retweets;favorites;text;mentions;hashtags
0;0;Apple 【iPhone 6 Plus（5.5インチ)/ iPhone 6(4.7インチ)/ iPhone5/ 5s/ 5c/ 4/ 4s】 長靴を履いた猫 お城 アーガイルチェック ベージュ 女子カ http:// hb.afl.rakuten.co.jp/hgc/g00r68g5.2 ncy396c.g00r68g5.2ncy4284/?pc=http%3A%2F%2Fitem.rakuten.co.jp%2Fauc-worldstore%2Fiphone5_85rie009%2F&m=http%3A%2F%2Fm.rakuten.co.jp%2Fauc-worldstore%2Fi%2F10018118%2F …;;
0;0;@biiacmartins apple gente fina;@biiacmartins;
1;1;Hahaha.. A Folha arrumou um estudo q fala q SP tem melhor mobilidade urbana q NY... É bem ruim o metrô da Big Apple ... Q cretinisse...;;
0;0;Bourbon Apple Cider. Because I can. #bourbon #thanksgiving http:// instagram.com/p/v4dvl_BDb7/;;#bourbon #thanksgiving
0;0;Apple はiOS 8が６割のiPhone, iPadで使用されていると発表＞ Apple says iOS 8 now on 60% of iPhones and iPads | 9to5Mac: http:// 9to5mac.com/2014/11/26/app le-says-ios-8-now-on-60-of-iphones-and-ipads/ …;;
0;0;Casey Joe Abair & Hunter Robertson - June Apple http:// elderly.com/recordings/ite ms/YODEL074.htm … #oldtimemusic #nowplaying;;#oldtimemusic #nowplaying
0;0;Será que a Apple participará do #BlackFriday ?;;#BlackFriday
0;2;#new #green #apple #leaf #Handmade http:// buff.ly/15rnvcq #etsy #Christmas #gifts #Blackfriday #deal see #shop banner #women #style;;#new #green #apple #leaf #Handmade #etsy #Christmas #gifts #Blackfriday #deal #shop #women #style
0;0;Two massive cunts on the apprentice, just wanna piss in their apple juice or summat. Fuckers;;
0;0;Disappointing to order @Wendys Apple pecan chix salad while on long holiday drive. No dressing. No pecans. Sigh. #togoorderfail;@Wendys;#togoorderfail
0;0;ソニー、電子ペーパー採用のスマートウォッチを開発中か--米報道 CNET Japan ソニーが準備を進める電子ペーパー採用スマートウォッチは、同社の現行のスマートウォッチや、「 Apple … http:// 2bit.tk/zbLB5;;
0;0;Chi sarà il prossimo motore di ricerca di Apple ?: Sono passati quasi 5 anni dal 2010 ed è quindi arrivata l’or... http:// news24h.allnews24h.com/P7QJ;;
0;0;via Tech Apple could be ditching Google as its default search engine, report says News broke last week that Yah... pic.twitter.com/ajffwrnbcO;;
0;0;今週売れ筋 第29位!!『 Apple Lightning Digital AVアダプタ MD826ZM/A』: http:// amzn.to/18NSAlK;;
0;0;Apple still hasn't close iOS 8.1 signing window. That's rare.;;
0;0;A feat world should be proud of ! Apple becomes first company worth $700bn http:// flip.it/YgxGr;;
0;0;Save Big on IPOD TOUCH 8GB - Buy Used at http://www. voom.in/TWCM-Apple-iPo d-Touch-8GB … ~ #apple #ipod #ipodtouch;;#apple #ipod #ipodtouch
0;0;*Sorting X-Mas presents* Mom: Right so, she has Apple Bottom and- Me: Who's Apple Bottom? Mom:..... APPLE JACK lmao, mom is soo hip;;
0;0;@0719_ apple おはよーございまーす！ フォローありがとです⊂( *･ω･ )⊃！;@0719_;
0;0;Mr Robert Makes The Best Apple Crisp pic.twitter.com/sgfshqz3hG;;
0;0;@marcus_jh Hi! I am interviewing Apple Pay users for an article. If you don't mind chatting with me, pls email or call me 415-344-1879. Thx!;@marcus_jh;
0;1;My boyfriend's making apple pies, his sister and dad are making eggs, his mom is getting everything and I'm sitting here eating an apple .;;
0;4;Apple bottom jeans is bumping upstairs;;
0;0;And now these are happening, as if Apple pastry, grocery shopping, and cleaning house isn't… http:// instagram.com/p/v4dtLruzTg/;;
0;2;Mom's homemade Apple pie sooo good;;
0;0;【 Apple 】 【レポート】iPhoneとOS X Yosemiteで何ができる?(第2回) - HandoffでMacとiPhoneの連続性を作り出す http:// dlvr.it/7f3gQx #Apple;;#Apple
0;0;Celebrities Show Off Their Beats In Apple 's New Ad (AAPL): Beats released a new ad on Wednesday, and it's cho... http:// read.bi/1rmK6Rg;;
0;0;Eating this blue candy apple;;
0;0;@cyberroo @doombunny I believe that is called “eating an apple ”;@cyberroo @doombunny;
0;0;@BrunoEleMesmo gratuito? na apple vc paga depois dos primeiros 30 dias;@BrunoEleMesmo;
0;0;Ion Eat Sweet Potato Pie That Mess Nasty Pass Me The Apple Pie;;
0;1;Niyla, yo sitsta, & apple @IAm_Tyran;@IAm_Tyran;
0;1;@MiraWroblewski @ABCNews24 ...and banks and mining and large business, apple google murdick, shall I go on.Stop blaming the poor. Stop rorts;@MiraWroblewski @ABCNews24;
0;0;Apple is gettng closer the $1 trillion - Apple is gettng closer the $1 trillion http:// tmblr.co/Z_b9in1WZi4e1;;
1;0;1 down 6 more to go! Yummy Apple Crumb pie! #Thanksgiving http:// instagram.com/p/v4dqoPjal-/;;#Thanksgiving
0;0;@chivi_ apple 用事ができたのかな？ ファイト（≧∇≦）;@chivi_;
0;0;Nadia just brought us an entire apple pie;;
0;0;http:// chatswing.com Live Free Apple iphone ipad chats App Website chats Room #chats #chatsrooms #app #developers #build;;#chats #chatsrooms #app #developers #build
0;0;Photo: Apple POW with candied #bacon top. The best in pre-Thanksgiving #foodporn thanks to amazing Chef... http:// tmblr.co/ZAvUix1WZi3RI;;#bacon #foodporn
0;0;Apple iPhone 6 Plus - 16GB Gold - Neuw., ohne Vertrag, Ohne Simlock, Frei: EUR 685,00Angebotsende: Sonntag De... http:// ebay.to/1ydapZN;;
0;0;Apple iPhone 6 - 64 GB - Spacegrau - OVP: EUR 800,00Angebotsende: Dienstag Dez-2-2014 0:41:04 CETSofort-Kauf... http:// ebay.to/1yiFQCE;;
0;0;Apple vive atualizando o iOS, mas ele nunca muda;;
0;0;@arielyayi andá a chamuyarte nenas en apple .;@arielyayi;
0;0;New post: Could Apple Cut Google as Default Search on Safari? http://www. phonealot.com/news/could-app le-cut-google-as-default-search-on-safari/ …;;
0;0;http:// vicvapor.com/files/2014/11/ lexus-lf-c2-apple-prototype-hd-wallpapers.jpg … Lexus LF-C2 Apple Prototype HD Wallpapers - ...;;
0;0;Apple is gettng closer the $1 trillion Apple is gettng closer the $1 trillion http:// tsbrenterprises.com/apple-is-gettn g-closer-the-1-trillion/ …;;
0;2;Crown Royal Apple and Budlights sound good... Mite have a #SLIGHTkickback ...;;#SLIGHTkickback
0;0;Do you want an Apple iPad with that airport delay? - Fortune http:// bit.ly/1xI9PAk;;
0;0;Google dejaría de ser el buscador predeterminado de Apple en 2015: Google podría perder el tít... http:// tinyurl.com/ookb7tj #WParteDeTuVida;;#WParteDeTuVida
0;0;#chile#gay#viña#viñadelmar#santiago#ipad#apple #happy#new#sing#art#guy#beach#time#life#iphone5#picofthed… http:// instagram.com/p/v4dpEbxO2n/;;#chile #gay #vi #vi #santiago #ipad #apple #happy #new #sing #art #guy #beach #time #life #iphone5 #picofthed
0;0;Is This Apple Computer Worth $1 Million? - Forbes http://www. applesecrets.com/2014/11/26/is- this-apple-computer-worth-1-million-forbes-16/ …;;
0;0;@Apple #OSX #Mavericks #FuckUp geeze ...;@Apple;#OSX #Mavericks #FuckUp
0;1;Sitting outside an Apple store for a husband in need. #LivingTheAmericanDream #Helpmate;;#LivingTheAmericanDream #Helpmate
1;0;The One Really Important Apple Watch Thing http:// bit.ly/1FrWthG #news #apple #Important #Really;;#news #apple #Important #Really
0;0;AmazonBasics Apple Certified Lightning to USB Cable – 6 Feet (1.8 Meters) – White - http://www. topcellulardeals.com/accessories/?p roduct=amazonbasics-apple-certified-lightning-to-usb-cable-6-feet-1-8-meters-white … pic.twitter.com/spk25HxoLg;;
0;0;New discovery of the day: my cat LOVES Apple sauce. Alrighty then.;;
0;0;RT @PaigeGardashian : I'm making a homemade apple pie <--;@PaigeGardashian;
0;0;Homemade apple pie and raspberry tarts. I think I did pretty good :) #Thanksgiving http:// instagram.com/p/v4dofik57a/;;#Thanksgiving
0;4;@The__Phillip you're built like a big apple;@The__Phillip;
0;0;Apple прекратит производство iPhone 5C в 2015 году - Газета.Ru;;
0;0;my apple juice is frozen solid this is not right;;
3;1;Celebrities show off their Beats in Apple 's new ad http:// read.bi/1CiEgoN;;
7;3;Celebrities show off their Beats in Apple 's new ad http:// read.bi/1CiEgoN;;
0;0;apple iphone 4 в украине видео инструкция http:// trmtuf.fo.ru/blog/187568_%D 0%9E%D0%B1%D1%89%D0%B8%D0%B5/430382_%D0%9C%D0%B8%D0%BB%D1%8B%D0%B5+%D0%BE%D0%B1%D0%BC%D0%B0%D0%BD%D1%89%D0%B8%D1%86%D1%8B+%D0%B7%D0%B0%D0%BA%D0%BB%D1%8E%D1%87%D0%B8%D1%82%D0%B5%D0%BB%D1%8C%D0%BD%D0%B0%D1%8F+%D1%81%D0%B5%D1%80%D0%B8%D1%8F …;;
0;0;Celebrities show off their Beats in Apple 's new ad http:// read.bi/1CiEgoN;;
0;0;i can sucessfully make apple tart would you like to try some one day @zaynmalik;@zaynmalik;
0;0;RT @mark_brownblog : “ Apple 株について、知っておきたい7つのこと” http:// htn.to/xjWW7r;@mark_brownblog;
0;0;Hot apple cider;;
0;0;@karmensarodjo @_Raz3R_ cause 1.0 has apple patched;@karmensarodjo @_Raz3R_;
0;0;Wow! I just won this for free, Newest Apple iPad 3rd Generation Jailbreaking Guide! (Instructi http://www. listia.com/r1gf4pc/7089676 #listia;;#listia
0;1;Christmas shopping? IPAD AIR 2 at Target for only $499 FREE SHIPPING!! Cant beat it #Apple #iPad;;#Apple #iPad
0;0;Apple прекратит производство iPhone 5C в 2015 году - Газета.Ru;;
0;1;Cranberry relish is done. Bread dough is rising. Apple pie in the oven. @TowerZombie and I have this handled so far.;@TowerZombie;
0;0;" @StevStiffler : I won't be happy unless Apple replaces Siri's voice with Morgan Freeman's." I'd probs buy an iPhone if this was the case.;@StevStiffler;
4;3;Juz mi sie ładowarka jebie to jakis zart jebac apple;;
0;0;Q saco ! Odeio Iphone e suas frescuras! Vtnc Apple de merda;;
0;0;#chile#gay#viña#viñadelmar#santiago#ipad#apple #happy#new#sing#art#guy#beach#time#life#iphone5#picofthed… http:// instagram.com/p/v4dneURO2Z/;;#chile #gay #vi #vi #santiago #ipad #apple #happy #new #sing #art #guy #beach #time #life #iphone5 #picofthed
0;0;SimonDotWeb Offerte Apple : iPad Air 2 LTE e iPhone 5S a sconto | Anche iPhone 6… http:// apple.hdblog.it/2014/11/26/Off erte-Apple-iPAd-Air-2-LTE-e-iPhone-5S-a-sconto … , see more http:// tweetedtimes.com/SimonDotWeb/ne wsandroid-it?s=tnp …;;
0;0;"Just ate apple seeds in hopes of turning into an apple " ok lexmata. Who says that;;
0;0;Ive been to the Apple Store way to many times. Might as well be working here.;;
0;0;Можно использовать 2 сим карты apple iphone 4 http:// missturnma.alaskanmalamutes.ru/news/ocherki/m ozhno_ispolzovat_2_sim_karty_apple_iphone_4.html …;;
0;1;Now that we are nearing Thanksgiving, I can declare that apple is only a midtier pie... there are plenty better options.;;
0;0;Red Still Life With Pear And Apple JENDRIA Original by Jendria http:// etsy.me/1zwn1ul via @Etsy;@Etsy;
0;0;Got windows 8.1 for my MacBook Pro retina! #apple #tech #microsoft #macbook #operatingsystem http:// instagram.com/p/v4dmjetMpV/;;#apple #tech #microsoft #macbook #operatingsystem
0;0;Apple , Google encryption 'not helping' criminal investigation: AFP http:// goo.gl/HQINvI;;
0;0;Where's My Cinnamon Apple;;
0;8;I'm fulla apple pie, coffee & hope!;;
0;0;Apple が最新アップデート「OS X Yosemite 10.10.1」を公開(「 Apple 」最新記事一覧‐ITmedia キーワード) / http:// bit.ly/1Hd12ym;;
0;0;@amanilabbas why do you have an apple phone thou. I used to respect you now it's just.. Yeah;@amanilabbas;
0;1;Apple pode interromper produção do iPhone 5C em poucos meses, diz jornal. Leia + http://www. techtudo.com.br/noticias/notic ia/2014/11/apple-pode-interromper-producao-do-iphone-5c-em-poucos-meses-diz-jornal.html … #AppleFail;;#AppleFail
0;1;being on hold with Apple is what I live for;;
0;1;Making apple pie;;
0;0;DAFTAR ONLINE UNTUK JADI PENGEDAR D' APPLE - TAWARAN TERHAD!... http:// fb.me/345hA2ux5;;
0;0;Shoot bout to grab some crown apple too;;
0;0;@Marq_Burnett ask him what his favorite Thanksgiving dish is and if he prefers pumpkin or apple pie;@Marq_Burnett;
0;0;@8pine_ apple まだありますか？;@8pine_;
0;0;one of my weaknesses. buttered toast w. apple jelly pic.twitter.com/PuAX08Qwl2;;
1;1;As far as technological capability, Microsoft shit so hard on Apple .;;
0;0;хочу iPhone 6 от @Wylsacom и @AppleJesus . #КонкурсНадежды http:// youtu.be/wuJKbadKWLY . Потому что у меня нету техники Apple , хочу iPhone 6;@Wylsacom @AppleJesus;#
0;0;One apple is? RT @JAYINK45885 : @Moca_tonedFit ....under 60 calories? that's a slice of bread;@JAYINK45885 @Moca_tonedFit;
0;0;@mar_wollersheim @HPersace the apple ? Haha;@mar_wollersheim @HPersace;
0;0;Apple elimina la palabra “gratis” de su App Store por las aplicaciones “freemium”: Estos últimos días habrás n... http:// bit.ly/1rmJTxt;;
0;0;Apple elimina la palabra “gratis” de su App Store por las aplicaciones “freemium”: Estos últimos días habrás n... http:// bit.ly/1rmJU4E;;
0;0;My family and friends are starting to arrive sweet somebody brought apple pie nice pic.twitter.com/AISAflnEEI;;
0;0;Apple elimina la palabra “gratis” de su App Store por las aplicaciones “freemium”: Estos últimos días habrás n... http:// bit.ly/1rmJTOe;;
1;1;Apple elimina la palabra “gratis” de su App Store por las aplicaciones “freemium”: Estos últimos días habrás n... http:// bit.ly/1rmJT0H;;
0;0;Apple pie in the oven perfect thing to bake on this snowy night and of course for Thanksgiving;;
0;0;Apple elimina la palabra “gratis” de su App Store por las aplicaciones “freemium” http:// bit.ly/1rmJTOe;;
0;0;Apple elimina la palabra “gratis” de su App Store por las aplicaciones “freemium”: Estos últimos días habrás n... http:// bit.ly/1rmJT0H;;
0;0;Apple elimina la palabra “gratis” de su App Store por las aplicaciones “freemium” http:// bit.ly/1rmJTOe;;
0;0;Apple parará la producción del iPhone 5c a mediados del 2015, ¿el experimento fallido de Apple ? http:// a.mynews.ly/!DYD.B7rnI via @Appy_Geek;@Appy_Geek;
0;0;Apple elimina la palabra “gratis” de su App Store por las aplicaciones “freemium” http:// j.mp/1yZygeX;;
0;0;Apple to discontinue iPhone 5C production in 2015: iPhone 5C, the product of that experiment, has not been spo... http:// bit.ly/1yZyeni;;
0;0;Apple elimina la palabra “gratis” de su App Store por las aplicaciones “freemium”: Estos últ... http:// bit.ly/1rmJSKb - via TheInquirer;;
0;0;Apple elimina la palabra “gratis” de su App Store por las aplicaciones “freemium”: Estos últimos días habrás n... http:// bit.ly/1rmJSK9;;
0;0;I just spilt apple juice all over myself. Very tragic.;;
0;0;"Ya man, today's the first day to gettin buff" he says while eating apple pie n ice cream. "Today for sure.";;
0;3;The apple employee I was screensharing with was probably judging the hell out of my brayden schenn desktop background;;
0;1;Video reveals your #iPhone has hidden powers even #Apple might not know about http:// zite.to/1rlbbEC;;#iPhone #Apple
0;0;Je rêve pas c'est bien Omar et Fred qui font les Pub d' Apple ???;;
0;0;#сейчас Акции Apple установили новый рекорд стоимости на бирже Nasdaq во вторник, 25 ноября, дойдя в ходе… http:// dlvr.it/7f3jhQ #правдиво;;# #
0;0;@Mazzi_Maz you're still my cinnamon apple;@Mazzi_Maz;
0;0;#chile#gay#viña#viñadelmar#santiago#ipad#apple #happy#new#sing#art#guy#beach#time#life#iphone5#picofthed… http:// instagram.com/p/v4djHdRO2G/;;#chile #gay #vi #vi #santiago #ipad #apple #happy #new #sing #art #guy #beach #time #life #iphone5 #picofthed
0;0;Фанаты осудили Apple за поднятие цен на iPhone http:// j.mp/1xI9FZG;;
0;0;Фанаты осудили Apple за поднятие цен на iPhone http:// j.mp/1xI9CNs;;
0;0;Фанаты осудили Apple за поднятие цен на iPhone http:// j.mp/1xI9CwZ;;
0;3;Hey #Apple . REALLY tired of seeing this in my Activity Monitor! #YosemiteProblems pic.twitter.com/yr4pgqghFL;;#Apple #YosemiteProblems
0;0;Apple Taps Foxconn As Sapphire Display Supplier for Next iPhone http:// dlvr.it/7f3gfB #appleiphone;;#appleiphone
0;0;Apple Said to Kill iPhone 5c Production in 2015 http:// dlvr.it/7f3hKm #appleiphone;;#appleiphone
0;0;Apple hits high of $700bn valuation after iPhone 6 success http:// dlvr.it/7f3h59 #appleiphone;;#appleiphone
1;0;Original Apple co-founder Ronald Wayne auctioning off early Apple documents http:// bit.ly/1xI9FsD;;
0;0;@hoezayismyname There is no ETA on if or when Serve will be eligible for Apple Pay. Serve is however eligible for Softcard.;@hoezayismyname;
0;0;Quand Apple rickroll http://www. journaldulapin.com/2014/11/26/nev er-gonna/ …;;
0;0;Original Apple co-founder Ronald Wayne auctioning off early Apple documents http:// dlvr.it/7f3gKq #TUAW $ AAPL pic.twitter.com/g6DwHWc5uf;;#TUAW
0;0;#Apple met à jour ses informations sur l' #iWatch http://www. igen.fr/node/88722;;#Apple #iWatch
0;0;#всем Акции Apple установили новый рекорд на бирже Nasdaq: Акции Apple установили новый рекорд… http:// dlvr.it/7f3hRp #новостиДня;;# #
0;0;Mình đang làm luận văn nghiên cứu về Customer satisfaction based on Apple function and design. Mọi người ai đang... http:// fb.me/2kkI5JGoY;;
0;0;Apple Taps Foxconn As Sapphire Display Supplier for Next iPhone http:// dlvr.it/7f3dtD #appleiphone;;#appleiphone
0;0;Apple Said to Kill iPhone 5c Production in 2015 http:// dlvr.it/7f3ggq #appleiphone;;#appleiphone
0;0;Apple hits high of $700bn valuation after iPhone 6 success http:// dlvr.it/7f3gzB #appleiphone;;#appleiphone
0;0;#читай Акции Apple установили новый рекорд на бирже Nasdaq http:// dlvr.it/7f3bc6 #новости;;# #
0;0;decembre jrentre dans la team #Apple . jvais bombardeeeeeer lss photo vous vereeer;;#Apple
1;0;Worked on this beautiful Rosette Apple Pie inspired by the preserve_us website all day long with my… http:// instagram.com/p/v4dhgPF2le/;;
0;0;L o l @me eating an apple at the gym;@me;
0;0;perfect cinnamon apple pic.twitter.com/SPvoIaG5LY;;
0;0;Apple pie is my weakness, for real though.;;
0;0;New Apple -targeting malware is unlike anything experts have seen - CBS News http://www. applesecrets.com/2014/11/26/new -apple-targeting-malware-is-unlike-anything-experts-have-seen-cbs-news-14/ …;;
0;0;Makin apple crisp like a boss. @LinhjaTurtle;@LinhjaTurtle;
0;0;Apple parará la producción del iPhone 5c a mediados del 2015, ¿el experimento fallido de Apple ? http:// fb.me/1DyRC5pUv;;
0;0;Apple iPad Air ケース iPad Airカバー/iPad ケース iPad カバー/アイパッドエアー ケース アイパッドエアー カバー/スマートケーススマートカバータイプ/風呂蓋/電源機 http:// hb.afl.rakuten.co.jp/hgc/g00qbts5.2 ncy3c14.g00qbts5.2ncy40e9/?pc=http%3A%2F%2Fitem.rakuten.co.jp%2Fmamorukunwebsite%2F5011175519018%2F&m=http%3A%2F%2Fm.rakuten.co.jp%2Fmamorukunwebsite%2Fi%2F12367297%2F …;;
1;0;Original Apple co-founder Ronald Wayne auctioning off early Apple documents http:// ift.tt/1vPbJDx pic.twitter.com/rYZqepax9Q;;
0;0;@MacLife If Apple replaces Google as default search engine it would be a mistake! #Apple;@MacLife;#Apple
0;1;Je suis plutôt bien #TeamiPhone #teamiphone6plus #Apple;;#TeamiPhone #teamiphone6plus #Apple
0;0;@dheble @idontcarenope it's apple pie!;@dheble @idontcarenope;
0;0;[Special Stage] 141125 T-ARA (티아라) - 작은사과 (Little Apple ) + Interview @T...: http:// youtu.be/85kWatJJyE8 via @YouTube;@T @YouTube;
0;0;"Elio 84 MPG Trike Will Talk To Your Apple Watch" => http:// bob.vg/enewsletter276d #applewatch #wearables @ElioMotors #cars #ios81;@ElioMotors;#applewatch #wearables #cars #ios81
0;1;I just took an online IQ test and it's telling me I can work at Apple;;
0;0;Near All-Time Highs, Should Investors Chase Apple Stock? $ AAPL http:// seekingalpha.com/article/271144 5?source=iphoneportfolioapp_twitter …;;
0;0;making apple pie yay;;
0;1;Take a break from the grocery store madness and #treatyoself to some #donuts tonight: Caramel Apple , Boston Cream, Hot Cocoa Sugar & more!;;#treatyoself #donuts
2;7;Fuck being my cinnamon apple ..You trynna be my Chipotle Burrito;;
0;1;@kristen_p26 @Apple _Kor;@kristen_p26 @Apple;
0;0;My apple is rattling when I shake it. That's a bad sign, right?;;
0;0;Dinner..... I am most excited about the pumpkin hard apple cider! #helloalcoholsincepregnancy http:// instagram.com/p/v4deX_Gvug/;;#helloalcoholsincepregnancy
0;0;#MY FIRST APPLE PIE #THANKSGIVING 2014 http:// instagram.com/p/v4dd-7NmEd/;;#MY #THANKSGIVING
0;0;e eu achava que era do meu e a apple diz que é normal porque é problema dele que nao conseguem resolver ,vao se foder -.-;;
0;0;@RachelLesslie raspberry and apple one;@RachelLesslie;
0;1;@midnightjaz @mp24601 @woodythewood Only Woody, Apple & I, know how true that is;@midnightjaz @mp24601 @woodythewood;
0;0;Why does my phone lose battery when it's on charge? Apple u fucked up;;
0;0;My apple trees are frozen pic.twitter.com/X0BNA5dO1g;;
0;0;Apple 、4K表示サポートディスプレイとして、LGの31インチDigital Cinema 4K対応モニター「LG 31MU97」を追加 #excitenews http://www. excite.co.jp/News/apple_blo g/20141127/Macotakara_25357.html?utm_campaign=fromapp&utm_medium=twitter&utm_source=news_i …;;#excitenews
0;0;@Yourgirlmaree she already tried with my cinnamon apple but aye I gotchu girl;@Yourgirlmaree;
0;4;"We're trying to lose weight" says Rocco after two pieces of apple pie ice cream and two huge sausage and pepper sandwiches HAHHH;;
0;0;Apple wood smoked brown sugar and agave glazed pumpkin pie pic.twitter.com/XvbeexxoJl;;
0;0;I Can't wait to eat some banana pudding & apple pie tomorrow.;;
0;0;Meanwhile Apple finna send me a brand new iPhone 6;;
0;0;Apple lanza iOS 8.2 Beta con WatchKit incluido http:// turankeo.com/apple-lanza-io s-8-2-beta-con-watchkit-incluido/ … #TuRankeo;;#TuRankeo
0;0;@horohoro_ apple 過ごさないですよ！ みんなが思ってる以上に僕ら一緒にいないですよ！笑;@horohoro_;
0;0;Yo I swear I hate these new updates especially the Apple Store new update;;
0;0;@daveharte yeah they’re weirdly strict about Apple stuff they basically just create identical listings for each type;@daveharte;
0;0;@JimbowlerSlice The apple or peppermint?;@JimbowlerSlice;
1;2;“ @DreaRaeanna : bc i miss my cinnamon apple https://twitter.com/DreaRaeanna/status/537755772046684160/photo/1 pic.twitter.com/SeRCTHCF6m ”;@DreaRaeanna;
1;0;“@ThatIraqi: Just found my Cinnamon Apple @rebeccakxng” i dont like apples i like pears;@ThatIraqi @rebeccakxng;
0;0;Apple ’s New iPhones Found Capable Of 4K Video Playback http:// weeder.org/rLH3aUo #entertainment #gaming #tech #gadgets;;#entertainment #gaming #tech #gadgets
0;0;APPLE iPhone 4S 4 Tropical Teal Frog Peeking Pets Skin Cov http://www. amazon.com/gp/product/B00 G0CUEM6 … Reply w/ #AmazonBasket to add to Amazon Basket;;#AmazonBasket
0;0;Apple Watch site refreshed to highlight Timekeeping, New Ways to Connect, and Health & Fitness: Apple has quie... http:// bit.ly/121xv9L;;
0;0;В России Apple поднимает цены на свою продукцию;;
0;0;Making some apple pie;;
0;0;Apple iPhone 6S concept immagini: una prima idea http:// bit.ly/1vPpsdv #offerta #sottocosto;;#offerta #sottocosto
0;0;First pie is out of the oven. #apple #cinnamon with #creamcheese #crust @Bed and Bruncheon http:// instagram.com/p/v4da9YwwfM/;@Bed;#apple #cinnamon #creamcheese #crust
0;0;[Breeze] Apple iPhone6 4.7インチ ケース カバ アイフォン6 iphone6... 2,980 円 【SmartTengoku(="url" 】 http://www. amazon.co.jp/Breeze-iPhone6 -iphone6-%E2%98%85%E6%B6%B2%E6%99%B6%E4%BF%9D%E8%AD%B7%E3%83%95%E3%82%A3%E3%83%AB%E3%83%A0-%E3%82%B9%E3%83%9E%E3%83%9B%E3%82%AB%E3%83%90%E3%83%BC%E2%98%86%E3%82%AF%E3%83%AA%E3%82%A2/dp/B00N8JX8UO/ref=pd_zg_rss_mw_e_128199011_10?ie=UTF8&tag=tac0506-22 … #ZVzhN;;#ZVzhN
0;1;“ @Bill_Nye_Tho__ : THE FILLING IN APPLE PIE BOILS AT 165 DEGREES PLAYA TELL YA MOMS TELL YA GRANDMAS” @mshindig;@Bill_Nye_Tho__ @mshindig;
0;3;Just made @NYCINZIA no-fail toffee, 2 pumpkin pies, apple pie & 2 pumpkin breads still baking. #Thanksgiving pic.twitter.com/W5hTpYQdfb;@NYCINZIA;#Thanksgiving
0;1;Mini apple pies for #friendsgiving2014 http:// instagram.com/p/v4daJZJegA/;;#friendsgiving2014
4;6;Spice cake w/pumpkin pie inside, choc cake w/ pecan pie inside, and spice cake w/ apple pie inside. All in one cake. pic.twitter.com/IViOdgB5Ow;;
0;0;DAFTAR ONLINE UNTUK JADI PENGEDAR D' APPLE - TAWARAN TERHAD!... http:// fb.me/2pNZH06WQ;;
0;0;@SiziweCharles oh if I just go to the apple store?;@SiziweCharles;
0;0;Modern art #apple #teabag #nightshift http:// instagram.com/p/v4dZ3EtYRL/;;#apple #teabag #nightshift
0;2;Nokia have fucked Apple right off with that advert;;
0;1;Breakfast.. #egg #apple #wheatmealbiscuit #digestive http:// instagram.com/p/v4dZkowyLb/;;#egg #apple #wheatmealbiscuit #digestive
0;0;Roast Turkey Breast with Apple Cider Gravy http:// shar.es/1XyQeD;;
0;1;I need to go to the Apple store;;
0;0;bacon + gruyere + apple + whole grain bread stuffed pumpkin http:// ift.tt/1yiFufq;;
0;0;Pie making day...pumpkin and apple done, pecan in the oven now http:// instagram.com/p/v4dYdGCZAM/;;
0;0;@daaiotero y yo hoy como pescado cn pure, Q CARAJO TIENE Q VER CON LO Q ESTAMOS HABLANDO ,essse famoso apple , que lindo.. el golpe de agus;@daaiotero;
0;0;Piss Off Putin…Eat an Apple http://www. exploretraveler.net/?p=3839 See more at http:// exploretraveler.com;;
0;0;Already got a iPod, iPad & a apple lab top. So why do I need a iPhone ?? Just going to get a android or galaxy!!;;
0;1;@Alicia_Farr record is record is 50 plus and 5 apple empanadas;@Alicia_Farr;
0;0;@KarsynMontes she be moving on to my cinnamon apple . Someone's gonna get hurt;@KarsynMontes;
0;1;Welcome to the glory of American Thanksgiving! RT @charlescwcooke : The smell of apple pie wafting from my kitchen is tantalizing.;@charlescwcooke;
