retweets;favorites;text;mentions;hashtags
0;0;We called in our order in advance 17 Big Macs, 4 orders of frys, 2 chikn nugget happy meals, a oreo mcflurry, 3 apple pies n a diet coke;;
0;0;#10ThingsThatAnnoyMe 4. apple sauce;;#10ThingsThatAnnoyMe
0;0;La mejor combinacion seria apple y @BBVAProvincial innovacion en servicios y tecnologia. Vamos #BBVAadelante ADELANTE;@BBVAProvincial;#BBVAadelante
0;0;@SaulBosS es el localizador ! Q todos tus amigoa q tengan apple los agregas y los puedes ubicar!;@SaulBosS;
0;0;Todo el mundo sabe que si no es Apple es una estupidez!!;;
0;0;★iPhone関連グッズ紹介★ 『iPhone4 SIMロック解除 アダプターセット Apple アップル iPhone4SIMロック解除 アダプターセッ.』を見る [楽天] http:// a.r10.to/hp3R3C;;
0;0;Should not of drank 2 pints of apple juice today. #bleh;;#bleh
0;0;#apple do something about ur shitty group imessages y cant i leave 1 ???;;#apple
0;0;Lmao these people have sticky notes on their MacBooks to hide the Apple logo.;;
0;0;@iammatthewparry last Thursday in the apple store... "oh great it's the guy who I saw last time" "Not been looking after your stuff again?";@iammatthewparry;
0;0;#10ThingsThatAnnoyMe 10. Girls who talk w a fake ass high pitched voice. You ain't cute! We all know you sound like you have a Adams Apple !;;#10ThingsThatAnnoyMe
0;0;MacNN: Judge penalizes Samsung for withholding code in Apple case . More #Apple #iPhone #news - http:// tinyurl.com/mm3pqq;;#Apple #iPhone #news
0;0;US judge sanctions Samsung, kills important defense against Apple http:// adf.ly/8C6B0;;
0;0;Apple Of My Eye~;;
0;0;Apple vs. Samsung: La batalla que apenas se inicia http:// bit.ly/JUcY8t #Noticias;;#Noticias
0;0;!! KHOMO: Extra Long USB Sync Cable Cord Charger for Apple iPhone, iPad 2, iPod Touc … http://carus bchargeradapter.solarpanelsheater.com/?p=36;;
0;0;Jill Design Skin Decal Sticker for Apple MacBook 13"" Aluminum (NO SEPARATE TRACKPAD released in 2008): This ski... http:// amzn.to/HEzXWH;;
0;0;Jill Design Protector Skin Decal Sticker for Apple MacBook Pro 15 inch (SEPARATE TRACKPAD button, released in Ja... http:// amzn.to/HEA04y;;
0;0;Hey Apple , of you send me a new iPhone and a camera, I'll make a commercial for you for free;;
0;0;@robcfunnell It's completely a software issue, so yes. We're ready whenever Apple is!;@robcfunnell;
0;0;apple shut my shit off THIS IS A BITCH!;;
0;0;@B_dankk nothing about to make these apple strudel cake things wop;@B_dankk;
0;0;Atencion: Apple IPAD 3 por 49$ -> http:// linkeur.es/.1368D miralo;;
0;0;Apple is so weak. They are constantly doing lowblows at Samsung. Makes me hate them even more. http://www. theverge.com/apple/2012/5/5 /3001434/us-judge-sanctions-samsung-precludes-workaround-defense-against-apple?utm_source=dlvr.it&utm_medium=twitter …;;
0;0;Harry's favorite food is sweetcorn and his fave drink is apple juice.;;
0;0;iMore Picks of the Week for May 5, 2012 http:// bit.ly/KskLzp #iPad #Apple #Mac;;#iPad #Apple #Mac
0;0;Vangoddy Newest iTouch Hard Case with Matching Black Color Finish & Metal Kickstand for Apple iPod touch... http:// bit.ly/LipJOg See Now;;
0;0;Apple pie RT @JODYGFACTS :U WORK a@McDonalds the fuck U think u gone smell like!? RT @Paeeeum: Finally off work & I smell like burgers&fries;@JODYGFACTS @McDonalds @Paeeeum;
0;0;see now Vangoddy Newest iTouch Hard Case with Matching Black Color Finish & Metal Kickstand for Apple iPod touch... http:// chilp.it/2157df;;
0;0;Truly remarkable to hear Steve Wozniak tell his 'life story' in technology and business. #apple #steve;;#apple #steve
0;0;@ardenreed Haha...I did neither. I went with option C...an entire bottle of Simply Apple . Now I have a stomach ache. I can't win today.;@ardenreed;
0;0;ahhhahh i totally forgot I'm supposed to go pick up the Apple donations today!!!!;;
0;0;see now Vangoddy Newest iTouch Hard Case with Matching Black Color Finish & Metal Kickstand for Apple iPod touch... http:// chilp.it/2157df;;
0;0;New post: #7: Flash Superstore New Ipad 3 &amp; Apple Ipad 2 Multifunctional / Multi Angle Wallet / Cover / Stand / http:// bit.ly/JLrBgU;;#7
0;0;dont miss that Vangoddy Newest iTouch Hard Case with Matching Black Color Finish & Metal Kickstand for Apple iPo... http:// tinyurl.com/7j6k26a;;
0;0;dont miss that Vangoddy Newest iTouch Hard Case with Matching Black Color Finish & Metal Kickstand for Apple iPo... http:// tinyurl.com/7c8nznb;;
0;0;amazing.. Vangoddy Newest iTouch Hard Case with Matching Black Color Finish & Metal Kickstand for Apple iPod tou... http:// tinyurl.com/7v46xxm;;
0;0;Turkey Fiji Apple Salad!! Dinner!! Amazed @how many nerds hang here on a Saturday night! (@Panera Bread) http:// 4sq.com/IMoc2t;@how @Panera;
0;0;you should see Vangoddy Newest iTouch Hard Case with Matching Black Color Finish & Metal Kickstand for Apple iPo... http:// bit.ly/LipJOg;;
0;0;you should see Vangoddy Newest iTouch Hard Case with Matching Black Color Finish & Metal Kickstand for Apple iPo... http:// bit.ly/KwOZxu;;
0;0;Amazing Vangoddy Newest iTouch Hard Case with Matching Black Color Finish & Metal Kickstand for Apple iPod ... http:// bit.ly/LipJOg post;;
0;0;Must see Vangoddy Newest iTouch Hard Case with Matching Black Color Finish & Metal Kickstand for Apple iPod touc... http:// bit.ly/KwOZxu;;
0;0;Pay? RT @BatonRouge_Buzz : #Jobs Apple Customer Service Rep, At Home at Apple (Baton Rouge, LA) http:// dlvr.it/1WyP9f #BatonRouge #LA;@BatonRouge_Buzz;#Jobs #BatonRouge #LA
0;0;“ @Green_ Apple _15 That sh_t craaa'”;@Green_;
0;1;@sanjay If Steve Jobs hadn't personally peed on your Apple //c, you could be using @tweetbot like all the cool kids;@sanjay @tweetbot;
0;0;I got an apple bottom I can make that thang clap hahaha;;
0;0;Why does apple always have to go and ruin something when it worked fine already #pingthis #letmedownload;;#pingthis #letmedownload
0;0;Apple y Google dominan el mercado de smartphones de Estados Unidos http:// bit.ly/HKkX6N http:// movilesxd.com;;
0;0;Bon maintenant Je tweet avec apple;;
0;0;Quem quer me vender um cabo da apple ?;;
0;0;Mama: *in my face* A banana a day will keep the doctor away! :D ... I thought it was apple kmsl (:;;
0;0;Green Apple Texas Margaritas!!!;;
0;0;Time for Apple to figure out a way to send an aroma via text. The jujube tea I'm brewing smells AMAZING!!!;;
0;0;@LikaLovesMUSIC_ lol its apple pies;@LikaLovesMUSIC_;
0;0;Hi, my name is Veronica, and I think droid is better than apple #hackedbyBob;;#hackedbyBob
0;0;How do you spend your Saturday!? Restoring your #OSX of course! #apple #lion #windows #ubuntu #macbookpro #http:// instagr.am/p/KQ517dHhpr/;;#OSX #apple #lion #windows #ubuntu #macbookpro #http
0;0;@Gfox_1 @jhowes17 @sugersuger2 use phone apps on my iMac instead of the better Apple software?;@Gfox_1 @jhowes17 @sugersuger2;
0;0;http:// cnet.co/KBLFzj Apple updates iLife apps with minor fixes, tweaks;;
0;0;Check out this great item: Dots(Red/white) Phone Snap-on Hard Case For APPLE iPhone 4/4G/4S http:// froo.co/5IEPnPm00s;;
0;0;@track8app streaming to apple tv. Love touching my music again. Great work.;@track8app;
0;0;So much for Apple Blossom this year. I'm at the Five Guys on Pleasant Valley if anyone wants to join.;;
0;0;@LDShadowLady Drinking apple juice? :D;@LDShadowLady;
0;0;Apple peach sangria http:// instagr.am/p/KQ51MMpIid/;;
1;0;Apple アップル SIMフリー iPhone 4S 白 をみまもりケータイで使いたい！ http:// amzn.to/KiSkjz;;
0;0;omw to apple bs now w/ lady & bestfriend;;
1;0;Apple Blossom was Slizzzzzyyy Slighttt.!;;
0;0;just have to thank @Vingoodwin @markjohnturner for the best apple pie ever and a lovely dinner with great friends big love night night xx;@Vingoodwin @markjohnturner;
1;0;at the apple store #sandra;;#sandra
0;0;3.5MM AUX AUDIO CABLE FOR APPLE IPOD TOUCH 8GB 1ST GEN: SKQUE 3.5MM AUX AUDIO CABLE FOR APPLE IPOD TOUCH 8GB 1ST GEN http:// amzn.to/tY0ZEc;;
0;0;Judge penalizes Samsung for withholding code in Apple case http:// dlvr.it/1WyPKj;;
1;0;My twitter be fucking up. Apple better have an update for this shit.;;
1;0;University partners with Apple , Sims Recycling for 5th annual e-Waste event http:// ow.ly/aIXjO;;
0;0;Donc genre $ AAPL devrait afficher le cours de l'action d' Apple .;;
0;0;" apple never gives anithing 4 free" amo questo commento !! #TrovatoinRete;;#TrovatoinRete
0;0;A este computador la batería le dura como 7 horas, pero no es suficiente apple !!!!;;
1;0;Best Way To Slice An Apple #SwirlyStyle http:// instagr.am/p/KQ5GMVNr1p/;;#SwirlyStyle
0;0;@apple _kingdom くさっ！;@apple;
3;0;@TrillAssLifeVC @AbnormalLeJune @SzooFarGone #TurnUp !! I never seen the big apple unless you count jagger head.. lol;@TrillAssLifeVC @AbnormalLeJune @SzooFarGone;#TurnUp
0;0;Bought thee cutest dress :'D soo exited , but passed the apple store n it made me miss my ipod haaa .. :/;;
0;0;Aujourd'hui j'ai pas applé @Fatima_DLGG. Qué-cho !;@Fatima_DLGG;
1;0;@pulpmx what ? An apple product could never f' up,right ? #koolaid;@pulpmx;#koolaid
3;0;Cheesecake, bake apple , pineapple & toasted coconut @#AnchorInnHotel @toddperrin @kathistacey #aTimeInTwillingate pic.twitter.com/UYboDdNc;@ @toddperrin @kathistacey;#AnchorInnHotel #aTimeInTwillingate
0;0;Here is a tip from #beautykitchen to fight cellulite. Mix 2 tablespoons of apple cider vinigar into an 8 oz glass... http:// fb.me/1D66LroK7;;#beautykitchen
0;0;Apple Tree - Infographic http:// twitpic.com/9ht3pc;;
0;0;Só sei que tem uma vodka, " Apple alguma coisa" que o Léo levou... Docinha, docinha... Uma maravilha. :9;;
0;0;@lomeys ４つのアカウント何とか終わりました〜ｗ。お約束のタイプミスの他、POPとIMAPの切替しないで設定してたりとか、まぁいろいろとｗ。 Apple 製品の設定がめんどいのはアカウントとかユーザーとかって名称が一般的な言い方と違うからですね。大概はアタリがつくんだけどなぁ。;@lomeys;
2;1;@_aNys_ @tears_ apple ははっそんな事…（休憩時に乗るバスを間違えたとは言えないな）;@_aNys_ @tears_;
0;0;Apple 's TV: Petite Glass in Every Corner of Your Home - Businessweek via @BW http:// buswk.co/ICWpiu;@BW;
0;0;Judge penalizes Samsung for withholding code in Apple case: The ongoing Apple vs. Samsung case being tried in th... http:// bit.ly/KskwUS;;
0;0;“ @Ashhleeyyy : “ @califinest510 : this apple pie from @Ashhleeyyy :) >” lol you know I got you !!!” actually technically I got it for her!! Lol;@Ashhleeyyy @califinest510 @Ashhleeyyy;
0;0;The All New Apple iWatch | Apple iPhone Five http:// bit.ly/HTc0wF;;
0;0;Apple Phantastical Fantasy http:// is.gd/dr9W2S;;
0;0;@WBGNBeatdown @AdenChambers Comparing the two is apple and oranges. Avengers more of a summer popcorn blockbuster. DKR transends its genre;@WBGNBeatdown @AdenChambers;
0;0;Apple pie MOONSHINE!!!!! Delicious. Nuff said.;;
0;0;@rawsoncj Sure, but wouldn't it make sense in that Apple copies its own desktop OS featureset?;@rawsoncj;
0;0;#Jobs Apple Customer Service Rep, At Home at Apple (Baton Rouge, LA) http:// dlvr.it/1WyP9f #BatonRouge #LA;;#Jobs #BatonRouge #LA
0;0;Apple and Samsung combine to collect 99% of mobile phone profits http:// bit.ly/KwOmnH;;
0;0;@Julio_14_ apple No pasa nada. En el fondo todo el mundo está salido.;@Julio_14_;
0;0;> CCM® Capacitive Stylus Pen For iPad 3rd Generation, Amazon Kindle Fire, Apple iPad, iPad 2, iPhone, iPhone 4S, Samsung Galaxy Tab 2 (7-I;;
1;0;L-06Cが安いから惹かれるけど、やっぱりiPadの使いやすさには遥かに及ばないんだよなぁ・・・でも高い(´༎ຶд༎ຶ) アップル の Apple iPad2 Wi-Fiモデル 16GB ホワイト http:// amzn.to/JjWuqd;;
0;0;#Jobs Apple Customer Service Rep, At Home at Apple (Fort Wayne, IN) http:// dlvr.it/1WyP5D #FortWayne #IN;;#Jobs #FortWayne #IN
0;0;Kwl night with apple candles;;
0;0;@_pine_ apple cofigualquelasblackjackcof;@_pine_;
0;0;How Do You Expect There To Be An Apple Soda But Not A Strawberry Soda? -.-;;
1;0;@LucasArribabem @dora_isacardoso @ruanrossato @lihh_costa hahaha nois abala na apple;@LucasArribabem @dora_isacardoso @ruanrossato @lihh_costa;
0;0;Apple http:// instagr.am/p/KQ5oHXO65G/;;
0;0;I'm at Apple Store (Los Angeles, CA) w/ 3 others http:// 4sq.com/IXXaGu;;
0;0;Apple pie is on point right now;;
0;0;My dog ate my magnet collection. Don't let him near my vintage collection of Apple IIe games saved on floppy discs.;;
0;0;A is for apple . B is for bacon. C is for cash. D is for Devine. E is for Elephant. F is for funny. G is me because im a G. H is for Horsey.;;
0;0;Install Siri On iPhone 4, iPad 2, iPod touch With Twitter & Facebook ...: The Apple iPhone 4S has been with us f... http:// bit.ly/Lipcfg;;
0;0;Harry Potter + My boyfriend > Apple Blossom.;;
0;0;#cleanourcloud#clean our air and show apple you care about clean energy! pic.twitter.com/0zK8IRNQ;;#cleanourcloud #clean
0;0;Apple fritters>>>;;
0;0;I just came from an event with Arpaio in Apple Valley. I gave an interview to a reporter there. Someone it on you-tube http:// j.mp/IMmHCK;;
0;0;My nephew being a little shit. The apple doesn't fall far from the tree @shively_legend;@shively_legend;
0;0;kwentins sitting on my couch licking the shit out this taffy apple lmfaooo .;;
0;0;Had a good day bouta call APPLE HEAD and make sure dey aint too drunk lol;;
0;0;Beneficios del Mercado Móvil apple y samsung. Resto desapareció http:// flpbd.it/HG9YT ”;;
0;0;@Hicksfilosopher how ? i rember apple;@Hicksfilosopher;
1;0;golf tomorrow with @RealCokes @nathanclarke6 @joe_skarz before shooting off to the big apple for some rest with family and friends!;@RealCokes @nathanclarke6 @joe_skarz;
0;0;Hey #apple , is this available as a PDF? http:// help.apple.com/advancedserver admin/mac/10.7/ …;;#apple
0;0;#apple #macbook #pro #13 at the bar #crowneplazauniversal #olloclip lens on rolling hard today http:// instagr.am/p/KQ5jALuVE3/;;#apple #macbook #pro #13 #crowneplazauniversal #olloclip
0;0;Upgrade! #apple http:// instagr.am/p/KQ5m1Pk8TJ/;;#apple
0;0;I'm having trouble setting good goals now that I've achieved mine of finishing college. ex. recent goal: finish off the apple juice.;;
0;0;Study: Apple iPad Accounts for 94.64% of all Tablet Web Traffic http:// ow.ly/aIXiP;;
0;0;Apple y Samsung Arrasan en los Beneficios del Mercado Móvil http:// flpbd.it/HG9YT;;
0;0;US judge sanctions Samsung, kills important defense against Apple : US Magistrate Judge Paul Grewal imposed a severe... http:// dlvr.it/1WyNtJ;;
0;0;Green Apple Slushy((:;;
0;0;@1Peluzetica eu que te irrito, né "Hey apple " ? kkkkkkkkkkk';@1Peluzetica;
0;0;Apple &#39;s &#39;iTV&#39; Might Not Launch Until 2014;;#39 #39 #39
0;0;@CarlaStaden i noo! Im going to bluewater tuesday to try get it fixed at the apple store xxxx;@CarlaStaden;
0;0;@Renata_Bom entao resumindo seu pai deu os dados do cartao de credito dele la? Pra apple ?;@Renata_Bom;
0;0;10 iPhone Cases That Help Support Good Causes http:// bit.ly/KaKBoG #socialmedia #tech #apple;;#socialmedia #tech #apple
0;0;Can't Buy Shit Til My Dad Calls Back And Tells Me His Pin Number For His Credit Card ! Fuck Apple !;;
0;0;mau ilang gak tu ? RT @Apple _1412 : Masih perih,;@Apple;
0;0;eating an apple while i wait for both cheese-stuffed bread and cheese-covered bread to be delivered to my doorstep;;
0;0;Banana bread made with no sugar and apple sauce instead of oil is just not the same.;;
0;0;Led apple (레드애플)_새드니스(SADNESS)_안무연습영상: http:// yearbook.com/a/2gei9s;;
0;0;@nicolerichard_ apple blossom?! I sure hope so!;@nicolerichard_;
0;0;"Michael, say pump..." "Pump." "Kin..." "Kin." "Now say pumpkin." " Apple ." Always been a freak.;;
0;0;When u go Apple u nevr go...............back hahaha;;
0;0;S/o to the guy at Apple for giving me a new iPhone!!!!! :);;
0;0;I'm addicted to orange, Apple ,&cranberry juice;;
0;0;Open street maps ack apple http:// arstechnica.com/apple/news/201 2/05/two-months-later-apple-acknowledges-use-of-openstreetmap-in-iphoto.ars …;;
0;0;About to down this Apple juice tho ..;;
0;0;Sterling Silver Charm Apple 12mm -Teachers-Health-Bella's Bracelet: This heavy, solid apple charm in glowing ste... http:// amzn.to/wcdex8;;
0;0;“ @califinest510 : this apple pie from @Ashhleeyyy :) >” lol you know I got you !!!;@califinest510 @Ashhleeyyy;
0;0;Don&#39;t Panic Macbook Decal Mac book Stickers Macbook Decals Apple Decal Macbook Pro / Macbook Air / iPad / iPhone 4 http:// weav.rs/KskfRP;;#39
0;0;or maybe some apple juice . .;;
0;0;@AshleyPurdy I just ate a apple :D :D;@AshleyPurdy;
0;0;Amazon Kindle Fire Sales Slump as Apple Boosts Tablet Share: May 3 (Bloomberg) -- http:// Amazon.com Inc. lost ... http:// bit.ly/KwNCih;;
0;0;#Android #iPhone #WP This App For iOS Brings Back The Magic Of Original Polaroid Camera To Th... http:// bit.ly/JD6gBV #Apple #samsung RT;;#Android #iPhone #WP #Apple #samsung
0;0;@MrMJPD it's on Google under caramel apple shots! it has gelatin w/ ur choice liquor instead of h2o, butte (cont) http:// tl.gd/h9v68d;@MrMJPD;
0;0;Wow! I just won this for free, Apple iTunes App - Winner's choice http://www. listia.com/r7f6z8/1528707 #listia;;#listia
0;0;She say you rushin you rabbid son of a labrador but im attracted to her like teenie boppers to apple stores;;
0;0;@Julio_14_ apple No. Nunca nadie lo sabrá.;@Julio_14_;
0;1;@MarthaElisee It's AMAZING, really cinnamon flavoured whisky and apple juice, if I could drink this and Bulmers No 17 forever I'd be happy.;@MarthaElisee;
0;2;On location ritual...workin in Ontario this wknd, found that Apple Store. HI GUYS! Heading to work! #disney #kidactors pic.twitter.com/9z1uVvWf;;#disney #kidactors
0;0;These Islands Aren't Just a Shelter From Taxes: Luxembourg is a tax haven, and Apple funnels more than a billion... http:// bit.ly/KwNyPq;;
0;0;Apple store Fwm @GOOF_noSPOOF;@GOOF_noSPOOF;
0;0;Free available Awesome tvQuran App for iphone in Apple store. #القران الكريم;;#
0;0;http:// twitpic.com/80f3zh #apple #jack and the #worm #political commentary #satire;;#apple #jack #worm #political #satire
0;0;一抹の不安は Apple がMaountain Lionでもブートキャンプを用意するか否かです。;;
16;1;Apple and Samsung combine to collect 99% of mobile phone profits - TechSpot http:// bit.ly/KvT70F #apple;;#apple
6;3;It Takes a Jailbreak: Cydia Community Releases iPad Text Edit Hack As a ... - Forbes http:// bit.ly/LioGOs #apple;;#apple
0;0;Get a usb extension cable >> RT @swatch_dan: Urgent message to Apple Inc.. Can you please make the charger cable fucking longer. #JustSaying;@swatch_dan;#JustSaying
0;0;IMM DRINKING A GREEN APPLE SLASH. . .;;
0;0;@xoAmbitiousxo I heard your input already tho. Next time it falls I'm going to apple . I don't want to keep paying 4 ghost armor.;@xoAmbitiousxo;
0;0;◆ Apple 、MobileMeユーザーのiCloud移行後、年間3,400円の20GB追加ストレージプランの無料適用期間を9/30までに延長 – http:// feedproxy.google.com/~r/macotakara/ fMAL/~3/ODNIwVKiGVo/index.php … – （via MACお宝鑑定団 blog（羅針盤） ) [1] iOS Focus;;
0;0;@1manonabicycle @astrokath Oooh might try this http:// allrecipes.com/recipe/slow-co oker-lancaster-county-pork-and-sauerkraut/ … with mashed potatoes + apple sauce.;@1manonabicycle @astrokath;
0;0;Apple 's Plan to Put Tiny Glass in Every Corner of Your Home http:// lnkd.in/9hmhJz;;
1;0;High Quality Hand Crafted Reversible Apple and Watermelon $7.99 http:// tinyurl.com/6luneqz;;
0;0;#facebook #social Another Facebook Acquisition: Mobile App #Glancee http:// goo.gl/fb/YHO21 #news #android #apple;;#facebook #social #Glancee #news #android #apple
0;0;Dis mango just as hard as a golden apple;;
0;0;Bon j'vais allez tweeté chez Apple !;;
0;0;I need to make me a trip to Mickie Dees nd get me toe apple pies ;);;
0;0;@x_mikke Al menos en el iPod, no hay soporte para FLAC. La mejor calidad que se puede tener es Apple Losless (m4a), usada en iTunes Store.;@x_mikke;
0;0;@penny_ha "If only they had an Apple Store, it'd be paradise!";@penny_ha;
0;0;@david_klose Vete ala cola jajaja Apple forever!! .!. FUCK IT!!;@david_klose;
0;0;@mpaulmath has now joined the world of Apple .;@mpaulmath;
0;0;#taf #tfb #followback #teamfollowback opera apple safari google chrome microsoft internet explorer mozilla firefox (at)upgradebrowser;;#taf #tfb #followback #teamfollowback
0;0;lol apple store guy asked me if me , @juliadorjan and @angelarizz were all sisters;@juliadorjan @angelarizz;
0;0;@QtGirl109 lol I still can't drink apple sangria -_-;@QtGirl109;
0;0;This apple is too good;;
0;0;The All New Apple iWatch | Apple iPhone Five http:// bit.ly/HTc0wF;;
0;0;If I was forced to drink one though, it'd be apple .;;
2;0;It's apple blossom baby! #living it up love my girls @crane_kaitlyn @hanny_boo97 @Larisa_DaMaster <3;@crane_kaitlyn @hanny_boo97 @Larisa_DaMaster;#living
0;0;Help with best iMac for $2000.00 #apple http:// bit.ly/JnLGYc;;#apple
0;0;#linux #kernel Re: Linux Support for Thunderbolt using Apple Monitor http:// dlvr.it/1WyNXC;;#linux #kernel
0;0;Apple Black&Mild? #Bomb;;#Bomb
0;0;Apple ストアより安く「iPhone」を直せるリペアショップで作業の一部始終を見学させてもらいました - GIGAZINE http:// gigazine.net/news/20120504- iphone-repair/ …;;
0;0;Продам Apple iPhone 3G 8GB http:// bit.ly/KwNfEr;;
0;0;Apple Computers: Steve Jobs Resigns As Apple CEO! http:// bit.ly/JUcJuj;;
0;0;MacBook Proが全くダメになっちゃった。 Apple に相談しよう。;;
0;0;Enjoying a spicy beef taco with green apple relish at the Street Food Block Party #SFBP @TOundrgroundmkt @ontfoodtrucks;@TOundrgroundmkt @ontfoodtrucks;#SFBP
0;0;Speculating about future Apple products is really hard to do well. That doesn't keep everyo... http:// bit.ly/Lioyyr http:// bit.ly/aYQIwZ;;
0;0;Amazing prices on Medium candy apple red fake leather sectional sofabed and 9 seater linen mix sofa at... http://www. world-of-sofas.co.uk/amazing-prices -on-medium-candy-apple-red-fake-leather-sectional-sofabed-and-9-seater-linen-mix-sofa-at-lee-longlands-in-bridport/ …;;
0;0;US judge sanctions Samsung, kills important defense against Apple http:// fb.me/WHfXl67Z;;
0;0;US judge sanctions Samsung, kills important defense against Apple : US Magistrate Judge Paul Grewal imposed a sev... http:// vrge.co/KwHCWG;;
0;0;#tech US judge sanctions Samsung, kills important defense against Apple : US Magistrate Judge Paul Grewal imposed... http:// vrge.co/KwHCWG;;#tech
0;0;US judge sanctions Samsung, kills important defense against Apple : US Magistrate Judge Paul Grewal imposed... http:// vrge.co/KwHCWG #tech;;#tech
0;0;@aya_0820_ apple おはようございます！今日も１日頑張りましょ～！！;@aya_0820_;
0;0;US judge sanctions Samsung, kills important defense against Apple http:// vrge.co/JD63hZ;;
0;0;#TheHapticProject US judge sanctions Samsung, kills important defense against Apple http:// vrge.co/KwHCWG @verge;@verge;#TheHapticProject
0;0;US judge sanctions Samsung, kills important defense against Apple : US Magistrate Judge Paul Grewal imposed a sev... http:// vrge.co/KwHCWG;;
0;0;US judge sanctions Samsung, kills important defense against Apple : US Magistrate Judge Paul Grewal imposed a sev... http:// vrge.co/KwHCWG;;
0;0;US judge sanctions Samsung, kills important defense against Apple : US Magistrate Judge Paul Grewal imposed a sev... http:// vrge.co/KwHCWG;;
0;0;US judge sanctions Samsung, kills important defense against Apple : US Magistrate Judge Paul Grewal imposed a sev... http:// vrge.co/KwHCWG;;
0;0;@p_diias vamos de big apple então;@p_diias;
0;0;#TheVerge US judge sanctions Samsung, kills important defense against Apple : US Magistrate Judge Paul Grewal imp... http:// vrge.co/JD62KZ;;#TheVerge
0;0;Apple abandons users with iMovie preinstalled, exploits open source Burn to support users http:// burn-osx.sourceforge.net/Pages/English/ home.html …;;
0;0;US judge sanctions Samsung, kills important defense against Apple : US Magistrate Judge Paul Grewal imposed a sev... http:// vrge.co/KwHCWG;;
0;1;I'm tweeting for the apple of my eye. <3 Maddie;;
0;0;“ @BENJAMILLS : Strawberry Ribena » Apple & Mango Copella Juice » Lucozade Orange » Tropicana.”lucozade Apple yhh you smashed it;@BENJAMILLS;
0;0;US judge sanctions Samsung, kills important defense against Apple : US Magistrate Judge Paul Grewal imposed a sev... http:// tinyurl.com/6u4ue6c;;
0;0;this apple pie from @Ashhleeyyy :) >;@Ashhleeyyy;
0;0;@ladychillz i dip apple sclices in mine for a healthy snack!!! #SoGood;@ladychillz;#SoGood
0;0;@MercadoAlertas Apple Mac Book Pro 15 Intel Core Duo Escucho Ofertas Ya $3,400.00 Neuquén http:// pmstrk.mercadolibre.com.ar/jm/PmsTrk?tool =5980535&go=/jm/item?site=MLA$$id=423596970 … #ofertas #Usado #adML;@MercadoAlertas;#ofertas #Usado #adML
0;0;@Golden Apple comics earlier today I saw an Adventure Time Fiona cosplayer :) rock on!;@Golden;
0;0;Apple iPod touch 32 GB (3rd Generation) Carrying CaseCrown Padded Compartment Compact Case (Pink): Protect and t... http:// amzn.to/rjQsWw;;
0;0;Apple iPod touch 32 GB (3rd Generation) Carrying CaseCrown Padded Compartment Compact Case (Pink): Protect and t... http:// amzn.to/rjQsWw;;
0;0;◆ [Mac] Transmit サーバーにアクセスした瞬間にこれだと思わせる高速 FTP クライアント – http:// rakuishi.com/mac/3668/ – （via ラクイシロク ) [2] Apple;;
0;0;This is how im spending my apple blossom weekend (; pic.twitter.com/ymx4tIta;;
0;0;@apple _koi らんらん♫ キャンプのお金振り込もうと思ったら振込先を聞くの忘れていた笑 手数料わからないと計算できないわ(￣▽￣);@apple;
0;0;LISTEN TO LATEST SINGLE! The Idler Wheel... FIONA APPLE Epic Records/People Person - Got it. Flaunt it!: http:// bit.ly/IIzd24;;
0;0;@Julio_14_ apple Era todo de broma. Para reírme un rato.;@Julio_14_;
0;0;Shoot an apple off my head.;;
