retweets;favorites;text;mentions;hashtags
1;0;RT @iMore : The Apple iPhone 5s leather case is a dirt magnet, tell us how you keep it clean! http:// flip.it/ImbU2;@iMore;
0;0;@fahda_ apple لية يا عم انا جيت جنب اهلك !! واحد بيتريأ على رصد انت مالك;@fahda_;
0;0;Acre and Area and Acreage Calculator #calculator #app #iPhone #apple #iPad http:// bit.ly/1dWXMrk;;#calculator #app #iPhone #apple #iPad
0;0;Weekly Roundup: Apple iMac review, BlackBerry Z30 review, Samsung's Galaxy Round and more!;;
0;0;Weekly Roundup: Apple iMac review, BlackBerry Z30 review, Samsung's Galaxy Round and more!;;
0;0;Weekly Roundup: Apple iMac review, BlackBerry Z30 review, Samsung's Galaxy Round and more!;;
0;0;Weekly Roundup: Apple iMac review, BlackBerry Z30 review, Samsung's Galaxy Round and more!;;
0;0;Weekly Roundup: Apple iMac review, BlackBerry Z30 review, Samsung's Galaxy Round and more!;;
0;0;Weekly Roundup: Apple iMac review, BlackBerry Z30 review, Samsung's Galaxy Round and more!;;
0;0;Weekly Roundup: Apple iMac review, BlackBerry Z30 review, Samsung's Galaxy Round and more!;;
0;0;Weekly Roundup: Apple iMac review, BlackBerry Z30 review, Samsung's Galaxy Round and more!;;
0;0;Weekly Roundup: Apple iMac review, BlackBerry Z30 review, Samsung's Galaxy Round and more!;;
0;0;Weekly Roundup: Apple iMac review, BlackBerry Z30 review, Samsung's Galaxy Round and more!;;
0;0;Weekly Roundup: Apple iMac review, BlackBerry Z30 review, Samsung's Galaxy Round and more!;;
0;0;Weekly Roundup: Apple iMac review, BlackBerry Z30 review, Samsung's Galaxy Round and more!;;
0;0;Weekly Roundup: Apple iMac review, BlackBerry Z30 review, Samsung's Galaxy Round and more!;;
0;0;Weekly Roundup: Apple iMac review, BlackBerry Z30 review, Samsung's Galaxy Round and more!;;
0;0;Weekly Roundup: Apple iMac review, BlackBerry Z30 review, Samsung's Galaxy Round and more!;;
0;0;vou entrar no site da Apple pra ver o meu Iphone, u.u;;
0;0;Photo: Apple pie: The Before. http:// tmblr.co/ZqybJyxawkDo;;
0;0;Steak with apple bourbon marinade..salad, red potatoes and a movie;;
0;0;Finally done with essay! Going to make #pie #delicious #sweets #apple;;#pie #delicious #sweets #apple
0;0;RL Polo hard case for Apple iPhone 5S http:// bit.ly/GFIOKR;;
0;0;The apple jacks I ate cut my tongue omg;;
2;3;Damn you, Apple ! I want my nutrition facts! :-p Pic: pic.twitter.com/fRSVhkqTZI;;
1;0;Apple Cider Braised Pork Roast For #SundaySupper #FamilyDinnerTable http:// goo.gl/Za1fia via @reneedobbs;@reneedobbs;#SundaySupper #FamilyDinnerTable
0;1;Apple , I love you, but you're on my shitlist.;;
0;0;@lalalaauren8 good good apple bees soon;@lalalaauren8;
1;3;You wanna know how to break the iTunes app? Search "Your Love" Outfield. Apparently Apple fucking hates that song and anyone who searches it;;
0;0;@habsgirl4life hmm apple , blueberry?;@habsgirl4life;
0;0;I tried the apple for love;;
0;0;Nothing better than Apple Harvest apple fritters;;
0;0;I was forced to go apple picking today so here. A shitty collage of apples pic.twitter.com/wmZmjQ4O4L;;
0;0;An Apple A Day http:// wp.me/p3Na5J-7I;;
0;0;Apple ’s Latest iPhones Could Be the Most Disappointing in the Company’s History: http://www. fool.com/investing/gene ral/2013/10/13/apples-latest-iphones-could-be-the-most-disappoint.aspx#.UlsxC6bvLzM.twitter … vía @themotleyfool;@themotleyfool;#
0;0;@juice_twentyten I WAS AT THE APPLE STORE IM SO FUCKIN PISSED !!!!!!!!;@juice_twentyten;
0;0;to stick with apple or see what all this talk about those dang galaxys are all about? I'm having issues right now.;;
0;0;Everyone's posting pics of pumpkin/ apple picking, doing couples things, etc. Nope not me #SingleAF;;#SingleAF
0;0;Apple cider, popcorn, football;;
2;3;apple > pumpkin;;
0;1;Nanny made cookies, pumpkin pie, apple pie, apple crumble and a turkey dinner;;
0;0;This is pretty neat: http:// goo.gl/8thw6V Learn #German spelling on your #mac #apple #backtoschool;;#German #mac #apple #backtoschool
0;0;Apple and pumpkin picking with the family today #fallfun #lawrencefarms http:// instagram.com/p/fbTOPfqqFW/;;#fallfun #lawrencefarms
0;0;apple bottom jeans jeans boots with da furrr;;
0;0;Well maybe if ness did t hit me in the head with the apple I wouldn't be in this predicament;;
0;1;Redds Apple Ale is sooooo good;;
0;0;Apple Green Patinated Copper Handmade Earrings http://www. handcrafted-earrings.com/apple-green-pa tinated-copper-handmade-earrings …;;
0;0;Hoje fui na apple store;;
2;2;I won't understand how people like to eat apple pie and pumpkin pie, its so gross;;
1;3;Why hello there you devilishly beautiful apple , you. #yummy #caramelapple pic.twitter.com/JzfciBilRt;;#yummy #caramelapple
0;0;#latergram Apple picking with @shelaghdolan - she made my birthday so special! @Tougas Family Farm http:// instagram.com/p/fbTSNLiwwW/;@shelaghdolan @Tougas;#latergram
0;0;I'm finally realizing how amazing my Apple TV is.;;
0;0;Ihhh só mais 15% de bateria, aí como vai rápido credo, merda de Apple;;
1;0;Walter Murphy & The Big Apple Band - A Fifth Of Beethoven (live at The Midnight Special 1976) https://www. youtube.com/watch?v=UtF-eU yvP7E …;;
0;0;'Hey, is that an Adam's apple or is your neck just happy to see me?'--me, to a guy with a big Adam's apple . (rule of 3) #neckboner;;#neckboner
2;0;Apple News: The iPad Mini 2 might surely come out with a brand new Retine Display and Touch ID (Fingerprint Scanner as in iPhone 5S);;
2;1;“@RappingWeezy: Got an iPhone charger... Call it apple juice”;@RappingWeezy;
0;0;#Cristãos manifestam preocupação com #censura #religiosa por parte de empresas como #Facebook , #Apple e #Google http:// bit.ly/18c2oZa;;#Crist #censura #religiosa #Facebook #Apple #Google
0;2;Homemade alphabet soup, grilled cheese and some apple crisp probably best dinner I've had in a while;;
0;0;Granny Smith Apple Pie Treat Awesome! Awesome! Not as hard as it looks!! 3 Granny Smith Apples - please wash... http:// fb.me/17mS5Y5wJ;;
0;0;RT @applenws : Google's 'Ingress' coming to iOS in 2014 http:// flip.it/YP5b9 #apple;@applenws;#apple
0;0;I swear to God everyone went fucking apple picking today.;;
0;2;@JoeDaugerdas @Ouellette25 lol nope we didn't go apple picking;@JoeDaugerdas @Ouellette25;
0;0;UGGHHHGGG WHERE TF IS MY APPLE JUICE ? BITCH GONNA MAKE ME CHOKE THEM. IM NOT INA PLAYFUL MOOD B.;;
0;0;SAMSUNG GALAXY TAB2 7" GOLD LEOPARD ROTATING STAND +2 SCREEN PROTECTORS + STYLUS $23.99 http:// bit.ly/1aCdxkI #tablets #apple;;#tablets #apple
0;0;Caramel Apple Mousse Cake Recipe. http:// fb.me/6mFYh3ObF;;
0;2;¿Acaso soy la única que prefiere Apple que Android?:(;;
0;1;Apple bees was;;
0;0;We took #FlatStanley to the Apple Festival today! @Georgia Apple Festival http:// instagram.com/p/fbTS71y4Ph/;@Georgia;#FlatStanley
2;2;Decided to step my game up #MacBookPro #Apple #Fresh #likeaboss #opm #digitalera #entrepreneur … http:// instagram.com/p/fbTF9KsBIc/;;#MacBookPro #Apple #Fresh #likeaboss #opm #digitalera #entrepreneur
0;0;Apple MB974ZM/B World Travel Adapter Kit http://www. amazon.com/Apple-MB974ZM- World-Travel-Adapter/dp/B002CJNCS4?SubscriptionId=AKIAJDM34GMLWSSGTQPQ&tag=secrheal01-20&linkCode=xm2&camp=2025&creative=165953&creativeASIN=B002CJNCS4 …;;
0;1;I want to go to haunted houses, hayrides, corn mazes, halloweekends and apple charlies. So much to do, so little time.;;
0;0;Mooi en ook zwaar weekend achter de rug. De tol van perfectionist willen zijn wat finetunning van devices #apple betreft. #sleepysleepynight;;#apple #sleepysleepynight
0;0;I wonder do they have cherry pie RT @Sawdeeze_nuts: What I do know is, I want an apple pie mcflurry!;@Sawdeeze_nuts;
0;0;Yellow rice, apple and onion pork roast, and mixed vegetables all cooked by moi! #delicious #mmmm and… http:// instagram.com/p/fbRYgssqbJ/;;#delicious #mmmm
0;0;Apple iPhone 6 specs release date and more http:// shar.es/EhR9Y via @TheTechnoTribe;@TheTechnoTribe;
0;0;@DavilaAnerica @EpicMcpe try Jhonny Golden Apple if not look on youtube;@DavilaAnerica @EpicMcpe;
0;0;Apple Cider Crackle with Spiced Rum Marc Alan Innes & Associates LLC Luxury Acquisition and… http:// instagram.com/p/fbTWahTCNA/;;
0;0;Apple forgot the manual! But here you have the best iPad Video Lessons. http:// dld.bz/cKCn3;;
0;1;You can learn #languages with your mac! Learn how to communicate in #Italian http:// goo.gl/Gam4hv #apple #mac #edtech;;#languages #Italian #apple #mac #edtech
0;0;For Apple iPad 4&3&2 360 Rotating Magnetic PU Leather Case Smart Cover Stand 04: $0.03 (0 Bids)End Date: Sund... http:// bit.ly/1ci1H19;;
0;0;@_Pamela remind me to invite you over for toast. You need to try my apple butter.;@_Pamela;
0;0;My iPhone charger is done for. Idk how I will charge my phone. Apple store tomorrow.;;
0;0;@ArturinDM solo apple;@ArturinDM;
8;0;#TeamKarutSedunia babi breakfast makan pie apple kat McD,drive thru....;;#TeamKarutSedunia
0;0;Apple juice problems. https:// vine.co/v/hHVvh5etL2n;;
0;0;@AndyPriceArt yippe kie-yey apple buckers!;@AndyPriceArt;
0;0;Green Apple Yoga shorts S NWT Elastic waistband Bamboo http:// ift.tt/17obP4e #yoga;;#yoga
1;2;I just want to cuddle drink apple juice and watch cops;;
0;0;Had a blast taste testing apples at Apple Jack Orchard today! http:// instagram.com/p/fbTPwPjzEL/;;
0;0;Damn Apple and Onion Baked Pork Chops got my house smelling like Autumn. #loveit #delicious … http:// instagram.com/p/fbTLX-j52P/;;#loveit #delicious
0;0;thats how they did me wit my iphone and ipad fuck apple;;
0;0;Weekly Roundup: Apple iMac review, BlackBerry Z30 review, Samsung's Galaxy Round and more! http:// ift.tt/1fvCc05;;
1;5;Apple pie;;
38;1;แรงอะ Apple ส่งหมายเชิญไปยังพนักงาน BlackBerry "มาทำงานที่นี่ไหม" #ittwt - http:// pulse.me/s/rOVhP;;#ittwt
0;0;Obamacare Website Fixes Could Take Two Week Or Two Months http:// bit.ly/1cLWIZs #apple #news #tech;;#apple #news #tech
0;0;An apple a day keeps the doctor away http:// instagram.com/p/fbTUyZouyy/;;
0;0;The highlight of my weekend was eating donuts from the apple orchard!Oh and @clark_emily02 surprising me by coming home;D #Icried #shecried;@clark_emily02;#Icried #shecried
0;0;@breakingbad702 what is that ... Love green apple jolly Rancher;@breakingbad702;
0;0;I think apple should turn on everyone's read receipts permanently.;;
0;0;@BuyCheapz .com: CaseCrown Cali Snap On Case (Coral Surf) for Apple iPhone 5S http:// goo.gl/fb/87jSW;@BuyCheapz;
0;2;Setting up my new MacBook Air while drinking tea and eating an apple , because I want to get the most out of my Apple Care plan.;;
0;0;Apple Cider brine pork loin smoked on apple wood... #porkporn http:// instagram.com/p/fbTOW1CXhP/;;#porkporn
0;2;My neighbor just gave me a brand new Apple TV I'm down!!;;
0;0;Ugh this caramel apple spice drink from Starbucks >>>>>>> #Heaven;;#Heaven
0;0;Estoy viendo "Yo Robot" y estoy seguro que Apple acabará fabricando esos robots psicóticos del futuro.;;
0;0;Wish I could trap the smell of baking apple pie so I can smell it forever;;
0;4;Homemade apple cider and cookies;;
0;0;Apple Raisin Oatmeal #FTW !;;#FTW
0;0;Fun with friends! (@Blake's Big Apple Orchard w/ 2 others) http:// 4sq.com/190R0Pl;@Blake;
0;0;Even tho she took the apple cider she bought for me...;;
0;0;About to skate apple park wit the homie;;
0;0;No Talkcast tonight, holiday weekend http:// dlvr.it/47WtYH #apple #mac;;#apple #mac
0;0;Apple iPhone 4 - 16 GB Black unlocked http:// ift.tt/15s7T55 #iphone;;#iphone
0;0;[MercuryNews Biz] Wolverton: Apple 's spaceship is landing in the wrong place http:// dlvr.it/47WtXZ;;
0;0;Apple iPhone 4S 32GB Black (Sprint) Smartphone With LIFEPROOF http:// ift.tt/16WsL7L #iphone;;#iphone
0;0;@09224422 Apple どーなってんねん＿|￣|○;@09224422;
0;0;Apple iPhone 4 - 8GB - Black (Verizon) Smartphone (MD439LL/A) http:// ift.tt/1g7Bp6Y #iphone;;#iphone
0;0;Piel Frama 603 Black iMagnum Shell for Apple iPhone 5 / 5S http:// ift.tt/166OUdx #iphone;;#iphone
0;0;Apple iPhone 4 - 16GB - Black (Bell) http:// ift.tt/17y4NZT #iphone;;#iphone
0;0;Apple iPhone 4S - 32GB - White (Sprint) Smartphone http:// ift.tt/1fuXHyj #iphone;;#iphone
0;0;Apple iPhone 4 - 8GB - Black (Verizon) Smartphone - A+ Condition http:// ift.tt/17y4ONj #iphone;;#iphone
0;0;...another worthy fall drive is frm the #TwinCities down 2 Jim's #Apple Farm-Not far away, #seasonal treats, new addn! http:// openplac.es/trips/jim-s-ap ple-farm-jordan-minnesota-in-jordan-mn-55352-9304/ …;;#TwinCities #Apple #seasonal
1;0;@leandrovillagra Aaaaa sisi, acá hay un montón que tienen bb y un iPod. Igual, ahora están como igualados los bb y Apple .;@leandrovillagra;
0;0;@Karlee127 haha yea I will maybe we can play apples to apple ?;@Karlee127;
0;0;仆街，晨咁早無la la 收到個iReserve的SMS, 但我冇send過去 Apple !!;;
1;0;7) 2) Performansi Saham Apple n Pertaruhan Hak Paten antara #Apple vs #Samsung http:// chirpstory.com/li/18272;;#Apple #Samsung
32;66;to the people who constantly slate apple ; don’t have an iphone/ipod haha, turkeys x;;
0;0;Apple picking with my best frand http:// instagram.com/p/fbTQ05HvPO/;;
0;1;Apple picking/ wine tasting kinda day... #hubersfarm http:// instagram.com/p/fbTMlRubPP/;;#hubersfarm
0;0;Apple demands news site pull copy of iTunes Radio contract, claims copyright infr http:// bit.ly/19IbwRO [ http:// redd.it/1oc711 ] #cyberlaw;;#cyberlaw
0;0;@cassie_ apple iya say :*;@cassie_;
0;0;6) Aku prnh pula buat TL ttg #Apple : 1) Jihad Terakhir Apple http:// chirpstory.com/li/9314 dan;;#Apple
0;0;10/19 Carnival of Dreams *PARTY/NETWORKING EVENT* — DreamHonor http:// buff.ly/1gCBFZu Free Apple TV! Free Class! Free Gifts! Come :) 10/19;;
1;0;Sour apple ass hoes. RT @XoxoJayda_ : I Hate A BITTER Bitch We Just Having Fun.";@XoxoJayda_;
0;0;So imma put on a movie and drink apple juice till I fall asleep xx;;
0;0;I feel like a little kid when I drink apple juice;;
0;0;@jais_ apple you just like me charl;@jais_;
1;0;Good morning, happy monday, happy holiday (at Villa Green Apple - Cipanas, Puncak) — https:// path.com/p/4qgMss;;
0;0;@Directioner5er7 oooooohh I'm using an Apple TV;@Directioner5er7;
0;0;5) Judul versi Indonesia: Optimisme Apple , ada penyesuaian judul n may be sedikit penyesuaian alur cerita. #Apple;;#Apple
0;0;CM Apple iPod shuffle https://www. youtube.com/watch?v=IrLvsR etp2o&feature=youtube_gdata_player … 懐かしいものをみつけた。iPodのCMといえば、この映像とこの曲やなぁ…。これ、何て言う曲なんやろ…？;;
0;0;#Hindi for beginners and advanced students. http:// goo.gl/Nlo021 Learn on your #Mac #apple #education #backtoschool;;#Hindi #Mac #apple #education #backtoschool
2;14;apple pie crepes with vanilla ice cream .. thank god for @peterkaymakcian;@peterkaymakcian;
0;0;@Heh_teh if youre home wed ill be home and we could wander over to trail of terror and/or the apple orcharddd!;@Heh_teh;
0;0;Apple Juice Falling From Her Lip;;
0;0;Photoset: thecakebar: Apple Pie Cookies Tutorial {click link for full recipe and tutorial} http:// tmblr.co/ZzyxGyxaw4zz;;
0;0;起業の神様【マイケルE.ガーバー】が教えれてくれる成功の秘訣『起業の神話』無料オンライン講座が期間限定で公開中ですよ＾＾特典に【Apple創業者スティーブンジョブスが残した52の名言集】も！豪華です！⇒ http:// bit.ly/michael02;;
0;0;@LicaCravo @elidiadomingos @GabCravo big pra mim só presta se for apple kk. E sobre a Gaia num queroo naao kk, já sou traumatizada com isso;@LicaCravo @elidiadomingos @GabCravo;
0;0;4) Tulisan BW diangkat seminggu stlh peluncuran iPhone 5C n 5S #Apple , 11 Sep, u tgl aku pribadi teringat kengerian tragedi 911;;#Apple
0;0;New apple iphone 5s 5 hybrid tpu bumper defender case slim candy apple green $7.00 http:// bit.ly/15aPwkR #Smartphone #Smartphones;;#Smartphone #Smartphones
0;0;Apple bee's on me;;
0;0;@imuserfriendly Ask Erfon what he will do if Apple doesn't announce a new MBPr at the next event.;@imuserfriendly;
0;0;Apple iPhone 6 specs release date and more Read More:... http:// fb.me/23zdOGiY1;;
0;0;But since when did lil smiley faces make someone decide what phone they're gonna get. Apple is so overrated and charge you for EVERYTHING;;
0;0;IPhone 4s Apple Por Apenas R$ 899,90 Em Até 12x Sem Juros!: http://www. clubedoclique.com.br/redirect.php?i d=32903&banner=282&token=3c7ee47400826405958132afcd916b7e …;;
0;1;This is the face Rob Ryan wears both at the end of a bad game and after drinking way too much apple cider. pic.twitter.com/vuP3K9HiJT;;
0;0;Got an iPhone charger... Call it apple juice;;
2;3;who wants to take me to apple hill;;
0;0;@luckychandra2 oleh2???? km lah yg ngasih aku,,, klw km mau oleh2 ambil noh di loker aku bnyk tab, apple , dkk..!!!!;@luckychandra2;
0;2;tis the season to drink apple cider;;
0;0;@Nflpicksapp la aplicacion solo funciona en ipad y/o iphone? En pc o lap no apple ?;@Nflpicksapp;
0;0;In preparation for tonight's feast, all I've eaten today is a piece of bread, an apple and a cookie. #bringontheturkey;;#bringontheturkey
0;0;I about had it with this Apple nonsense.;;
1;0;Posts: una aplicación recomendada e indispensable para bloggers ( Apple Store) http:// goo.gl/fb/jqELo;;
0;0;Chemistry with the #Periodic #Elements is magic? Not with this learn #iphone app! http:// goo.gl/PaXpkn #apple #rt #edtech #chemistry;;#Periodic #Elements #iphone #apple #rt #edtech #chemistry
0;4;Stranded with groceries... Will share apple pie icecream for ride;;
0;0;Meh, not so much. — Drinking a Blue Moon Caramel Apple -Spiced Ale by Coors Brewing Company at @jameski — http:// untp.it/1bQu4Hd #photo;@jameski;#photo
0;0;Fried chicken, mashed potatoes, sweet potatoes, collards, apple sauce, green bean with bacon, and corn bread;;
0;0;Sunny ma applé *_* Pour mdire de ne pas oublier skon avai prévue et qu'il allai mrapplé taleur :$;;
0;0;Tu tan Samsung y yo tan Apple .;;
0;0;@Zuvviee I'll make sure say hey next time you get turnt at Apple bees bahaha;@Zuvviee;
0;0;Apple iPhone 4s - 16GB - White (Unlocked) Smartphone: C $103.76 (0 Bids)End Date: Wednesday Oct-16-2013 19:46... http:// bitly.com/18c2akT;;
0;0;Apple iPhone 4 - 8GB - White (Sprint) Smartphone: C $190.05 (0 Bids)End Date: Friday Oct-18-2013 19:45:04 EDT... http:// bitly.com/19y1xRa;;
0;0;Featured: Swappa listing for Apple iPhone 5S (Verizon): $730 http:// swappa.com/listing/UMU620 /view …;;
0;0;IPhone 4s Apple Por Apenas R$ 899,90 Em Até 12x Sem Juros!: http://www. clubedoclique.com.br/redirect.php?i d=9881&banner=282&token=a916fbeeaa56622d57035ff6eee889ce …;;
0;0;this Carmel Apple Kettle Corn is to die for!!;;
0;0;Apple iPhone 4s - 16GB - White (Unlocked) Smartphone: C $103.76 (0 Bids)End Date: Wednesday Oct-16-2013 19:46... http:// bitly.com/18c2akT;;
0;0;@youusedtoknow_ apple is better than windows;@youusedtoknow_;
0;0;Apple iPhone 4 - 8GB - White (Sprint) Smartphone: C $190.05 (0 Bids)End Date: Friday Oct-18-2013 19:45:04 EDT... http:// bitly.com/19y1xRa;;
0;0;Android chargers are a whole lot better than apple chargers;;
0;0;I hate the apple store I have no patients;;
0;0;finding my dog ate the apple pie on the counter #notmyfavoritething #gonnakillhim;;#notmyfavoritething #gonnakillhim
0;1;Our Pumpkin exhibition tent @HoosGarden before the thousands of visitors arrived for Pumpkin& amp;Apple Gala pic.twitter.com/PTMrZIuL2t;@HoosGarden;
0;1;“ @briannechappell : worst day besides the apple pie” i feel u bri i wanna punch a bitch;@briannechappell;
0;3;Pumpkin pie, apple cider, and football. It's gon be a gooooood night >:) #yeahhhboii;;#yeahhhboii
0;0;@mikaelexander I'm sure Apple will fix these issues in a month or two anyway so even if you do have problems they'll go away.;@mikaelexander;
0;0;@willyanca oooh I just never went back whoops. I go to the green apple by Eastport;@willyanca;
0;0;iPad信者にありがちなこと iphoneの延長であることに気づいていないwww #iphoneあるある #Apple #フォローしてくれた人全員フォローする 。;;#iphone #Apple #
0;0;The green apple skittles are amazing.;;
0;0;Espaço Mog da Silva invited you to Espaço MOG's event PARTY DE CAUSAR! | (Estreia em Campinas)! | Open Vodka + Big Apple + Hi-Fi! 8:45pm;;
1;7;"IM SO FULL" I scream as I shove apple crisp into my mouth;;
0;0;Apple iPad 2 64GB (Wi-Fi + 3G) (Black) VERIZON $202.02;;
0;1;I'm going to bake a bunch of pumpkin pie and spice cakes with hot apple cider and throw a Harvest Party. For myself, because fuck people.;;
4;0;Whenever I eat an apple , I have to cut it up. #bracesproblems;;#bracesproblems
0;0;I liked a @YouTube video from @HuskyMUDKIPZ http:// youtu.be/McoTCmMlxAU?a NEW Minecraft THE GREAT APPLE HUNT "MAH GAWD" w/Husky, SSundee,;@YouTube @HuskyMUDKIPZ;
0;0;You can learn #languages with your mac! Learn how to communicate in #Hindi http:// goo.gl/Nlo021 #apple #mac #edtech;;#languages #Hindi #apple #mac #edtech
0;0;@Captain_Swank raw apple juice? Wtf?;@Captain_Swank;
0;0;http:// goo.gl/3oZiaY teachMe #TEXT learn all the abbreviations for texting with your #iPhone #iPad #iphone5 #ipod #apple only $0.99 today;;#TEXT #iPhone #iPad #iphone5 #ipod #apple
0;0;"The Worst Acquisitions Apple Ever Made" http:// buff.ly/16CD7XX;;
0;0;@EP_fan13 Pete was the third member of exclamation point when they were named final moments and they put apple stickers on their skateboards;@EP_fan13;
0;0;Los jóvenes en China ya no quieren trabajar 'como chinos' para Apple ¿Colapso a la vista? http:// es.rt.com/s4j vía @ActualidadRT;@ActualidadRT;
0;0;When I think of fall I think of apple cider;;
0;0;RT @TheSpaceShop1: Follow us to win a iPad mini Samsung Galaxy S4 and a Apple MacBook Air just follow and retweet :) good luck;@TheSpaceShop1;
0;2;How can you deny homemade apple crisp and Ben and Jerry's?;;
0;0;brie and apple salad;;
0;0;Apple cider;;
0;0;O creo quiso al final gana Apple un cliente!! :);;
0;0;Kettle corn & hot apple cider;;
0;0;i'm just annoyed with apple right now and att and tmobile ugh;;
0;1;I love apple . Problems with my iPhone... No problem, here is a new iPhone... Oh why thank you!;;
0;0;Not really feeling this apple picking thing tomorrow;;
0;1;Apple needs to make a special wifi for plateau people cause our wifi never works;;
0;0;@apple _hm_ apple いがったな～～！かぜひぐなよぉ～～！;@apple;
0;0;All I ate today was an apple SOOO that's probably why...;;
0;0;Apple should buy big companies, says ex-boss: One recent example of this is Siri, a company Apple acquired in ... http:// bit.ly/19y1rc8;;
0;0;Apple should buy big companies, says ex-boss: One recent example of this is Siri, a company Apple acquired in ... http:// bit.ly/19y1rc8;;
0;0;@itsmaryg6 @AlondraMahone oh haha! :) well, how about Apple ;);@itsmaryg6 @AlondraMahone;
0;0;Apple 's photostream feature is the seed of a social network. Like google reader in early days or simplified google+ circles @daringfireball;@daringfireball;
0;0;After Decades Of Doubt, Deregulation Delivers Lower Electricity Prices http:// bit.ly/15zUK9T #socialmedia #tech #apple;;#socialmedia #tech #apple
0;0;Looks great!! @jbecker818 : These just came out of the oven! @Skinnytaste Apple Spiced Scones with Spiced Glaze #Fall http:// instagram.com/p/fasfhrFeHJ/ ”;@jbecker818 @Skinnytaste;#Fall
0;0;My mom made apple cobbler all ima say is #damnnnnnn that was the best thing I've eaten in weeks lmfao;;#damnnnnnn
0;1;Apple Pie;;
0;4;Apple hill donuts pic.twitter.com/QCW6hDRj6g;;
0;0;#AppleStore @Apple Store, Irvine Spectrum Center http:// instagram.com/p/fbSnM2LHzg/;@Apple;#AppleStore
0;1;@shelbeysparrow me too! I went to the apple store to look at it in person and it's sooooo pretty!;@shelbeysparrow;
0;0;#AppleSays adalah kata-kata para Apple yang paling terkenal di kelas. Apalagii yang "BenerJugaLo" itu asli dari seseorang di IX A =));;#AppleSays
0;0;My obsession @TwiningsTeaUK #greentea #apple &Pear pic.twitter.com/vl79DBFDJ9;@TwiningsTeaUK;#greentea #apple
0;0;I forgot my Apple security questions so I gave Apple my number and now I'm scared bc they're gonna call me;;
0;0;@whiteappleminho Apple さん♪おはようございます♬第1話のオープニングにはびっくりしました！Sexyミノくんにやられました でも、その後はPCがフリーズして見られなかったので、この画像とっても嬉しいです ありがとうございます;@whiteappleminho;
0;0;@apple _log_cream おはあり〜（＾Ｏ＾☆♪;@apple;
0;0;Apple crisp in the oven!!!!!;;
0;0;I was otp with apple for damn near an hour;;
0;0;Steve Jobs Died Aged 56 - A sad day for all at Apple Computers as founder, Steve Jobs dies. - via @whidiomas ... http:// is.gd/e0MMe8;@whidiomas;
0;4;if i see another apple picking picture on instagram..;;
0;0;@melissadufresne si c'est acheté avec le même identifiant Apple c'est acheté pour la vie.. tu télécharge à volonté;@melissadufresne;
2;1;#RapLikeLilWayne Got an iPhone charger... Call it apple juice;;#RapLikeLilWayne
0;0;@hrk_ apple ちょっと変わった女の子が好きなもんで…笑 早く彼氏出来るといいね！;@hrk_;
0;0;(38% OFF) Apple Time Capsule MC343LL/A 1TB Sim DualBand [OLD VERSION] - $199.98 (was $319.99) - http:// amzn.to/ohdUZf #computer #apple;;#computer #apple
0;0;Mmm i got a caramel apple nom;;
0;0;@mh_renton @apple _chocolat ええケツや(*´ω｀*);@mh_renton @apple;
0;0;Weekly Roundup: Apple iMac review, BlackBerry Z30 review, Samsung's Galaxy Round and more! http:// dlvr.it/47Wsk8 #engadget #tech;;#engadget #tech
0;0;Apple Reveals Campus 2 in New Video http:// dlvr.it/47Wsjr;;
0;0;Weekly Roundup: Apple iMac review, BlackBerry Z30 review, Samsung's Galaxy Round and more! http:// dlvr.it/47Wsg7;;
0;0;New Mac Pro is Coming this Fall http:// tinyurl.com/n4lpmaf #apple;;#apple
0;0;Hangover 3 better be funny after I spent my coins on it on Apple TV !!!;;
