retweets;favorites;text;mentions;hashtags
0;0;NEW Apple TV 32GB 4th Generation 1080p MR912LL/A FREE Shipping! $119.99 via eBay http:// ift.tt/2zrA0EN;;
0;2;I having that tonight with a side of apple pie lol;;
0;0;Apple Responds to Senator's Request for Info on Face ID Privacy and Security Juli Clover http:// ift.tt/2wZPONa;;
0;0;En su momento Steve Jobs estuvo en bancarrota llevándose Apple encima. Pidio un préstamo a Microsoft y gracias a ello son el lider #1 hoy. https:// twitter.com/PaoloMandala/s tatus/919031962798575617 …;;#1
3;2;A Big Apple Office for Your Business! #NYC #virtualoffice #entrepreneur #startup #smallbiz https:// virtualofficefaq.wordpress.com/2017/10/16/thi nk-big-a-big-apple-office-for-your-business-3/ … pic.twitter.com/pTSNubE3eZ;;#NYC #virtualoffice #entrepreneur #startup #smallbiz
0;1;This one is likely to plug a really bad wifi vulnerability.;;
0;0;Have a @realchad01 kind of night. - Drinking a Ginger Apple Ale by @ReddsAppleAle @Folwell — http:// untp.beer/s/c516298214 #photo;@realchad01 @ReddsAppleAle @Folwell;#photo
2;1;A Big Apple Office for Your Business! #NYC #virtualoffice #entrepreneur #startup #smallbiz https:// virtualofficefaq.wordpress.com/2017/10/16/thi nk-big-a-big-apple-office-for-your-business-3/ … pic.twitter.com/1SeKPuz1aA;;#NYC #virtualoffice #entrepreneur #startup #smallbiz
0;0;wish i had apple cider donuts;;
0;3;I WAS TOLD BY APPLE CARE!!!!!;;
0;1;Design by @Apple that's unintuitive - while sharing a link in iMessage, you have to type the name of the person instead of checkboxes. Why? pic.twitter.com/2qEQnfR2kA;@Apple;
0;0;WPA2の脆弱性「KRACK」対処パッチ、Microsoftは対応済み、 Apple のOSとAndroidは数週間中 - ITmedia NEWS http://www. itmedia.co.jp/news/articles/ 1710/17/news044.html …;;
0;0;*why foreign governments withhold trade deficits- offset $ BRKA vacuum... trade deficits a USG Gag Order free trade/law obstruction problem;;
20;8;ไมโครซอฟท์เผย แพตช์ช่องโหว่ Wi-Fi ใน Windows ตั้งแต่สัปดาห์ที่แล้ว, ฝั่ง Android/ Apple กำลังมา https://www. blognone.com/node/96316;;
0;1;Yes. Doesn’t even vibrate cause of Apple Watch.;;
0;0;Well now that I know 100% it's not my pc I can finally say: fuck tumblr and fuck apple;;
0;0;WPA2の脆弱性「KRACK」対処パッチ、Microsoftは対応済み、 Apple のOSとAndroidは数週間中 - ITmedia NEWS http://www. itmedia.co.jp/news/articles/ 1710/17/news044.html …;;
2;41;Yo @Apple #ShotoniPhone8Plus pic.twitter.com/UuOZhqotV5;@Apple;#ShotoniPhone8Plus
0;0;行ってらっしゃいオルァ;;
1;3;Every day I find a new affront to good UI Design in Apple ’s podcast app.;;
0;0;On Android it says up to $1 in Google Play credit! This is the problem when supposed influencers are Apple fans and don't look further.;;
0;0;Apple Considered Buying Medical Startup Crossover Health http:// for.tn/2yv8f03;;
0;0;Another thing I noticed today with @Apple Watch Series 3 GPS+LTE. I don’t think the heart monitor works while you’re on the phone.;@Apple;
0;0;there is one ! pull down on your home screen;;
0;0;Uh oh: It looks like the iPhone X's sky-high price is actually scaring away Apple fans - BGR… http:// bit.ly/TechN;;
0;0;So Swiftie's are changing their Apple IDs saying that they live in Singapore to get the app. It's not fair.;;
0;0;Taffy Apple Salad Ingredients 1 (15 ounce) can pineapple chunks - drained with juice… https://www. instagram.com/p/BaU_Y98Api_/;;
0;0;人教版七年级语文课文【有声文本】 - panfeng shang https:// goo.gl/fb/8WwRXn #apple #apps #iOS #education;;#apple #apps #iOS #education
0;1;人の怒りはニヨニヨできますなあ w 自分も顔真っ赤にしてますけどね;;
0;0;Apple Considered Buying Medical Startup Crossover Health - Fortune http:// ift.tt/2gntLxc #Apple;;#Apple
0;0;banana, apple and a little bit of nuttella (energy taker and potassium for your muscles);;
0;0;Awesome article! Thanks for the feature!;;
0;0;I liked a @YouTube video http:// youtu.be/SWw3vrQZPBQ?a Stardew Valley - DANCING APPLE ?! - Part 3;@YouTube;
0;0;Genuine Apple 85w MagSafe1 Macbook Pro17" charger adapter A1343 A1172 A1286 https://www. ebay.co.uk/i/253188735529 @eBay @Gumtree @AmazonUK @Gumtree;@eBay @Gumtree @AmazonUK @Gumtree;
0;0;You buy yourself an apple watch;;
0;0;I put a apple in ya mouth , then hang you over a fire that’s a roasting session @TheRealTayRoc;@TheRealTayRoc;
1;0;Anyone want to buy an Apple Pencil lol pic.twitter.com/IAeKbAErQU;;
3;8;Someone share their Apple Music playlist with me /:;;
0;1;Apple Considered Buying Medical Startup Crossover Health http:// for.tn/2kUNKET pic.twitter.com/2HoQjQp8Xw;;
0;0;How Apple , Google and Microsoft are addressing the KRACK Wi-Fi vulnerability http:// ift.tt/2ynwaim;;
1;0;Per @chrissyfarr Apple also had approached @onemedical READ https:// twitter.com/chrissyfarr/st atus/920050275720708096 …;@chrissyfarr @onemedical;
0;1;Teehee;;
0;0;El Beddit 3 Sleep Monitor de Apple parece estar ‘Agotado’ http://www. iosmovil.net/el-beddit-3-sl eep-monitor-de-apple-parece-estar-agotado/ … pic.twitter.com/MtZlGaqWrd;;
0;0;#Monday - #Publishing #copyright for #authors and #writers with #books is on #Apple #iTunes as an #audiobook https:// itunes.apple.com/us/audiobook/c opyright-law-protecting-authors-writers-professor/id1199532530?ign-mpt=uo%3D4 … pic.twitter.com/PoODbZiqG2;;#Monday #Publishing #copyright #authors #writers #books #Apple #iTunes #audiobook
0;8;me: "I can't facetime my friend, do you have any other apple products?" andy: "Ya, I have an apple in the fridge" *spits in Andys eye*;;
0;1;google’s japanese keyboard also has text emojis but apple ’s is better imo pic.twitter.com/M8Jj5onZs0;;
0;0;【iPhone Mania】「Huaweiが Apple を抜き、スマホ市場シェア2位を獲得」IDC予測 http:// ift.tt/2ig9aLs http:// ift.tt/2xJIR2l;;
0;0;[PSA] Apple Says 'KRACK' Wi-Fi Vulnerabilities Are Already Patched in iOS, macOS, watchOS, and ... https:// goo.gl/PefXiu;;
0;0;Convertimos Su Sitio Web En Aplicación Apple  Para Descargar En Appstore A,.. ··· https:// goo.gl/O0auUn . #USA;;#USA
0;1;LOL APPLE MUSIC ALWAys gets them wrong;;
0;0;Me gustó un video de @YouTube http:// youtu.be/sBsUbzhNEWQ?a Huawei Mate 10 humilla a Samsung y Apple durante su presentación;@YouTube;
0;0;Apple PayのSuicaで、EX予約専用ICカードとして利用可能に　10月23日から - ITmedia NEWS http://www. itmedia.co.jp/news/articles/ 1710/12/news117.html …;;
0;8;本日のパスワードが apple で｢ばなな｣の顔つきになった;;
0;0;Apple Responds to Senator's Request for Info on Face ID Privacy and Security http:// ift.tt/2ynw6z8;;
0;2;This is literal #fakenews . The Apple didn't fall far from the tree #MDPolitics #MDGov https:// twitter.com/wom_alley/stat us/920073064364339200 …;;#fakenews #MDPolitics #MDGov
0;0;Catch Niña Weijers at Green Apple Books (San Francisco) Monday and at Skylight Books (LA) Weds... http:// fb.me/2qtPldjg2;;
2;2;I remember when Gucci Mane Lemonade came out. Everybody became a sour apple bitter bitch https:// twitter.com/clearlyiconic/ status/919999006037741574 …;;
0;0;damn sis when they gone put “For Everybody” back on Apple Music ? @kashdoll;@kashdoll;
0;1;Catch Niña Weijers at Green Apple Books (San Francisco) Monday and at Skylight Books (LA)… http:// thenomadicjournal.com/2017/10/16/nor th-korea/ … pic.twitter.com/mW3ouBNdSb;;
0;5;Someone share a good apple music playlist with me please :)))));;
0;0;¿Por qué Amazon, Apple , Facebook, Microsoft y Google han tenido problemas para capturar a Hollywood? http:// nyti.ms/2gnTQw2 Via #nytimesES;;#nytimesES
0;0;#ApplePencil は体感してしまうと、すごく欲しくなる。描き心地は最高、ペンの持ち心地も驚くほど。強気の値段も体感してしまえば納得してしまう。 かといって、私はそこまでヘビー絵描きじゃないから、 Apple Pencilが使える #iPhone が出たら、それでいい。RT;;#ApplePencil #iPhone
0;0;But, still.;;
0;0;namnooj Hey! We're afraid this isn't possible, but you can try syncing your songs from Apple Music to iTunes. Chec… https:// twitter.com/i/web/status/9 20073984778964993 …;;
0;0;Apple Cider Floats for dessert! Thanks for the recipe @mywholelotoflov ! #gatherroundthetable … https://www. instagram.com/p/BaU_K8CFkIj/;@mywholelotoflov;#gatherroundthetable
0;0;おーはよ;;
0;0;Forever linked to Apple . Eli held his own last night I thought. May have gotten away w a PI.;;
0;0;Right; the picture shows a person in power taking advantage of an innocent victim. Apple and Oranges. Trump is a predator, plain and simple;;
0;0;ไมโครซอฟท์เผย แพตช์ช่องโหว่ Wi-Fi ใน Windows ตั้งแต่สัปดาห์ที่แล้ว, ฝั่ง Android/ Apple กำลังมา http:// ift.tt/2kVvRpi;;
0;1;Apple ordered to pay $440 million to FaceTime patent troll https:// goo.gl/3iB4gz;;
0;0;I spent 47 minutes working out with Apple Health. #LoseIt;;#LoseIt
0;1;ไมโครซอฟท์เผย แพตช์ช่องโหว่ Wi-Fi ใน Windows ตั้งแต่สัปดาห์ที่แล้ว, ฝั่ง Android/ Apple กำลังมา http:// ift.tt/2kVvRpi;;
0;0;Apple hit with $440M in damages in VirnetX patent lawsuit - CNET Judge issues final judgment in legal battle with … http:// ift.tt/2ym6zpX;;
0;0;Apple answers Sen. Al Franken’s privacy concerns over Face ID - CNET Apple responded to the Democrat’s concerns ov… http:// ift.tt/2gfC4Y9;;
0;0;Telegraph Pics: Apple 's head of diversity apologises for saying a group of 12 white men can be as diverse as a tea… http:// ift.tt/2xLYdZe pic.twitter.com/BDJLhR4ph7;;
0;0;Enter to win a new Apple Watch 2! http:// lockerdo.me/lch+1;;
0;0;Heh. Chrysanthemum Apple Cake, same.;;
0;0;「Huaweiが Apple を抜き、スマホ市場シェア2位を獲得」IDC予測 http:// ift.tt/2ig9aLs;;
0;0;it's a small one thank goodness :);;
0;0;There is video proof of the Chinese factories of these jerseys. If I see video of Apple factories being bad then I’d stop;;
0;0;Así como cuando #Apple decide lanzar su iRON MAN que versión de #iOS traerá? https://www. instagram.com/p/BaU_QvmAyVQ/;;#Apple #iOS
0;0;Genuine Used Apple 45W Macbook Air 11" 13" MagSafe2 Power Adapter Charger A1466 https://www. ebay.co.uk/i/253188740570 @eBay @AmazonUK @Gumtree @Shopify;@eBay @AmazonUK @Gumtree @Shopify;
0;0;Apple executive sorry for saying white people can be diverse: 'I regret the choice of words' http:// ceesty.com/w0XyAr pic.twitter.com/KlT41Gbcqc;;
0;0;Apple Says 'KRACK' Wi-Fi Vulnerabilities Are Already Patched in iOS, macOS, w... (3 users) http:// bit.ly/2goOu3A http:// b.hatena.ne.jp/entry/s/www.ma crumors.com/2017/10/16/krack-wifi-vulnerabilities-patched-apple-ios-macos/ …;;
0;0;WPA2の脆弱性「KRACK」対処パッチ、Microsoftは対応済み、 Apple のOSとAndroidは数週間中 http:// dlvr.it/Pw19Ds;;
0;0;Apple don’t fall far from the tree.....;;
0;0;Apple 、｢Xcode 9.0.1｣をリリース http:// dlvr.it/Pw18vL (via 気になる、記になる…);;
0;0;Cramer: The action in Apple 's stock is a lesson on buying into weakness - CNBC http:// dlvr.it/Pw18wV;;
0;0;Apple lidera las ganancias en el Dow #Jones : KeyBanc anticipa subidas... http:// tinyurl.com/yanf9m7p;;#Jones
0;0;Join us on Weds for a seminar on “ Apple Breeding 101” presented by Dr. Kate Evans. Free event at WVC from 4-5. pic.twitter.com/N89LMWMocm;;
0;0;This is BS @Apple , I’ve never had iMessage do this.;@Apple;
10;4;A bite of the Golden @Apple : Tech titan loses $440 million lawsuit https:// sptnkne.ws/fG3d #VirnetX pic.twitter.com/QCi3K0FHIz;@Apple;#VirnetX
0;0;No por nada empresas como Apple y Samsung han recurrido a estos grandes diseñadores industriales. http:// bit.ly/2ysbK5r;;
0;0;Jimmy Iovine Talks Founding Interscope Records, Apple Music & Selling Be... https:// youtu.be/8U8Iku1Ov2Q via @YouTube;@YouTube;
0;0;Apple Pay Cash Will Boost Apple Inc. Stock … With Time: One of the key features for iOS 11… https:// goo.gl/fb/QeHeL5;;
0;0;Apple MacBook Pro A1398 15.4" Laptop - ME293LL/A #October , 2013#http:// teczistecatl.flussstone.info/US/categories/ twt/?item=272890392614 …;;#October #http
0;0;Apple iPod nano 7th Generation Blue (16 GB) $72.00 via eBay http:// ift.tt/2gL2HEI;;
0;0;Apple iPod Nano | 7th Generation | Slate | 16GB (Latest Model) NEW $119.95 via eBay http:// ift.tt/2xLcEws;;
0;1;little apple -hair ponytail because of his current long hair... https:// twitter.com/lanaleiss/stat us/920073908468043777 …;;
0;0;Apple addresses SenFranken's Face ID security concerns http:// cnet.co/2godCrf pic.twitter.com/bK7kSC9xVU;;
0;1;My mom thought it would be funny to delete me off of our Apple Music account, now I have no music in my library, thanks again mom.;;
0;4;Anyone else have a crush on the girl from the apple portrait lighting commerical... DWIGHT;;
0;2;And I'm honoured to be your cinnamon apple but who's is Michaela's;;
0;0;I don't get to listen to crying in the club as often as I like since Apple Music deleted it from my library & still hasn't given it back :(;;
1;3;Great take by @settern on smartwatch sizes: https:// m.imore.com/apple-gets-it- right-why-android-wear-sucks-for-women … (I wear a 38mm Apple Watch now and love the smaller size.);@settern;
0;1;ANOTHER iOS update? Really, @Apple ?! #iOS11 pic.twitter.com/WwAhnGLVph;@Apple;#iOS11
0;0;gotta get that apple and cinnamon oatmeal fym;;
0;0;Apple 's head of diversity apologises for saying a group of 12 white men can be as diverse as a team with women http://www. telegraph.co.uk/news/2017/10/1 7/apples-head-diversity-apologises-saying-group-12-white-men-can/?WT.mc_id=tmg_share_tw …;;
1;0;#iPhoneUpdate | Apple 's iPhone X Worship Hides A Secret Truth - Forbes;;#iPhoneUpdate
1;0;Top 5 most useful Android free apps [ 2017 ] has been published on Latest News on Apple products Latest ... - http:// appleseek.com/top-5-most-use ful-android-free-apps-2017/ … pic.twitter.com/jeMMCBI96B;;
0;0;Apple 's head of diversity apologises for saying a group of 12 white men can be as diverse as a team with women and… http://www. telegraph.co.uk/news/2017/10/1 7/apples-head-diversity-apologises-saying-group-12-white-men-can/ …;;
0;0;【歡喜第一等演唱會】 Apple 邱詩凌 - 再會啦心愛的無緣的人: http:// youtu.be/_cBlBAXfYY8?a via @YouTube;@YouTube;
0;0;I think they let Fiona Apple name that album.;;
0;0;Or were you in need of a different kind of help?;;
0;0;Listen to Selena Gomez: Next Steps by Apple Music Pop on #AppleMusic . https:// itunes.apple.com/mx/playlist/se lena-gomez-next-steps/idpl.d9d329bbccfe44f0866f73399bea1342?l=en …;;#AppleMusic
0;0;SpotifyCares: namnooj Hey! We're afraid this isn't possible, but you can try syncing your songs from Apple Music t… https:// twitter.com/i/web/status/9 20073984778964993 …;;
0;1;2m Genuine Apple iPhone 6 6S 7 Plus 5S iPad Lightning Sync Charger USB Cable https://www. ebay.co.uk/i/253139983468 @eBay @Gumtree @Shopify @AmazonUK;@eBay @Gumtree @Shopify @AmazonUK;
0;0;[question] iPhone 6, 10.2.1 Jailbroken, Apple File Conduit 2 works, but no tweaks work or show up in settings. Why… http:// ift.tt/2yqC3Zy;;
0;0;How Apple Says It Prevented Face ID From Being Racist pic.twitter.com/MOnWbwdNgN;;
4;7;Apple : prepare your customers for the inevitable EMP attacks by developing iCan and iString phones.;;
0;0;Honestly our Apple Music accounts have to be exactly the same;;
0;0;ไมโครซอฟท์เผย แพตช์ช่องโหว่ Wi-Fi ใน Windows ตั้งแต่สัปดาห์ที่แล้ว, ฝั่ง Android/ Apple กำลังมา http:// j.mp/2gKQ5xr #itnews #cybernews …;;#itnews #cybernews
0;0;そうなんですかww Apple って確かアメリカ産ですよね;;
0;0;まぁ正直この辺りの対応速度についてはAppleには1ミリも期待してない…;;
0;0;Lowkey u right, @Apple y'all hearing this for your next update???!;@Apple;
0;0;Protectionism against People,Banks,Central Banks Treasuries,Currencies&Economies-WHGagOrder=deceptive forced destablizing complacency= Last;;
0;0;I guess my dinner is going to be this Honeycrisp Apple the size of a baby’s head.;;
0;1;Apple iphone 6/6S ultra thin magnetic sett ring back cover. Available Now- http://www. shopkartindia.com pic.twitter.com/ChZaLcJzh7;;
0;0;Dropped my phone in the toilet, I had a panic attack, a late IG post and we survived. Bravo @Apple;@Apple;
0;3;That $50 that just dipped out of my account for • Apple Music • Netflix • Planet Fitness • TIDAL & • Hulu though;;
0;0;てか、色々聞いた 山猿って人めっちゃいい。なんかいい歌ばっかりやった笑 http:// Mrs.GREEN APPLE もいい歌。歌ってる人たちかっこいい笑;;
0;1;おはよーさん 大食いの息子もいりませんか？;;
0;0;Apple iPhone 7 Plus 32GB Gold Smartphone for T-Mobile MNQK2LL/A 5.5" Display NEW http:// ameretat.firefeuer.info/US/categories/ twt/?item=272890388846 …;;
0;0;Need something tasty for breakfast? You can’t go wrong with these Delicious Apple Cinnamon Breakfast #recipes ! http:// buff.ly/2lkmCdn pic.twitter.com/mHDdf39QPO;;#recipes
2;0;Green Apple Lip Balm, Handmade Lip Balm, Lip Butter, Tinted … http:// etsy.me/2tDtLv1 #craftshout #GreenAppleLipBalm pic.twitter.com/T8LTUz19QA;;#craftshout #GreenAppleLipBalm
0;1;SEBASTIAN OLZANSKI // BEEN STANNIN SINCE 2014-2015 “sebsters are my cinnamon apple ” god i love it when he speaks Spanish SEXTAPEOLZANSKI pic.twitter.com/VO9zQyMjcE;;
0;0;조아ㅠㅠ 우리 닉주디 촬영 했을때가 마지막이었나,,?;;
0;0;Apple Responds to Senator’s Request for Info on Face ID Privacy and Security http:// ift.tt/2hKyMwe #infosec;;#infosec
1;3;Apple Music shuffle is so ass it’ll have me listening to the same songs every single day;;
0;1;SAME WTF IS THIS;;
0;0;@kevandbenedict question do I need to be on an apple device to access your podcast?;@kevandbenedict;
0;0;四字熟語を勉強するのに便利 https:// itunes.apple.com/jp/app/yokuwak aru-si-zi-shu-yutoreningu/id747686885?mt=8 … #iphone #app #apple #四字熟語;;#iphone #app #apple #
0;0;1m Genuine Apple iPhone 6 6S 7 Plus 5S iPad Lightning Sync Charger USB Cable https://www. ebay.co.uk/i/253139986865 @eBay @AmazonUK @Shopify @Gumtree;@eBay @AmazonUK @Shopify @Gumtree;
0;1;why Apple Music cuts out Gucci sayin “all these chains on me”;;
0;2;Why would Apple even care about it. Apple ‘s business is products - hardware and software.;;
0;0;¡Consigue un pack de productos de Apple ! ¡Participa ahora con #SorteosAppMiVodafone y llévatelo! http:// bit.ly/PackAppleVF;;#SorteosAppMiVodafone
0;0;@Apple why almost everyone's Iphone having system problems? why you guys tryna force people to buy the newer phone. that shit is too much $$;@Apple;
0;3;Yo @Apple y'all need to create a search bar inside of the message thread because I can't be scrolling like this all the time https:// twitter.com/jacob_310/stat us/920073070429138944 …;@Apple;
0;0;@chottoland_nhn 普通ただ大型アプデしただけでは新規は増えないが、わざわざタイトルを変えて記事に乗せてもらったお陰でチェンクロ3はAppleの無料ランキングで上位に入った。 ユーザーを増やすにはこのやり方がいいと思う。本当に終わってほしくないので頑張って下さい。;@chottoland_nhn;
0;0;Huawei aims to challenge Apple and Samsung on technology as well as price http://www. newssummedup.com/a/yf7tgg;;
0;0;Adam's Apple Wish List for the tea drinking it as knives and bombs.;;
0;0;Well no more hugs for dingo then;;
0;0;1gの重量を減らすために技術者が苦心した携帯電話に女子高生は50cmのぬいぐるみをぶら下げるしそれを笑うギークがAppleのエンジニアが試行錯誤を重ねて生まれた美しいデザインのMacBookにステッカーをべたべた貼るから結局人類はお互いのことを理解出来ないまま皆死ぬ;;
0;0;Report: Apple entered deep acquisition talks w/ health clinic startup as it mulls entry into primary care https:// 9to5mac.com/2017/10/16/rep ort-apple-primary-care-deal/ … #tech;;#tech
0;0;Apple 's head of diversity apologises for saying a group of 12 white men can be as diverse as a team with women and… http:// bit.ly/2gLCtC4;;
0;0;Apple Watch Series 1 38mm Aluminum Case Black Sport Band - (MP022LL/A) $150.00 via eBay http:// ift.tt/2yt6JuS;;
0;0;Apple Watch Series 2 42mm Stainless Steel with $400 in Apple Bands & AppleCare+ $499.99 via eBay http:// ift.tt/2gp4hzt;;
0;0;コンサートの時に便利！！　スーパーライト君 https:// itunes.apple.com/jp/app/suparai to-jun/id656703189?l=ja&ls=1&mt=8 … #iphone #app #apple;;#iphone #app #apple
0;0;TE REGALO UN IPHONE X Y UN APPLE WATCH SERIE 3!! SORTEO INTERNACIONAL I ... https:// youtu.be/KjynOKg6Zbg #VeroRestrepoMeRegalaUnIphoneX;;#VeroRestrepoMeRegalaUnIphoneX
0;0;Got my phone fixed n they had a restore it now I can’t get back in my Apple Music I’m upset;;
2;6;Was getting restless during my flight so I built something. Introducing, the Apple Music webapp! #applemusic #webdev #ux #javascript #css pic.twitter.com/QCcDJP2BEC;;#applemusic #webdev #ux #javascript #css
0;0;mano esse ios ta dando umas travadas monstras parabens @apple pela BOSTA BOSTA BOSTA;@apple;
0;0;Huawei Mate 10 humilla a Samsung y Apple durante su presentación https:// youtu.be/sBsUbzhNEWQ vía @YouTube;@YouTube;
0;0;Mm hot apple cider;;
0;0;Apple Responds to Senator's Request for Info on Face ID Privacy and Security http:// fb.me/3ikbi1PrS;;
0;0;WPA2とAESのみの組み合わせでも駄目なものは駄目なのね NECさん Apple さんアップデートおなしゃす;;
0;0;４桁までの、足し算、引き算、かけ算を暗算で考えるアプリです。 https:// itunes.apple.com/jp/app/hitasur a-ji-suantoreningu/id776807895?mt=8 … #iphone #app #apple;;#iphone #app #apple
0;0;Apple 's head of diversity apologises for saying a group of 12 white men can be as diverse as a team with women and… http://www. telegraph.co.uk/news/2017/10/1 7/apples-head-diversity-apologises-saying-group-12-white-men-can/ …;;
0;0;iPhone8在庫アリ(●´艸`)ﾑﾌﾌ 当日お渡し可能です!! #札幌 #au #MNP #iPhone #格安 #無料 #中央区 #新規 #機種変更 #iPhone #Apple;;# #au #MNP #iPhone # # # # # #iPhone #Apple
0;0;Hey! We're afraid this isn't possible, but you can try syncing your songs from Apple Music to iTunes. Check out: http:// spoti.fi/1V33T5A /RK;;
0;0;5択暗算の解き方にはパターンがある https:// itunes.apple.com/jp/app/web-cab -spi-hitasura5ze-suantoreningu/id871692322?mt=8 … #iphone #app #apple;;#iphone #app #apple
0;0;無料アプリ　ひたすら９９トレーニング https:// itunes.apple.com/jp/app/hitasur a99toreningu/id894069966?l=ja&ls=1&mt=8 … #iphone #app #apple;;#iphone #app #apple
0;0;Apple Says 'KRACK' Wi-Fi Vulnerabilities Are Already Patched in iOS, macOS, watchOS, and tvOS Betas https://www. macrumors.com/2017/10/16/kra ck-wifi-vulnerabilities-patched-apple-ios-macos/amp/ …;;
0;0;Bos Apple Kikuk Saat iPhone X Melorot dari Celana http:// fb.me/XnTArmbY;;
0;9;Every time you go to apple pic.twitter.com/E1KxTTezab;;
0;1;Cool, self-driving cars! But household laundry is still a multistage process involving bulky, loud machines. I want my iWash. When, #Apple ?;;#Apple
1;0;Apple . An android is an unknown quality; it might kill you. But we all know how hot it is having an apple up our arse.;;
0;0;Apple iPad Air 2 128GB, Wi-Fi only, 9.7in iOS 10.1.1 http:// ift.tt/2yP0AKX #iPadAir;;#iPadAir
1;2;Bos Apple Kikuk Saat iPhone X Melorot dari Celana http:// dlvr.it/Pw18lk pic.twitter.com/qQkFDu3P8V;;
0;0;I just bought a new insurance policy and updated my Apple ID from my college email address. That’s enough adulting for tonight.;;
4;4;Apple Considered Buying Medical Startup Crossover Health http:// sunnyhoi.blog/Pw18Yg #Tech #Apple pic.twitter.com/v8PzHA6hmT;;#Tech #Apple
0;0;WPA2の脆弱性「KRACK」対処パッチ、Microsoftは対応済み、 Apple のOSとAndroidは数週間中 - ITmedia NEWS http://www. itmedia.co.jp/news/articles/ 1710/17/news044.html …;;
0;2;Sois grandes. Seguir así y Apple os tendrá mucho miedo. Gracias por un encuentro impresionante #LiderazgoCanalla;;#LiderazgoCanalla
0;0;#Apple podría reemplazar la función Touch ID por Face ID en el 2018 http:// bit.ly/2gJg0FZ pic.twitter.com/9vflRDV1ZO;;#Apple
0;1;#Apple Might Have Patched KRACK Vulnerability In Latest Betas https:// goo.gl/fb/sMFoas #gadget #cellphones #computers;;#Apple #gadget #cellphones #computers
0;0;Apple hit with $440M in damages in VirnetX patent lawsuit - CNET: Judge issues final judgment in legal battle… http:// dlvr.it/Pw18Kk #NEWS;;#NEWS
0;1;Carmel apple;;
2;8;Apple has considered an expansion into health care clinics https://www. cnbc.com/amp/2017/10/16 /apple-considered-acquisition-of-crossover-health-part-of-health-push.html …;;
0;1;りんごちゃんは筆圧ゴリラというよりは圧倒的に描きまくってるイメージ╰(*´︶`*)╯♡;;
0;0;Huawei Mate 10 humilla a Samsung y Apple durante su presentación https:// youtu.be/sBsUbzhNEWQ vía @YouTube;@YouTube;
0;2;kirei's adam's apple Tasy;;
0;0;「 Apple Pencil」対応の新型iPhone、2019年にも登場？ (ギズモード・ジャパン) - LINEアカウントメディア http:// news.line.me/issue/oa-gizmo do/6d59a2f14d25?utm_source=Twitter&utm_medium=share&utm_campaign=none&share_id=GXj08197651706 … #linenews @news_line_me さんから;@news_line_me;#linenews
