retweets;favorites;text;mentions;hashtags
0;0;@Myloc How Apple could become a $1 #in http:// feedproxy.google.com/~r/Techcrunch/ ~3/Z4i4HJF2UAA/ … (Automatically sent using IFTTT);@Myloc;#in
0;0;¡Consigue un pack de productos de Apple ! ¡Participa ahora con #SorteosAppMiVodafone y llévatelo! http:// bit.ly/PackAppleVF;;#SorteosAppMiVodafone
0;0;i had to make a new zealand apple id and download it from there;;
0;0;How I cancel my old Apple Music?;;
0;0;Report: Apple entered deep acquisition talks w/ health clinic startup as it mulls entry… http:// iphoneparadise.com/2017/10/16/rep ort-apple-entered-deep-acquisition-talks-w-health-clinic-startup-as-it-mulls-entry-into-primary-care/ … pic.twitter.com/johQIprUoI;;
0;0;[He licks sugar off his lips, nodding.] Yeah, it's more like a spice flavor? I guess that's why it's apple cider donuts.;;
1;4;Recensioni a @movesapp su #AppStore : “ho un apple ”. Ma non mi dire pic.twitter.com/5e0KteehRx;@movesapp;#AppStore
0;1;Тут в протоколе безопасности WPA2 Wi-Fi обнаружили уязвимость. По словам Apple она была закрыта в последних бетах iOS и macOS pic.twitter.com/EeWGJ23btH;;
0;0;My iMac has gone black. It's under a year old. I cannot get it to load back on. #Apple has seriously weakened since #stevejobs passed pic.twitter.com/k8ZFGNLW49;;#Apple #stevejobs
0;0;i made a new zealand apple id hahahaha;;
0;0;PlexPy (ChrisAyers-PC) alexisbushong ( Apple TV) started playing Modern Family - Summer Lovin'.;;
0;0;Apple iPod nano 2nd Generation Black 8 GB Model A1199 $22.99 via eBay http:// ift.tt/2ysYjDU;;
0;0;Apple iPod Touch 1st Generation 8GB A1213 $18.99 via eBay http:// ift.tt/2xJEODp;;
0;1;Mostly big multinational tech companies: Microsoft, Apple , Google and the like.;;
0;0;Apple 's head of diversity apologises for saying a group of 12 white men can be as diverse as a team with women and… https:// goo.gl/fb/BXQjVR;;
0;0;I hate apple now;;
0;0;１番仲の良いランキング 1位 @ApHelloapril 2位 @hinaringo_ apple 3位 @Serephi_TERA みんなも診断♫ → http:// fr.ifav.jp pic.twitter.com/C4qZSccgHX;@ApHelloapril @hinaringo_ @Serephi_TERA;
0;0;Apple выпустила рекордно мало iPhone X http:// balticvoice.ru/strana-i-mir/4 1916 …;;
0;0;Crown apple ....;;
0;3;These Apple employees are;;
0;0;Apple Juice;;
0;0;Apple выпустила рекордно мало iPhone X Первая партия iPhone X отправлена поставщикам. Она насчитывает всего 46,5... http:// fb.me/1uDE4tGlG;;
0;0;Apple serait en partenariat avec LG Display pour un iPhone pliable http:// ift.tt/2yNKgdg;;
0;0;Apple et les banques portent Wall Street à des records http:// ift.tt/2hJRNPg;;
3;3;I am deeply in love with hot apple cider;;
0;0;Apple slapped with $440m patent bill in VirnetX FaceTime spat http:// dlvr.it/Pw1CwF pic.twitter.com/U45x81ODjU;;
0;0;PlexPy (ChrisAyers-PC) devandaar ( Apple TV) started playing Brooklyn Nine-Nine - Unsolvable.;;
0;0;Insight Report: The Future of Apple Pay – Current and Future Status http:// dlvr.it/Pw1CyV;;
0;0;Apple answers Sen. Al Franken’s privacy concerns over Face ID - CNET http:// ceesty.com/w0XiVM pic.twitter.com/v2CYQOY1Nf;;
0;0;Insight Report: The Future of Apple Pay – Current and Future Status http:// dlvr.it/Pw1CvD;;
0;0;Insight Report: The Future of Apple Pay – Current and Future Status http:// dlvr.it/Pw1Ctt;;
0;0;Insight Report: The Future of Apple Pay – Current and Future Status http:// dlvr.it/Pw1Csb;;
0;0;Insight Report: The Future of Apple Pay – Current and Future Status http:// dlvr.it/Pw1CsX;;
0;0;Insight Report: The Future of Apple Pay – Current and Future Status http:// dlvr.it/Pw1Cqz;;
0;0;Insight Report: The Future of Apple Pay – Current and Future Status http:// dlvr.it/Pw1Cpf;;
0;0;Insight Report: The Future of Apple Pay – Current and Future Status http:// dlvr.it/Pw1Cny;;
0;0;Exato, Luska. Povo acha que Apple é só iPhone. Aí sai falando essas coisas. Normal.;;
0;0;Minha escolha Red Apple Earrings em minha última visita ao Starplaza! http://www. stardoll.com/in/?pid=25720& gid=1&turl=%2Fuser%2F%3Fid%3D432629015 …;;
0;3;やったぁᐠ( ˆ࿀ˆ )ᐟぽこみちさん参加;;
0;2;Your Expert Guide To Apple Cider Vinegar https:// buff.ly/2yn8niw pic.twitter.com/BToJ2bu2FQ;;
0;0;Cedars-Sinai、 Apple Watchでデジタルインタラクティブアプリケーションを提供 http:// mhealthwatch.jp/global/news201 71017 … @mHealthWatchJp さんから;@mHealthWatchJp;
0;1;というか自分、サボっていたもんで釣りやってなかったort リヴァイアいないから風属性でいってきます;;
0;0;おはやう;;
0;0;if you have iOS 11 you can pull down on the home screen but the other iOS has it when you slide all the way to the right pic.twitter.com/7jjnrengOi;;
0;0;Apple Storeでも販売している、かの有名な「Beats」のヘッドホンやスピーカー。 電話問い合わせの時はAppleCareテクニカルサポートセンターでは対応できないので注意！;;
0;0;Apple MacBook Pro9,2 MD101LL/A i5@2.50GHz,4GB RAM,500GB HDD DVDRW 13″ 2012 http:// applejoyride.com/?p=286999;@2;
0;0;i never said apple meat. that wasn't me.;;
0;0;Apple extiende sus pruebas internas de Apple Pay Cash a los empleados de sus tiendas http://www. iosmovil.net/apple-extiende -sus-pruebas-internas-de-apple-pay-cash-a-los-empleados-de-sus-tiendas/ … pic.twitter.com/IhhGgcw2hL;;
0;0;[exblog] 多彩でお得 Apple Store 外付けハードドライブ、G-DRIVE USB-C mobile http:// cuoreverde.exblog.jp/28225025/;;
0;0;fuck apple .;;
0;0;Apple cider is the bomb diggity;;
1;9;#Qualcomm подал в суд на #Apple , из-за нарушения патентов и требует запретить производство и продажи iPhone в Китае.;;#Qualcomm #Apple
0;0;Apple hit with $440M in damages in VirnetX patent lawsuit - CNET https:// goo.gl/fb/TVqevd;;
0;0;Apple answers Sen. Al Franken’s privacy concerns over Face ID - CNET https:// goo.gl/fb/rLdT8E;;
0;1;Apple foray into content is a mistake IMO (curation is ok). Focus on computing. Still no Macs in big enterprise. https:// twitter.com/JonyIveParody/ status/919943829599420416 …;;
0;0;Huawei Aims to Challenge Apple and Samsung on Technology as Well as Price http:// ift.tt/2yrXNpK;;
0;0;Apple 's diversity VP apologizes for controversial statement at summit this week http:// ift.tt/2iaCZgG;;
1;1;Is Nicci supposed to be pronounced like Gucci? Am I out of the know about this new trendy baby name a la Apple ?;;
0;2;meu fone da apple ta muito baixo que ódio do caralho quero matar alguém;;
0;2;my friend carlo got all of that plus a plate of apple pie i hate him;;
0;0;welp.. after the 13th thousand update from Apple since this iPhone 8.. my phone is working a little more decent;;
0;0;Apple Says 'KRACK' Wi-Fi Vulnerabilities Are Already Patched in iOS, macOS, watchOS, and tvOS Betas - Mac Rumors http:// ift.tt/2gJpQaT;;
0;2;Come on sedar la sikit Malaysia bukan first wave pun in receiving new iPhones from Apple . That speaks volumes about our purchasing power.;;
0;2;This update is literal trash lmao Apple wyd smh;;
0;0;One thing common with an apple and a 5K a day because they both keep the doctor away. When I… https://www. instagram.com/p/BaVAMQiBFfq/;;
0;0;【速報】新型「iPad Pro」4月4日に発表か。ベゼルレスになるもよう - 慣例通りであれば、3月におこなわれていたAppleの発表会。今年はどうやら4月となり、そこでは新型の｢iPad... http:// tinyurl.com/y74hwgt6;;
0;2;Put cinnamon with the apple sauce. Makes it delicious;;
0;0;If you were hiding criminals embezzling 10's & 100's of Billions from my foreign Country through $ BRKA #NYSE I wouldn't pay you either USG;;#NYSE
0;1;"I WAS TOLD BY APPLE CARE THAT COPYRIGHTING A COMMON ACTION WAS PERFECTLY ACCEPTABLE";;
0;3;My life is significantly worse without Apple Music;;
0;0;No dejo de ver en Apple las funciones que tiene el iPhone x cada vez queda menos para tenerte en mis brazos;;
1;3;Bayview Farm & Garden's 17th Annual Apple Day is coming up! Look out for fresh baked apple pastries, cider,... http:// fb.me/L0cqEWB2;;
0;0;PlexPy (ChrisAyers-PC) alexisbushong ( Apple TV) has stopped O.J.: Made in America - Part One.;;
0;4;Oh no, I’m stuck in apple store hell – bei Apple Store, Grand Central;;
0;0;Apple sem dúvidas é melhor né;;
0;0;Apple Music ain’t protect my Patek it’s sound low.;;
0;0;Apple releases third iOS 11.1, watchOS 4.1, and tvOS 11.1 betas [U] https:// buff.ly/2xJJgSu;;
0;0;Dishonesty still rules. There is ALWAYS a bad apple You discover it after the damage is done. There is no fair punishment for this crime.;;
2;6;at least its not the apple juice pic.twitter.com/n2PRvJl0X9;;
0;0;Wow Apple fixed 3D Touch stutter on iOS 11.1 beta 3 well done @Apple;@Apple;
0;2;Oooo. Gotta do something with an apple slice in that case!;;
8;2;Apple Daily investigation: Development Under Secretary's inherited farmland includes several illegal structures http:// hk.apple.nextmedia.com/realtime/news/ 20171017/57340566 …;;
1;1;Steve was probably turning over in his grave when Apple made these dumb USB headphones.;;
0;0;ん？iOS 11でCSSフォントファミリの- apple -systemに日本語も入るようになったの？;;
0;1;Time for a new phone you know how apple products act when the new stuff come out https:// twitter.com/_marcooo22/sta tus/919765160914386946 …;;
0;0;someone buy me a apple watch;;
0;0;Não sei se pego um moto g5 ou um apple;;
0;1;;;
0;0;#SmallBiz #News ; http:// techstep.co / --- Apple Considered Buying Medical Startup Crossover Health - Fortune pic.twitter.com/TN9kRlkpHR;;#SmallBiz #News
0;0;Actually obsessed with all things apple;;
0;3;Steph's lady cooked him gluten free pancakes and chicken apple sausage this morning. You'll need to do much better. https:// twitter.com/miakhalifa/sta tus/920056906344890370 …;;
0;10;アップルウォッチすげーな 2年前に買ったApple Watchに命を救われた男性 - LINE NEWS http:// news.line.me/issue/internet s/d1d6165fc00d?utm_source=Twitter&utm_medium=share&utm_campaign=none&share_id=uMm08198205540 … #linenews @news_line_me さんから;@news_line_me;#linenews
0;0;iPhoneのイヤホンジャックなくなって不便だなと思ってたけど、 これたぶん、 「いい加減Bluetoothにしなさいよ」 っていう Apple からのメッセージだよね。;;
0;0;PlexPy (ChrisAyers-PC) alexisbushong ( Apple TV) started playing O.J.: Made in America - Part One.;;
0;0;RIP Mr. Lahey @johndunsworth "The shit apple doesn't fall far from the shit tree" - Mr.Lahey #TrailerParkBoys pic.twitter.com/D8zr0k9t32;@johndunsworth;#TrailerParkBoys
0;0;亀頭痛いから無理;;
0;0;Also, the columnist named Amazon, Apple , Facebook, Microsoft, and Alphabet the “Frightful Five”;;
0;0;Cramer: The action in Apple 's stock is a lesson on buying into weakness - CNBC http:// dlvr.it/Pw1Cdc;;
0;0;How Apple Says It Prevented Face ID From Being Racist - Gizmodo http:// dlvr.it/Pw1Cdq #AppleNews;;#AppleNews
0;0;Apple iPad 1st Gen A1219 9.7in 16GB Black WiFi MC577LL/A – Minor Cosmetic: Item specifics… https:// goo.gl/fb/1Gze98;;
0;0;Apple 's healthcare ambitions beyond the Watch https:// goo.gl/fb/GqXnsa;;
0;4;A socialist tech podcast about how Apple is a blood soaked capitalist devil but also ios11 is pretty great.;;
0;1;Best Buy got 6ft 2mm Apple brand lightning cables for $23 . 3ft 1mm’s are $21. Thank me later;;
0;0;Apple must pay $439.7 million for patent infringement; appeal coming http:// ift.tt/2yNUhHw;;
0;0;ほーい、おはあり～;;
0;0;So glad George isn’t this way....I did have him as my Apple Watch background tho for a min lol https:// twitter.com/_aimeecheng/st atus/918869215708246016 …;;
0;1;ios11以前と以降での、- apple -systemの表示 https:// qiita.com/a_t/items/1869 3be11bd87f98d212 …;;
0;0;#TaeyeonFact Favorite Fruits : Orange, Apple , Strawberry, Tomato;;#TaeyeonFact
0;0;Fuck the pumpkin patch and taking cute pictures, I just go for the apple cider donuts;;
0;0;"Beware of sketchy iOS popups that want your Apple ID" https:// arstechnica.com/information-te chnology/2017/10/beware-of-sketchy-ios-popups-that-want-your-apple-id/?amp=1 … #tech #feedly;;#tech #feedly
0;3;Hot apple cider and watching The Nightmare Before Christmas;;
0;0;Apple ta llevó sus primeras unidades del iPhone X a Europa. Ya falta menos;;
1;2;An apple cider and gin cocktail? Yeah, fall just might be our favorite season. #GinCocktails http:// bit.ly/2ysF1OI;;#GinCocktails
0;0;Wie will #Pegida die Globalisierung durch Google, Daimler, Nestlé, Apple , Goldman-Sachs, etc. verhindern? Durch nationalisieren der Kunden?;;#Pegida
0;0;El Apple TV con tvOS 11 y tus AirPods se llevan cada vez mejor http://www. iosmovil.net/el-apple-tv-co n-tvos-11-y-tus-airpods-se-llevan-cada-vez-mejor/ … pic.twitter.com/lJM2BYCXXK;;
0;1;Buy one and become an apple fan like me;;
0;2;She sure is the Apple doesn't fall far from the tree;;
0;0;Nako ampagsakirindot aba meron ka din namang makakadate, apple;;
4;3;Apple slapped with $440m patent bill in VirnetX FaceTime spat http:// reg.cx/2v8G;;
0;0;Apple slapped with $440m patent bill in VirnetX FaceTime spat http:// reg.cx/2v8G;;
0;0;Apple 's iPhone X Worship Hides A Secret Truth http:// ift.tt/2igGXnU #Finance #Investments #ROIMentor;;#Finance #Investments #ROIMentor
0;2;anyways are stray kids on apple music yet hellevator is the best thing ive seen from tht company;;
0;0;あー Apple Watch 付け忘れた〜;;
0;0;今日立ってるだけで基本暇だろうから Apple Watchにtwitterの通知来させて暇をしのごう作戦なんだけど誰通知取ろう.....;;
0;1;ProParagraph Web Volume 3 #FCPX #VideoEditor #VideoEditing #filmmaking #FinalCutProX #apple https:// vimeo.com/234559776;;#FCPX #VideoEditor #VideoEditing #filmmaking #FinalCutProX #apple
0;0;#Japan #Japantravel #travel Japanese iPhone Apple Pay http:// bit.ly/2wPvAKk;;#Japan #Japantravel #travel
0;0;Yup, my 5S is not near as fast with the new update. Perfectly good phone but Apple cycles older tech out too soon. https:// twitter.com/mrsilverscott/ status/920026966811598848 …;;
0;0;eBay - 20% Off Apple iPhone 8 & 8 Plus: iPhone 8 64GB $861.6; iPhone 8 256GB $1134.2; iPhone 8 Plus 64GB $1054.4;… http:// dlvr.it/Pw1C1v pic.twitter.com/Ia2QSic2qz;;
0;1;ワカルw hage…その単語を久しぶりに聞いたw 不思議なダンジョンシリーズも好きでやっているのですが、それも他人の不幸がおかしいんで動画あったら是非見てみてくださいw 深層階で強雑魚に囲まれたり、トラップで死亡とかフイテしまいますw;;
0;0;Insight Report: The Future of Apple Pay – Current and Future Status http:// dlvr.it/Pw1C1W;;
0;0;Apple Considered Buying Medical Startup Crossover Health - Fortune http:// dlvr.it/Pw1Bwn;;
0;0;Insight Report: The Future of Apple Pay – Current and Future Status http:// dlvr.it/Pw1C18;;
0;0;Insight Report: The Future of Apple Pay – Current and Future Status http:// dlvr.it/Pw1C17;;
0;0;Alexander the Great sent samples of dwarf apple trees to Aristotle's Lyceum;;
0;0;New iPhone X Surprises Reveal Apple 's Flawed Vision http:// bit.ly/2ztNpMj by @ewan via @Forbes pic.twitter.com/3ySd7iU3JT;@ewan @Forbes;
0;1;Apple cider vinegar just upsets me bc it's so nasty but so good for you;;
1;0;I'm trying to hit up Apple bee's Friday for them $1 margaritas;;
0;1;sensacional como coisa da Apple insiste em dar merda comigo;;
0;0;i was like making out w my apple lmaoooo;;
0;0;Inside Apple 's futuristic new Silicon Valley headquarters | New York Post http:// ref.gl/zzl8KFK8;;
0;0;and don't try to DM me like last time if you not gonna drop a new phone in the mail bc i'm sick of this shit. my phone damn near unusable.;;
0;0;but teach the history, they "say the best words" but leave their religion as an arrow goes through an apple . the arrow's path is "Islamic";;
0;0;マットアップルグリーン。ほとんどの方が艶ありを選択される中、今回は艶なしをご選択頂きました。剥がせば元通りだから気軽に遊べます♪ #macwraps #apple http:// mwraps.com pic.twitter.com/cAFdga5G6S;;#macwraps #apple
0;2;Assuming there are #DTC #HC opps/apps - pretty sure Apple would focus on high-end/luxury tier of that & not the Walmart/Amazon tier - right?;;#DTC #HC
0;0;@goabode any plans on integration with Apple #HomeKit ?;@goabode;#HomeKit
0;0;"How dare U put any importance on diversity of thought!! We only care about skin color and gender! Apologize!" - @Apple;@Apple;
0;0;Cool that Apple podcasts got rid of the “mark as played” function that I literally use every day.;;
0;0;Fast alternate #music #guitar #pablushansen #shred #recording #apple #logicprox #espguitars … https://www. instagram.com/p/BaU_diRHSzQ/;;#music #guitar #pablushansen #shred #recording #apple #logicprox #espguitars
0;4;FoodsI students made Apple Crisp to reinforce MANY of our cooking, mixing, and measuring terms. They had to slice,core, melt, peel,melt, etc pic.twitter.com/cKgjei840n;;
0;0;Apple iPhone X Took Years to Develop—and Its Just the Beginning http:// fortune.com/2017/10/14/app le-iphone-x-news-2/ …;;
0;0;Apple Considered Buying Medical Startup Crossover Health - Fortune http:// ift.tt/2gKfKpU;;
0;0;I am literally fresh from an apple tasting, & the buzz was all about the SweeTango!;;
0;0;Recuperar o ID Apple é um cu!!;;
0;0;Apple Responds to Senator’s Request for Info on Face ID Privacy and Security http:// aluvicro.com/apple-responds -to-senators-request-for-info-on-face-id-privacy-and-security/ … pic.twitter.com/eJbFGbTHzI;;
0;3;Apple Music邦楽の守備範囲狭過ぎる ミスチルないくせになんでエロゲソング豊富なんだよ笑う;;
0;1;sigma apple pi;;
0;0;#Apple #终于修复了便携访问时无法在状态栏下拉通知中心的bug ​ http:// ift.tt/2ytKeX0 (via Weibo http:// ift.tt/2gnsuWz );;#Apple #
0;0;Qualcomm Extends Legal Battle With Apple And The iPhone To China http:// zpr.io/ng5xV pic.twitter.com/BbNDADjDbT;;
0;0;I was on the 11.0.0 and I updated to the 11.0.3 software.. yes, I do have the monthly membership with Apple Music;;
0;1;Hello, @Apple , my Live Photo won’t turn off in iMessage. It’s really annoying and I’ve tried everything.;@Apple;
0;0;Apple の「グキッっと折れるスマホ特許」見つかる。製品登場もありうる ... - ギズモード・ジャパン http:// ift.tt/2ym1jT5 #Apple;;#Apple
0;0;Apple произведут столько телефонов, сколько будет нужно. Не жуйте сопли раньше времени. Ждите официальной даты продаж;;
0;0;Apple TV 3rd Generation Digital HD Media Streamer A1469 $34.99 via eBay http:// ift.tt/2xLBPzf;;
0;2;Listen to ＢＹＥ ＢＹＥ (Available on Spotify, Apple Music, and Tidal) by SPEECHLESS #np on #SoundCloud https:// soundcloud.com/speechlesss/b- y-e-b-y-e …;;#np #SoundCloud
0;1;Told ya I'm not always Apple -negative! :);;
0;0;Damn Apple Music. Stop playing Britney when I’m trying to be listen to depressing music;;
0;0;Me ha gustado un vídeo de @YouTube ( http:// youtu.be/ieYvcz_2X4c?a - Apple 's $999 iPhone X Hands On).;@YouTube;
0;0;yall drop a new update twice a week like it's going to fix anything. yall going OD with this planned obsolescence shit.;;
0;0;ｷﾞｭｰ(*>ω<)ω<*);;
0;2;The first time I can remember feeling sexualized by a man was when I was twelve buying a sticker from the vending machine at the old Apple Market and a grown man asked me how old I was. TWELVE. #MeToo;;#MeToo
1;1;Got my Gotcha this Saturday way! Better then the plus but did get it because I wasn't able to use the Plus anymore.;;
0;0;@OutOfBounds Will this be on Apple /google podcasts ?;@OutOfBounds;
0;0;/loads up the sympathy /continues reading tweet /notices " Apple " & Apple devices in the tweet /pretends he can't read /puts Phil Collins on;;
0;5;My fuckin cinnamon apple;;
0;0;Apple MacBook Air A1370 11.6" Laptop - MC968LL/A (July, 2011) http:// coyolxauhqui.erdemoon.info/US/categories/ twt/?item=232526285168 …;;
0;0;Dont listen to them get an s7 or s8 you wont regret it;;
0;0;RT @MacRumors : Apple Responds to Senator’s Request for Info on Face ID Privacy and Security … pic.twitter.com/NKJXzbDKCX;@MacRumors;
0;1;Garret Zachary already went for a cookie run. Rays apple market said no.;;
0;1;apple sucks;;
0;0;Apple upgraded because $1,000 iPhone will ‘extract’ more profits from consumers http:// zentrade.online/apple-upgraded -because-1000-iphone-will-extract-more-profits-from-consumers/?utm_campaign=twitter&utm_medium=twitter&utm_source=twitter … #news #price #shares;;#news #price #shares
0;0;I just want an Apple Watch;;
0;1;Honestly my phone is 4 months old and it’s already fucking up im over it @Apple get your shit together;@Apple;
0;0;大丈夫‼︎ 晴れるはず 私も雨予報で途中から晴れたし！！;;
7;18;I still have yet to goto the apple orchard;;
0;0;Uses same implementation so risk is low. Apply updates from Apple as & when they come out.;;
0;0;#Smartphone Apple Watch Series 3 Nike Plus Edition https:// goo.gl/fb/7cNVkw;;#Smartphone
5;12;The 1980 " Apple Pie" singers wish the Houston #Astros best of luck in Game 3 of the #NLCS @astros pic.twitter.com/r0EKjlsAgh;@astros;#Astros #NLCS
0;0;くっさwwwww;;
3;15;someone buy me apple cider and watch hocus pocus w m PLS;;
0;1;今日は先週と違って亀頭が痛いんだけどどうしたらいい？;;
0;0;#230: Apple Got its AWS Bill https:// releasenotes.tv/230-apple-got- its-aws-bill/ …;;#230
0;0;Shit Apple doesn't fall far from the Shit Tree !!! Best line ever by John ( Lahey ).;;
0;0;Me too, they sit in the back of my head like a worn in an apple;;
1;3;We make Apple News better. Follow Cambro. pic.twitter.com/SdAMQJXi8E;;
0;0;someone rip this so i can put this on my apple music!!!!;;
0;0;Me gustó un video de @YouTube http:// youtu.be/oN7c-UkeRes?a UNBOXING APPLE WATCH NIKE PLUS SERIES 3 DIFERENCIAS;@YouTube;
0;0;Our Apple Walnut Granola Bars #granolabars #granola #smallbatch #handbaked #harlemvalley … https://www. instagram.com/p/BaU_417jCCa/;;#granolabars #granola #smallbatch #handbaked #harlemvalley
0;0;Apple https:// twitter.com/gyllensiut/sta tus/919622259953848320 …;;
0;1;The #HongKong #startup that wants to be the ‘ @Apple store’ for #cryptocurrencies @GenesisBlockSE #payment #fintech http:// sc.mp/d9TAW4;@Apple @GenesisBlockSE;#HongKong #startup #cryptocurrencies #payment #fintech
0;0;@Apple give me my fucking money back or give me a new phone son. my phone freezes multiple times per day and yall do this shit on purpose.;@Apple;
0;1;i'm a sucker for a nice crisp apple;;
0;0;¿Por qué Amazon, Apple , Facebook, Microsoft y Google han tenido problemas para capturar a Hollywood? http:// nyti.ms/2gnTQw2 - nytimesES;;
0;0;大阪待ち合わせ場所.com ：【心斎橋】 Apple store Shinbashi前 http:// osakamachiawase.com/shinsaibashi/a pplestore …;;
0;1;I am satisfied with iPhone/OS 11. But, I do need a device that a 7 year old can drop/drown/abuse without giving me heartburn.;;
0;0;Apple Watch Series 3 単体で LINE は利用できるのか http:// voty-app.com/posts/241832;;
0;0;こりゃ、朗報ですね。/【WPA2】 Apple 、Wi-Fiの脆弱性「KRACKs」を次回アップデートで修正へ http:// touchlab.jp/2017/10/apple_ to_release_wpa2_fix/ …;;
0;24;Russian to your nearest Apple Store and find out!!;;
0;1;3 Apple Suppliers Investors Shouldna t Worry About http:// ift.tt/2yslI8b;;
0;2;How there's only 1 Apple Store in the entire state of Iowa is beyond me;;
0;0;Apple mdr https:// twitter.com/gyllensiut/sta tus/919622259953848320 …;;
0;1;HOME & GARDEN PARTY USA STONEWARE APPLE 3 1/2″D X 3 3/4″T S&P SHAKERS W/ HANDLES https:// foreignzone.net/9-moso-natural -air-purifying-bag-odor-eliminator-for-cars-closets-bathrooms-and-pet-areas-captures-and-eliminates-odors-charcoal-color-200-g-2/ …;;
0;0;Both my phone and my iPod are Gen 5, but my iPod is suddenly struggling with updates while my phone isn't... Gdi Apple /:;;
0;2;Wish I could delete Apple maps. That shit is trash;;
0;1;Security News This Week: Be Careful Where You Enter Your Apple ID Password https://www. wired.com/story/apple-id -password-phishing/?mbid=social_twitter_onsiteshare … via @WIRED #cyberawarenessmonth;@WIRED;#cyberawarenessmonth
0;0;Just the absolute essentials. #kindle #booklife #bookworm #nerd @Apple King of Prussia https://www. instagram.com/p/BaU_2G7AKHC/;@Apple;#kindle #booklife #bookworm #nerd
0;0;This phone is gonna look ugly as shit.. #iphonex #sucks #apple #comeon #otterbox #uscellular #case https://www. instagram.com/p/BaU_tzblkiQ/;;#iphonex #sucks #apple #comeon #otterbox #uscellular #case
0;2;I’m sorry but the Samsung watch looks way cooler than the Apple Watch;;
0;0;http:// ebay.to/2vLpVjz Buy the Apple watch 42% Off, Buy it now before the offer ENDS!!;;
0;0;#NewAlbum "I'm From Lincoln Village" by hardyru_34 available now on iTunes & Apple Music!… https://www. instagram.com/p/BaU_1wShi2Z/;;#NewAlbum
0;0;Apple explored buying a medical-clinic start-up as part of bigger push into health care - $ DXCM https:// apple.news/A8mxbewG-TyqKX 2LVmVBVpA …;;
0;0;Don’t miss your chance to hear directly from the @Apple Team during this year’s #FCPXSummit . Code POST17 saves $100! https:// goo.gl/F93SaL pic.twitter.com/VVkGe6g7K8;@Apple;#FCPXSummit
0;0;ayos apple;;
0;0;LIVE on #cube : Apple Valley Fall Choir Concert @TheCubeDotCom http:// thecube.com/e/754415;@TheCubeDotCom;#cube
0;6;I wanna bitch I can take apple picking and to the pumpkin patch and etc fall shit;;
