retweets;favorites;text;mentions;hashtags
0;0;News: Android fans accuse Apple of cop... http://www.breakingnews.co/android-fans-accuse-apple-of-copying-samsung-first-apple-insider/93953;;
0;0;Details Of Apple 's Lawsuit Against Samsung Revealed; And It's Even More Ridiculous http://bit.ly/g55j61 Tech.alltop;;
0;0;Android fans accuse Apple of copying Samsung first - Apple Insider http://bit.ly/f26x82;;
0;0;The Apple Ipad http://bit.ly/g1tpkQ;;
0;0;Apple Ipad Ebook http://bit.ly/fPT6qW;;
0;0;Apple Ipad http://bit.ly/g7YGc6;;
0;0;Apple Appears to be Cracking Down on Incentivized Installs (Kim-Mai Cutler/Inside Mobile Apps): Kim-Mai Cutler ... http://bit.ly/ej6VND;;
0;0;Silicone Cassette Shape Cover Skin Case for New Apple iPhone 4 ( 4th Generation 16GB 32GB - AT&T Only ) + Includes A... http://f4vou.tk;;
0;0;#apple Apple acusa a Samsung de copiarle los cacharros (Baquía.com) http://bit.ly/eQno5G;;#apple
0;0;#apple Apple acusa a Samsung de copiar el iPhone y el iPad (hoyTecnología) http://bit.ly/f8DniD;;#apple
0;0;USB iHub is the perfect knockoff accessory for your Apple -centric existence http://pulsene.ws/1miGG jobs would sell 3MM;;
0;0;oh yeaah, apple pie! #yumm;;#yumm
0;0;Purple Premium Dual Protection Rubberized Hard Case Cover for Apple iPod Touch 4th Generation + Wisdom Courage ... http://amzn.to/i62H7b;;
0;0;apple のイヤホンを使ってる人は、自分の音漏れくらい自覚して！！！　[ほにゃ～];;
0;0;It's Not Just Apple , Samsung Has Been Copying Everyone Forever (AAPL, MOT) - San Francisco Chronicle http://bit.ly/epJWC3;;
0;0;Love that iPad autocorrects "Ipad" or "ipad". Apple makes sure people spell their shit right.;;
0;0;Android fans accuse Apple of copying Samsung first: Immediately after Apple filed suit against Samsung over pate... http://bit.ly/eDMJnX;;
0;0;cnet apple tech news App Store algorithm change said to be categorical: New data suggests that recent changes m... http://cnet.co/h8fEXj;;
0;0;Win an Apple iPad- 16GB WiFi (1st Gen) @slickdeals http://slickdeals.net/giveaway/959;@slickdeals;
0;0;Unviersal Car Windshield Mount Holder for Apple Iphone Smartphone, Ipod Touch By Ikross: Unviersal Car Windsh... http://amzn.to/fR5mh0;;
0;0;I'm at Apple Store (367 George St, at King St, Sydney) http://4sq.com/gtGnfs;;
0;0;3n1 Combo - Premium Aluminum Case for the New Apple iPod Nano Nano-Chromatic 4th Generation 8 gb 8gb 16 gb 16gb... http://amzn.to/f3FKAG;;
0;0;@fortyagency chiptle, apple , target to name a few.;@fortyagency;
0;0;@WillDunn_ i just told u whatever i know :( i dont have anything of Apple . So sorry. Check yr downloads, put yr USB in yr laptop & save it;@WillDunn_;
0;0;Lmfao this girl just spilt apple juice on her 3 new hollister shirts DAMN;;
1;0;Most common frustration heard at #where20 is that Apple 's website is not mobile optimized.;;#where20
0;0;#Apple : #Samsung Copied Design http://6sen.se/g4QSur;;#Apple #Samsung
0;0;Haters Accuse Apple Of Ripping Off Samsung. UPDATE: Certified Bullshit! http://www. cultofmac.com/haters-accuse- apple-of-ripping-off-samsung/91051 … via @cultofmac;@cultofmac;
0;0;Q&A: je souhaite acheter le dernier apple nano, est il obligé de télécharger de la mu http://bit.ly/g0dDAi #acheter #Apple #dernier;;#acheter #Apple #dernier
0;0;" @ElEsteNoticias : Apple demanda a Samsung por plagio http://cot.ag/edeQ5M";@ElEsteNoticias;
0;0;これまで Apple は容認してるかと思ったけどここまでやるのね。そりゃあ、誰もがそう思ってたけどさ笑。Galaxyは似てるなんてもんじゃないよなあ。RT @wataru4 : 「Samsung製品はコピー」を画像で例示： Apple http:// wiredvision.jp/news/201104/20 11042018.html … ”;@wataru4;
0;0;apple trying to sponser me cause i be on some mac shit!;;
0;0;I LOVE THE APPLE STORE;;
0;0;@aots Gotta say, best ad is still the Apple Big Brother one from the '80's #AOTS;@aots;#AOTS
0;0;Oh CNET just hit the linkbait goldmine with this one: Survey: Most Android users 'hate Apple ' http://j.mp/dHvnhn;;
0;0;Apple Investors Await Cost of …: Apple Investors Await Cost of Japan Disaster: Last month’s earthquake and tsuna... http://bit.ly/fZIRu1;;
0;0;@Lambo_Jenkins 4real? IDK bro, I mean I aint drunk all the APPLE koolaid yet but I hear alot of good things about the I4.... There was alot;@Lambo_Jenkins;
0;0;iTunes 10.2.2 es complatible con el jailbreak: Como muchos de vosotros habréis comprobado, Apple a actualizado i... http://bit.ly/h5B5Zg;;
0;0;@RaviVora Apple Color for this project;@RaviVora;
0;0;サムスンがパクっているのは明らかだろうが、アイコンは仕方くねぇ？RT @wiredvision : 「Samsung製品はコピー」を画像で例示： Apple http://wiredvision.jp/news/201104/2011042018.html;@wiredvision;
0;0;@WillDunn_ You should ask @CharlesTrippy - if dealing with Apple /iPhones were a sport, he'd probably go pro.;@WillDunn_ @CharlesTrippy;
0;0;Android fans accuse Apple of copying Samsung first - Apple Insider - ... http://is.gd/Keu90c;;
0;0;Apple sues Samsung for copying its Innovation http://goo.gl/fb/gLjzn;;
0;0;#gbamRT @princessmovida: Dats correctRT @DrewBaba : C For Cunt RT @oluseyimcfunny : B for bastard RT @princessmovida: A for apple;@princessmovida @DrewBaba @oluseyimcfunny @princessmovida;#gbamRT
0;0;RT @MobileBurn : Samsung reacts to Apple lawsuit, will file own suit: Samsung has responded to Apple 's lawsuit (cont) http://tl.gd/9uuqd1;@MobileBurn;
0;0;Why Apple shares are dirt cheap ( @andymzaky / Fortune) http://j.mp/fQ1b2l http://techme.me/BRWE;@andymzaky;
0;0;@jeyl0rd in the big apple till sunday. Hope i get to see blue man group! #hope;@jeyl0rd;#hope
0;0;Sabem pq o Jobs ta de licença da Apple ? Pra vir me entregar o iPhone 4 que eu vo ganhar na promoção da @Imersao_System ! http://www. kingo.to/y4w;@Imersao_System;
0;0;#videogames Video Game Ratings Board Prepares For Downloadable Games, Apple - Kotaku Australia: GamePro.comVideo... http://bit.ly/emTReY;;#videogames
0;0;Survey: Most Android users 'hate Apple ' http://cnet.co/hwIcrx;;
0;0;Survey: Most Android users 'hate Apple ' http://cnet.co/g8uVoy;;
0;0;RT LOL @Apple @appleinsider : Android fans accuse Apple of copying Samsung first http://dlvr.it/P3Tv8;@Apple @appleinsider;
0;0;IN THE APPLE STORE;;
0;0;Trying out these new shoes with a walk down to Clarendon since I totally spaces on my Apple store and grocery needs.;;
0;0;twitter na ipade :P chapem preco americania miluju apple , je to maximalne blbuvzdorne;;
0;0;Sunny RT @NANYAkeKPOPERS : apple hair Dara / blonde Sunny? (via: @jj6391 ) #NANYAkpopers;@NANYAkeKPOPERS @jj6391;#NANYAkpopers
0;0;YUM! Appreciation Apple Crisp @MelodyLeaLamb @RTtheBest @michaelbathurst @Painting_Artist @windowsot @thebeadedpillow @mssuzcatsilver;@MelodyLeaLamb @RTtheBest @michaelbathurst @Painting_Artist @windowsot @thebeadedpillow @mssuzcatsilver;
1;0;Interesting: " Apple vs Microsoft by the numbers" http://bit.ly/h54z3f;;
0;0;Survey: Most Android users 'hate Apple ' http://news.cnet.com/8301-17852_3-20055181-71.html?part=rss&subj=news&tag=2547-1_3-0-20;;
0;0;you ask me to feed your baby while you jump in the shower n i ate all the apple gerber baby sauce then i then burp in his face .. #imthuggin;;#imthuggin
0;0;@apple _gl ヽ(；ﾟﾛﾟ)ﾉ;@apple;
0;0;YupRT @donsimoninc: C for cock :D RT @oluseyimcfunny : B for bastard RT @princessmovida: A for apple;@donsimoninc @oluseyimcfunny @princessmovida;
0;0;Goodnight everyone. sleep tight. dream of apple and rice and all things nice.. and Good morning to the other side of the globe. xx ^_^;;
0;0;@Kfreshness yea but everyone said it "improved" the launch, created the demand. If apple hadn't done it tge iPhone 4 would've failed;@Kfreshness;
0;0;Apple iLife Mac OSX Full http://bit.ly/eUfnaq #piratebay;;#piratebay
0;0;sipping on some sparkling apple cider;;
0;0;Tech Today: Apple iPad for £250? PSPgo gone http://bit.ly/hnXVe4;;
0;0;おめw RT @apple _lomo : @hoshi2000 ありがとう！しあわせになります！！;@apple @hoshi2000;
0;0;Tech Today: Apple iPad for £250? PSPgo gone: Survey says tablet prices must fall, Sony cuts PSP loses Posted by ... http://bit.ly/hUarMa;;
0;0;Tech Today: Apple iPad for £250? PSPgo gone: Survey says tablet prices must fall, Sony cuts PSP loses Posted by ... http://bit.ly/hnXVe4;;
0;0;Apple poursuit Samsung sur ses tablettes et ses smartphones (Lesoir.be): Apple a déposé plainte contre Sa... http://bit.ly/eaX9Ij #apple;;#apple
0;0;iPhone vs Galaxy : Apple s'en prend à Samsung (Generation-NT.com): Apple porte plainte contre Samsung, es... http://bit.ly/eUDZqC #apple;;#apple
0;0;「Samsung製品はコピー」を画像で例示： Apple http://is.gd/sEiKBi;;
0;0;RT @redglassesapps : iPhone+Mac: simple GUI 2make your own frameworks.... Apple SHOULD have included in Xcode: http://bit.ly/fPEHgw;@redglassesapps;
0;0;@willdunn_ worst comes to worst, you can call apple (if needed call one over here where it isnt midnight) and they'll help;@willdunn_;
0;0;#tech Tech Today: Apple iPad for £250? PSPgo gone: Survey says tablet prices must fall, Sony cuts PSP l... http://bit.ly/dZPMhX #nolabel;;#tech #nolabel
0;0;Apple replaced my iPhone + gave me new ugraded MBP w/software. Mindful of the ongoing hacking they set up my new MBP in a secure locale.;;
0;0;Apple iLife Mac OSX Full http://bit.ly/eUfnaq #mac;;#mac
0;0;RT @negrielectronic Win an Apple iPad Tablet PC 64GB Wifi (Unlocked) (Open Box) http:// negrielectronics.com/apple-ipad-64g b-wifi-unlocked-open-box.html … via @negrielectronic;@negrielectronic @negrielectronic;
0;0;Damn!RT @paulhelmick : Apple has sold over 187 million iOS devices http://bit.ly/fuZMpu;@paulhelmick;
0;0;Apple に対してこれを違うものと主張し、自分のところの知的財産をゴリ押しするサムソンを怖いもの知らずと取るべきか無謀と取るべきか… RT @wataru4 : 「Samsung製品はコピー」を画像で例示： Apple http:// wiredvision.jp/news/201104/20 11042018.html … ”;@wataru4;
0;1;I've tried doing the "hold sleep and home button for 8 seconds" thing, didn't work, still comes up with an apple and arrow pointing to itune;;
0;0;Dats correctRT @DrewBaba : C For Cunt RT @oluseyimcfunny : B for bastard RT @princessmovida: A for apple;@DrewBaba @oluseyimcfunny @princessmovida;
0;0;#Apple App-Tipp: Jourist Weltübersetzer und Coastel Super-Combat kostenlos http://bit.ly/eaZBw5;;#Apple
0;0;Stylishly Designed Hard Cover Snap on Case, iPad Cover for Apple iPad MB292LL/A Tablet (16GB, 32GB, Wifi + 3G) ... http://amzn.to/ghL6nd;;
0;0;Apple iTunes 10.2.2 - Play & buy music, videos, TV shows & burn CDs.. http://feedproxy.google.com/~r/macupdate/~3/tu_B4HxWThg/apple-itunes;;
0;0;FreeWalk Premium clear anti Glare 9.7" Screen Protector for Apple iPad 3G tablet / Wifi model 16GB, 32GB, 64GB:... http://amzn.to/ijtAmb;;
0;0;Look Design Protective Decal Skin Sticker for Apple iPad 2nd Gen Tablet E-Reader: Look Design Protective Deca... http://amzn.to/fCfPOK;;
0;0;Apple iPad 3G lcd frame: Apple iPad 3G lcd frameRating: The iPad 3G lcd Frame Plastic Chasis hold the iPad To... http://amzn.to/fyvNmt;;
1;0;i don't like samsung, but I hope, no matter how unlikely, that they crush Apple in this patent suit;;
0;0;@_Candy_ Apple Sin duda;@_Candy_;
0;0;i said im hungry & my lil princess (niece) brings me doritos & apple pie :) i love her meng.;;
0;0;Im.down to apple and watermelon !;;
0;0;The iPad makes the iPhone look like my old commodore 64. How has man managed to exist for thousands of years without "the cloud" and apple .;;
1;1;"there 13! they cnt drive! APPLE JUICE!!!!!!" :D;;
0;0;Plain chicken breast, salad, apple +tomato soup for dinner.;;
0;0;#Retail Here's The Real Reason #Apple Is Suing Samsung http:// read.bi/gFbx24 vía @alleyinsider;@alleyinsider;#Retail #Apple
0;0;Stock Market, April 20: What's on Tap: NEW YORK (TheStreet -- It's iPhone Wednesday! Both AT&T and Apple are r... http://bit.ly/fpLYZ9;;
0;0;Stock Market, April 20: What's on Tap: NEW YORK (TheStreet -- It's iPhone Wednesday! Both AT&T and Apple ... http://tinyurl.com/437qcs2;;
0;0;Stock Market, April 20: What's on Tap: NEW YORK (TheStreet -- It's iPhone Wednesday! Both AT&T and Apple are r... http://bit.ly/fpLYZ9;;
0;0;Hotgirl 'nóng bỏng' bên iPad 2: Apple chính thức tung ra thị trường chiếc máy tính bảng iPad 2 hồi tháng 3 vừa q... http://bit.ly/dVMs5l;;
0;0;Poker novice? Try PokerPartner from Hawk iMedia http://bit.ly/7Q4xKc #iphone #poker #apple #games b81b8;;#iphone #poker #apple #games
0;0;「Samsung製品はコピー」を画像で例示： Apple - Wired Vision http://bit.ly/ftRTb5;;
0;0;Report: Apple Makes Major App Store Ranking Changes http://www.gamasutra.com/view/news/34194/ via @gamasutra;@gamasutra;
0;0;CUSTOM #Apple #iPhone and #iPod personalised Wallpaper, Neon Wallpaper Creator http://bit.ly/NeonApp -115:0-23:0-50;;#Apple #iPhone #iPod
0;0;Mac OS 7 logos turned into playing cards http://aol.it/gv6QLU #Apple;;#Apple
0;0;Alienware open to tablets, investigating Thunderbolt http://bit.ly/eAI1nO #Apple;;#Apple
0;0;iOS outreaches Android when iPod touch, iPad are counted in the mix http://aol.it/ie3e5s #Apple;;#Apple
0;0;Michigan Police Could Search Cell Phones During Traffic Stops http://bit.ly/fQYH6C #Apple;;#Apple
0;0;FTC takes action against 'fake' news sites http://bit.ly/fCnisY #Apple;;#Apple
0;0;“D for Dick @DrewBaba : C For Cunt RT @oluseyimcfunny : B for bastard RT @princessmovida: A for apple ”;@DrewBaba @oluseyimcfunny @princessmovida;
0;0;@apple _xox ディグダが急に怪しくなりましたね;@apple;
0;0;Yup! Gd boiRT @oluseyimcfunny : B for bastard RT @princessmovida: A for apple;@oluseyimcfunny @princessmovida;
0;0;Would like to marry 'lucas' from apple who let me redownload all 560 itunes downloads that I deleted by accident. What an angel.;;
0;0;It's gonna be my new favorite place to be... ;-) RT @mimikmy : I'm at Apple Store 福岡天神 (天神2-3-24, 天神ルーチェ 1F, 福岡市中央区) http://4sq.com/hSOXme;@mimikmy;
0;0;Android fans accuse Apple of copying Samsung first - Apple Insider http://bit.ly/f26x82;;
0;0;On air: Kasso - The Walkman. #Apple #IPhone #IPad user? Download our #disco #webradio #app for free! Visit #AppStore !;;#Apple #IPhone #IPad #disco #webradio #app #AppStore
0;0;Apple Releases Some Preliminary Sales for iPad in Lawsuit - Bloomberg http://bit.ly/dMZ3Bj;;
0;0;Apple Investors Await Cost of Japan Disaster - Wall Street Journal http://bit.ly/h2Ogkn;;
0;0;Survey: Most Android users 'hate Apple ' - CNET (blog) http://bit.ly/gv0xzq;;
0;0;Stocks to watch Wednesday: Apple , Intel, IBM - MarketWatch http://bit.ly/gytPx6;;
0;0;@nakchuns @akuma7703 @voiceyw @yhc9944211 @apple _file @jiny925 @MONEYTODAYMTN @poiuyt55 @soohjc @jsb2093 팔로감사드립니다!~나날의행복가득채워지는소중한시간되시길소원해봅니다;@nakchuns @akuma7703 @voiceyw @yhc9944211 @apple @jiny925 @MONEYTODAYMTN @poiuyt55 @soohjc @jsb2093;
0;0;Facebool Login - Apple App Store Ranks Quality over Quantity – Mobiledia: Develop (blog) Apple App Store Ranks Q... http://bit.ly/eMtEBs;;
0;0;Android users do you hate Apple ? That's not rhetorical (or very nice), let's hear it! Apple or Android? Poll says http://cnet.co/fbapldroid;;
0;0;Apple lleva a la justicia su guerra tecnológica con Samsung - Cinco Días: Los Mas HabladosApple lleva a la justi... http://bit.ly/eXMpju;;
0;0;Rebellion Flag Decorative Skin Decal Sticker for Apple iPod Nano 1G (1st Gen) MP3 Player: Scratch Resistant Ski... http://amzn.to/glbLhB;;
0;0;Ipad Apple Como Nuevo 16gb Wifi 3g Tablet Pc Computadora http:// articulo.mercadolibre.com.do/MRD-1493233-ip ad-apple-como-nuevo-16gb-wifi-3g-tablet-pc-computadora-_JM …;;
0;0;Comscore: U.S. Smartphone Subs as of Feb: Google 33% RIM 28.9% Apple 25.2% MS 7.7% Palm 2.8% http://bit.ly/glLtOW #where20;;#where20
0;0;Win a Shabby Apple dress from @Savingmoneyll http://su.pr/1ycxi9 #Giveaway ends 4/26!;@Savingmoneyll;#Giveaway
0;0;@AdamKitching apple it! That why I changed from bb a simple task like back your phone up it didn't work! Hope u get it sorted :-/;@AdamKitching;
0;0;Free Stock Picks Five Things to Watch: Apple , Gold at $1500 & More: Gas prices reach a tipping point, gold price... http://bit.ly/ghdAyk;;
0;0;Five Things to Watch: Apple , Gold at $1500 & More: Gas prices reach a tipping point, gold prices reach a record ... http://bit.ly/ghdAyk;;
0;0;Five Things to Watch: Apple , Gold at $1500 & More http://bit.ly/hN2Ea7;;
0;0;RT @JornalOGlobo : Pedro Doria fala sobre o duelo entre Apple e Google na internet móvel. http://ow.ly/4Dd9K (Via @karampatricia );@JornalOGlobo @karampatricia;
0;0;Noodles and apple juice http://plixi.com/p/94035794;;
1;0;TECHSUAL: Apple Sues Samsung, Claims They Copied the iPad http://www. techsual.com/2011/04/apple- sues-samsung-claims-they-copied.html?spref=tw …;;
0;0;Apple (MC725LL/A) 17" MacBook Pro: Core i7 2.2GHz, 4GB RAM, 750GB HDD for $2100: At eBaySold by MacMall via eB... http://bit.ly/i3eIXQ;;
0;0;@wizardcud dude i just had 2 apple pies but NO FUCKING SHAKE.;@wizardcud;
0;0;Sci&Tech- Stocks to watch Wednesday: Apple , Intel, IBM - MarketWatch http://adf.ly/1GIYh;;
2;1;2010 Worldwide Smartphone Market Share: Symbian 37% Android 23% Apple 16% RIM 16% Windows 4% Others 4% http://bit.ly/emWaNd #where20;;#where20
0;0;The apple doesn't fall far from the tree.;;
0;0;WaterRT @dotman_dotCom : ✗ for RT @princessmovida: A for apple;@dotman_dotCom @princessmovida;
0;1;@Solivagant No like whether or not your phone is reporting to Apple what apps you use and for how long.;@Solivagant;
0;0;your stupid just liek your mom the apple doesn't fall far from the tree xO — lmfao sweet :D http://4ms.me/gjOI1l;;
0;0;@Chuck_Tay14 chillis got that too! i need a place the got some apple pie for dessert..im craving something apple cinnamon;@Chuck_Tay14;
0;0;[App] Apple 、仮想通貨を報償とするDLなどのシステム取り締まりを強化？ iPhoneゲームニュース http://dlvr.it/P3ZC3;;
1;0;TECHSUAL: Samsung Fights Back Against Apple http://www. techsual.com/2011/04/samsun g-fights-back-against-apple.html?spref=tw …;;
0;0;@Naly_D we've had a lot of people receiving refurbs from Apple instead of new replacements. I say give it a go, they'll have all the docs;@Naly_D;
0;0;You do realise that Apple is the corporate face of Skynet? Judgment Day. And on April 21st 2011 it'll feel pretty fuckin real to you too! ;);;
0;0;Stocks to watch Wednesday: Apple , Intel, IBM - MarketWatch - http://on.mktw.net/fwRi7V;;
0;0;@_gamestre Oi Quer concorrer a um Apple Ipad de graça? click no link Participe e convide seus amigos: http://bit.ly/hIjnRs;@_gamestre;
0;0;Apple Appears to be Cracking Down on Incentivized Installs (Kim-Mai Cutler/Inside Mobile Apps): Kim-Mai Cutler... http://bit.ly/h4bNZB;;
0;0;Apple Appears to be Cracking Down on Incentivized Installs (Kim-Mai Cutler/Inside Mobile Apps);;
0;0;Apple TV MC572LL/A (2010): Apple TV MC572LL/A (2010) Stream HD cinema as well as TV shows rented from iTunes, as... http://bit.ly/fkOYB1;;
0;0;TM: Apple Appears to be Cracking Down on Incentivized Installs (Kim-Mai Cutler/Inside Mobile Apps): Kim-Mai Cu... http://bit.ly/gC71mK;;
2;0;Apple ทำยอดขายอุปกรณ์ iOS ได้มากกว่า 187 ล้านชิ้น!! http://www. imaicafe.com/2011/04/20/app le-sold-ios-product-over-187/ … via @imaicafe;@imaicafe;
2;0;What Apple ’s App Store Changes Mean for Users http://bit.ly/dOuqEW <-- includes quotes by yours truly;;
0;0;@TeamStyless ahh good :D finally!! I have no idea what to wear either! And everyone's meeting at 12pm at Apple Store in Covent Garden! xxx;@TeamStyless;
0;0;Survey: Most Android users 'hate Apple ' http://rckd.us/mx4;;
0;0;あっぽ〜さん、おはようございます(｡-_-｡)♬ RT @apple _son : おはよ～今日何しよ…;@apple;
0;0;@DreCal1 now I'm apple head... Ok..;@DreCal1;
0;0;App Store algorithm change said to be categorical: New data suggests that Apple did in fact make changes to its... http://cnet.co/fjelLn;;
0;0;Android fans accuse Apple of copying Samsung first http://dlvr.it/P3Yzb;;
0;0;この節操のなさは流石と思う。> Samsung製品はコピー」を画像で例示： Apple http:// wiredvision.jp/news/201104/20 11042018.html …;;
0;0;#Google #News Android fans accuse Apple of copying Samsung first - Apple Insider http://bit.ly/fWDfhN #Australia;;#Google #News #Australia
0;0;#iphone Samsung To Countersue Apple In iPhone, iPad Patent Claim http://bit.ly/hvyW07;;#iphone
0;0;iPhone info! Samsung To Countersue Apple In iPhone, iPad Patent Claim: By Ricardo Bilton | April 19, 2011 5:47 P... http://bit.ly/eIiWDx;;
0;0;iPhone info! Samsung To Countersue Apple In iPhone, iPad Patent Claim: By Ricardo Bilton | April 19, 2011 5:47 P... http://bit.ly/eIiWDx;;
0;0;iPhone info! Samsung To Countersue Apple In iPhone, iPad Patent Claim: By Ricardo Bilton | April 19, 2011 5:47 P... http://bit.ly/eIiWDx;;
0;0;Samsung To Countersue Apple In iPhone, iPad Patent Claim: By Ricardo Bilton | April 19, 2011 5:47 PM EDT Samsung... http://bit.ly/e6Eaxu;;
0;0;どのAndroidケータイもそんなに変わらん、と思うけどGalaxyはちょっとパクリ過ぎな印象。「Galaxyは模倣 アップルが提訴」 http://yj.pn/oHyx6M #yjfc_ apple （アップル）;;#yjfc_
0;0;iPhone 5 won't be anything special: Rumor has it that Apple 's iPhone 5 won't be anything too special. Physically... http://bit.ly/gwDHnk;;
0;0;Samsung To Countersue Apple In iPhone, iPad Patent Claim http://bit.ly/gihxml;;
0;0;Apple had sold 108 mil iPhones, 19 mil iPads and 60 Mil iPods as of March 2011. http://tinyurl.com/3ja8tpk;;
0;0;Like the success of Apple with iOS, I've thought there is no more conlict to compete with whose rock is bigger but who has rock-ceaser-paper;;
0;0;Samsung To Countersue Apple In iPhone, iPad Patent Claim: By Ricardo Bilton | April 19, 2011 5:47 PM EDT Samsung... http://bit.ly/fnh1ks;;
0;0;#apple #ipad - Apple adds third supplier of iPad 2 touchscreen components - tuaw.com http://4tab.me/article/48058/;;#apple #ipad
0;0;Samsung To Countersue Apple In iPhone, iPad Patent Claim http://bit.ly/gYgTQl;;
0;0;Apple Ipod Touch iTouch 2 3 Purple/Black Zebra Hard Case Snap on Cover Protector Sleeve + LCD Protector + Free ... http://amzn.to/etb0cF;;
0;0;Samsung To Countersue Apple In iPhone, iPad Patent Claim: By Ricardo Bilton | April 19, 2011 5:47 PM EDT Samsung... http://bit.ly/i2beum;;
0;0;Apple ทำยอดขายอุปกรณ์ iOS ได้มากกว่า 187 ล้านชิ้น!!: สืบเนื่องจากข้อพิพาทระหว่าง Apple และ Samsung เกี่ยวกับการล... http://bit.ly/f1fAs1;;
0;0;Apple ทำยอดขายอุปกรณ์ iOS ได้มากกว่า 187 ล้านชิ้น!! http://bit.ly/f1fAs1;;
0;0;Apple ทำยอดขายอุปกรณ์ iOS ได้มากกว่า 187 ล้านชิ้น!! http://bit.ly/f1fAs1 :IT-Phone;;
0;0;@APPLE _PIE_18 おはようございます。天気良いけど寒いですね。花ももが綺麗になって、桜より力強い感じしません？;@APPLE;
0;0;iPhone 5 won't be anything special: Rumor has it that Apple 's iPhone 5 won't be anything too special. Physically... http://bit.ly/fA6fLA;;
0;0;Samsung To Countersue Apple In iPhone, iPad Patent Claim: By Ricardo Bilton | April 19, 2011 5:47 PM EDT Samsung... http://bit.ly/gRziuy;;
0;0;Did Apple Reject This Idea for iOS Multitasking? [Video] http://bit.ly/g42WRI;;
0;0;Report: Apple bans app incentives, cripples freemium games http://bit.ly/ek130C #in;;#in
0;0;Samsung Promises Legal Revenge Against Apple [Blip] http://bit.ly/eSNEq6;;
0;0;@inakajin をを、高級品！Appleの7800円のやつはリモコン付いてるんですね。うーむ。;@inakajin;
0;0;@Snespy - Dude, I heard your mom made the best Apple Pie, so how could I not come to visit?;@Snespy;
0;0;@flokinhafloks Oi Que tal ganhar um Apple Ipad grátis? click no link Inscreva-se e convide seus amigos: http://bit.ly/hIjnRs;@flokinhafloks;
0;0;#apple Unter CC verdubbtes Killer-Release auf AQuietBump: DADUB – Backward forward (Das Kraftfuttermischwerk): U... http://bit.ly/f6UifD;;#apple
0;0;Neue Ausgabe des BMW Magazins für das Apple iPad verfügbar: Auch die Themen der aktuellen Ausgabe dürften auf vi... http://bit.ly/dZCugx;;
0;0;#apple NEW Apple iPad! – GTT (Ipad-Ratgeber.de): Hier stellt Alex euch die ersten Bilder vom neuen iPad, dem Tab... http://bit.ly/heSUh9;;#apple
0;0;Honk for iPhone [Video] http://bit.ly/eUku2v #Apple #iPhone;;#Apple #iPhone
0;0;#YANDEX Apple подала в суд на Samsung, обвинив ее в копировании идей. В общей сложности корпорация Стива Джобса ... http://bit.ly/epSRbt;;#YANDEX
0;0;PORRA EU VOU METRALHAR A APPLE . SÓ ISSO.;;
0;1;in the apple store with my baby;;
0;0;inmielive72 asked: You seem like a person interested in this. Apple launched iPad2 and we’re looking for... http://tumblr.com/xxi26qcm58;;
0;0;CNN.com - Technology - Apple to Samsung: Stop stealing our ideas http://rss.cnn.com/~r/rss/cnn_tech/~3/3wjJR8t-LL8/index.html;;
0;0;Lawrys on an apple slice;;
0;0;iPad2! And apple ... RT @gracecheung604 : iPad2 vs Playbook? RT @adoniadonia : Apple vs Doritos;@gracecheung604 @adoniadonia;
0;0;Bye bye braces. Carmel Apple here I come! I'll twitpic a pic soon (:;;
0;0;Win an Apple iPad- 16GB WiFi (1st Gen) @slickdeals http://slickdeals.net/giveaway/959;@slickdeals;
0;0;apple is a joke with all these phones that have about 1 new feature while other co's are comin out with phones way ahead of em iphone 5?lol;;
0;0;Batman-Joker. Sabres-Flyers. Bond-Blofeld. Me-Clowns. Android Users- Apple . @CNETNews : Most Android users 'hate Apple ' http:// cnet.co/g8uVoy;@CNETNews;
