retweets;favorites;text;mentions;hashtags
0;0;Klw ipad appel samo dgm diky,mau? RT @dektalayonksary: pengen ..klo dak tu ipad apple b lah RT @ayumasiihadaa: Kenapa? Dekta mau jg iy?? Ha;@dektalayonksary @ayumasiihadaa;
0;0;@apple _non ぜひぜひ！ぬりやさんは通りからちょっと中に入った路地の中にありますが、こんなところにこんないい雰囲気のお店があるんだ～！という感じです！落ち着いた個室が多いので、ちゃんとした席でももちろんOK！;@apple;
0;0;Apple demanda a Samsung por imitar a Iphone e Ipad: http://bit.ly/h6wO5n;;
0;0;@CaduSilva @dutello bem lembrado! È isso mesmo! Será q com isso o imperio da Apple vai contratacar? kkk competitividade sempre é bom!;@CaduSilva @dutello;
0;0;Smashin Apple Jacks right now!;;
0;0;Nintendo In Talks With Rockstar About Wii 2 Development http://bit.ly/gozmMT #tech #apple #web;;#tech #apple #web
0;0;“ @LiveProfile : As of 5 minutes ago Apple is reviewing the update! Landscape, copy and paste, speed increase, bug fixes, and more :)” woooo;@LiveProfile;
0;0;@ijustine I thought you are an Apple fangirl?;@ijustine;
0;0;Apple 's iOS has twice the reach of Android … for now | Android …: In result from a new study, A... http://bit.ly/hFVVLy #xoopia #android;;#xoopia #android
0;0;Laptops, netbooks, desktops, hard drives, memory cards, computer components, accessories from Apple , HP, Intel, Asu... http://amzn.to/fAwIWb;;
0;0;golly gosh what an intriguing night of trying to stave away boredom and pain. just made an apple pipe for tootin' and codeine is separated.;;
0;0;E eu sonhando com um Sony Vaio Pink ou então um IMAC da Apple .;;
0;0;Free Classifieds F-SApple Iphone 4 32gb- Apple Ipad 2 16GB-32GB-64GB (Abha Ø§Ø¨Ù‡Ø§): BUY 2pcs get 1pcs FREE- OR... http://bit.ly/dOMgXY;;
0;0;Free Classifieds FOR SALE- Brand New Apple Iphone 4G-3G 32GB Leglly Unlocked - -200 BUY 2 GET 1 FREE (Barcelona)... http://bit.ly/fv7JQt;;
0;0;Free Classifieds For Sale - Apple iPhone 4G 32GB - Nokia E7 - Blackberry Playbook (Hamad Town): WELCOME TO Elect... http://bit.ly/gra4dD;;
0;0;@kensukejoji Apple ？;@kensukejoji;
0;0;Free Classifieds FOR SALE- Brand New Apple Iphone 4G-3G 32GB Leglly Unlocked - -200 BUY 2 GET 1 FREE (Barcelona)... http://bit.ly/gOaI12;;
0;0;Apple cleaning up App Store rankings by de-emphasizing downloads: http:// arstechnica.com/apple/news/201 1/04/apple-cleaning-up-app-store-rankings-by-deemphasizing-downloads.ars?utm_source=feedburner&utm_medium=feed&utm_campaign=Feed%3A+arstechnica%2Findex+%28Ars+Technica+-+Featured+Content%29 …;;
0;0;On air: Trinere - All Night. #Apple #IPhone #IPad user? Download our #disco #webradio #app for free! Visit #AppStore !;;#Apple #IPhone #IPad #disco #webradio #app #AppStore
0;1;The sweeter the apple , the blacker the core. Scratch a lover and find a foe;;
0;0;@Kyra_Fancypants My favorite. You should try it with apple jelly and a sliced banana.;@Kyra_Fancypants;
0;0;Samsung Ready to Battle Apple in Patent War http://viigo.im/6nG0;;
1;0;Apple Accuses Samsung of Stealing Ideas for Galaxy Line http://om.ly/BSUXo;;
1;0;Omg since when did ear buds get so expensive. The ones from apple are almost $70;;
0;0;Top 5 Apple Products of All Time: Noah’s List http://www. technobuffalo.com/companies/appl e/top-5-apple-products-of-all-time-noah-s-list/ … via @technobuffalo #TechnoBuffalo;@technobuffalo;#TechnoBuffalo
0;0;@SamanthaNU Hey sam how did that chair break? Oh and then how did those chunks of apple get in my bar sink that doesn't have a disposal?;@SamanthaNU;
0;0;Ya está a la venta el lector de tarjetas de crédito de #Apple . http://tinyurl.com/3gyv6cd;;#Apple
0;0;#iphone #3gs Samsung To Countersue Apple In iPhone, iPad Patent Claim http://bit.ly/fvrlcv;;#iphone #3gs
0;0;I'm at Apple Store (8888 SW 136th St, Miami) http://4sq.com/fKJAql;;
0;0;It seems like bird games have really cornered the market on Apple apps;;
0;0;Zip it RT @BNasty215 : Apple Lookin So Right She Make Me Want A Piece,;@BNasty215;
0;0;Internet: What Apple ’s App Store Changes Mean for Users (New York Times) http://feedzil.la/gZWKns;;
0;0;iBooks: Frequently Asked Questions (FAQ): See the frequently asked questions below to learn mor... http://bit.ly/9uVjZ2 #apple _topiknews;;#apple
0;0;Today is the first time Apple approves my app update on free version faster than paid version. What happened?;;
0;0;Wrd RT @BkBrandon : Why they can't make an apple juice that taste EXACTLY like Motts apple sauce;@BkBrandon;
0;0;Apple iLife Mac OSX Full http://bit.ly/eUfnaq #book;;#book
0;0;Two messages no tumblr: propaganda da Apple . ê.;;
0;0;@RusanaVelcheva Е, това са си евангелистите. Church of Apple , знаем :);@RusanaVelcheva;
0;0;♬And if this town ♫♪is just an apple ♫♪Then im gon take my bite♬;;
0;0;O símbolo da Apple seria a maçã mordida pelo signo de serpentário?;;
0;0;Apple iPod Mini Accessory Review http:// bit.ly/hxizo0;;
0;0;** Apple iPad 2 ** RT & WIN iPad! I just entered to WIN iPad 2 from Hot Buckles! http://ow.ly/46wSY #HBiPAD2;;#HBiPAD2
0;0;PC World: Apple 's iOS Beats Android? Not Exactly . More #Apple #iPhone #news - http://tinyurl.com/mm3pqq;;#Apple #iPhone #news
0;0;MacRumors: Apple cracking down on offer walls in iOS apps. http://bit.ly/eqraJy Good;;
0;0;たしかにアイコンは劣化コピーだわ。 RT @wiredvision 「Samsung製品はコピー」を画像で例示： Apple http://wiredvision.jp/news/201104/2011042018.html;@wiredvision;
0;0;TechCrunch - comScore: Including iPads, iPods And Tablets, Apple ’s iOS Outreaches ... #percent #android #ipad http://bit.ly/foi30s;;#percent #android #ipad
0;0;"Boletín: Apple denuncia a Samsung por plagio y otras noticias" - http://j.mp/ewbqep;;
0;0;Currently reading Japan woes force scrutiny of Apple 's margins http://www.stuff.co.nz/s/KfOh;;
0;0;RT @idgnow : Na justiça, Apple diz que Samsung fez "cópias descaradas" do iPhone e do iPad http://ow.ly/4CXF6;@idgnow;
0;0;Damn, I like ur style mr.Rotten Apple;;
0;0;Android fans accuse Apple of copying Samsung first - Apple Insider http://smartshare.me/hna;;
0;0;Android fans accuse Apple of copying Samsung first - Apple Insider http://10x6.com/hna;;
0;0;iPad giveaway! Follow @DrAfsahi and RT this to enter drawing for an Apple iPad plus more! Visit: http://SouthCoastDermatology.com/news.asp;@DrAfsahi;
0;0;やっぱ似てる似てないの問題か。ギャラクシーがか。似てるというか、スマートフォンの形としてはあれが一般的だし、他の機種もiPhoneに類似してる。したの部分がちょっと違うくらいか。どう考えても Apple 焦ってるじゃん。ギャラクシー伸びてるからやべえなってるだけじゃん。;;
0;0;yang mana aja boleh RT @DamnRightTweets : Apple VS Droid: Which Is Greater? Test it and get it for free! http:// bit.ly/AppleVSDroid #USonly;@DamnRightTweets;#USonly
0;0;I uploaded a @YouTube video http://youtu.be/hPInE904XCY?a My Apple themed desktop !;@YouTube;
0;0;RT @AppleNewsDACH2011#apple 64 GB iPhone mit iOS Version mit Exposé Funktion aufgetaucht (IPhone Magazine): Aha, was haben wir denn d...;@AppleNewsDACH2011;#apple
0;0;@ella_mariela I been really good ma'am, how is the big apple ?;@ella_mariela;
0;0;Offer - FOR SALE: Brand New Apple Iphone 4G/3G 32GB Leglly Unlocked . $200: ASALAM ALIAKUMFOR SALE:... http://tinyurl.com/3wku9lv;;
0;0;The Apple iPad now has 80000 dedicated apps | The Apple iPad Fan http://bit.ly/ggacP0;;
0;0;Laptops, netbooks, desktops, hard drives, memory cards, computer components, accessories from Apple , HP, Intel, Asu... http://amzn.to/dE76h2;;
0;0;#mac ==>: Laptop Battery M9338J/A for Apple iBook G3 14″ M8862J/A – 8 cells 4400mAh, Light Grey http://bit.ly/fRzPWZ;;#mac
0;0;apple付属とか100均以下 RT @y_nao_01: apple のイヤホンを使ってる人は、自分の音漏れくらい自覚して！！！　[ほにゃ～];@y_nao_01;
0;0;“ @LiveProfile : As of 5 minutes ago Apple is reviewing the update! Landscape, copy and paste, speed increase, bug fixes, and more :)” nice;@LiveProfile;
0;0;comScore: Including iPads, iPods And Tablets, Apple ’s iOS Outreaches Android By 59 Percent http://zite.to/ejToPQ via @Ziteapp;@Ziteapp;
1;0;I uploaded a @YouTube video http://youtu.be/7HJNksfonJ8?a Apple iPhone iOS5 demo on video? Is this it? New Multitaskin;@YouTube;
0;0;Not horrendously surprising, and also telling...RT @JayOatway : Survey: Most Android users 'hate Apple ' http://cnet.co/hwIcrx;@JayOatway;
0;0;#Apple #iPod #hier #gewinnen http://bit.ly/f0EJ4l;;#Apple #iPod #hier #gewinnen
0;0;. @gruber nails it in one sentence. // ComScore Discovers That Apple Sells iOS Devices Other Than the iPhone http://tinyurl.com/3qhkp2l;@gruber;
0;0;I like the iPhone, but I hate Apple . Therefore... http://tinyurl.com/3n4fkqn;;
0;0;vodka & apple juice ! lol;;
0;0;Apple says no to incentivised downloads http://tcrn.ch/fr4wCp #in #fb;;#in #fb
0;0;Apple lawsuit against Samsung reveals details about product volumes http://bit.ly/eCXBcR (via @news360app );@news360app;
0;0;Sci/Tech News Apple 's Samsung lawsuit reveals over 60 million iPod touch sold - Apple Insider: ReutersApple's Samsung l.. http://dld.bz/XkxK;;
0;0;#news #europe Why Apple shares are dirt cheap - Fortune Tech: Ahead of Apple 's earnings, the numbers tell it all:... http://adf.ly/1GIip;;#news #europe
0;0;#Tecnologia | iOS de Apple , 59% más extendido que Android (vanguardia) http://feedzil.la/egUTqg | #Follow1x1 | #FF;;#Tecnologia #Follow1x1 #FF
0;0;Apple is going after samsung but doesnt Samsung supply parts for apple ... uh ok;;
0;0;@howdyitsryan So, If an Apple was alive would you not eat Apples & other fruits?;@howdyitsryan;
1;0;TUAW: Steve Jobs thought Noah Wyle did a "fantastic job" playing him in Pirates of Silicon ... http://aol.it/ieO49g #apple #iphone #ipad;;#apple #iphone #ipad
0;0;Guess i'll have to go complain to the Apple store..smh;;
0;0;Why Apple shares are dirt cheap - Fortune Tech: Ahead of Apple 's earnings, the numbers tell it all: If sha... http://tinyurl.com/3pxc3cr;;
0;0;Unoff. Apple Weblog: Steve Jobs thought Noah Wyle did a "fantastic job" playing him in Pirate... http://aol.it/fDUhfo #tech #apple #news;;#tech #apple #news
0;0;Apple Weblog: Steve Jobs thought Noah Wyle did a "fantastic job" playing him in Pirates of Silicon Valley http://aol.it/fDUhfo #BC;;#BC
0;0;Hardware News || New Entry || Apple granted key patents for on-the-go wireless device a Just as China approved eleven http://bit.ly/fkw07C;;
0;0;@QueJoDicBruno Olá Que tal concorrer a um Apple Ipad grátis? Visite no link Cadastre-se e convide seus amigos: http://bit.ly/hIjnRs;@QueJoDicBruno;
0;0;There were computers in Biblical times. Eve had an Apple .;;
0;0;Finally RT @LiveProfile As of 5 minutes ago Apple is reviewing the update! Landscape, copy and paste, speed increase, bug fixes, and more :);@LiveProfile;
0;0;How bout group chat!! RT @LiveProfile : As of 5 minutes ago Apple is reviewing the update! Landscape, copy and (cont) http://tl.gd/9uurml;@LiveProfile;
0;0;Apple Juice Ahh.;;
0;0;Apple 's iOS Beats Android? Not Exactly http://trap.it/nAgauv #android;;#android
0;0;@theempoweredmom **Smiles** Re: YUM! ~> Appreciation Apple Crisp;@theempoweredmom;
0;0;WE GAVE KIERAN AN APPLE !!! :D (@PierreSixD live on http://twitcam.com/4kp1h);@PierreSixD;
0;0;Apple Clamps Down On Incentivized App Downloads http:// tcrn.ch/grPMsl via @techcrunch;@techcrunch;
0;0;こうして見ると…ひどすな(汗) RT @wataru4 「Samsung製品はコピー」を画像で例示： Apple http:// wiredvision.jp/news/201104/20 11042018.html …;@wataru4;
0;0;RT " @djchrislake : Apple computers are like digital condoms. They give you a 99.9% chance of avoiding viruses";@djchrislake;
0;0;Android fans accuse Apple of copying Samsung first - Apple Insider http://woelig.net/hna;;
0;0;@higortorchetti Olá Quer ganhar um Apple Ipad grátis? click no link Participe e convide seus amigos: http://bit.ly/hIjnRs;@higortorchetti;
0;0;Android fans accuse Apple of copying Samsung first - Apple Insider http://10x6.com/hna;;
0;0;@Brizzly_ girl u in the Apple store messing with the display joints like shit lol;@Brizzly_;
0;0;PlayBook can succeed in Apple dominated market: experts - http://fwix.com/a/74_4c27b98162;;
0;0;hey @beliebnbeckham i now eat apple cores... and my family thinks its really weird.;@beliebnbeckham;
1;0;existe uma marca que é mais cool que a apple : a "duzoto", sério: todo mundo vive falando do carro duzoto, da casa duzoto, da vida duzoto...;;
0;0;Android fans accuse Apple of copying Samsung first - Apple Insider http://v8no.com/hna;;
0;0;Apple adds touch-screen manufacturer to alleviate iPad 2 supply issues - CNET (blog) http://bit.ly/fvDvVT;;
0;0;Step on his toes lmao RT @_SiNsati0n : This nigga in the apple store with flip flops is blowing mines ;;@_SiNsati0n;
0;0;Health benefits of apple cider vinegar http://bit.ly/h0Jg3v;;
0;0;ASUS 19 bamboo-plated U43SD laptop graduates to Sandy Bridge, so does plain-jane U41SV http://twlv.net/5nQuxc #socialmedia #tech #apple;;#socialmedia #tech #apple
0;0;@RealMarkSumera which one is it the one next to knotts? Shit don't forget my sweet tea and apple pies buwhaha goodluck though;@RealMarkSumera;
0;0;Android fans accuse Apple of copying Samsung first - Apple Insider http://bit.ly/fSg59w;;
0;0;Android fans accuse Apple of copying Samsung first http://goo.gl/fb/xFRxv AppleInsider.com;;
0;0;@Doctor_Teeth maybe an apple cake. Or banana choc cuppycakes;@Doctor_Teeth;
0;0;Apple vs Samsung: Apple 's case against Samsung is a sign that the US company is afraid of the unexpectedly pe... http://on.ft.com/dLDHpv;;
0;0;Apple 's Samsung lawsuit reveals over 60 million iPod touch sold http://goo.gl/fb/SPRO7 AppleInsider.com;;
0;0;Stereo Headset with Bulit-in Microphone and Click / Hold Button (Black) for Apple iPhone / iPhone 3G / iPod Vid... http://amzn.to/fAqzN1;;
0;0;App Store algorithm change said to be categorical: New data suggests that recent changes made to Apple 's App St... http://cnet.co/fjelLn;;
0;0;Review of Apple ’s unit numbers released in legal filing prior to earnings - http://j.mp/gt5HDf;;
0;0;Apple Releases Some Preliminary Sales for iPad in Lawsuit - Bloomberg http://bit.ly/eEglG9;;
0;0;Jiaahh pake apple boat aja sklian ._.RT @rifaaaaJR: Yaah pake jet (n) pake banana boat doong kak._. Wkwk RT @dian_cute : Haha;@rifaaaaJR @dian_cute;
0;0;@RKFollese listen. Face it. Apple is awesome. And so are you.;@RKFollese;
0;0;@gsimonettig Cheguei de viagem! #Apple;@gsimonettig;#Apple
0;0;@WillDunn_ Hold down the two buttons until the Apple logo shows up.;@WillDunn_;
0;0;@nlnc_ apple sim;@nlnc_;
0;0;iPad: Silicone Skin Green Case for Apple iPad + Stereo Earphones + Anti-Glare Screen Protector + Wristband http://bit.ly/eON2tf;;
0;0;RT @pgbiz : It seems to be the night of the long knives with Apple swiping its enemies - Tapjoy, Cydia etc - prior to its Q2 financials;@pgbiz;
0;0;@SHANswers ok, just email me the app... hopefully i will pass wit flyin colors. & i got some an apple 4 extra credict. :-);@SHANswers;
0;0;Why Apple shares are dirt cheap (Andy M. Zaky/Fortune) http://bit.ly/e2r9XM;;
0;0;#TelefeNoticias " Apple vs. Samsung" y la mina que nunca me acuerdo de cómo se llama "¡Llamen a Bill Gates!". Oh, Jobs te perdone...;;#TelefeNoticias
0;0;*thought it was apple suing samsung*RT @hajjajo : What is dis I'm seeing samsung suing apple iPad for copyright breach plssss;@hajjajo;
0;0;Samsung caught in #Apple 's war on #Android http://goo.gl/6Hrzx;;#Apple #Android
0;0;Apple высказала требование закрыть дело против магазина iTunes: Закрыть дело против музыкального сервиса iTunes,... http://bit.ly/h3nuc2;;
0;0;@jobbies @davidtrewern Is it just me or does anyone else read iAds as 'Aids'? Not sure that's a good thing for Apple ..!;@jobbies @davidtrewern;
0;0;@huboferik A lot of $ and perhaps overstated. How many people bought Samsung when they thought they were buying Apple ? My view is zero.;@huboferik;
0;0;Apple lawsuit against Samsung reveals details about product volumes http://bit.ly/gHPQeE #apple #about #against #apple;;#apple #about #against #apple
0;0;我在痞客邦 PIXNET 新增了篇文章：網路賺錢 網路致富的殿堂與 Apple iPhone 4 16G 500萬畫素/平板電腦比較 http://qqapure.pixnet.net/blog/post/29412074;;
0;0;" @IntoMobile : Samsung will take counter-actions to Apple lawsuit http://bit.ly/fetHfA" #fb;@IntoMobile;#fb
0;0;Adore June – Professional iPad Sleeve / Case for Apple iPad and iPad 2 Wifi / 3G Model 16GB, 32GB, 64GB: Perfec... http://bit.ly/gvHpZ6;;
0;0;Samsung to Strike Back Against Apple 's Patent Infringement Suit http://bit.ly/hmx3WY;;
0;0;Pick me!!! - @hotbuckles Wow!! ** Apple iPad 2 ** RT & WIN iPad ! I just entered to WIN iPad 2 from Hot Buckles! ow.ly/46wSY #HBiPAD2;@hotbuckles;#HBiPAD2
0;0;Android fans accuse Apple of copying Samsung first http://sns.mx/7Pdjy8 #apple;;#apple
0;0;Lo mejor q vi hoy: Sr 75-80 años, cn sus audífonos Apple , d traje, llevando el ritmo cn su paraguas y pierna, recordé q #lamusicanotieneedad;;#lamusicanotieneedad
0;0;「Samsung製品はコピー」を画像で例示： Apple | WIRED VISION http://bit.ly/fUdVpi 確かに特にサムスンはパクリの傾向が強い。HTCはそうでもないけど。ただiPhoneの印象が強すぎるから似てくるのはしょうがなくね…;;
0;0;@BluGambino and by the way apple is the shittttt;@BluGambino;
0;0;Win an Apple iPad- 16GB WiFi (1st Gen) @slickdeals http://slickdeals.net/giveaway/959;@slickdeals;
1;0;Survey: Most Android users 'hate Apple ' http://cnet.co/hwIcrx via @cnet *coel @sumarketer @autami @kenyulian @WidyDee @andrias98;@cnet @sumarketer @autami @kenyulian @WidyDee @andrias98;
0;0;Win an Apple iPad- 16GB WiFi (1st Gen) @slickdeals http://slickdeals.net/giveaway/959;@slickdeals;
0;0;Matte Crocodile Skin Case for Apple iPhone 3G / 3GS - Black http://is.gd/Rv9nEY;;
0;0;El profesor de Administración de Empresas habla de la guerra de Windows y Mac. Que divertido, habla del fanatismo de Mac y Apple cc @bisarro;@bisarro;
0;0;Apple iOS device sales leaked in Samsung lawsuit, iPad sales fall short?: On Wednesday Apple ’s earning c... http://bit.ly/hq4TL7;;
0;0;At Electric Pig UK: Apple iOS device sales leaked in Samsung lawsuit, iPad sales fall short?: On Wednesd... http://bit.ly/hq4TL7;;
0;0;Apple processa Samsung por causa da linha Galaxy.... Eu sabia que isso ia acontecer...;;
0;0;魔法の箱を構想する。 のちの Apple Macintoshである RT @ogiri_tweet 【ついったー大喜利】2011年4月20日のお題です。あのニュートンが晩年にハマった意外なことは何か教えてください。 #ogiri_110420;@ogiri_tweet;#ogiri_110420
0;0;@Jean_Aciole @atilasevero bem eu vou esperar o iPad2 pra ver as melhorias da Apple pois o ipad1 nAo mim convenceu;@Jean_Aciole @atilasevero;
0;1;75 really useful iPad tips and tricks : http://goo.gl/5L1ko #apple #mlearning #tablet;;#apple #mlearning #tablet
0;0;Acase Classic Kindle 3 (Latest Generation) Leather Case ( Apple Green) with Screen Protector Film http://is.gd/k6ArQQ;;
0;0;Apple calls Samsung copycat, sues co - Times of India http://goo.gl/fb/RdSvy #business;;#business
0;0;@WillDunn_ Okay, how about you go to the Apple Store and ask them to fix it? And if they say you need to restore, go ahead and panic. :P;@WillDunn_;
0;0;Granny made me sloppy-joes and apple crisp for lunch today. What a great ol' gal!;;
0;0;Apple iOS Actually Outreaches Android By 59% in US http:// blogs.forbes.com/afontevecchia/ 2011/04/19/apple-ios-actually-outreaches-android-by-59-in-us/ … via @forbes;@forbes;
0;0;ﾋﾞｸｯ RT @y_nao_01: apple のイヤホンを使ってる人は、自分の音漏れくらい自覚して！！！　[ほにゃ〜];@y_nao_01;
0;1;Turn Your iPad 1 or 2 into an Interactive Whiteboard (Practical Practice) http://bit.ly/fcfJXA #ipad #apple;;#ipad #apple
0;0;BJ Rainy Sky Grey Silicone Skin for Apple iPod Nano 3rd Generation: http://tinyurl.com/3gu7lbq;;
0;0;Cuffu - Arrow - Fashion Case Cover for Apple iPhone 1st Gen. (NOT for iPhone 3G or 3G s): http://tinyurl.com/3dgyrou;;
0;0;QVS 6ft DB25 Male to Mini8 Male Apple Computer ImageWriter Printer Cable (CC505-06): QVS 6ft DB25 Male to ... http://tinyurl.com/3myws8k;;
0;0;Apple ’s Throwing The Book At Samsung In New Lawsuit: In the past few years, patent lawsuits be... http://bit.ly/hdp0Ka #media #seriously;;#media #seriously
0;0;Danou-se: Apple processa Samsung http://wp.me/p15OeS-1f0;;
1;0;Apple cider vinegar is a powerful purifying and detoxifying agent. Soak for 20 minutes in a warm bath.;;
0;0;Thanks for the sushi rolls chipmunk @Tye_Bo , remember to put some ice on the cheek. Lmk if the apple store still exists when you get ur mac;@Tye_Bo;
0;0;Apple iOS device sales leaked in Samsung lawsuit, iPad sales fall short? http://bit.ly/gO2Pbg;;
0;0;@MMAGTOTO give me some apple pie nomnomnom;@MMAGTOTO;
0;0;Samsung Ready to Battle Apple in Patent War http://bit.ly/g4lf3C;;
0;0;說 http://tinyurl.com/454fcjn ( Apple 修改了軟體排行榜的計分方式) http://plurk.com/p/bs35x2;;
0;0;#iPad News - Apple lawsuit against Samsung reveals details about product volumes http://tiny.ly/JQGa;;#iPad
0;0;Square credit card reader for iPhone now available from Apple Store http://zite.to/fjp4FY via @Ziteapp;@Ziteapp;
0;0;Apple are so lazy they can't even update their iTunes installer picture to feature the iPad 2, it's still the iPad @chronic @EmilyCaffrey;@chronic @EmilyCaffrey;
0;0;Apple sues Samsung: a complete lawsuit analysis: Comments http://bit.ly/hLAvfB #in;;#in
0;0;Win an Apple iPad- 16GB WiFi (1st Gen) @slickdeals http://slickdeals.net/giveaway/959;@slickdeals;
0;0;@letty_colima @_Candy_ Apple #Fuertesdeclaraciones;@letty_colima @_Candy_;#Fuertesdeclaraciones
0;0;ComScore Discovers That Apple Sells iOS Devices Other Than the iPhone http://tinyurl.com/3qhkp2l;;
0;0;Apple interpone demanda contra Samsung por imitación http://bit.ly/fL53MG;;
0;0;rooCASE Couture Folio Genuine Leather (Red) Case Cover for Apple iPad 3G Wi-Fi (For 1st Generation http://is.gd/dE7DC4;;
0;0;AppleInsider | #Android fans accuse #Apple of copying #Samsung first http://me.lt/8x7LX;;#Android #Apple #Samsung
0;0;@PrintesaDorinta Would you like some famous stress relief apple pie??;@PrintesaDorinta;
0;0;Samsung threatens Apple in response to patent lawsuit http://reg.cx/1NK9;;
0;0;Apple sues Samsung and Samsung countersues Apple : http://wp.me/pTUdA-28b;;
0;0;In The Know: Should The Nation's Unemployed Be Buying New Apple Computers? | The Onion - America's... http://onion.com/eoNQuh #FB;;#FB
0;0;Apple didn't fall far RT @J_Wright_PhD My mama rude as hell lmao;@J_Wright_PhD;
0;0;#ebay Apple 17in MacBook Pro - Newest Model (MC725LL/A) ($2100.00) http://getidealyzer.com/l/3ba73pn;;#ebay
0;0;rt @GingerMarden315 CONGRATS! You won an Apple iPad 2! Claim here: bit.ly/getfreeipadtwo (Copy and Paste)<CONGRATS UR BLOCKED! #BeatiT;@GingerMarden315;#BeatiT
0;0;Galaxy savaşları!: Apple 'dan en büyük rakibi Samsung'a şok suçlama! ... http://bit.ly/g40yr8;;
0;0;Kommentar der Financial Times Deutschland zu Apple /Samsung - vorab20.4.2011: Apple - Patenter Wettbewerb Patentk... http://bit.ly/hGcfhW;;
0;0;An apple a day keeps the doc away!! http:// yfrog.com/hsu27rtj;;
0;0;Apple Macbook Air Package Forwarding Service from USA http://r.ebay.com/s5I4Yf;;
0;0;Video studentky přípravného roku ČJ (Lída).flv http://bit.ly/eQwTcL #apple;;#apple
0;0;Earnings Preview: Apple Inc. http://bit.ly/fgTNFL;;
0;0;Adobe vs. Apple : And The Winner Is… http://bit.ly/fk100u;;
0;0;@maureenjohnson The nice people at Apple seem to have done the trick. #panicaverted;@maureenjohnson;#panicaverted
0;0;@CaitlinCandela did they have these effects before the worked for Apple or after or you know what just throughout? Steve Jobs... #biwinning;@CaitlinCandela;#biwinning
0;0;iPad: Apple sues Samsung over Galaxy line of phones, tablets http://bit.ly/esWVdp;;
0;0;Apple 's Samsung lawsuit reveals over 60 million iPod touch sold - Apple Insider: New York Times (blog) Apple 's Sa... http://bit.ly/hIOfbY;;
0;0;Apple News! iHub, l'Hub con il logo Apple che si illumina - PianetaTech: PianetaTechiHub, l'Hub ... http://bit.ly/h0qNot Leggi ancora...;;
0;0;@WillDunn_ The way I see it, you have two options. 1) Run like a mad man to the nearest Apple store. 2) Forget about it and buy a new one.;@WillDunn_;
0;0;@alingtron lol . . I've done worse to Apple Macs over the years and I'm a total Mac fan !! . . :D;@alingtron;
0;0;The most delicious apple juice http://instagr.am/p/DVCMD/;;
0;0;so, parents don't contol kids and their iPhone purchases so, Apple gets sued. Only in America.;;
0;0;アイコンは無理があるとして… どっからパーツもってくるんだろうね｜「Samsung製品はコピー」を画像で例示： Apple | WIRED VISION http://wiredvision.jp/news/201104/2011042018.html;;
0;0;そいや Apple がSAMSUNGに体して訴訟起こしたけど、 Apple はSAMSUNG製品が、Androidが怖いだけにしか見えない。ちょっと調べてくる;;
0;0;@ntk430 おはよん 昨日はシャワー浴びたら即寝だった(ｰｰ;)どんだけ疲れてたんだって思ったよwww 元々は、SAMSUNGが中々許してくれなくて Apple 、iPhone出せなかったんだよね～、にしても、今回のは…(^_^;) 何かと話題になりますね…グンちゃん（笑）;@ntk430;
0;0;@aciolineto eu usei os dois e não tenho duvidas, o @atilasevero ama a apple , nada muda o que ele pensa.;@aciolineto @atilasevero;
0;0;Apple Slapped With a Class-Action Suit Over iPhone In-App Game ...: Apple is being hit by a... http://bit.ly/fxVfnA collegestudentlounge;;
