retweets;favorites;text;mentions;hashtags
0;0;[ apple ] (要脱獄) ｢iPad Keyboard Prototype｣のコンセプトを再現したTweak｢SwipeSelection｣がダウンロード可能に http:// dlvr.it/1WyQbm;;
0;0;Apple iPad2 ブラック 64GB Wi-Fiモデル MC916J/A 国内版 http:// amzn.to/kgJIee #PC #Amazon;;#PC #Amazon
0;0;Very stylish! Zebra Custom iPad Case: http:// bit.ly/dPtp3p #zazzle #zebra #iPad #case #apple #speck;;#zazzle #zebra #iPad #case #apple #speck
0;0;@Khyaa_ Apple Store. Apple Store. Apple Store. Apple Store. Apple Store. Apple Store. Apple Store. Apple Store. Apple Store. Apple Store.;@Khyaa_;
0;0;RT @cultofmac : Why 'Evidence' Won't Help You Predict Apple Products http:// cultm.ac/K1g6TK;@cultofmac;
0;0;Apple Wins Ruling, Sanctions in Samsung Infringement Lawsuit: Apple Inc. (AAPL) won sanctions against Samsung El... http:// bit.ly/KwRjVc;;
0;0;@StrongRoninPop @_pine_ apple perdón, entre DOCE personas DX;@StrongRoninPop @_pine_;
0;0;Apple Wins Ruling, Sanctions in Samsung Infringement Lawsuit: Apple Inc. (AAPL) won sanctions against Samsung El... http:// bit.ly/KslCjr;;
0;0;Apple Wins Ruling, Sanctions in Samsung Infringement Lawsuit: Apple Inc. (AAPL) won sanctions against Samsung El... http:// bit.ly/KwRgIU;;
0;0;Apple Wins Ruling, Sanctions in Samsung Infringement Lawsuit: Apple Inc. (AAPL) won sanctions against Samsung El... http:// bit.ly/KwRgIU;;
0;0;Apple Wins Ruling, Sanctions in Samsung Infringement Lawsuit: Apple Inc. (AAPL) won sanctions against Samsung El... http:// bit.ly/JD7Un2;;
1;0;Dear Adam and Eve, why y'all eat the dang apple ? Shoot we could've been freely naked smh;;
0;0;Apple crisp yum-o.;;
0;1;♫ Apple Candy - by Subscape #bbc #radio1;;#bbc #radio1
0;0;Amazon holiday pricing! ***NO AT&T CONTRACT*** Apple iPhone 4 Black Smartphone 16GB http:// amzn.to/acVGxB;;
0;0;Apple doesn't fall far from the tree unless the tree is on a hill then the apple can roll.;;
0;0;Apple ipod 6 In 1 FM Transmitter(F6) cell phone: Apple ipod 6 In 1 FM Transmitter(F6) cell phone . Instruction:F... http:// amzn.to/o7WpXO;;
0;0;#Classifieds Apple iPhone 4s- 32GB - Black / White (Unlocked) Smartphone http:// bit.ly/Lirf36 #Ads #Australia;;#Classifieds #Ads #Australia
0;0;#Apple Pink Sports Armband for iPhone 4 16GB/32GB / Verizon iPhone 4 16GB / 32GB http:// adf.ly/2RzqV;;#Apple
0;0;#Apple black portable dock station speaker for apple iphone 4 ipod htc evo 3d 4g mp3 http:// adf.ly/2RzqV;;#Apple
0;0;#Apple x2 dual front back lcd screen protector film for apple iphone 4 4g 4s 4th gen http:// adf.ly/2RzqV;;#Apple
0;0;#Apple Black Sports Armband for iPhone 4 16GB/32GB / Verizon iPhone 4 16GB / 32GB http:// adf.ly/2RzqV;;#Apple
0;0;Apple has destroyed me. My life is now made up of drawing super heroes... #MadeWithPaper pic.twitter.com/Ge81T9gX;;#MadeWithPaper
0;1;Got my candy apple #YEE pic.twitter.com/pDS8sv4r;;#YEE
0;0;Varsity: Red Wing (3) at Apple Valley (13) - FINAL http:// link.ngin.com/KzAiHA;;
0;0;@Apple _Tay have fun in hk!!;@Apple;
0;0;http:// IndianaJobBank.com Apple Customer Service Rep, At Home at Apple (Fort Wayne, IN): Every day, people do amazing ... http:// bit.ly/KwR9gs;;
0;0;Apple Releases Mac Flashback Trojan Removal Tool;;
0;0;gambling man who co-founded apple … http://gambling-man-who -co-founded-apple.casinosssonline.com;;
0;0;@haru_hina89 @126828227 @_Bad_ Apple _2 おやありでしたん;@haru_hina89 @126828227 @_Bad_;
0;0;Ugh I love apple sauce;;
0;0;@J_ Apple _3 whaddup Christina;@J_;
0;0;my phone upgrade is due anytime for the next 3 months, apple , now is when you release iphone5 thank you :));;
0;0;I bit into an apple seed;;
0;0;"New Samsung Galaxy S3. Designed by lawyers" #PatentWar #apple;;#PatentWar #apple
0;0;Apple iPad2 ブラック 32GB Wi-Fiモデル MC770J/A 国内版 http:// amzn.to/l3Rkjh #PC #Amazon;;#PC #Amazon
0;0;At Apple Bees with them babies;;
0;0;Lmao when u done smoke, you eat the apple;;
0;0;I need to remember that not every company is like Apple when it comes to customer service :/;;
1;0;Apple juice > Orange juice;;
0;0;@AskHer_AboutMe i thought you was going to apple bees ? whatchu going to see ?;@AskHer_AboutMe;
0;0;Why I hate use an apple product: http://www. youtube.com/playlist?list= PL37DADDD0A2A80CF2 … Android VS iOS;;
0;0;@_pine_ apple anda sí D: nos repartimos las lecturas entre 8 personas y aún con eso me tocó un buen ;A;;@_pine_;
0;0;i the apple store!!!!!!!! #nerdybirdy;;#nerdybirdy
0;0;just made an apple pie! delicious!;;
0;0;Google haggles on fine for Apple browser breach http:// bit.ly/Lir3AK;;
0;0;Google haggles on fine for Apple browser breach http:// bit.ly/Lir3AK;;
0;0;Google haggles on fine for Apple browser breach http:// bit.ly/Lir3AK;;
0;0;Google haggles on fine for Apple browser breach http:// bit.ly/Lir3AK;;
0;0;Google haggles on fine for Apple browser breach http:// bit.ly/Lir3AK;;
1;0;Cool pic of the All-City Marching Band from the Apple Blossom Parade today. pic.twitter.com/VOoImzxh;;
0;0;@AngelesColman hoy APPLE ,venite con tus amigas q las hago psar a todas sin fila :) Cel/Whatsapp 15.5575.8791 / pin: 2622BFFF;@AngelesColman;
1;0;Apple blossom is funny #whitepeoplegonewild;;#whitepeoplegonewild
0;0;IPad 3 wanted!! (Fishers) http:// bit.ly/Lir33M #indy #apple #gear;;#indy #apple #gear
0;0;apple pro book uk download http:// zincolovedus1.typepad.com/blog/2012/05/a pple-pro-book-uk-download.html … #osama #earthtweet;;#osama #earthtweet
0;0;Gosay_QUATTRO Time Line News 紙が更新されました！ http:// bit.ly/vDITyH ▸ 本日トップニュースを提供してくれたみなさん： @apple _matome;@apple;
0;0;En Şık Apple İphone Resimleri « Girne Haber http:// whrt.it/KDjsYI;;
0;0;@luligimeneez hoy APPLE ,venite con tus amigas q las hago psar a todas sin fila :) Cel/Whatsapp 15.5575.8791 / pin: 2622BFFF;@luligimeneez;
0;0;I just got super excited because I remembered I have ice cold pear and apple cider in the fridge!!!;;
0;0;@syadeednizar 50+. Tengok kedey jugak lahh. Aku beli fon kat kedey biase. Tu ah slack. Mase tu tak tahu ape lagi pasal apple nie haha;@syadeednizar;
0;0;Verizon is SOO sketchy. Poor baby…. I guess Apple doesn't let you disable bluetooth, or install your crap... http:// fb.me/1JpHur8WF;;
0;0;The Verge: US judge sanctions Samsung, kills important defense against Apple | http:// vrge.co/JD569A |;;
0;0;out at Lenox shopping all by myself...me & a Caramel Apple Splice;;
0;0;iPhone News: Has the Mac crested? The OpenForum's haikus tackle the issue: Apple released i... http:// bit.ly/KwQPyi;;
0;0;【The new iPad】 APPLE アップル 新しいiPad（第3世代）（iPad3）32GB 黒 ブラック 【WiFi+4G LTE】【海外版SIMフリー】 http:// amzn.to/InYcK5 #PC #Amazon;;#PC #Amazon
0;0;we choked on r bite thus adams apple (live at http:// ustre.am/G1Qt/1 );;
0;0;@DaniMultiversal La garantía en portátiles Apple es mundial. No depende del lugar de compra.;@DaniMultiversal;
0;0;@Camisoler hoy APPLE ,venite con tus amigas q las hago psar a todas sin fila :) Cel/Whatsapp 15.5575.8791 / pin: 2622BFFF;@Camisoler;
0;0;This whole world is abput to be Apple;;
0;0;Apple may unveil new MacBook hybrid this year, says analyst http:// cnet.co/Kslqkk;;
0;0;Making my Nanna some apple cinnamon muffins cause she's sick & hasn't had much of an appetite until now =\ #loveher #shedeservesit;;#loveher #shedeservesit
1;0;@agustise @aldicristaldo hoy APPLE ,venite con tus amigas q las hago psar a todas sin fila :) Cel/Whatsapp 15.5575.8791 / pin: 2622BFFF;@agustise @aldicristaldo;
0;0;Apple Milkshake anyone? 8DD;;
0;0;Android Central Editors’ App Picks for May 5, 2012 http:// bit.ly/KaKBoI #socialmedia #tech #apple;;#socialmedia #tech #apple
0;0;jontymisra: How do you spend your Saturday!? Restoring your #OSX of course! #apple #lion #windows #ubuntu #macbookpr ... http:// instagr.am/p/KQ517dHhpr/;;#OSX #apple #lion #windows #ubuntu #macbookpr
0;0;Go Green Save the Trees With Apple iTunes ePass App http://www. marketwire.com/press-release/ -1631783.htm …;;
0;0;@rawsoncj Apple began veering that way with Newsstand and magazines, though. There's also a "tone store" in iTunes. Breadcrumbs I cling to.;@rawsoncj;
0;0;@solcmartinez hoy APPLE ,venite con tus amigas q las hago psar a todas sin fila :) Cel/Whatsapp 15.5575.8791 / pin: 2622BFFF;@solcmartinez;
0;0;Apple MacBook 2.0GHz 13.3インチ MB466J/A http:// amzn.to/qDBd1R #PC #Amazon;;#PC #Amazon
0;0;There is a very nice picture in her of Fiona Apple raking llama turds.;;
0;0;Mega Partnering V Welcomes Apple Co-found Steve Wozniak and Celebrity ...Google Alerts - World Business: http:// bit.ly/LiqVBn;;
0;0;~go to green apple ~;;
0;0;"People who are crazy enough to think they can change the world, are the ones who do." - Apple Computers #Truth;;#Truth
0;0;Apple iPhone 5 3D But look at the shape of it!!! http:// mylikes.com/l/1utCb - spon;;
0;0;Apple pie without the cheese is like a kiss without a squeeze;;
0;0;Apple 's Siri commercials make the users look very very lonely. For those who have no friends...Siri is always there.;;
0;0;Apple sauce for my dinner #justsad;;#justsad
0;0;Hablemos de que con @ferunagel preferimos no ir a Apple para ir a dormir a lo de flor porque esta Dante;@ferunagel;
0;0;@camogodoy hoy APPLE ,venite con tus amigas q las hago psar a todas sin fila :) Cel/Whatsapp 15.5575.8791 / pin: 2622BFFF;@camogodoy;
0;0;Bout to eat my nephew taffy apple;;
0;0;Apple Bees w/ Troy tonight(: Then Twin House;;
0;0;Apple slices and Caramel! #yum;;#yum
0;0;JBL OnBeat Air: The good: The JBL OnBeat Air features Apple AirPlay wireless streaming in a fairly compact iPhon... http:// bit.ly/KwQD26;;
0;0;@ryusei_ apple はやない？;@ryusei_;
0;0;@maritabelen hoy APPLE ,venite con tus amigas q las hago psar a todas sin fila :) Cel/Whatsapp 15.5575.8791 / pin: 2622BFFF;@maritabelen;
0;0;Mega Partnering V Welcomes Apple Co-found Steve Wozniak and Celebrity ... http:// bit.ly/LiqOpg;;
0;0;Mega Partnering V Welcomes Apple Co-found Steve Wozniak and Celebrity ... http:// bit.ly/KsljoV;;
0;0;フォロー返し100％です！ #apple #相互ﾌｫﾛｰ募集 #桑田佳祐 #MT4 #あっちゃん #けいおん #wstcg #たかみな #Wii #youtube #ﾌｫﾛﾐｰ #ﾌｫﾛｰﾐｰ #autofollow #InstantFollowBack #浜崎あゆみ #fo;;#apple # # #MT4 # # #wstcg # #Wii #youtube # # #autofollow #InstantFollowBack # #fo
0;0;@Kerrison20 @PoundCakeHer @Julie_Hacking phone and Apple blamed the phone company - made the company give me a new SIM card and that didn't;@Kerrison20 @PoundCakeHer @Julie_Hacking;
0;0;Mega Partnering V Welcomes Apple Co-found Steve Wozniak and Celebrity ...: Mega Partnering V, the World's #1 Wea... http:// bit.ly/LiqO8Q;;#1
0;0;" @Factboook : Apple made an iPhone app that helps you keep track of your girlfriend's period & her moods.";@Factboook;
0;0;@Nero_ apple 【bot厨　撲滅運動実施中】タグをつけたbotは非常に迷惑迷惑迷惑迷惑迷惑迷惑迷惑迷惑迷惑迷惑迷惑迷惑迷惑迷惑迷惑迷惑迷惑迷惑迷惑迷惑迷惑迷惑迷惑迷惑迷惑迷惑迷惑迷惑迷惑迷惑迷惑迷惑迷惑迷惑迷惑迷惑迷惑685801;@Nero_;
0;0;Well I have a new iPhone courtesy of apple but lost all my pics, apps etc;;
0;0;Just joined the iPhone, MacBook, iPod, iPad club. @AzBossLady is killin the apple game with me;@AzBossLady;
0;0;@sbingner Are you working on a solution for Apple blocking your SAM Unlock?;@sbingner;
0;0;Hard Candy: Frenzy Finger Paints: Art You Wondering? Orly: Green Apple Nicole by OPI: Brilliant http:// pinterest.com/pin/1634666614 45004655/ …;;
0;0;@juliana_ apple ja estou no msn;@juliana_;
1;0;I'm gonna spoil you like an apple just cause you my booo*;;
0;0;@MayraCarp hoy APPLE ,venite con tus amigas q las hago psar a todas sin fila :) Cel/Whatsapp 15.5575.8791 / pin: 2622BFFF;@MayraCarp;
0;0;Guess we're going to Apple Bee's ....;;
0;0;@Julio_14_ apple Y no sé si quiero saberlo entero, eso de que tuvieses esa edad no me es excusa jajajaja.;@Julio_14_;
0;0;@CamiFerraiulo hoy APPLE ,venite con tus amigas q las hago psar a todas sin fila :) Cel/Whatsapp 15.5575.8791 / pin: 2622BFFF;@CamiFerraiulo;
0;0;Un juego de apple store para niñas q es de cuidados a un bebe. La comida la tienen q comprar! Sale 0,99 dolares cada mamadera!;;
0;0;Breakfast with apple and tea.;;
0;0;@cesyeshe potato head, sea circus (pork tacos, green apple and mint granita & mojitos), cafe Bali, grocer and grind, sarong restaurant.;@cesyeshe;
0;0;Apple Black Travel Charger/Home Wall mp3: Apple Black Travel Charger/Home Wall mp3 . This Cell Phone Travel / Ho... http:// amzn.to/KwQn39;;
0;0;@camilaruiz @yayiaranda hoy APPLE ,venite con tus amigas q las hago psar a todas sin fila :) Cel/Whatsapp 15.5575.8791 / pin: 2622BFFF;@camilaruiz @yayiaranda;
0;0;Apple;;
0;0;@JasmineAbelaX I felt his arm when u left and he said nice meeting ya was crumbling inside... Like apple crumble;@JasmineAbelaX;
0;1;@viickylescano @viickymazzeo hoy APPLE ,venite con tus amigas q las hago psar a todas sin fila :) Cel/Whatsapp 15.5575.8791 / pin: 2622BFFF;@viickylescano @viickymazzeo;
0;0;Mmmm candy apple @Kevinwoo91 pic.twitter.com/kQEhBGe8;@Kevinwoo91;
0;0;@DigsRetro I think the iPhone is supposed to adapt based on common mistakes made. Apple 's algorithms must have us pegged as creepers, haha.;@DigsRetro;
0;0;@agusariotti hoy APPLE ,venite con tus amigas q las hago psar a todas sin fila :) Cel/Whatsapp 15.5575.8791 / pin: 2622BFFF;@agusariotti;
0;0;" APPLE VS KABBA" (Astagh Firullah). Lekin jab Forward Karnay Ka Erada Kartay Hen To shaitan Aap K Eraday Ko Kumzor Ker Deta Hay. So plea ...;;
0;0;Premium Neon Green Zebra Design Protective TPU Silicone Skin Cover for Apple iPod Touch 4th Generation + Mirror ... http:// amzn.to/LiqEOO;;
0;0;Buffett prefiere IBM que Google o Apple - Negocios - http:// CNNExpansion.com : http:// bit.ly/KwQfki;;
0;0;App Price Changed : NaviPad US, new price : 5.99 #apple #iosUniversal http:// bit.ly/IMokyO;;#apple #iosUniversal
0;0;@antonellaariost hoy APPLE ,venite con tus amigas q las hago psar a todas sin fila :) Cel/Whatsapp 15.5575.8791 / pin: 2622BFFF;@antonellaariost;
0;0;apple apple apple;;
0;0;@MeemsInterlude haha!! I'll try it tomorrow xD. My bro and me bought Hipp Organic apple & pear pudding lol. So healthy as well!;@MeemsInterlude;
0;0;Apple and Mango J2O <3_<3;;
1;1;I ate an apple today, if that interests anyone..;;
0;0;What is the costliest fruit?   You guessed right if you said Apple . http:// lnkd.in/z42q7p;;
0;0;Coconut meringue, peanut butter apple http:// pinterest.com/pin/2381278990 17539516/ …;;
0;0;@rawsoncj will there be a hack to turn it off? Unless Apple can make the Dashboard suck less in iOS...;@rawsoncj;
0;0;@sofi_messina hoy APPLE ,venite con tus amigas q las hago psar a todas sin fila :) Cel/Whatsapp 15.5575.8791 / pin: 2622BFFF;@sofi_messina;
1;0;Apple MacBook MB403LL/A 13.3-inch Laptop (2.4 GHz Intel Core 2 Duo Processor, 2 GB RAM, 160 GB Hard Drive)... http:// dlvr.it/1WyQ3N #tvs;;#tvs
0;0;Apple が推奨する少しの配慮でiPhoneのバッテリー駆動時間とバッテリー耐用年数をより延ばす方法 - 男子ハック #share B! http:// bit.ly/KxVJZZ;;#share
1;0;RT @JGKunzler Win a $100 Apple Gift Card! Just follow @JGKunzler and RT this message. http:// ow.ly/1sX0R5 #AppleGlenn;@JGKunzler @JGKunzler;#AppleGlenn
0;0;despues de una noche loca de viernes , la noche del sabado se viene con todaa , apple venis con todaa;;
0;0;@Bruxelles Faites chier d'attaquer Google! Attaquez Apple , Microsoft ou Facebook mais lachez google tout est free grâce au système de pub!;@Bruxelles;
0;0;Apple Splash! iPhone Chromatic Go Launcher theme v1.0 By Cyber Flasher http:// goo.gl/fb/gzYSD #playmarket #apk;;#playmarket #apk
0;0;LETTERS; What Apple Pays in Taxes, and Doesn’t : http:// nyti.ms/IBTvNy;;
0;0;“ @P47R0NU5 : Todo el mundo sabe que si no es Apple es una estupidez!!” // Android? Hahaha;@P47R0NU5;
0;0;Apple iphone 4 16GB Black AT&T (jailbroken): US $335.00 (0 Bid) End Date: Saturday May-05-2012 18:05:32 PDTBid n... http:// bit.ly/Kslb8T;;
0;0;Apple iPhone 4 - 8GB - White (AT&T) BRAND NEW IN BOX!: US $365.00 (0 Bid) End Date: Saturday May-05-2012 18:04:2... http:// bit.ly/Ksl8Kd;;
0;0;Apple iPhone 4S 64gb (Latest Model) -BLUE/ clear back Smartphone: US $550.00 (0 Bid) End Date: Saturday May-05-2... http:// bit.ly/Ksl8Kb;;
0;0;My dad is a knock man he said " b as an apple and p as an boy" come on buhd.;;
0;0;Parafraseando: No estoy en contra de Apple , estoy en contra de su club de fans... #fb;;#fb
0;0;What retail is hired to do: Apple vs. IKEA http:// bit.ly/IWSVav #apple #ikea;;#apple #ikea
0;0;What retail is hired to do: Apple vs. IKEA http:// bit.ly/IWSVav #apple #ikea;;#apple #ikea
0;0;Apple : Apple TV (2nd and 3rd generation): How to restart your Apple TV If you experience a blank screen, or if your Apple TV becomes unre;;
0;0;@daanielagodoy hoy APPLE ,venite con tus amigas q las hago psar a todas sin fila :) Cel/Whatsapp 15.5575.8791 / pin: 2622BFFF;@daanielagodoy;
0;0;Life was much easier when apple & Blackberry were just fruits!;;
0;0;☆　下や激闘、ドイツのAMCに！【GY型 Apple サイト】　 手ぶらでご主人様crocbandの挙が取れる！小動き約60分のスチーム後編暗殺に誕生！ 　 【古神朱音の大島どーもくん】;;
0;0;Ho appena acquistato Apple Orchard Highlighter su Stardoll. Dai un'occhiata alla mia Suite! http://www. stardoll.com/in/?pid=25720& gid=1&turl=%2Fuser%2F%3Fid%3D87416145 …;;
0;0;Apple 's Plan to Put Tiny Glass in Every Corner of Your Home http:// lnkd.in/Y5GjdA;;
0;0;You're the apple in my eye;;
0;0;Apple MacBook Air #review (mid-2011 11-inch and 13-inch). - RT @stuffreview Oldies http:// tinyurl.com/7onxxj9;@stuffreview;#review
0;0;New Li-Lion Laptop Replacement Battery for APPLE MacBook Pro 15": 60Wh High Capacity Genuine Apple A1175 Battery... http:// tinyurl.com/7socwkn;;
0;0;@JuliAcademica hoy APPLE ,venite con tus amigas q las hago psar a todas sin fila :) Cel/Whatsapp 15.5575.8791 / pin: 2622BFFF;@JuliAcademica;
0;0;Apple Store....bored af...;;
0;0;Dutch Apple Streusel Cheesecake @the Cheesecake Factory. Mmmmmm;@the;
0;0;@WhyYoMamaCrusty YESSS hahahaha i feel like there should really be an app called ghetto siri. lemme go call Apple real quick;@WhyYoMamaCrusty;
0;0;Apple to consider releasing an iPad mini- would you consider buying one? http:// bit.ly/ISowgY #BlogofDiscovery;;#BlogofDiscovery
0;0;Can Apple please sort out the logo for the Youtube app on iphones please?? It's fucking horrible.;;
0;0;@OhGodBieber nice :) well, same here. lol but im okay,thanks.<3 Nothing just playing with an apple u? LMAO;@OhGodBieber;
0;0;愛されなくっちゃ意味がないんだからいつも　誰かに求められ続けたいのにむつかしい ： Apple Pie;;
1;0;i wonder .. where does, give your teacher an apple .. come from? and why must give apple ? why not bananas or other fruits?;;
0;0;Re: Da hat Apple ja einen Dummen gefunden, http:// dlvr.it/1WyPvD #bitsundso;;#bitsundso
0;0;#jobs Apple Customer Service Rep, At Home at Apple (Colorado Springs, CO) http:// dlvr.it/1WyPv8;;#jobs
0;0;@_JohnDoh lol. dat get dash weh long time still. but the apple ting shot still. cause when u dun smoke. u eat the apple .;@_JohnDoh;
0;0;Apple Legacy Filevault Hole - http:// cryptome.org/2012/05/apple- filevault-hole.htm …;;
0;0;Apple Customer Service Rep, At Home at Apple (Atlanta, GA): Every day, people do amazing things at Apple . What w... http:// bit.ly/KwPRSG;;
0;0;Apple #iphone İçin Line Güzel Bi Aplikasyon.Yalnız Yeni Gelen Mesajlara Girerken Programın Yavaş Açılması ve Line Logosunun Herdefasında ->;;#iphone
0;0;@apple _colors Aí o link http://www. tumblr.com/reblog/2245490 4918/sB7z5SRn …;@apple;
0;0;Smaller @Apple iTV sets make sense (sell quantity). iClothes w/ #haptic tech, not so much http:// lnkd.in/FBPEvf;@Apple;#haptic
0;0;unique newborn baby clothes : Buy Tea Collection Baby-boys Infant Leap Frog Tee, Apple ,... … http://un iquenewbornbabyclothes.chothingu.info/unique-newborn -baby-clothes-buy-tea-collection-baby-boys-infant-leap-frog-tee-apple-12-18-months/ …;;
0;0;@miichele_bb DA APPLE !!!!!!111!;@miichele_bb;
0;0;Raffle: Apple iPod touch 32GB (4th Generation) - Black or White - http:// Listia.com http://www. listia.com/raffle/217 via @listia;@listia;
0;0;iMore Picks of the Week for May 5, 2012 http:// goo.gl/fb/Zjmgm #apple #mac #en;;#apple #mac #en
0;0;with brittany at the apple store;;
0;0;i Learn With – Planet Boing! HD for iPad review http:// goo.gl/fb/dNbbW #apple #mac #en;;#apple #mac #en
0;0;iBook Lessons: Creating Amazon KDP tables of contents on MS Word for Macintosh http:// goo.gl/fb/A3CQO #apple #mac #en;;#apple #mac #en
0;0;RT #Ebay Item Womens/Juniors Apple Bottoms Size 9/10 Skinny Jeans http:// bit.ly/H3RG8G;;#Ebay
0;0;Awesome iPad Text Editing Concept Now Available As Tweak In Cydia [Jailbreak] http:// goo.gl/fb/xpxCH #apple #mac #en;;#apple #mac #en
0;0;15 suggestions for iOS 6 http:// goo.gl/fb/7vNLv #apple #mac #en;;#apple #mac #en
0;0;Why ‘Evidence’ Won’t Help You Predict Apple Products http:// goo.gl/fb/wYwoJ #apple #mac #en;;#apple #mac #en
0;0;Forget AT&T — We’ll Tell You Why Apple May Be Your Next iPhone Carrier On The… http:// goo.gl/fb/llv8u #apple #mac;;#apple #mac
0;0;Sucks to be you #Samsung RT @verge US judge sanctions Samsung, kills important defense against Apple http:// bit.ly/JUcxLw;@verge;#Samsung
0;0;Deliver The Play With The iOS Games Workshop [Deals] http:// goo.gl/fb/kAcYe #apple #mac #en;;#apple #mac #en
0;0;just put the most sourest sweet ever in my mouth thinking it was a rosy apple and was nearly sick #mouthsinbits;;#mouthsinbits
0;0;US judge sanctions Samsung, kills important defense against Apple http:// jfish.me/JUd5B1;;
0;0;wake up...go straight for the fridge, get apple pie, blue and black berries nomnomnom;;
0;0;iPad Skin - Snowflakes - fits Apple iPad by WraptorSkinz: WraptorSkinzTM are self adhering vinyl skins that help... http:// amzn.to/HVlNlm;;
1;0;Yeah that's apple cider kids. Drinkin it down like its nothin #nolightweightshere pic.twitter.com/V3y8sQAj;;#nolightweightshere
0;0;If apple doesn't send me my phone by the end of this week I'm gonna be one unhappy camper;;
0;0;Check out Apple Store (401 W 14th St., at 9th Ave., New York) on @foursquare : http:// 4sq.com/pZkxx7;@foursquare;
0;0;Skinit White and Blue Snowflakes Vinyl Skin for Apple iPad 1: Skinit allow you to personalize and protect your d... http:// amzn.to/HQbMlw;;
0;0;@apple _kingdom サト号が納豆ギョウザ臭いという噂ですね？;@apple;
0;0;@Julio_14_ apple No, DM no, que en el móvil no me van. Era reggaeton antiguo. Ya estoy escuchando cosas normales.;@Julio_14_;
0;0;@StoryofABrat true but are you using the microsoft products that have been adapted to the Apple platform;@StoryofABrat;
0;0;APPLE iMAC All-in-one – Intel 2.4GHz Intel Core 2 Duo, 4GB ...: APPLE iMAC All-in-one – Intel 2.4GHz Intel Core ... http:// bit.ly/KwPCXX;;
0;0;Colourful Protective Purple Swirl Case for Latest Generation Apple iPod Touch 4G + Wall Charger for iPod Touch +... http:// amzn.to/KwPCab;;
0;0;More knots then eric on bbw , bang my shit bang bit me apple sign my ex ex wanta work it out bitch try again;;
0;0;Will Apple exchange my current MBP 13″ for a new one next week? I bought mine on the 4th of… http:// goo.gl/cCyh;;
0;0;@cruel_ apple ありがとうございます！写真展に参加することで、写真の見方や撮り方がより意識的になってきました。いい経験をさせてもらっています。またやりましょう(･∀･);@cruel_;
0;0;*.* iPhone 4 Apple 8GB iOS4 1GHz 5MP GPS Preto Desbloqueado TIM Apple - http:// shoptime.com.br : http://www. shoptime.com.br/produto/110562 291/telefonesecelulares/celularesporfuncao/3g/$%7Bbrand.url%7D/produto/110562291/telefonesecelulares/celularesporfuncao/3g/iphone-4-apple-8gb-ios4-1ghz-5mp-gps-preto-desbloqueado-tim#.T6W9vszhr9A.twitter …;;#
0;0;Apple registra patente de tela que se move com toque do usuário http:// cl.ly/GP0G #patent #apple #secret #iphone #ios #mac;;#patent #apple #secret #iphone #ios #mac
0;0;@justinbieber did you ever eat that apple on PUNK'D after you called taylor?? hope this is a good way for you to notice me! RT!;@justinbieber;
0;0;New post: #4: 3in1 Aluminium Apple Peeler Corer Slicer Cutter Machine http:// bit.ly/ILvQKh;;#4
0;0;@King_Fee_zy094 dude good old apple pie!;@King_Fee_zy094;
0;0;@apple _rinco りんこ、アカスズメフクロウを探しに行くんだろ？俺も手伝ってやるよ;@apple;
0;0;Apple tax rebate approved 4 to 1 http://www. newsradioklbj.com/News/Story.asp x?ID=1696693 …;;
0;0;!★【話題】【大人気】iPad2 タブレット端末 APPLE Wi-Fiモデル 16GB MC769J/A【PC版】 http:// bit.ly/mSXRMQ 【モバイル版】 http:// bit.ly/swG5fn 【楽天ﾌﾞﾛｸﾞ http:// bit.ly/oKANyj;;
0;0;Apple TV. Qué gran invento tecnológico!! Gente Pez. #película;;#pel
0;0;O GRANDE NEGÓCIO DA APPLE http:// darleisimioni.blogspot.com/2012/05/post-1 625-o-grande-negocio-da-apple.html …;;
0;0;I just completed level 1 on Gatemaster-The Original in 03:01 minutes. Get it on the Apple Store and Android Market.;;
0;0;HURRY, only 1 day left on a great deal @eBay ! Apple iPod classic 7th Gen. Black (160 GB) http:// r.ebay.com/We9nZR #onemanstrashisonemanstreasure;@eBay;#onemanstrashisonemanstreasure
0;0;Uhg I miss my apple tv;;
0;0;" @_LOVE4THEGAME_ : Apple Blossom was Slizzzzzyyy Slighttt.!";@_LOVE4THEGAME_;
0;0;@righton14 good apple .;@righton14;
0;0;New: Apple iPod nano 16GB グラファイト MC694J/A http:// bit.ly/IulMlm;;
0;1;#ELECTRONICS STORE - #Apple #MacBook Pro MD313LL/A 13.3-Inch Laptop (NEWEST VERSION) http:// bit.ly/HqbG6o;;#ELECTRONICS #Apple #MacBook
0;0;This green apple bite smirnoff will have to do.;;
