retweets;favorites;text;mentions;hashtags
0;0;My Laptop #apple #tattoo #sk84life http:// instagr.am/p/KQ5Pfnwnjd/;;#apple #tattoo #sk84life
0;0;van Gogh - Self portrait, 1889 skin for Apple iPod Touch (4th Gen / 2010) http://www. coversandskins.com/226/SKNBRGVNG0 2IPDT4G/view …;;
0;0;Judge penalizes Samsung for withholding code in Apple case: The ongoing Apple vs. Samsung case being tried in th... http:// bit.ly/KwMZFv;;
0;0;must see Vangoddy Newest iTouch Hard Case with Matching Black Color Finish & Metal Kickstand for Apple iPod touc... http:// tinyurl.com/7j6k26a;;
0;0;Clovers Design Protective Decal Skin Sticker for Apple iPod nano 3G (3rd Generation) 4GB/ 8GB Player: Scatch Res... http:// amzn.to/KmFQrj;;
0;0;@apple _supp اوك;@apple;
0;0;This is a 'water apple ' - very interesting, I didn't think it tasted like much, def not sweet to me http:// instagr.am/p/KQ5SuWvz-v/;;
0;0;@apple _supp تونه وسلطه ! وشششش جوك ><;@apple;
1;0;こっちの方がいいかな？みまもりケータイのSIMを早く差し替えたい。アップル Apple SIMフリー iPhone 4S 16GB http:// amzn.to/IRdvww;;
0;0;@Carl_CoolSneaks Man i was tryin to get everclear today for apple pie shots;@Carl_CoolSneaks;
0;0;This ladies feet smells like Apple sauce & spinach ardichoke dip;;
0;0;Ont pourrait presque jurer que Apple a voler cette idée à #cjdltv http://www. vipad.fr/post/support-i pad-retro-tv#.T6WpLxoLpvY.twitter … RT @Carletonbeach;@Carletonbeach;#cjdltv #
0;0;@NiramayaD @tiamimba @riyanla @praseti0 @andhinadian yeee beneran guahh.. bawa apa kek apple cider.. kan seru haha;@NiramayaD @tiamimba @riyanla @praseti0 @andhinadian;
0;0;No one knows how hard I worked and how long I've waited for this, feels good so good! #MacBookPro #Apple #Di http:// instagr.am/p/KQ5SRUpVTV/;;#MacBookPro #Apple #Di
4;0;fast cash apple http:// fast-cash-apple.paydayloansosai.com;;
0;0;Study: Apple iPad Accounts for 94.64% of all Tablet Web Traffic http:// bit.ly/J5I7VO;;
3;1;What's the value of creativity in business? Apple : 60k employees. Foxconn (Taiwanese mfe of Apple products): 1.2M employees. Same revenue.;;
0;0;Macworld How to publish your MobileMe iWeb site on Dropbox | Software http:// macw.us/JxdUOa #Apple #CloudStorage;;#Apple #CloudStorage
0;0;Found out how to make Casey listen: sausage links. (The apple doesn't fall far from the tree.) #DadsTalking;;#DadsTalking
0;0;@mrsgremlinhead which gym? I'm joining apple this week;@mrsgremlinhead;
0;0;Apple MacBook 13" White Intel Core 2 Duo T7200, 2.0 GHZ, 1GB, 160 Gb Hard Drive, http:// blogreaction.net/q,458864;;
0;0;CUSTOM #Apple #iPhone and #iPod personalised Wallpaper, Neon Wallpaper Creator http:// bit.ly/NeonApp -497:0-23:0-50;;#Apple #iPhone #iPod
0;0;一枚の、イノベーション。（ Apple MacBook Air）;;
0;0;#apple #mac #macbook 17.3″ Laptop Sleeve with Extra Side Pocket , Soft Carrying Handle & Removable Shoulder Stra... http:// bit.ly/Liof6T;;#apple #mac #macbook
0;0;Disney makes the best caramel apples. Sour powder caramel apple FTW :) pic.twitter.com/Fgu98eb3;;
0;0;When Apple introduced the apple iphone 4g on 24 June: When Apple introduced the apple iphone 4g on 24 June 2010 ... http:// bit.ly/KwMNpC;;
0;0;The All New Apple iWatch | Apple iPhone Five http:// bit.ly/HTc0wF , wow cool sheit :o);;
1;1;currently tweeting from a random macbook in the apple store #bamf;;#bamf
0;0;Apple to build private restaurant to keep out snoopers http:// lnkd.in/9Qd3zN;;
0;0;Buffett prefiere IBM que Google o Apple - http://xn--cnnexpansin-zeb.com cnnexpansión.com;;
0;0;Oh @samsunguk I'm so bored of this stupid phone deleting all my texts & stopping me receiving calls. Time to migrate to Apple methinks...;@samsunguk;
0;0;@ligiazite tampoco Android... Apple !! Iphones es Superior en todos Los Aspectos;@ligiazite;
0;0;Im ready to turn 21 ill go to apple bees and get DRUNK;;
0;0;MacOS KenDensed: MacOS KenDensed: Apple ’s Taxes & RIM’s Publicity Stunts http:// tmo.to/ejLS ”;;
0;0;Apple plans 'breakthrough product' made from Liquidmetal via @Telegraph http:// soc.li/2jc6Dhf;@Telegraph;
0;0;Gonzaga Bulldogs Black Apple iPad Slip Sleeve: Bring your team pride into the 21st century when you slip your Ap... http:// amzn.to/ykXMlO;;
0;0;@_Bad_ Apple _ 神奈川は雲一つないなぁ;@_Bad_;
0;0;@apple _1873 yes that was really nice :-);@apple;
0;0;@VBlackRose @starsshiningout It's apple scented, crackles like fire and fucking sparkles. Genesis status. pic.twitter.com/RWFvtXoE;@VBlackRose @starsshiningout;
0;0;@_jackHA omg, I'm having such a shit night, so jealous right now, I'm eating an apple ._.;@_jackHA;
0;0;ID Apple : sauleps3@hotmail.com;@hotmail;
1;0;これも候補！みまもりケータイSIMを挿して使いたい！アップル Apple SIMフリー　iphone 4S　White　ホワイト http:// amzn.to/JkxcZ8;;
0;0;.@yusuzu_ apple _74 @mgmgmaguko @ayajdkt @yukinoyoseidam @yukidaruma_54 @megu_327 @dacha_22410 みんな、昨日はおやありでした！！;@yusuzu_ @mgmgmaguko @ayajdkt @yukinoyoseidam @yukidaruma_54 @megu_327 @dacha_22410;
0;0;Apple lolipops... (;;;
0;0;@InfamouzCharLee it only work with iPhone users and you gotta have it on and have a apple of;@InfamouzCharLee;
0;0;MiniSuit Aluminum Bluetooth Keyboard Case for Apple iPad 2 (Silver with Black Keys) http:// nblo.gs/xhDHg;;
0;0;Apple Tree Chilling !!!!!! Miss my dawg @Bossgeefa;@Bossgeefa;
0;0;RT @RockitBurgerBar : This is total food porn! The Hottie, The Farmhouse and The Johnny Apple (clockwise from the top). pic.twitter.com/yFoUzNUi;@RockitBurgerBar;
0;0;@_Bad_ Apple _ あれーもう眠いのー;@_Bad_;
0;0;Browse » Home » » >>Targus CleanVu Cleaning Pads for Apple iPad, iPad 2, iPhone, Motorola… http:// goo.gl/fb/uPHtW;;
0;0;@PaulTei Livin' dangerously! And the apple pie spanokapina thingy if about to come out of the oven. Can't leave now. Smells so good!;@PaulTei;
0;0;Want to create presentations that work on Apple iPods? Sign up for Slidepoint: Free account sign-up: http:// bit.ly/pxiRI8 #flash;;#flash
0;0;APPLE http:// instagr.am/p/KQ5RmahWGW/;;
0;0;Yeah. Ima go get me a bottle of something and a couple of Cran Apple Raspberry bottles of juice.;;
0;0;Verizon takes the lead on text to 911 services - #Apple vs #Android [Engadget] The FCC first outlined its... http:// tmblr.co/ZIxufvKxvfkh;;#Apple #Android
24;8;US judge sanctions Samsung, kills important defense against Apple http:// bit.ly/JUcxLw;;
0;0;Apple Customer Service Rep, At Home at Apple (Memphis, TN): Every day, people do amazing things at Apple . What will... http:// dlvr.it/1WyMxp;;
0;0;First time here.. This place is a mad house... (@Apple Store) http:// 4sq.com/KDilZ6;@Apple;
0;0;sour apple Smirnoff is that function!;;
0;0;These Islands Aren't Just a Shelter From Taxes: Luxembourg is a tax haven, and Apple funnels more than a billion... http:// bit.ly/JD5Gnx;;
0;0;Steve Jobs played FDR in internal Apple corporate video http:// bit.ly/JD5DIq;;
0;0;@1Directioners69 pelo e-mail do user da Apple eu consigo mandar mensagem como se fosse de um celular pra você, pelos meus cálculos, e sem +;@1Directioners69;
0;0;Skque Apple iPod Touch 4th Generation - 8GB 32GB 64GB Black Rubberized Case: Safely carry and cover your iPod To... http:// amzn.to/KwMfjC;;
0;0;They way they talking like nighas still ain't sliding whole chapters. Remember Eve ate the apple first , it's yall curse;;
0;0;Regulators Scrutinize Apple ’s “New iPad” In The U.K, Australia And Sweden http:// tinyurl.com/6whx7go #dazeinfo;;#dazeinfo
0;0;Read all news about BlackBerry, Apple , Android, Samsung and more mobile tecnology on http://www. appbb.co / #mobile #support;;#mobile #support
0;0;What apps can you get on android that are the same on apple ?: Question by VintageGeek: What apps can you get on ... http:// bit.ly/KwMdZ3;;
0;0;What apps can you get on android that are the same on apple ?: Question by VintageGeek: What apps can you get on ... http:// bit.ly/KwMdZ3;;
0;0;What apps can you get on android that are the same on apple ?: Question by VintageGeek: What apps can you get on ... http:// bit.ly/KwMdZ3;;
0;0;What apps can you get on android that are the same on apple ?: Question by VintageGeek: What apps can you get on ... http:// bit.ly/KwMdZ3;;
0;0;What apps can you get on android that are the same on apple ?: Question by VintageGeek: What apps can you get on ... http:// bit.ly/KwMdZ3;;
0;0;What apps can you get on android that are the same on apple ?: Question by VintageGeek: What apps can you get on ... http:// bit.ly/KwMdZ3;;
0;0;What apps can you get on android that are the same on apple ?: Question by VintageGeek: What apps can you get on ... http:// bit.ly/KwMdZ3;;
0;0;What apps can you get on android that are the same on apple ?: Question by VintageGeek: What apps can you get on ... http:// bit.ly/KwMdZ3;;
0;0;What apps can you get on android that are the same on apple ?: Question by VintageGeek: What apps can you get on ... http:// bit.ly/KwMdZ3;;
0;0;@apple _supp ممكن صورة والبرنامج اللي تستعلمه ؟;@apple;
0;0;What apps can you get on android that are the same on apple ?: Question by VintageGeek: What apps can you get on ... http:// bit.ly/KwMdZ3;;
0;0;@apple _supp هههههههههههههههههههههـً ما فيه احد فاتح الحين لو فيه كان ما عطينا التوست وجه;@apple;
0;0;Not a henny girl but I had 6/7 shots last night along with apple vodka and ting.;;
0;0;Bout to kill this liquor allllll night apple blossom baby;;
0;0;RT @Maryani_ Apple : Pagi" Ʊϑªн̣̣̇̇ bikin jengkel (>_<) tapi syukurin aja sudah...;@Maryani_;
0;0;Apple 's Plan to Put Tiny Glass in Every Corner of Your Home http:// lnkd.in/mWUXcd;;
0;0;@_pine_ apple *directioners;@_pine_;
0;0;Beneficios del Mercado Móvil apple y samsung. Resto desapareció http:// flpbd.it/HG9YT ”;;
0;0;US judge sanctions Samsung, kills important defense against Apple http:// vrge.co/LinPx8 Tech.alltop;;
0;0;So this Apple Bee's is JAM packed ...;;
0;0;This is total food porn! The Hottie, The Farmhouse and The Johnny Apple (clockwise from the top). pic.twitter.com/FoAM3KE4;;
1;0;Got dat BLUE PINE APPLE EXPRESS! blueberry mixd wit pineapple express on deck @G_A_M_E_INC @NukieThaG @Bobbysphotograp;@G_A_M_E_INC @NukieThaG @Bobbysphotograp;
0;0;Every tings a app wit apple #davion;;#davion
0;0;@_pine_ apple estuvieron nominados a mejor fanclub en unos premios de MTV Italia y ganaron y las directiones andan ardidas;@_pine_;
0;0;iPad charging port can be a mare at times. Apple need to get it sorted quick-sharp;;
0;1;Brock is spoiling me!! Going to the apple store to look at a new Mac book pro!!! #Upgrade !!!!;;#Upgrade
0;0;@_TerryTheBoss lol cool :) hey might be getting there early like 8.15 wanted to let you know, you wouldn't happen to have a apple charger?;@_TerryTheBoss;
0;0;@Joemon871 apple can't wirelessly fix it lol. Just don't update your firmware. Unlock that iPhone and keep it for yourself! #iMessage;@Joemon871;#iMessage
0;0;#Macbook #MacbookPro #Apple #AppleInc . #laptop #computer http:// instagr.am/p/KQ5EoQCfva/;;#Macbook #MacbookPro #Apple #AppleInc #laptop #computer
0;0;!: Blancho Bedding - [ Apple Letter] Luxury 5PC Comforter Set Combo 300GSM (Full Size) Promotion Today http://suededowncomforter.comforterpr;;
0;0;@tristananthonyJ go To the apple and go to system preferences;@tristananthonyJ;
0;0;@J_ Apple _3 watz up;@J_;
0;0;iPhoneを使うと Apple の為になる。;;
0;0;@GabrielAlfaro89 apple jajaajajajajaj;@GabrielAlfaro89;
0;0;It's so many Apple Bottom jeans and bad weaves on Belle Isle right now;;
0;0;@Apple _0324 mex town ?;@Apple;
0;0;at a restaurant that actually has snapple apple . love! :);;
0;0;Ma watching adams apple wit princilla;;
0;0;@Apple _1412 iso isone rak kenal aku.. hooo;@Apple;
0;1;Fireball Whisky and Apple Juice is and will forever be my new favourite drink.;;
0;0;@jayfriesen apple is shutting out apps that use dropbox under flimsy pretences;@jayfriesen;
2;3;I want to Apple Blossom queen.;;
0;0;@_Bad_ Apple _ 無理は駄目だよ？;@_Bad_;
0;0;US judge sanctions Samsung, kills important defense against Apple : US Magistrate Judge Paul Gr... http:// vrge.co/JD5vsw #technology #geek;;#technology #geek
0;0;80% of Ontario's apple crop this year was destroyed by the freezing temperatures last weekend. Yikes. http:// bit.ly/JnLjwX;;
0;0;@_Bad_ Apple _ おはよう腐藍(フーラン)。今日もがんばりましょ！;@_Bad_;
1;0;Apple valleys celebrity couple caught again! @jazminawada pic.twitter.com/Tistbkf1;@jazminawada;
1;1;Took grandson to Buffalo Grille for dinner. Excellent quesadillas, pecan crusted chicken, and apple pie.;;
0;0;Way to go apple !!!! http:// lnkd.in/gp7q2t;;
0;0;hey @apple you should make your iPad text editing work like this instead… http://www. cultofmac.com/165223/awesome -ipad-text-editing-concept-now-available-as-tweak-in-cydia-jailbreak/?utm_medium=twit&utm_campaign=spread-us …;@apple;
0;0;This is a carmel apple shot. #tasty pic.twitter.com/G5VGhWuZ;;#tasty
0;0;@sao_ apple (ΦωΦ)ﾌﾌﾌ;@sao_;
0;0;" @_ShitNobodySays : Wow, she has a sexy adam's apple ." @John_McDonald9;@_ShitNobodySays @John_McDonald9;
0;1;fuji apple juice, fresh squeeze lemon, Espolon tequila, sea salt and brown sugar rim, ice. Love pic.twitter.com/8LmyshdJ;;
0;0;Apple produziert neues Modell des iPad 2 http:// j.mp/IDEHgf #Apple #iPad #iPad2;;#Apple #iPad #iPad2
0;0;@TheAmyAnderson @aubreylily i watched the episode where Apple Bloom gets cutie pox today!!!;@TheAmyAnderson @aubreylily;
0;0;WANT! @Apple Music Row http:// instagr.am/p/KQ4_9lkYLl/;@Apple;
0;0;O mundo só será um lugar justo quando a loja da Apple aceitar o pagamento em balas.;;
0;0;#allyourjobs Apple Customer Service Rep, At Home at Apple (San Antonio, TX): Every day, people do amazing things... http:// bit.ly/vpiyHq;;#allyourjobs
0;0;Trying to sync music to my iPhone, but...: Apple Support Communities http:// adf.ly/8C5Qa #music;;#music
0;0;Many thanks to all those who posted the button sequence fix on the apple forums!;;
0;0;@_Bad_ Apple _ おはよう腐藍(フーラン)@自称・藍廃！　いい夢見れた？;@_Bad_ @;
0;0;Amazon holiday pricing! Apple iPad MC497LL/A Tablet (64GB, Wifi + 3G) Would make a nice gift! :) http:// amzn.to/9QxbWD;;
0;0;When I see the apple sign pop up on my phone after its been dead for a while >>> #bestsignever #addicted;;#bestsignever #addicted
0;0;Acer Iconia Tab A510 Review: In a market that’s primarily dominated by giants such as Apple and Samsung, it take... http:// bit.ly/KwLGX3;;
0;0;@pilistyles se me paro el corazon!Ahora m esta bajando nose q garcha pero lo conecto y m pone que el celular no esta conectado con apple;@pilistyles;
0;0;What a great read. But I still strongly believe that the next product apple will dominate will be in-car tech/nav syst… http:// lnkd.in/zUXDf6;;
0;0;Gente, já experimentaram rir para a SIRI? aiusheiuahs Ela responde com HE HE HE #Apple;;#Apple
0;0;Samsung Galaxy Tab 2 (10.1) Debuts At $399.99; Will The Company’s &#39;Price Drop Strategy&#39; Impact Sales Of Apple http:// bit.ly/Linr1P;;#39 #39
0;0;Caramel apple 's are a pregnant woman's best friend **marilyn monroe voice** pic.twitter.com/8lMXf94l;;
0;0;I love you Apple ! (@Apple Store w/ 2 others) http:// 4sq.com/KsjtEr;@Apple;
0;0;" @terratecnobr : Apple registra patente de tela que se move com toque do usuário http:// bit.ly/JbHMnE #TerraTecnologia ";@terratecnobr;#TerraTecnologia
0;0;Back to the Big Apple ! (@John F. Kennedy International Airport (JFK) w/ 79 others) http:// 4sq.com/Iul3kf;@John;
0;0;mp3 i-Pod shuffle apple fullset itu yg kayak gimana sih ?;;
0;0;@Tom_B_17 @himynameiscalum lime, apple and blueberry vodka is also on sale at tescow.;@Tom_B_17 @himynameiscalum;
0;0;App Price Changed : Today in Private Equity - Your Source for Industry News, new price : 3.99 #apple #iPad http:// bit.ly/IxqGNc;;#apple #iPad
0;0;Vip status with @apple in and out in less than 10 seconds @applestore #genius;@apple @applestore;#genius
0;0;software store - Apple TV MD199LL/A [NEWEST VERSION] http:// bit.ly/HiYsqu;;
0;1;I see they cleaned up the exploded apple that was in the hallway.;;
0;0;Is Apple ’s Time Capsule the best no-hassle, wifi-based backup solution that works seamlessly with Time Machine?;;
0;0;This apple bees >>>;;
0;0;> 8 - 10 inch Brilliant Butterfly Escape White Floral Netbook Laptop Sleeve Slip Case Pouch Bag for Apple iPad 1 iPad 2 iPad 3 / most of Ac;;
0;1;Bite Me.... Apple 's Sign #MacLife http:// twitpic.com/9ht1fl;;#MacLife
0;0;Best Apple iPad Accessories for Entrepreneurs http:// om.ly/BrKNR;;
0;0;worst day of apple blossom.;;
0;0;@Airborne_Lyssa got celebs signing her apple product , ohh nah not I lol .. they can sign my apple accessories nothing more;@Airborne_Lyssa;
0;0;@SenoraThomas u should create his own apple account. So he can have one 4 the future. iTunes can be shared as in the program. Not accounts.;@SenoraThomas;
0;0;@VintageJay He's the only cuz he came up with an untethered jailbreak for 5.1 and i wanna get it this time before apple fixes that ish lol;@VintageJay;
0;0;@apple _supp هههههههههههههههههههههـً ايفونوشوب;@apple;
0;0;Apple MacBook Pro - Core i7 2.8 GHz - 4 GB Ram http:// buyservice.vsemp.ru;;
0;0;@_megzzzzz I did, apple core out da window x;@_megzzzzz;
0;0;FreeBSD X: Berkeley Unix, Apple Quality http:// dlvr.it/1WyMX1 #teamfollowback;;#teamfollowback
0;0;Nice and cozy in winchester, va for apple blossom grand feature parade. pic.twitter.com/ZjKEwxjd;;
0;0;Apple flapple 2012 #wastypants;;#wastypants
0;0;Complete Tool Screw Driver #Torx Kit to Repair http:// tinyurl.com/822rqzp #2g #3G #Apple #Broken #Cracked #Display #GPS #iPhone #iPod #Lcd;;#Torx #2g #3G #Apple #Broken #Cracked #Display #GPS #iPhone #iPod #Lcd
0;0;May Apple Blossoms at Riverside Park, Janesville Wisconsin http:// bit.ly/Liniv4;;
0;0;Apple iMac Intel Aluminum (2.0, 24-inch, DDR2-800) 512MB Memory Ram Upgrade (A-Tech Brand): 512MB DDR2-800 (PC2-... http:// amzn.to/HSYvad;;
0;0;En estas cosas si hace falta el apple tv, ya proximo a que compararlo;;
0;0;Apple Customer Service Rep, At Home at Apple (Des Moines, IA): Every day, people do amazing things at Apple . What... http:// dlvr.it/1WyMTw;;
0;0;#cleanourcloud#help apple quit coal! pic.twitter.com/GJtRLri1;;#cleanourcloud #help
0;0;Apple 's Plan to Put Tiny Glass in Every Corner of Your Home http:// lnkd.in/qDGjZ4;;
0;0;RT @BorowitzReport DID YOU KNOW: The average Apple worker works 16 hours longer than the average Apple battery.;@BorowitzReport;
0;0;@bhockle "hello any apple ][ users out there :-)" ?SYNTAX ERROR - It's " Apple ][" :-) #a2c .chat .. Early evening it's JMP'in usually..;@bhockle;#a2c
0;0;RT @zonafull Con un SoC de 32 nanómetros, Apple mejora la batería del iPad 2 http:// goo.gl/fb/p774N;@zonafull;
1;0;Como se llama esa APP, que me quita "la calor", Apple ?;;
1;0;I was eating a Big Mac the other day when I thought to myself.. Apple does make some tasty products!;;
0;0;Feeling like Grover when you eat an apple :P ~Zoe;;
0;0;@andyp05 I'm not much of a drinker, and I find apple cider a bit too strong for me. Can't resist a Scrumpy when I go to Cornwall though.;@andyp05;
0;0;@HennaBennz apple pie :)));@HennaBennz;
0;0;logo fechamo um big apple e energetico , bebi mais ke o tilbita na nix , pksaskpapsa;;
0;0;@marcelia_ apple @RachelleJesuit @kerryaeo my next spontaneous thing is to get this beautiful guy pic.twitter.com/G0H0yEwF;@marcelia_ @RachelleJesuit @kerryaeo;
0;0;My grandfather eating this apple <<>> lmao;;
0;0;Buffett prefiere IBM que Google o Apple http:// bit.ly/IWQuop via @cnnexpansion;@cnnexpansion;
0;0;I'm happy today. Would you like to know why? Because I'm baked darling. Like an apple pie.;;
0;0;@philipeau De nada querido, eu sei q hj ele trabalha pra apple .;@philipeau;
0;0;@rin_ apple これおもしろそー!!もう読んでしまった？どうやった？;@rin_;
0;0;Apple and Samsung combine to collect 99% of mobile phone profits: By Shawn Knight Apple and Samsung have combine... http:// bit.ly/JD5a9l;;
2;0;Apple doesn't pay its Chinese workers shit because there are millions of other Chinese who can take their place. They pay shit b/c they can.;;
0;0;47 Digital Media Resources You May Have Missed http:// bit.ly/KaKBoE #socialmedia #tech #apple;;#socialmedia #tech #apple
1;1;@MichelleNeary3 You're the apple to my pie;@MichelleNeary3;
0;0;A reminder, we (all) share a single common unavoidable destiny. #Steve_Jobs #Apple #fb #in http://www. youtube.com/watch?v=MeK5wU 2JdX0&feature=youtube_gdata_player …;;#Steve_Jobs #Apple #fb #in
0;0;@apple _rkdo jajajaja q paja :| tan aburrido se ha vuelto xD;@apple;
0;0;New colors in the Urban Collection by Emile Henry: raspberry, tangerine, apple green, and nougat. pic.twitter.com/bw6XaGFQ;;
0;0;At the apple store on the new mac laptop... I want it <3 <3;;
0;0;I think it was point less going to apple blossom . Fuckkkknnn Wack -___-;;
0;0;@apple _supp هههههههههههههههههههههـً الصوره مغشوشه;@apple;
0;0;“ @LpewAl : @apple _supp لم احرجك هذا قليل من حقك سيدي لايسعني الا ان اقول شككرا واستمر ارجوك فأنت داهيه بالابداع” ولا زال هالحبيب يحرجني;@LpewAl @apple;
0;0;Apple CEO Tim Cook meets with Ferrari CEO - http:// 9to5mac.com/2012/04/25/app le-ceo-tim-cook-meets-with-ferrari-ceo-for-two-hour-meeting/ …;;
0;0;Trending: #Facebook , #Yahoo , #FlyLeasingLtd , #WFCWellsFargo &Co., #USO , #Alibaba , #TechWeekly , #YahooWants , #Apple , #Statoil;;#Facebook #Yahoo #FlyLeasingLtd #WFCWellsFargo #USO #Alibaba #TechWeekly #YahooWants #Apple #Statoil
0;0;@apple _star18 おはですー！+.(。Ő∀Ő)ﾉﾟ+.;@apple;
0;0;Twice in one day it seems. (@Apple Store) http:// 4sq.com/JcCGro;@Apple;
0;0;Yeyeyeye, teaaaaaam apple pic.twitter.com/Sa0yR3PW;;
0;0;Les apple addict aidez moi svp....;;
0;0;I'm eating apple sauce and graham crackers for some reason;;
0;0;Babysitting all apple blossom -_-;;
0;0;Mentions and buzz for Bad Apple : http:// sch.mp/0cAWw - RT @msmeredithrose Birthday dinner for @theevanstyles at The Bad Apple #amazing h...;@msmeredithrose @theevanstyles;#amazing
1;0;Apple and Samsung combine to collect 99% of mobile phone profits http:// bit.ly/LimYg1;;
0;0;Apple should make it where AT&T supplies data and Verizon gives voice;;
0;0;@jleehenderson Ever since you pointed out how dumb that Zooey Apple commercial is its all I can think of when it's on. Is that rain?;@jleehenderson;
0;0;FreebieQueen Update: When I try to download free games, I am...: Apple Support Communities http:// bit.ly/KwKSS3 #freebie #web #tech;;#freebie #web #tech
0;0;board games-board games for families: LEGO Creator 5891: Apple ... http:// bit.ly/Ksj9Wj;;
0;0;Viva Moby, Apple wizard!;;
0;0;@PaidnLaid from when you came with that apple ishhh we were beefing mate lol;@PaidnLaid;
0;0;Apple 1 Steve Jobs and wozniak ;;; smitt9 channel videos: http:// youtu.be/lcKAVRzkVfU via @youtube;@youtube;
0;0;My study date with Apple Jacks! http:// instagr.am/p/KQ41vKITTw/;;
0;0;On my lunch break. Hitting up McDonalds. I cannot escape those apple pies;;
0;0;@Nathantarctique @Anthonysoito Apple a été le premier à introduire le Smartphone tel qu'on le connaît aujourd'hui;@Nathantarctique @Anthonysoito;
0;0;Forget 1 Trillion: Can Apple Become a Multitrillion-Dollar Company? http:// goo.gl/fb/2gyWD #etf;;#etf
0;0;Apple blossom !!;;
0;0;Durable Black All-in-One Bluetooth Keyboard and Protective Hard Case for Apple iPad 2 Tablet (16GB, 32G, 64GB) F... http:// amzn.to/IHm7yF;;
0;0;Purple and Pink Durable Messenger Pinn Bag Carrying Case with Removable Shoulder Strap for Apple iPad 2 Tablet (... http:// amzn.to/IHm7ir;;
0;0;Silver and Blue Durable Messenger Pinn Bag Carrying Case with Removable Shoulder Strap for Apple iPad 2 Tablet (... http:// amzn.to/IHm9GN;;
0;0;Apple Customer Service Rep, At Home at Apple (Des Moines, IA): Every day, people do amazing things at Apple . What... http:// dlvr.it/1WyLyX;;
0;0;@apple _star18 おはよう燐@ジローの誕生日♪。ゆっくりしてて大丈夫か時間？てきぱき動けよー;@apple @;
0;0;at the apple store. i get to upgrade to the iPhone 4 in June. yayayayayayy. for now the 3G will have to do.;;
0;0;Cause u r the apple to my pie and u r the straw to my berry ^^;;
1;0;After #Apple & #consumers contd. 2 ignore the evidence,what prompted the co. to pay attn? On #Talkback http:// vsb.li/V0rX3v #csr #business;;#Apple #consumers #Talkback #csr #business
0;0;Designing for Growth - Apple Does It, So Can You http:// onforb.es/Iosayt;;
0;0;Cookies and some apple juice;;
0;1;Healthy??RT @SongzSweetie: Mcdonalds can miss me with these apple slices in this happy meal. Tf I look like eating warm apple slices???;@SongzSweetie;
0;0;Apple Kimchi?? :/;;
0;0;@May 06, 2012 at 12:45AM its #comp time 2 #win the all NEW #apple #ipad with #zagg here on #fb http:// s-hq.it/Jq3Yqs #competition;@May;#comp #win #apple #ipad #zagg #fb #competition
0;0;Samsung and Apple get 99% of mobile profits, read more here: http:// ow.ly/aIrNR #android;;#android
1;0;@apple _supp لم احرجك هذا قليل من حقك سيدي لايسعني الا ان اقول شككرا واستمر ارجوك فأنت داهيه بالابداع;@apple;
0;0;BELKIN – LIVEACTION CAMERA SHUTTER GRIP FOR APPLE IPHONE http:// aktiveinfo.com/blog/2012/5/5/ belkin-liveaction-camera-shutter-grip-for-apple-iphone.html …;;
0;0;After #Apple & #consumers contd. 2 ignore the evidence,what prompted the co. to pay attn? On #Talkback http:// vsb.li/HABlON #csr #business;;#Apple #consumers #Talkback #csr #business
0;0;http:// bit.ly/rsoj1H ★ええ？安いぃぃ～!!ipad2がこの値段-!!!【送料無料】【新品 APPLE iPad2 16GB MC769J/A 　詳しくは→ http:// bit.ly/mSXRMQ 【楽天ﾌﾞﾛｸﾞ】 http:// bit.ly/nCWJKx;;
