retweets;favorites;text;mentions;hashtags
0;0;Gracias amigo Yoltic Asesor Apple http:// fb.me/35p5itfMy;;
0;0;@kenna_allen21 I don't know I watched it on Apple TV! (:;@kenna_allen21;
0;0;Cute iPad 2,3,& 4th Generation Hello Kitty Protector Get 5 items+FREE SHIPPING $21.95 http:// bit.ly/15zY3hk #ipad #apple;;#ipad #apple
0;0;I had one at WA yesterday it was good af! RT @its_riDQulous : I really want a candy apple;@its_riDQulous;
0;0;Apple - Podcasts - https:// appsto.re/i6FH96J #iTunes;;#iTunes
0;0;To all Apple Valley Residents: if you did not receive an Automated phone message from your childs school then im... http:// fb.me/31DrPXEWJ;;
0;0;“ @FunnyPicsDepot : Count The Struggles https://twitter.com/FunnyPicsDepot/status/389540335158059008/photo/1 pic.twitter.com/JEPy9nzGOP ” where are her apple bottom jeans?;@FunnyPicsDepot;
0;0;Apple Jacks is so skinny;;
0;0;@S_bad_ apple なるほど、そこに意味はない、したいからやっているんだ、と。なるほど。 部活いてらぁ( ´ ▽ ` );@S_bad_;
0;0;I have completed the quest 'Chop down 2 Apple ...' in the #Android game The Tribez. http:// gigam.es/qtw_Tribez #androidgames , #gameinsight;;#Android #androidgames #gameinsight
0;0;Apple pie is the only pie I'll ever like #delicious #yum;;#delicious #yum
0;0;@fantastic4sum apple : The alternative to the orange. http:// apple.urbanup.com/1582300;@fantastic4sum;
0;0;pqp essa apple tá de graça com a minha cara;;
0;0;She's my common sense RT @Apple _Dip : @callhertee love that ass to death but ain't no second chance;@Apple @callhertee;
0;1;Roku LT is a better buy than Apple TV http:// money.cnn.com/2013/10/10/tec hnology/roku-lt-review/index.html … #roku #appleTV #technology;;#roku #appleTV #technology
0;0;Jung JoonYoung hiba a ser parte de LED Apple;;
0;0;Buying an iphone was the worst decision of my life. Fuck apple .;;
0;0;apple crisp is my favorite thing about fall;;
0;0;What does one wear apple picking?;;
0;0;Apple Streusel http:// instagram.com/p/fbUjVZnahh/;;
0;0;@Tetratine apple;@Tetratine;
0;3;Momma is making apple cider & it makes our house smell heavenly.;;
0;0;Apple picking was fun but tiring;;
0;0;@giannanemehh go to settings, iTunes and App Store, click on Apple ID, view Apple ID, then change country/region;@giannanemehh;
0;0;Apple cider <333;;
0;2;Nothing better than the smell of apple crisp in the oven;;
0;0;@GC_SA pues sí mañana no me dicen que onda o me lo cambian si lo llevare a Apple;@GC_SA;
0;0;so yeah.. i have to give the apple butter to people...;;
1;0;But I love apple . Every time I call with a problem they fix it right away. If I was still with metro they'll be like you on yo own my nigga.;;
0;0;@Tgreene_88 @_ManYouSLEEP fuck yo apple head ass up;@Tgreene_88 @_ManYouSLEEP;
2;0;Celebrating Apple 's Birthday today. Happy birthday @XoAppleR http:// instagram.com/p/fbUcLWsVOC/;@XoAppleR;
1;1;Las 10 cosas que no sabías sobre Apple ! http://www. publital.net/las-10-cosas-q ue-no-sabias-sobre-apple/#.UlsynO8GrgQ.twitter … vía @PUBLITAL_NET;@PUBLITAL_NET;#
0;0;[gn]売れない iPhone 5C と、思惑どおりの Apple とは？：The Most Trustworthy Apple Analyst Out There Just Slashed His Estimates For .. http:// j.mp/1bQv124;;
0;2;“ @taytayamos : I want a Carmel Apple so baaad ” me too and I can't for another year or so #fuckbraces;@taytayamos;#fuckbraces
2;0;Big thanks to Apple for supplying iPad Mini's to the #MATSITI conference today for everyone to use! #digitalinclusion #IndigenousX;;#MATSITI #digitalinclusion #IndigenousX
0;1;Apple your iTunes isn't working;;
0;2;Apple cider;;
0;0;A customer shared this photo with us after she purchased Zombie Orchard today. Granny Smith apple on the bottom... http:// fb.me/1X7PJ34Qv;;
0;0;Hasil jadi! Hardcase and softcase only 100k! For BB, apple , samsung, sony, nokia, lenovo, htc,… http:// instagram.com/p/fbUgMZJKVS/;;
0;0;I love apple and pecan pie too much;;
0;0;Incredible day w/my Brick family as 70 of us headed upstate 2navigate a corn maze, apple pick & hay ride! chk it! http:// bit.ly/17ocpyO;;
1;0;Ok, ultimamente le estoy agarrando gusto a las #manzanas #apple . :D;;#manzanas #apple
0;0;@ali_tummino stay home and come apple picking with me;@ali_tummino;
0;0;Working apple harvest today was completely awful in the rain. #somuddy;;#somuddy
0;0;Why can't my boyfriend have Friday off so we can go apple picking?! Dammit!!;;
1;0;Who Would Take Apple Candy's From Someone Else's House On Halloween Though? #Ghetto #Homeless #Greedy;;#Ghetto #Homeless #Greedy
0;0;@JonAcuff Which begs the question... Jon, you need our local apple (and other things) source: http://www. bulknaturalfoods.com /;@JonAcuff;
0;0;@jais_ apple you nasty aye;@jais_;
0;0;Apple iPhone 5S vs Samsung Galaxy S4 Which Is Faster Better Benchmark AT&T #attmobilereview http:// dld.bz/cQFWQ;;#attmobilereview
0;0;Apple présentera un nouvel iPad le 22 octobre http:// ift.tt/15zY19r;;
0;0;@terazeanoto APPLE CINNAMON OMFG THERE ARE THREE RIGHT THERE;@terazeanoto;
1;0;Watching these #Samsung Galaxy Gear commercials makes me wonder if #Apple is going to ever wake-up from its innovation nap.;;#Samsung #Apple
0;0;Apple iPhone 5S vs Motorola Moto X Which Is Faster Better Benchmark AT&T #attmobilereview http:// dld.bz/cQFXd;;#attmobilereview
0;0;@teentitansdope what did the apple do this time?;@teentitansdope;
0;1;Apple picking with my babe thehipp04 http:// instagram.com/p/fbUYQ-p7sX/;;
0;0;Apple iPod nano 16GB Slate (7th Generation) NEWEST MODEL http:// amzn.to/14dTTfa;;
0;0;VERY COOL! -- "Exclusive Photos: Apple ’s new campus in Cupertino" http:// photos.mercurynews.com/2013/10/11/exc lusive-photos-apples-new-campus-in-cupertino/ …;;
0;0;Apple iPhones vs Samsung Galaxys Geekbench Benchmarks #attmobilereview http:// thechrisvossshow.com/apple-iphones- vs-samsung-galaxys-geekbench-benchmarks/ … via @chrisvoss;@chrisvoss;#attmobilereview
0;0;Caramel apple suckers >>>>>>>;;
0;0;@jadadukes3 | Apple *;@jadadukes3;
0;3;Goodluck on your Thesis defense! Last push for this sem pretties! God Bless.. @roseann392 @apple _dee_ap @krisTELLMEMORE @JAlipato;@roseann392 @apple @krisTELLMEMORE @JAlipato;
0;0;Qt Brothers: vamos a Vipper, no vamos a Six, pero ahi hay viejas, vamos a Apple que ganamos todos, Apple está cerrado, ya fue vamos a Alvear;;
0;0;Herhold: New Apple building will bring worldwide attention - San Jose Mercury News http:// dlvr.it/47WyWP;;
0;0;Apple snicker salad>>>>>>>>>>;;
0;0;Granny Smith Apple Pie Treat Sherri Lynn Beitz-Prather Awesome! Awesome! Not as hard as it looks!! 3 Granny... http:// fb.me/1Q5d1orlU;;
0;0;Apple iPhone 4S 16GB ( #White ) - AT&T http:// tinyurl.com/lpgf5b7;;#White
0;0;Esse pessoal é anti-capitalistas mas possuem celulares da Apple , computadores de última geração... Fascistas!;;
0;1;Apple Strudel>>>>>;;
0;0;Job Ad Triggers Heated Apple -China Mobile Speculation http:// ectnews.com.feedsportal.com/c/34520/f/6320 03/s/3255a426/sc/15/l/0L0Smacnewsworld0N0Crsstory0C791630Bhtml/story01.htm …;;
0;0;Naw but... lauren pope is a man ! Nobody seen her adams apple ?;;
0;0;My first apple pie from scratch. When life gives you apples, you make apple pie! http:// instagram.com/p/fbUSARHveI/;;
1;1;Apppless!!! #apple #weekend #hangout #icecream #sweets #thegroove #losangeles #la #california #usa @… http:// instagram.com/p/fbUIKEm03p/;@;#apple #weekend #hangout #icecream #sweets #thegroove #losangeles #la #california #usa
0;0;Carmel apple shake at steak n shake >>>>>;;
0;0;" @kafaak : นักวิเคราะห์บอก Apple จะหาผู้ใช้หน้าใหม่ซื้อ iPhone ยาก ... เพราะใครๆ ก็มีกันหมดแล้ว #ittwt - http:// pulse.me/s/s5isC "...ตลกร้าย;@kafaak;#ittwt
0;0;The Samsung Galaxy Note III seriously makes me rethink my dedication to Apple .;;
0;1;Apple announces iPhone 5s: Touch ID fingerprint security, 64-bit A7 CPU, new gold option coming Sept. 20 http:// j.mp/163fuJy #Apple;;#Apple
0;0;http:// micro-service.com.ua/remont_smartfo nov.html … - Ремонт смартфонов, ремонт кпк, ремонт google-фонов ремонт смартфонов Apple iphone, Ре;;
0;0;#Goldbox #Deals CaseCrown Cali Snap On Case (Coral Surf) for Apple iPhone 5S http:// goo.gl/fb/9IUV1;;#Goldbox #Deals
0;0;The Apple iPhone 5s leather case is a dirt magnet, tell us how you keep it clean! http:// j.mp/1aCewS5 #Apple;;#Apple
1;3;This weather makes me want apple cider, Christmas music, and holiday food. But mostly just holiday food.;;
0;0;View the Bloomfield Apple Festival Parade http:// j.mp/163futd #Apple;;#Apple
0;0;Apple Pie http:// instagram.com/p/fbUfbnQAsx/;;
0;0;Apple Festival Parade hits the streets http:// j.mp/1aCez07 #Apple;;#Apple
0;0;Samsung biting Apple too much yo!!! #UnrealCopying;;#UnrealCopying
0;0;Herhold: New Apple building will bring worldwide attention - San Jose Mercury News http:// dlvr.it/47WyN7;;
0;0;Apple Crumble #Thanksgiving #dessert http:// instagram.com/p/fbUXucy1_J/;;#Thanksgiving #dessert
0;0;“ @CommonWhiteGirI : grandma: DO YOU WANT AN APPLE me: no thanks grandma grandma: HERES YOUR APPLE ”. my grandma all the time!;@CommonWhiteGirI;
0;0;Apple picking with my favorite girl http:// instagram.com/p/fbUciSt1-3/;;
0;0;http:// micro-service.com.ua/remont_smartfo nov.html … - Ремонт смартфонов, ремонт кпк, ремонт google-фонов ремонт смартфонов Apple iphone, Ре;;
0;0;Homemade apple pie! http:// instagram.com/p/fbUco3jWpo/;;
0;0;@APPLE _IMAN @baraaziad @abod_e213 انا عن نفسي صمت السنه الى فاتت;@APPLE @baraaziad @abod_e213;
4;7;Those couples that take cute pictures at the apple orchard make me cry just a bit;;
0;0;I love apple juice I could drink it all day;;
0;0;@MDawgg_97 I have some caramel apple pops with your name on them!! Real ones this time;@MDawgg_97;
0;0;An apple cozy! I'm just tickled by this thing. http:// instagram.com/p/fbUcMHQNPp/;;
0;0;Celebrate Art, Food, Music, Tech and Startups in Las Vegas http:// bit.ly/15zUKXF #socialmedia #tech #apple;;#socialmedia #tech #apple
0;0;@BillyLeishman Got an iphone charger, call it apple juice.;@BillyLeishman;
0;0;phone still broke..taking it to apple tomorrow..if u need anything dm me;;
0;6;Some pretty hard apple pie..... pic.twitter.com/2lvNjrkaaz;;
0;0;Apple #iPhone5S Users Complain Sbout 'Blue Screen Of Death' Error: http:// onforb.es/GS5JTg #Apple #iOS7Problems;;#iPhone5S #Apple #iOS7Problems
0;0;Apple Fritter Rings Recipe http:// pinterest.com/pin/4970145088 48166482/ …;;
0;0;Must try Apple cinnamon water. Detox and lose weight. via @pinterest http:// pinterest.com/pin/1904178904 68450718/ …;@pinterest;
0;0;http:// micro-service.com.ua/remont_smartfo nov.html … - Ремонт смартфонов, ремонт кпк, ремонт google-фонов ремонт смартфонов Apple iphone, Ре;;
0;0;Weekly Roundup: Apple iMac review, BlackBerry Z30 review ... http:// dlvr.it/47WyL6 (Google News);;
0;0;A Look at the Features on the Apple iPhone 5s - Motley Fool http:// dlvr.it/47WyJc;;
1;1;Apple cider is sex in a cup;;
0;0;米 Apple 、iPhone 5cの生産量を半減ー中国をはじめ、各国で販売不振のためか #tech #niftynews http:// news.nifty.com/cs/technology/ techalldetail/meeti-20131011-210373/1.htm … やっぱり買うんだったら５Sになるんでしょうか？;;#tech #niftynews
0;0;apple pie and the tigers game. #score;;#score
0;0;-Vamos a terminar muertos gracias a las maquinas ( Apple )- Yo robot;;
0;0;@benandjerrysUK Choc Apple for Halloween. Toffee and Choc ice creams with apple sausage and Choc chunks.;@benandjerrysUK;
0;1;My mom bought me Carmel Apple suckers;;
0;0;quer ver em vez de colocar limão colocar big apple , mds q coisa dos deuses;;
0;0;Earlier today at the apple orchard with my heart @JustJay89 #lovehimsosomuch pic.twitter.com/RNIXiCWJOP;@JustJay89;#lovehimsosomuch
0;0;@Terra_Cide apple pie schnapps. problem solved!;@Terra_Cide;
0;0;Trying to be #Healthy Fruit shake for snacks: apple ,banana,beets,carrots,pineapple& malunggay. #paleo … http:// instagram.com/p/fZzvNat9nR/;;#Healthy #paleo
0;0;can eating mcdonalds apple pies be a profession;;
0;0;New Apple iphone five Situation Supplies Great Choice to Before Models: Draco Design's new Draco 5 aluminum bu... http:// bit.ly/19y321D;;
0;0;@adamalsing funkade i typ 1-2 dagar för sambon sen var samma fel tillbaka igen.. Get your shit together Apple !;@adamalsing;
0;0;#nighttimecoding #geek #apple #html pic.twitter.com/WHCQ5I3YtK;;#nighttimecoding #geek #apple #html
0;0;@JulesMancini *sighs happily and closes his eyes* Bonne nuit, apple pie.;@JulesMancini;
0;0;Get better scores in #Chinese with jbvTeacher http:// goo.gl/RPtsW8 for #mac #apple #education #backtoschool;;#Chinese #mac #apple #education #backtoschool
0;0;"@RappingWeezy: Got an iPhone charger... Call it apple juice";@RappingWeezy;
0;0;My night consists of watching the Tigers & drinking apple cider.;;
0;0;#Le #Petit #apple http:// instagram.com/p/fbUY1DCQ-T/;;#Le #Petit #apple
0;0;Damnit where's this snake! Come on snakey come take a nice bite out of this apple ...;;
0;0;Urban Armor Gear UAG Apple iPhone 5 & 5S Composite Case Aero (Blue) - Retail box $16.99 http:// bit.ly/1aCeucP #cellphones;;#cellphones
0;0;Apple может запустить программу по приему старых iPhone и вне США.. http:// goo.gl/fb/X2kwa;;
0;0;klo bsa d atas brooo.... :) jiayoo... RT @kompascom Sony Mau di Bawah Samsung dan Apple http:// kom.ps/AF6oXe;@kompascom;
0;0;Office for iPad will debut after next Windows version | TUAW - The Unofficial Apple Weblog http:// aol.it/16a3G2X;;
0;0;Apple announces iPhone 5s: Touch ID fingerprint security, 64-bit A7 CPU, new gold option coming Sept. 20 http:// j.mp/1aCerh4 #iPhone;;#iPhone
0;1;Baked pumpkin chocolate chip cookies and an apple crisp pie, I'm just turning into a housewife recently.;;
0;0;The Apple iPhone 5s leather case is a dirt magnet, tell us how you keep it clean! http:// j.mp/163fppj #iPhone;;#iPhone
0;0;@terazeanoto mint,ocean breeze aka fish and apple cinnamon;@terazeanoto;
0;0;Apple iPhone 4 – 16GB – Black (AT&T) Smartphone (MC318LL/A) http:// dlvr.it/47WxtG;;
1;0;For Apple iPod Nano 3rd Gen 3 3G Sport Armband Case Pouch Arm Band Strap 4 8G $3.99 http:// bit.ly/15zXV1w #gadget #electronics;;#gadget #electronics
0;0;So I went into the apple store today to look at the 5s and 5c and i still have no clue which to get;;
0;0;WIN an Apple TV http://www. royaldraw.com/draws/countrie s/united-states?drid=MTMxMQ==&rcdrid=MTMxMQ==&rcref=OTBUVU5oWFRVMTBkNUVqVDNCelVOZEhNRDVFZUJwV1RtWkZWT0p6WkUxME1GUjBUNlZrZVlsM1lxNTBkTnBXVA==&rcsrc=dHdpdHRlclNoYXJl …;;
0;0;It's crazy that so many ppl go apple picking I felt like I saw a 100 people I knew;;
0;0;Rumor: #Apple Planning 5.7-Inch #iPhone for 2014! http:// on.mash.to/17XFk0d;;#Apple #iPhone
0;1;Have eaten two boiled eggs, couple of rich tea biscuits, banana, apple , packet of popcorn and just boiled the kettle for pot noodle..;;
0;0;Apple Will Be Holding A Press Event Oct. 22 http://www. crysis.tv/appleholdingpr esseventoct22/ … via @crysisyt;@crysisyt;
0;0;Thx @nytimes for rating my NJ area #2 spot for apple picking; tourists, congestion and packed local restaurants! #idiotdrivers !;@nytimes;#2 #idiotdrivers
0;0;Coming from Apple in 2014: 12-inch Retina MacBook, sharper iPad, cheaper iMac? http:// flip.it/CwbT9;;
0;0;But if I had to choose Windows > Linux > Apple;;
0;0;Pumpkin pie, apple pie, pecan pie, butter tarts and peach cobbler.. I guess you can say my grandma went a little over board this year;;
0;0;Skinit Dragon Ball Z Young Gohan for LeNu Plus Case for Apple iPhone 5 5S http:// amzn.to/152ZB56;;
1;1;Samsung Galaxy has a phone watch like the power rangers suck that apple ...where ya at????;;
0;0;Zum Verkaufen Apple iPhone 5 e Samsung Galaxy S4 @300Euros : Ich habe das Apple iPhone 5 und Samsung Galaxy S4 ... http:// tinyurl.com/k2h7g33;@300Euros;
0;1;Cassandra just asked me if Christopher Columbus was the one who picked the apple off the tree..;;
0;0;#apple Silver 1.44" Touch Smart Bluetooth Watch Phone Sync Dial SMS with SIM TF MP3/4 http:// ift.tt/15utQjQ;;#apple
0;0;oh apple;;
0;0;#apple Apple iPhone 4s - 64GB - Black (Verizon) Smartphone http:// ift.tt/19DWr3I;;#apple
0;0;#apple Apple PowerBook G4 15" 667MHZ / 512mb OS X 10.4 and Maxtor external hard drive http:// ift.tt/15utREn;;#apple
0;0;#apple SPECK CandyShell for iPhone 4S/4 - Black/Dark Gray http:// ift.tt/1cCeEFW;;#apple
0;0;#apple apple magic keyboard http:// ift.tt/1gx4Qgx;;#apple
0;0;#apple UNCOMMON IPHONE 4 DEFLECTOR CASE-PURPLE MOSAIC ROSES- BRAND NEW @NO RESERVE http:// ift.tt/GTJc8J;@NO;#apple
0;0;#apple Apple iPhone 4 -32GB -Pink Smartphone(Factory unlocked ) CLEAN ESN, iOS 7. http:// ift.tt/1gwbSlH;;#apple
0;1;Had fun pumpkin& apple picking with the boyfriend;;
0;0;Just finished eating Apple pie & ice-cream!!;;
0;0;Wow no apple pie. Kmt;;
0;0;#apple TEAM CANADA HOCKEY CANADA IPHONE 5 HARD PLASTIC CASE http:// ift.tt/1cd3VPq;;#apple
0;0;#apple OtterBox 2600 PDA iPhone Case http:// ift.tt/1cd3VPk;;#apple
0;0;Apple needs to speed things up and get me an iPhone watch to go with my iPhone soon.;;
0;0;#apple JENSEN JHD3630BTB USB SiriusXM Ready and iPod Ready Stereo with Bluetooth http:// ift.tt/GRohTy;;#apple
0;0;#apple APPLE I PHONE 4. VERIZON 8GB Clean Esn http:// ift.tt/GSsx4K;;#apple
0;0;Swedish apple pie - Apple picking is one of those seasonal markers in New England.... http:// j.mp/17mFERV #KendraNordin #NewEngland;;#KendraNordin #NewEngland
0;0;Apple iPhone 5c 16GB (Pink) - Verizon Wireless , http://www. amazon.com/exec/obidos/AS IN/B00F3IEOM4/now_keyword-20/ref=nosim/ … #Amazon;;#Amazon
0;1;apple crisp;;
0;0;Esta buenisimo el nuevo comercial de Motociclo,el de las hinchadas de Nokia y de Apple xD @steinpipe;@steinpipe;
0;0;Apple pie to help ease the pain #footballproblems #saintsvspats #foodie;;#footballproblems #saintsvspats #foodie
0;0;Apple lanzará su programa de intercambio de iPhones en Europa http:// applediario.com/2013/10/11/app le-lanzara-su-programa-de-intercambio-de-iphones-en-europa/ …;;
0;0;Вот тебе на Сенатор Джон Маккейн: " Apple заслуживает лучшего, чем Тим Кук".;;
0;0;PowerGen White Dual USB Port 2 4A 12W AC Travel Wall Charger w Sviwal Plug Designed for Apple … http:// goo.gl/fb/XXdKW;;
0;0;RT @MeelowLab : #iPhone5s causa reinicios y pantallazos azules #fallo #Apple http:// fplus.me/p/3yrO CC @somosiphone @chdve;@MeelowLab @somosiphone @chdve;#iPhone5s #fallo #Apple
0;0;Apple planea la construcción de su nueva sede con un edificio anillado que ha llamado la atención por su diseño. pic.twitter.com/I6ta9Clk0Z;;
0;0;Ay @jstMOVEforward_ remember that strawberry apple ale I was tellin u bout..........;@jstMOVEforward_;
1;0;Cie taowa :) @Nhuyy_ @Ghinahsalsabila @Gadisdindaa @iydhanurfaidah @IrNirmala @AlexiaCia @Apple _Afhi31 @Anhaaaa_;@Nhuyy_ @Ghinahsalsabila @Gadisdindaa @iydhanurfaidah @IrNirmala @AlexiaCia @Apple @Anhaaaa_;
1;1;Windows is ratchet, Apple is prude, and Linux is anal;;
0;0;IPhone 4s Apple Por Apenas R$ 899,90 Em Até 12x Sem Juros!: http://www. clubedoclique.com.br/redirect.php?i d=15529&banner=282&token=51ed557fb6ebbacb47be6e19f8e9cef2 …;;
0;0;Turn down for apple juice;;
0;0;I'm giving away: APPLE PIE MOONSHINE. Check it out - http://www. listia.com/rs67uv/2997582;;
0;0;I wnt sum apple pies from mcdonalds;;
0;0;In love with the new iPhone 5s! So sleek! @Apple Store, Roosevelt Field http:// instagram.com/p/fbUNodlisl/;@Apple;
0;1;"Got an iPhone charger... Call it apple juice" BARS @Chryscolley31;@Chryscolley31;
0;0;"A is for apple a-a- apple , B is for banana b-b-banana, C is for cat c-c-cat." #notstopABCs #thanksbeau #famjammakingmefeelbetter;;#notstopABCs #thanksbeau #famjammakingmefeelbetter
0;0;Raw Apple Cider Vinaigrette http:// pinterest.com/pin/1935844839 56310059/ …;;
0;0;Wilson's apple orchard http:// instagram.com/p/fbUSNLOyoz/;;
0;0;I was just told that I'm going Apple picking with my grandparents on Tuesday and my grandpa's making potato pancakes... WEEK MADE.;;
0;0;@chieftech @jodiem I bought the Logitech KB from the Apple site at the same time as the iPad; doubles as a hard shell cover, works well;@chieftech @jodiem;
1;2;Warm apple cider;;
0;0;@HBAysenur apple marka şarj aleti yazıp sahte şarj aleti gönderiyorsunuz. Allahtan ios 7 uyarı veriyor, bu mu sizin satış taktiğiniz ?;@HBAysenur;
0;0;Apple Pumpkin Banana Bones #dogtreatrecipe via Golden Woofs http:// fb.me/29uhDS1Df;;#dogtreatrecipe
0;0;Eating a apple don't hate https:// vine.co/v/hHVg1nwhUQY;;
0;0;I want my warm apple cider!!;;
0;0;Grandma fixed apple pie, in officially in heaven;;
0;0;Slow Cooker Apple Butter...your house will smell divine while this is cooking!! Delicious! http:// pinterest.com/pin/4970145088 48166473/ …;;
0;0;I have apple cider, honey mustard pringles, and walking dead is on.. that has to entice someone to hang out with me #allmyfriendsaredead;;#allmyfriendsaredead
0;0;My homemade apple hand pies with my freshly picked apples #fallfoods #battlefieldorachards http:// instagram.com/p/fbUPNRgVUu/;;#fallfoods #battlefieldorachards
0;0;9) 12 bln terakhir #Apple sgt aktif ciptakan produk, yakni: iPad Mini, iPad 4, iPhone 5S, 5C dan rilis iOS 7;;#Apple
0;0;#1: Apple iPod touch 4G MP3-Player (Facetime, HD Video, Retina Display) 32 GB, weiß: Apple iPod touch 4G MP3-P... http:// bit.ly/1bpovv4;;#1
0;0;8) Ingin tahu ttg launch 5S n 5C baca aja info berikut http:// goo.gl/5uscLH #Apple;;#Apple
0;0;I love whoever invented apple chips.;;
0;0;PGA Apple EarPods専用 シリコン製イヤホンカバー ホワイト PG-IP5EARC02WH 480 円 【リックス／PGA(="url" href】 http://www. amazon.co.jp/Apple-EarPods% E5%B0%82%E7%94%A8-%E3%82%B7%E3%83%AA%E3%82%B3%E3%83%B3%E8%A3%BD%E3%82%A4%E3%83%A4%E3%83%9B%E3%83%B3%E3%82%AB%E3%83%90%E3%83%BC-%E3%83%9B%E3%83%AF%E3%82%A4%E3%83%88-PG-IP5EARC02WH/dp/B00CPSUQ4A/ref=pd_zg_rss_ts_e_128199011_9?ie=UTF8&tag=tac0506-22 … #PzY31;;#PzY31
0;0;lol those farmers at the apple picking farm are really serious about their apples,;;
0;0;Leaves candle hot apple cider and walking dead;;
1;0;I like how there's people sitting outside of the apple store using their wifi;;
0;0;@april_denise83 I hate how they cornered the market. Only Apple and house brands in most electronics stores over here :(;@april_denise83;
0;0;http:// bit.ly/1bo5Sr8 Если бы Apple делала фотоаппараты;;
0;0;I haven't had pumpkin pie or apple cider yet and its mid October. I need to step my game up.;;
0;0;@apple _hoshi 僕が最初にブログで取り上げた時も、ボーカル可愛い、という持ち上げばっかりだったので、僕みたいに持ち上げるだけでなく、直接的な行為に出る人もそりゃ居る訳ですよね。しかし、Facebook見る限り、すごい頻度のようで、、頑張って欲しいですね。;@apple;
0;0;I want apple headphones so bad !!!! )):;;
0;2;Drinking apple cider, carving pumpkins, and watching Halloween movies! #happyfall @CearaCarney @sarsoura_amoura pic.twitter.com/1CxwylqZc1;@CearaCarney @sarsoura_amoura;#happyfall
0;0;Latest fall craving inspired my newest recipe! Who doesn't love a delicious caramel apple ? So I… http:// instagram.com/p/fbTzFEkkqy/;;
0;1;I could really go for some Schutts apple cider and donuts right now. #fallfood #penfieldprobs;;#fallfood #penfieldprobs
0;0;"I want to drink apple cider but not out of a red solo cup when I'm dressed as a red solo cup" @lorissa_abC;@lorissa_abC;
0;0;Baking apple pie and cupcakes tomorrow for dessert;;
0;0;She the apple if my eye;;
1;0;I fell in love with Apple Pie.;;
0;0;Apple 's New Spaceship Campus Bears A Freaky Resemblance To The UK's #NSA http://www. businessinsider.com/apples-gchq-20 13-10 … #Apple;;#NSA #Apple
0;0;I'm quickly becoming a master at making apple crisp...the secret...use more cinnamon;;
0;0;Mr.O says "happy fall everyone" Now here's an apple that is already all shiney!... http:// fb.me/2sFP8nayf;;
0;1;Mickinney Doyle, apple cider donuts, Sunday gravy, and apple cobbler never going back to school;;
0;0;Made apple -stuffed chops for the first time tonight. Happy with how it turned out. #noms #dinner;;#noms #dinner
0;0;This candy apple right now #favoritefalltreat #delicious;;#favoritefalltreat #delicious
0;0;I want green apple caramel suckers like so bad. Why they gotta have a long name though #thestruggle;;#thestruggle
0;0;Free available Awesome tvQuran App for iphone in Apple store.;;
0;3;and give really good hugs and enjoy life around a campfire with an apple cider in my hand.;;
0;0;Drinking apple juice out of this tiny juice box.;;
0;0;@MZSyc You better believe it! It's dubbed " apple pie cake" and it's literally like an apple pie meets a crumb cake. Legit. #crispin;@MZSyc;#crispin
0;0;Apple offering iTunes credits to eligible iOS users who purchased iWork and iLife apps after September 1 (the... http:// dlvr.it/47WxV9;;
0;0;i want a caramel apple;;
0;0;@milagrosmp Jaaa mira quien aparecio? Pask wask jajaja estas yendo a apple ?;@milagrosmp;
0;0;I think I smell apple crisp;;
0;0;Biting into a terrible apple is one of life's greatest disappointments;;
0;1;@BrandonBongo damn iphones. Do your job apple ! Hahaha;@BrandonBongo;
1;4;Hot apple cider and haunted hayride!!;;
0;1;I cant wait to go apple picking at chudleigh's tomorrow;;
0;4;Whenever my family comes over for dinner, it basically turns into an apple product tutorial session;;
0;0;Caramel Apple Pops. #myfavorite http:// instagram.com/p/fbUG9VBnG5/;;#myfavorite
0;0;Ferrari y Apple llegan a un acuerdo de colaboración: http:// bit.ly/1bpoqHD;;
0;0;Angry orchard crisp apple >>> #yumm;;#yumm
1;0;Anyone wanna take me to the Apple Barn and get apple cider and pick out pumpkins. Yeah I'd love you forever.;;
