retweets;favorites;text;mentions;hashtags
0;0;The Next Big Thing You Missed: If the Apple Store Sold Groceries http:// goo.gl/aausuL If they sold food, I'd never leave.;;
0;0;Otterbox Commuter case for Apple iPhone 5S http:// bit.ly/18NiudM;;
0;0;@_rin_ apple 恋「ういっす、おはよ！」駆「おはよう、凛りんご@ラフィネは嫁」;@_rin_ @;
0;0;Apple Storeではもう iPad mini Retina発売されたのか;;
0;0;Apple says iPad mini with retina display on sale now - Los Angeles Times http:// ift.tt/1fzRj6d #Apple;;#Apple
0;0;Apple maps: how Google lost when everyone thought it had won http://www. theguardian.com/technology/201 3/nov/11/apple-maps-google-iphone-users …;;
0;0;Disponibile Apple Digital Camera RAW Compatibility Update 5.01: Tramite la funzione "Aggiornamento Software" è... http:// adf.ly/ZErnT;;
0;1;@sgavinesq And Granny Smith slaps Red Delicious and calls her a bad apple;@sgavinesq;
0;0;C'est pour aller a Apple Store !;;
0;0;Un libro cuenta cómo cambió el desarrollo de Android cuando Apple presentó el iPhone http:// feedproxy.google.com/~r/applesencia /~3/-s2qOXbEJBU/libro-cuenta-cambio-desarrollo-android-presentacion-iphone …;;
0;0;@alexcornellier Ou est-ce que peux le réserver pour pickup en Apple Store?;@alexcornellier;
0;0;I just entered to win an Apple #iPadAir from @CAASCO in the #CAAiPadGiveaway ! Here's your chance: http:// blog.caasco.com/whatshappening /win-an-ipad-air/ …;@CAASCO;#iPadAir #CAAiPadGiveaway
0;0;Apple tuvo ventas históricas de su iPhone, pero Android sigue siendo el ‘rey’ de los smartphones http:// cnn.mx/n001SI3;;
0;0;Un an après, la revanche d' Apple sur Google Maps http://www. latribune.fr/technos-medias /20131112trib000795283/un-an-apres-la-revanche-d-apple-sur-google-maps.html … via @LaTribune;@LaTribune;
0;0;Great #Mac #Chinese language learning software http:// goo.gl/RPtsW8 #apple #education #backtoschool #easy;;#Mac #Chinese #apple #education #backtoschool #easy
0;0;@l_cifolilli they're pumpkin apple so I win;@l_cifolilli;
0;0;Having an Apple Toaster! Bacon marmalade, caramelized apples on focaccia & toasted w/ cheese, served… http:// instagram.com/p/gojszNkypS/;;
0;0;@SarahsSara @Lizzzklik Didn't you know retail workers are slaves without the right to a life? I'm so glad Apple isn't making us work.;@SarahsSara @Lizzzklik;
0;1;My mother so unnatural she eating Julie Mango neat neat like iz a apple or something. #CleanMothersAssociation;;#CleanMothersAssociation
0;0;Je vois plus de ti carrés où de trucs pourris pour les émos d' Apple;;
0;0;Apple juice. >>>;;
0;0;Apple details pressure-sensitive touchscreen in new patent - Inrumor http:// paten.to/1bBvxMP;;
0;0;2nd Annual Apple Festival Giveaway 11/30 http:// goo.gl/agbQqy via @MelindaDunne;@MelindaDunne;
0;0;Apple vs. Samsung Lawsuit: Patent Infringement Retrial Update; Jury Selection ... - Latinos Post http:// paten.to/1i7x02e;;
0;0;Apple разрабатывает смартфон с искривленн http:// iv-snim.ru/3010/fayli/gra vity-defied-na-kompyuter-onlayn.php …;;
1;0;Apple lance son nouvel iPad mini http:// dlvr.it/4Jj4Qb;;
0;0;Apple releases ITS OPERATING SYSTEM SOURCE CODE - Register http:// adf.ly/ZErju;;
0;0;Windows Phone, Android Gain Market Share While Apple Slips Despite Growth In iPhone Shipments: http:// bit.ly/1bsNuiF;;
0;0;http:// finance.yahoo.com/news/review-pr icey-ipad-mini-keeps-223948692.html … Apple one if the few companies….;;
0;0;@elonmusk He is defying Gravity..The Apple didn't fall far from the tree..;@elonmusk;
0;0;So apple decides to get switched to my class. Cool XD;;
0;0;@Huda_Beauty I hear (bc my bro told me) that they are no better than the apple headphones. This is what I heard......;@Huda_Beauty;
0;0;http:// ift.tt/1fzSoen ASCII.jp － トップ - アップルストア銀座前でiPad mini Retinaを予約してみた: 11月13日深夜、銀座直営店「 Apple Store,Ginza」に出かけてiPad mini Retinaディスプレイモ...;;
0;0;Any ole ways we just had some frozen yogurt whewwww lawd I'm going back. I had apple pie birthday cake and vanilla it was very delightful;;
0;0;@apple _coree with your luck it's all essays.;@apple;
0;0;Apple Blossoms abstract watercolor http:// dld.bz/c36ZN;;
0;0;Apple & jif to go http:// instagram.com/p/gokBMDKKis/;;
0;0;Love apples? @budgetearth is giving away fun apple themed prizes including a $50 #itunes #giftcard ! Enter here! http:// monicasrrr.blogspot.com/2013/11/second -annual-apple-festival-giveaway.html?utm_source=feedburner&utm_medium=email&utm_campaign=Feed%3A+blogspot%2FhPesiz+%28Monica%26%2339%3Bs+Rants%2C+Raves+%26amp%3B+Reviews%29 …;@budgetearth;#itunes #giftcard
0;0;Biz Break: Apple -Samsung trial, new iPad Mini for sale, Android rules ... - San Jose Mercury News http:// dlvr.it/4Jj4Jk;;
0;0;Nokia выразила благодарность Apple за подражание;;
0;0;I wanna make my homemade apple crisp this week .;;
0;0;Apple Store app now supports international Passbook gift cards after update - Apple Insider http:// ift.tt/HG3kfj #apple Macgasm Apple S...;;#apple
0;0;CAPP juice for #baby #samu #carrot #apple #pear #parsley #juice #cute #breakfast #yummy #healthy … http:// instagram.com/p/gojHZ6kZVW/;;#baby #samu #carrot #apple #pear #parsley #juice #cute #breakfast #yummy #healthy
0;0;I need some caramel apple werthers candy... #stat;;#stat
0;0;I Like To Eat Tomatoes Like I Eat An Apple #TeamNotNormal;;#TeamNotNormal
0;0;Apple MacBook 13.3" Laptop-A1181 (2GHz,Intel Core 2 Duo,2GB/120GB) used http:// ift.tt/1bA6vxR;;
0;0;Apple puso a la venta el nuevo Ipad Mini Retina - Univisión http:// ift.tt/1gHzIwg #Populares;;#Populares
0;0;@kimdarce hahahaha apple cut apple apple apple cut :))))));@kimdarce;
0;0;Man, my niece made some badass tastin' mini apple pies.;;
0;0;Music: @PapooseOnline feat @Noreaga – The Rotten Apple http:// microphonebully.com/?p=7608;@PapooseOnline @Noreaga;
0;0;Apple Computer - AAPL - Japanese Candlestick Case Study - YouTube Video - http:// youtu.be/uNPhfdof1RU;;
0;0;#iPadMiniRetina is actually up for sale now. Quick Apple take my money!;;#iPadMiniRetina
0;0;Actualizate " Apple y Samsung a Juicio Nuevamente " http:// goo.gl/UsjtO7 http:// fb.me/2NYg7q2Hx;;
0;1;How my meeting for imsa got canceled << I was looking forward to apple juice.;;
0;0;Apple II DOS source code released by Computer History Museum http:// 29g.us/0306t4 http:// 29g.us/5BEzGj;;
0;0;Get better scores in #Spanish with jbvTeacher http:// goo.gl/fkT5tg for #mac #apple #education #backtoschool;;#Spanish #mac #apple #education #backtoschool
0;0;I freaking called Apple and the lady is watching tv while I'm on the phone with her. Lol no.;;
0;0;La bande originale de Pokémon X & Y téléchargée sur iTunes ! #Apple #Pokemon #Nintendo pic.twitter.com/dKCe0T05Gg;;#Apple #Pokemon #Nintendo
0;0;foi zika quando eu estava falando de computadores com um mlk na minha escola,daí ele falou de uma marca que era a paraguai da apple;;
0;0;So just told a customer we had spiced apple spider as a new flavor instead of spiced apple cider. Opps;;
0;0;#Chinese for beginners and advanced students. http:// goo.gl/RPtsW8 Learn on your #Mac #apple #education #backtoschool;;#Chinese #Mac #apple #education #backtoschool
1;0;Reporte de ComScore revela Google Maps ha perdido un tercio de sus usuarios a la vez que aumentan usuarios de Apple Maps;;
50;17;Apple tuvo ventas históricas de su iPhone, pero Android sigue siendo el ‘rey’ de los smartphones http:// cnn.mx/n001SI3;;
0;0;I liked a @YouTube video from @tfaiso http:// youtu.be/hE1UxKx0JsA?a Apple iPad Mini 2 with Retina Display Unboxing;@YouTube @tfaiso;
0;0;Video: #Google Nexus 5 vs #Apple #iPhone 5s #Tech #Gadget http:// ow.ly/qJGMg;;#Google #Apple #iPhone #Tech #Gadget
0;0;Very Cool! Wirelessly Mirror your iOS Display on your Mac - A Super Simple Solution! #ios #apple #maxosx #deals -- http:// bit.ly/1cjT9Wg;;#ios #apple #maxosx #deals
0;0;¡La familia está completa! Apple lanzó su iPad mini este martes http:// ow.ly/qJQez;;
0;0;ヒマつぶしに Apple Store App見てみると、予約したiPad miniの情報が見られる。キャンセルもこちらでできますがうっかり押してしまいそうに。 pic.twitter.com/dJQ5MDLQJF;;
0;0;Apple y Samsung a Juicio Nuevamente - http:// goo.gl/UsjtO7;;
0;0;Video: #Google Nexus 5 vs #Apple #iPhone 5s #Tech #Gadget http:// ow.ly/qJGMc;;#Google #Apple #iPhone #Tech #Gadget
0;0;@CollardSoylentG I had count I think I have between 21-23 machines not including phone tablets apple tv's if it still goes I may want it;@CollardSoylentG;
0;0;I like LeBron James Action Shot VINYL skin for Apple iPhone 4 4S http:// bit.ly/19wZa4q;;
0;0;Das Productive PDF Bundle von Paddle mit 3 Apps für den Apple Mac für nur 4,86€: Im neuesten Bundle vo... http:// bit.ly/1a2m4Qj #Medien;;#Medien
0;0;Das Productive PDF Bundle von Paddle mit 3 Apps für den Apple Mac für nur 4,86€: Im neuesten Bundle vo... http:// bit.ly/1a2m4Qj #Medien;;#Medien
0;0;@TomGLarose J'ai commandé online, mais j'appelle tous les jours d'ici Vendredi au Apple Store et des s'il y en a j'annule ma commande;@TomGLarose;
0;0;Tonight it's Glazed Mahi Mahi with a Shrimp and Apple Salsa, Shrimp Fried Rice and grilled Zucchini and Yellow Squash http:// fb.me/11N6GNXDF;;
0;0;mozaralla sticks from apple bee's sound soooooooo bomb right now!;;
0;0;Slowdown in Apple TV shipments suggests delay for full-size television http:// bit.ly/1cSRlZn;;
0;0;Slowdown in Apple TV shipments suggests delay for full-size television: Apple is expected to launch a refreshe... http:// bit.ly/1cSRlZn;;
0;0;Slowdown in Apple TV shipments suggests delay for full-size television: Apple is expected to launch a refreshe... http:// bit.ly/1cSRlZn;;
0;0;First Look: Apple 's iPad mini with Retina display: Apple surprised on Tuesday when it launched online and in-s... http:// bit.ly/1a2naeL;;
0;0;AppleInsider - Slowdown in Apple TV shipments suggests delay for full-size television: Apple is expected to la... http:// adf.ly/ZErdH;;
0;0;Slowdown in Apple TV shipments suggests delay for full-size television: Apple is expected to launch a refreshe... http:// bit.ly/1cSRlZn;;
0;0;Apple ne bicim kulaklik yapmissin takilmiyo lan;;
0;0;Slowdown in Apple TV shipments suggests delay for full-size television http:// bit.ly/1cSRlZn;;
0;0;Slowdown in Apple TV shipments suggests delay for full-size television: Apple is expected to lau... http:// bit.ly/1cSRlZn #appleinsider;;#appleinsider
0;0;#Apple #BlackBerry Apple se interesa por parte de la compañia Blackberry http:// dlvr.it/4JQsph;;#Apple #BlackBerry
0;0;@KeithBurtis Have you already ran the Apple Broadband Tuner on this device as well? It can be found in the apple app store. ^AML;@KeithBurtis;
0;0;Baked Apple , Limoncello, Strawberry, Toasted Coconut, Mango are just a few of the dairy free options at Echo Park today!;;
0;0;#Apple : Stop the iOS-Mac merger http:// ow.ly/qJPlE;;#Apple
0;0;"Thuzas para prefeito" "O soro dos hospitais serão Big Apple " "Vai ser feriado todos os dias" kkkk hj foi resenha;;
0;0;Why the fuck does the apple store smell like nasty sweat.;;
0;0;http://www. theaustralian.com.au/technology/per sonal-tech/more-costly-ipad-mini-on-sale/story-e6frgazf-1226758757454 … Also today - Apple has released the iPad Mini with Retina in Australia. You'll pay $110 more but get more. #apple;;#apple
0;1;I didn't know it could be so easy to learn on my #mac #Russian http:// ggoo.gl/htU6cS #apple #education #learning #osx #edtech;;#mac #Russian #apple #education #learning #osx #edtech
0;0;Apple выпустит в 2014 году большой iPhone с выпуклым дисплеем;;
0;0;@PeterAppleEater word. Wait apple eater?;@PeterAppleEater;
0;0;why cum errbody hate apple sauce..? I love it.. obvi. pic.twitter.com/BhpItHmkgO;;
0;0;Read about Apple -Cheddar Galette at Honest Cooking from @jeffAromaCucina -- find at http://www. foodiefeeds.com ! #fb #foodblog #foodblogger;@jeffAromaCucina;#fb #foodblog #foodblogger
0;0;@Skittles I love love LOVE Skittles. Except the Green Apple ones - they taste like heartbreak. #BringBackLimeSkittles;@Skittles;#BringBackLimeSkittles
0;0;Looks like a new phone! #whatcrackedscreen #iphone #glitter #skin #apple http:// instagram.com/p/goj1Gqo9fG/;;#whatcrackedscreen #iphone #glitter #skin #apple
0;1;Apple Cider= effective time at the library #yum #warm #soooogood;;#yum #warm #soooogood
0;0;Look Inside Apple 's Spaceship Headquarters With 24 All-New Pics http:// zite.to/HPHiqx / Muy buen artículo.;;
0;0;65 2 Tue Nov 12 17:55:17 2013- apple http:// blog.naver.com/corba20/802016 11385 …;;
0;0;My new Moon Mountain vape juice came! Nebula Nectar and Apple Apocalypse. Tasty! #vape #ecig #byebyetobacco;;#vape #ecig #byebyetobacco
0;0;That sizzling steak at apple bee was so damm good;;
0;0;“ @iraloiola : “Q: What's worse than finding a worm in your apple ? A: Lots of things. Watch the news, you idiot!!”” Ha Ha very funny! :);@iraloiola;
0;0;Интернет магазины одежды. #Apple http:// drogaodyag.blogspot.com/2013/11/blog-p ost_8197.html …;;#Apple
0;0;memo pad買ったばかりだけど、欲しくなってきた^^; etina搭載iPad mini販売開始 - Y!ニュース　iPad mini Retinaモデルが Apple Storeで販売開始。品薄説も。 http:// dailynews.yahoo.co.jp/fc/computer/ip ad/?id=6097062 …;;
0;0;Apple is looking forward for Liquid metal exterior for iPhone 6 http:// goo.gl/fb/6PIMO;;
0;0;@_rin_ apple おーはーよー！！(*´ω｀*);@_rin_;
0;0;30 tir di monete da 5 centisimi, la vendetta di #samsung verso #apple http://www. linkiesta.it/blogs/sere-ndi pity/samsung-risarcisce-apple-con-30-tir-di-monete-da-5-centisimi … via @Linkiesta;@Linkiesta;#samsung #apple
27;18;Apple responds to student's campaign to change "gay" definition in company dictionary http:// huff.to/1brJ2kc;;
0;0;so brought these @threeworkssnacks apple chips to the husband and they were gone so fast!… http:// instagram.com/p/gojyg3KziM/;@threeworkssnacks;
0;0;Lmao but I bet he still gets "it" — XD GURL IM EATIN AN APPLE DONT MAKE ME CHOKE http:// ask.fm/a/a0bphj3j;;
0;0;Organic vs Traditional Apple hmmm which one did I buy? #rawfood #raw http:// instagram.com/p/goj1-dEWP7/;;#rawfood #raw
0;0;“ @CaseyNeistat : dropped my iPhone again. think they can fix this at the Apple Store? pic.twitter.com/RSXp6NB2Cx ” #fb;@CaseyNeistat;#fb
0;0;Lemon vs. Apple . #lemononsteroids #biggestlemonever http:// instagram.com/p/gojnbDQF8A/;;#lemononsteroids #biggestlemonever
0;0;Фотогалерия: Виртуална разходка из бъдещата централа на Apple http:// fb.me/6kiaLELmJ;;
0;0;First Look Apple s iPad mini with Retina display http:// pulse.me/s/x53hq;;
0;0;Bitch the middle button on my phone coming off ,, fuck apple as a company;;
0;0;SAMI, nuovo progetto Samsung: al lavoro anche un ex ingegnere Apple : Si chiama SAMI ed è una piattaforma alla ... http:// adf.ly/ZErYh;;
0;0;When your Poppy gives you apples, make apple pie! http:// instagram.com/p/goj3CqCnwd/;;
0;1;Apple store in columbia? About time;;
0;0;I'm a apple fan tho. Fckk them androids;;
0;0;Jonagold. Best. Apple . Ever. And Anna Wintour http:// instagram.com/p/gojviqDv_2/;;
0;0;" @ComunicaRSE : Gobierno chino y #Apple discuten sobre cooperación bilateral en protección ambiental #RSE http:// goo.gl/y39uEr ";@ComunicaRSE;#Apple #RSE
0;2;My mom asked me why there was an apple under the tv stand... I blame Thumma.;;
0;0;Apple says iPad mini with retina display on sale now - Los Angeles Times http:// ift.tt/1fzRj6d;;
0;1;Just realized that the only things I've had today have been an apple and a coffee #starving;;#starving
0;0;Sent my Mac out to apple because it shit the bed. My tablet AND Mike's laptop both can't run the program I need to do my online class;;
0;0;iAd Workbench Expands to New Countries [ Apple Developer] http:// ift.tt/17n8p1X;;
0;0;Can Apple come out with a gaming console?;;
0;0;So why me and Moses in Apple Store in Lennox Square Mall and he makes me put up my Android in my Gucci Purse! He... http:// fb.me/2Yat7WEqG;;
0;0;Why Retailers + Developers Should Pay Attention to Apple 's iBeacon: By Ryan Matzner This past June at the WWDC... http:// huff.to/1bsToQN;;
0;0;Just found a working pair of apple headphones in my room, sweet baby j;;
0;0;“ @breezysbiebur : WHY ARE THERE NO BLACK EMOJIS LIKE WTF APPLE ” !!!;@breezysbiebur;
1;0;Why Retailers + Developers Should Pay Attention to Apple 's iBeacon http:// huff.to/1bsToQN #Technology;;#Technology
0;0;I just entered to win an Apple #iPadAir from @CAASCO in the #CAAiPadGiveaway ! Here's your chance: http:// blog.caasco.com/whatshappening /win-an-ipad-air/ …;@CAASCO;#iPadAir #CAAiPadGiveaway
0;0;Why Retailers + Developers Should Pay Attention to Apple 's iBeacon: By Ryan Matzner This past June at the WWDC... http:// huff.to/1bsToQN;;
0;0;#Apple iSchool? http:// interactyx.com/social-learnin g-blog/apple-ischool/ …;;#Apple
0;1;Apple needs three way facetime;;
0;0;@apple _bot_bot フォロワー増えろ♪L( ＾ω＾ )┘♪増えろ♪└( ＾ω＾ )」♪増えろ♪└( ＾ω＾ )」♪増えろ♪└( ＾ω＾♪└( ＾ω＾♪└( ＾ω＾ )」♪ 増えろ)」増えろ♪ )増えろ増え増え増えふ あ #RTした人全員フォローする;@apple;#RT
1;2;Got home. Opened @StrideBox and put on new apple cider lip balm. Killed run I did not want to do. Coincidence? I think not.;@StrideBox;
0;1;Currently drinking caramel apple cider and heading to the P!nk concert;;
2;0;Pretty sure apple removed the emojis from desktop iMessage in Mavericks...in other words all the fun stuff.;;
0;0;Tech News CUPERTINO, Calif. (AP) — Apple began selling a new iPad Mini on Tuesday without the usual fanfare. ... http:// on.fb.me/14P3hWE;;
26;26;Mac Blog: Computer History Museum Releases Apple II DOS Source Code http://www. macrumors.com/2013/11/12/com puter-history-museum-releases-apple-ii-dos-source-code/ …;;
0;0;@HiltonIlz iya la... Game utk androit ama apple ... kan gamenya ada gems" gtu mknya tanya u lo...;@HiltonIlz;
0;0;I kinda love apple cinnamon!! :) http:// instagram.com/p/gojzVBQw8p/;;
0;0;Apple iPhone 4 - 16GB - White (AT&T) Clean Esn!!! Cracked Screen WORKS GREAT!!! $159.99;;
0;0;Apple releases ITS OPERATING SYSTEM SOURCE CODE http:// ift.tt/1clghni #TechNews #DesignNews http:// ift.tt/15vCDB2 #AppNews #MediaNews ...;;#TechNews #DesignNews #AppNews #MediaNews
0;0;Really just need a slice of Apple pie right now.;;
0;2;I want some Redds apple ale;;
0;0;“ @vballproblems : is it really that hard to add this, Apple ? pic.twitter.com/Iq9sElrVgA ” I think this every day. #wtf;@vballproblems;#wtf
0;1;Apple vs. Samsung: The Next Round http:// on.mktw.net/HW52bD $ aapl #iphone #apple #applesamsung;;#iphone #apple #applesamsung
0;0;Climbing them stairs, them old apple and pears;;
0;0;@instagram @tigerbar17 I need to download Apple Apps store or Google Play store in order to create an account on Instagram;@instagram @tigerbar17;
0;0;iPad mini Retinaモデル、オンライン Apple Storeでひっそり販売開始。携帯各社や量販店は「未定」のまま http://www. slashnews.biz/archives/34025 923.html … #news #newsjp;;#news #newsjp
0;0;@Ihnatko iTunes has been on the decline for a few years on. As if they hired newbie programmers who don't even know about M-V-C or Apple UI.;@Ihnatko;
0;0;Gostei de um vídeo @YouTube de @foodbeast http:// youtu.be/vdCGnuccRv0?a How to Eat an Apple Like a Boss;@YouTube @foodbeast;
0;0;I just entered to win an Apple #iPadAir from @CAASCO in the #CAAiPadGiveaway ! Here's your chance: http:// blog.caasco.com/whatshappening /win-an-ipad-air/ …;@CAASCO;#iPadAir #CAAiPadGiveaway
0;0;Но скорость с которй новинки начинают появляться в России определенно радует. Так и до оффйлан Apple Store недалеко.;;
0;0;The cranberry apple infused vodka at @houndstoothnyc is lovely. As is everything else.;@houndstoothnyc;
0;0;@OhNuts pecans make for a perfect topping on Apple Bundt Cake. Recipe on the blog tomorrow!!;@OhNuts;
0;0;Apple juice is a constant pleasure in my life;;
0;0;当たり前ですが、突然でしたね。昨日、たまたま Apple Store, Ginzaに立ち寄ったんですが、Retinaじゃない方を見てきました(笑)　QT @nikkeionline : 新型ｉＰａｄミニが販売開始　納期は「１～３日」 http:// s.nikkei.com/17rT4SZ;@nikkeionline;
0;0;iPad Air GRATIS!!! Raih Kesempatan Untuk Menang Apple iPad Air GRATIS!!! http:// buff.ly/1eHCLnH @halalsociety #kuis #kuiz #indonesia 550;@halalsociety;#kuis #kuiz #indonesia
0;0;Apple iPad Air review: Thin, light and fast, but expensive - http:// feedas.com/apple-ipad-air -review-thin-light-and-fast-but-expensive-6/ …;;
4;5;WHY ARE THERE NO BLACK EMOJIS LIKE WTF APPLE;;
0;0;I just entered to win an Apple #iPadAir from @CAASCO in the #CAAiPadGiveaway ! Here's your chance: http:// blog.caasco.com/whatshappening /win-an-ipad-air/ …;@CAASCO;#iPadAir #CAAiPadGiveaway
0;0;Apple Lightning Digital AVアダプタ MD826ZM/A 5,143 円 【アップル(="url" href="ht】 http://www. amazon.co.jp/Apple-Lightnin g-Digital-AV%E3%82%A2%E3%83%80%E3%83%97%E3%82%BF-MD826ZM/dp/B009WQ9E8C/ref=pd_zg_rss_mw_e_3371411_5?ie=UTF8&tag=tac0506-22 … #ujCsl;;#ujCsl
0;1;While everyone talks about Christmas, I am looking forward to that sparkling apple cider at Thanksgiving.;;
0;0;Price Drop: War of the Zombie (Games) $2.99 ► Free #App #AppStore #Apple #iTunes http:// itunes.apple.com/ru/app/id60527 7717 …;;#App #AppStore #Apple #iTunes
0;0;Join the @iOSnoops #sweepstakes #giveaway to win a free second generation Apple iPad mini! http:// goo.gl/PsJX3D;@iOSnoops;#sweepstakes #giveaway
0;0;todays☞banana apple soymilk honey pic.twitter.com/wBpqnUhcDx;;
0;0;@mame_ apple まめちゃんがどこに住んでんのか知らんが、それ確実にさみい… 着物きてる私が寒いもん。羽織まできてるのに！！！！！;@mame_;
1;0;Best apple pie I'm ever going to eat? I sure hope I'm ready for this! Thanks @littlepedrozo :);@littlepedrozo;
19;8;-E: "¿Cuál es tu juego o una aplicación de Apple favorito?" -Selena: "Ahora estoy con el Candy Crush o aplicaciones que sirvan para editar".;;
0;0;MARKETWATCH: Apple and Samsung back in court http:// on.mktw.net/1bBuFId $ AAPL;;
0;0;#Amazon USA : MiniSuit Apple #iPad 2 Aluminum Bluetooth Keyboard C... by MiniSuit http:// amzn.to/xQRpD5;;#Amazon #iPad
0;1;So for like 3 weeks I've been drinking white grape juice and I've been thinking it was apple juice. Awkward.;;
0;0;NVIDIA Unveils 7-Inch Tegra Note 7 Tablet With Advanced Stylus: On the same day that Apple announced the avail... http:// on.mash.to/1dnmKPU;;
0;1;@DevanyyBieber_ sip. Se deberia de poder ver desde cualquier dispositivo apple .;@DevanyyBieber_;
0;3;Yay my neighbor just brought us apple crisp #yum #perksofmoving;;#yum #perksofmoving
0;0;We now have apple cider from Walkers Fruit Ranch. We're enjoying it with cinnamon and our house made caramel. New seasonal fav? We think so.;;
0;0;Join the @iOSnoops #sweepstakes #giveaway to win a free second generation Apple iPad mini! http:// goo.gl/PsJX3D;@iOSnoops;#sweepstakes #giveaway
0;1;apple store finally getting this piece of shit phone fixed;;
0;0;@mariovrp apple;@mariovrp;
0;0;Google TV and Apple TV say, "Hi." Why Intel’s Huge Project to Challenge Pay TV Could End Up in Pay-TV Land http:// variety.com/2013/digital/n ews/why-intels-huge-project-to-challenge-pay-tv-could-end-up-in-pay-tv-land-1200823731/ …;;
0;0;iPad Air GRATIS!!! Raih Kesempatan Untuk Menang Apple iPad Air GRATIS!!! http:// buff.ly/1eHCLnH @halalsociety #kuis #kuiz #indonesia 549;@halalsociety;#kuis #kuiz #indonesia
0;2;Apple swan pic.twitter.com/4wnrfwZa3B;;
0;0;@haeleyMFsnapp tF??... Who names their kid apple ?;@haeleyMFsnapp;
0;0;Apple stocks reflecting their fingerprint camera, I would have picked what the people really wanted.... bigger screen. Samsung + 2.;;
0;0;Being in harmony with such objects ( apple , bottle, suspended ceiling light, table, palm tree) demands the rejection of all compromises.;;
2;0;apple diet starts tomorrow @lustcoast @fabiolamillan_;@lustcoast @fabiolamillan_;
0;0;Apple y Samsung a Juicio Nuevamente: Los dos mayores fabricantes de teléfonos inteligentes del mundo, Apple y ... http:// bit.ly/1bBsWCC;;
0;0;そう考えるとやはりiPadとかはユーザーに優しいよな。高いけど… 次は Apple に戻そう。さらばGoogle！;;
0;0;Apple y Samsung a Juicio Nuevamente: Los dos mayores fabricantes de teléfonos inteligentes del mundo, Apple y ... http:// bit.ly/1bBsWCC;;
2;2;Soy Geek , y me encanta la informática , y e estado en la cola de la nueva tienda 3 horas y media , y orgulloso me siento #Apple;;#Apple
0;0;Apple y Samsung a Juicio Nuevamente: Los dos mayores fabricantes de teléfonos inteligentes del mundo, Apple y ... http:// bit.ly/1bBsWCC;;
0;0;@saucybag The only problem with Apple making a controller will be the lack of buttons (if they design it their way);@saucybag;
0;0;Apple y Samsung a Juicio Nuevamente http:// fb.me/21AyAiPWP;;
0;0;Apple y Samsung a Juicio Nuevamente: Los dos mayores fabricantes de teléfonos inteligentes del mundo, Apple y ... http:// bit.ly/1bBsWCC;;
0;0;@JLavar when the apple watch comes out I know it's gonna be mean!!!! But that Samsung watch is cool;@JLavar;
1;5;I @KelseyDayle11 and The Mill and apple cider and good talks and clear minds and I just love life;@KelseyDayle11;
0;0;Android and Windows Phone grow, Apple drops http://www. computerworld.com/s/article/9243 979/Android_Windows_Phone_grow_in_smartphone_share_while_iPhone_drops …;;
0;0;Магазины женской одежды! #Apple http:// mivaodezhda.blogspot.com/2013/11/blog-p ost_6597.html …;;#Apple
