retweets;favorites;text;mentions;hashtags
0;0;Enjoying his birthday dinner, 2 lb baked stuff lobster with veg. and bacon Apple Mac and cheese.… https://www. instagram.com/p/BaU-pJwFKOa/;;
1;4;Back to New York for my 9th stop! Do you notice the apple on my shirt? Why do you think I'm wearing it? @USMLowerschool #usmfac https:// twitter.com/cleeinfo725/st atus/920032668422754304 …;@USMLowerschool;#usmfac
1;2;iTunesカード1500円 応募方法・フォロ&RT&条件達成 当選人数・RT数により変動1名〜 連絡事項・DMでやり取りします #Apple #iTunes #無料 #プレゼント pic.twitter.com/ruvKVTKinK;;#Apple #iTunes # #
0;0;@Apple customer service is terrible.;@Apple;
0;1;Watch out for us at #COPSWEST ! Are you going? Visit our booth and enter to win an Apple Watch! pic.twitter.com/c14jdf9dj9;;#COPSWEST
0;5;My apartment smells like apple cider;;
0;9;Girl is cute. I hate this commercial because I cant escape it! Its always on tv, every social feed... y'all must've spent Superbowl $ on ads;;
0;0;Publishers are already feeling pain from Apple 's move against ad tracking https:// digiday.com/media/publishe rs-already-feeling-pain-apples-move-ad-tracking/ …;;
0;0;Según Fortune: Apple , Google y Amazon son las empresas más admiradas del mundo.;;
0;0;Apple hit with $440M in damages in VirnetX patent lawsuit -... http:// fb.me/1ILVRvfmO;;
0;1;We blend a wonderful Apple Pie spice but it still takes a master pie baker to create a masterpiece...of pie.;;
0;0;Enter for a chance to win a #FallHarvest Delta Vacations apple picking adventure! http://www. hallmarkchannel.com/fall-harvest/s weepstakes …;;#FallHarvest
0;0;@Gleamapp is giving away an Apple #HomePod and I want to #win it. Help me out: http:// bit.ly/2x87y8D;@Gleamapp;#HomePod #win
0;0;@DetroitBORG I saw a video on YouTube iPhoneX hands on by Apple employee please find that video I want to see and it was post on Instagram;@DetroitBORG;
0;0;Apple says it already fixed KRACK Wi-Fi hack on iOS and macOS — Cult of Mac http:// fb.me/zFLI9hlu;;
0;0;you tripping.. ima try the apple one day but iont like nothing apple;;
0;0;Wars: Buffett deceives USG support to fraud $ BRKA to attack my & others foreign treasury central bank & economies- not broken before Buffett;;
1;1;WPA2の”KRACK”問題はクライアント側で修正される問題。Windowsは先週パッチ済み、Androidは来月Pixelデバイス向けパッチが出るなど準備中、 Apple はベータで修正済みで正式リリース未定と。。。 https://www. theverge.com/2017/10/16/164 81818/wi-fi-attack-response-security-patches … @Verge;@Verge;
0;0;I'm at Apple Fashion Valley in San Diego, CA https://www. swarmapp.com/c/lY53qDuN2DD;;
0;1;Let’s rush Apple then;;
0;6;someone go to the apple orchard w me;;
0;0;Is that apple juice?;;
0;0;@Benzene_Ping ; This was what I was telling you about;@Benzene_Ping;
0;0;#BestAppleWireless #SmartWatch Band, Uitee Woven Nylon Band for Apple Watch 42mm Series 1 & 2, Uniquely and… http:// dlvr.it/Pw1785 pic.twitter.com/NnCrvserrS;;#BestAppleWireless #SmartWatch
0;0;Apple says it already fixed KRACK Wi-Fi hack on iOS and macOS - Cult of Mac https:// lnkd.in/eD4C8tG;;
0;0;KOKKIA i10s (NEW Luxurious Black) Tiny Bluetooth iPod Transmitter for iPod/iPhone/iPad/iTouch with true Apple auth… http:// ift.tt/1MnAVFX;;
0;2;You're my cinnamon apple chaes just quoting a vine smh;;
0;1;Well seeing as I've never played QB outside my backyard with only my 6 foot, 185 lb bro rushing on a 10 apple count, I'll give Alex a pass;;
0;0;Apple Responds to Senator's Request for Info on Face ID Privacy and Security. I Hate Everything.;;
0;0;Check out ? #Apple deal from #O2 - Apple iPhone 6s (128GB Gold Refurbished Grade B) at £9.99 on O2 Refresh... https:// my.app.link/NXIWN5Nc8C?248 603b8 …;;#Apple #O2
0;0;Insight Report: The Future of Apple Pay – Current and Future Status http:// dlvr.it/Pw17BY;;
2;1;Apple 's head of diversity apologises for saying a group of 12 white men can be as diverse as a team with women and… http://www. telegraph.co.uk/news/2017/10/1 7/apples-head-diversity-apologises-saying-group-12-white-men-can/?utm_source=dlvr.it&utm_medium=twitter …;;
0;0;How Apple and Android took over the smartphone market - http:// Marketplace.org http:// dlvr.it/Pw16z9;;
0;0;Will be opening up the Crown Apple this evening in honor of Jim Lahey (John Dunsworth), who will forever be the liquor. #TrailerParkBoys;;#TrailerParkBoys
0;0;Need holiday dessert ideas? Try this Swedish Apple Pie! *(gluten-free, vegan, whole grain, dairy-free) and... http:// fb.me/yGhGfNAi;;
0;0;The problem with progressivism is, no-one can ever be progressive enough. Can't wait until there are none left standing. #Apple #diversity;;#Apple #diversity
0;0;The heart is wicked-from start to finish. Eve ate the apple and Adam lied about it. We are no different. Tell me no and the opposite happens;;
0;1;神がいた頃の Apple は斬新でとても良かったのですが、今は技術力だけ上がり続けてなんか足りません[;;
0;0;✺ Apple Considered Buying Medical Clinic Startup Crossover Health https:// goo.gl/fb/R2nSeg;;
4;6;What's the next Honeycrisp? Apple breeder David Bedford might have the answer. from The Splendid Table: https://www. splendidtable.org/story/whats-th e-next-honeycrisp-apple-breeder-david-bedford-might-have-the-answer …;;
0;0;We're waiting for that answer from Apple , but as soon as we get the inventory, we'll start shipping! *SAP;;
0;0;✺ Apple Responds to Senator's Request for Info on Face ID Privacy and Security https:// goo.gl/fb/P1SdEm;;
0;0;あいたそは根気強さが売りやからな;;
0;0;The latest The The Nigerian Engine™ Daily! https:// paper.li/NG_Engine/1418 211878?edition_id=dd722500-b2cb-11e7-a385-0cc47a0d1605 … #apple #wearables;;#apple #wearables
0;2;Just like there’s “recently deleted” for photos there should be “recently deleted” for messages @Apple;@Apple;
2;3;Join Robinhood and we'll both get a share of stock like Apple , Ford, or Sprint for free. Make sure you use my link. http:// share.robinhood.com/holliem4;;
0;1;Indignada com a escola da minha irmã,deram um fone da Apple pra todo mundo como assiim!!???;;
0;0;Sephora has managed a corporate feat that would make the leaders of Google, Apple and Facebook envious. https:// lnkd.in/g-vWhMU;;
1;4;"I think Apple has gotten pretty complacent with their forward thinking. And I don't find Apple to be as intuitive." http:// bit.ly/2zdkwmX;;
0;0;Create a new apple id and use singapore as your country;;
0;0;Apple Responds to Senator's Request for Info on Face ID Privacy and Security http:// ift.tt/2wZPONa #AAPL;;#AAPL
0;0;Apple to appeal five-year-long patent battle after $439.7 million loss https://www. theverge.com/2017/10/16/164 82568/apple-virnetx-facetime-patent-battle-loss-appeal-planned … via @Verge;@Verge;
2;1;I love apple cider so so much.;;
0;0;Apple answers Sen. Al Franken’s privacy concerns over Face ID http:// cnet.co/2yuKHbI via @CNET;@CNET;
0;0;Apple Pay India Launch Confirmed By Eddy Cue http:// zpr.io/ng5XZ pic.twitter.com/tUU5s6nwzp;;
0;0;If you asking me to pick an apple , I sure can. It's easy I only need a ladder.;;
0;0;Me gustó un video de @YouTube http:// youtu.be/oN7c-UkeRes?a UNBOXING APPLE WATCH NIKE PLUS SERIES 3 DIFERENCIAS;@YouTube;
0;6;11 days for account recovery Apple ?! 11 days because I put the wrong password on my ipad?!?!?!??!?!?!?!? 11 DAYS MORE THAN THE 48 HOURS;;
0;0;Apple Responds to Senator's Request for Info on Face ID Privacy and Security http:// ift.tt/2wZPONa;;
0;1;Join Robinhood and we'll both get a share of stock like Apple , Ford, or Sprint for free. Make sure you use my link. https:// share.robinhood.com/jamief68;;
0;0;One bad apple ... https:// youtu.be/1wunv9U4IWk;;
0;0;Apple Park October 2017 Drone Tour Shows More Finishing Touches [VIDEO] | http:// ift.tt/2kT7Vmt | #drone #dronetour #virtualdronetour;;#drone #dronetour #virtualdronetour
0;0;Apple Park 4K Drone Tour October 2017 | http:// ift.tt/2xK0h3T | #drone #dronetour #virtualdronetour;;#drone #dronetour #virtualdronetour
0;0;Apple iPhone 7 Plus 32GB Gold Smartphone for T-Mobile MNQK2LL/A 5.5" Display NEW http:// nicneven.feuersun.info/US/categories/ twt/?item=272890388846 …;;
0;0;same stupid shit at Apple .;;
0;5;Apple juice makes my taste buds tingle;;
0;1;Apple 's iPhone X worship hides a secret truth http://www. forbes.com/sites/ewanspen ce/2017/10/16/apple-iphonex-design-performance-best-ferrari/ … pic.twitter.com/PXGARvDK2H;;
0;0;おはよう、みなさん！こちらも午後には雨 止むみたいです。みっちゃん、ありがとう 私が厚着になる時は地球が氷河期になる時だよ;;
0;1;Apple Music doesn’t get any love nah;;
0;0;Apple iPhone X in Face-Off as Huawei’s Mate 10 Launches https:// lnkd.in/fpWGvjb;;
0;0;The latest Apple Rock #EventMarketing Trends! https:// paper.li/AppleRockUSA/1 336923832?edition_id=c7a16d80-b2cb-11e7-8e26-0cc47a0d15fd …;;#EventMarketing
0;0;Apple Responds to Senator's Request for Info on Face ID Privacy and Security http:// ift.tt/2wZPONa;;
0;0;Wait who's whos cinnamon apple;;
0;0;Exactly my issue. Can u believe I now need to make sure my portable charger is ready to go? As I often forget to charge it. I’m pissed APPLE;;
0;0;PlexPy (ChrisAyers-PC) devandaar ( Apple TV) started playing Brooklyn Nine-Nine - Fancy Brudgom.;;
0;0;“would you like a apple pie with your order?” first of all bitch did i ask for one;;
0;0;@AppValley_vip please kill that shitty Apple security has detected a virus ad, it fucks up the app and forces you to restart;@AppValley_vip;
0;0;Apple Watch Series 3 の設定してる https:// support.apple.com/ja-jp/HT204505;;
0;0;んだよこれヾ(╬｀Д´ )ﾉ Apple ってたまにイミフなアプデするよねーー;;
0;1;Im just gonna leave this n walk away.... #Halloween #pumpkincarving #naughty the apple pie is safe..... pic.twitter.com/qL38jQ91s8;;#Halloween #pumpkincarving #naughty
0;0;むかってるわ;;
0;0;アップデートに4.3リジェクトを適用するとは、 APPLE は本気でアプリの量を減らそうとしているな。;;
0;0;Les produits Apple qd ils sont tout neufs ils sentent trop bon;;
0;0;¿Por qué Amazon, Apple , Facebook, Microsoft y Google han tenido problemas para capturar a Hollywood? http:// nyti.ms/2gnTQw2;;
0;0;Chinese Apple Soup with Pork Ribs https:// souperdiaries.com/chinese-apple- soup-recipe/ …;;
0;0;Apple 's diversity chief apologizes after saying a group of 'white, blue-eyed men' can be considered diverse. https://www. google.com/amp/s/www.bizj ournals.com/sanjose/news/2017/10/16/apple-diversity-chief-apologizes-white-men-comment.amp.html …;;
0;0;Apple Responds to Senator’s Request for Info on Face ID Privacy and Security http:// bit.ly/2yqnDbM by julipuli http:// bit.ly/2x0Xf72 …;;
0;1;i call apple and listen to the classical music while holding;;
0;0;Apple hit with $440M in damages in VirnetX patent lawsuit – CNET http:// ift.tt/2ysH2Jr pic.twitter.com/SLrVj4EFf5;;
0;0;Apple está interesada en alquilar un estudio en Los Ángeles para crear contenido propio https://www. applesfera.com/rumores/apple- esta-interesada-en-alquiler-un-estudio-en-los-angeles-para-crear-contenido-propio …;;
0;0;うらたさんのとこみてないよおおおおお;;
0;0;Apple To Release iPhone With Apple Pencil Support In 2019: Here’s Why Steve Jobs Would Be… http:// wookbox.com/apple-to-launc h-iphone-with-apple-pencil-help-in-2019-right-heres-why-steve-jobs-would-be-pissed-tech-tech-occasions/ … pic.twitter.com/f7FEUdlt5r;;
0;0;Apple diversity chief apologizes to staff for statements made at summit https:// buff.ly/2yt4lUI pic.twitter.com/srNuao0IYh;;
0;0;apple https:// twitter.com/gyllensiut/sta tus/919622259953848320 …;;
0;1;Fomos a Apple Store do shopping Morumbi, e gente, pensa em um atendimento MARAVILHOSO. Sério o funcionário extremamente simpático .;;
0;1;Hmm must be a Michigan thing. Sounds good tho. Kinda want an apple fritter now;;
0;0;@Nero_ apple 【bot厨　撲滅運動実施中】タグをつけたbotは非常に迷惑迷惑迷惑迷惑迷惑迷惑迷惑迷惑迷惑迷惑迷惑迷惑迷惑迷惑迷惑迷惑迷惑迷惑迷惑迷惑迷惑迷惑迷惑迷惑迷惑迷惑迷惑迷惑迷惑迷惑迷惑迷惑迷惑迷惑迷惑迷惑迷惑1784232;@Nero_;
0;0;Huawei unveils new phone to challenge Apple , Samsung http:// fb.me/6iztGpDaq;;
0;0;I can't believe I went to metro & called Apple and I ended up fixing my phone on my own lmao;;
0;0;Apple answers Sen. Al Franken’s privacy concerns over Face ID – CNET http:// ift.tt/2ysntkf pic.twitter.com/WxEMOJDe5Y;;
0;1;I love cooking, making homemade chili tonight, and tomorrow a turkey dinner, with apple /pumpkin pies, mashpotatos and stuffing!;;
4;6;113. Won the 'Best Kpop Group' award at the American music awards show 2017 'Big Apple Music Awards' (BAMA) pic.twitter.com/W7LnPWLqZv;;
0;0;apple #BTSShow #MPN @BTS_twt;@BTS_twt;#BTSShow #MPN
3;2;Kobe is out now!! If you have Apple Music, Spotify, Google Play or any of these streaming services it's available for you! pic.twitter.com/EecQaUetMI;;
0;0;Do you have your phone paired with the Apple Watch when going for a run?;;
0;0;เมื่อคืนมันมีคลิปออกมาจริงว่ะ แต่กุหนีไปนอนก่อน อะเคร๊ 5555 171017 MXM - 애플 데일리 대만 Apple Daily Taiwan https://www. youtube.com/watch?v=5fz9-I bEBL4&feature=share …;;
0;1;Huawei Steps Closer to Overtaking Apple ’s iPhone http:// ift.tt/2gLzABv pic.twitter.com/Q1jLsJJCfP;;
0;1;今日はスーツ着たわよ！;;
1;0;Apple Responds to Senator's Request for Info on Face ID Privacy and Security http:// applenws.com/apple-responds -to-senators-request-for-info-on-face-id-privacy-and-security/2017/mac-rumors?utm_campaign=mac-rumors&utm_medium=twitter&utm_source=twitterapple … #AppleNews;;#AppleNews
3;4;apple ももうすぐ修正パッチ配信するみたい なので今セキュリティ危険煽りしてる株垢は確信犯()なのでブロックしたほうがいいですよ https:// twitter.com/mejironiyouji/ status/920071204291076096 …;;
0;1;Apple pie;;
0;3;Make sure y’all follow me on Apple Music https:// itunes.apple.com/profile/91Wavy;;
0;11;Why does this look okay..but it really is creepy .. Apple should make this one a official wallpaper;;
0;0;¿Por qué Amazon, Apple , Facebook, Microsoft y Google han tenido problemas para capturar a Hollywood? http:// nyti.ms/2gnTQw2;;
0;0;Well an MP3 Player, absolutely!! Hahaha!! Please no Apple;;
0;2;Red pill. Buy stock in apple and Facebook. Bet on sports https:// twitter.com/wesleysnipes/s tatus/920046984274292736 …;;
0;1;Huawei Steps Closer to Overtaking Apple 's iPhone http:// ift.tt/2ztlnRa;;
0;1;ice in apple juice?;;
4;95;if we drop tonight, the apple music version won’t be up till tomorrow or the day after that, just a heads up;;
0;6;@D0KD0_GT2 @Snake_GT2 @EAGLE_GT2 @Y010_GT2 @C0C41N3_GT2 @H4N_GT2 @BPurple_GT2 @2do_GT2 @D_ apple _GT2;@D0KD0_GT2 @Snake_GT2 @EAGLE_GT2 @Y010_GT2 @C0C41N3_GT2 @H4N_GT2 @BPurple_GT2 @2do_GT2 @D_;
0;4;#最後に聴いた曲を投下して5人指名をして繋げていくリレー @junMrs0611 @MGA__app ありがと〜♡♡♡ StaRt/Mrs. GREEN APPLE 指名はでてきた人にするね↓;@junMrs0611 @MGA__app;#
0;0;WPA2の脆弱性「KRACK」対処パッチ、Microsoftは対応済み、 Apple のOSとAndroidは数週間中 - ITmedia NEWS http://www. itmedia.co.jp/news/articles/ 1710/17/news044.html …;;
0;1;I could not pass up apple flavor tho;;
0;0;Apple slams Qualcomm suit seeking iPhone ban in China https:// buff.ly/2x0vs6M pic.twitter.com/XMEkfA30PF;;
0;0;Sensei Said So Podcast by The Clan on Apple Podcasts http:// fb.me/3I2Pk43Ya;;
0;0;Les cellulaires se plient, mais pas comme vous le pensez! http:// appleinsider.com/articles/17/10 /12/how-ditching-the-home-button-on-iphone-x-could-pave-the-way-for-a-dynamic-foldable-future-iphone … #iphone #apple @appleinsider #Techno;@appleinsider;#iphone #apple #Techno
0;1;Apple Cookies With Butterscotch Frosting https:// houseofyumm.com/apple-cookies- with-butterscotch-frosting/ … pic.twitter.com/39yZu6kxPR;;
0;0;とりあえずシャフる(ﾟ∀ﾟ)ﾊｲﾜ ﾛﾀ笑 規制なったら大変そやから気を付けるわ((( ´ºωº `)))ｶﾞﾀｶﾞﾀ笑 ほんでもって今から仕事なう(｡•́•̀｡) いつでも受診どーぞ♪上から下まで調べ…仕事いってきま(;//́Д/̀/)'`ｧ'`ｧ;;
0;0;あかりんごと全くかすってなくてわろた さやかね！;;
0;0;@Apple lanzó una gama de #emojis con #glamour , vendrán en la actualización del iOS 11.1. pic.twitter.com/CCY7KXioGg;@Apple;#emojis #glamour
0;0;Apple doesn’t belong in a fruit salad. #grindsmygears;;#grindsmygears
0;0;Siriの気遣いwwwやさしいwww pic.twitter.com/mYfvocBO4t #Siri #iphone #apple;;#Siri #iphone #apple
0;0;Steve Jobs Apparently Had No Input on the Apple ... http://www. smartwatchreviews.com/steve-jobs-app arently-had-no-input-on-the-apple-watch/ …;;
0;0;Check it out! #hack #screen #iphone #iphoneonly #apple #ios #phone #smartphone #mobile pic.twitter.com/qpVzMojpvS;;#hack #screen #iphone #iphoneonly #apple #ios #phone #smartphone #mobile
0;0;Apple Ios 11: Six Awesome Features That You Will Love http:// dlvr.it/Pw168V pic.twitter.com/iLAwqw7eK8;;
0;0;> Apple SVP Eddy Cue 'Vehemently' Disagrees With Perception That Apple 's Innovation Has Slowed http://www. iatkosx86.tk/2017/10/apple- svp-eddy-cue-vehemently-disagrees.html …;;
0;0;¡Consigue un pack de productos de Apple ! ¡Participa ahora con #SorteosAppMiVodafone y llévatelo! http:// bit.ly/PackAppleVF;;#SorteosAppMiVodafone
0;1;As Voice Has Its Moment, Amazon, Google and Apple Are Giving Brands a Way Into the Conversation via @mtviveiros http:// bit.ly/2kTEMrk;@mtviveiros;
0;0;Personalisation of every customers’ #banking_experience needed. Social media, Google, Apple , Amazon are taking over https:// buff.ly/2yqYDkJ;;#banking_experience
0;0;@apple _p_Kuro 忍さんおはようございます〜 今日はみんなでお出かけですか？ ゆっけはまだEveに挨拶もしていませんw 起こしてあげてくださいね♡;@apple;
0;0;Please RT! #thermomix #recipe Thermomix Apple &#038; Apricot Bircher Muesli http:// bit.ly/2wUetGV pic.twitter.com/pHXO3Amk4S;;#thermomix #recipe #038
0;0;Apple is putting the finishing touches on its $5 billion campus — including private basketball courts http:// fb.me/3ySf95GYc;;
0;2;頑張れ I am apple;;
0;0;Apple ’s diversity VP apologizes for controversial statement at summit this week http:// fb.me/1E0NyzjXf;;
0;2;A very Happy Birthday to you!! Any chance you'll be having a Meet-Up while in the Big Apple ??;;
0;1;Chrysanthemum Apple Cake is nothing like that good as a name, but I like my rust-colored chrysanthemum & the apple cake I baked on Saturday.;;
3;2;Apple Hj eu digitei tanto em ingles q ja to bilingue #MPN #BTSShow;;#MPN #BTSShow
0;0;ok not to be fucking dramatic but i need my phone more than anything omfg i cant stand using spotify i need apple music..my only privilege..;;
0;0;I won 4 credits for free phone calls. Super cool! Chance to win an Apple Watch, Gift Cards, etc. Get Dingtone at http:// dingtone.me/d;;
0;0;FREE Apple & Eve Organics Juice at Publix via Couponers United | Free Coupon Classes Orlando FL | ... http:// tinyurl.com/ybmrgdj3;;
0;0;Apple https:// twitter.com/gyllensiut/sta tus/919622259953848320 …;;
0;1;concordo mas n largo minha Apple;;
0;0;iDrop News is giving away an Apple Pencil in December, enter to win now. https:// wn.nr/bSQ5RS;;
0;0;iPad Proは apple pencilの遅延やフリーズが目立って戻したいくらいですが、iPhoneの方は更新が必要になったアプリが出た以外今の所困ってませんね。;;
0;0;i couldn't think of any except it's Apple being Apple .;;
0;0;“Your Apple Music subscription has expired” First of all, I just paid you mfs;;
1;12;The entire yoga class I was craving a 24 oz. Heineken and two McDonald's apple pies for $1.;;
0;0;Email apple complaining xxxxx;;
0;0;#10: Apple Watch Band,Soft Silicone Sport Replacement Strap for Apple iWatch Series 1 2 3 Sport… https:// goo.gl/fb/647UMB #Smart #Watch;;#10 #Smart #Watch
0;0;#7: Apple Watch Band , Soft Silicone Sport Replacement Strap for Apple iWatch Series 1 2 3 Sport… https:// goo.gl/fb/TsTMFf #Smart #Watch;;#7 #Smart #Watch
0;0;Apple Responds to Senator's Request for Info on Face ID Privacy and Security http:// ift.tt/2wZPONa;;
0;0;#apple Genius Bar, they r late & I let guy kno I’m on a hard out due to case in OR. He made analogy that his work like OR. Ok, ‘genius’;;#apple
0;0;Grupo Internet Brasil já saiu! https:// paper.li/InternetBrasil /1311093681?edition_id=83adf350-b2cb-11e7-8823-0cc47a0d164b … #smartphones #apple;;#smartphones #apple
0;1;My Apple Music is acting up;;
0;0;MacRumors: Apple Responds to Senator’s Request for Info on Face ID Privacy and Security https://www. macrumors.com/2017/10/16/app le-face-id-senator-response/ … b… pic.twitter.com/e5llKnOHjB;;
0;0;I spent 1 hour and 7 minutes working out with Apple Health. 271 calories burned. #LoseIt;;#LoseIt
2;0;Apple Responds to Senator's Request for Info on Face ID Privacy and Security http:// applenws.com/apple-responds -to-senators-request-for-info-on-face-id-privacy-and-security/2017/mac-rumors?utm_campaign=mac-rumors&utm_medium=twitter&utm_source=twitterapple … #AppleNews;;#AppleNews
0;2;Check this contest to win a free Apple Watch! The more people participating the more giveaways... http://www. AppleAddicted.life I want mine pic.twitter.com/wqrrJryX3a;;
0;0;りんごさんおめでとぉぉぉおおおお;;
0;0;I wanna know more about streaming and how an artist gets an album sale from someone who has Apple Music or something. I’m confused.;;
0;0;Apple iPhone 7 outselling iPhone 8 https://www. gsmarena.com/iphone_7_outse lling_iphone_8-news-27751.php … #tech #feedly;;#tech #feedly
0;0;choix flambeur : jme prends une golf 7 sympa et une apple watch, et je garde le reste pour une prochaine bagnole;;
0;0;Apple Responds to Senator's Request for Info on Face ID Privacy and Security http:// ift.tt/2wZPONa;;
1;4;The boys are here making your mealtime better for the next hour. Come say hi to Apple Valley 12AAA #ChickfilA #AppleValley pic.twitter.com/6x7542CU86;;#ChickfilA #AppleValley
0;1;Do it daddy!;;
0;0;SUPERB 2015 13" Apple MacBook Air laptop i5 1.6 - 2.7GHz 128GB SSD 4GB RAM http:// trivia.stonefeuer.info/US/categories/ twt/?item=372107165284 …;;
0;0;特型建造(ガチャの名前) で『エンタープライズ』を引く チュートリアルの一回目のガチャは星2以下？確定だから そのあともらえるキューブってアイテムと資金を使って建造(ガチャ) 星3で最高レアね。;;
0;2;Apple Mail is pretty shite isn't it.;;
0;0;Apple Responds to Senator's Request for Info on Face ID Privacy and Security http:// ift.tt/2wZPONa;;
2;2;Development of Swift was a misstep by Apple .;;
0;1;Come to Boston. We can go apple picking tooooooooo;;
0;0;【定期】 DYNAMIC CHORD apple -polisher Toi / 音石夕星くんのグッズを回収しております。お手元に迷子の夕星くんがいらっしゃいましたら、是非検索からでもお気軽にリプ下さい。;;
0;0;Apple Responds to Senator's Request for Info on Face ID Privacy and Security http:// ift.tt/2wZPONa;;
0;0;This question is as logical as, “would you welcome Apple burritos, if they were introduced.” https:// twitter.com/chrissyfarr/st atus/920055951440228353 …;;
0;0;Please RT #beauty Is the Apple Watch worth it&quot; http:// bit.ly/2ytNqlw pic.twitter.com/cdvWJCwbK3;;#beauty
0;1;I prefer the privacy of Apple .;;
0;0;even if on some ancient phone apple doesn't care about any more like iphone 5 that'd be a dream. i just hope it'll be sometime this decade…;;
0;0;➚Very very Berry Release on apple -Utopia- https:// itunes.apple.com/jp/album/utopi a-single/id1202116538 … #música #Japón #información;;#m #Jap #informaci
0;1;Ladies, dress cute when you go to the Apple Store. Thank me later;;
0;0;Necesito que te descargas algo para androide y apple JUAN PABLO;;
0;0;Apple hit with $440M in damages in VirnetX patent lawsuit - CNET Judge issues final judgment in legal battle with... http:// fb.me/7gsKr3Y44;;
1;0;What upgrade? iPhone 7 reportedly outselling iPhone 8. https:// buff.ly/2gLGEy2 @CNET #techgeeks #Apple $ AAPL pic.twitter.com/qrOiwcm4wN;@CNET;#techgeeks #Apple
0;0;Apple answers Sen. Al Franken’s privacy concerns over Face ID - CNET Apple responded to the Democrat’s concerns... http:// fb.me/6JrTeld3C;;
0;0;Report: Apple entered deep acquisition talks w/ health clinic startup as it mulls entry… http:// applejoyride.com/?p=286997 pic.twitter.com/3kIJgU2gWX;;
0;0;I need someone to bring me apple cider it's an emergency;;
0;0;➞AKIRA(亮) Release on apple -DARK SIDE- https:// itunes.apple.com/jp/album/dark- side-single/id1203617733 … #música #Japón #información;;#m #Jap #informaci
0;0;Apple hit with $440M in damages in VirnetX patent lawsuit – CNET http:// applejoyride.com/?p=286998;;
0;0;Apple pagará 440 millones de dólares por plagiar iMessage y FaceTime https://www. ipadizate.es/2017/10/16/app le-juicio-virnetx/?utm_source=twitter-ipadizate&utm_medium=dlvr.it&utm_campaign=share-night …;;
0;0;With high winds in the forecast, make sure you have KEC's SmartHub app (available on both Apple and Android... http:// fb.me/BpNyMCmh;;
0;2;now on Apple Music feat @kyle_hiill2 https:// itunes.apple.com/us/album/no-fe elings-feat-dr-p/id1296949182?i=1296949187https://itunes.apple.com/us/album/no-feelings-feat-dr-p/id1296949182?i=1296949187 …;@kyle_hiill2;
