retweets;favorites;text;mentions;hashtags
0;0;Когда Apple рассказывает о новых функциях в своих устройствах, в голове крутится один и тот же вопрос: «А что, и этого раньше у них не было?;;
0;1;apple イヤホン使ってる人バレちったよwww;;
0;0;Farted in da Apple Store, No Windows #raplikewayne;;#raplikewayne
0;0;Apple Turnover Murder Hannah Swenson Mystery With Recipes http:// tinyurl.com/76svk7f pic.twitter.com/6RdmTAJJ;;
2;0;I want a CARAMEL CANDY APPLE SOOOOO BAD!!!;;
0;0;The Big Apple or Chi town? False: Brian Williams. #BrianWilliamsismyNigga;;#BrianWilliamsismyNigga
0;0;@dreamer5h estaria trocando de icon no meu not da apple;@dreamer5h;
0;0;A for apple , B for Ball, O for ??? Z for ???;;
0;0;【速報】 Apple オンラインストアで｢iPad mini Retinaディスプレイモデル｣の販売開始！41,900円から #かみあぷ http://www. appps.jp/archives/21095 38.html …;;#
0;0;RT @CNNMex : Apple tuvo ventas históricas de su iPhone, pero Android sigue siendo el ‘rey’ de los smartphones http:// cnn.mx/n001SI3;@CNNMex;
0;0;RT @CNNMex : Apple tuvo ventas históricas de su iPhone, pero Android sigue siendo el ‘rey’ de los smartphones http:// cnn.mx/n001SI3;@CNNMex;
1;0;#Apple #MacBook Core2Duo 2Ghz 1GB RAM 80GB #HD 13 MB061LL/A #BuyNOW $229.99 #deal #ebay #apple http:// bit.ly/1bBtGrr;;#Apple #MacBook #HD #BuyNOW #deal #ebay #apple
0;0;oh how i love apple cider;;
0;0;Grandi!!! Samsung pays Apple $1 Billion sending 30 trucks full of 5 cent coins http:// news-hound.net/samsung-pays-a pple-1-billion-sending-30-trucks-full-of-5-cent-coins/ …;;
0;0;Apple releases previously SECRET OPERATING SYSTEM SOURCE CODE - Register http:// ift.tt/183oHAL #sourcecode #news;;#sourcecode #news
0;0;¿Por qué usan la manzanita de Apple en sus nombres o bios? Sólo se lo paso a @MARAVERT . XD;@MARAVERT;
13;2;Surprise: Apple Maps Is a Hit, Google Maps Loses Ground http:// on.mash.to/18pJgnA;;
0;0;Apple accepting donations for Philippines Typhoon relief efforts http://www. iphonehacks.com/2013/11/apple- accepting-donations-philippines-typhoon-relief-efforts.html#.UoLA5vZZMb4.twitter …;;#
0;0;@_rin_ apple よお、凛りんご@ラフィネは嫁！寝癖なんとかしとけよー;@_rin_ @;
0;0;Apple and Samsung back in court http:// dld.bz/cUaTg;;
0;0;@priiesalvadorqw @emilijulia_ já querooo, BIG APPLE !;@priiesalvadorqw @emilijulia_;
0;0;Can anyone recommend where to get my MacBook fixed? Nearest Apple store is miles away & is always packed! #help;;#help
0;0;@AlexDaUkrainian @youens exactly - Apple should be ashamed of itself - $50 for each step up would be a lot, let alone $100;@AlexDaUkrainian @youens;
0;0;i go in my fridge in hopes to find an apple juice, but i find a deer heart instead. #huntingprobs;;#huntingprobs
0;0;Gene Munster: The iPhone, iPad, Apple TV and beyond http:// zite.to/1clldsx via @zite;@zite;
9;0;who took a bite out of the apple on the iPhone?;;
0;0;Apple Cider&&Cinnamon!!!;;
0;0;OMG what a nice easy dinner to come home to - packet risotto Milanese with @fieldroast apple and sage… http:// instagram.com/p/gokXpBIJ1h/;@fieldroast;
0;0;ReadWrite: Apple Maps Takes Off: Cue The Antitrust Lawsuit? http:// google.com/producer/s/CBI w6JnvpQ4 …;;
0;0;drinking hot apple cider while i do homework(:;;
0;0;If you like me you'll get me some good apple cider bc I finished mine and love it pic.twitter.com/PrKQmI7ivU;;
0;0;Apple Pie Moonshine #joescrabshack #happyannitome http:// instagram.com/p/gokWJWj-ZB/;;#joescrabshack #happyannitome
0;1;#Chef #ChefAleta Delicata Squash and Apple Soup: pic.twitter.com/r8VILf9ALA;;#Chef #ChefAleta
1;0;You can learn #languages with your mac! Learn how to communicate in #Chinese http:// goo.gl/RPtsW8 #apple #mac #education;;#languages #Chinese #apple #mac #education
0;0;@mame_ apple あ。まめちゃん関西か。今東京(の電車の中)にいるけどすんげーさみぃよぅ( ；∀；) あー。それ関連の仕事してるから着てるの。いつもはスーツ！！！！！！！！ あ。私の格好良いではないかごっこ出来ないよｗｗ 作り帯だしｗｗｗｗ;@mame_;
0;2;@THEIndian_yo omg yes! I hate green apple skittles!!) :;@THEIndian_yo;
1;0;La nueva tableta #iPad Mini ya salió a la venta, pero la disponibilidad es limitada. http:// cnn.it/HW1LsD #Apple;;#iPad #Apple
0;0;Silver Update 4/5/12 Apple Bubble - Software Provided By http:// Netdania.com http://www. netdania.com derivative... http:// goldfinder.com.au/?p=1661;;
0;0;The windy city or the big Apple;;
0;0;Public at last: Apple II DOS code that launched an empire - CNET http:// dlvr.it/4Jj66w;;
0;0;" @CNNEE : La nueva tableta #iPad Mini ya salió a la venta, pero la disponibilidad es limitada. http:// cnn.it/HW1LsD #Apple " Plop :$;@CNNEE;#iPad #Apple
0;0;服にーカメラにー Apple にーサッカーにー;;
1;0;i, uh, don't want my grocery stores to be comparable to the apple store http://www. wired.com/business/2013/ 11/apple-store-as-grocer/#slideid-131981 …;;#slideid
0;0;Apple is looking forward for Liquid metal exterior for iPhone 6 http:// shar.es/8vsAs via @TheNewsTribe;@TheNewsTribe;
0;0;Apple Mulai Jual iPad Mini Retina - BeritaSatu http:// dlvr.it/4Jj64s #iPad;;#iPad
0;0;Why let one bad apple spoil the whole damn BUNCH;;
0;0;You're up shit's creek with Apple maps #FreshMeat;;#FreshMeat
0;0;Caramel Apple Cream Cheese Cookie Bars - Picky Palate - http:// wertherscaramelshoppe.com/post/474/caram el-apple-cream-cheese-cookie-bars-picky-palate … via http:// wertherscaramelshoppe.com /;;
0;0;Review: Pricey iPad Mini keeps Apple premier brand: Apple is probably one of the few companies tha... http:// tinyurl.com/kkukesw #Technology;;#Technology
0;0;The Next Big Thing You Missed: If the Apple Store Sold Groceries | Wired Business http:// hlpfrm.it/18pNbR8;;
0;0;Apple Mulai Jual iPad Mini Retina - BeritaSatu http:// dlvr.it/4Jj611 #iPad;;#iPad
0;0;@Det_Conan_Kudo @iH8sn0w announced in the summer that apple left 6.0.2 open for downgrade on the i5. I downgraded and lost AWS support...;@Det_Conan_Kudo @iH8sn0w;
0;0;Millones en disputa entre Samsung y Apple . Uno de sus juicios por derechos de autor comenzará dentro de poco... http:// bit.ly/182DE6g;;
0;0;今日サンタモニカの Apple storeにipadあったら買うな、いや買うね！！;;
0;2;Apple store makes me want to shoot myself in the eyes.;;
0;0;Caramel Apple Cream Cheese Cookie Bars - Picky Palate | Caramel, apples, and cheesecake! http:// pinterest.com/pin/4402269322 96699909/ …;;
0;0;I hope I get the job at the Apple store in Berkeley! That, would be amazing;;
0;0;Bouta be on my 4th apple charger smh;;
0;0;PAUSE WAYMENT HOL UP! morgen umm uhh where my candy apple mad again;;
0;0;I'm at Apple Store (Bellevue, WA) http:// 4sq.com/1i7xt4K;;
0;0;#lazytweet API for Apple TV (current gen) to issue remote cmds to the device ala iOS Remote.app? "Home share" looks to be a walled garden.;;#lazytweet
2;0;Apple II DOS, written in seven weeks in 1978, would take years today http:// bit.ly/HSDXqx;;
0;0;Why does everyone want an Apple TV? Dam thin gonna be so expensive it will be a flop. They need to stick to the lil black box.;;
1;0;no one can convince me that lorde isn't fiona apple and darlene connors baby.;;
0;0;"iAd Workbench Expands to New Countries" http:// bit.ly/1bsTR5x via Apple Developer News;;
1;0;Apple jacks good;;
0;0;Find great prices on ALL APPLE PRODUCTS: iPod, iPad, iMac, iPhone new and used at http:// bit.ly/8Yaxvd ~ #apple #iphone #ipod #ipad #mac;;#apple #iphone #ipod #ipad #mac
0;0;@NewSchoolSS @rjchoppy @TommySledge is it a man cars violation if I like redds apple ale? #therealmancardcourt;@NewSchoolSS @rjchoppy @TommySledge;#therealmancardcourt
1;1;@zgal97 I hang out with an apple who loves self loathing;@zgal97;
0;0;#fruits#c#vitamin#deposu#apple #orange#grape#healthy#zero#calori#happyhappy#instapic http:// instagram.com/p/gokDOBn9hq/;;#fruits #c #vitamin #deposu #apple #orange #grape #healthy #zero #calori #happyhappy #instapic
0;0;Public at last: Apple II DOS code that launched an empire - CNET http:// dlvr.it/4Jj5ph;;
0;0;Spoon ketchup flag car apple pie;;
0;0;Apple Developer News;;
0;0;Состоится новое судебное заседание по иску Apple к Samsung http:// vk.cc/1YRt1m;;
0;0;You can learn #languages with your mac! Learn how to communicate in #Italian http:// goo.gl/Gam4hv #apple #mac #education;;#languages #Italian #apple #mac #education
0;0;@Vitacost Apple pie!;@Vitacost;
0;3;Someone made apple pie cookies. It was me. They're delicious. http:// instagram.com/p/gokS5IDMxk/;;
0;0;#Russian is interesting to learn - This #Mac app eventually help http:// goo.gl/htU6cS #apple #education #learning #osx #edtech;;#Russian #Mac #apple #education #learning #osx #edtech
0;0;Lindo souvenir que me regalaron.. The big apple . pic.twitter.com/ZqBJvaFnZ4;;
0;0;I'm at Apple Store (Philadelphia, PA) w/ 3 others http:// 4sq.com/1eJt1Jm;;
0;0;I lost in watchin "adam's apple " .. So d movie so interestin food nt even on my mind...;;
0;0;BANANA AND APPLE JUICEEEEEEEEEEEEEEEE YAYYYYYYYYYYYYYYYYYYYY;;
0;0;Black Mamba 24 Kobe Bryant NBA Skin-Protector for Apple iPhone 4 http:// bit.ly/11vYFCM;;
0;0;@luobo05 Apple って世界共通モデルな…ハズなんですけど。い〜っぱい売るから、 はヨロシクって事なんでしょうか。 docomo版＋MVNOに期待なんですけど、本体だけだと割高 (｡-_-｡);@luobo05;
0;0;3 bowls of apple jacks later..;;
0;0;Why Am I stuck driving behind a tractor on a dirt road? Oh I know why cause I'm in ass crack Apple valley!;;
1;0;@HSHsports Apple Valley High school. Football Track . Wide Reciever. Apple Valley, Minnesota. #AVFB #AVTF;@HSHsports;#AVFB #AVTF
0;1;Fuck sake Apple . Let me but the new iPad Mini already... Stop saying you can't process my request;;
0;0;@_rin_ apple 何ィ？凛りんご@ラフィネは嫁もう起きるのかよォー…。もうちょっと…寝よーぜェー…。;@_rin_ @;
0;0;Retina iPad mini unboxing and first hands on http:// ift.tt/1fzS0wu #Apple;;#Apple
0;0;Dark rum and apple ... Yum!;;
0;0;@thegamecock I can't believe that Apple would post jobs before signing a lease or announcing a coming store opening. Much ado about nothing.;@thegamecock;
0;0;Ciiee bbm android :D apa apple ?? “ @RullyFir : Invite 767b53e1”;@RullyFir;
0;0;国内携帯電話シェア、ソニーモバイルが初の2位に(「 Apple 」最新記事一覧‐ITmedia キーワード) / http:// bit.ly/1dTiVW1;;
0;0;FFS! My charger has broken again, and I'm on 24%. Apple are you fucking joking?;;
0;0;ARGH! My Car was Broken into, lost daughter's ipod and MY green apple @5hourenergy DANG IT!;@5hourenergy;
0;0;Apple cider, chili, sweats. I'm ready to be stuck in the house. BRING IT ON;;
0;0;@_rin_ apple 郁「おっ、おはよ！」涙「…お、おはよう」;@_rin_;
0;0;Like this is another reason why Apple be working my nerves because their products always on some BULL.!;;
0;0;Our 2 summer seasonal ciders, Bandwagon Apple and Berried Alive, will be pouring from 5pm today! A bit drier than last year, tasting great!;;
0;0;Surprise: Apple Maps Is a Hit, Google Maps Loses Ground http:// dlvr.it/4Jj5T7;;
0;0;“ @MarketWatch : Apple and Samsung back in court http:// on.mktw.net/1bBuFId ” they left at some point?;@MarketWatch;
1;0;i really want some iCECREAM and apple pie from mcdonalds .;;
1;0;Not holding my breath for an Apple television set. Why would Apple enter a legacy device market?;;
0;0;Win the new #Apple #iPad in the Experience Advertising #Sweepstakes ! @experienceads http:// woobox.com/zzsvs8/4os1o8;@experienceads;#Apple #iPad #Sweepstakes
1;0;“ @andypina54 : What two apps do you have to download to text with emojis?-.-” apple and Iphone;@andypina54;
0;1;No worries, I brought my apple juice out with me;;
0;0;“ @TheeGrCERO : Does anyone have an Apple TV...” Never! I die first lol! Why don't you get one that is refurbished on http:// apple.com ?;@TheeGrCERO;
0;0;Why Google's Android Is Devouring Apple , In 1 Chart http://www. huffingtonpost.com/2013/11/12/goo gle-android-apple_n_4260292.html …;;
0;0;Ms. V's lower elementary class went to the Apple Store on a field trip today to learn how to make i movies!! http:// fb.me/11T7hHC8e;;
0;0;Takis & Everfresh Green Apple Drink Lawd <<<<<;;
0;0;Состоится новое судебное заседание по иску Apple к Samsung - http:// ekonomika-info.ru/2013/11/sostoi tsya-novoe-sudebnoe-zasedanie-po-isku-apple-k-samsung/ …;;
0;0;@ashley_godinez3 ill send them with some peach cobbler and apple pie to bring you;@ashley_godinez3;
0;0;<happy mail day> @bananarepublic #fur katespadeny #apple #just2fancy @http://www. just2fancy.com http:// instagram.com/p/gokNp_KgLP/;@bananarepublic @http;#fur #apple #just2fancy
0;0;i been eating an apple wrong this whole time D:;;
0;0;@AgusMaria15 jajaja fiesta del 30, pero no puedo. Igual sale Apple el viernes con mi amigo Fran (?;@AgusMaria15;
1;0;Just stopped by @JuiceLandAustin to buy the Apple Lilly juice cleanse drink. I was craving it. Apple celery parsley cucumber kale spinach!!;@JuiceLandAustin;
0;0;Win the new #Apple #iPad in the Experience Advertising #Sweepstakes ! @experienceads;@experienceads;#Apple #iPad #Sweepstakes
0;0;NaBloPoMo: For you are an apple perched at the very top of a very tall tree http:// wp.me/p68b6-i4;;
1;0;Apple iPhone 5s 32GB (Gold) - Unlocked , http://www. amazon.com/exec/obidos/AS IN/B00F3J4NSI/now_keyword-20/ref=nosim/ … #Amazon;;#Amazon
0;0;If Apple products are any indication, ZODIAC ORACLE X is gonna be polarizing at first but ultimately better than anything before it;;
1;2;Flux pavilion - bass cannon sounds so fucking good with Apple EarPods.;;
0;0;Slowdown in Apple TV shipments suggests delay for full-size television http:// appleinsider.com.feedsportal.com/c/33975/f/6161 68/s/339b8754/sc/21/l/0Lappleinsider0N0Carticles0C130C110C120Cslowdown0Ein0Eapple0Etv0Eshipments0Eseen0Eto0Edelay0Enew0Ehardware/story01.htm …;;
0;0;Wow Aroma's hot apple cider w caramel;;
0;0;Apple Responds To Student's Campaign to Change 'Gay' Definition In Company's Dictionary http:// huff.to/1e1lD9B via @HuffPostGay;@HuffPostGay;
0;0;Slowdown in Apple TV shipments suggests delay for full-size television: Apple is expected to launch a refreshe... http:// bit.ly/1cSRlZn;;
0;0;Apple Insider: Slowdown in Apple TV shipments suggests delay for full-size television http:// bit.ly/1cSRlZn;;
4;4;¿Así será el TV de Apple ? [Imágenes] | Movida Apple http:// movidaapple.com/2013/11/12/asi -sera-el-tv-de-apple-imagenes/ …;;
0;0;@apple _pie7110 サンキューヽ(*´▽)ノ♪ トイレ報告はいらない(笑);@apple;
0;1;@THEshawnathan THE APPLE JUICE BOTTLE IN THE BACK HAHAHAHA;@THEshawnathan;
0;0;At Apple Tree Pre-School — https:// path.com/p/3Czrxl;;
0;0;Apple is dead in the water http:// t.money.msn.com/top-stocks/app le-is-hated#tscptmt …;;#tscptmt
0;0;Public at last: Apple II DOS code that launched an empire http:// tinyurl.com/mrdpwuf #technologies #tech;;#technologies #tech
0;2;Mom made homemade little apple pies for desert tonight pic.twitter.com/aExQa3OCOw;;
0;1;I usually eat an apple a day. Just returned from a local orchard with fresh NY grown apples. Keeping the Dr away as long as possible. (KS);;
0;0;Рестор - официальный поставщик техники фирмы Apple . В ресторе я когда-то покупал планетный компьютер iPad. Там можно и iPhone приобрести.;;
0;0;APPLE SAUCE – how timely, use a pot or your #slowcooker and use whatever #apples and #flavourings yo http:// pinterest.com/pin/1678998923 31801814/ …;;#slowcooker #apples #flavourings
0;1;When the apple isn't overpowered by the latte taste is when all of the world is right lol.;;
0;0;@_rin_ apple トーマ「おはよう、凛りんご@ラフィネは嫁。体調は？今日も元気？」シン「見りゃわかるだろ……おまえも、いつまでもぼけっとしてないで、さっさと仕度しろよ」;@_rin_ @;
0;0;@AustinMahone #AustinBangaBanga I'm one month clean today Austin and it would mean the world if you'd follow me! x apple;@AustinMahone;#AustinBangaBanga
0;0;Cukup sulit buat menyakinkan monyet bahwa apple lebih manis dari pada pisang=D;;
0;0;I have the urge to wanna throw an apple at somebody;;
0;1;@emilijulia_ @Bambeerg partiu jovens, sabado ganhamos 3 big apple la kkk;@emilijulia_ @Bambeerg;
0;0;@toddbishop The Law of Small Numbers at work again. Apple still grew faster than WP in number of phones sold.;@toddbishop;
0;0;When I was little everyone called me Booboo,Pumpkin,Ms.Britt,& Apple Dumplin.;;
0;0;eForCity Hybrid Case compatible with Apple ® Iphone® 4/ 4S, White Hard/ Black Skin , http://www. amazon.com/exec/obidos/AS IN/B0097MF0PC/now_keyword-20/ref=nosim/ … #Amazon;;#Amazon
0;0;first caramel apple spice of the season;;
0;0;Apple iPhone 5 vs Blacberry Z10 #Dilema_Pilih_Yg_Mana;;#Dilema_Pilih_Yg_Mana
13;6;Apple posted 13 job openings in Columbia today, sparking speculation that a store might be on the way. What do you think? Are you applying?;;
0;0;I'm fiendin for some apple pie right now;;
0;0;I'm calling it right now, Apple is going to release a iPad Pro next year..;;
0;0;@fcommakatie @Coughl1n Ahh, good ol' AIM... but yeah no it's my phone manufacturer's fault for not being Apple;@fcommakatie @Coughl1n;
0;0;Apple -related phishing and online banking malware increase http:// j.mp/1e1i4A5;;
0;3;Green apple slices and peanut butter;;
0;0;Apple is looking forward for Liquid metal exterior for iPhone 6 http:// shar.es/8vst4 via @TheTechnoTribe;@TheTechnoTribe;
0;0;Apple releases ITS OPERATING SYSTEM SOURCE CODE http:// bit.ly/183mGVs;;
0;1;#Apple pone a la venta el nuevo iPad Mini http:// bit.ly/1bsTKGZ;;#Apple
0;0;apple 社のイヤホンの音漏れやばww;;
0;0;GLAZED MAHI MAHI Recipe for: Glazed Mahi Mahi, with shrimp and apple salsa Ingredients: Salsa 12 small shrimp... http:// fb.me/38err0Fsr;;
0;0;Soso, das iPad Air ist also totaler Schrott, hat Display Probleme ohne Ende und die User sind kurz davor die Apple Zentrale anzuzünden? :D;;
0;0;Wireless Steel SeriesWoW MMORPG gaming mouse for Windows and Apple Mac OS http:// bit.ly/18ZWzi3;;
0;0;A world of cider: Tasty varieties to try this season: Whether it’s called apple wine, cider beer, sake cider or sidra, one thing rema...;;
0;0;A world of cider: Tasty varieties to try this season: Whether it’s called apple wine, cider beer, sake cider or sidra, one thing rema...;;
0;0;A world of cider: Tasty varieties to try this season: Whether it’s called apple wine, cider beer, sake cider or sidra, one thing rema...;;
0;0;A world of cider: Tasty varieties to try this season: Whether it’s called apple wine, cider beer, sake cider or sidra, one thing rema...;;
0;0;A world of cider: Tasty varieties to try this season: Whether it’s called apple wine, cider beer, sake cider or sidra, one thing rema...;;
0;2;@damMacKenzie @summerell69 like a deer by an apple tree;@damMacKenzie @summerell69;
0;0;“ @just_lilnigga : “ @_SpecialKae : Bitch the middle button on my phone coming off ,, fuck apple as a company” lmao tf?”lolololol;@just_lilnigga @_SpecialKae;
1;1;@BarbeeBoobug ill get some apple juice and you get the animal crackers lol TURN UP;@BarbeeBoobug;
0;0;So Apple doesn't sell the '5' anymore I need a 32 gb;;
0;0;" @Gestionpe : Apple puso hoy a la venta el nuevo #iPadMini con Retina Display http:// goo.gl/6IhqHN " No cedas, @frantisan !;@Gestionpe @frantisan;#iPadMini
0;0;@apple _marines くーる君 おはありのおはよう( ´ ▽ ` )ﾉ今日もよろしく☆;@apple;
0;0;Putting Liam and denim together is like adding vanilla ice cream to apple crisp it makes whats hot hotter;;
0;0;The Next Big Thing You Missed: If the Apple Store Sold Groceries. http://www. wired.com/business/2013/ 11/apple-store-as-grocer …;;
0;3;RT @BostonBiz : Tech news: Review: Pricey iPad Mini keeps Apple premier brand http:// bo.st/1gHvNzw;@BostonBiz;
0;0;I feel #Apple is on the decline since #SteveJobs passed on. A man of such genius speaks his last words of wisdom. http:// ow.ly/i/3HSwA;;#Apple #SteveJobs
0;1;RT @BostonBiz : Tech news: Review: Pricey iPad Mini keeps Apple premier brand http:// bo.st/1gHvNzw;@BostonBiz;
0;0;MacMagazine Scales to Cover Apple 's Keynote Address http:// blog.pagodabox.com/macmagazine-sc ales-cover-apples-keynote-address/ … - I know this is old news, but it's a sweet write-up @PagodaBox;@PagodaBox;
0;0;I don't really care how to make a swan out of an apple to be honest!;;
0;0;Apple MC184LL/B Wireless Keyboard (English) $65.00 http:// bit.ly/1703ya2 #mouse #desktop;;#mouse #desktop
0;0;Apple is looking forward for Liquid metal exterior for iPhone 6... http:// fb.me/2kJ2IDO4J;;
0;0;【マイリスト】【Bad Apple !クリスマスver.!】X'mas Apple !!【修正版】 http:// nico.ms/sm9100883 #sm9100883;;#sm9100883
0;0;(1 copo de big apple com "xuépis");;
0;0;thank god Marshall from the Apple support website knew how to rescue my phone because i sure didn't.;;
0;0;@angelaisperf Its Rare If You See A Fight (x , @Apple Their Bunch Of Pussys (x;@angelaisperf @Apple;
71;25;La nueva tableta #iPad Mini ya salió a la venta, pero la disponibilidad es limitada. http:// cnn.it/HW1LsD #Apple;;#iPad #Apple
0;0;Our Fresh Fruit jewelry candle collection includes Black Cherry, Apple Harvest and Strawberry candle http:// pinterest.com/pin/3134928240 33031928/ …;;
0;0;Presentan nuevas imágenes de Mothership, la nueva sede de #Apple con forma de nave espacial http://www. latercera.com/noticia/tenden cias/2013/11/659-551298-9-presentan-nuevas-imagenes-de-mothership-la-nueva-sede-de-apple-con-forma-de-nave.shtml …;;#Apple
0;0;Ya salieron los precios de las iPad Mini con Retina Display...guardaré aún más, a ver si en enero salgo con todos mis juguetes Apple .;;
0;0;Sooo my phone really just shut off and came back on by itself… #TF , I will be going to Apple the next time I go home.!;;#TF
0;0;This is pretty neat: http:// goo.gl/77aKVz Learn #French spelling on your #mac #apple #backtoschool;;#French #mac #apple #backtoschool
0;0;Apple Gets Free Advertising Other Companies Could Only Dream Of http:// trap.it/mZSQwD #android;;#android
0;0;I want apple bees or bdubbs;;
0;0;“ @_SpecialKae : Bitch the middle button on my phone coming off ,, fuck apple as a company” lmao tf?;@_SpecialKae;
0;0;Surprise: Apple Maps Is a Hit, Google Maps Loses Ground http:// realestatenewsnyc.com/?p=190388;;
0;1;Being both patriotic and domesticated and made a homemade apple pie #MyFriendsAreLucky;;#MyFriendsAreLucky
0;0;#UNN Apple puso a la venta el nuevo Ipad Mini Retina: Apple puso a la venta su nuevo iPad Mini con pantalla... http:// dlvr.it/4Jj56y;;#UNN
0;0;Parabéns mãe, parabéns Apple .;;
0;0;Got me a Big Mac, fries, 2 apple pies and some juice;;
0;0;Apple Lightning Digital AVアダプタ MD826ZM/A 5,143 円 【アップル(="url" href="ht】 http://www. amazon.co.jp/Apple-Lightnin g-Digital-AV%E3%82%A2%E3%83%80%E3%83%97%E3%82%BF-MD826ZM/dp/B009WQ9E8C/ref=pd_zg_rss_ts_e_3371411_3?ie=UTF8&tag=tac0506-22 … #NVU8x;;#NVU8x
0;1;Goddammit apple .;;
1;2;Apple II DOS source code now officially available: http:// j.mp/1aDnmNv;;
0;0;Apple is my nigga android is the side bitch trying come between us;;
0;0;@stallent I heard Apple shutdown Cards. :-/;@stallent;
0;0;@Det_Conan_Kudo @TiP_Cam They may have been present, but they weren't active. The Baseband Firmware can enable/lock the bands Apple allows.;@Det_Conan_Kudo @TiP_Cam;
0;0;@apple _pie7110 プリントとっといて！;@apple;
0;0;Hasta luego Apple http://www. anandtech.com/show/7507/amd- kaveri-apu-launch-details-desktop-january-14th …;;
0;0;Get better scores in #Hindi with jbvTeacher http:// goo.gl/Nlo021 for #mac #apple #education #backtoschool;;#Hindi #mac #apple #education #backtoschool
0;0;“ @vballproblems : is it really that hard to add this, Apple ? pic.twitter.com/qMZjjn8EwN ”;@vballproblems;
0;0;@dr_daniwigway @DrBink_Cleaves DayQuil, Benadryl, Claritin, Apple cider vinegar, liquid cold medicine, hot tea and lemon;@dr_daniwigway @DrBink_Cleaves;
0;0;صور جديدة ترينا حرم شركة Apple الجديد http:// dlvr.it/4Jj4y4;;
0;0;APPLE GO FUCK YOURSELF;;
0;0;Apple начнет продажи новых iPad Air и iPad mini в России с 15 ноября http:// dlvr.it/4Jj4vG;;
0;0;Apple Support Communities is where laymen play technical support by repeating prayers and superstitious rituals to other laymen.;;
0;0;Surprise: Apple Maps Is a Hit, Google Maps Loses Ground http:// ift.tt/HSD8hn;;
0;0;Nunca dejare la genialidad de #apple . Pero como importo mis contactos de icloud a un cel #android;;#apple #android
0;1;Spiced apple air freshener plugged in my room! Ahhhhh;;
0;0;Been craving Apple juice all day;;
0;0;queria um copo de big apple puro, tipo .. agora!;;
1;1;An apple a day will keep anyone away if thrown hard enough! #BecuzImAGrl;;#BecuzImAGrl
0;0;Public at last: Apple II DOS code that launched an empire http:// ift.tt/1anZ9ho;;
0;0;Photo: Apple Tart / Bakers Royale http:// tmblr.co/Zhp4Mu_EuKRS;;
0;8;Sweet tea and a piece of apple pie from bill millers sounds amazing;;
0;0;Photo: hausofdirectioners: on a scale from 1 to Samsung how much do you hate Apple ? http:// tmblr.co/Z-OXXy_EuKAe;;
0;0;@_rin_ apple セシル「おはようございます、ワタシもちゃんと目が覚めました。今日の朝ご飯はパンがいい」;@_rin_;
0;0;Perfectly balanced dinner: 1 shot of Whole5 antioxidant juice, 1 large piece vegan gluten free apple pie;;
0;0;Apple releases previously SECRET OPERATING SYSTEM SOURCE CODE: OK, fanbiois, start your assemblers The Computer History Museum has sc...;;
