retweets;favorites;text;mentions;hashtags
0;0;@aguscalvo2 you have to live in the us, have some apple device, and I'm only gifting people who don't have the money to buy it themselves;@aguscalvo2;
0;0;Apple hill http:// instagram.com/p/fbTrBKiaNr/;;
0;0;It's cocktail time! Apple cider bourbon martinis, y'all! http:// instagram.com/p/fbTzjet8dG/;;
0;0;5 X Ultra Clear Screen Protector Film for Apple iPad Mini 16GB 32GB 64GB --- $0.99 http:// bit.ly/1aCdVQ8 #blackberry #playbook;;#blackberry #playbook
0;0;Its 2013 and there's still no stripper emoji...wtf! And there's no emoji of TITS! Apple is fuckin up!!!;;
0;0;【デスクトップ】 #3: APPLE Mac mini/ 2.5GHz Dual Core i5 /4G/500G/USB3/Thunderbolt MD387J/A http:// amzn.to/1cZcQlE #デスクトップ #パソコン #amazon #アマゾン;;#3 # # #amazon #
0;0;Apple MacBook Pro 13.3" A1278 Intel Core 2 Duo 2.26GHZ 160GB 2GB RAM http:// ift.tt/1cLWZM6;;
1;2;Apple cider is so good.;;
0;0;7 Ways to Stop iOS 7 From Killing Your iPhone Battery http:// buff.ly/16E5rt7 via @mashable #Apple #iOS #iOS7 #Battery #iPhone #HowTo;@mashable;#Apple #iOS #iOS7 #Battery #iPhone #HowTo
1;1;Apple 、2014年半ばにより薄く、Retina搭載のMacBook Airを発表か http:// Jailbreakers.Info http:// dlvr.it/47WwBr;;
0;0;omg apps because APPle wow;;
1;0;#iphoneonly #apple #TagsForLikes #appleiphone #ios #iphone3g #iphone3gs #iphone4 #iphone5 #technology … http:// instagram.com/p/fbTy2mgIa1/;;#iphoneonly #apple #TagsForLikes #appleiphone #ios #iphone3g #iphone3gs #iphone4 #iphone5 #technology
0;0;Samsung Galaxy Note 3 vs Apple iPhone 5S Which Is Faster Better Benchmark AT&T #attmobilereview http:// thechrisvossshow.com/samsung-galaxy -note-3-vs-apple-iphone-5s-which-is-faster-better-benchmark-att/ … via @chrisvoss;@chrisvoss;#attmobilereview
0;0;Apple Macbook Air A1466 MD231LL/A 13.3" Ultrabook Computer / Mac OSX 10.7 http:// ift.tt/GYrDUp;;
0;1;We don't play Gamesss when it comes to Apple picking lol Plus we had more in our purses haha Nothing… http:// instagram.com/p/fbTqXqIfv-/;;
0;0;Coming from Apple in 2014: 12-inch Retina MacBook, sharper iPad, cheaper iMac? http:// flip.it/pHUDV;;
0;0;Sunday reads! Links to Jolie Gentil Cozy Mysteries. Fun & murder at the Jersey shore #itunes #ipad #ipod #mac #apple http:// itunes.apple.com/us/artist/elai ne-orr/id467570687?mt=11 …;;#itunes #ipad #ipod #mac #apple
0;0;Cinnamon apple tea + cinnamon apple oatmeal =;;
0;0;@HaleyMoreno002 I've only had apple and passion fruit. Apple tasted like shit;@HaleyMoreno002;
0;0;@kaitlynpalmer14 @TayCox13 @breeebakes APPLE GUICE;@kaitlynpalmer14 @TayCox13 @breeebakes;
0;0;I have completed the quest 'Chop down 2 Apple ...' in the #Android game The Tribez. http:// gigam.es/qtw_Tribez #androidgames , #gameinsight;;#Android #androidgames #gameinsight
0;0;Apple Pie to my faceeeeeee LMAO;;
1;1;A sweet apple on the GWG helps, too! MT @rhanes92 : Love Thanksgiving because it is a free license to eat as much as humanly possible.;@rhanes92;
0;0;I want some strawberry short cake ice cream and a apple pie;;
0;0;Yay for apple picking;;
0;0;Apple Pie And Ice Cream Blessed;;
0;0;Caramel Apple Marshmallow Pops http:// momsmadhouse.com/caramel-apple- marshmallow-pops … via @mommadhouse;@mommadhouse;
0;0;iOS 7.0.2 / 6.1.4 / 6.1.3 Unlock/Jailbreak iPhone 5S/5C/5/4S - Apple Jailbreak tool Completed Few Hours Ago - http:// living-outlet.de/ios-7-0-2-6-1- 4-6-1-3-unlockjailbreak-iphone-5s5c54s-apple-jailbreak-tool-completed-few-hours-ago/ …;;
16;0;นักวิเคราะห์บอก Apple จะหาผู้ใช้หน้าใหม่ซื้อ iPhone ยาก ... เพราะใครๆ ก็มีกันหมดแล้ว #ittwt - http:// pulse.me/s/s5isC;;#ittwt
0;0;@Sol_Smilez @HumbleTraveller it'll be a zap apple blossom since Granny Smith's should've been zap apple instead of a pie.;@Sol_Smilez @HumbleTraveller;
0;0;iOS 7.0.2 / 6.1.4 / 6.1.3 Unlock/Jailbreak iPhone 5S/5C/5/4S - Apple Jailbreak tool Completed Few Hours Ago - http:// living-outlet.de/ios-7-0-2-6-1- 4-6-1-3-unlockjailbreak-iphone-5s5c54s-apple-jailbreak-tool-completed-few-hours-ago/ …;;
0;2;Can't believe the amount of Apple picking pictures on Instagram.;;
1;1;Apple should really make better chargers TBH;;
0;0;@Haslinah_Ali APPLE ..! hahahahah;@Haslinah_Ali;
0;0;BRAND NEW UNLOCKED AT&T APPLE iPHONE 5C 16GB WHITE http:// bit.ly/19Ej5gf US $510.00 (90 Bids) End Date: #AT &amp;T #iPhone;;#AT #iPhone
0;1;@davidhoang I was expecting a picture of your cat on an Apple product.;@davidhoang;
0;0;@YitzKemp #Apple #innovation;@YitzKemp;#Apple #innovation
0;0;Why won't @samlaspada or @Yeooo_Key make me apple pie! Like I thought we were besties;@samlaspada @Yeooo_Key;
0;0;my apps are a piece of shit i had three Facebook messages and six Skype ones and didnt get a single damn alert fuck u apple;;
0;0;Five Ways Leaders Bridge the Generational Divide http:// bit.ly/15zUK9V #socialmedia #tech #apple;;#socialmedia #tech #apple
0;0;Wenn ich spinne und es 01:52 Uhr ist, sind Sie Apple -Stores.;;
1;0;I Really Love Apple Juice !;;
1;2;If you don't use Gain's Apple Mango Tango on your laundry, we can't be friends.;;
1;0;Caramel Apple Marshmallow Pops - Mom's Madhouse http:// pinterest.com/pin/7515388750 5368733/ …;;
0;1;Using Apple maps as a navigator is fun. We are driving to haunted fort night. pic.twitter.com/aYfuJvtNPm;;
0;0;Weekly Roundup: Apple iMac review, BlackBerry Z30 review, Samsung's Galaxy Round and more! #geek http:// engt.co/16GvRKw;;#geek
0;1;They thought the champagne was apple juice pic.twitter.com/zGHvHyD0bW;;
0;3;I got sunburnt while apple picking today like lol;;
0;0;APPLE ¿¿¡¡TAN DIFÍCIL ES CREAR UNA BATERÍA DE MÓVIL QUE DURE MÁS DE UN DÍA!!??;;
0;0;@ifostore Tx. What can the local community do to get an Apple store in Santa Cruz? #SantaCruzTechBeat;@ifostore;#SantaCruzTechBeat
0;0;I wish starbucks sold apple cider. I'm really craving some rn.;;
0;0;apple picking with my babe! @mattysmack16 pic.twitter.com/K87wWvXSZy;@mattysmack16;
0;0;Shit's about to get real. Like, " apple crisp" real. #Thanksgiving;;#Thanksgiving
0;0;I have a really big Adam's apple;;
0;0;She is the APPLE of our eye !!! http:// fb.me/2BhMlqvCI;;
0;0;I think if someone bought me some apple juice I would love them forever.;;
0;0;@cassie_ apple eh? Aku kirain kamu ngasih tau km yg pacarannya udah lama -_-;@cassie_;
0;0;La Turquie sera le treizième pays à accueillir un Apple Store http:// belgium-iphone.lesoir.be/2013/10/11/la- turquie-sera-le-treizieme-pays-a-accueillir-un-apple-store/ …;;
0;0;“ @___Chula : I'd drink apple cider everyday if I could .. ”;@___Chula;
0;0;#Spanish for beginners and advanced students. http:// goo.gl/fkT5tg Learn on your #Mac #apple #education #backtoschool;;#Spanish #Mac #apple #education #backtoschool
0;0;@_iSunWG @WGLimLittle_RP morrningggg mommy sun and apple lim-*;@_iSunWG @WGLimLittle_RP;
0;0;Thinking about how good that Redd's Apple Ale was earlier.;;
0;0;Who cares what happens at the Jersey shore? Jolie Gentil and friends. #ipad #ipod #apple #mac http:// itunes.apple.com/us/artist/elai ne-orr/id467570687?mt=11 …;;#ipad #ipod #apple #mac
0;0;I think @Ashley_Janaye03 @asshld get me a candy apple from WA. :);@Ashley_Janaye03 @asshld;
0;0;@Wickedboy_007 maybe but apple should. If I can restore all apps I should be able to do singles;@Wickedboy_007;
0;0;Is that what you call yours @lunaman22 ? Lol RT@RappingWeezy: Got an iPhone charger... Call it apple juice;@lunaman22 @RappingWeezy;
0;1;Nobody tells you how messy it is to eat an apple . Nobody prepares you for that.;;
0;0;Mais um filme. @Sala Apple TV Cid e Thiela http:// instagram.com/p/fbTsF_wYhB/;@Sala;
1;0;В Apple развернули кампанию по найму новых сотрудников из числа работников канадского производителя BlackBerry…;;
0;0;Apple picking with Tyler. #nephew #lovehim http:// instagram.com/p/fbTsZbEjFS/;;#nephew #lovehim
0;0;Whisky big apple red bull é absolut <3;;
0;1;Steal an IPhone in the Hood call it Apple Jack -_- Why though;;
0;0;Check out my Scratch and Save deal at #Zookt : Apple iPhone 5S 16Gb Space Gray Fa.... Come check out your & Save. http://www. zookt.com/site/share?sha re_id=36&type=index&user_id=5843&time=1381708330 …;;#Zookt
1;0;“@BloombergNews: Apple to debut new iPads at Oct. 22 event amid growing competition | http:// bloom.bg/1bWTP4Y ” that was slower than Reuters.;@BloombergNews;
0;0;My mom is doing 110 right now yet yells at me when I break 50 in the car with her. The apple didn't fall far.;;
0;0;Apple iPhones vs Samsung Galaxys Geekbench Benchmarks #attmobilereview http:// thechrisvossshow.com/apple-iphones- vs-samsung-galaxys-geekbench-benchmarks/ … via @chrisvoss;@chrisvoss;#attmobilereview
0;0;@Sol_Smilez @HumbleTraveller think about it. How is it the apple family has their names that turns cuties? It'll be a blossom but I think...;@Sol_Smilez @HumbleTraveller;
0;3;New Red Wings Gear, Bob Evans, and Apple Orchard with my main squeeze @ErricGarner and popcorn picking with the 'rents #sundayfunday;@ErricGarner;#sundayfunday
0;0;This Apple Bee's & Star Bucks finna give me life!!!;;
0;0;Just apple pickin' @Gibbsville Orchard http:// instagram.com/p/fbTs6lAG1v/;@Gibbsville;
0;0;tao trying to fix kris’ apple hair and checking to see if it looks okay http:// 31.media.tumblr.com/8d05bbb39063ba e95672d6492e31de94/tumblr_mum8mdLcM01qzh5sno1_250.gif …;;
0;0;@fahda_ apple دى شبكة دعارة;@fahda_;
0;0;A Look at the Features on the Apple iPhone 5s - Motley Fool http:// dlvr.it/47WvpD #gadgetifo;;#gadgetifo
0;0;Weekly Roundup: Apple iMac review, BlackBerry Z30 review, Samsung's Galaxy Round and more! http:// engt.co/1aCdOEk;;
0;3;apple crisp is http:// thebomb.com pic.twitter.com/sQxBa8RtXN;;
0;0;I would love to take my pickle man apple picking one year.;;
0;0;#google Telephone Repair Handbook - WebEarth Book :) http:// dlvr.it/47Wvls #apple;;#google #apple
0;0;#google EXXON COMMUNITY SUMMER JOBS PROGRAM (CSJP) Book :) http:// dlvr.it/47Wvkw #apple;;#google #apple
0;0;This tamarindo apple w/ chile pic.twitter.com/6kxOMk7XBb;;
0;0;#google Xerox 6204 Wide Format Solution - Surveyors Exchange Company Book :) http:// dlvr.it/47Wvjq #apple;;#google #apple
0;0;Now I'm ready to eat that candy apple wen i get home;;
0;0;#google Computershare Trust Company, N.A. Traditional and Roth IRA for the Book :) http:// dlvr.it/47Wvhp #apple;;#google #apple
0;0;#google ONLINE COURSE REGISTRATION USER MANUAL 1. LOGIN INTERFACE Book :) http:// dlvr.it/47Wvgd #apple;;#google #apple
0;0;"I don't know how to eat an apple " @jupeller everyone;@jupeller;
0;0;apple trash recovery http:// dlvr.it/47Wvdq;;
0;0;Last picture from dis iphone4 #upgraded #treatyoself #swag #apple #selfbdaygift http:// instagram.com/p/fbTgSACoTr/;;#upgraded #treatyoself #swag #apple #selfbdaygift
0;1;I want apple pie and ice cream.;;
0;0;Crisp of the apple;;
0;0;We drove an hour & 1/2 to go Apple -Picking we could've just went to the store, But sometimes its about the experience thank you @MrsMelanin;@MrsMelanin;
0;0;嘘ばっかり、ヨドバシに聞いたけどそんな製品扱ってないって言ってるけど。いつ、どこの店で見た？と言われたぞ。RT @gen_get_bear : そういえば、ヨドバシカメラで「iPad2012」なる物が売っていた。 Apple からはそんな製品は発売されていないから、何処まで偽物を売れば;@gen_get_bear;
0;0;Made #vegan #apple #oat #tartlettes with standingontopoftheworld yesterday with our freshly picked… http:// instagram.com/p/fbTsViviHt/;;#vegan #apple #oat #tartlettes
0;0;Apple pie a la modé;;
0;1;@itsmaryg6 @AlondraMahone lmfao! Hmm I think Apple pretty sick af but my final word is ANDROID;@itsmaryg6 @AlondraMahone;
0;0;Not sure who's at fault. Apple or free wifi at #yvr impossible to sign on.;;#yvr
0;1;I love apple -based desserts and pastries;;
0;0;Apple are taking the piss aren't they? pic.twitter.com/l5ywX6QBvy;;
0;0;Apple Cider with a twist;;
0;0;Central park apple store Tommy hilfiger Subways Manhatan Nike McDonalds;;
0;0;#MentionPerfection Apple Juice!!!!;;#MentionPerfection
0;0;@ModelMilkBistro what's on the Sunday Supper menu? Is your apple pie there? Because that's all I want.;@ModelMilkBistro;
1;1;@sudds_5 unfortunately I've had to watch that play too many times today. I blame it on the bad apple I ate before the game #neveragain;@sudds_5;#neveragain
1;0;drake the type of nigga to pick up a bruised apple and ask who did this to you;;
0;0;新着記事: 2014年モデルiMacは、廉価モデルも登場か？ http:// wp.me/p2GURL-1IZ #apple;;#apple
0;0;@Apple _elsword ・・・・・ん、すまない。　何か言ったか？;@Apple;
0;0;Apple pie fries with vanilla frozen yogurt. Noms. http:// instagram.com/p/fbTnP1RyiH/;;
0;0;Apple iPhone 6 specs release date and more http:// shar.es/EhRNu via @TheNewsTribe;@TheNewsTribe;
0;0;I really want a candy apple;;
0;0;by @sugarfootgrits: @hellaveganeats in #dolorespark yay! #vegan #chilaquiles , apple #frenchtoast , and lusty lovers tacos… ... #veggiebuzz;@sugarfootgrits @hellaveganeats;#dolorespark #vegan #chilaquiles #frenchtoast #veggiebuzz
0;0;One bad apple can ruin it for everybody .;;
0;0;I checked in at Apple Store on #Yelp http://www. yelp.com/biz/apple-stor e-santa-monica?pt=check_in&ref=twitter&v=4b …;;#Yelp
1;2;Anyone wanna bring me to an apple orchard?;;
0;0;@LAD_4_Life ok! Was stuck here at the Apple store! Mac n Cheese for all!;@LAD_4_Life;
0;0;@kenia_111 Asi son. Hubieras llevado tu iPhone a una tienda de Apple y te dan uno nuevo.;@kenia_111;
0;0;Why Apple Will Enter the Home Automation Market http:// flip.it/DSB6o;;
0;0;Apple iOS 7 ile birlikte gelen kilit ekranının geçilmesini kapsayan güvenlik açığını son yayınladığı güncelleme... http:// fb.me/LbFnTnur;;
1;0;Apple iPhone 6 specs release date and more http:// shar.es/EhBHY via @TheNewsTribe;@TheNewsTribe;
0;0;Coming from Apple in 2014: 12-inch Retina MacBook, sharper iPad, cheaper iMac? http:// flip.it/TfG2y;;
0;0;@jennifer000001 yea some apple juice that will have you on ya ass;@jennifer000001;
0;0;Apple Quinoa Cake http:// pinterest.com/pin/1108308408 03382716/ …;;
0;0;@jennicajordan9 @koletteamber @16jvjordan @fredjordan70 pumpkin carving party, complete with apple cider and pizza!;@jennicajordan9 @koletteamber @16jvjordan @fredjordan70;
0;0;Mmmmmm apple pies;;
0;0;Hey! You should check out this Apple iPad Mini 16GB giveaway by @TeknoGadyet .. What are you waiting for? JOIN NOW!!! http://www. teknogadyet.com/2013/10/teknog adyet-christmas-giveaway-apple-ipad-mini-16gb-wifi.html?showComment=1381420675094#c2532307500768145214 …;@TeknoGadyet;#c2532307500768145214
0;1;Between the smell of apple pie baking and the patriots pulling off a win, this is a perfect Sunday;;
0;0;This is the beautiful Leica camera designed in part by Apple 's Jony Ive http:// weeder.org/rLHWsP5 #photography #tech;;#photography #tech
42;3;#好きな曲あったらRT Bad apple !! Bad apple !! Bad apple !! Bad apple !! Bad apple !! Bad apple !! #RTした人全員フォローする #相互希望;;# #RT #
0;0;Lay off a little on the apple spice febreeze my nose is on fire;;
0;0;I like cold apple pie;;
0;0;Apple Harvest Candle http:// ow.ly/pMkNd #Home #Garden #Jar #Candle #Jewelry Inside #Apple #Harvest;;#Home #Garden #Jar #Candle #Jewelry #Apple #Harvest
0;0;Apple Crisp tho>>>;;
0;0;"@levvis_: to the people who constantly slate apple ; don’t have an iphone/ipod haha, turkeys x" there's a reason they don't own an Apple ....;@levvis_;
0;1;#retweet Learn #Russian on your #macbook . With more than 4000 words http:// goo.gl/htU6cS #apple #education #learning #osx #edtech;;#retweet #Russian #macbook #apple #education #learning #osx #edtech
0;0;Drinking a Redd's Apple Ale by Redd's Brewing Company — http:// untp.it/163eVzC;;
0;2;hoes on my dick cause my rims cut their apple sauce;;
0;0;#رتويت Weekly Roundup: Apple iMac review, BlackBerry Z30 review, Samsung's Galaxy Round and more!: You might say the w... #ريتويت;;# #
0;0;Weekly Roundup: Apple iMac review, BlackBerry Z30 review, Samsung's Galaxy Round and more!: You might say the week is never really d...;;
0;0;Does beer mix well with apple pie? I'm about to find out.;;
0;0;Weekly Roundup: Apple iMac review, BlackBerry Z30 review, Samsung's Galaxy Round and more! http:// engt.co/18c2KiA;;
1;0;Que nochesita con las pibas eh #Apple #Fisuras #Escrachos pic.twitter.com/gDXqnEZSYQ;;#Apple #Fisuras #Escrachos
0;1;Got home and my dad had fried chicken and apple pie made.. man I have a good dad;;
0;0;the apple i put in the fridge like a week ago is still in there om g;;
0;0;Boutta Go Get A Apple;;
0;0;iPhoneのバッテリー残量すでに34%何だが Apple はふざけてるんですか？;;
0;0;Dell Optiplex 755 (160 GB, Intel Pentium, 1.8 GHz, 2 GB) Desktop $80.00 http:// bit.ly/15zXcNG #printer #apple;;#printer #apple
0;0;Perfect fall day to make fresh apple cider. #favortieseason http:// instagram.com/p/fbTF9WIF3C/;;#favortieseason
0;0;I could drink sprite and apple juice all day haha @Sprite @Motts I need to be sponsored by them;@Sprite @Motts;
0;0;I ate a carmel apple for the first time today .;;
0;0;Apple juice swag!!! http:// instagram.com/p/fbTl-vLu-M/;;
0;0;Boobs case for Apple iPhone 4 - make your device even sexier http:// bit.ly/14ABW5v;;
0;0;ドコモiPhone5sはやはり人気！ Apple 噂まとめ（10/6〜10/12）｜Mac http:// smar.ws/Vfm7e #SmartNews;;#SmartNews
0;0;@apple _teako おはよう、信(アポ)＠悠雅は８連休♡。寝癖ひでぇことになってんぞ。･･･直してやるからこっちこい。;@apple;
0;0;@joeharris Gotta go big in the Big Apple !;@joeharris;
0;0;I'm still sad about my apple juice I wanted that is bad I only drunk a little out of it;;
0;0;“@Sawdeeze_nuts: What I do know is, I want an apple pie mcflurry!” --- that still sounds so odd;@Sawdeeze_nuts;
0;1;I love Apple products.;;
0;4;Whoever drank my apple juice can go to hell.;;
0;0;Sorry apple , might be going to the competitors.;;
0;0;My momma homemade apple pie>;;
50;133;#DateIdea - apple orchard walk -wagon hayride -pick & carve pumpkins -watch sunset -dinner -haunted house -bonfire Anyone?;;#DateIdea
1;1;I just wanna go to a couple haunted houses then come home and watch Halloween movies with popcorn, apple cider, and a caramel apple;;
0;0;Dinner was lovely now to end it i got my warm apple pie and vanilla ice cream;;
0;3;BLT's for supper and moms making apple crisp;;
0;0;@stephjou94 true life my soulmate works at the apple store;@stephjou94;
0;0;@aaronnak Tough to be apple right now. Any message that deflects lack of originality in favor of focus on customer might be a good thing.;@aaronnak;
0;0;Google play e apple store, favor criar um app onde eu possa descobrir as redes sociais e o número daql pessoa bonita que eu vi na praia hj;;
0;0;Well Done Apple . Way to screw up my mood in a Monday.;;
0;0;@labsontheloose @cagans76 @CamTheBoston @AbbyDawgBlog @Cyan1137 @Cocopuppy @tiggywinkle21 Apple 's a well known farter!;@labsontheloose @cagans76 @CamTheBoston @AbbyDawgBlog @Cyan1137 @Cocopuppy @tiggywinkle21;
0;1;Like, anyone want to go to the apple orchard;;
1;0;@Fraaanchuuu apple fanboy;@Fraaanchuuu;
0;2;hot apple cider from dunkin's >>;;
0;0;Like The Evolution Of Apple 's iPod And iPhone, Nest Is Building One Product At A Time http:// flip.it/0wL7D;;
0;0;Do I dare updating my phone to iOS7?? #ios #apple #dare #um #iOS7 #FirstWorldProblems;;#ios #apple #dare #um #iOS7 #FirstWorldProblems
0;0;IOS 7.0.2 super fun! i love apple application. it deals have me.;;
0;0;@apple _teako 信(アポ)＠悠雅は８連休♡ちんおはようー 俺さあ、今日はまいう棒工場に招待される夢見たんだー;@apple;
0;2;Caesar Salad. Butternut squash soup. Lasagna with garlic bread. Apple pie. Great friends. Pats win. #perfectsunday pic.twitter.com/F85wv5Bo5n;;#perfectsunday
0;0;NIGGA AT APPLE STORE SAID I HAD TOO MANY PICTURES AND THATS WHY MY IPOD WONT BACKUP ANYMORE;;
1;1;“ @maryparkerj : Im going to drink now bye” drink what some apple juice freshie ?;@maryparkerj;
0;0;Someone bring me a bagel + apple cider and I'll love you forever #fox218 #promise;;#fox218 #promise
1;1;Flavours of Fall at @PlaygroundDTSA . Apple , burnt miso, cider sorbet, walnut streusel. pic.twitter.com/jui6v9O7L9;@PlaygroundDTSA;
1;0;“ @bobby_b_Nardy : Na dey braggin on 5-1, ya lost ya lost, u ate dat apple sauce”;@bobby_b_Nardy;
0;0;Note to self: Model life after @Joe_Nye Any apple pie recipe ideas?;@Joe_Nye;
0;0;I'm a little yellow apple tree. #lexi #cutiepie #thecutestofallcutiepies @in an apple orchard of course http:// instagram.com/p/fbTMKWhYUD/;@in;#lexi #cutiepie #thecutestofallcutiepies
0;0;I have an apple pie do u think I want to hang out with you??? THINK ABOUT IT;;
1;1;Apple News: The iPad 5 might surely come out with the brand new Touch ID (Fingerprint Scanner) and all the same iPhone 5S colors.;;
0;0;“ @adreanaspohn : Apple cider slushies. ”;@adreanaspohn;
0;0;I'm too lazy to activate my credit card & buy my iPhone from the apple store.. Maybe tomorrow;;
0;0;i dont know what happened to my iphone music but i am not happy #iphone #apple #fixthis;;#iphone #apple #fixthis
1;2;@hellaveganeats in #dolorespark yay! #vegan #chilaquiles , apple #frenchtoast , and lusty lovers tacos… http:// instagram.com/p/fbS87SQNMM/;@hellaveganeats;#dolorespark #vegan #chilaquiles #frenchtoast
0;0;PERO BLDA, LA FOTO EN EL CARTEL DE APPLE , LA CAGO!;;
0;0;apple pie mmmm;;
0;0;@apple _teako お、おう！起きたか！あー・・・悪い、おかず焦がしちまった・・・;@apple;
0;0;Hope everyone had a great weekend. We had gorgeous weather in the big apple . #whpsignsoftheseason … http:// instagram.com/p/fbTSV8gjHK/;;#whpsignsoftheseason
0;0;What a lovely day for apple -picking on Île d'Orléans. Easy to feel thankful... pic.twitter.com/T46ISQa4W8;;
0;1;@bethanygraceee hot apple cider!;@bethanygraceee;
0;0;Found spiced apple cider tea in our house and it reminds me of country maid. #nostalgia;;#nostalgia
2;0;Check it out! One of our members - Hannah Leshaw, Filmmaker has a film at the Big Apple Film Festival. Link to... http:// fb.me/30zQry2mq;;
0;0;Are you going to see Fiona Apple at the Bank of America Theater on Tuesday?;;
0;0;My room smells like a rotting apple ... So weird. And kind of gross. I don't have apple anything up here;;
0;0;¡Disfruta en Sushi Itto con #TOMARI ! Para hoy, ¿qué tal un Apple Saketini? http:// ow.ly/i/3p4M7;;#TOMARI
4;1;Nos volvemos niños berrinchudos si la última presentación de Apple no nos sorprende. Queremos más, más http:// ht.ly/pLR2M @elbaxter;@elbaxter;
0;0;IPhone 4s Apple Por Apenas R$ 899,90 Em Até 12x Sem Juros!: http://www. clubedoclique.com.br/redirect.php?i d=12613&banner=282&token=9cfeea1412e6977cbab3ce6d8fc9ed02 …;;
0;0;Lucky Charleston brides shopping in the Big Apple , stop in at BHLDN's pop-up October 14th-20th.... http:// fb.me/2FD6mWArN;;
0;0;Not apple or samsumg but LG;;
0;3;First hat of the season Pumpkin and apple picking pic.twitter.com/dK4gJcWYpL;;
0;5;carmel apple suckers are the key to my heart #delicious;;#delicious
0;0;Apple picking with my babe :) @andrewstemps http:// instagram.com/p/fbTghgMctA/;@andrewstemps;
0;1;@Lavonjwilliams come over we can watch movies <3 ill make you apple pie;@Lavonjwilliams;
0;0;The Apple iPhone 5s leather case is a dirt magnet, tell us how you ... http:// dlvr.it/47Wv7X;;
0;0;@apple _teako おはようー;@apple;
0;0;Apple from out east #applepie #apple #fall #li http:// instagram.com/p/fbTa7-mytq/;;#applepie #apple #fall #li
0;1;apple cider #bestpartoffall;;#bestpartoffall
0;0;The pies are done baking. Blueberry on left and apple on right. My 1st blueberry pie. My 9 yo did most the work for the apple .;;
0;0;#اضافات_بلاك_بيري #البلاكبيري 759472BA #BBM #ADDME #ADDMEBBM #BBM4ALL #apple #iPhone;;# # #BBM #ADDME #ADDMEBBM #BBM4ALL #apple #iPhone
0;0;Photo: anotherdimension: This is why I love Apple lmao Page 46 of the terms & conditions of the Apple iOS 7... http:// tmblr.co/ZhaZYrxawqzi;;
0;0;Why Apple Will Enter the Home Automation Market — http://www. cultofmac.com — Readability http:// bit.ly/1bQjVKC;;
0;0;MASAKI YODA -FAKER- on #iTunes (UK) https:// itunes.apple.com/uk/album/faker /id448860727?i=448860742 … #apple;;#iTunes #apple
1;0;eating an apple;;
0;0;@LilTunechi lil wayne looks like a crab apple;@LilTunechi;
0;0;Man all the Nigga's wanna use my charger in this house, Am the only one that knows where the apple store is ??;;
0;0;Secretary of State Kerry positive about nuclear talks with #Iran . Story on The News In Two app. Free N2 #Apple link http:// tinyurl.com/aoevffx;;#Iran #Apple
0;0;Hombre demanda a Apple por haberse hecho adicto a la pornografía http:// goo.gl/Xx3o6;;
0;1;I liked a @YouTube video http:// youtu.be/4r94qlP1cQA?a Apple iPhone 5s Review;@YouTube;
0;0;@Apple _JLouie not sure will find out once i get it out of the cooler.;@Apple;
0;0;#French for beginners and advanced students. http:// goo.gl/77aKVz Learn on your #Mac #apple #education #backtoschool;;#French #Mac #apple #education #backtoschool
0;0;@SenTedCruz So, you're promoting Koch Brothers buying Apple iPhone supplier while joking about #ACA & health care?;@SenTedCruz;#ACA
0;0;@apple _teako おはよ♡;@apple;
0;0;@Marp2057 Apple .;@Marp2057;
2;0;New model of Apple ’s proposed spaceship campus reveals new details about the building http:// flip.it/C4Tb9;;
0;0;@apple _teako おはようございます、信(アポ)＠悠雅は８連休♡さん;@apple;
0;0;in other news this apple fucking sucks;;
0;0;¡Holaaaa! ¿Alguien se acuerda de mi? u.u Si esta publicación llega a +20 MG jugamos algo :) • Apple Cinnamon;;
0;1;My momma baked me an apple pie to welcome me home. What a babe;;
