retweets;favorites;text;mentions;hashtags
0;0;Google announces 'We come in peace' - Times Online: The HinduGoogle announces 'We come in peace'Times O.. http://tinyurl.com/yzxaxua;;
0;0;Google Buzz Isn't Exactly Humming Along - All Things Digital (blog) http://ff.im/-g3ndR;;
0;0;@GUIOOS haha ps mis apuntes hoy serán google y wikipedia ;) hahaha. Sólo será está vez;@GUIOOS;
0;0;Google recent updates are not up to the expectations http://rep.ly/1M9pa;;
0;0;We just updated our site http://infosnipper.com with Privacy Group Pings FTC About Google Buzz at http://tinyurl.com/y9sgsg3;;
0;0;Technology Blog Privacy group files FTC compaint about Google Buzz: (AP) -- A privacy watchdog group is complainin... http://bit.ly/b7inc3;;
0;0;Watch Live Football In Google Chrome – 1645th Edition: In time for the beginning of this year’s Champions League a... http://bit.ly/diMysV;;
0;0;Google Real-Time Search Results Now Include MySpace http://short.to/17hhm;;
0;0;Good News for Bing: Google Includes MySpace Updates in Real-Time Results http://shar.es/m1AYq;;
0;0;@illmami : Two words: Google Chrome. I made the switch. It's worth it.;@illmami;
0;0;no puedo entara mi google Buzz.. ahora me conunicare desde aqui...;;
0;0;http://tinyurl.com/yf6faz4 Inside Google 's Hot Topics, a real-time heat map of news and chatter - Los Angeles Times (blog);;
0;0;More Buzz on the Google Buzz... RT @mashable Google Buzz Prompts Privacy Investigation in Canada - http://bit.ly/beYf65;@mashable;
0;0;Google Code の更新が Google Group に配信されるようにしてみました。これで Issues の登録も見落とすことなくなるかな？;;
0;0;Google Raises the Bar http://ow.ly/183sA;;
0;0;Just got my email from Google and my dock will be here tomorrow. Yeaaaaaaa.;;
0;0;@aarond22 FB doesn't, but Google does ... muwhahaha;@aarond22;
0;0;@deflima Você pode usar o Google insights!;@deflima;
0;0;interesting - google buzz doesn't link to articles from blog's rss feed, but the buzz emails do;;
0;0;Privacy Group Pings FTC About Google Buzz: The Electronic Privacy Information Center lodged a complaint with the F... http://bit.ly/9LFYQT;;
0;0;@rocx1958 Google Buzz ... google it :-);@rocx1958;
0;0;Google Buzz: Already Better than Wave. Not exactly a high bar to start with http://bit.ly/9RKBcW;;
0;0;600 shops, Music, News, Weather, Online TV, Face book, Twitter, You tube, Google Search engine Toolbar. Download FREE! http://bit.ly/9LLWws;;
0;0;@videos4bb cheaper for them, not me, seeing I use google voice for everything calls from UK are only .02/min.;@videos4bb;
0;0;シャレていていいかも知れない QT @lifehackerjapan : 【最新記事】 Google マップ封筒をカンタンに作れるテンプレート「MapEnvelope」 http://bit.ly/9tkM9Z #lh_jp;@lifehackerjapan;#lh_jp
0;0;@ShauntesaJaQuia shii idk... google it lol;@ShauntesaJaQuia;
0;0;IT News: HTC Desire คู่เหมือน Nexus One ของ Google แต่น่าใช้กว่า เพราะอะไร คลิกไปดูเลย http://www.arip.co.th/news.php?id=410900;;
0;0;@anoop_sahgal using Google Voice on the Droid w verizon;@anoop_sahgal;
0;0;So, invite some friends, have them invite friends too, now u have lots! RT @detrick : @kishau im on google wave and got like 1 contact also!!;@detrick @kishau;
0;0;@joamot30 Sim... 30% direta 70% google ... não tenho enviado muito os links para agregadores!;@joamot30;
0;0;Add Google Buzz Share Button in Blogger Blog Posts http://su.pr/1uzJuB;;
0;0;[ニュース] google news 政治! 消費税：閣内に温度差 「景気が後退」「必要なら」 - 毎日新聞 http://bit.ly/99AyEH;;
0;0;RT @mashable : Google Buzz Prompts Privacy Investigation in Canada - http://bit.ly/beYf65;@mashable;
0;0;HoudahGeo 2.4.2 - Geocoder pins photos in Google Earth to where they were taken. - http://j.mp/buFXd0;;
0;0;RT @mashable Google Buzz Prompts Privacy Investigation in Canada - http://bit.ly/beYf65;@mashable;
0;0;iSuppli: Google will transform telcos from calling plans to mobile advertising - VentureBeat - http://redir.is/lLu #OpenSource;;#OpenSource
0;0;LET'S GET 1GB FIBER TO OUR DOORS #inBend ! Everyone sign Google Fiber for Communities http://ow.ly/15YgW &plzRT!;;#inBend
0;0;Privacy issues, spams dampen Google Buzz's social debut: Privacy concerns are making the world’s most-visited webs... http://bit.ly/d0YJ4H;;
0;0;Don't Count Out Facebook as a Competitor to Google http://bit.ly/9pDsTk;;
0;0;Let’s Try to Find All 200 Parameters in Google Algorithm | Search Engine Journal http://ff.im/-g3n49;;
0;0;Is Google Making Us Stupid? http://ow.ly/15Yg4;;
0;0;Spammers already targeting Google Buzz: Websense said its security analysts found that spa.. http://bit.ly/bWn46n http://ping.fm/yNtYL;;
0;0;Google Focuses on "Mobile First," Upcoming Applications at Mobile World Congress - PC Magazine (blog) http://tinyurl.com/yzj323n;;
0;0;STILL working my way thru Valentines-related feeds in my Google reader. Ugh.;;
0;0;Google -Blogs: D/B Recommended: 2 Years Madame Claude Event in Berlin / 27.02.10 | - http://tinyurl.com/yeoljac;;
2;1;Google and friends selling 60000 Android phones a day - San Francisco Chronicle (blog) http://goo.gl/fb/40lt;;
0;0;: “link Tips to Increase your Google Ranking” http://feed-xmlrss.com/%e2%80%9clink-tips-to-increase-your-google-ranking%e2%80%9d.html;;
0;0;Damn, I missed pancake day. It's all @google 's fault for not putting it on my calendar with the other special days.;@google;
0;0;Google Checkout gets a New Boss http://tinyurl.com/ygh8vry;;
0;0;Maybe this is why Google is in permanent beta. RT @KFinnegan : Google admits that Buzz testing was "insufficient" - http://bit.ly/bHyQeX;@KFinnegan;
0;0;RT @PrivacyToday : Google changes Buzz privacy settings - again. From CNET: http://ow.ly/180rS #privacy;@PrivacyToday;#privacy
0;0;"Why do you want to work here?" http://bit.ly/5kqLuy #jobseekers #jobangels #jobtips #jobinterview Google Buzz #jobs;;#jobseekers #jobangels #jobtips #jobinterview #jobs
0;0;All Things Digital Google Looks Forward to FTC "Feedback" on Buzz [Digital Daily]: While well-intentioned, Google ’... http://bit.ly/a4UHmR;;
0;0;AllThingsDigital: Google Looks Forward to FTC "Feedback" on Buzz [Digital Daily] http://bit.ly/a4UHmR;;
1;0;Facebook Now Drives More Traffic to Key Sites Than Google http://shar.es/m1ACf;;
0;0;: How to Use Google Documents : Tips for Using Google Documents http://bit.ly/a2aDXc;;
0;0;Google street view car... http://twitpic.com/13nzj4;;
0;0;HOW TO: Integrate Google Buzz Into Your WordPress Blog http://bit.ly/cUqqjU;;
0;0;HOW TO: Integrate Google Buzz Into Your WordPress Blog http://bit.ly/cUqqjU;;
0;0;noffa, o google ta tão, tão, tão... *-*;;
0;0;Google Buzz Prompts Privacy Investigation in Canada http://bit.ly/c4MdiZ;;
0;0;Google Looks Forward to FTC "Feedback" on Buzz [Digital Daily]: While well-intentioned, Google ’s “sorry, we didn’t... http://bit.ly/d5Q80o;;
0;0;just verified my name on my Google Profile. No one's gonna be me now! Muahaha?;;
0;0;You can install the Google Marketplace on Archos 5 Internet Tablet with the latest firmware: http://archosfans.com/201… http://disq.us/c4a4w;;
0;0;Google Buzz: Next Stop, Morningside Crescent! http://bit.ly/d5z1na;;
1;0;Privacy Group Pings FTC About Google Buzz: The Electronic Privacy Information Center lodged a complaint with the F... http://bit.ly/cHzEdC;;
0;0;EPIC has filed a complaint with the Federal Trade Commission, urging the FTC to open an investigation into Google ... http://bit.ly/9AEABk;;
4;0;Google Buzz Prompts Privacy Investigation in Canada - http://bit.ly/beYf65;;
0;0;Now i wish i didn't search blue waffle in google :(;;
0;0;"Abbiamo rilevato un'attività sospetta nel tuo account Google . Crea una nuova password per continuare a utilizzare il tuo account.";;
0;0;@TweetsCuriosos Que diizer que não era eu no Google Earth ?;@TweetsCuriosos;
0;0;AND I had to enter my password three times to log into G apps for GS. At least I'm confident it was all bona fide. But sort it out google !;;
0;0;oh god! This person in my class just used the search function in the browser with bing to find google ...I think my brain just exploded;;
1;0;RT @CBCNews : Privacy commissioner probing Google Buzz http://bit.ly/9tmoD3;@CBCNews;
0;0;Google Buzz Isn't Exactly Humming Along - All Things Digital (blog) http://bit.ly/b1sEqj;;
0;0;Google Buzz Prompts Privacy Investigation in Canada http://ff.im/-g3mZV;;
0;0;iSuppli: Google will transform telcos from calling plans to mobile advertising - http://tinyurl.com/yzd8m43;;
0;0;@GameMakerBlog wasnt talkin bout gmb but yes i can on the other computer that i am hardly ever alowed on. i was talkin bout google docs;@GameMakerBlog;
0;0;Google Buzz Prompts Privacy Investigation in Canada http://ff.im/-g3mZg;;
0;0;Privacy group files FTC complaint on Google Buzz: Privacy group files FTC complaint on Google … http://goo.gl/fb/0hJW;;
0;0;Don’t Count Out Facebook as a Competitor to Google http://bit.ly/bfSM2I;;
0;0;@jujubeetleb Google apps has made a wedding doc for your future big day ;) http://www.thefrisky.com/post/246-google-goes-bridal/;@jujubeetleb;
0;0;Killer Google AdWords Guide for Affiliates http://bit.ly/9dBMbJ;;
0;0;Google Buzz Prompts Privacy Investigation in Canada http://ff.im/-g3mYe;;
0;0;@MrsMBarrett showoff! I see someone jumped on google lol;@MrsMBarrett;
0;0;RT @nprnews : Privacy Group Pings FTC About Google Buzz http://su.pr/2RDRuX - WHOAH! Never saw that coming... ;);@nprnews;
0;0;" Google will also provide an easier way to totally disable #Buzz for those Gmail users who seek to do so" How kind of them!;;#Buzz
0;0;Googleismo: De fato o google cresceu e com o tempo e conseguiu juntar diversos devotos. Há quem duvide que o googl... http://bit.ly/9n3HU2;;
0;0;http://bit.ly/bRoR4X 1 Sneaky Article Marketing Trick to Get You on the First Page of Google : ... http://bit.ly/cJVV22 http://bit.ly/9vM01O;;
0;0;1 Sneaky Article Marketing Trick to Get You on the First Page of Google : We look at them with envy, those damn sne... http://bit.ly/bw4r06;;
0;0;Gabriella Davi-Khorasanee Can someone tell me why I need to use Google Buzz please? http://ff.im/-g3mWS;;
0;0;Google Buzz Prompts Privacy Investigation in Canada http://ff.im/-g3mWM;;
0;0;#Google Buzz Prompts #Privacy Investigation in #Canada http://goo.gl/fb/oMOR #Mashable #googlebuzz #epic;;#Google #Privacy #Canada #Mashable #googlebuzz #epic
0;0;1 Sneaky Article Marketing Trick to Get You on the First Page of Google : We look at them with envy, those damn sne... http://bit.ly/d5htiB;;
1;0;Privacy Group Files FTC Compaint About Google Buzz. Details here: http://bit.ly/c1Hd2Z;;
0;0;#Google Buzz Prompts #Privacy Investigation in #Canada http://goo.gl/fb/sNHV Mashable.com #googlebuzz #epic;;#Google #Privacy #Canada #googlebuzz #epic
0;0;@Ulrichfr mais pourquoi diable google ne fournit pas gratuitement les mises a jour, c'est dingue cette histoire, avantage apple!;@Ulrichfr;
0;0;Google Buzz Prompts Privacy Investigation in Canada http://goo.gl/fb/gUdQ;;
0;0;gadgets for good: Google buzz and Twitter not a threat to Facebook ... http://cli.gs/JzjZZ;;
0;0;http://bit.ly/dnJWUN How to Tighten Your Google Buzz Privacy Settings;;
0;0;iSuppli: Google will transform telcos from calling plans to mobile advertising http://goo.gl/fb/3Ah2;;
0;0;Google Starts Serving up MySpace Status Updates -... http://ff.im/-g3mU0;;
0;0;@Ben_Picard es ce que Google maps navigation marche au Canada?;@Ben_Picard;
0;0;Google Wants to Index Your DNA, Too http://209.239.112.133/2010/02/ google -wants-to-index-your-dna-too/ http://bit.ly/b680M4;;
0;0;http://j.mp/drbzDM #google ist erfolgreich aber es gibt auch abers!;;#google
0;0;60,000 Android Phones Shipping Daily: Schmidt: Google CEO Eric Schmidt, speaking at the Mobile World Congress in B... http://bit.ly/dgM3Ta;;
0;0;1,500 attendees watch Avinash Kaushik, Google Analytics Evangelist, kick off SES London 2010: Search Engine Strate... http://bit.ly/bPGG7L;;
2;0;¿Estan ready para tiendas Google ? Lo leíste aquí primero. | Are you ready for Google stores? You heard it here first. #Google;;#Google
0;0;RT @tomkrcha : Google : Android now shipping on 60,000 handsets per day http://bit.ly/bldwuv #mobile #cellphones #apple #competition;@tomkrcha;#mobile #cellphones #apple #competition
0;0;@Raddp couldn't disagree more. Not because google should "win" but facebook needs a competitor to keep it honest. Evil sumbitches, fb.;@Raddp;
0;0;Pânico ao terminar a atualização de firmware do nokia 5800 discador e contatos pararam de funcionar. Sr. Google deu a solução! #fail #nokia;;#fail #nokia
0;0;Spammers already targeting Google Buzz http://dlvr.it/21mT;;
0;0;I appreciate @Google finally making GDrive even if its not branded that way, Im uploading some large random files to Google Docs.;@Google;
0;0;iSuppli: Google will transform telcos from calling plans to mobile advertising: By working with the mobile gadget ... http://bit.ly/atzmjx;;
0;0;@ThatsDennis no sir. Google them youll see.;@ThatsDennis;
0;0;@jmortizsilva en este blog dicen que Google Reader si es accesible, hablan de tres aplicaciones y de un tal TV Raman http://bit.ly/ceylls;@jmortizsilva;
0;0;Trying out Google Chrome, at first experience, seems cleaner and much more stable than Explorer (imagine that)...;;
0;0;Google Maps Labs, el laboratorio de pruebas de Google Maps http://chilp.it/3102b1;;
1;1;O.O! RT @LaTrinchera : RT @barreravh : Bing vs Google - mapas de bing superan a los de Google , por Blaise Aguera TED2010 http://bit.ly/aepZZQ;@LaTrinchera @barreravh;
0;0;looking for a action movie @google;@google;
0;0;Combining AIM, Google Talk, & Facebook chat in one iChat window = major nerd win;;
0;0;Moscow-Vladivostok virtual journey on Google Maps: www.google.ru/intl/ru/landing/transsib/en.html;;
57;20;Google Buzz Prompts Privacy Investigation in Canada - http://bit.ly/beYf65;;
0;0;UGH. The Google CAPTCHA just beat me 3 times and then locked me out. I feel so... unhuman...;;
0;0;Anyone have an article about #search and caps lock? Looking for confirmation that @google can't read ALL CAPS;@google;#search
0;0;RT @palmpre : New blog post: New Look for Google Mobile on webOS http://url.ag/9urw6n;@palmpre;
0;0;vendo Viver a Vida.. AAah so pra nao esquecer de contar, vi a BARBARA PAZ no shopping !!!!!! OMG (se nao souber quem eh www. google .com.br);;
0;0;Has someone broken the internet? I can't access Google - how on earth will I find out anything!??;;
0;0;@sellout Hehe ;-) It’s because the “ Google Bar” is much more forgiving and helpful in case one makes typos.;@sellout;
0;0;@fseixas google wave?? isso é sooooo 2009...... :-);@fseixas;
0;0;RT Gotta Google moqueca... @mchamberlin : Making moqueca for birthday dinner. http://myloc.me/3TriR;@mchamberlin;
0;0;How to Use Google Buzz (PCWorld) http://bit.ly/98A7Ip;;
0;0;zona, to usando msn, google talk e o bate-papo do facebook..tudo ao mesmo tempoo huahauha;;
0;1;RT @chrismessina : "Top 10 things to fix in Google Buzz" http://ping.fm/sDpFs (over 7K votes in 24h!) /by @jyri tip @techmeme;@chrismessina @jyri @techmeme;
0;0;@DoTheWoo Best benefit = two way conversation/feedback + access to great information that you wont find on a google search (undermines SEO);@DoTheWoo;
0;1;Radian6’s #SocialMedia Monitoring Platform Now Tracks Google Buzz http://ow.ly/183oE (via @solvis );@solvis;#SocialMedia
0;0;Your one stop source for everything Google and 2010 Winter Olympics - GREAT CONTENT! http://ow.ly/183pL;;
0;0;just purchase a book growing your business with google;;
0;0;just purchase a book growing your business with google;;
0;0;Imágenes libres de derechos con Google Images http://bit.ly/9cDbbC;;
0;0;I love blogging but finding popularity is tough - checkout http://cloudkeyword.com for a boost in google performance;;
0;0;Google Hearts Springfield?... Day Three Follow-Up: I was unable to follow up the last couple days due to being out... http://bit.ly/92LteI;;
0;0;Nielsen: Facebook the 3rd-most-popular mobile site behind Google Search & Yahoo Mail http://bit.ly/azMx5J 100 million active mobile users!;;
1;0;Nielsen: Facebook the 3rd-most-popular mobile site behind Google Search & Yahoo Mail http://bit.ly/azMx5J 100 million active mobile users!;;
0;0;Google Hearts Springfield?... Day Three Follow-Up: I was unable to follow up the last couple days due to being out... http://bit.ly/bqloEM;;
0;0;@albrechtlara Adorei o comercial da Google ! Nunca tinha visto!;@albrechtlara;
0;0;Forget Buzz, Google still won't sort out Reader. I need to sync multiple Google Readers, it's failing to handle parts of one account.;;
0;0;((a)bc_akaishi)yahoo！、 google が、地図検索・画像検索のように、「通販サイトの専門検索」を開始させたら、楽天市場っていきなりピンチになっちゃうのかな？;;
0;0;Google Real-Time Search Results Now Include MySpace http://short.to/17hhm;;
1;0;Entenda um pouco a forma como pensamos: Nietzsche - Viviane Mosé - Café Filosófico. Entre no Google Vídeo e baixe o arquivo de 41 min.;;
0;0;New post: Optimizing AdWords Quality Score | Google Slap (http://cli.gs/40je9) http://cli.gs/40je9;;
0;0;Scientific blog post: Tinhte.com - Trên tay Google Nexus One (N1) http://crazy-eng.com/blog/archives/11710;;
0;0;RT @abrepalabras : El editor jefe de Le Post propone la "redacción Google " (nuevas funciones de una redacción moderna) http://is.gd/8xxQV;@abrepalabras;
0;0;Mastering Google Webmaster Central http://bit.ly/brfxSF;;
0;0;http://tinyurl.com/yfz6rq8 API de Google Libros - Google Code;;
0;0;@Simon818 I'm certainly not sending my bank statements to Google for scanning, and coverage not available everywhere;@Simon818;
0;0;YouTube Turns Five Years Old, But Without Google , It Would Be Bankrupt http://bit.ly/aAlS0I;;
0;0;Google _Buzz: Go beyond Status Messages http://www.google.com/buzz;;
0;0;Follow me on Google Buzz at http://www.google.com/profiles/ravi.karandeekar: http://bit.ly/adcEo5: http://bit.ly/d... http://bit.ly/9pWjSd;;
1;0;YouTube Turns Five Years Old, But Without Google , It Would Be Bankrupt http://bit.ly/b8CnJB;;
0;0;@eeeeilidh its quite hard toexplain,its war time and its about this girl and two guys and just awesome!:E google it haha,deffo do! x;@eeeeilidh;
0;0;Após reclamações do Buzz, google irá alterar as configuracões, e possivelmente também existirá possibilidade de bloquear seguidores;;
0;0;RT @TIME Why Google wants a faster Internet | http://su.pr/2TOMQm;@TIME;
0;0;Google Buzz copied FriendFeed’s worst features, why? http://scobleizer.com/2010/02/15/google-buzz-copied-friendfeeds-worst-features-why/;;
0;0;" Google is too powerful" says Vodafone CEO http://bit.ly/aZg1pP;;
0;0;I dont want to check so many services RT @waltmossberg : " Google Buzz Isn't Exactly Humming Along" , says @kabster728 : http://bit.ly/bsnCAO;@waltmossberg @kabster728;
0;0;@nagisakuraouka 今 Google で検索してようやっと「がんばれゴエモン」がなんなのか思い出しましたｗ　さすが Google としか言いようが無いですｗ;@nagisakuraouka;
0;0;Google retrocede con Buzz http://viigo.im/2rYc;;
0;0;The problem with just testing new digital products internally - http://bit.ly/9dnEFx #Google #Buzz;;#Google #Buzz
0;0;Google - Moscow-Vladivostok: virtual journey on Google Maps - http://bit.ly/csu12n;;
0;0;RT @omgthatssotrue Dear Ke$ha, I think you're confused. Please Google Mick Jagger. #omgthatssotrue;@omgthatssotrue;#omgthatssotrue
0;0;Google Real-Time Search Results Now Include MySpace http://nxy.in/87vml;;
0;0;RT @nprnews Privacy Group Pings FTC About Google Buzz http://su.pr/2RDRuX;@nprnews;
0;0;Deleted my previous tweet, because twitter converts the garbage that google buzz shows for apostrophes;;
0;0;MySpace Real Time Search Goes Live on Google : http://cot.ag/9qR1NV ^Glenn;;
0;0;Google Goggles Getting OCR Translations http://nxy.in/pob1y;;
0;0;feednews: Techcrunch: The Android Who Cried Wolf: Currently, Google has one of the more interesting problems I’ve... http://ff.im/-g3mHZ;;
0;0;Seit Monaten lernen immer wieder Leute über Google -Suchen von #Zivilschein , dass man gefrorene bzw. geplatzte Eier noch essen kann. [1/2];;#Zivilschein
0;0;How Google Saved Google Buzz - The Huffington Post http://goo.gl/fb/JCnJ;;
0;0;Google Buzz, nuove opzioni per la privacy http://bit.ly/dB9jnh #fb;;#fb
0;0;Google Buys an Aardvark to Improve Social Networking: Google has moved quickly to match moves by Microsoft and Yah... http://bit.ly/9VLBHw;;
0;0;Was reading ytd's tweets & realised hwz's tweets, every line starting with " Google says" flooded it. Lol;;
1;0;How to Add Google Buzz Button to Your Blog http://bit.ly/aBeMAs Blogging.alltop;;
0;0;Video Comparison: New Google Phone (Nexus One) vs. iPhone http://goo.gl/fb/SLx7 #video #google #googlenexusone #smartphones #android;;#video #google #googlenexusone #smartphones #android
1;0;Google Surpasses Facebook ... But Really? is a good rebuttal to another popular post that hit the waves recently. http://bit.ly/93cGIY;;
0;0;Tentei voltar Para o Internet Explore, é uma BOSTA! continuo no google chrome;;
0;0;News: Privacy group files FTC compaint about Google Buzz - FOX 8 News WVUE-TV http://bit.ly/a1fpzI;;
0;0;News: EPIC Files FTC Complaint Over Google Buzz - All Things Digital (blog) http://bit.ly/c2oKbH;;
0;0;Thank gawd for google . The #olympic site had a 2nd gold medal for Canada, but not who won it! Bastards keeping me in the dark!;;#olympic
0;0;Google setzt auf "Mobile first" http://bit.ly/d1Lg67 #MWC;;#MWC
0;0;New post, "Feeds for Google Alerts" - http://bit.ly/brljJD;;
0;0;@Crisgcouto www. google .com.br , entra no linke mapas;@Crisgcouto;
0;0;google の「リアルタイム検索」日本語にも対応。twitterの検索にも対応。;;
0;0;#Google was #404 for about 5 minutes at 3:30 today. Was I the only one who got this? http://tweetphoto.com/11623813;;#Google #404
0;0;RT @ashermoses : Google Androids take over mobile convention - http://bit.ly/9jNsmC;@ashermoses;
0;0;Turn Google into Your Personal Napster with a Bookmarklet - Bookmarklets - Lifehacker http://ff.im/-g3mB3;;
0;0;Ahahaha teteeeup loh dia promosi RT @rianisovana : pengen 'twitteran' tanpa batasan karakter? Google Buzz ajah!;@rianisovana;
0;0;Arianna Huffington: What a Difference a Week Makes: Google Buzz Arrives With a Bang - http://bit.ly/cziy7h;;
0;0;Google , you need to let us make our own themes for Chrome. I love you, but these themes suck.;;
0;0;Cdogstar Google write [pic] http://ff.im/g3mzp;;
0;0;#jQuery #Google #Buzz widget http://bit.ly/cgYG7C;;#jQuery #Google #Buzz
0;0;google chrome书签同步不可用了。;;
0;0;@renata_de_boer ben nog steeds niet uitgekeken haha, schaatsen en google house gedoe, relaxed! Maar ga wel zo tukken denk ik!;@renata_de_boer;
0;0;Radian6’s Social Media Monitoring Platform Now Tracks Google Buzz #Radian6 http://ow.ly/183oE #scrmmx;;#Radian6 #scrmmx
0;0;@foleypod Well, it is an issue for me. ;-) Therefore Twitter and #Buzz seem like they will be the end solution for me, until Google fixes;@foleypod;#Buzz
0;0;@Jeff_Scarpo goog .. doing many things - google buzz / android - droid smart phones .. iphone lite www.mapdentist.com;@Jeff_Scarpo;
0;0;google も動きが早い。いま何がおきているか？を提供--Twitter投稿を検索画面で自動スクロール。つぶやき者のフォロワーの数やretweetが関係するようです。;;
0;0;Google App Engine for Java 와 스프링(Spring Portfolio) 호환성 http://younghoe.info/1309;;
0;0;Flash: Privacy group files FTC compaint about Google Buzz - FOX 8 News WVUE-TV http://bit.ly/cdjZam;;
0;0;Google altera definições de privacidade do Buzz depois das críticas dos utilizadores : http://bit.ly/9WyHSK;;
0;1;Top 10 Google Settings You Should Know About http://lifehacker.com/5470671/ #lifehackertop10 #googlesettings;;#lifehackertop10 #googlesettings
0;0;Google Opt Out Feature Lets Users Protect Privacy By Moving To Remote Village. http://bit.ly/9lmNzG;;
0;0;Flash: EPIC Files FTC Complaint Over Google Buzz - All Things Digital (blog) http://bit.ly/coT7wf;;
0;0;Google Adsense Secrets? No way... http://www.icantinternet.org/2009/08/google-adsense-secrets/ #adsense;;#adsense
0;0;cari d google ajRT @muthcenul: caranya gmn?Twitalay apa sih?RT @astriddwi : akhirnya hpku bisa buat tuitwit, twitalay;@muthcenul @astriddwi;
0;0;Google still dominates search, but social sites gain http://sbne.ws/r/3Sla;;
0;0;@MGEEZr website. google it. :);@MGEEZr;
0;0;TrueJonasFan has google alerts set for everytime @JonasBrothers @NIckJonas or @ThisIsJoe are mentioned;@JonasBrothers @NIckJonas @ThisIsJoe;
0;0;@MWC : Google CEO outlines search giant's mobile efforts: And no, they're not trying to steal all of your business http://bit.ly/9UxP6J;@MWC;
0;0;Check Google Maps on your iPhone dude! RT @modeminho Is there still an ihop on mission st. San francisco ?;@modeminho;
0;0;@zeldman yes but is Google buzz ignoring you? :-);@zeldman;
0;0;pachecod: Google is under fire for privacy breaches in its Buzz social networking launch: http://bit.ly/boG7X8: pachecod: Google is un...;;
3;0;For Search Nerds: Inside Google 's Hot Topics, a real-time heat map of news and chatter http://bit.ly/cwFT3D;;
0;0;#bm #gadgets Getting Started: gadgets.* API - Gadgets API - Google Code http://bit.ly/5ebxzD;;#bm #gadgets
0;0;@potebadilla por google reader tu sigues paginas te llegan como mail cada cosa que haces y ahi siguen mi twitter me dio miedo;@potebadilla;
0;0;Highlights from Google 's Get Inside the Winter Games Press Conference http://ow.ly/183mJ;;
0;0;MySpace Real-time Data Launches on Google Search: Los Angeles - News Corp.'s (NYSE: NWS) MySpace announced on Tues... http://bit.ly/bB3bTF;;
0;0;http://bit.ly/bmy8AX Google Commits Blogocide, Shuts Down Music Blogs;;
0;0;http://bit.ly/a1t8Sx Google Buzz :O Marc Jacobs the New Buzz King; Donna Karan and Zac Posen Receive Raves;;
