retweets;favorites;text;mentions;hashtags
4;4;[CNET] The HomePod: Apple's answer to the Amazon Echo and Google Home video - CNET http:// j.mp/2rXB96h;;
2;5;Check us out on itunes, stitcher & google play! https:// twitter.com/chaddukes/stat us/871878555088678912 …;;
0;0;Learn how our #clients have transformed their #sales using #google #AdWords & get your AdWords certification! http:// bit.ly/2onS6Re pic.twitter.com/b6jGNTkoD3;;#clients #sales #google #AdWords
0;1;Porque eu sou um lixo Google pesquisar;;
2;16;Hi Nora, I was wondering... Is this true? Can that ... — it's not true dahfkdahfdk google translate fucked up https:// curiouscat.me/noranb/post/15 9066268?t=1496707156 …;;
0;0;Rugged capabilities, refined interior. The well tailored interior of the MINI Co…: google … https:// goo.gl/fb/GSE2tI;;
0;0;June 06, 2017 at 01:56AM Google Trend --> Mac Miller;;
0;0;June 06, 2017 at 01:56AM Google Trend --> Guns And Roses;;
0;1;bahahahahaaa so it's not going to understand me and cost more than google and amazon? I love me some apple but come on;;
0;0;The only thing Ferrari about this concept car is the logo on the front and back!…: google … https:// goo.gl/fb/EwvvCt;;
222;242;Esperamos que para mañana todos ya tengan lista su cuenta de @Spotify y que compren el single en iTunes/ Google Play.;@Spotify;
0;0;esas personas que hacen preguntas pendejas aún sabiendo que existe google;;
0;0;➜桜(sakura) -UNIVERSE- on #Google play music https:// play.google.com/store/music/al bum?id=Bta6vfix6t5qpjiknx4qasjnmje&tid=song-Tzjngcafhba4tiz73humcjccxia … #Song #tune #музыка #Япония #ИНФОРМАЦИЯ;;#Google #Song #tune # # #
0;0;@Google won't remove hate preacher rants? http:// dailym.ai/2rN8kbO Otherwise known as aiding & abetting then #Indefensible @MailOnline;@Google @MailOnline;#Indefensible
0;2;Take some effing notes or better yet memorize key points. Don't print or email actual docs. Ever. Don't Google details at work OR at home.;;
0;2;Não acho absurdo pensar nisso, mas vindo dos diretores do Santos, é bem provável que vão jogar no google pra saber de quem se trata. Jênios.;;
0;1;Use Google Maps https:// twitter.com/nrmaherr_/stat us/871879046921146369 …;;
0;0;wingedbelievereagle: DAVID BOWIE ,TWD …LIVE ‘CHER SHOW ’ 1975 Source : google ... https:// tmblr.co/ZFmYWx2MPILl0;;
0;0;And Google Plus is never going to rival the social media site she uses Twitter as much as I do so we can talk all the time;;
1;2;Stubborn attitudes of Facebook, Google and Twitter like tech companies on "encryption" have been criticized after terror attacks in London.;;
0;0;Google Street View vehicles now measuring air pollution https:// environment.google/projects/airvi ew/ …;;
0;0;Gostei de um vídeo @YouTube http:// youtu.be/Lyp_LYJPE2w?aEM HD - RESUMO DA ZUEIRA #55 - NARRADO PELO GOOGLE TRADUTOR;@YouTube;#55
0;0;É possível as pálpebras não abrirem mais depois de ficar o dia todo abertas e estarem cansadas? Google pesquisar;;
0;0;When your google drive for the #yearendcelebration looks like your #yearbook drive. Here we go! pic.twitter.com/L96WbVdk9v;;#yearendcelebration #yearbook
0;0;➔桜(sakura) -UNIVERSE- on #Google play music https:// play.google.com/store/music/al bum?id=Bta6vfix6t5qpjiknx4qasjnmje&tid=song-Tzjngcafhba4tiz73humcjccxia … #Song #tune #musica #Giappone #informazioni;;#Google #Song #tune #musica #Giappone #informazioni
0;0;At #google for the #howardwest kickoff. Very happy to be a #Bison #awwHU;;#google #howardwest #Bison #awwHU
0;0;King of dark fantasy. Summon today. App Store: http:// bit.ly/AzhyKP Google Play: http:// bit.ly/NtcNTs #DarkSummoner;;#DarkSummoner
0;7;a unesp tinha q organizar um workshop de google pra umas pessoas;;
0;0;I only use my google home and Alexa to turn the lights off from bed. Or check the weather in my closet.;;
0;0;There is a really cool new thing called " Google " it will answer any question you have!;;
1;6;#seo #localseo #marketing #marketingautomation Purchases on Google quietly opens beta for requests in US http:// ow.ly/FJG850by9bM;;#seo #localseo #marketing #marketingautomation
0;0;I wish people didn't just believe everything they seen. Research it. It takes 5 seconds to Google something, & 10 minutes to read 3 articles;;
0;2;Google だってほぼ広告費で儲けてるんだし、広告や宣伝や口コミを制するものが界隈を制するのですよ;;
9;36;必読。 Google のAI戦略が分かりやすくまとまってるインタビュー。AIはディープラーリングなどの研究の時代からユースケースの発明の時代に移った。クラウドAIを使ってどんなサービスを構築していくか。それが重要になる！ http:// fb.me/1lW20D4aq;;
0;1;I wish you could write this in google before asking a hard working minister who has lot others to do. Good luck! It's easy process.;;
0;0;Lo Que No Sabias De GOOGLE ? hechale un vistazo https:// youtu.be/03nedw6qWvk vía @YouTube;@YouTube;
0;0;☵桜(sakura) -UNIVERSE- on #Google play music https:// play.google.com/store/music/al bum?id=Bta6vfix6t5qpjiknx4qasjnmje&tid=song-Tzjngcafhba4tiz73humcjccxia … #Song #tune #musica #Giappone #informazioni;;#Google #Song #tune #musica #Giappone #informazioni
0;0;Google Hangouts now takes advantage of iOS native-calling features - Digital Trends https:// apple.news/AvsyUiVEZR5WQ3 YjDWkMchg …;;
0;1;My Google account unfollowed @Verliswolf automatically. Luckily I noticed it.;@Verliswolf;
0;0;eu tô chorando, preciso fazer dois trabalho e nem comecei ainda nenhum deles, e o de geografia não tem no google;;
0;0;Google Burgers!! https:// lnkd.in/eZM_--R;;
1;1;Machine learning comes to Google Sheets, boosting data visualization for users http:// tek.io/2rYdl2m #DataScience #MachineLearning;;#DataScience #MachineLearning
0;0;¡CURSO DE MARKETING DIGITAL VENTAS EN GOOGLE ADWORDS Y FACEBOOK! Vende en Google y Facebook Llámanos al:... http:// fb.me/C9rETVWs;;
0;0;There have been multiple studies about it. Here's one article from 2011, but Google will find you more. http://www. nytimes.com/2011/09/13/us/ 13contractor.html …;;
0;1;Tον ελευθερο χρονο μου, καθομαι παταω στο google "homemade gay porn greek" και ψαχνω να δω μηπως υπαρχω πουθενα...;;
0;0;#USA #Google - Do you have enough money for retirement? - Here is help! http:// bit.ly/2kfXh7n pic.twitter.com/KozZg4qOd1;;#USA #Google
0;0;lo buscaste en Google traductor verdad pic.twitter.com/UfNKcVrE9V;;
0;0;¡CURSO DE MARKETING DIGITAL VENTAS EN GOOGLE ADWORDS Y FACEBOOK! Vende en Google y Facebook Llámanos al:... http:// fb.me/38jZ7bMKQ;;
0;0;Looks like Canada is known for ski resorts!.. What people think of every country in the world, according to Google http:// read.bi/2qXZjJ7;;
0;2;I'm glad articles about impeachment are at the top of my Google Now feed. Either their recommendation system works, or I'm in the majority.;;
2;16;Hi Nora, I was wondering... Is this true? Can that ... — it's not true dahfkdahfdk google translate fucked up https:// curiouscat.me/noranb/post/15 9066268?t=1496707156 …;;
0;3;i had to google this i first thought you were calling me an ocean weed;;
0;1;➞桜(sakura) -UNIVERSE- on #Google play music https:// play.google.com/store/music/al bum?id=Bta6vfix6t5qpjiknx4qasjnmje&tid=song-Tzjngcafhba4tiz73humcjccxia … #Song #tune #musica #Giappone #informazioni;;#Google #Song #tune #musica #Giappone #informazioni
0;2;RT sengineland: #SearchCap : Retail #SEO , #B2B searches & green Google logo by rustybrick http:// selnd.com/2rYqM29;;#SearchCap #SEO #B2B
0;0;【ダークサマナー】ダークファンタジーの王道ゲーム！数多のモンスターと最強を目指せ！ AppStore： http:// bit.ly/P63JqN Google Play： http:// bit.ly/Nl1XT4 #DarkSummoner_jp;;#DarkSummoner_jp
0;0;Google ’s AlphaGo Levels Up From Board Games to Power Grids http:// dlvr.it/PK2S9Y pic.twitter.com/aFYYcYHN7u;;
0;0;Se n sabe oq é alantoide pesquisa no google — criatividade exalando https:// curiouscat.me/lalan_/post/15 9364479?t=1496707149 …;;
2;6;Trump dejó los acuerdos de París, pero @facebook y @Google quieren apoyar el calentamiento global. http:// bit.ly/2qRGwQq pic.twitter.com/JEAfJgmSJn;@facebook @Google;
0;0;♪Very very Berry -ShootingStar- on #Google play music https:// play.google.com/store/music/al bum/Very_very_Berry_ShootingStar?id=Byy74supalby4hn6mojqx53sf74 … #Song #tune #musica #Giappone #informazioni;;#Google #Song #tune #musica #Giappone #informazioni
0;0;Garage Digital: el plan de formación personalizado y gratuito de Google https:// goo.gl/TvFAjU?btz10=2 359060605 …;;
0;0;Scattergories...with a twist!! It's harder than you think.... NO using Google ! Every answer must start with the... http:// fb.me/131ex4U5m;;
0;1;"Are you at Kroger?" Shut the fuck up, Google Maps, you know exactly where I'm at. Don't play coy thinking you'll get a review out of me.;;
0;0;I really just had to google him, never even heard of this guy in my life #TankSznPart2;;#TankSznPart2
0;1;Too expensive of a gadget for something that just preforms a glorified Google search... Feel the same way about "smart" watches;;
0;0;How the Trump-Russia Data Machine Games Google to Fool Americans http:// buff.ly/2qYWtU4 pic.twitter.com/WGdkIV4KNu;;
0;0;Tasty? Google ???;;
0;0;Gostei de um vídeo @YouTube http:// youtu.be/a5e7qRnmG9o?a7 Buscas no Google que você JAMAIS deve fazer (se quiser dormir essa noite);@YouTube;
6;7;#Google #Chrome 59 Released With a Material Design #UI in the Settings Section https://www. bleepingcomputer.com/news/google/go ogle-chrome-59-released-with-a-material-design-ui-in-the-settings-section/#.WTXwF-hnNYw.twitter … #tech #browser #cybersecurity #ai;;#Google #Chrome #UI # #tech #browser #cybersecurity #ai
0;0;DMOZの終了でメタディスクリプションの再評価。「長さに制限はありません。ただしスニペットは必要に応じて切り詰められます（端末の幅に合わせる場合など）」。◆ ユーザーに役立つ検索スニペット｜ Google ウェブマスター向け公式ブログ http:// pyn.jp/2sxxYPP;;
0;0;mano as meninas pedem pra mim pesquisar um negócio que nem tá no google , se fode;;
0;1;there's research showing it decreases soda consumption. You can google it if interested.;;
0;0;Can't believe Tories have resorted to buying ads on google and snapchat because they are that shit of a political party #ToriesOut;;#ToriesOut
0;0;Gostei de um vídeo @YouTube http:// youtu.be/Lyp_LYJPE2w?aEM HD - RESUMO DA ZUEIRA #55 - NARRADO PELO GOOGLE TRADUTOR;@YouTube;#55
0;0;➠Very very Berry -ShootingStar- on #Google play music https:// play.google.com/store/music/al bum/Very_very_Berry_ShootingStar?id=Byy74supalby4hn6mojqx53sf74 … #Song #tune #musica #Giappone #informazioni;;#Google #Song #tune #musica #Giappone #informazioni
0;0;Eso ya esta comprobado en varios estudios => google;;
0;0;✓Very very Berry -ShootingStar- on #Google play music https:// play.google.com/store/music/al bum/Very_very_Berry_ShootingStar?id=Byy74supalby4hn6mojqx53sf74 … #Song #tune #musica #Giappone #informazioni;;#Google #Song #tune #musica #Giappone #informazioni
0;0;こないだ姉ちゃんに肉じゃが作ってって頼 んだら｢そんなん自分で作れ！」って返され た でも次の日 Google の検索履歴見たら 肉じゃが おいしい肉じゃが 最高の肉じゃが 究極の肉じゃが 至高のにｋｊはｄ 至高の肉じゃが ってあってﾜﾛﾀ;;
0;0;Tweeting this again, because it's that good: "Can Google properly crawl and index JavaScript frameworks?" https:// goralewicz.com/blog/javascrip t-seo-experiment/ …;;
0;1;1コマ目終わったら写真送ります！ それよりも早く見たかったら、学校のホームページに Google カレンダーがあるので、それを見てもらえればと思います…！;;
0;0;Don't get too excited - Be careful celebrating Google 's new ad blocker https:// interc.pt/2swR8W7 by @ddayen;@ddayen;
0;0;Gostei de um vídeo @YouTube http:// youtu.be/Lyp_LYJPE2w?aEM HD - RESUMO DA ZUEIRA #55 - NARRADO PELO GOOGLE TRADUTOR;@YouTube;#55
0;0;I wouldn't know but google might;;
0;0;Very very Berry -ShootingStar- on #Google play music https:// play.google.com/store/music/al bum/Very_very_Berry_ShootingStar?id=Byy74supalby4hn6mojqx53sf74 … #Song #tune #musica #Giappone #informazioni;;#Google #Song #tune #musica #Giappone #informazioni
1;0;coisas engraçadas pra eu rir pq não tá dando mais Google pesquisar;;
0;0;The Unicorns Backed By FAMGA (Facebook, Apple, Microsoft, Google , Amazon) http:// ift.tt/2sLp6pa;;
0;0;Google home is your friend;;
0;1;#seo #feedly : "今や Google は人間並みに言葉を認識できる。音声の誤認識率は4.9%" https://www. suzukikenichi.com/blog/googles-a bility-to-understands-language-is-equivalent-to-humans/amp/ …;;#seo #feedly
0;0;➠Very very Berry -ShootingStar- on #Google play music https:// play.google.com/store/music/al bum/Very_very_Berry_ShootingStar?id=Byy74supalby4hn6mojqx53sf74 … #Song #tune #musica #Giappone #informazioni;;#Google #Song #tune #musica #Giappone #informazioni
0;0;Pruebas de que? De que trabajé ahí? Búscame en Google !!! Carlos Rivelino Quiroz año 2010. Y la verdad la experiencia no fue la mejor;;
0;0;Google Pixel XL International Giveaway @androidauth #giveaway https:// wn.nr/KE8ZwJ;@androidauth;#giveaway
0;0;【ダークサマナー】ダークファンタジーの王道ゲーム！数多のモンスターと最強を目指せ！ AppStore： http:// bit.ly/P63JqN Google Play： http:// bit.ly/Nl1XT4 #DarkSummoner_jp;;#DarkSummoner_jp
0;0;Google Street View di Indonesia http:// ow.ly/ANVtw;;
0;1;The Unicorns Backed By FAMGA — Facebook, Apple, Microsoft, Google , Amazon https://www. cbinsights.com/blog/unicorn-i nvestments-facebook-apple-microsoft-google-amazon/ … #VC #Startup pic.twitter.com/6Fe3xWjqLV;;#VC #Startup
0;0;Square Cash - Android Apps on Google Play https:// play.google.com/store/apps/det ails?id=com.squareup … http:// pinterest.com/pin/6501368961 78658733/ …;;
0;1;So far, the results have been pointing towards using google forms. I just finished creating it so I'll open up prompting soon! (Again ) https:// twitter.com/kaifectionery/ status/871814042326847488 …;;
0;0;➠MASAKI YODA -99th base- on #Google play music https:// play.google.com/store/music/al bum/MASAKI_YODA_99th_base?id=Bybsqdkxnlt5mglxptdyjt76lvy … #Song #tune #musica #Giappone #informazioni;;#Google #Song #tune #musica #Giappone #informazioni
0;0;How accurate is @Google 's new #attribution tool? @ben_r_g of @MerkleCRM | @Periscopix explains: http:// bit.ly/2rN4X4Q pic.twitter.com/EUpa7O9AYj;@Google @ben_r_g @MerkleCRM @Periscopix;#attribution
0;0;Google Play Store ofrece mayor claridad en los precios de apps y juegos #GrandesMedios https://www. grandesmedios.com/promociones-pr ecios-play-store/ …;;#GrandesMedios
0;4;como é bom procurar no google qual o motivo das tuas pontadas no peito e descobrir que tu tem câncer;;
0;0;Man sees yet another Coggan power training FB post harking back to 10 year old Google group post be like.... https:// youtu.be/-l7lM4zy0dM;;
0;0;iOS 11 makes the iPad feel more like a Mac - The Verge http:// bit.ly/2ruRRZo #Google #News #Tech;;#Google #News #Tech
0;0;Im in the running to get a $25 google play gift card thanks to @neonexus671 #Swiper https:// wn.nr/fyCTzG;@neonexus671;#Swiper
0;0;When Siri was behind them compared to Ok Google . Like why not invest in improving the AI;;
0;0;➔MASAKI YODA -99th base- on #Google play music https:// play.google.com/store/music/al bum/MASAKI_YODA_99th_base?id=Bybsqdkxnlt5mglxptdyjt76lvy … #Song #tune #musica #Giappone #informazioni;;#Google #Song #tune #musica #Giappone #informazioni
1;35;My sound engineer: "How did they find you for this interview?" Me: "I think if you google '1860s and testicles,' you get me?" 5/n;;
0;0;#Business • Apple escalates its battle with Amazon and Google with the HomePod http:// dlvr.it/PK2RYN pic.twitter.com/KEUKsvzekY;;#Business
0;0;Win A #Google #Pixel & Printer With #Android Headlines @androidheadline @mopria #giveaway http:// bit.ly/PixelMopria http:// swee.ps/chTlORhSn;@androidheadline @mopria;#Google #Pixel #Android #giveaway
0;0;"Ok google comment peut-on réussir à dormir quand on n'y arrive pas ?";;
0;0;➚MASAKI YODA -99th base- on #Google play music https:// play.google.com/store/music/al bum/MASAKI_YODA_99th_base?id=Bybsqdkxnlt5mglxptdyjt76lvy … #Song #tune #musica #Giappone #informazioni;;#Google #Song #tune #musica #Giappone #informazioni
0;0;Google sucks Sarsour...;;
0;1;No Drs. are talking about it! Google;;
0;0;Lieber selber steuern als geblockt werden: Google will help publishers prepare for a Chrome ad blocker. https://www. wsj.com/articles/googl e-will-help-publishers-prepare-for-a-chrome-ad-blocker-coming-next-year-1496344237 …;;
0;0;@google , why can't I find this book on your #playstore ? #silentCensorship #freeSpeech pic.twitter.com/5UrBvjx4GF;@google;#playstore #silentCensorship #freeSpeech
0;0;Trabzonun şampiyonluğunu caldiniz en büyük örneği bak Google 'ye türkiyenin en şerefsiz takımı yaz sonra gel konuşalım;;
0;0;Google Pixel XL International Giveaway @androidauth #giveaway https:// wn.nr/HK82kV;@androidauth;#giveaway
0;0;Data search engine by google ! https:// cse.google.com/cse/publicurl? cx=002720237717066476899:v2wv26idk7m …;;
0;0;Every time I meet a rly hot guy I just google search his dad and ask if I wanna be with someone who's gonna look like that;;
0;0;FYI yes I plagiarize, from revered authors to shitty trap rappers. So don't waste your time tryna google my tweets.;;
0;0;✓MASAKI YODA -99th base- on #Google play music https:// play.google.com/store/music/al bum/MASAKI_YODA_99th_base?id=Bybsqdkxnlt5mglxptdyjt76lvy … #Song #tune #musica #Giappone #informazioni;;#Google #Song #tune #musica #Giappone #informazioni
0;3;pic.twitter.com/2d1dYC1r9W;;
0;1;#Google PD week is here! https:// twitter.com/edtechteam/sta tus/871732195630747648 …;;#Google
11;12;#SearchCap : Retail #SEO , #B2B searches & green @Google logo by @rustybrick http:// selnd.com/2rYqM29;@Google @rustybrick;#SearchCap #SEO #B2B
0;0;Google and facebook are responsible for an informed public stop PROPAGANDA.;;
0;9;Super proud moment today - the @Whitepages_au app is #1 trending app in the App Store! Also in the free chart of Google Play pic.twitter.com/cgBGBHd9IP;@Whitepages_au;#1
0;1;Hey now I love there matte black line up looks so nice one thing that doesn't make sense is how they released there on Google home;;
0;0;#CrackerBarrel thanks for the raw chicken tonight great advice ... sorry google it. My meal was not charged. Flying over seas tomorrow;;#CrackerBarrel
0;0;Tu tomaste la foto o es de Google ?;;
0;0;MASAKI YODA -99th base- on #Google play music https:// play.google.com/store/music/al bum/MASAKI_YODA_99th_base?id=Bybsqdkxnlt5mglxptdyjt76lvy … #Song #tune #musica #Giappone #informazioni;;#Google #Song #tune #musica #Giappone #informazioni
0;0;Google トレンド 急上昇ワード Apple http:// ift.tt/2sLkHTi;;
0;1;We've had exactly same from our 5 year old. But he's also asked "why is that alexa named google " #firstmoveradvantage summed up;;#firstmoveradvantage
0;0;they don't have advertisers - if they do it's google ads and on their best day maybe they made $3 off the clicks;;
0;0;No. I just forgot my password and when I use "forgot password" it is unable to verify my identity.;;
0;1;SearchCap: Retail SEO, B2B searches green Google logo (Barry Schwartz/SearchCap: Daily Search Engine Recap) http:// dlvr.it/PK2RQy;;
0;0;tô boiando com esse negócio de Google duo, só sei q tem como falar com Whindersson por ligação de vídeo #WhinderssonNoGoogleDuo;;#WhinderssonNoGoogleDuo
0;0;Google j'en peux plus .....;;
1;2;日常生活に直結するサービスが沢山！ 検索だけじゃない！ Google が提供しているサービスはこんなにあった｜ferret [フェレット] https:// ferret-plus.com/7242 @ferretplus より;@ferretplus;
0;0;eu pesquisando no google às 3h da manhã https:// twitter.com/anawitchclara/ status/871581919976337408 …;;
0;0;SearchCap: Retail SEO, B2B searches & green Google logo https:// goo.gl/gwlKUe;;
0;2;Yeah sorry I'm not up on what google search terms are best to figure out "what is that thing that looks like a corkscrew but really isn't";;
0;0;Google Street View vehicles now measuring air pollution http:// ift.tt/2qQtnat;;
0;0;Estoy participando en un sorteo de @JorgeLealTG de una tarjeta de 50$ en google play o itues http:// bit.ly/2sBl6HA;@JorgeLealTG;
0;0;Google の後追いでも、買ってしまうかもしれない･･･(ﾉ∀`) Appleがスマートスピーカー「HomePod」を発表！ ホームアシスタント ビームサウンドでおウチを進化;;
0;0;Google Street View vehicles now measuring air pollution http:// ift.tt/2qQtnat;;
0;0;#SEOeStore offers full campaigns start from $5, to promote your #Google #rank to top #1 http:// panel.seoestore.net/seo-campaigns. php?ref=Heriyanto …;;#SEOeStore #Google #rank #1
2;4;Not sure if anyone has done a Google search on that subject like I just did. China is by far the worst carbon polluter.;;
0;1;LO BUSQUE EN GOOGLE;;
0;0;Google , Apple, Microsoft, Amazon and Facebook take top five spots in BrandZ's ranking ...read more Via:: FT India... http:// fb.me/ZOnvsNR3;;
0;0;Apple HomePod vs. Amazon Echo vs. Google Home – CNET http:// itruck.news/apple-homepod- vs-amazon-echo-vs-google-home-cnet/ … pic.twitter.com/7lNnmvENdt;;
0;0;Google furry. pic.twitter.com/8B5KshUJDK;;
0;0;United Onslaught is on! Get Divine Evolvable Rank S! App Store: http:// bit.ly/AzhyKP Google Play: http:// bit.ly/NtcNTs #DarkSummoner;;#DarkSummoner
2;0;WSJ Ends Google Users' Free Ride, Then Fades in Search Results http:// twib.in/l/5BLnebdd76ry via @jasoncreation #socialmedia pic.twitter.com/rcXe9UQmng;@jasoncreation;#socialmedia
0;1;I'm looking forward to attending your session: Fantastic Feedback Tools for Google Docs Wednesday. Thanks for posting resources!;;
0;1;Its main function is a really good speaker system. Its not exactly an amazon echo/ google home competitor. It also competes with sonos.;;
0;0;google it lol;;
0;1;LRT I told my kid, "Girl, I got 101 nerves and you on 100 of them." My son overheard me & actually went to Google how many nerves one has.;;
0;0;The clarity of your content matters almost as much as whad you're actually saying. ( Google Webmasteds);;
0;2;comecei a pensar no que eu quero pra minha vida, fui dar uma olhada no google agora to so tremendo e chorando;;
0;0;como perder peso estando sentada e as vezes deitada no sofá google pesquisar estou com sorte;;
0;0;Mymarketplace New Blog Post: Google Shadow http:// tinyurl.com/8rm5gfg;;
0;7;searching google images for pictures of immune cells when i come across this absolute masterpiece #stonedmacrophage pic.twitter.com/IWzYEr8soT;;#stonedmacrophage
0;0;The rise of analysis and the fall of the ability to utilize it. Google Ngram Viewer: '[ https:// books.google.com/ngrams/graph?c ontent=%22analysis+paralysis%22&year_start=1800&year_end=2000&corpus=15&smoothing=3&share=&direct_url=t1%3B%2C%22%20analysis%20paralysis%20%22%3B%2Cc0 …;;
0;0;Google Trend --> Mac Miller June 06, 2017 at 01:56AM;;
0;0;Struggled to Rank Your Site on First Page of #Google ,This Is Your Solution Backlink Software http:// bit.ly/1TMa2x6 pic.twitter.com/TK9EBudQjb;;#Google
0;0;Google Trend --> Guns And Roses June 06, 2017 at 01:56AM;;
0;0;#Google has update its’ request for reconsideration for non-compliant ad pages. #AdSense;;#Google #AdSense
0;0;iMessage vs Google Hangouts https:// twitter.com/satviksehgal/s tatus/871877533855236096 …;;
0;0;Filling the Google Gaps: Harnessing the Power of Google through Instruction https:// osf.io/preprints/lawa rxiv/j3rcs … via @OSFramework;@OSFramework;
0;0;Google Pixel XL International Giveaway @androidauth #giveaway https:// wn.nr/dywk5G;@androidauth;#giveaway
0;0;Thanks, Jon Hart, for your excellent review on Google @Birdeye_ https:// birdeye.com/modloft-furnit ure-147575592552228/review/56009937538784988 …;@Birdeye_;
2;0;[PR] 56位⇒2位のサイトが実施した直帰率改善法教えます http:// devo.jp/index.php?aid= a575f63c9a1da9 … #seo #google #アフィリエイト #起業 #稼ぐ #お金 #広告 #副業 #web #ブログ #拡散 #検索 pic.twitter.com/C7BFY7JAa9;;#seo #google # # # # # # #web # # #
0;0;Thanks, Sanjeev Kundra, for your excellent review on Google @Birdeye_ https:// birdeye.com/modloft-furnit ure-147575592552228/review/56009938538784987 …;@Birdeye_;
0;0;Garage Digital: el plan de formación personalizado y gratuito de Google https:// goo.gl/TvFAjU?btz7=23 57060605 …;;
0;1;Why shortcuts for Google Home are a total waste of time https:// venturebeat.com/2017/06/04/why -shortcuts-for-google-home-are-a-total-waste-of-time/ … #startups #entrepreneur pic.twitter.com/EwCNmHbrks;;#startups #entrepreneur
0;0;Is it bad if I don't need to google it?;;
0;0;Faulty redirects result in a nega ivehuser experience. ( Google Webmasters);;
0;0;@TTChelps hi is there a problem with Google Maps? Is line 1 running to Finch?;@TTChelps;
0;4;Eu sou muito paranóica, qlqr dorzinha q eu sinto já vou no google pesquisar se é algo grave, se eu vou morrer, gente pq;;
0;0;King of dark fantasy. Summon today. App Store: http:// bit.ly/AzhyKP Google Play: http:// bit.ly/NtcNTs #DarkSummoner;;#DarkSummoner
0;0;Amazon、 Google のは欲しいけどAppleのスピーカーはいらんなぁ。;;
0;0;Dinosaurus offline di google chrome juga seru;;
0;0;Alguém nesse momento esta procurando a sua empresa no Google ! Só 20% dos WEBSITES são… https://www. instagram.com/p/BU-iUCAje4x/;;
0;0;Goodluck! Google banyak2 jawapan ict tu;;
