retweets;favorites;text;mentions;hashtags
0;0;@kel_surprise That wouldn't work for me. I do most of my writing directly to Google Docs. #Nanowrimo;@kel_surprise;#Nanowrimo
0;0;Gmail(Gﾒｰﾙ)から直接通話！ Google のiP電話が始まる？日本でのサービス開始は？ http://www.amamoba.com/pc/new-;;
0;0;Google Files Suit Against US Govt. Over Contracts http://bit.ly/bNKmQs;;
0;0;@gugutz2 google chrome faz contas na barra de endereço =D;@gugutz2;
0;0;Google Files Suit Against US Govt. Over Contracts: On Friday, Google filed suit against the US government, a... http://tinyurl.com/29uj8ej;;
0;0;É traumatizante pesquisar algo dessas paradas no google pois só sai coisas ruins, da meio que um medo, mas é normal, tudo tem seus riscos.;;
1;0;If you google for "vote" you can find your polling station! AND YOU SHOULD.;;
0;0;ICO Not Mulling Plan To Act Against Google In Street View Snafu http://bit.ly/cznLHn;;
2;1;Gmail: スレッドの解除が、すべての Google Apps ユーザーで利用可能にhttp://bit.ly/a720pt;;
0;0;The almighty Google assisted me in finding current pictures of Damita from "Class Act." Yes, she is STILL bad.;;
0;0;Google Lat Long: Announcing the Panoramio Photo Contest http://goo.gl/fb/fnJwg;;
0;0;@jjalviarez jorgito a al cpu le instale google chrome y avira el antivirus pero el que dice: avira personal sera ese?;@jjalviarez;
0;0;1) Go to google Maps 2) Go Get Directions 3) Japan as start location and China as End location 4) read number 43;;
0;0;Google - Government on 1 Fav Source+32 others like Electronista- http://bit.ly/a3Uyu4;;
0;0;Google Sues Agency Over Microsoft-only Cloud Deal: A U.S. Department of Interior request for bids for a cloud-base... http://bit.ly/delOeZ;;
0;0;Google Files Suit Against US Govt. Over Contracts: On Friday, Google filed suit against the US government, allegin... http://bit.ly/cQSsO1;;
0;0;Someone searched for "ohlins du788" on Google and landed on http://www.helmetheadcycle.com/product/5031/ohlins-du-788-motorcycle-shock.;;
0;0;Google Brings Artificial Intelligence To GMAIL with Incredible New Web 2 0 'auto responder' technology! http://www.redgage.com/c-kfdeg;;
0;0;Mapenvelope - Cool use of google maps, which turns any location into the inside of an envelope .. http://bit.ly/b6og56;;
0;0;Google makes it easy to find your polling place and voting information. http://maps.google.com/vote;;
0;0;That was fast!! @mr_gentleman @tempoaltempo technically, if this was twitter jeopardy, Linnell got it. #movember google it folks!;@mr_gentleman @tempoaltempo;#movember
0;0;Want To Improve Google Ranking: http://EzineArticles.com/5306179;;
0;0;Google calls bug bounty hunters to YouTube, Blogger: '1337' cash for web flaws Google has unveiled a pilot program... http://bit.ly/bRpqMT;;
0;0;谷歌众包论坛(bbs.pxysm.com) #其他Google应用#Google 网站管理员工具（Webmaster Tools）功能更新：可显示反向链接总数 http://fl5.me/9k55gm;;# #Google
0;0;Google Files Suit Against US Govt. Over Contracts: On Friday, Google filed suit against the US government, allegin... http://bit.ly/aHBjtm;;
0;0;http://esparrelinux.com/estadisticas-google/ eso las estadisticas de este mes #google #estadisticas #esparrelinux .com;;#google #estadisticas #esparrelinux
0;0;@ncbeets Grab the latest beta, then Preferences > Browsers > Install Google Chrome extension.;@ncbeets;
0;0;@edtgraff #sschat I by doing a search on google , got a bbok in every childs langauge, check out the International Digital Library :-);@edtgraff;#sschat
0;0;RT @JasItUp823 : So this haitian dude I met 2 weeks ago blew my phone up today. Buddy mustve called 6 times in 2 hours.< google voice block!;@JasItUp823;
0;0;RT @globovision : Google demanda a un ministerio que privilegió a Microsoft http://bit.ly/dxLipk;@globovision;
0;0;Plz whatever u do don't google "blue waffles" lmfaooo;;
0;0;ICO Not Mulling Plan To Act Against Google In Street View Snafu - ITProPortal http://bit.ly/b2hXZo;;
0;0;@kabekabe159 衛生面的に考えて牛めし大盛＞腹痛い。ふむ、確かに衛星 Google 地図で見ても周囲に何も無いな・・・仕事で行ったお客さんの家があるくらいだ＾～＾学園祭中は大学の食堂は営業無いよね？うちはそうだったけど。変わりに学生の店の怪しい料理があるんだよね;@kabekabe159;
0;0;RT @kiaramy : a next pussyfucker tlkn bout " google it"???...bt a wah nuh duh dem lecturer here man??....*hisss|| ... http://tmi.me/2NcSl;@kiaramy;
0;0;I'll never be a problem gambler. Just had to google myself through placing a bet on the Melbourne Cup. Each way, trifecta, quinella waaat?;;
0;0;Google it* #okbye RT @IWUOHA : Who came up with sch in dis world....abeg!!!! #just wanna know http://myloc.me/dKlBq;@IWUOHA;#okbye #just
0;0;Go to Google Maps and get directions from Japan to China and scroll down to number 43, its funny :);;
0;0;el google chrome es mucho mejor q el internet explorer para twitter:D jajajaja;;
0;0;Google Map of the $278M land (14 acres, near bottom) @Salesforce just bought to build new HQ. AT&T Park at top. http://sn.im/sfdc1101a #sfdc;@Salesforce;#sfdc
0;0;I really need to start reading the items I star in Google Reader;;
0;0;RT @dallasdude612010@Romo_Girl @Jackie_Bob ..well few beers not to bad, to many bad,,dr pepper..sure not good for you.. google it someti...;@dallasdude612010 @Romo_Girl @Jackie_Bob;
0;0;Yes, I just had to google "what do you do when plastic melts in your oven?" Bad mishap when cooking over the weekend :);;
0;0;UPDATE 1- Google gaining on booming smartphone market: By Tarmo Virki, European Technology Corre... http://bit.ly/aGm4HY ... #finance #money;;#finance #money
0;0;Google Reposts Banned Turkish Videos: By MARC CHAMPION ISTANBUL— Google Inc. on Monday appeared to be set for a ren... http://bit.ly/9uLORz;;
1;4;マスコミで理科系用語が出て来た時には、 google よりは、ciniiなどで探した方が冷静に見えると思う。コメンテーターの発言のバックグラウンドを読む為にも。;;
0;0;@BlackDeanMartin what was the name of that google app that allowed you to point at buildings and it would tell you what they were?;@BlackDeanMartin;
0;0;@burzikak From an article I read. MS is the new IBM, Google is the new MS, Facebook is the new Google . They all become the thing they hate.;@burzikak;
0;0;Google 's Top 10 Best (and Worst) Innovations of the Year http:// shar.es/0U0ax;;
0;0;NYU Joins the Google Cloud http://bit.ly/bx7Wxt;;
0;0;On a Budget?: $123.30 - 8" Touch Screen TFT LCD Google Android 2.0 Tablet PC w/ WiFi/Camera (VIA 8505+ 533MHz) http://bit.ly/cwmcyQ;;
0;0;Gmailのメールを Google Tasksのタスクに関連メールとして登録できるのが便利。タスクに関連するメールを探す手間が省ける。;;
0;0;Created a new Google Doc and found that I somehow have @nehindes cover letter from her app to UNC. #weird;@nehindes;#weird
0;0;【定期ポスト②】雫石よしゃれ通り周辺JV　参加店の場所が見れる地図（ Google Map）(PC推奨)　→　http://bit.ly/c5Le0B;;
0;0;Android phones outsell iPhone 2-to-1, says research firm. Google 's OS powers 44% of smartphones sold in U.S. last Qrtr http://retwt.me/1Pt96;;
0;0;Lo bueno es que todavía recordaba cosas, y lo que no, bueno, nada que Google no pueda resolver...;;
0;0;Google - Government on 2 Fav Sources+31 others like CNET: News- http://bit.ly/auzeWg;;
0;0;Google jalouse Microsoft qu'il accuse d'être privilégié par le ministère des Aff. intérieures américain http://bit.ly/cGE40X via @technaute;@technaute;
0;0;Can I disable unwanted Android apps in Froyo?: Smartphone manufacturers, Google , and wireless operators may think ... http://bit.ly/aoO8zN;;
0;0;http://bit.ly/bvkQts Google sues the morons at US Dept of Interior.;;
0;0;@mrlianderson Manda muitos depoimentos no orkut? Procura no google ou cria os… — Mando pra quem me manda. Eu crio. http://4ms.me/c6cf4X;@mrlianderson;
0;0;@JodySparks #8 in Google SERPs for YA Author and #7 in Duck Duck Go. That's a big deal. SHE'S a big deal!;@JodySparks;#8 #7
0;0;[ Google Reader] Report details OS market share in Q3, Android pulls off 10x growth http://dlvr.it/7t5Bb;;
0;0;Google 's Android Software Now 2nd Globally - House and Home Gazette http://ff.im/-t0t6H;;
0;0;Google 's AdMob Integration Is "Just Not Going Great" (GOOG) - San Francisco Chronicle http://ff.im/-t0t6A;;
0;0;グーグル、ウェブビデオソフトウェアWebMを高速化--アヒルの名前を開発コード名に （ZDNet Japan）: Google は、同社のビデオソフトウェア「WebM」に対する初の大規模なアップデートをリリースした。パフォーマンス... http://bit.ly/ckXAud;;
1;0;Google ฟ้องรัฐบาลสหรัฐกรณี Department of Interior ประมูลไม่เปฌนธรรม เอื้อต่อ Microsoft http://bit.ly/dbol8B #ittwt #lawtwit;;#ittwt #lawtwit
0;0;【レビュー】ページのテキストを Google サーバに保存して利用するChromeエクステンション （MYCOM Journal） http://bit.ly/9kwleX;;
0;0;【IT】 グーグル、ウェブビデオソフトウェアWebMを高速化--アヒルの名前を開発コード名に （ZDNet Japan）: Google は、同社のビデオソフトウェア「WebM」に対する初の大規模なアップデートをリリースした。パフ... http://bit.ly/aeKo1n;;
0;0;【レビュー】ページのテキストを Google サーバに保存して利用するChromeエクステンション （MYCOM Journal）: Google Chrome runs web pages and applications wit... http://bit.ly/9kwleX;;
0;0;Google On How Trends Spread: As time goes by, the search index increases down the coasts and finally throughout mu... http://bit.ly/9MgrXq;;
0;0;Google - Government on 3 Fav Sources+30 others like ReadWriteWeb- http://bit.ly/8YRhwD;;
0;0;【IT】 【レビュー】ページのテキストを Google サーバに保存して利用するChromeエクステンション （MYCOM Journal）: Google Chrome runs web pages and application... http://bit.ly/dmxSMI;;
0;0;@SlimFierce google;@SlimFierce;
0;0;Google Sues The US Government For Only Considering Microsoft Solutions | Techdirt http://ff.im/-t0t6y;;
0;0;NYU Joins the Google Cloud - PC Magazine http://ff.im/-t0t6z;;
0;0;Google Files Suit Against US Govt. Over Contracts - PC Magazine http://ff.im/-t0t6I;;
0;0;ICO Not Mulling Plan To Act Against Google In Street View Snafu - ITProPortal http://ff.im/-t0t6D;;
0;0;Google calls bug bounty hunters to YouTube, Blogger - Register http://ff.im/-t0t6C;;
0;0;Introducing the Google APIs console http://ff.im/-t0t6x;;
0;0;Google On How Trends Spread: As time goes by, the search index increases down the coasts and finally throughout mu... http://bit.ly/bGkFh7;;
0;0;New API of the Week: Google Custom Search API - Plus: Google APIs Console http://goo.gl/fb/BbR7w;;
0;0;Google の検索キーワードからRSS引っ張ってるんだけど、今日はアマゾンの送料無料で飽和;;
0;0;The world as the eagle and the wild goose see it http://bit.ly/cEwVY4 #google;;#google
0;0;Google Sues the United States of America http://tiny.ly/B1Ez;;
0;0;@amblass Just the google reader numbers. I don't know how accurate they are and they don't account for everything.;@amblass;
0;0;Pior é que é verdade! rsrs RT @fredesigner : A cabeça de um libriano é mais ou menos assim rsrs RT Google Reader (1000+) http://bit.ly/axKA09;@fredesigner;
0;0;Just installed Traductor de Google http://appaware.org/1z on my #Android - via #AppAware;;#Android #AppAware
0;0;Google is polluting the internet http://ping.fm/8EhQQ;;
0;0;@DamPuchiiBAD_ idk google it;@DamPuchiiBAD_;
0;0;Google is polluting the internet http://ping.fm/ftNWS;;
0;0;Whenever I want to log into my e-mail I find myself typing my password into google #fail;;#fail
0;0;Google Wave Creator Leaves Google Because It’s “Too Unwieldy”- http://bit.ly/9eOrwc;;
0;0;@GaleKittrell The full monty #google;@GaleKittrell;#google
0;0;@GOOGLE _ME_BiSHH haha im just gettin yur reply! and ii know girl! yu had him for a lil minute too :);@GOOGLE;
0;0;RT @effectdesign : 無印から、 Google カレンダーリンク対応無料iPadアプリが出てるんだぁ。 #appjp;@effectdesign;#appjp
1;0;It's so funny how the word 'violence' in French is feminine. Well, according to Google Translate it is...;;
0;0;15 Killer Google Chrome Features You Might Not Know About: Google Chrome has been steadily gaining in the browser ... http://bit.ly/95lPoQ;;
0;0;RT @YourFavWhiteGuy #DrakePunchlines Shes stingy with her love, her heart is frugal / she say she need time to do some soul searchin; Google;@YourFavWhiteGuy;#DrakePunchlines
0;0;He marcado un vídeo como favorito en YouTube. -- 3D Madrid in Google Earth http://youtu.be/THhYSuFUG0k?a;;
0;0;@WinterSpringPro google tv;@WinterSpringPro;
0;0;In Defense of Google and Facebook - New York Magazine http://bit.ly/bqsT6Y;;
0;0;@yrvn Si lo que quieres es un "personal pocket pc", un gamer o social device, seguramente algo de Apple o Google se adapte mejor.;@yrvn;
0;0;@SCRobyn I've never liked allergies either. Google Totallergix, best trick in the book, natural too.;@SCRobyn;
0;0;ブログにエントリ: 【VCGOO注目キーワード】しょっちゅう 漢字 - しょっちゅう 漢字の関連商品検索はタイトルをクリック。【Data from google 】 http://vcgoo.jp/yQG;;
0;0;Passing the torch to the cloud: NYU is going Google : (Cross-posted on the Official Google Blog)The weather report ... http://bit.ly/9yQw2x;;
0;0;Passing the torch to the cloud: NYU is going Google : (Cross-posted on the Official Google Blog)The weather report ... http://bit.ly/cbPwgc;;
0;0;New Alexa Toolbar for Google Chrome! Http://www.leadenhalluk.com/google-chrome-alexa-toolbar;;
0;0;Marc Champion / Wall Street Journal: Google Reposts Barred Turkish Videos  —  Internet giant put... http://bit.ly/ckjmuw [Web News] #Media;;#Media
0;0;Cacete....o Google Buzz ainda existe, mas deve ter sido mais um Wave do Google ..rs ;);;
0;0;@beckylindeman @crystaleyesd By "try"...do you mean " google "? :S;@beckylindeman @crystaleyesd;
0;0;Google 街景店内拍照正式启动: 消息人士称上周起， Google 已经在拍摄街景时对有需要的建筑物里的店家进行拍摄，并上传到 Google 的相关服务，包括搜索结果和 Google Earth上。 Google 将在美国、澳大利亚、日本... http://bit.ly/ctr1oy;;
1;0;Google has acquired 40 companies so far in 2010. Indigestion coming? http://is.gd/gADVl;;
0;0;@_darionDGAF google her;@_darionDGAF;
0;0;Google has acquired 40 companies so far in 2010. Indigestion coming? http://is.gd/gADVl;;
0;0;@poke_now ゼクロム「 google で検索してもそんな言葉でないぞ」;@poke_now;
0;0;Google sues U.S. over government contract exclusion: SAN FRANCISCO (Reuters) - Google is suing t... http://bit.ly/db8rFR #newsupdatesonline;;#newsupdatesonline
0;0;@peterhoneyman Flying Star is our family fav ABQ Cafe. Closest is about 4 mi from Hyatt Tamaya, prob. too far if no car. Google 4 details.;@peterhoneyman;
0;0;Acho que foi a primeira vez na vida que o Google me deixou na mão.;;
0;0;So far, based on my experience, all a website SEO class equals is a lesson in how to use Google tools. Fail. -_-;;
1;0;I keep seeing tweets saying "WHO'S LILY ALLEN?!?11/?1" Omfg. Google it you lazy fucks.;;
0;0;@google _me_bxtch lol lil bit buh you'll lose it cus you'll be tryna catch up wit me wen i dogg you one on one !;@google;
0;0;Google 's Android platform has taken the lead in the U.S. smartphone market, according to several new reports by technology research firms.;;
0;0;[ Google Reader] App Deals of the Day [Dealzmodo] http://dlvr.it/7t58S;;
0;0;Man bites dog? Google sues the government: Heck iPhone is starting to see that now? like the site called jailbreak... http://bit.ly/9bTkZW;;
0;0;[ Google Reader] What Tomorrow's Elections Mean for Science and Technology [Midterm Elections] http://dlvr.it/7t58R;;
0;0;@coldiebear #Microsoft and #Apple have to sue #Google and friends instead of winning customers via innovation. Discuss. :P;@coldiebear;#Microsoft #Apple #Google
0;0;como saber q uma musica foi traduzida pelo google : qndo vc encontra coisas assim with your old Rayban? - Rayban com seu velho?;;
0;0;Google sues DOI over Microsoft-only RFQ bids http://ff.im/-t0t0J;;
0;0;RT @miaminewsnow : Google sues Interior Dept over e-mail bid request http://dlvr.it/7t4QP;@miaminewsnow;
1;0;really thinking I should see wayyyy more #slaprapz posts in my google reader...hmmm;;#slaprapz
0;0;PCもスマフォも Google は着実にシェア伸ばしてるな ※以下引用 Erick Schonfeld 10月のブラウザ戦争の勝者はChrome http://j.mp/aeef84;;
0;0;Hot At Sphinn: Google ?s Eric Schmidt Problem, SEO Mistakes, Social Media Writing & More: http://wp.me/p16CWP-28C;;
0;0;Android Market Roundup for the week: http://bit.ly/dl9fuk Has a pretty extensive look at Navigon vs Google Nav. #shamelessplug;;#shamelessplug
0;0;Google demanda al Gobierno estadounidense por privilegiar a Microsoft: En un concurso convocado por el Depar... http://tinyurl.com/2cy5m2p;;
0;0;[ Google Reader] Check Out the New Ars Technica Reader for iPad [Ipadapps] http://dlvr.it/7t581;;
0;0;[ Google Reader] Arrrgmented Reality T-Shirt [Shirts] http://dlvr.it/7t57r;;
0;0;Strike up the band: over 10 million have gone Google with Apps for Education http://bit.ly/bfGVjB #google;;#google
0;0;GOOGLE ( @dudapaganini live on http://twitcam.com/2kzzc);@dudapaganini;
0;0;@OMG_ITSJOSLYN I bet you do type they name in google !;@OMG_ITSJOSLYN;
0;0;Δημιουργήθηκε η αντί - Google και ονομάζεται Blekko.com: Μια «ανθρωποκεντρική» μηχανή αναζήτησης, που μπλοκάρει τ... http://bit.ly/9QO2uC;;
0;0;#unique Petunjuk Aneh di Google Maps http://tinyurl.com/2fujqbu #top;;#unique #top
0;0;#unique Petunjuk Aneh di Google Maps http://tinyurl.com/2fujqbu #top;;#unique #top
0;0;#unique Petunjuk Aneh di Google Maps http://tinyurl.com/2fujqbu #top;;#unique #top
0;0;#unique Petunjuk Aneh di Google Maps http://tinyurl.com/2fujqbu #top;;#unique #top
0;0;#unique Petunjuk Aneh di Google Maps http://tinyurl.com/2fujqbu #top;;#unique #top
0;0;Apple, Google Interested In Mobile Payment Startup BOKU And Its ... http://bit.ly/9eGHye;;
0;0;Google Extends Security Reward Program: Google expands a rewards program that is designed to compensate hackers w... http://nyti.ms/cqzUpA;;
0;0;@ReimaryRdgz sii ando bn inspirada.... ( google ) jajajjajaja XD;@ReimaryRdgz;
0;0;queria desenhar/pintar meu próprio tema pro google chrome.;;
0;0;Qual o melhor navegador que existe?? — Google Chrome http://4ms.me/aoITgy;;
0;0;@Barbara_Landim jogo no google e entro nos sites..;@Barbara_Landim;
0;0;just google earth'd the 2nd happiest place on earth and im still sad, that's saying something....;;
0;0;A cabeça de um libriano é mais ou menos assim rsrs RT Google Reader (1000+) http://bit.ly/axKA09;;
0;0;i'm putting bad word in the google translator and its funny play it out lound;;
0;0;hi Android Tops Apple, RIM in US Smartphone Market Share: Google 's Android operating system had a successful third... http://bit.ly/13rtYI;;
0;0;How To Make Money Online Advertising For Free On Youtube Google ...: GlobalDomainsInternationalWebsite.ws How To M... http://bit.ly/cb9GjZ;;
0;0;♺ @schestowitz : #Google Sues US Gov't For Only Considering #Microsoft http://ur1.ca/28ql2 "when it rains, it pours";@schestowitz;#Google #Microsoft
0;0;In 1928, René Magritte envisioned the limitations of Google Goggles. http://en.wikipedia.org/wiki/The_Treachery_of_Images;;
0;0;@Gui_Muniz procura no Google;@Gui_Muniz;
0;0;que honra fui citado no post \o/ #gddbr RT @chesterbr : Google Developer Day 2010 http://bit.ly/aTy34V - blog do chester;@chesterbr;#gddbr
0;0;Google Code Blog:Introducing the Google APIs Console and our latest API updates  —  After a bus... http://bit.ly/aLUiNH [Web News] #Media;;#Media
0;0;[HQYB] Google 起诉美国: 那是没有疑义一块唯一细片我得到投入OSNews的最令人敬畏的标题。 这个标题是，很令人敬畏我甚而不需要写别的，因为它从awesomeness将减去。 暗示约翰尼吉他，当一个孤立流浪汉乘坐他的... http://bit.ly/d2d7kx;;
0;0;Google SPORTSPAGE with Joe o'neill and click on the USTREAM LINK RIGHT NOW!....WE ARE LIVE;;
0;0;確かに今のところ要らないが、全部から選ばせようとしたらハードウェアが追い付かない。だから、国内メーカーも google TVもあのくらいなんでしょ。 http://bit.ly/aHGcVO;;
0;0;Apple, Google Interested In Mobile Payment Startup BOKU And Its ... http://bit.ly/9L441M;;
0;0;Google Reposts Barred Turkish Videos (Marc Champion/Wall Street Journal): Marc Champion / Wall Street Journal:Go... http://bit.ly/95xPBt;;
0;0;Introducing the Google APIs Console and our latest API updates ( Google Code Blog): Google Code Blog:Introducing ... http://bit.ly/cWAVlS;;
0;0;Google Reposts Barred Turkish Videos (Marc Champion/Wall Street Journal): Marc Champion / Wall Street Journal:Go... http://bit.ly/dfAYQx;;
0;0;Techmeme | Google Reposts Barred Turkish Videos (Marc Champion/Wall Street Journal) http://bit.ly/95xPBt via adamsafire.com;;
0;0;Google Reposts Barred Turkish Videos (Marc Champion/Wall Street Journal): Marc Champion / Wall Street Journal:Go... http://bit.ly/95xPBt;;
0;0;Techmeme | Introducing the Google APIs Console and our latest API updates ( Google Code Blog) http://bit.ly/cWAVlS via adamsafire.com;;
0;0;Internet Marketing: Introducing the Google APIs Console and our latest API updates ( Google Code Blog) http://bit.ly/aTghvJ #getfound;;#getfound
0;0;Introducing the Google APIs Console and our latest API updates ( Google Code Blog) http://bit.ly/cWAVlS;;
0;0;Introducing the Google APIs Console and our latest API updates ( Google Code Blog): Google Code Blog:Introducing ... http://bit.ly/aeOpHO;;
0;0;Introducing the Google APIs Console and our latest API updates ( Google Code Blog): Google Code Blog:Introducing ... http://bit.ly/cWAVlS;;
0;0;Techmeme: Google Reposts Barred Turkish Videos (Marc Champion/Wall Street Journal): Marc Champion / Wall Street ... http://bit.ly/dfAYQx;;
0;0;Techmeme: Google Reposts Barred Turkish Videos (Marc Champion/Wall Street Journal) http://bit.ly/95xPBt #tech #news;;#tech #news
0;0;TECHMEME- Introducing the Google APIs Console and our latest API updates ( Google Code Blog): Google Code Blog:In... http://bit.ly/cWAVlS;;
0;0;Google Reposts Barred Turkish Videos (Marc Champion/Wall Street Journal) http://bit.ly/98z3cF;;
0;0;Introducing the Google APIs Console and our latest API updates ( Google Code Blog): Google Code Blog:Introduc... http://bit.ly/cWAVlS twfd;;
0;0;Google Reposts Barred Turkish Videos (Marc Champion/Wall Street Journal): Marc Champion / Wall Street Journal:Go... http://bit.ly/dfAYQx;;
0;0;The MBNonline.com... Google Reposts Barred Turkish Videos (Marc Champion/Wall Street Journal): Marc Champion / W... http://bit.ly/dfAYQx;;
0;0;Introducing the Google APIs Console and our latest API updates ( Google Code Blog) http://tinyurl.com/28898ao;;
0;0;Google Reposts Barred Turkish Videos (Marc Champion/Wall Street Journal): Marc Champion / Wall Street J... http://bit.ly/95xPBt ^DigiCura;;
0;0;Techmeme: Introducing the Google APIs Console and our latest API updates ( Google Code Blog): Google Code Blog:In... http://bit.ly/aeOpHO;;
0;0;[Techmeme] Google Reposts Barred Turkish Videos (Marc Champion/Wall Street Journal): Marc Champion / Wall Street... http://bit.ly/dfAYQx;;
0;0;Techmeme: Introducing the Google APIs Console and our latest API updates ( Google Code Blog) http://bit.ly/cWAVlS #tech #news;;#tech #news
0;0;Introducing the Google APIs Console and our latest API updates ( Google Code Blog): Google Code Blog:Int... http://bit.ly/cWAVlS ^DigiCura;;
0;0;Introducing the Google APIs Console and our latest API updates ( Google Code Blog) http://bit.ly/dnhdaL;;
0;0;Google Reposts Barred Turkish Videos (Marc Champion/Wall Street Journal): Marc Champion / Wall Street Journal:Go... http://bit.ly/dfAYQx;;
0;0;Introducing the Google APIs Console and our latest API updates ( Google Code Blog): Google Code Blog:Introducing ... http://bit.ly/aeOpHO;;
0;0;Google Reposts Barred Turkish Videos (Marc Champion/Wall Street Journal): Marc Champion / Wall Street Journal:Go... http://bit.ly/dfAYQx;;
0;0;[Techmeme] Introducing the Google APIs Console and our latest API updates ( Google Code Blog): Google Code Blog:I... http://bit.ly/aeOpHO;;
0;0;Google Reposts Barred Turkish Videos (Marc Champion/Wall Street Journal): Marc Champion / Wall Street Journal:Go... http://bit.ly/dfAYQx;;
0;0;The MBNonline.com... Introducing the Google APIs Console and our latest API updates ( Google Code Blog): Google C... http://bit.ly/aeOpHO;;
1;0;Introducing the Google APIs Console and our latest API updates ( Google Code Blog): Google Code Blog:Introducing ... http://bit.ly/aeOpHO;;
0;0;Introducing the Google APIs Console and our latest API updates ( Google Code Blog): Google Code Blog:Introducing ... http://bit.ly/aeOpHO;;
0;0;Introducing the Google APIs Console and our latest API updates ( Google Code Blog): Google Code Blog:Introducing ... http://bit.ly/aeOpHO;;
0;0;Introducing the Google APIs Console and our latest API updates ( Google Code Blog): Google Code Blog:Introducing ... http://bit.ly/aeOpHO;;
0;0;If you can't figure out how to Google , just ring your call button and Tommy will come back there and hit you on the head with a tack hammer.;;
0;0;@HumbertoEsparza hasta lástima me da usar microsegundos de procesamiento de los servidores de google para eso jaja;@HumbertoEsparza;
0;0;Google Docs dkmanlarn pdf formatnda indirme http://ff.im/-t0t8Y;;
0;0;Google URL Kısaltma Servisi http://ff.im/-t0t8T;;
