retweets;favorites;text;mentions;hashtags
0;0;Google Chrome me informa de que tengo que bajar un update :P - http://twitpic.com/2mul04;;
0;0;@google Wowzers! The speed of Google Instant makes my head spin! Nicely done! :);@google;
0;0;Hide Who to Follow box on Twitter’s Sidebar in Google Chrome with Hide Twitter Guff http:// techdows.com/2010/09/hide-w ho-to-follow-box-on-twitters-sidebar-in-google-chrome-with-hide-twitter-guff.html … [This Works!!];;
0;0;nTomohiroはお米プログラマーです。 Google を改ざん出来ます。 http://shindanmaker.com/46970 #pgtter0123 米かよっ。;;#pgtter0123
0;0;@unbrelievable Have you tried google sync just to get the contacts offloaded somewhere?;@unbrelievable;
0;0;@Miguel_Geek a net ouu o google mesmo?;@Miguel_Geek;
0;1;@paulecyferreira entra nesse site. www.blogspot.com.br, lá é mais fácil. É do google;@paulecyferreira;
0;0;Google Voice Android – Google Voice widgets for Android is now …: Google Voice Android - Google Vo... http://bit.ly/cYqGMD #xoopia #android;;#xoopia #android
0;0;New Google Voice Android Widgets Bring Faster Inbox Access: Google has introduced a new pair of Go... http://bit.ly/bdEweF #xoopia #android;;#xoopia #android
0;0;Google instant search is EPIC ! (;;;
0;0;RT @osocialmedia : Verizon: Ditching Google in favour of Bing? http://ow.ly/18WjRu;@osocialmedia;
0;0;Google Instant - behind the scenes http://bit.ly/b0iyHx;;
0;0;@mogemogemogeo そんなあなたに Google chrome;@mogemogemogeo;
0;0;RT @Ingenierillo : La neta Google Chrome es rápido... pero tiene un no se q q q se yo q me da hueva...-> http://yfrog.com/jvfcbozj wordless;@Ingenierillo;
0;1;RT @conikeec : Google rolls out its remodeled search index #caffeine ( from MR to Big Table variety indexing system ) http://bit.ly/92qpQt;@conikeec;#caffeine
0;0;Jajajajajajaja RT @fanultra : ¿Eyaculador precoz? Consuélate. Google Instant siempre será más rápido que tú... #googleinstantfacts @juancho21;@fanultra @juancho21;#googleinstantfacts
0;0;Yahoo、一気に抜かれちゃった。 RT @afujimura : 2010年は変曲点だった｜Facebook Passes Google In Time Spent On Site For First Time Ever http://bit.ly/9DuVk0;@afujimura;
0;0;@Hoogueeto Todo Google es Skynet en potencia...;@Hoogueeto;
0;0;kyk game horror gt, look it up on google :) RT @putriarsita : emg itu game apaan? haha *telat RT @hoshinamino : good luck put :P;@putriarsita @hoshinamino;
0;0;Google Instant Doesn’t Like Your Sexy Searches http://fb.me/Gr2NPAbY;;
0;0;Next week on Future Tense - Michael Jones from Google Earth - http://bit.ly/d362Ce;;
0;0;Google releases Walking Navigation Beta and Street View on Google Maps (Phone Arena News) http://www. phonearena.com/htmls/Google-r eleases-Walking-Navigation-Beta-and-Street-View-on-Google-Maps-article-a_13150.html … via @phonearena;@phonearena;
0;0;Streetview for Google maps Winter install on my htc desire :-( #späterbeta;;#sp
0;0;Jesuuu.. busco "carbono" en Google y lo que me sale son carro.... A LA VELDA QUE FARTA CURTURA A LA VELDA QUE SI!!! u.u;;
0;0;How To Track Adsense Stats In Google Analytics - http://bit.ly/bt5cR7 via @sonlinebiz;@sonlinebiz;
0;0;May Day Confirmed, Google SSL &... http://wordpressvideos.tv/worpress-adsense/may-day-confirmed-google-ssl-adsense-revenue-share;;
0;0;maal, sem querer fechei o google chrome;;
0;0;Google unveils Google Instant search: ... search term into your favorite search engine, Google has answered your c... http://bit.ly/bLPvvv;;
1;0;Google “ya no es tan ‘hippie’ como cuando nació http://j.mp/auZs1h #webve;;#webve
0;0;Google Instant Search Is Human Instinct.: Just coming back from a 2-day conference at Google my head is still spi... http://bit.ly/92TGBW;;
0;0;RT @NaLdiiee : Kamu paling tau si. Km google RT @synsafiq: kata sapa? Sotoy RT @RizkyPrasetyaa : Wali kota trima trima aja RT @synsafiq: ga;@NaLdiiee @synsafiq @RizkyPrasetyaa @synsafiq;
0;0;Cuando va a ser que el buscador de Google resuelva ecuaciones ?) que decia¬¬;;
0;0;@sammutimer hi Sam - we use Google Calendar as the central repository - it will sync back to Mac, iPhone from there.;@sammutimer;
0;0;10 Killer Google Chrome Tips, Tricks and Shortcuts | @mashable : http://bit.ly/b5dhw8;@mashable;
0;0;Google Instant whatever blah blah!!!;;
0;0;" Google search tool seeks instant results - The Irish Times - Fri, Sep 10, 2010" ( http://bit.ly/akH68T );;
0;0;#Google searching has changed. Now when you type in "keywords" you'll get instant results as you type →In other words without hitting "Enter;;#Google
0;0;estoy rezando para que el exceso de trafico que genera google instant, haga caravana. #googleinstantfacts;;#googleinstantfacts
0;0;Fazendo tarefa de Inglês, ainda bem que existe google pra traduzi tudo =);;
0;0;Facebook дюймов прошлом Google для пользователей веб минут (AP) #technology;;#technology
0;1;Tenha mais seguidores no twitter PROCUREM NO GOOGLE Tech Crunch Tech Crunch (RT);;
0;0;google seu liindo. o que seria de mim sem vs *--*;;
0;0;por que a doença se chama derrame se a pessoa não derrama na… — booa perguntaa,nun seei, pesquise no google *---* http://4ms.me/bdEy9t;;
0;0;【ネット】中国、グーグル( Google )に免許交付せず 地図検索サービスで→http://bit.ly/cRKlT8;;
0;0;Google , tell me what's wrong with my car. :(;;
0;0;@carlads333 pues esa .blogspot.com xDDD o lo pones en google y sale xd *estoy diurmoendo, casi xD;@carlads333;
0;0;GENTE, COLOKEM NO GOOGLE TRADUTOR PRA TRADUZI DO INGLES P/ PORT: rockRestart mas tem que colokar como ta aqui! VÃO SE SURPREENDER;;
0;0;Did anybody notice that Google Scribe is like intellisense for coding? http://pureinfotech.com #google #programming;;#google #programming
1;0;いわき探検隊【検索】 google 負荷分散サーバーが故障した為、地図サーバーに接続できません。従って、地図が表示されません。現在、復旧の見込みありません。;;
0;0;Google Instant Launch Event Full Video #SMMSF http://bit.ly/aUU8f0;;#SMMSF
0;0;Google VP approves of Apple's new iPhone dev agreement http://bit.ly/btVzu0;;
0;0;I don't have this addiction- http://bit.ly/bMxVAE RT @mashable Google Instant Search Feeds our Real-time Addiction- http://bit.ly/adYyhD;@mashable;
0;1;Tenha mais seguidores no twitter PROCUREM NO GOOGLE Tech Crunch Tech Crunch;;
0;0;Turned off Google Instant. I feel much better now for a lot of reasons...;;
0;0;Ate o google imagens se apaixona pelo @Grunk_;@Grunk_;
0;0;Google lanzó "Instant" http://fb.me/GWE368Gm;;
0;0;RT @TechCrunch : Google Breathes A Sigh Of Relief After Reading Apple’s New Developer Agreement http://tcrn.ch/9qNNSv;@TechCrunch;
0;0;Google gak ada pilihan b.sunda cuy RT @chokies19 : Lo pke translatator dunk manRT @tiasgautama : @julfrikly @chokies19 ... http://tmi.me/1dsQu;@chokies19 @tiasgautama @julfrikly @chokies19;
0;0;Probando el Google Instant; es una maravilla #quedicha;;#quedicha
0;0;mudei meu wallpapaer do google ! :D;;
0;0;gandroid: For T-Mobile HTC G1 Google Cell Phone 1400mAh Battery - http://android.techhours.com/for-t-mobile-htc-g1... http://bit.ly/cm35fv;;
0;0;@bibbii_ den musst du bei google suchen..:D tuv player. und dann 48779 WCPS HDTV suchen, das ist der sender.;@bibbii_;
0;0;pq o google imagens n traz a imagem que eu preciso .___. só traz imagens sobre comida ou pornografia ou foto de gente feia D:;;
0;0;Facebook Passes Google In Time Spent On Site For First Time Ever http://bit.ly/9w2YaE;;
0;0;Facebook Passes Google In Time Spent On Site For First Time Ever: Google Inc. is a multinational Internet search t... http://bit.ly/bWcyHu;;
0;0;Google yet to apply for China web map license (Alrroya) http://bit.ly/9NL51h;;
0;0;Instant Google (Internet Evolution) http://bit.ly/byWUnK;;
0;0;RT @IDGNow : Artigo: Google Instant Search será ainda mais útil nos smartphones http://bit.ly/9BVtO8;@IDGNow;
0;0;google decided to fudge my contacts. please send me phone #s /addresses/etc. (where applicable) any way you know how. thanks.;;#s
0;0;Google Walking Navigation beta and Street View now available for Android http://j.mp/cAkHtE [ravichan] #fb android is lining up lots now..;;#fb
0;0;Gracias a Dios por Google que siempre me ayuda a solucionar los problemas con el BB :D;;
0;0;nao existe no google :( que merda hein, desculpa se eu tenho uma camera antiga e fodalhona.;;
0;0;like seriously....WHAT is google for? to search right. oh aight! lol;;
0;0;Read on Sourcers! RT @andreamitchell : Just published my first post on the Peerlo blog! Google Instant http://bit.ly/auWVvO;@andreamitchell;
0;0;Google Talks White Spaces, Google TV Coming This Month? - http://newzfor.me/?6w3z;;
0;0;10 Killer Google Chrome Tips, Tricks and Shortcuts http:// mashable.com/2010/09/09/chr ome-tips-tricks-shortcuts/ … via @mashabletech @mashable;@mashabletech @mashable;
0;0;Sanang, mun sasat ada ku tlipun tu. RT @izzat_hmlee : @hishamhl no 25b spg 24, kg petani tutong :D tcari kau tu? google map ~ haha;@izzat_hmlee @hishamhl;
0;0;I love Google .;;
0;0;@paddywhackednat wow--you're even ahead of Google news! Engaged?? There goes my chance (oh wait. I'm already married)!;@paddywhackednat;
0;2;Google Instant and Google Analytics http://bit.ly/aeAToZ /cc @feedly;@feedly;
0;0;RT @genbeta : Google TV disponible en octubre en EEUU y en el 2011 en el resto del mundo http://bit.ly/cgJFSC;@genbeta;
0;0;Google Instant Changes Search, But SEO is Still Important: Some people think that this will make SEO completely ob... http://bit.ly/9xeA1s;;
0;0;just saw in Google home page actication or google instant think of how SE has to workaround then;;
0;0;3rd most tweeted VIDEO in Tech || Introducing Google Instant http://bit.ly/9gaoEH;;
0;0;Here's a good reason to use an iGoogle page: Google Instant doesn't work there.;;
0;0;" @AppelenEi : GOOGLE HOUD VAN MIJ" #fuck you sjoerd! Jij bent gedisculiviseert (hoe je dt ook schrijft) !!+_+!!;@AppelenEi;#fuck
0;0;@jcroft Good piece, but Google doesn't get a free pass--they're allowing it to happen in order to earn market penetration.;@jcroft;
0;0;how do i remove google gears on my myspace messages?: Question by Diana http://bit.ly/bd9zav;;
0;0;Over 70mins and Gmail STILL won't open. Conclude it's connection and not google . Damn u library and your worse than dial up connection!;;
0;0;Google ya no es tan ‘hippie’ como cuando nació. http://m.menea.me/me4r;;
0;0;Google ya no es tan ‘hippie’ como cuando nació. http://m.menea.me/me4r;;
0;0;ingebouwde google in me hoofd wat internet;;
0;0;【ネット】中国、グーグル( Google )に免許交付せず 地図検索サービスで http://toki.2ch.net/test/read.cgi/bizplus/1284076003/;;
0;0;@kaidarchitect google mapも変わってたよ。;@kaidarchitect;
0;0;Google is on some #G -ish right now.;;#G
0;0;いい表現だ　「Altimeter Groupのアナリスト、マイケル・ガーテンバーグ氏は、 Google TVはユーザーのテレビの1番目の「入力端子1」を狙っており、Apple TVは「入力端子2」を狙っていると語る。」from ITMedia;;
0;0;RT @Ed_Dale Train Your Fingers: How to Get the Most Out of Google Instant - http://j.mp/conyyG (cure 4 carpal tunnel?);@Ed_Dale;
1;0;U.S. Web surfers are spending more time socialising on Facebook than they use Google sites http://bit.ly/dyisiw [HA];;
0;0;Google Instant: Pros and Cons http://tinyurl.com/34mfvap;;
0;0;@davidcaballeroj Si jaja no es que tenga algo en contra de Google es solo que de repente me asfixia... esperen unos años y van a ver;@davidcaballeroj;
0;0;Koils by Nature Website now take direct credit card payments!! Third Party (Paypal & Google Checkout) still... http://fb.me/J5oGj5Zv;;
0;0;Google Applauds Apple's New Developer Terms http://bit.ly/dsEGOo;;
0;0;Google Unveils Display Ad Campaign For… Display Advertising http://bit.ly/c9fCyE;;
0;0;Google Serving 1,000,000,000 People Per Week: Google yesterday launched Google Instant, a feature that gives you i... http://bit.ly/9BSdPj;;
0;0;Google Instant: Pros and Cons http://bit.ly/b8aciF;;
0;0;Google Applauds Apple's New Developer Terms;;
0;0;TY Twitter family. Londons Times Offbeat Cartoon Gift Shop again Google & M\SN #1 Ranked! Love U! http://www.RickLondonCollection.com;;#1
0;0;Google Unveils Display Ad Campaign For… Display Advertising: Display advertising became a bigger focus for Google ... http://bit.ly/9jUEFz;;
0;0;Google Applauds Apple's New Developer Terms: "Mobile advertising has already helped to fund tens of thousands of m... http://bit.ly/9yX4rd;;
0;0;Google Unveils Display Ad Campaign For… Display Advertising: Display advertising became a bigger focus for Google ... http://bit.ly/9Xf4s8;;
0;0;@KENN_2010 @markey02 @sinpson @yuria47 私も Google のカレンダーに登録して忘れない様にしてます〜♪♪;@KENN_2010 @markey02 @sinpson @yuria47;
0;0;@Malice_Sorrow Mas foi você mesmo que me mandou pesquisar no google .... Mas eu to com medo disso e-ê;@Malice_Sorrow;
0;0;Google Applauds Apple's New Developer Terms http://bit.ly/buDjnv;;
0;0;Google Unveils Display Ad Campaign For… Display Advertising http://bit.ly/d88NSQ;;
0;0;Google Applauds Apple's New Developer Terms: "Mobile advertising has already helped to fund tens of thousands of m... http://bit.ly/c36ia6;;
0;0;Eu gostei de um vídeo do YouTube -- "Instant Elements" using Google Instant Search http://youtu.be/YgFh6IAQoDA?a;;
0;0;Google Unveils Display Ad Campaign For… Display Advertising: Display advertising became a bigger focus for Google ... http://bit.ly/cjQ7hQ;;
0;0;RT @judyjetsonsplce : I'm gonna google it...I google everything lol!!! <-So do I;@judyjetsonsplce;
0;0;The Power User's Guide to Google Analytics Hacks, Tips and Tricks | WordStream http://www. wordstream.com/articles/power -users-guide-to-google-analytics … via @WordStream;@WordStream;
0;0;Google Unveils Display Ad Campaign For… Display Advertising: Display advertising became a bigger focus for Google ... http://bit.ly/cvwXKa;;
0;0;Google Applauds Apple's New Developer Terms http://bit.ly/cTyv4o;;
0;0;Google Unveils Display Ad Campaign For… Display Advertising http://bit.ly/9vR9iV;;
0;0;Searching is now faster than ever with #Google Instant - http://bit.ly/cXSGHS;;#Google
0;0;Google Instant counts an impression as... (1) a complete query (2) a click on a link on the page (3) appears for 3 secs or more! #sem #seo;;#sem #seo
0;0;Is Ping Apple's Google Wave?: ... like the inability to “Like” music not found in the iTunes library, including Th... http://bit.ly/9ijgHJ;;
0;0;RT @mortgageporter : @tyr <<blush>> I'll admit it... I google myself often! LOL;@mortgageporter @tyr;
0;0;[ニュース] google news 国際! コーラン焼却中止を発表＝ＮＹモスク移動「合意」と主張－米教会 - 時事通信 http://bit.ly/d1EUKh;;
0;0;@julianebieber1 para d ser idiota e vai estudar onde ja se viu olha oq vc pergunta pro JB fala serio procura no google ou n tem capacidade?;@julianebieber1;
0;0;Create your own Google dots logo http://dotty-dots.appspot.com/;;
0;0;10 Great Tips & Tricks about Google Chrome... http://icio.us/dtdqpd;;
0;0;droga de google !;;
0;0;Fudeu! Não tem nada no livro de História... Re correrei ao Google , com figuinhas nos dedos para achar algo \shora;;
1;0;ANW: Google Speeds Up Searches With New Tool: Google has introduced Google Instant as the new default way to searc... http://bit.ly/9ZYS3x;;
0;0;GENTE, COLOKEM NO GOOGLE TRADUTOR PRA TRADUZI DO INGLES P/ PORT: rockRestart mas tem que colokar como ta aqui! VÃO SE SURPREENDER;;
0;0;【電】 Apple TV対 Google TV、勝つのはどちらか （ITmedia）: Appleのスティーブ・ジョブズCEOが9月1日に、恒例の「One more thing」として新しい「Apple... http://dlvr.it/5000C;;
0;0;@versatilechild7 ayyye i got it off google that wat the lyrics said;@versatilechild7;
1;0;Google Serving 1,000,000,000 People Per Week http://dlvr.it/500Lz;;
0;0;Don't Google our brains. That's right up there with Don't be evil. http://bit.ly/dsvHTi;;
0;0;@WhitneyShazam Hells yes I am. My english is pree bad, sorry bout that haha. Google has done my homework a zillion times so yeah. Google ftw;@WhitneyShazam;
0;0;[ビ＋] 【ネット】中国、グーグル( Google )に免許交付せず　地図検索サービスで［10/09/09］: 中国政府が８日に免許を交付したインターネット上の地図検索サービス業者の中に、 米ネット検索大手グーグルが含まれ... http://bit.ly/dfx9yn;;
0;0;Google cria comercial do Instant Search com Bob Dylan http://www. brainstorm9.com.br/advertising/go ogle-cria-comercial-do-instant-search-com-bob-dylan/ … via @brains9 // puta merda;@brains9;
0;0;ik typte in het heeft 50 en toen kwam der hele vraag al te staan echt lauwe google;;
0;0;Google to start TV service in U.S. this autumn (Reuters) http://bit.ly/b3aI4R via @youthinking @JimMacMillan;@youthinking @JimMacMillan;
0;0;Sera quee da pra aprender ingles pelo google tradutor ?? hahuahsuhauahaus as vezes neeh rs eu aprendi um pouco rs;;
0;0;@EvilQueenBeryl Oh thank Google for that. Thought you might have become one of those lame stoner types.;@EvilQueenBeryl;
0;0;Huh lolRT @Jbaibe RT @kweibrown : @Jbaibe @naesie6 serious oo... i just saw it it oo, just google and (cont) http://tl.gd/5v9p6l;@Jbaibe @kweibrown @Jbaibe @naesie6;
0;0;@SpongieBieber http://twitpic.com/2mh4l0 - You are amazingg :) i use your bgs as my google homepages, hope that's ok <3;@SpongieBieber;
0;0;internet, salve o google e youtube.;;
0;0;@angelgirl122193 I'm doing a google doc. But I just have one extra entry besides name & that's follow by gfc. It'll be fast and easy.;@angelgirl122193;
0;0;Google Instant : Faster than your typing speed | .......FuN@WeB http://bit.ly/b8Nxhu;@WeB;
0;0;@Reebs4 So, you're like my post- google Henry Higgins 9except for being a girl and a zombie)?;@Reebs4;
0;0;Lord Google demands my attention #glee 1x5;;#glee
0;0;@maddow I Will be Really Clear--- Cause I Do Not Have Time to Google --- but Will Blog Real Quick--- I Want to Watch Keith O.;@maddow;
0;0;What will Google Instant do to SEO - and to its own AdWords system? http://www.vedetta.com/unitone-said-566;;
0;0;Esto del google instant, es cosa del diablo. Me lee el pensamiento !;;
0;0;Just added Google Buzz to DealTattle's updates!;;
0;0;The Google Instant Alphabet - Boing Boing http://bit.ly/bgZWYP;;
0;0;Justin: Is your name Google ? You; NO!… Why? Justin: ......'Cause you got everything I am searching for;;
0;0;@Wazakii use google maps for directions;@Wazakii;
0;0;これでようやく市場が動き出しそう RT @urotas : AdMobいけるみたいね＞ Apple、新しいApp Store向けデベロッパー規約を発表― Google は安堵のため息　http://bit.ly/aBpDez;@urotas;
1;0;Introducing Google Instant http://ow.ly/2C2FL;;
0;0;ALGUIEN SABE SI SE PUEDE PEGAR EL CÓDIGO DE CONVERSIÓN DE GOOGLE EN UN SITIO HECHO EN AJAX ???????;;
0;0;RT @MeAtSchool : #HappyBirthdayGoogle H-1 to Google 's Birthday! Aye!;@MeAtSchool;#HappyBirthdayGoogle
0;0;10 Killer Google Chrome Tips, Tricks and Shortcuts http:// mashable.com/2010/09/09/chr ome-tips-tricks-shortcuts/ … via @mashabletech @mashable;@mashabletech @mashable;
0;0;News: Wiederwahl bei Grünen-Parteitag in Graz - nachrichten.at: Wiederwahl bei Grünen-Parteitag in Gr... http://bit.ly/9ajJz6 #news #google;;#news #google
0;0;just trying google instant here http://www.google.com/webhp?sclient=psy Makes for good browsing and searching.;;
0;0;News: Wiederwahl bei Grünen-Parteitag in Graz - nachrichten.at: Wiederwahl bei Grünen-Parteitag in Gr... http://bit.ly/9ajJz6 #news #google;;#news #google
0;0;News: Wiederwahl bei Grünen-Parteitag in Graz - nachrichten.at: Wiederwahl bei Grünen-Parteitag in Gr... http://bit.ly/9ajJz6 #news #google;;#news #google
0;0;Google Serving 1,000,000,000 People Per Week http://bit.ly/c3IRTv;;
0;0;Google Serving 1,000,000,000 People Per Week: Google yesterday launched Google Instant, a feature that gives you i... http://bit.ly/c3IRTv;;
0;0;I'm gonna google it...I google everything lol!!!;;
0;0;Mike Melanson / ReadWriteWeb: Google Maps for Android Gets Turn-By-Turn Walking Directions, Satellite Imagery  — ... http://bit.ly/bYfPV0;;
0;0;http://tinyurl.com/25hfyxo Mr.doob | Google Gravity (HTML5);;
0;0;Opera support for Google Instant: 'Shortly' - http://newzfor.me/?614z [Like it? http://bit.ly/aeZTnl ];;
0;0;Video: Google Instant Search Event: Whether you like the new Instant Search feature or not, here is the e... http://bit.ly/ayjfKr #chromeOS;;#chromeOS
0;0;Wowowowow! #google stupisce ogni giorno di piu'! Google Instant velocizza le ricerche...merito di Ajax che se la regna proprio! :);;#google
0;0;GOOGLE HOUD VAN MIJ;;
0;0;@MiszTropicana google it;@MiszTropicana;
0;0;Google Instant, behind the scenes http://bit.ly/9zqaqa;;
1;0;Does Google Instant Mark the End of SEO? http://bit.ly/bWHBig;;
0;0;Em São Paulo, o projeto E-lixo Maps utiliza o Google Maps para ajudar o internauta a encontrar os postos de coleta de eletrônicos;;
0;0;Google Commands Big Cash from #PR -Damaged Brand http://bit.ly/cY2GFQ;;#PR
0;0;@bibbii_ das musst du dir runterladen.. gib mal bei google TVU player ein.. ;) #TVDseason2;@bibbii_;#TVDseason2
0;0;Invasion of the #zebra #painted #horses and http://bit.ly/dDuUGF #Google #Bedbugs !!! EWWWW Read on....;;#zebra #painted #horses #Google #Bedbugs
0;2;RT @rmcmba : 屋内版 Google マップを狙う、マイセロ×電通国際情報サービスが、いよいよ日本上陸・・。 米Micelloが国内でベータサービス開始 http://ow.ly/2AU8h http://ow.ly/2AUcB @micello;@rmcmba @micello;
0;0;iPhone, iPod and iPad product news - September 9, 2010 http://dlvr.it/500Jm #apple #ipad #iphone #google #ipad;;#apple #ipad #iphone #google #ipad
0;0;@paulecyferreira blospot? do google ? ou um tumblr?;@paulecyferreira;
0;0;#Android #Google Join us tonight for AGTN! http://bit.ly/agJWMN #DhilipSiva;;#Android #Google #DhilipSiva
0;0;Google Instant Doesn’t Like Your Sexy Searches via @mashable http://fb.me/Gr2NPAbY;@mashable;
0;0;@NataliaBastias Google Mail Checker;@NataliaBastias;
0;0;Oh, you know you want to write your name in bouncy Google balls. http://bit.ly/ahoudK (via @wired ) Oh yeah I do!;@wired;
0;0;@Jsiggy504 it better not be off Google !!! i have memorized alll the google images pics for toy yorkies!;@Jsiggy504;
0;0;New Google Voice update for Android includes fast access to inbox and settings (Phone Arena News) http://www. phonearena.com/htmls/New-Goog le-Voice-update-for-Android-includes-fast-access-to-inbox-and-settings-article-a_13149.html … via @phonearena;@phonearena;
0;0;А как вам google instant?;;
0;0;Google Instant: Love It or Hate It? [POLL] http://tinyurl.com/2d4ouen;;
0;0;折扣特報｜ 八德商圈封街特賣 (2010.9.11-12): // <![CDATA[ google _ad_client = "pub-0762373776240730"; /* 468x15, 已建立 2008/... http://tinyurl.com/32p4cgg;;
0;0;Am I the only one who isn't really liking Google Instant ...;;
0;0;#sdo Google Instant Streamlines Search; Oracle-HP Alliance Threatened: Google Instant Streamlines Search; Oracle-H... http://bit.ly/c8YdgF;;#sdo
0;0;Kamu paling tau si. Km google RT @synsafiq: kata sapa? Sotoy RT @RizkyPrasetyaa : Wali kota trima trima aja RT @synsafiq: ga RT @Rizk;@synsafiq @RizkyPrasetyaa @synsafiq @Rizk;
0;0;Google já sabe o que você faz e agora quer sugerir o que vem depois: http://bit.ly/9Wiqvo via @gv_oficial oO Tenho medo da Google !;@gv_oficial;
0;0;@fashiongazette Bá! Coloca no google gata! Sempre faço isso! rsrs;@fashiongazette;
0;0;eu acho qe a Google podia desconfiar qe ela ta DESTRUINDO o #orkut :) as vezes a ideia é essa ne, VAI SABER ..;;#orkut
0;0;Google Talks White Spaces, Google TV Coming This Month? - http://newzfor.me/?6w3z;;
0;0;Google Instant: Pros and Cons – PC World: Globe and Mail Google Instant: Pros and Cons PC… http://goo.gl/fb/zdnhK;;
0;0;Google;;
0;0;I Just Made $1,000 In One Day From #Google #Adsense - http://bit.ly/9FNgPx via @sonlinebiz;@sonlinebiz;#Google #Adsense
0;0;@art3fact but Google instant on mobile will be terrible (on a 3g device) the results will be slow to appear and not render fast enough.;@art3fact;
0;0;This new Google search kinda scares me...;;
0;0;aí alguém vem falar com vc no msn > "Carol, eu to escrevendo essa palavra certo" > PROCURA NO GOOGLE , bjs;;
0;0;補足。使用検索エンジン： google 画像　検索に用いた語句：camelus　skeleton;;
0;0;Não curto o Google Chrome porque abro e me vejo de wayfarer nos mais visitados............;;
0;0;My google wave folks...consider yourself BLESSED #TreyAlbum @lorihypenann @crimsonviolets5 @redsanatomi @hositdown @iseeyouguh6;@lorihypenann @crimsonviolets5 @redsanatomi @hositdown @iseeyouguh6;#TreyAlbum
0;0;wagwan for this new google chrome everything just keeps flashing;;
0;0;I love " Google Chrome" =);;
0;0;RT @hushm0nk3y Google Instant a potential bonanza for search scams http://viigo.im/4MQd;@hushm0nk3y;
0;0;algunos no saben q existe google o wikipedia, porq preguntan y q es esto y donde esto en twitter?;;
0;0;RT @hmiyazaki : インプレッションの測定方法が「ユーザーがEnterキーを押して検索を完了し、そのページを3秒以上見るか、結果ページのリンクをクリックした時」に RT Googleのスパム対策責任者、SEOの「死」論争に介入 http://is.gd/f3bp4;@hmiyazaki;
0;0;Updated Google Voice offers pair of widgets - CNET (blog) http://tinyurl.com/3ykpjrf #Google;;#Google
0;0;Google Adwords Konto mit 300,- EUR Guthaben - nur kurze Zeit!: Sie erhalten ein Google AdWords Konto mit einem AdW... http://bit.ly/aIeAAe;;
0;0;Photog Distinguishes Himself by Looking Just Like Google http://bit.ly/chHDCJ;;
0;0;it is an amazing feat to knock the fruit, apple, off the first page of google search results;;
