retweets;favorites;text;mentions;hashtags
0;0;RT @Judd6149 New at The 6149: Google 's in the algorithm mixin' up the medicine: Searchterranean Homepage Blues http://post.ly/wTMb;@Judd6149;
2;0;Google Search: now faster than the speed of type http://bit.ly/ao3hQm;;
0;0;LIES!!! RT @fanultra : Ni una patada de chuck Norris es tan rápida cómo Google Instant ##googleinstantfacts;@fanultra;# #googleinstantfacts
0;0;Argentina tomou um sacode (bem feito) da Lituânia no basquete. Aliás, como diz o Capital Inicial, que país é esse? Google , lá vou eu!;;
0;1;Depois de resolver exercícios de física sempre fico com aquela sensação de que algo não se encaixa.O pior é : I CAN'T GOOGLE IT!;;
0;0;@dreamtheaterbr http://bit.ly/aQ0mLJ some explaination in spanish but u can traduce it with google . Sad but true, G'Bye MP;@dreamtheaterbr;
0;0;@OfficialDHough Nice! Google traffic unlocked with a Traffic Cipher @SEO_Networker - http://www.trafficcipher.com I'll be voting for you!;@OfficialDHough @SEO_Networker;
0;0;RT @wired : Oh, you know you want to write your name in bouncy Google balls. http://bit.ly/ahoudK;@wired;
0;0;@_spyder he has some good points. Google is as evil as every other corporation! Oh well. Glad I'm 1st in line for updates with my fone ;);@_spyder;
0;0;RT @MauricioG0mes : segundo Google Maps estou a 4km daí !;@MauricioG0mes;
0;0;@theadvocatemag Censorship on Google Instant http://bit.ly/9ZfiUD #esf #lgbt;@theadvocatemag;#esf #lgbt
1;0;Censorship on Google Instant: The web is buzzing about Google 's latest advancement, Google Instant, which doesn't ... http://bit.ly/dDw1Vn;;
0;0;Censorship on Google Instant http://bit.ly/9OpkGg;;
0;0;Censorship on Google Instant: The web is buzzing about Google 's latest advancement, Google Instant, which doesn't ... http://bit.ly/9OpkGg;;
0;0;Censorship on Google Instant: The web is buzzing about Google 's latest advancement, Google Instant, which doesn't ... http://bit.ly/9OpkGg;;
0;0;Me joga no Google , me chama de pesquisa, e diz que eu sou tudo o que você procurava! @luansantanaevc haha;@luansantanaevc;
0;0;Whoa, instant search results in google is kinda cool;;
0;0;Wow Google very cool! Umm what about SEO?;;
0;0;hay veces que chrome si puede ser un pain in the ass...." google no pudo encontrar la página " google .com" que está buscando";;
0;0;Google Talk amb.johnson1@gmail <----- add me #droid and #BlackBerry users;@gmail;#droid #BlackBerry
0;0;" Google often finds out about new Android phones the same day the rest of the world does" http://bit.ly/avM2cu HT @asymco;@asymco;
0;0;Who else got google talk;;
0;0;rt @html5aldente RT @HTML5Samples : New post: Google I/O 2009 - Building Applications in the Cloud http://bit.ly/cBmv7W;@html5aldente @HTML5Samples;
0;0;The Google Instant Alphabet - Boing Boing http://safe.mn/u5N;;
0;0;google instant ya no le da tiempo a flash de ir por su cafe en medio de una busqueda #googleinstantfacts;;#googleinstantfacts
0;0;「Facebookの強力なAPIがあなたのWebサイト上の成長と婚約を駆動するために社会経験を作成することができます。」 Google AJAX Language API の翻訳やばい;;
0;0;@GrowMap Agree! Just saying :-) Have written to Andy w/one change that needs to be made to make it work w/ Google toolbar;@GrowMap;
0;0;WTF @Google ? Google Instant censors "bisexual" and "lesbian". http://bit.ly/dA1LMT #LGBT;@Google;#LGBT
0;0;朝イチ、 Google カレンダーからメールもらったので忘れずに済んだ本日の撮影小物は「米糠」(爆) そして、スマホ欲しい熱が止まない。うーん。近所のDoCoMoショップに、えくすぺりあいじりに行こうか。;;
0;0;@Samuwhere Tava procurando o blog do galã, saiu esse link no google e achei vcs \o/;@Samuwhere;
0;0;Google TV Coming to US Soon,Wordwide Debut Next Year http://nxy.in/1c09o;;
0;0;RT @davidcaballeroj @Yipie_Kinopio a mi tambien me gusta google y amo gmail :D;@davidcaballeroj @Yipie_Kinopio;
0;0;Google Instant is pretty impressive;;
0;0;@chocopuyo あ、もしかしてMailのRSS機能って Google リーダーから引っ張ってこなくてももともとあるとか？;@chocopuyo;
0;0;Is there a way that i could specify how many articles i want each feed in my Google Reader RSS to save & Dump the rest?I cant find anything;;
0;0;Google Chrome Extensions at School: Staying Connected: It’s back-to-school season in many parts of the world, so we… http://goo.gl/fb/x3ii1;;
0;0;どっちだ？=>Apple TV対 Google TV、勝つのはどちらか http://bit.ly/9X3r6s;;
0;0;@GlenCurren Just use the Google translator or Babel Fish. Translate to Spanish and then back to English.;@GlenCurren;
0;0;Facebook inches past Google for Web users' minutes: U.S. Web surfers are spending more time socializing on Facebook than searching wit...;;
0;0;just determined that if I do a Google Image Search of my name, my picture is the 1st to show up...on the 7th page.;;
0;0;Essa @isaalmeida fica falando inglês, eu não sei inglês. E lá vai o costa pro google tradutor, argh. AYUSHAUSHAUHSAUHSUHAS;@isaalmeida;
0;0;So I reconstructed the Google bouncing balls logo in HTML5 canvas. What do you think? http:// rawk.es/r via @robhawkes;@robhawkes;
0;0;RT @m_thompson : Just How Massive is Google ? [INFOGRAPHIC] http://www. penn-olson.com/2010/09/09/goo gle-interesting-facts/ … via @pennolson;@m_thompson @pennolson;
0;0;Google 、週当たりの検索ユーザー数が10億人を超えたと発表 http://www.itmedia.co.jp/enterprise/articles/1009/09/news058.html;;
0;0;Jajajajaaaa!! @joswe5673 @AdrianAyala RT @fanultra : Ni una patada de chuck Norris es tan rápida cómo Google Instant ##googleinstantfacts;@joswe5673 @AdrianAyala @fanultra;# #googleinstantfacts
0;0;RT @boingboing The Google Instant Alphabet - Boing Boing http://bit.ly/bgZWYP;@boingboing;
0;0;Just google instanted myself. This Mike Leach football coach dick is going down.;;
0;0;Video: Sergey Brin Explains Why Google Instant Matters http://bit.ly/9ySroz #bing;;#bing
0;0;Ask your Phone instead of asking for directions. Google added "Walking Navigation" to the new version of Maps for Android.;;
2;0;Ni el café instantaneo es tán rapido como Google Instant #googleinstantfacts;;#googleinstantfacts
0;0;open source version « just4moms.net: Tags: chromium, omnibox, open source version, san francisco. Posted in google ... http://bit.ly/cwAY02;;
0;0;Google Maps 4.5 Now with Walking Navigation Beta #nomade http://bit.ly/aAl11L;;#nomade
0;0;If you like the stuff Google Labs cooks up, you'll like Google Instant search. Searches as you type. http://tinyurl.com/28lqql6;;
0;0;VOU PERGUNTAR PARA O TIO GOOGLE;;
0;0;Google Maps gets Walking Navigation, enhanced search #nomade http://bit.ly/9m7Qx2;;#nomade
0;0;@Nanaricchetti @artenacozinha eu tb não consigo ficar logada, toda hora o google (blogger, orkut...) fica pedindo a senha...;@Nanaricchetti @artenacozinha;
0;0;Google Maps for Android Gets Turn-By-Turn Walking Directions, Satellite Imagery: For smartphone ... http://bit.ly/aBNJpS (via ReadWriteWeb);;
0;0;@THRASHERlokz for the busss, google it ha;@THRASHERlokz;
0;0;poha tenho que fazer um trabalho todo em inglês @_@ . google tradutor lá vou eu, hahaha;@_ @;
0;0;Si algún día desaparecieran Windows, Mac o Google me llevaría un gran disgusto.;;
0;0;My google chrome looks a bit different... Hmmm;;
0;0;Google Search just became instant. http://google.com/instant #googleinstant;;#googleinstant
0;0;ハハハ、そうですね。それは難しそう。RT @ma10 : Google Calendarで仕事関係だけを入れたやつを作って関係者と共有しようと思ったけど、それって僕みたいに複数の職場の仕事関係の用件とさらには仕様までが入り交じった生活してると全然実用的じゃないことに気づいた。。。;@ma10;
0;0;Opera support for Google Instant: 'Shortly' - http://newzfor.me/?614z;;
0;0;Google Voice Android – Google Voice widgets for Android is now …: Google Voice Android - Google Voi... http://bit.ly/cYqGMD #xoopia #iphone;;#xoopia #iphone
0;0;@luannkelven Para aparecer no google images? Isso?;@luannkelven;
0;0;New Google Voice Android Widgets Bring Faster Inbox Access: Google has introduced a new pair of Goo... http://bit.ly/bdEweF #xoopia #iphone;;#xoopia #iphone
0;0;Check out my new Google profile http://www.google.com/profiles/travisbbrandt;;
0;0;Google Instant search feeds our real-time addiction http://bit.ly/alaCMd;;
0;0;@RJToronto Google TV launch soon. Basically Tivo-esk, but richer. Lives on your comp w/ small connx box to TV feed. Wonder if it's combtble;@RJToronto;
0;0;Me choca la gente que no es "amiga de su pantalla". Se aburren y empiezan a dar vueltas en circulo. Yo me aburro y busco algo en google .;;
0;0;The web is an RPG. Google Analytics measures your XP. And a traffic spike is a critical hit. And that's why I won't sleep tonight.;;
0;0;Just How Massive is Google ? [INFOGRAPHIC] | Penn Olson http://safe.mn/u5H;;
0;0;Is it better to buy from Google Networks or banner ads through say a local news website?;;
0;0;ROFL - Google Launches 'The Google ' For Older Adults http:// onion.com/b1Uuzi;;
0;0;@AcoolPRican e mesmo cara! Rsrs precisa fazer uma pesquisa no google : "Novia de @Calle13Oficial ";@AcoolPRican @Calle13Oficial;
0;0;Google Maps update brings Walking Navigation Beta and more http://f.ast.ly/AT56U;;
0;0;@rodrigochades busca en google y te aparece una pagina;@rodrigochades;
0;0;RT: @fanultra : Ni una patada de chuck Norris es tan rápida cómo Google Instant#googleinstantfacts;@fanultra;#googleinstantfacts
0;0;@IamQueenMAC yo dat why u need be my wife ihope u didnt google dat cuz if u did #failed but da to #DR can be a -go #single ?;@IamQueenMAC;#failed #DR #single
0;1;Neat innovations in Google Walking Navigation! Nice integration with StreetView. http://bit.ly/amBX3z RT @edparsons;@edparsons;
0;0;robhawkes: @wired Thanks for the tweet! I'm the dude behind the HTML5 version of the bouncy Google logo.:... http://bit.ly/djUN3K ^DigiCura;@wired;
0;0;@TodoFanDaAshley HAUSHAUS' Pode procurar assim no Google que voçe vai axar alguma Coisa , FUNDAÇAO LORENZATO !;@TodoFanDaAshley;
0;0;Google responde tus dudas e inquietudes http://bit.ly/cfgMlJ;;
0;0;@FeS_Delegada escreve no google : emessenfer ILoveM e entra logoooooooooooo';@FeS_Delegada;
0;0;" @AppelenEi : 2-0 gek" #sorry hoor maar de laaste telt nie mee! @ManyAlbron had goed !jij verade jezelf door google te roepen;@AppelenEi @ManyAlbron;#sorry
0;0;YES! RT @tararojas : anyone else find the new google instant somewhat annoying?;@tararojas;
0;0;Good show!! If you missed the show tonight you can get it at Google , iTunes, MSN and YouTube!;;
0;0;@MattNeithercott everything on my android phone backs up to the google cloud. now i've got a bricked ipad after trying to update the iOS;@MattNeithercott;
0;0;Write Your Name in Bouncy Google Balls | Webmonkey| Wired.com http://safe.mn/u5F;;
0;0;The Google Instant Alphabet - Boing Boing http://bit.ly/bgZWYP;;
0;0;WAP: paul.wap - Project Hosting on Google Code http://bit.ly/b6Zbwj;;
0;0;@terryxxy Google Maps for iPhone is such a tragedy ....however I still can not find some other apps to replace it;@terryxxy;
0;0;Hello i am having a problem, i have a bustness in google mpas being hacked: hello i have a busyness on googl... http://tinyurl.com/336z3ve;;
0;0;Vanexxa – Creatividad de Madrid del 2010 | I THINK GOOGLE http://lnkd.in/S5pbJn;;
0;0;Just How Massive is Google ? [INFOGRAPHIC] http://www. penn-olson.com/2010/09/09/goo gle-interesting-facts/ … via @pennolson;@pennolson;
1;0;As Google gets smarter, are we getting dumber? http://bit.ly/9AqU4E;;
0;0;Aniversário de Neto semana que vem. Na falta do q fazer coloquei no google : sugestão de presentes para virginianos.. e só rindo, rindo muito;;
0;0;localseoranking_ La Jolla Back From Google Maps Purgatory! http://dld.bz/veYv;;
0;0;@goldenpneuma めでたく Google 認定と言う事ですね。;@goldenpneuma;
0;0;RT @eventosfera : Google Instant and Google Analytics http://bit.ly/aeAToZ /cc @feedly;@eventosfera @feedly;
0;0;Hereje ;) RT @fanultra Ni una patada de chuck Norris es tan rápida cómo Google Instant ##googleinstantfacts;@fanultra;# #googleinstantfacts
0;0;Ay que me LOL! RT @fanultra : ¿Eyaculador precoz? Consuélate. Google Instant siempre será más rápido que tú... #googleinstantfacts @juancho21;@fanultra @juancho21;#googleinstantfacts
0;0;Google Instant: 検索エンジン。米 Google が導入を発表、入力中に検索結果を逐次表示 http://bit.ly/9BR0Do;;
0;0;9/16 急遽決定！あの坂田氏が講師で「Twitterのyahoo, google で出来ないビジネス活用術、ここまで使えるとは目からウロコだ！詳細はブログで http://ameblo.jp/bijiken/entry-10643974647.html;;
0;0;O_o google on some new shit !;;
0;0;RT @MeAtSchool : PROJECTS were so IMPOSSIBLE without GOOGLE .- @FunnyOrFact #HappyBirthdayGoogle;@MeAtSchool @FunnyOrFact;#HappyBirthdayGoogle
0;0;Iwebslog.com- Google Instant Prototype Looks a Bit Like Bing (PC Magazine): PC Magazine - Google 's new Google ... http://dlvr.it/500Ht #Tech;;#Tech
0;0;Custom VW pics VW on Air Ride Ghia sitting on 17" fuch's and Air! http://dlvr.it/500ld #http_schemas_ google _com_photos_2007_photo;;#http_schemas_
0;0;Google Voice Gains Widgets On Android Smartphones: By Eric Zeman Widgets are one of the better tools offered by An... http://bit.ly/aTWI8F;;
0;0;Sony shows of prototype android / google tv 2 Minutes ago: Google TV consists of Google 's "Android" platform, the ... http://bit.ly/c4H8Ob;;
0;1;Google instant: http://tinyurl.com/32nehg3;;
0;0;Update: Google Earth Landed On the iPad http://bit.ly/a52odj;;
0;0;Coloquei no Google ,fruta quente..aparece uma laranja e duas maças pegando fogo;;
0;0;YES PLEASE RT @wired Oh, you know you want to write your name in bouncy Google balls. http://bit.ly/ahoudK;@wired;
0;0;@shashathoishi go google .;@shashathoishi;
0;0;Estabas asustada? " @Val_Ale : Gracias a Dios por Google que siempre me ayuda a solucionar los problemas con el BB :D";@Val_Ale;
0;0;@PalhaAssada O pior é que no site oficial, o Google fez um tutorial, mas com uma opção lá que simplesmente não existe no Chrome pra Mac.;@PalhaAssada;
0;0;@paulo_yamamoto Coloca "on 3D" no google e clica "estou com sorte";@paulo_yamamoto;
0;0;Google Earthで軌跡チェック、5999円のお手軽GPSロガー──「GPSサイクルメーター」 - http://bit.ly/bQg1Bc;;
0;0;@TimCAD do you know how to add the comic page to google reader #googlereadernoob;@TimCAD;#googlereadernoob
0;0;Google Instant Search & Google analytic tracking- http://tinyurl.com/38ba4oz;;
0;0;best killer feature in google chrome -- URL bar is also a calculator + a unit conversion tool. BRILLIANT!;;
0;0;TGIF의 새로운 의미! Twitter Google Iphone Facebook;;
0;0;@chrisjacobs7 Re. #google 49,989 positive opinions http://j.mp/3j5SFs? -vs- 15,537 negative http://j.mp/38Z3h2?;@chrisjacobs7;#google
0;0;A bold step in the direction of User Experience design: Google makes the search button obsolete with Google Instant! http://is.gd/f3e3E;;
0;0;Massive Computer Virus Strikes ABC/Disney, Comcast, Google , Others http:// shar.es/0scfu;;
0;0;Chrome to Phone will send and save pdf's .. then quick office makes quick work of them! amazing! #google #android #froyo i love you google !;;#google #android #froyo
1;0;Really fantastic Google Maps idea for NZ post Earthquake efforts http://www.mapquake.co.nz/;;
0;0;【IT】中国などのネット検閲国家に圧力を　グーグル( Google )が呼びかけ［10/09/09］: at ビジネス+ 板 http://bit.ly/ddwZTk;;
0;0;To de cara com o Google Earth. Tinha tempo que eu nao brincava. Ta show de bola.;;
0;0;@GizmoAlex so google does searches on the fly, now. no longer need to use the "go" or "search" button. Le Wow.;@GizmoAlex;
0;0;Tnanks @CoachKarenG ! Um, okay but when I google I get his mom died in 2007. How long a pass do you get before you try to be civil again?;@CoachKarenG;
0;0;@jsc24 ....../goes on google translation/;@jsc24;
0;0;the pictures of breaking down now in google images;;
0;0;En el año 2000, Google bromeó con la idea de adivinar lo que la gente quería buscar. Diez años después la broma es una realidad;;
1;0;Julien Sobrier Blackhat SEO talk @Google : http://bit.ly/9kYvfk <- joke at 26:40 - His solution 4 BHSEO? Switch to Bing! O_O :);@Google;
0;0;A Sneak Peek at Google Instant Search for Mobile [VIDEO] http:// mashable.com/2010/09/08/goo gle-instant-mobile/ … via @mashablemobile @mashable #li;@mashablemobile @mashable;#li
0;0;역시 Google 의 목적은 세계정복? ^^; http://is.gd/f3dZI 기존부터 강력했던 NLP 기술에 voice recognition이 결합되니까.. 이제 못 하는 게 없구나;;
0;0;LogQwertityは逆転プログラマーです。 Google を改ざん出来ます。 http://shindanmaker.com/46970 #pgtter0123 じゃあ Google 反転させてI'm Feeling Unhappyとか作ろうかな;;#pgtter0123
0;0;음성검색에서 시각검색으로. 카메라가 매우 중요시 되겠군요. 기대해봅니다. " Google Says Search By Sight Is Our Mobile Future http://bit.ly/dgBM1p;;
0;0;Gmail Priority Inbox + SuperStars + Shortcuts + Google Docs has equaled a little happiness for me today! Gr8 aids 2 #GTD;;#GTD
0;0;yo i think my lyrics in fb come out o Google when u look 4 them lmao !!!!!;;
0;0;Turns out I'm smarter than google . hah;;
0;0;My Own Name in bouncy Google Doodle Balls. http://bit.ly/cBk3WD;;
0;0;@weirdscience202 google;@weirdscience202;
0;0;Why can @google read my mind now?!;@google;
0;0;some blog suggested spelling errors will win you new Google Instant placement. It'll also mack you look smorter! #FAIL;;#FAIL
0;0;Google my name: KING COCO LOCO;;
0;0;¿Conclusión? Que Microsoft, Google y Apple defiendan tecnologías informáticas diferentes es un incentivo para el progreso.;;
0;0;Any one use google voice as there default voice mail box. What's your experience like?;;
0;0;逆の意味で、マーケットを作りたい人達には有利 RT @sardinej : 同意！ RT @vvakame : Googleが3G載ってない端末にマーケットをライセンスしないのは明らかに間違ってる！！！;@sardinej @vvakame;
0;0;@artenacozinha @Panelaterapia detalhe, ontem o computador dele tb não entrava no google;@artenacozinha @Panelaterapia;
0;0;I am amazed at the number of photos of Asians eating KFC on my google search right now.;;
0;0;Google Adds Google Voice Widget to Android Home Screen #google #android #internet http://bit.ly/aKKdQO;;#google #android #internet
0;0;Will your business be found in an instant with Google ? http://bit.ly/blxrxF;;
0;0;RT @NaLdiiee : Kamu paling tau si. Km google RT @synsafiq: kata sapa? Sotoy RT @RizkyPrasetyaa : Wali kota trima trima aja RT @synsafiq: ga;@NaLdiiee @synsafiq @RizkyPrasetyaa @synsafiq;
0;0;Oh, you know you want to write your name in bouncy Google balls. http://bit.ly/ahoudK" ~cx~;;
0;0;Google Chrome 6になってから微妙にブラウザ内のキーボード操作が効かないことがある気がするな;;
0;0;Pensando em Sheldon RT: @hirenkoi : RT @meio_bit Demonstração mega-geek do Google Instant http://bit.ly/91q7h6;@hirenkoi @meio_bit;
1;0;Google changing (for good) SEM and SEO this week: http://tinyurl.com/38bn37n;;
0;0;Do it LOL RT @wired : Oh, you know you want to write your name in bouncy Google balls. http://bit.ly/ahoudK;@wired;
0;0;Google Maps for Android Gets Turn-By-Turn Walking Directions, Satellite Imagery (Mike Melanson/ReadWriteWeb) http://rww.to/akMwfm;;
0;0;RT @AndroidGuys : Google Maps 4.5 Hits Android Market with Walking Navigation Beta http://dlvr.it/4zTMZ http://bit.ly/c8Lute;@AndroidGuys;
0;0;Apple TV対 Google TV、勝つのはどちらか http://dlvr.it/500bm 【ITmedia】;;
0;0;Es medio molesto que la gente use Twitter como google ... donde queda esto? alguien sabe aquello? #alobien #enserio;;#alobien #enserio
0;0;Google TV Will Have Its Own Instant Search (Janko Roettgers/NewTeeVee) http://bit.ly/af8ihI;;
0;0;Custom VW pics Custom VW pics Airkewld Booth at winter jam http://dlvr.it/500b7 #http_schemas_ google _com_photos_2007_photo;;#http_schemas_
0;0;Google Talks White Spaces, Google TV Coming This Month? - http://newzfor.me/?6w3z;;
0;0;Google Instant tem o mesmo filtro das sugestões de pesquisa...;;
0;0;@sammutimer I sync all our calendars through Google Calendar and then feed them into iCal and iPhone Cal.;@sammutimer;
0;0;@chasingstarsBGs http://twitpic.com/2mgwz4 - lovely <3 i hope its ok i used one of your bgs as my google homepage background haha :);@chasingstarsBGs;
0;0;RT @australian Apple opens Apps to Flash, Google | The Australian http://bit.ly/b0JE8E;@australian;
0;0;10 Killer Google Chrome Tips, Tricks and Shortcuts http://bit.ly/aXs6pU;;
0;0;Under the bonnet of #Google #Instant http://bit.ly/91i3c6;;#Google #Instant
0;0;@MsRedPen I like Google Reader;@MsRedPen;
0;0;RT: @meiobit_ : Demonstração mega-geek do Google Instant http://migre.me/1dUhr;@meiobit_;
0;0;@vm263 I don't have my computer at the mo, so I don't have my streaming bookmark unfortunately. If you google streams you should find one.;@vm263;
0;0;@Rodriggo_r e oq vc entende por 'logaritmo'? UHSAUSH sem jgar no google ,;@Rodriggo_r;
0;0;Usa com frequência o Google Tradutor ? — Uso , KKKKKKK' sempre http://4ms.me/d8jxpE;;
0;0;@MattCC716 Google used to have a KICKASS music search page. But apparently they closed it. Grrr.;@MattCC716;
0;0;sweatsheela: Google Instant Coming Natively To Browsers “In The Next Few Months” http://bit.ly/alB701 http://bit.ly/bEgAuh;;
0;0;Google Chrome aqui vamos nós de novu..Lov U #Baby ..RSRSRS;;#Baby
0;0;@Panelaterapia no computador dele não mudou nada... o google está fazendo mudanças;@Panelaterapia;
0;0;Quer saber o teu nível de influência no Twitter? Descobri hoje uma ferramenta chamada TweetLevel. É só digitar no google !;;
0;0;sweatsheela: Google Instant Coming Natively To Browsers “In The Next Few Months” http://bit.ly/alB701 http://bit.ly/91o452;;
0;0;caramba, vi propaganda do second life agora no google adsense. nem sabia que existia ainda...;;
0;0;@eMuddy Agreed. I dig the Google Sites. Wonder if it might be too simplistic for my ideal, but I'm still new to it, so have a lot to learn.;@eMuddy;
0;0;「 google instant」http://eeg.jp/RmKb って検索ボタンがいらなくなったってこと？！検索のスピードが格段に上がるって事か？！;;
0;0;Assitir o solista in english sem legenda pra fazer relatório?? ÉÉÉ nãão :D, Querida prof. o google vai me contar o filme, no stress ;);;
6;11;admobセーフでした。 [news] - Apple、新しいApp Store向けデベロッパー規約を発表― Google は安堵のため息 → http://j.mp/9ZDApl;;
0;0;¿Que es Google Instant? http://goo.gl/fb/VaooV #internet #software #google #inicio #instant #pagina;;#internet #software #google #inicio #instant #pagina
0;0;Free Google Reader! #Vitamins Cases http://goo.gl/fb/w9oh3;;#Vitamins
0;0;RT @Truth_is_nyc @AmandaMMartinez is a beauty in #hiphop ...... google that !!!;@Truth_is_nyc @AmandaMMartinez;#hiphop
0;1;If you think Google Instant is blocking you unfairly, you might find this link helpful http://bit.ly/bryRAA;;
0;0;@Panelaterapia ontem eu não entrava nada do google , meu marido trocou sei lá o que e consegui, hj ele mudou a página para mim;@Panelaterapia;
0;0;Just b/c your Google eminates from NJ does not mean you will get answers fm Dr House T @missbanshee : Will not consult Dr. Google ...;@missbanshee;
0;0;So google have ruined both image search and regular search now. Fix it or I'm switching to Bing.;;
0;0;When Google isn’t getting the job done, give 1 of these other search engines a chance RT @joemsie #web #zerm Read more: http://bit.ly/9qI6Xe;@joemsie;#web #zerm
0;0;When Google isn’t getting the job done, give 1 of these other search engines a chance RT @joemsie #web #zerm Read more: http://bit.ly/9qI6Xe;@joemsie;#web #zerm
0;0;When Google isn’t getting the job done, give 1 of these other search engines a chance RT @joemsie #web #zerm Read more: http://bit.ly/9qI6Xe;@joemsie;#web #zerm
1;0;When Google isn’t getting the job done, give 1 of these other search engines a chance RT @joemsie #web #zerm Read more: http://bit.ly/9qI6Xe;@joemsie;#web #zerm
0;0;When Google isn’t getting the job done, give 1 of these other search engines a chance RT @joemsie #web #zerm Read more: http://bit.ly/9qI6Xe;@joemsie;#web #zerm
0;0;[ニュース] google news top! 振興銀が破綻申請 ペイオフ初の発動へ - MSN産経ニュース http://bit.ly/ctnlv9;;
0;0;Google translate needs to work on its korean. I enter a kpop idol's tweet, and all I get back is... (i'll continue in the next tweet);;
0;0;Mi teclado no tiene < o (no lo encuentro) y pongo ''corazon 3'' en google y me sale.. <3 #pollando;;#pollando
0;0;Sergey Brin: Google Instant es uno de los mayores cambios a la búsqueda que hemos hecho http://is.gd/f3dXv;;
1;0;http://bit.ly/dBCt67 Google 's AdMob delighted with new Apple policies;;
0;0;#Google should have bought #heaper instead of creating Google #Instant . #heapr .com rocks!;;#Google #heaper #Instant #heapr
0;0;Google Instant: Pros and Cons: While Google is hyping Google Instant as the greatest thing since sliced bread, som... http://bit.ly/bMcpLq;;
0;0;Doodle de Google ayuda a explotar en ventas http://bit.ly/bohpI7 vía @Eloi_Raiol_3D @GoogleDiscovery;@Eloi_Raiol_3D @GoogleDiscovery;
0;0;@_MyNameBrandon_ that google chrome crucial? i heard its makin a rize past mozilla firefox and catchin up to internet explorer.;@_MyNameBrandon_;
7;1;Ni una patada de chuck Norris es tan rápida cómo Google Instant ##googleinstantfacts;;# #googleinstantfacts
0;0;@brianericford Not really disagreeing, but: I'm not sure Google could NOT allow it, now. It's Apache licensed. They can't go back on that.;@brianericford;
