retweets;favorites;text;mentions;hashtags
0;0;Poxa tô afim de saber o que é Cambridge Day que a @athusmanaus tá perguntando quem vai. #Nãoseioquesetrata . Joga no google :P;@athusmanaus;#N
0;0;なんでしたら中の人になってオフィシャルに改ざんしてくださいw RT @figarashi : figarashiは厨プログラマーです。 Google を改ざん出来ます。 http://shindanmaker.com/46970 #pgtter0123 @rintarotokairin;@figarashi @rintarotokairin;#pgtter0123
0;0;Google Instant. Saving 2-5 seconds per search. That's like a day per week for me! http://google.com/landing/instant;;
0;0;http://1001fp.com/862018 Google Web Toolkit, EXT GWT, GAE Developer Needed #TechnologyJob;;#TechnologyJob
0;0;RT Google 日本語入力のユーザー辞書が200語いった http://am6.jp/bV05or;;
0;0;RT 2010年09月09日にブックマークした記事＋独り言まとめ - 己【おれ】: ... Google 日本語入力や予測変換のような仕上がり.. http://am6.jp/d2m9qM;;
0;0;Get on the front page of Google with PageRank Caffeine www.pagerankcaffeine.com;;
0;0;@jpatinob Google Instant es Skynet en potencia.;@jpatinob;
0;0;RT 最近 Google IMEがちょっとアホ。前より精度落ちてないかい？ http://am6.jp/c9sT4e;;
0;0;@taisakiss Mas línguas com caractérs é Pho** só com google mesmo! oO rsrs;@taisakiss;
0;0;Fast Access to #Google Voice with #Android Widgets - http://bit.ly/dBIxR5;;#Google #Android
0;0;10 Killer Google Chrome Tips, Tricks and Shortcuts http://bit.ly/cjTVrv (via @mashable );@mashable;
0;0;Make your own Google Bouncy Balls logo: http://dotty-dots.appspot.com/?h=566d4320496e6b2e;;
0;0;Oracle- Google lawsuit: what's it all about? http://bit.ly/ca2BGG;;
0;0;Psychic Google (-0.5): Even faster than Instant http://bit.ly/aveiFR;;
0;0;I favorited a YouTube video - Adon Byron from Google New Zealand talking about child safety onlin... http://dlvr.it/500DX;;
1;0;Escrevam I FakeNumber no google tradutor e percebam que a tradução é I NxZero UAHEIUAHEUIHEAIUEHAUIEHAUIE;;
0;0;@edgeofwithin Well, its not google 's fault. And apple has ATT over a barrel. I really hate the cell phone carriers.;@edgeofwithin;
0;0;@mtpii : ps who are you-- you started following me on google reader, what's our connection, or who I should say;@mtpii;
0;0;Eu fui procurar no google : nomes para coquinhos e não apareceu nd de util :P;;
0;0;Ohmygod found all of the answers in a document on google with all of the answers to the yellow sheet :O;;
0;0;Google Applauds Apple's New Developer Terms #google #apple #internet http://bit.ly/9rDN34;;#google #apple #internet
0;0;William Gibson: Google 's Earth: Source: linkfilter.net --- Thursday, September 09, 2010I actually think most peop... http://bit.ly/bt8TxB;;
0;0;William Gibson: Google 's Earth: Source: linkfilter.net --- Thursday, September 09, 2010I actually think most peop... http://bit.ly/bt8TxB;;
0;0;Dino iki pengen updet tweet,tapi atek boso jowo dadi spurane sing ga paham,soale gaonok nang google translate .;;
0;0;Google Instant: A Whole New Way to Search is Coming Soon! http://bit.ly/arXrsr;;
0;0;desisto de procurar gráficos no google '-' vou fazer os meus (: haha;;
0;0;@LO_Desconocido poooo' #autodidata essa eu fui no google . ;);@LO_Desconocido;#autodidata
0;0;Google : Do excessive internet use, television viewing and poor life-style ...: The aim of this study is to determi... http://bit.ly/c4iUO1;;
0;0;And the keyword "Kaichou Wa Maid-sama!: Episode 10" when used on google showed Rashidonline.net on the 3rd spot again! http://bit.ly/cc083v;;
0;0;La aparición del Google Instant cambia el juego para las marcas http://ow.ly/2C2us;;
0;0;Why Google Instant May Make You Click On More Ads http:// tcrn.ch/9FuGnI via @techcrunch;@techcrunch;
0;0;RT @bkmacdaddy : How To Grab More Rankings With Google ’s Branded Search Results http://selnd.com/diFPBd;@bkmacdaddy;
2;1;for SEO on google , wikipedia really needs this joke as a 2nd listing http://bit.ly/cytUQ4;;
0;0;Why the fuck did i just google google ?Wtf;;
0;0;@chuyitos LOL google no dice nada acerca de ella;@chuyitos;
0;0;Usa com frequência o Google Tradutor ? — Nem sempre.. Mas quando eu quero ver a tradução de alguma musica que e… http://4ms.me/agO74a;;
0;0;Google Maps Navigation on Android gets walking directions: Google posted its second Android app update for today w... http://bit.ly/ceHX85;;
0;0;Top story on the Colocation America Daily http://bit.ly/cAc6GS (via @sewatch ) ▸ How Google Instant Search Will Impact Advertisers;@sewatch;
0;0;@mabeprado ah foi o que eu imaginei, joguei no google mais nem ele sabia D: EOAUOEUAEAUOUEAOUEO obrigada ^^;@mabeprado;
0;0;@ChelseaPiiitre a peprally! Google it :D google "high school peprally";@ChelseaPiiitre;
0;0;estamos vendo ouros pela google , muuito loco , imagem em 3d;;
0;0;Facebook inches past Google for Web users' minutes - Forbes http://bit.ly/a9C8wM;;
0;0;Love that Gmail just caught one of my weekly Google Alerts and tagged it as SPAM #fail #emailmarketing;;#fail #emailmarketing
0;0;@paulonishii cara , confesso , procurei no google agr quem é esses G.G , banda de rock ? *-* poow , você se dá bem cm meu irmão #semata haha;@paulonishii;#semata
0;0;why for my google reader has no icons?;;
0;0;Google lança nova ferramenta. Google Instant deixa mais rápida ainda a pesquisa no buscador - http://ow.ly/2C2DR #Google;;#Google
1;0;Google lança nova ferramenta. Google Instant deixa mais rápida ainda a pesquisa no buscador - http://ow.ly/2C2DQ #Google;;#Google
0;0;Google lança nova ferramenta. Google Instant deixa mais rápida ainda a pesquisa no buscador - http://ow.ly/2C2DP #Google;;#Google
2;0;Google lança nova ferramenta. Google Instant deixa mais rápida ainda a pesquisa no buscador - http://ow.ly/2C2DO #Google;;#Google
0;0;jajaja RT @fanultra ¿Eyaculador precoz? Consuélate. Google Instant siempre será más rápido que tú... #googleinstantfacts @juancho21;@fanultra @juancho21;#googleinstantfacts
0;0;Anuciado pela Google novo formato para sistema de buscas - http://tinyurl.com/2cxp7vy;;
0;0;What will Google Instant do to 'SEO' - and to its own AdWords system? http://bit.ly/cv9Wwz;;
0;1;@akikom_ ググるってまだ使います？？なんか、 Google を使うのは当たり前になっているから、ググるって使わないような・・・・。あれ、使わなくなっているのは僕だけ？！;@akikom_;
0;0;@taisakiss kkkkk baixei um gadget aki do trad. da google ! Mas o inglês, espanhol falo, francês e italiano arranho... cont...;@taisakiss;
0;0;RT @mashable : Google Instant Search Feeds our Real-time Addiction [CNN] - http://bit.ly/adYyhD;@mashable;
0;0;I love google analytics!;;
0;0;Oy!! RT“ @tatianamijalica : How Google 's new search product Google Instant will force to change SEO strategies: http://wp.me/pBETa-Vx”;@tatianamijalica;
0;0;Google Santo google . O que não acho na matéria pesquiso lá \o/;;
1;0;Get rapid, mass traffic to your site without Google or crazy SEO tricks. http://cli.gs/2T1TH;;
0;0;T-Mobile Unveils New Google Phone, G2 http://bit.ly/bR95oY;;
0;0;Updated Google Voice offers pair of widgets - CNET (blog) http://goo.gl/fb/CwttV;;
0;0;Google Instant gives as-you-type search results: New feature will allow users to get search results as they type q... http://bit.ly/a74jc8;;
0;0;Computerworld: Google Instant gives as-you-type search results http://bit.ly/a74jc8;;
0;0;Google adds walking directions for Android - CNET (blog) http://goo.gl/fb/LpQnc;;
0;0;Facebook inches past Google for Web users' minutes - The Associated Press http://goo.gl/fb/P5JG7;;
0;0;Google Instant: Pros and Cons - PC World http://goo.gl/fb/vJdSG;;
0;0;Google Noticias: Radar ruso mejora control de tráfico aéreo en occidente cubano - Prensa Latina http://bit.ly/ankmja;;
0;0;I'll take a Froyo tablet anyday, Google says Android Froyo is not for tablets, is there a tablet OS on its way? http://bit.ly/bwItLv;;
0;0;Google keyword search for ink cartridges canon http://bit.ly/deBCje;;
0;0;Google , YouTube e uma tremenda falta de semancol: Se um dia eu precisar fazer uma lista sobre as melhores funcion... http://bit.ly/avH56w;;
0;0;How to use Google Sites - butterscotch http://www. butterscotch.com/tutorial/How-T o-Use-Google-Sites … via @AddThis;@AddThis;
1;0;Apple、iOS開発者向けライセンス契約の制限緩和を発表: この改訂で、開発者はAdobeのFlashアプリの移植と Google のAdMob広告プラットフォームの利用が可能になるようだ。 http://bit.ly/b8748X;;
0;0;@jpinsd Misunderstood, not Google voice. I meant the Google phone dialer. The Google video chat plug in is required. Not avail for iPhone.;@jpinsd;
0;0;I love my Google Voice, and the free calls from Gmail are fantastic! Google is wonderful!;;
0;0;Prank calling ppl via google phone.;;
1;0;AdMobいけるみたいね＞ Apple、新しいApp Store向けデベロッパー規約を発表― Google は安堵のため息　http://bit.ly/aBpDez;;
0;0;mija molleja de rayon usar google traductor.. aparte de q apesta D: @OMGisgnesis;@OMGisgnesis;
0;0;#yoconfieso que me da mucho gusto cuando google instant no puede predecir mis búsquedas;;#yoconfieso
0;0;@nakonako @boulding 確かに「広告媒体」としての Google の価値は下がるかもしれないですね。あーでもAdsenseってのもあるか。興味深いエリアです。;@nakonako @boulding;
1;0;Facebook passa o Google em acessos nos Eua. #fire ! http://read.bi/c8fNTe;;#fire
0;0;@andrewbolt Google 'wilson turkey"' and click the first link that comes up :);@andrewbolt;
0;0;if at first you don't suceed, @google .;@google;
0;0;Mudei o layout...não do Twittter ,o do Google Chrome!;;
0;0;#odeioquando preciso pesquisar algo no google , e pessoas me chamam no msn e eu acabo esquecendo oqe era pra procurar;;#odeioquando
0;0;【ネット】中国、グーグル( Google )に免許交付せず　地図検索サービスで［10/09/09］ | http://bizplus.blog.so-net.ne.jp/2010-09-10-15;;
0;0;#InternetFilter 'Internet censorship is trade barrier', says Google exec http://bit.ly/d2QKD9 #Australia;;#InternetFilter #Australia
3;0;Hóri no Google dos Posers: Você quis dizer Fiuk.;;
0;0;Facebook inches past Google for Web users' minutes - The Associated Press http://bit.ly/cisCxi;;
0;0;Yahoo Had Google 's New Instant Feature In 2006 http://tinyurl.com/34ls6pn;;
0;0;Apparently my house s a portal 2 other dimensions cuz I can't fix my fuckin Google Latitude! I'm down d street, @Dennys , Storage1; I'M@HOME!;@Dennys @HOME;
0;0;RT @MeAtSchool : AYE TODAY IS GOOGLE 'S BIRTHDAY! #HappyBirthdayGoogle xxxxxx;@MeAtSchool;#HappyBirthdayGoogle
0;0;As long as you don't use Google ... RT @VerizonWireless : Best wireless service in the country? JD Power has the answer: http://bit.ly/924PjS;@VerizonWireless;
5;1;Google Voice app coming back to App Store - http://macosrumors.com/?p=2083 #iPhone #GoogleVoice;;#iPhone #GoogleVoice
0;0;RT @meio_bit Demonstração mega-geek do Google Instant http://bit.ly/91q7h6;@meio_bit;
0;0;à¸à¸£à¸°à¸à¸²à¸¨ Google TV à¸­à¸­à¸à¸ à¸²à¸¢à¹à¸à¸à¸¥à¸²à¸¢à¸à¸µà¸à¸µà¹ http://bit.ly/bnxn1b;;
0;0;rusblonde: rusblonde: Google Instant: Love It or Hate It? [POLL]: Google Instant is just a few hours old, but in “... http://bit.ly/9hr39A;;
0;0;pow @thiaagofreire pra que estudar tem tudo no google pow! --' hehe;@thiaagofreire;
0;0;Yooo if you google "Ima Snitch" I'm like second, third etc. To cum up.... Successful #swagg;;#swagg
0;0;I'll save a few seconds with Google Instant. Oh what, oh what shall I do with all that time?;;
0;0;@larissasouza mas será? tem muita coisa sobre isso no google mesmo... é muita coisa pra ser só um fake, né?;@larissasouza;
0;0;This new google fucking me up....i hate it wit a passion;;
0;0;Estou no simulador de vôo do Google Earth.;;
0;0;Google va investir en France : R&D et institut culturel: Google va lancer un plan d'investissement en France. Ce p... http://bit.ly/9DVALY;;
0;0;Google va investir en France : R&D et institut culturel: Google va lancer un plan d'investissement en France. Ce p... http://bit.ly/98vlGc;;
0;0;Google va investir en France : R&D et institut culturel http://bit.ly/9DVALY /via GNT;;
0;0;This does my head in. RT @petapixel Photographer creates unique webpage by cloning Google : http://j.mp/b3q5nf;@petapixel;
0;0;@AmandaMMartinez is a beauty in #hiphop ...... google that !!!;@AmandaMMartinez;#hiphop
0;0;Careful, Google : Facebook Has Passed You in Time Spent on Site [Chart] http://www. pamorama.net/2010/09/09/car eful-google-facebook-has-passed-you-in-time-spent-on-site/?sms_ss=twitter …;;
0;0;si escribes " google instant" en google instant se crea un loop infinito que destruye todos sus servidores n_n;;
0;0;@DontRushElina omfg you're Swedish? I think I'm in love lol jk.. Yeah google takes up like 5/7ths of my brain. It's the only thing i have;@DontRushElina;
0;0;@ReMercatelli Teee ajudo amr, proucura no google HAHAAHA *-* hsuahsu;@ReMercatelli;
0;0;eu quero dar um tiro no pessoal do google .;;
0;0;Google Promises New Investment in France Following Regulatory Battles: By Matthew Campbell - Thu Sep 09 15:30:18 G... http://bit.ly/9Gu3fp;;
0;0;窓の杜 - 【REVIEW】「 Google Chrome」を3ペイン型の２ちゃんねる専用ブラウザーにできる「read.crx」: http://goo.gl/iqYE;;
0;0;RT: @Cardoso : Demonstração mega-geek do Google Instant http://bit.ly/bp92Fx;@Cardoso;
0;0;update: Google Earth pro download - Works 100% http://appsnail.com/android/android-applications/google-earth-pro-download-works-100/;;
0;0;@andrehmachado google a melhor escola que existe =D... não tem melhor... isso é fato.... auhauhauha;@andrehmachado;
0;0;@zbpipe I just did a Google search, and it seems to be that the way to say it is, "data is collected." Hope this helps!;@zbpipe;
0;0;hey, tengo un google chrome nuevo y no me di cuenta;;
0;0;Google Instant a potential bonanza for search scams http://viigo.im/4MQd;;
0;0;Puto google académico, si da resaultados inutiles. #Meladilla buscar demás.;;#Meladilla
0;0;RT @fanultra : ¿Eyaculador precoz? Consuélate. Google Instant siempre será más rápido que tú... #googleinstantfacts @juancho21;@fanultra @juancho21;#googleinstantfacts
0;0;If your have a small business in Bakewell and want help to improve your Google ranking, call Phil @3shires http://3shiresdesign.net/;@3shires;
1;0;#linkk Google adivinha resultado de busca antes que usuário dê "enter" http://bit.ly/au9GKF;;#linkk
0;0;via @linkkbrasil Google adivinha resultado de busca antes que usuário dê "enter" http://bit.ly/au9GKF;@linkkbrasil;
0;0;@tthaisdanielly nosso ilustríssimo Professor Wikipédia,o google ambulante! #omestreTONICO;@tthaisdanielly;#omestreTONICO
0;0;Google がトラフィックでもページ関連性判定している事が、特許公開で判明。コンテンツに共通要素を含んでてもユニークアクセス少なめサイトの相互リンクは、検索結果は悲しいって事 ［リンクが張られたページの関連性を特定する方法］ http://tinyurl.com/3y7na8q;;
0;0;說 www.cnbeta.com/articles/121558.htm ( Google Voice for Android 升级，增加桌面 widgets) http://plurk.com/p/7h6zp3;;
0;0;Hay gente que solo vive de "RetuiT". Piensen que es como copiar y pegar un trabajo de google y llevárselo a la profe -.-";;
0;0;WATCH: ' Google Instant' http://bit.ly/9sVzpg;;
0;0;Why does Google Instant show no love for the Ls and Bs in #LGBT ? http://sn.im/12brfv;;#LGBT
0;0;ユーザーが検索したい情報　先回りして表示「 Ｇｏｏｇｌｅ Ｉｎｓｔａｎｔ」 http://news.searchina.ne.jp/disp.cgi?y=2010&d=0910&f=business_0910_024.shtml;;
0;0;@JeffParsons Bold does have a GPS, Instead of paying for ATT navigator, you can use google maps...don't know if it does Turn by Turn though.;@JeffParsons;
0;0;WATCH: Details About Google TV http://bit.ly/bG75Lf;;
0;0;Create your own Google dots logo: http://bit.ly/coANB8 Comments: http://bit.ly/cxzM3S;;
0;0;Google 's AdMob delighted with new Apple policies http://bit.ly/b2D2oD;;
0;0;the keyword "07-ghost season 2" on google showed Rashidonline.net on the 3rd spot. and had given my page 584 pageviews. http://bit.ly/a7WDmD;;
0;0;“ @Luis_Rys : #enel2000 pentium 4 era lo mejor jajajaja y no existía Google , o si?”/: creo q no;@Luis_Rys;#enel2000
0;0;Google ..Not bad....http://www.google.com/;;
0;0;[2ch/ビジネスnews+] 【IT】中国などのネット検閲国家に圧力を　グーグル( Google )が呼びかけ［10/09/09］ 勢:362 #2ch http://bit.ly/bMEuwX;;#2ch
0;1;Google Apps (nearly) first class citizen now http://bit.ly/b1Yl1D (http://bit.ly/cAy402);;
0;0;Tried downloading Google voice & video chat plugin on iPhone: "Unfortunately Google voice & video chat is not available for PowerPC Macs";;
0;0;Work at Home…TriVita, Veretekk, SEO Social Networking | Google ... http://bit.ly/aXCfMG;;
0;0;Official Google Blog: Google Instant, behind the scenes http://bit.ly/9CJpMD;;
0;0;@Pauloavjr Tive que jogar no Google pra descobrir que diabos era cozumel. Ignorância é foda...;@Pauloavjr;
0;0;Facebook дюймов прошлом Google для веб минут пользователей #ru;;#ru
0;0;dogfooding (testing with Google employees) って言うんだ…。RT @google : A peek at the design & challenges of Google Instant http://bit.ly/aQDcIh;@google;
0;0;This kind of news makes me admire Google | Google Applauds Apple's New Developer Terms http://bit.ly/bx2XNS;;
0;0;checking google transit for bus routes from home to CWRU. never puts me on the Health Line. Best kept secret in leveland. What gives RTA?;;
0;0;@yoppu おはようございます。まあ、内部エンジンが Google に変わりましたからね;@yoppu;
0;0;Google Maps update brings Walking Navigation Beta and more: Google Maps for Android has been updated again ... http://bit.ly/c1V8UJ #mobile;;#mobile
0;0;Anyone else noticing increased traffic from Yahoo since Google Instant debuted?;;
0;0;Despite Justin Bieber Videos, YouTube Still Losing Google Money;;
0;0;por que?xd RT @stphnyprla tengo una pequeña duda en ingles.. Pero prefiero tenerla a usar Google Traductor, SOBRE MI CADAVER!;@stphnyprla;
0;0;Mene Google ya no es tan ‘hippie’ como cuando nació.: Alrededor de 150 especialistas en seguridad informática... http://m.menea.me/me4r @me;@me;
0;0;I'm about to open my Google Reader. Be afraid. Be very afraid.;;
0;0;Google Instant Prototype Looks a Bit Like Bing - Yahoo! News: Google 's new Google Instant search feature may not b... http://bit.ly/bBasba;;
0;0;Is Google making us Stupid with it's new search technology? http://bit.ly/cXNeCU Thoughts?;;
0;0;Clever stuff.. Using Google Instant Search With The Elements Song by Tom Lehrer http:// laughingsquid.com/using-google-i nstant-search-with-the-elements-song-by-tom-lehrer/ … via @laughingsquid;@laughingsquid;
0;0;Top story on the AppsMeet Daily http://bit.ly/dxukQt (via @SnappyTouch ) ▸ Games from Within | Google App Engine As Back End For iPhone Apps;@SnappyTouch;
0;0;Google : how many people have insurance?;;
0;0;N.O.B. News: Despite Justin Bieber Videos, YouTube Still Losing Google Money: By Sam Biddle on Septem... http://bit.ly/drkyl8 #JustinBieber;;#JustinBieber
0;0;+ 1 Estrelada: O que é o Google Instant? http://goo.gl/fb/wa9vH;;
0;0;RT @eWEEKNews Google Pays $8.5M to Settle Buzz Privacy Lawsuit - Security from eWeek http://bit.ly/aPvOYr;@eWEEKNews;
0;0;As Google gets smarter, are we getting dumber? http://bit.ly/9AqU4E;;
0;0;vo usa o google para ultima horaa, vo testa meu inglees :p;;
0;1;Google すごい　http://j.mp/9Yqc6G;;
0;0;I feel like Charlton Heston in Soylent Green when I talk about Google , but trust my horror ppl I know of which I speak;;
0;0;Great review! Google Voice vs. Skype:http://cnettv.cnet.com/google-voice-vs-skype/9742-1_53-50092772.html?tag=api?tag=twitter;;
0;0;RT @KatieLinendoll : Dear Google , You... autocomplete me.;@KatieLinendoll;
0;0;Google Magic Formula http://bit2.ca/PK83c;;
0;0;Google Walking Navigation beta and Street View now available for Android http://bit.ly/9exTDm;;
0;0;Google Maps #8220;Sponsored Map Icons#8221; Test Comes To U.S http://bit.ly/cX4Utf;;#8220 #8221
0;0;[ニュース] google news 政治! 鈴木宗男の命運は尽きたか？ - ウォール・ストリート・ジャーナル日本版 http://bit.ly/a5D3YQ;;
1;0;90% of knowing about computers is knowing how to use google .;;
0;0;Just heard this song called "Whip My Hair". I could see this being played in the clubs.....now google /youtube the title and b shocked!!;;
0;0;Introducing Google Instant [video] http://idek.net/31ht (via @GuyKawasaki );@GuyKawasaki;
0;0;@JoanneMJacobs ooh ahha! then i can't help ya ahaha google it or somethin;@JoanneMJacobs;
0;0;OH WHAT, I just explored GOOGLE VOICE and locked in a number with a 503 area code and the letters VIET - haha!;;
0;0;RT @fanultra : ¿Eyaculador precoz? Consuélate. Google Instant siempre será más rápido que tú... #googleinstantfacts @juancho21;@fanultra @juancho21;#googleinstantfacts
1;0;Maybe: (a) Google hates you, and life is unfair, (b) You suck, (c) Your back-links all have anchor "buy viagra" and you sell gum.;;
0;0;[ニュース] google news top! 日本振興銀：経営破綻 初のペイオフ発動へ - 毎日新聞 http://bit.ly/d1OI6z;;
0;0;Google Maps for Android Gets Turn-By-Turn Walking Directions, Satellite Imagery http://nxy.in/mi1wz / @rww;@rww;
0;0;Buka google translate lahhRT @tiaraaaP : Ceramah nya pake b.jawa lagi mana gue ngarti;@tiaraaaP;
0;0;Hmm, I don't remember allowing Google maps to auto update itself, what the ......;;
0;0;http://tinyurl.com/32b8lan Globe Genie: random teleporter for Google Street View - Boing Boing;;
0;0;StaleBacon Comic #222 " Google Balls" http://su.pr/7B10SP #webcomics #joke #google Please RT!;;#222 #webcomics #joke #google
0;0;Google Instant search feeds our real-time addiction - http://bit.ly/apoXHm #cnn;;#cnn
0;0;@justinbieber Justin most of the pictures of u on Google r so mean. i wasnt able2 come 2 ur concert on 9/5. I cried 4 like 3 hrs. plz follow;@justinbieber;
0;0;Google やリナックスが隆盛の中、マイクロソフトがどのようにしてFREEに対抗してきたのかなど、『FREE』を読んで整理ができた。この書籍、アプリピジネスに関わる人は必読の書と推薦しておきたい。;;
0;0;@raaraujo_ procura algumas produtoras no google e faz uns orçamentos, ai vc usa como base o de alguma;@raaraujo_;
0;0;Intel CEO reveals Google TV launch is this month, explains McAfee purchase http://bit.ly/acSerS;;
0;0;If Google was a baby, I'd smack it. So rude, it can't wait until I'm finished typing. I need another engine for search.;;
0;0;yes, i google everthing ok! Lol:);;
0;0;Money News: Why Google Voice Spells Trouble for AT&T and Verizon http://bit.ly/cX2PU9 http://bit.ly/bVHcBn;;
0;0;Why Google Voice Spells Trouble for AT&T and Verizon: Voice-over-IP and messaging services will eat into wireless carriers' revenues.;;
0;0;@oazamar (despues de buscar en google 30 segs) ¿como? ¿ASI?!?!?! -> http://bit.ly/c3fBjq;@oazamar;
0;0;Why Google Voice Spells Trouble for AT&T and Verizon: Voice-over-IP and messaging services will eat into wireless carriers' revenues.;;
0;0;nossa aprendi a deixar o simbulo do google sempre algum que escolher, tipo sempre o do pacman...quem sabe não posto depois no blog ;];;
0;0;Why Google Voice Spells Trouble for AT&T and Verizon: Voice-over-IP and messaging services will eat into wireless ... http://bit.ly/cX2PU9;;
0;0;Why Google Voice Spells Trouble for AT&T and Verizon: Voice-over-IP and messaging services will eat into wireless ... http://bit.ly/a2Z41O;;
1;0;Guess what: Intel's Otellini: Google TV shipping this month #Geek #WebTech #News http://bit.ly/boD808;;#Geek #WebTech #News
0;0;Guess what: Opera support for Google Instant: 'Shortly' #Geek #WebTech #News http://bit.ly/cXJiRb;;#Geek #WebTech #News
0;0;:O mi blog aparece en google si buscas el post q postee :P;;
0;0;fotos de mariscal no orkut já ! algumas foram censuras pelas normas do google . hahahaha;;
0;0;RT @victorpizarro : RT @srivero : 3 Aplicaciones para mejorar el posicionamiento en Google Instant. http://is.gd/f3c2G;@victorpizarro @srivero;
0;0;Google Maps update brings Walking Navigation Beta and more http://dlvr.it/5002d #tech #mobile #fb;;#tech #mobile #fb
0;0;The Side-Effects of Google Instant http://dlvr.it/5002f #tech #mobile #fb;;#tech #mobile #fb
0;0;【IT】中国などのネット検閲国家に圧力を グーグル( Google )が呼びかけ http://dlvr.it/50028;;
0;0;@Ginnny moet eerlijk bekennen dat google er aan te pas moest komen maar ik weet nu wat een scrunchie is en hoe god het zeker niet bedoelde;@Ginnny;
0;0;Google maps é muito viciante!;;
0;0;Ooww al cash sr RT @CoachCash45: S/o to my #Father for being on #WorldStarHiPHop ... Harlem Legend... Google him!;@CoachCash45;#Father #WorldStarHiPHop
0;0;thai-uebersetzer.de – Ihre Thai-Übersetzer Vielleicht sind Sie ja bei der google -Suche nach Thai Übersetzer,... http://fb.me/HlDbs5rp;;
0;0;Coloquei "fakenumber" (escrito junto) no Google Tradutor e apareceu a tradução "nx zero". É SÓ AQUI QUE ACONTECE ISSO? HAHAHA I FakeNumber;;
0;0;Google Speeds Up Searches With New Tool: Google has introduced Google Instant as the new default way to search the... http://bit.ly/biDGLG;;
0;0;Google Instant Search Feeds our Real-time Addiction http://ff.im/-qtekJ;;
0;0;Google Speeds Up Searches With New Tool: Google has introduced Google Instant as the new default way to sear... http://tinyurl.com/36c3mxx;;
0;0;Google Instant search feeds our real-time addiction - CNN http://bit.ly/arwOrj;;
0;0;#Android #Google Penguin II Power Bar http://bit.ly/9v1UAq #DhilipSiva;;#Android #Google #DhilipSiva
0;0;#Android #Google Penguin I Classic http://bit.ly/aBsLDa #DhilipSiva;;#Android #Google #DhilipSiva
