retweets;favorites;text;mentions;hashtags
11;14;Let's try to get GOOGLE to get BTS on their homepage on the boys anniversary date by doing the following: #BTS #bts4thanniversary @BTS_twt pic.twitter.com/w7ZCbo1QA5;@BTS_twt;#BTS #bts4thanniversary
0;0;Google Pixel XL International Giveaway @androidauth #giveaway https:// wn.nr/7ntWfC;@androidauth;#giveaway
0;1;caralho escrevi "porra de anjo" no google e só apareceu foto do rene na augusta eu to chorando;;
0;0;Que Apple y Google no se hagan patos, usan el micrófono, gps y demás periféricos del Smartphone para espiar con fines publicitarios...;;
0;0;#4: Google -HomeAssistant-2017: Google -HomeAssistant-2017 Recell Buy new: $104.49 13 used… https:// goo.gl/fb/hk7j7o #Networking #Product;;#4 #Networking #Product
0;4;pic.twitter.com/yTY8xiKRbe;;
0;0;Liat berita kantor google di atap nya ad hutan. Seketika jdi bayangin kerja disana terus senja nya ke atap liat pemandangan pasti indah bgt;;
0;0;Wow you KNOW you wanted to google it too!;;
0;0;The Ridiculous Bandwidth Costs of Amazon, Google and Microsoft Cloud Computing http:// ift.tt/2oXI5PZ;;
0;0;Google Pixel XL International Giveaway @androidauth #giveaway https:// wn.nr/AqzUw8;@androidauth;#giveaway
0;0;Noam Chomsky | Talks at Google https:// youtu.be/2C-zWrhFqpM via @YouTube;@YouTube;
0;6;Just survived @GoogleEarth & @GoogleMaps lightning talk at Google Sydney. #edchatnz #gegnz #digitaledchat #edtech https:// docs.google.com/presentation/d /1306NwTW5rRWZhfkvoFnCsqIFF7PWzyy8UeL7b_xJkAw/edit?usp=sharing …;@GoogleEarth @GoogleMaps;#edchatnz #gegnz #digitaledchat #edtech
0;3;I just had to write a check and I didn't know how so I had to google it lmao I love adult hood;;
0;1;eu to nervosa, só quero chorar STOP OVERTHINKING google pesquisar;;
6;0;@HTaladro Good morning, HGT. Teka, google ko yan mamaya. Sino ang singer? Happy Tuesday. Love&Smiles. #ALDUBAllTheWay;@HTaladro;#ALDUBAllTheWay
0;2;just wonder how many of y'all "speak english you're in america" "go back to your country" have google translated "despacito";;
0;0;How's this better than Google Home or Amazon Alexa);;
0;0;ということで、僕のNexus 5XにGoogleアシスタントはいつ…;;
0;1;She has twitter bots that will actively respond with stupid shit like trying to remind a user to do self care. Seriously, just Google her.;;
0;0;Google activa la alerta SEO ante el abuso del link building masivo https:// marketing4ecommerce.net/abuso-del-link -building-masivo/ … vía @Mkt4eCommerce;@Mkt4eCommerce;
0;1;How did google know its my birthday? pic.twitter.com/kwEvDq97nk;;
0;0;I guess Google dosen’t know memes https:// tmblr.co/ZK3T0h2MPHzGU;;
0;0;Your next Android phone -- Samsung Galaxy S8 or Google Pixel? http:// itnews.drifterup.com/News/Details/2 9795 … #Google Pixel @RealInvestigatorIT pic.twitter.com/fEOMCe5DyQ;@RealInvestigatorIT;#Google
0;0;Apple HomePod vs. Amazon Echo vs. Google Home – CNET http:// bit.ly/2saMH5S;;
0;0;DaycareDailies for Android has been released! Download it on the google play store today! https:// goo.gl/s5oZaR pic.twitter.com/yoR795XvTL;;
0;0;Anyone buy a second Google Home for another 6 months of Play Music and YouTube Red? http:// ift.tt/2rECUm9;;
0;0;➝Very very Berry on Google play https:// play.google.com/store/music/ar tist/Very_very_Berry?id=Apw2juqqtdpufwejm5om3bhugwm … #musica #Giappone #informazioni;;#musica #Giappone #informazioni
0;0;Alguém nesse momento esta procurando a sua empresa no Google ! Criamos campanhas direcionadas NO… https://www. instagram.com/p/BU-iQUEjg2T/;;
0;1;Google Webmaster Hangout Notes: May 30th 2017 - DeepCrawl http:// bit.ly/2qRecxL #SEO via @DeepCrawl;@DeepCrawl;#SEO
0;0;Joguei isso no Google e caiu em um artigo explicando os porque/que era um anúncio e me questionei dos limites do role;;
2;1;Google Play’s policy on incentivized ratings, reviews, and installs http:// bit.ly/2qUrc9A #androiddev #android;;#androiddev #android
0;0;How to Use Google Adwords Click-to-Message To Close More Sales @salesmsg http:// blog.salesmessage.com/google-click-t o-message …;@salesmsg;
0;1;SIM SIM SIM EU TBM PESQUISEI LAJDOADJQLDNWPRKW O GOOGLE SABE DOS ESQUEMAS KSJDKSJAOD;;
0;0;Poll: Many SEOs Say They Were Hit By The Google Fred Update http:// dld.bz/fMm9H;;
0;0;Gostei de um vídeo @YouTube http:// youtu.be/bhvx4irbYk0?a MINUTOS DA ZOEIRA #7 - NARRADO PELO GOOGLE TRADUTOR;@YouTube;#7
0;0;Poll: Many SEOs Say They Were Hit By The Google Fred Update http:// dld.bz/fMm9H;;
0;0;police caught staging London bridge hoax - Google Search http:// fb.me/zJdeqdpE;;
0;0;Apple Debuts HomePod, Its Competitor to Google Home and Amazon Echo... Apple today announced the HomePod, a ...... http:// bit.ly/2sazkms pic.twitter.com/I65BC88BCJ;;
0;0;I was talking about Amazon Alexa and Google Home;;
0;0;GOOGLE TRICKS YOU HAVE TO TRY NOW!!!: http:// youtu.be/dMWFxPo4okI?a via @YouTube;@YouTube;
194;220;您社群帳號、網站部落格的人氣守護者！ 為顧客的FB、Instagram、Youtube、部落格、Twitter、 Google 地圖五星...號召粉絲觀看、按讚、衝人氣！官網1： http://www. fans-door.com / 官網2： http:// fansdoor.com pic.twitter.com/V9zdzSk5p5;;
1;3;Escolha a sua assistente de voz doméstica: Google Home, Alexa da Amazon e agora HomePod da Apple ! #RockStory http:// pocca.com.br/view?id=moWRGa rQ&utm_source=twitter …;;#RockStory
0;0;12件のコメント http:// b.hatena.ne.jp/entry/s/www.su zukikenichi.com/blog/google-ad-experience/#tw?u=ynabokun … “ Google 、ウザい広告はChromeで表示しなくなることを決定。広告に関する問題のレポートをSearch Consoleで公開 | 海外SEO情報ブログ” http:// htn.to/evcCzr;;#tw
0;0;Actual google earth street view of proposed location. pic.twitter.com/5l75CBssvL;;
0;0;Google ストリートビューとは、 Google 検索、 Google マップ、Google＋で、店舗・施設の中を360°のパノラマ画像で疑似体験できるサービスです。 http:// bit.ly/2bvskEG pic.twitter.com/WVGTq88s4Q;;
0;2;um...if that's what you call it, might wanna google conspiracy theory means a bunch of ppl made up a fake story i take him at his word;;
0;0;Como baixar aplicativos e jogos no Google Play Store http:// dlvr.it/PK2QQh pic.twitter.com/zH3SjF405F;;
1;0;If anyone can tell me the first music video ever shown on @MTV I will buy them a treat. (Don't google , have some class);@MTV;
0;0;King of dark fantasy. Summon today. App Store: http:// bit.ly/AzhyKP Google Play: http:// bit.ly/NtcNTs #DarkSummoner;;#DarkSummoner
0;0;Ué, o meu também tá D: Tu conectou teu BS com a conta google ?;;
0;0;Hey @Apple , High Sierra will prevent Ad Tracking, but what about when you or Google open the Mic to hear me and sent me Targeted Ads...;@Apple;
0;0;No busqueis Hannar Hentai en google imágenes ...;;
0;0;Gostei de um vídeo @YouTube http:// youtu.be/Lyp_LYJPE2w?aEM HD - RESUMO DA ZUEIRA #55 - NARRADO PELO GOOGLE TRADUTOR;@YouTube;#55
0;1;Searching on google How to mehboob aap k qadmo main.;;
0;0;App Storeの段階的リリースって Google と違ってリリースの割合を選べるわけじゃないのかな。;;
0;0;dark Google give me more josie rizal guides and not discourse from 2015;;
0;0;少佐：こないだ中尉に肉じゃが作ってって頼んだら｢そんなもの少尉か中佐に頼めよ！」って返されたんだけど次の日 Google の検索履歴見たら 肉じゃが おいしい肉じゃが 最高の肉じゃが 究極の肉じゃが 至高のにｋｊはｄ 至高の肉じゃが ってあった;;
0;2;Google me descontrata, eu perdi o pendrive;;
0;0;"LeBron James and Kevin Durant collaborated on a secret hip-hop track in 2011 - ESPN (blog)" {by } via #Google #Sp … http:// bit.ly/2qUrjlT;;#Google #Sp
0;0;Google translate would put the "ni" with "oitokeru" and it's registering "nioi" so GT gave me "those bastards will smell you";;
0;1;ooooOOOOOH TOP IS FUCKING RUINED SKJSKJC SOMEONE GOOGLE SEARCH THAT PIC IM P SURE IT'S JUST AN ULZZANG;;
0;0;apple WWDCの発表内容を軽く確認したamazon echo, Google homeの対抗でHomePod出すのか。 http:// gigazine.net/news/20170606- homepod-wwdc-2017/ …;;
0;0;Ａ「竹中半兵衛ってどんな人なんだろ(・・?)」　B「 Google で画像検索してみたら良いんじゃない？」　Ａ「」 http:// twitpic.com/bfp89d 誰だよ;;
0;0;Google Pixel XL International Giveaway @androidauth #giveaway https:// wn.nr/r8Z8rF;@androidauth;#giveaway
0;4;Sharing from Aqwaal-e-Zareen Android App. Google Play URL: https:// play.google.com/store/apps/det ails?id=com.appchamp.urdu.aqwalezareen … pic.twitter.com/0cSdqLYnXj;;
0;0;Chapéus corretor d texto tbm ajuda mais c quiser confirmar vai no pai dos burros virtual GOOGLE;;
0;14;7th grader reading to Kindergarten students via Google Hangouts #csufedtech pic.twitter.com/vHDFqaPMBs;;#csufedtech
0;0;Access more listings with full details (days on the market, addresses, Google maps,...) Register here for Free: http:// dld.bz/fewfm pic.twitter.com/0HpEsyAUag;;
0;0;ARMYS lets try to get google to do a doodle for them on BTS's anniversary date!! #v #bts #jimin … https://www. instagram.com/p/BU-iK6clthV/;;#v #bts #jimin
0;0;Pretty sure Cindy Smith just got her intern to google Nashville at the last minute to write this. http:// ift.tt/2qSMgO5;;
0;0;Where is Serena? imho, a contender in the Race! & ranked @WTA ? Google her,lol! & not fake sites;@WTA;
0;4;#periodismo y nuevos escenarios: WSJ cerró el "click free" desde Google y el tráfico desde el buscador cayó 44%, vía @mathewi @technology https:// twitter.com/mathewi/status /871850250788626433 …;@mathewi @technology;#periodismo
0;0;I would've known this is in DZ if I saw it on google;;
1;0;Garage Digital: el plan de formación personalizado y gratuito de Google https:// goo.gl/TvFAjU;;
0;0;[ダークサマナー]イベント「熾烈なる共同戦線」開催。GOD化可能新SモンスターをGETしよう AppStore： http:// bit.ly/P63JqN Google Play： http:// bit.ly/Nl1XT4 #DarkSummoner_jp;;#DarkSummoner_jp
0;1;If you type yonder in Google maps as destination. It will pull up the last address you were at. https:// twitter.com/Crappy_Advice/ status/871860762485997568 …;;
0;0;Thanks, Michelle Atkinson, for your excellent review on Google @Birdeye_ https:// birdeye.com/village-dental -olde-raleigh-147734154337783/review/56010541538785190 …;@Birdeye_;
0;0;Thanks, joseph troiano, for your great review on Google @Birdeye_ https:// birdeye.com/five-star-impr ovements-148226800069329/review/56010543438785191 …;@Birdeye_;
0;0;Google Pixel XL International Giveaway @androidauth #giveaway https:// wn.nr/ByRW7y;@androidauth;#giveaway
0;1;"Hoje vou estudar pra física" 30 minutos depois no Google : homem sofre de "TPM"? pic.twitter.com/J6zaZGL3Kn;;
1;0;ldjrlrkr eh en vrai g juste cherché sur google "exo shooting hearts" et BAM sexy xiumin https:// twitter.com/snkibum/status /871878044910321664 …;;
0;0;MASAKI YODA Release on Google play music -High- https:// play.google.com/store/music/al bum/MASAKI_YODA_%E4%BE%9D%E7%94%B0%E6%AD%A3%E6%A8%B9_High?id=Bcvu3yjwimoks2owjnltgdvg6ca&hl=ja … #musica #Giappone #informazioni;;#musica #Giappone #informazioni
1;9;So my sister told me to Google the high school I went to and this is what happens... nice to see the former me. So hopeful, so naïve pic.twitter.com/7qzGrZKZvN;;
0;0;いや文脈を読み取れよ Google グラスみたいなもの？って聞いたらホロレンズみたいなものって言うから、その二つはなにが違うのかを聞いているんだが;;
0;0;Cutting Misty hair in Morocco on location @Google magic https://www. instagram.com/p/BU-iIfzFXKY/;@Google;
0;0;¿Cómo puedes evitar que Google Maps rastree tu ubicación? https:// goo.gl/73yRyg;;
0;0;The Ridiculous Bandwidth Costs of Amazon, Google and Microsoft Cloud Computing http:// ift.tt/2oXI5PZ #startup #Dubai #KSA;;#startup #Dubai #KSA
0;1;Am yet even on " Google maps" see some resembling play station pads https:// twitter.com/MisterBoldwood /status/871877723236552704 …;;
0;0;Seguro investigaste en google ajajajajajaja;;
0;0;I just had to Google that. But yes I think I agree.;;
0;0;you have google , go figure it out;;
0;0;Now playing MR DELAWARE FAME - Closure_fixed dl the app google play & ios be apart of the movement;;
0;0;Google 君に風評被害が及ぶところだったから削除;;
0;0;what about google docs?;;
0;3;Android 7.1.1 Nougat Soak Test Underway for Moto Z Play http:// dlvr.it/PK2QBT #Android #Google #news pic.twitter.com/N0ezaWcCx4;;#Android #Google #news
0;0;Apple HomePod vs. Amazon Echo vs. Google Home - CNET http:// dlvr.it/PK2PtM pic.twitter.com/VkjlK9x5nS;;
0;1;I've already added it to my Google calendar!!! YAS! And it's even a Friday;;
0;0;Google Pixel XL International Giveaway @androidauth #giveaway https:// wn.nr/7n5MBC;@androidauth;#giveaway
0;0;#Consulting #Affiliate #E -zine #Promotion #Blog Run Your Own Search Engine And Make Money Like Google ! http:// dlvr.it/PK2Pss pic.twitter.com/YRwC2kg685;;#Consulting #Affiliate #E #Promotion #Blog
0;0;Google Pixel XL International Giveaway @androidauth #giveaway https:// wn.nr/kMzqPX;@androidauth;#giveaway
0;0;Resource: Microsoft Guides for Switching from Google Services to Office 365 For Business (Windows IT Pro) http:// dlvr.it/PK2Q0g;;
4;4;[CNET] The HomePod: Apple's answer to the Amazon Echo and Google Home video - CNET http:// j.mp/2rXB96h;;
0;1;eh so descobrirem que ce eh trans que automaticamente aparece so pergunta sobre isso no cc vai pro google meu bem;;
0;0;" Google likes it when your update old content." http:// ow.ly/kKIt30ciXKa @Katie_Hornor Advice for updating your blog posts. Great tips!;@Katie_Hornor;
0;0;https:// goo.gl/XO07Y5 @eBay @youtube @Facebook @cnn @BBCBreaking @google @BBCWorld @twitter @cnnbrk @nytimes @globaltimesnews @instagram pic.twitter.com/Q9lEUY7SFh;@eBay @youtube @Facebook @cnn @BBCBreaking @google @BBCWorld @twitter @cnnbrk @nytimes @globaltimesnews @instagram;
0;0;HNews: The Ridiculous Bandwidth Costs of Amazon, Google and Microsoft Cloud Computing http:// bit.ly/2sb9EG3 #google #amazon;;#google #amazon
0;1;Apple, Amazon, and Google have all expertly built entire ecosystems with each piece building on every other part.;;
1;3;En el Día Mundial del Medio Ambiente se apuesta por conectar a las personas con la naturaleza, así lo celebra Google https:// goo.gl/MGZ5rl;;
0;0;Google y el cambio de la comercialización digital con Deep y Machine Learning #Cloud http:// ow.ly/wxoZ30cl5AY;;#Cloud
0;0;Te recomiendo jugar #Apensar desde tu móvil.Disponible en App Store http:// icogr.com/18XJ4TU y en Google Play http:// icogr.com/1AdkmW1;;#Apensar
0;0;Descarga Nuestra APP Nos encuentras en la Google Play como: Kebuena Puebla Radio Descargala y Escucha en tu... http:// fb.me/1pOYoYoxV;;
0;0;#NowPlayingOnXIVFM RickyDash - Dja c'est djandjou #XIVFM Disponible sur App Store! & Google Play! http://www. xivfm.com;;#NowPlayingOnXIVFM #XIVFM
0;3;How long until Google and Amazon will start touting the privacy features of Home and Echo, respectively, to show they’re as good as Apple?;;
0;0;Ah yes. I too can Google conspiracy theories from Breitbart.;;
0;0;Wait paypal isn't instant though. You need google wallet or venmo;;
0;0;WWDC 2017 Siri Speaker Vs Google Home http:// bgr.com/2017/06/05/wwd c-2017-siri-speaker-vs-google-home-amazon-sale/ …;;
0;0;Send your girl a google quote;;
0;0;Pero la re puta madre Internet de miérda no me deja entrar a Google !;;
0;0;Apple, Amazon, Google and other tech giants are joining an effort to adhere to the Paris climate agreement https://www. recode.net/2017/6/5/15741 016/apple-google-donald-trump-us-paris-climate-agreement …;;
0;0;Resource: Microsoft Guides for Switching from Google Services to Office 365 For Business (Windows IT Pro) http:// dlvr.it/PK2Plz;;
0;0;Apple Unveils HomePod Speaker, Long After Amazon, Google (Tyler Durden/zero hedge) http:// dlvr.it/PK2Ply;;
0;4;harder to google cat-friendly pot edible recipe than i would've thought;;
0;0;O Great Confessor Google (Mike Pesca/Slate Magazine) http:// dlvr.it/PK2Plv;;
0;0;Apple Unveils HomePod Speaker, Long After Amazon, Google (Tyler Durden/zero hedge) http:// dlvr.it/PK2Plw;;
0;0;@YouTube @Google censor the mildest infraction yet allow terrorists to preach to their masses from their sites? U r terrorist sympathizers https:// twitter.com/michellemalkin /status/871824691991805955 …;@YouTube @Google;
0;1;One time in 6th grade I convinced my friend NASDAQ was Google spelled backwards and he believed me.;;
0;1;what is google ? SMH GTFO;;
0;0;Não tô conseguindo usar o SoundCloud nem no app nem no Google;;
0;1;Google 欲しいです.*･ﾟ　.ﾟ･*.;;
0;0;See the latest post from Cars 3 on Google https:// goo.gl/GQFyqL;;
0;0;Be Careful Celebrating Google ’s New Ad Blocker. Here’s What’s Really Going On. https:// theintercept.com/2017/06/05/be- careful-celebrating-googles-new-ad-blocker-heres-whats-really-going-on/ …;;
0;0;Google アナリティクスで自社内からのアクセスを分析から除外する方法 http:// compactlife.info/?p=117;;
0;0;Mercers bought up lots of stock in Google last year, just saying https:// twitter.com/Fems2Good4Trum p/status/871764234480353280 …;;
0;0;Google Chrome intègrera un bloqueur de pubs début 2018 - http:// 01net.com http:// zut.io/0RNAv;;
0;0;If you type into Google Jeremy Corbyn's name look at the 1st thing that comes up lol pic.twitter.com/J1pU9m8h1W;;
0;0;ラクマ(rakuma)で換金を行っています!!!!。iTunes Amazon google 他可能でございます。(itunesの値段です) 1000→950 1500→1450 3000→2900 5000→4800 10000→9400;;
0;0;WWDC 2017 Siri Speaker Vs Google Home http:// bgr.com/2017/06/05/wwd c-2017-siri-speaker-vs-google-home-amazon-sale/ …;;
0;0;フリル(Fril)で換金を行っています!!!!!!!。iTunes Amazon google 他可能でございます。(itunesの値段です) 1000→950 1500→1450 3000→2900 5000→4800 10000→9400;;
0;0;Google 's Ridiculous Patent on Dropout http:// ift.tt/1IruwKD;;
0;1;Of the 3, Google Home, Amazon Echo, & Apple HomePod, the HomePod is the best looking. If the sound lives up to the hype, I'm in. #wwdc2017;;#wwdc2017
0;0;GOOGLE OF CANADA TO BE CLOSED FOREVER! http://www. martiniforpm.com/2017/04/27/goo gle-of-canada-to-be-closed-forever/ …;;
0;1;Le contenu AMP à chargement rapide de Google génère 35 % d'engagement de plus que le contenu web mobile http:// ift.tt/2ruNAFn;;
0;0;Apple HomePod vs. Amazon Echo vs. Google Home - CNET: The HomePod could easily be a better… https:// goo.gl/fb/V0aRI3;;
1;0;You tell me some shit that sound like bullshit, Imma google it right there and if you wrong, imma tell you. Now we're both smarter;;
0;1;→ Eller när beskrivningen av appar i Google Play Store tvångsmaskinöversätts till svenska så det ser helt häjkon bäjkon ut.;;
0;1;#USA #UK - #Google - Keep learning about the Revolution in Internet Marketing => http:// bit.ly/2nhXR30 pic.twitter.com/WSCQrmrXaV;;#USA #UK #Google
0;0;Google Pixel XL International Giveaway! https:// wn.nr/xXHdHF;;
0;1;digr_io Google is about to start blocking annoying ads so you don't have to (GOOGL) http://www. businessinsider.com/google-is-abou t-to-start-blocking-annoying-ads-so-you-dont-have-to-2017-6 …;;
0;0;I'll google it up and follow the steps on WikiHow. > Gentleman on the street, unforgiving on the sheet. > Late night texts until she gets -;;
0;0;Google street view guy at Bay and Adelaide via /r/toronto http:// imgur.com/gYlNNtt;;
0;0;What Marketers Should Take Away from Google I/O 2017 - Business 2 Community https:// apple.news/AGKFPaa0dOMSBJ 877hAL6sg …;;
0;0;Journal ends Google users’ free ride, fades in search results https:// goo.gl/fb/k0EnNd;;
0;0;【ダークサマナー】ダークファンタジーの王道ゲーム！数多のモンスターと最強を目指せ！ AppStore： http:// bit.ly/P63JqN Google Play： http:// bit.ly/Nl1XT4 #DarkSummoner_jp;;#DarkSummoner_jp
0;0;Please post a link as google reveals nothing. Thank you.;;
0;1;My Google Home won’t speak Lyft, Siri still rando-dials people I never talk to, so no thanks, Apple, no HomePod today.;;
0;1;アプリのスケジュール帖はお知らせを[○週間前][○日前][○時間前]複数設定できるので 物忘れ激しい私(昔から最近特に )にはもう命綱レベル…スマホにある Google のです、おかげでWブッキングやうっかりドタキャンがなくなってます スマホ tubアカ同期するからどれからも入力可;;
0;1;Sim, é caro. Normalmente o onhockey (dá um google ) tem mais opções de links;;
0;0;Very very Berry on Google play https:// play.google.com/store/music/ar tist/Very_very_Berry?id=Apw2juqqtdpufwejm5om3bhugwm … #music #musik #japan #INFORMATION;;#music #musik #japan #INFORMATION
0;1;My brain is like a Google Chrome browser with 67 different tabs open;;
0;0;King of dark fantasy. Summon today. App Store: http:// bit.ly/AzhyKP Google Play: http:// bit.ly/NtcNTs #DarkSummoner;;#DarkSummoner
0;0;[ダークサマナー]イベント「熾烈なる共同戦線」開催。GOD化可能新SモンスターをGETしよう AppStore： http:// bit.ly/P63JqN Google Play： http:// bit.ly/Nl1XT4 #DarkSummoner_jp;;#DarkSummoner_jp
0;0;domaines, ainsi que les derniers développements au Moyen-Orient. ( google traduction);;
0;0;#gesyrt12 Master Universitario en eLearning y Redes Sociales: Herramientas 2.0_ Google Docs http:// unirgestoresdeaprendizaje.blogspot.com/2017/06/herram ientas-20google-docs.html?spref=tw …;;#gesyrt12
0;1;Oculus Founder’s Startup Working On Lidar Surveillance Tech http:// dlvr.it/PK2Ph0 #Android #Google #news pic.twitter.com/qKuAldj63S;;#Android #Google #news
0;4;Alleged NSA leaker's surname is "Winner". Google says that surname drives from German "Wanne". German or (((German)))?;;
0;0;I'm not as good as Google;;
0;0;King of dark fantasy. Summon today. App Store: http:// bit.ly/AzhyKP Google Play: http:// bit.ly/NtcNTs #DarkSummoner;;#DarkSummoner
0;0;SEO tip #3: Set up a Google business page and keep it updated #SEO #Google #Business;;#3 #SEO #Google #Business
0;0;Es delivery nada más, pone en Google Don bauru y ahí te aparece el número tienen de todo, la única cagada es que No tiene página ni nada;;
0;0;Google is about to start blocking annoying ads so you don't have to (GOOGL) http://www. businessinsider.com/google-is-abou t-to-start-blocking-annoying-ads-so-you-dont-have-to-2017-6 …;;
0;2;Marketing Land: Google confirms it will start blocking ‘annoying’ ads on Chrome next year - http:// buff.ly/2rD92bB;;
0;0;#Homepod costs $350... for $350 i can buy another google home and an Alexa and still spend less.. #Apple is such a joke.;;#Homepod #Apple
0;0;Google Pixel XL International Giveaway @androidauth #giveaway https:// wn.nr/GC8Nq2;@androidauth;#giveaway
0;1;This post was actually on Google News. Congrats @MarkDice https://www. youtube.com/watch?v=aI2AIu 9oBJg …;@MarkDice;
0;0;Google Pixel XL International Giveaway @androidauth #giveaway https:// wn.nr/6qRYCB;@androidauth;#giveaway
0;0;+ an article about them, I guess? But if you really want to, you should make more use of Google Images;;
0;0;Google Pixel XL International Giveaway! https:// wn.nr/Ecx4WH;;
0;0;En Google escribo talingo y me sale el mismo que la imagen que usted envió pic.twitter.com/eBQU60FvXp;;
0;0;@Google pic.twitter.com/C4stKyh0Ty;@Google;
0;1;AN ADULT HAVING SEX WITH A MINOR IS RAPE! STATUTORY RAPE! GOOGLE IT! https:// twitter.com/supa_dupa_hero /status/871876014145757185 …;;
1;1;Eu sei que vc sabe que eu sei que vc sabe que eu sei que vc sabe que eu sei q é Google;;
0;0;Is there a google chrome extension or hos do I do this?;;
0;0;TE JURO QUE NO VI ADEMÁS QUE ESTABA BUSCANDO EL GIF EN GOOGLE PORQUE NO LO TENÍA JAJAJAJAJA;;
0;6;Kinda obsessed with this #datanerd @google http://www. blog.google/products/g-sui te/visualize-data-instantly-machine-learning-google-sheets/ …;@google;#datanerd
0;0;United Onslaught is on! Get Divine Evolvable Rank S! App Store: http:// bit.ly/AzhyKP Google Play: http:// bit.ly/NtcNTs #DarkSummoner;;#DarkSummoner
0;0;Google champion....oh wait. Theres not a prize for that... Carter Page https:// twitter.com/funder/status/ 871872017422831616 …;;
0;0;Google ’s breakdown of what Americans don’t know how to spell, state by state http:// wapo.st/2qFbw55?tid=ss _tw&utm_term=.e3aef504f249 …;;
0;0;Google Pixel XL International Giveaway @androidauth #giveaway https:// wn.nr/xXHdHF;@androidauth;#giveaway
0;0;Google Pixel XL International Giveaway @androidauth #giveaway https:// wn.nr/kMzqhJ;@androidauth;#giveaway
0;0;Google Pixel XL International Giveaway @androidauth #giveaway https:// wn.nr/Ecx4WH;@androidauth;#giveaway
0;0;$100 please. Don't they teach you how to use Google in college? https://www. youtube.com/watch?v=gm9iZn qGMvY …;;
0;0;Google Earth gives you the opportunity to see anywhere in the world, so what do we do - we search our own house;;
0;2;Hail Google;;
0;0;ya udah cek google ? ok google .;;
0;1;Looks like someone decided to google how to write a proper sentence. Next google how to use GIFs https:// twitter.com/chadhammon/sta tus/871811454957228034 …;;
0;0;@Google Thank you. Almost asked an embarrassing question on here;@Google;
0;0;@Google has a problem with guns, but this is just fine?;@Google;
0;0;I'll google it and see what comes up;;
0;0;♫MASAKI YODA Release on Google play music -High- https:// play.google.com/store/music/al bum/MASAKI_YODA_%E4%BE%9D%E7%94%B0%E6%AD%A3%E6%A8%B9_High?id=Bcvu3yjwimoks2owjnltgdvg6ca&hl=ja … #music #musik #japan #INFORMATION;;#music #musik #japan #INFORMATION
