retweets;favorites;text;mentions;hashtags
0;0;nice cümleleri doğru çeviren google translate, Pazar Segmentasyonunu "Sunday Segmentation" olarak çevirmenn chicken translationdan farkı ne?;;
5;0;Update: Google on suing US government - "a fair and open process could save US taxpayers tens of millions of dollars" http://tnw.to/16xyF;;
0;0;Look what I drew in the office melbourne cup sweep! *looks up name on google * http://flic.kr/p/8PYG5M;;
0;0;@bucanero14 Por eso, Growl tiene para todo tipo de apps. Yo lo tengo con Adium, Dropbox, Google , Echofon, Evernote, Skype, Transmission...;@bucanero14;
0;0;やはりタスクリストアプリがほしい。 Google のやつと同期できて並び替えやインデントができるやつ;;
0;0;@faraahriza eh eh eh parah lo bawa" bekasi hahaha untung saya anak jakarta :P masa siiih dari google ? :P;@faraahriza;
0;0;How To Make Digital Flashcards With Google Docs Spreadsheets [Web & iOS/Android] http://goo.gl/fb/wXA8O;;
0;0;New blog post : How To Set Up Google Adsense On Your Website! Get Payed From Google For Advertising! http://bit.ly/bHF3Hb;;
0;0;Google の検索の一番下がcurrrrrrrrrryになるのはいつなのかしら…。;;
0;0;I liked a YouTube video -- Trading a long spread on Google Inc (GOOG) http://youtu.be/Wd08kvlr1to?a;;
0;0;Wow! Is The New #Google Chrome OS An Attempt To Make Your Hard Drive Obsolete? http://su.pr/1gmzcM;;#Google
0;0;If your have a small business in Stafford and want help to improve your Google ranking, call Phil @3shires http://3shiresdesign.net/;@3shires;
0;0;Quando você desenvolve algo que envolve HTML +CSS+Javascript, é aí que você vê COMO O GOOGLE CHROME É MELHOR que os outros browsers!;;
0;0;New API of the Week: Google Custom Search API - Plus: Google APIs Console http://rww.to/a0VR3x;;
1;0;Знайшов ще один цікавий та корисний інструмент від #google для збору ідей і питань http://www.google.com/moderator/;;#google
0;0;Someone searched for "givi trunk 37 l" on Google and landed on http://www.helmetheadcycle.com/product/1663/givi-e370-monolock-top-case.;;
2;2;Google Sues The US Government For Only Considering Microsoft Solutions http://lnkd.in/6YWt53;;
0;0;I am curious how this "App Store" will play out. Android, Google , BlackBerry, Microsoft, Nokia, Adobe etc. all have app stores.;;
0;0;Before you find out who wins, see who gets the most searches on Google : http://goo.gl/ribu. And don't forget to vote!;;
0;0;Google calls bug bounty hunters to YouTube, Blogger #google #youtube http://bit.ly/dAoKT1;;#google #youtube
0;0;Google sues agency over Microsoft-only cloud deal http://bit.ly/dCiqeO #tech #news;;#tech #news
0;0;@ChooseGaabiS Não DD: Google \o/;@ChooseGaabiS;
0;0;Google Sues Interior Dept Over E-mail Bid Request http://goo.gl/fb/cK9kW;;
0;0;just completed coding a FTP module for google product feeds... time for bed!;;
0;0;tech headlines Google sues agency over Microsoft-only cloud deal: Google and a reseller of its produc... http://bit.ly/djmc4X www.pcguys.eu;;
0;0;@oysta probably not google .com, but just for google .com.au?;@oysta;
0;0;I was about to Google something... then I forgot. Story of my life.;;
0;0;Google Files Suit Against US Govt. Over Contracts: On Friday, Google filed suit against the US… http://bit.ly/TechN;;
0;0;Blekko Social Search Challenges Google -- InformationWeek: Blekko Social Search Challenges… http://bit.ly/TechN;;
0;0;Get rapid, mass traffic to your site without Google or crazy SEO tricks. http://cli.gs/2T1TH;;
0;0;@sivavaid Very true. I think Chuck is suggesting that institutions that *can* work at web scale ( Google ) are in danger of supplanting Us.;@sivavaid;
0;0;Looks like my ma doesn't have Safari or Google Chrome on her computer But she has Internet Explorer -_-;;
0;0;@Ari_hoover like bbm or google tlk jus for blackberry android n iphone;@Ari_hoover;
0;0;Soon, Google , soon. RT @twiteconomy : #NYT : A New Search Engine, Where Less Is More http://nyti.ms/aJ9ONQ #business #money;@twiteconomy;#NYT #business #money
0;0;Google WM: google analytics: why arent i seeing anything for the past 1 1/2 weeks-suddenly nothing is registering/... http://bit.ly/crnkOF;;
0;0;Google in US lawsuit over online applications: The online search group sues the US Department of the Interior in a... http://bit.ly/d52y3a;;
0;0;The Google Traffic Pump System, E-business & E-marketing #Ebusiness #Emarketing http://nblo.gs/9XUlk;;#Ebusiness #Emarketing
0;0;Someone must have made the "worst waive since Google 's" joke by now, right? #toolazytosearch;;#toolazytosearch
0;0;RT @i_Justo : Having trouble syncing my google calendar w/ my blackberry.....Tuff -- damn my Nigga, u got it bad;@i_Justo;
0;0;O google tradutor do chrome ñ tá funcionando, beleza!;;
0;0;Consejos de seguridad para usar #Google #Chrome http://bit.ly/9WS3pO;;#Google #Chrome
1;0;If u search images of @jhuivanhaitsma on Google this is what u find... http://twitpic.com/332uar lol;@jhuivanhaitsma;
0;0;@TrickyLT google;@TrickyLT;
0;0;RT: @wsjamericas : Google demanda al Departamento del Interior por contrato de correo electrónico http://bit.ly/c74lRE;@wsjamericas;
0;0;Google アラートは読んだらすぐに破棄しないと、ものすごい勢いでたまってゆく。とりあえず数千あったものをすべて削除。;;
0;0;hmm botei um tema no meu Google Chorme *---*;;
0;0;RT @teksquisite : Google calls bug bounty hunters to YouTube, Blogger http://bit.ly/avD5fq;@teksquisite;
0;0;o.O if you use Google maps from Japan to Taiwan, they will ask you to jet ski over the ocean on step 43! What the hell?;;
0;0;@surlyF That was just the first Google link for the following search: academic press rejection rates -maternal;@surlyF;
0;0;AN24: #Wettkampf mit #Microsoft : #Google verklagt US-Innenministerium: Kampf um die US-Büros… http://goo.gl/fb/TiQkx;;#Wettkampf #Microsoft #Google
0;0;pesquisando no google sobre retirada de amigdalas.. :(;;
1;0;1) Go onto google maps 2) Click get directions 3) Put Japan in the first box and USA on the second 4) Go down to 27.retweet if you get it!;;
0;0;@EbyyN yup. 60% sure. google it;s high time.;@EbyyN;
0;0;Where to vote tomorrow, who's on the ballot, if you're registered + more. Google Election Center: http://ow.ly/32RIT #4aafgov;;#4aafgov
0;0;my @msteagan background on my phone so sexy lol i want a booty shot but none come out on google  http://yfrog.com/mgbprzsj;@msteagan;
0;0;Apple, Google looking to buy Boku for mobile payments: Apple and Google are both investigating the prospect of buy... http://bit.ly/ahvjtX;;
0;0;Google sues Interior Dept over e-mail bid request Google is suing the U.S. Department of the Interior over a request fo.. http://dld.bz/45P7;;
0;0;RT @Mediavista : Apple, Google looking to buy Boku for mobile payments: Apple and Google are both investigating (cont) http://tl.gd/6oumn4;@Mediavista;
0;0;RT @family_jules 1) Go to google maps2) Set Japan as start location and China as end location3) Read direction number 43;@family_jules;
0;0;@myersnews @ckanal @mjenkins @kategardiner : I think it's an interesting experiment -- like buying a keyword on Google for a news topic;@myersnews @ckanal @mjenkins @kategardiner;
0;0;Afffee ... Essa internet da "cidade onde moro" me deixa looouco ! HAHAHA ... Ate o site do Google trava as vezes ! #Comopode ?;;#Comopode
0;0;The Google Game http://twitpic.com/332u8t;;
0;0;@Onerepublic35 kannst mal nen link zum good life cover posten bitte? ich hab bei google nun schon 2 verschiedene (cont) http://tl.gd/6oumlt;@Onerepublic35;
0;0;*** How To Make Digital Flashcards With Google Docs Spreadsheets [Web & iOS/Android] http://j.mp/bE5OzN #tresestrellas http://j.mp/b7onQ0;;#tresestrellas
0;0;Dominating the New Google , Google Traffic Tricks Google Buzz Secrets: Dominating the New Google , Google Traffic T... http://bit.ly/9rphuY;;
0;0;*** Google sues the US government over Microsoft favoritism http://j.mp/bl1spW #tresestrellas http://j.mp/amtq1w;;#tresestrellas
0;0;Google Docs Editing On The Go: http://marketsubset.com/?p=3306;;
0;0;RT @tecnoespanol *** Google sues the US government over Microsoft favoritism http://j.mp/bl1spW #tresestrellas ... http://j.mp/bzGiuL;@tecnoespanol;#tresestrellas
0;0;I wish I would Google that bull I mean like 4real man come on;;
0;0;How when you Google pics of Larry Hoover you get Rick Ross...lmao but also a smh...;;
0;0;Google Sues Interior Department http://sy.ly/w4bbN #news #video #MSNBC #CNN #FOX;;#news #video #MSNBC #CNN #FOX
0;0;@josephranseth I use Google Tasks... just the little default list that pops up in Gmail.;@josephranseth;
0;0;Share? RT @CJStarchild: The almighty Google assisted me in finding current pictures of Damita from "Class Act." Yes, she is STILL bad.;@CJStarchild;
0;0;Google sues the US government over Microsoft favoritism http://goo.gl/fb/19Ia6;;
0;0;RT @GOOGLE _ME_BiSHH : RT @AUsPriceless Boyyyyyyyyyyyyy it b sum creepin going on round AU!......... Boy do it ! Creepin like a.mugg !;@GOOGLE @AUsPriceless;
0;0;1日掛かってなんとか復帰。 Google IMEが原因か？とにかく惨惨。RT @ichirominato : あらら、大変！“ @doclap : ｽﾀｰﾄｱｯﾌﾟ修復失敗。再起動止まらず8回目<再起動6回目で強制終了したら起動せず。 #office2010 #MSsucks ”;@ichirominato @doclap;#office2010 #MSsucks
1;0;Go to Google Maps, get directions for Japan to China and look at instruction 43...LOL #fb;;#fb
0;0;@bardiche ニュースの話題は Google に行こうかなーって考え中。Twitterの使われ方が昔と違ってSNSっぽいからそれでいいかなーって迷ってます。;@bardiche;
0;0;@kiliankoe Google oder wat? http://www.motor-talk.de/forum/die-beiden-ziffern-des-mehrbereichsoels-t1622406.html;@kiliankoe;
0;0;Introducing the Google APIs Console and our latest API updates ( Google Code Blog) http://bit.ly/cofaEn;;
0;0;@Smallotsbigwine Google 'em - P2P clients;@Smallotsbigwine;
0;0;RT @dirnt_mikedirnt Hell, I could google my name, and a picture of Billie's fucking penis pops up. // AHAHAHAHAHAHAHAHAHAHAH!!!!;@dirnt_mikedirnt;
0;0;@HeatherTeeling the one that you get like in front of your front teeth. i don't know what it's called, on google images it's smiley piercing;@HeatherTeeling;
0;0;Resistance to Locative Media: Google Germany, by Mareline Heijman |Masters of Media http://bit.ly/caL5Ul;;
0;0;@google _me_bxtch I'm good how u;@google;
0;0;@TriggerHappyJax Aw aren't you cute? :) so much so infact...screw google and twitter...the whole internet aint a (cont) http://tl.gd/6oumds;@TriggerHappyJax;
0;0;@carlosnunezo @andonicarrion google docs me esta dando problemas, se desconecta solo :-(;@carlosnunezo @andonicarrion;
0;0;@nataliasagarna tenés que loguearte con tu cuenta de Google .;@nataliasagarna;
0;0;Depois de 6 anos eu mudei minha senha do Google .;;
0;0;@frankie_HOEE well what do you think google 's for? Hahaha.;@frankie_HOEE;
0;0;New API of the Week: Google Custom Search API - Plus: Google APIs Console http://goo.gl/fb/6BT1W;;
0;0;@PeterandPauLove tenes qe hacerlo por google ! en el mio abajo de dnde dice las visitas dice contador de visitas hace clik i te va directo ;);@PeterandPauLove;
0;0;Google Reposts Barred Turkish Videos (Marc Champion/Wall Street Journal) http://goo.gl/fb/OwpcA;;
0;0;@DixonHamby @jasonlparks - I want to see his search logs and make sure GOOGLE doesn't come up during his games ;);@DixonHamby @jasonlparks;
0;0;Ja tava pesquisando no google onde é o proximo show de Justin Bieber, é em Oklahoma City, OK nos EUA no dia 3 de Novembro.;;
0;0;@techwavejp google chrome ブラウザで記事が白紙になって全く読めないのは仕様・・？topページは読めるけど個別記事が白紙。;@techwavejp;
0;0;I wonder if I'm the only parent that has to Google the answers to their kids homework. This shit is HARD!;;
1;0;@maahcorreiala rocKrestart = NxZero ( Por GOOGLE TRADUTOR ) (6) ☻;@maahcorreiala;
0;0;Go to Google Maps. Get directions from the United States to China. Check out instructions #29 #44 and #104. ;) RT;;#29 #44 #104
0;0;RT @globovision : Google demanda a un ministerio que privilegió a Microsoft http://bit.ly/dxLipk;@globovision;
0;0;Arnaldo Bello: 6:59 PM : Google demanda a un ministerio que privilegió a Microsoft http://bit.ly/bUk4WP @Arnaldo;@Arnaldo;
0;0;how to contact google with site information about the manufacture of the explosive PETN: Your Blogs URL: non... http://tinyurl.com/2ftjh2h;;
0;0;google analytics: why arent i seeing anything for the past 1 1/2 weeks-suddenly nothing is registering/no da... http://tinyurl.com/2cfdnfl;;
0;0;Arnaldo Bello: 6:59 PM : Google demanda a un ministerio que privilegió a Microsoft http://bit.ly/bUk4WP @Arnaldo;@Arnaldo;
0;0;Arnaldo Bello: 6:59 PM : Google demanda a un ministerio que privilegió a Microsoft http://bit.ly/bUk4WP @Arnaldo;@Arnaldo;
0;0;Siiento que google piensa por mi.. somos uno los dos jajajajajaja xD.... tanto asi que lo que quiero entro y ahi esta en al primer paginita;;
0;0;How To Completely Back Up Your Google Account Files http://goo.gl/fb/lUdl9;;
0;0;New WordPress Tutorial : How to make money with google adsense mp4 http://bit.ly/cC6AMi;;
0;0;@JRMora @Cyberfrancis pues de Google lo hacen contactando con los Webmaster y mintiendo sobre posibles demandas. Te acojonas y borras...;@JRMora @Cyberfrancis;
0;0;Tengo que mover todas las cuentas de mis clientes a algo electrónico. No me he decido entre Google Docs o Excel via Dropbox.;;
0;0;Google Sues Agency Over Microsoft-only Cloud Deal: By Grant Gross, IDG News Google and a reseller of its products ... http://bit.ly/aC21fM;;
0;0;@xGotCyrusVirus hes on Nickelodeon victorious just google him hes sexotic :D sexy + exotic;@xGotCyrusVirus;
0;0;@evelynephin pgen download gravity, cuma bnggung search d google nya nulis apa. Hehe;@evelynephin;
0;0;@settembre99 さすが Google 。というか、業者？;@settembre99;
0;0;Aff, a pior coisa que aconteceu foi o Google ter comprado o YouTube. Não posso logar no Orkut e no YouTube ao mesmo tempo;;
0;0;@jeett Tal vez pueda hablar con Jeannette a través de Google Translate, porque yo soy el uno en la casa que no habla español... :);@jeett;
0;0;If you are having problems getting results with Google - Alternative search engine Blekko launches - http://bit.ly/bVB5u7 #cnn;;#cnn
0;0;Google sues US government, says bid terms favor Microsoft http://dlvr.it/7t5MZ @ccureit #ccureit;@ccureit;#ccureit
0;0;さぁ今日も元気にｱﾌﾞﾉｰﾏﾙﾋｰﾊｰ!(´∀｀) RT @katsu1004xx: 明日は google 社へ行ってくるよ(´ε` )　夜は、楽天の人と会うよ(´ ▽｀).。ｏ♪♪ ﾎﾞｹ～　そしてうちの株価が下がったよ・・・（汗）　アーメン(*′∀｀)ﾋｰﾊｰ♪;@katsu1004xx;
0;0;Google Docs Editing On The Go http://dlvr.it/7t5N2;;
0;0;#Android #Google Droid 2 Global edition coming soon, 1.2 GHz CPU confirmed http://bit.ly/9v8o7q #DhilipSiva;;#Android #Google #DhilipSiva
0;0;@DreaSparkles you can definitely search ringtones on YT and download them, as for wallpaper, if u know then dimensions, Google it?;@DreaSparkles;
0;0;#Google sues #Interior Dept over e-mail bid request http://goo.gl/fb/pAVDc #technology #us;;#Google #Interior #technology #us
0;0;@tbcagency Brands Club - Não funcionar plenamente no Google Chrome é um erro fatal :-|;@tbcagency;
0;0;@pbeens Makes sense. I was thinking wikispaces, but google is where we are going. Ever used Glogster?;@pbeens;
0;0;Google Offers Bounty to Web Bug Hunters: Following up on a successful bug bounty program that pays hackers for fin... http://bit.ly/civAaJ;;
0;0;Google Reposts Barred Turkish Videos (Marc Champion/Wall Street Journal) http://goo.gl/fb/1XgvY;;
0;0;@FrancieJones nice comment on the blog frances - I do wonder what will happen to this huge enterprise taht is Google;@FrancieJones;
0;0;@DanielCesario É assinei a minha separação .da IE. Só uso o Google Chomer Tenho ainda o mozilla. IE vai ser enterrado junto com o serra???;@DanielCesario;
1;0;Google creates new text input interface for moblie. Looks sweet! http://www.the8pen.com/index.html;;
0;0;RT @notiven : RT: @globovision : Google demanda a un ministerio que privilegió a Microsoft http://bit.ly/dxLipk;@notiven @globovision;
0;0;After watching the #pdc videos, it seems like #ms is not innovating at the rate of others #google , I suppose we will see with #wp7;;#pdc #ms #google #wp7
1;0;Logitech Revue With Google TV: The Official TechCrunch Review http:// tcrn.ch/cb0jEr via @techcrunch;@techcrunch;
0;0;go on google maps, search get directions from japan to china. read number 43. nbd. (:;;
0;0;Stavio Google Analytics na sajt krajem meseca i sada mi prikazuje rast posete 3557%;;
0;0;New API of the Week: Google Custom Search API - Plus: Google APIs Console http://goo.gl/fb/UVHCR;;
0;0;Someone searched for "k1100lt parts" on Google and landed on http://www.helmetheadcycle.com/vehicle/968/bmw-k1100lt.;;
0;0;First #Yahoo started shedding talent, now #Google is too. Lars #Rasmussen is on his way to #Facebook . http://rww.to/9EzgAh;;#Yahoo #Google #Rasmussen #Facebook
0;0;http://cor.to/K4D ¿Cómo aprovechar Google en la cobertura de una campaña electoral?;;
0;0;Google sues the US government over Microsoft favoritism http://goo.gl/fb/RrhB1;;
0;0;Google calls bug bounty hunters to YouTube, Blogger http://bit.ly/avD5fq;;
0;0;DTN Technology News: New Internet search engine launches: Blekko: Challengers to Google have come and gone but ano... http://bit.ly/ab1n0Z;;
0;0;New Internet search engine launches: Blekko: Challengers to Google have come and gone but another startup is stepp... http://bit.ly/cIligZ;;
0;0;ReadWriteWeb - New API of the Week: Google Custom Search API - Plus: Google APIs Console http://bit.ly/as47L5;;
0;0;New API of the Week: Google Custom Search API - Plus: Google APIs Console: Today, via its Google Code Blog, Googl... http://bit.ly/as47L5;;
0;0;New Internet search engine launches: Blekko: Challengers to Google have come and gone but another startup is stepp... http://bit.ly/btkcMr;;
0;0;New Internet search engine launches: Blekko: Challengers to Google have come and gone but another startup is stepp... http://bit.ly/cCgY0T;;
0;0;New Internet search engine launches: Blekko: Challengers to Google have come and gone but another startup is stepp... http://bit.ly/b4mJVp;;
0;0;Google ’s Place Search Overhaul: Small Business Is the Big Winner http://networkedblogs.com/9XPyV;;
0;0;If Google Trend Analyzer is any indication of election success, Kurt Schrader will slam Scott Bruun http://tinyurl.com/2bxf89o;;
0;0;Gente que ya conoció el callejón del aguacate... por google maps.;;
0;0;Search Engine Optimization SEO - Marketing SEM Blog: How to index your website fast in Google - Msn - Y... http:// seo-sem-tips-tricks.blogspot.com/2010/10/trick- for-fast-indexing-in-google-msn.html?spref=tw …;;
0;0;@CharlesTrippy google tv;@CharlesTrippy;
0;0;@romanbold @aurorans U nekim slučajevima Google maps zna bolje od zagrepčana gdje su koje ulice ;);@romanbold @aurorans;
0;0;Just made an awesome Google Form to keep track of holiday gifts I buy! Saved shortcut on my phone and it all dumps into master spreadsheet.;;
0;0;bleki kemari guk-guk RT @nurulqoms Weits, ada pencari baru bakal nyaingin Google : Blekko.com .. Mmm, kok kayak nama guk guk ya?;@nurulqoms;
0;0;@sansevieriaa eh lid udah nyari materinya di google ?;@sansevieriaa;
0;0;@KandiCaneLane you needa sign into google talk miss;@KandiCaneLane;
0;0;Google sues the government: http://bit.ly/bwUkbM #waytogogoogle #justice;;#waytogogoogle #justice
0;0;Wettkampf mit Microsoft: Google verklagt US-Innenministerium: Kampf um die US-Büros: Microsoft dominiert mit s... http://bit.ly/aFZiDh #www;;#www
0;0;Wettkampf mit Microsoft: Google verklagt US-Innenministerium: Kampf um die US-Büros: Microsoft dominiert mit seine... http://bit.ly/aFZiDh;;
0;0;Wettkampf mit Microsoft: Google verklagt US-Innenministerium: Kampf um die US-Büros: Microsoft dominiert mit s... http://bit.ly/aFZiDh #www;;#www
0;0;spiegel_ Wettkampf mit Microsoft: Google verklagt US-Innenministerium: Kampf um die US-Büros: Microsoft dominiert ... http://bit.ly/9Sggly;;
0;0;Wettkampf mit Microsoft: Google verklagt US-Innenministerium: Kampf um die US-Büros: Microsoft dominiert mit seine... http://bit.ly/aFZiDh;;
2;0;now this is fun:1: go to google maps and select "get directions"2: select Japan as the starting (cont) http://tl.gd/6oum5o;;
0;0;Wettkampf mit Microsoft: Google verklagt US-Innenministerium: Kampf um die US-Büros: Microsoft dominiert mit seine... http://bit.ly/9Z2kjK;;
0;0;RT @CodyFlakes143: google understands me......;@CodyFlakes143;
0;0;RT @kafaak : Microsoft เผย ยอดผู้ใช้ IE8 และ IE9 รวมกัน เติบโตมากกว่า Google Chrome http://bit.ly/czTaAA #ittwt // เลิกใช้ IE ไปละ;@kafaak;#ittwt
0;0;Te queremos Google , acaba con esos gringos. RT @fayerwayer : Google demanda EEUU x privilegiar a Microsoft n licitación http://clic.bz/9o18ga;@fayerwayer;
0;0;Tinha um besouro transmissor de chagas aqui em casa, porque o google me confirmou isso.;;
0;0;@renanforni google tradutor \o;@renanforni;
0;0;I love Google Docs. Fuck a Microsoft Office.;;
0;0;stop_affaire: marre d'attendre votre navigateur internet ? telecharger Google Chrome, si ce n'est pas deja fait ici : http://twlr.me/2B5;;
0;0;@Eirelav1313 google is my friend...did you see how EASY it looked too? Yes, some in my future...;@Eirelav1313;
0;0;Lets google em!;;
0;0;install google wave server http://sns.ly/vQS52;;
0;0;google 's suing again-.-;;
0;0;@jesuisjavy I've never liked allergies either. Google Totallergix, best trick in the book, natural too.;@jesuisjavy;
0;0;@Prenesen well I can only tell yu so much.. Google it lol;@Prenesen;
0;0;Google wants us to jet ski to get places now'a'days .. Makes sense.;;
0;0;took me 6 minutes and 38 seconds to spell the word "Inconvenience" and i hada use google to help me out. #dontjudgeme;;#dontjudgeme
0;0;http://ogae10.co.cc/2010/11/_google_monitor_query_-or-googletestad.html _ google _monitor_query_ or googletestad;;
0;0;@maria_yousuf ehem... just google Jared Leto and you'll thank me for it :P He has blue eyes you'd just want to dive into XD;@maria_yousuf;
1;0;@MaryCruzBieber COPIA E COLAAA *-* VIVA AO GOOGLE \o/;@MaryCruzBieber;
0;0;The YouTube Symphony Orchestra returns! http://bit.ly/cbGKnJ #google;;#google
0;0;GameString Adrenalin turns your Google TV into a game streamer, will WoW your couch (video) ... [http://is.gd/gzblZ];;
0;0;Google Maps has directions on how to kayak from Japan to the US. They have streets and avenues and roads and stuff! I need to do that.;;
0;1;Exclusive: Apple, Google Are Sniffing Around Mobile Payments Startup BOKU http:// tcrn.ch/bfRVtj via @techcrunch;@techcrunch;
0;0;@ashghebranious Oh, Gillard being an international embarrassment? Besides coming from her own mouth, other links are/were ABC Google News;@ashghebranious;
0;1;@barbaram My students are using Google Sites for their ePortfolios, and Google Docs for the linked attachments storage.;@barbaram;
0;0;Google cree que el móvil será un gran impulsor del comercio electrónico en http:// Cincodias.com http://www. cincodias.com/articulo/tecno logia/Google-cree-movil-sera-gran-impulsor-comercio-electronico/20101027cdscdstec_2/cdstec/ … vía @Cinco_Dias_com;@Cinco_Dias_com;
0;0;Apple, Google Looking At Buying Mobile Payment Company Boku~ 겨우 250만불? Boku라는 곳은 얼마 전 울회사와도 계약하여 서비스를 상용화하기도 했는데... 쩝~http://j.mp/cNuV4P;;
0;0;I like how the short URL is "n0o" RT @arstechnica : Google sues feds over Microsoft-centric bidding requirement: http://arst.ch/n0o;@arstechnica;
0;0;Where do all these quote groups on twitter get their quotes? From their brains or google ?;;
0;0;Google Aust have a nice image today for #Melbournecup http://bit.ly/9ssq1A;;#Melbournecup
0;0;How To Make Digital Flashcards With Google Docs Spreadsheets [Web & iOS/Android] http://post.ly/190FW;;
0;0;Google processa os Estados Unidos - Tecnologia - http:// EXAME.com http:// exame.abril.com.br/tecnologia/not icias/google-processa-os-estados-unidos?utm_source=twitterfeed&utm_medium=twitter … via @portal_exame;@portal_exame;
0;0;@JoaoRafaelSCCP ah sim, mas no google deve ter algum link;@JoaoRafaelSCCP;
0;0;RT: @globovision : Google demanda a un ministerio que privilegió a Microsoft http://bit.ly/dxLipk;@globovision;
0;0;Google 街景店内拍照正式启动: 消息人士称上周起， Google 已经在拍摄街景时对有需要的建筑物里的店家进行拍摄，并上传到 Google 的相关服务，包括搜索结果和 Google Earth上。 Google 将在美国、澳大利亚、日本... http://idek.net/3GvA;;
0;0;@Mom101 BTW, AFAIK google stopped counting blogroll links a while back - they only look at links in the body of a post. Or something.;@Mom101;
0;0;@_TattooedVixen Now you know..I got to google it now lol..;@_TattooedVixen;
0;0;New API of the Week: Google Custom Search API - Plus: Google APIs Console http://safe.mn/1lFG;;
0;0;Google Files Suit Against US Govt. Over Contracts: On Friday, Google filed suit against the US government, a... http://tinyurl.com/29uj8ej;;
0;0;New API of the Week: Google Custom Search API - Plus: Google APIs Console http://safe.mn/1lFG;;
0;0;Google 街景店内拍照正式启动: 消息人士称上周起， Google 已经在拍摄街景时对有需要的建筑物里的店家进行拍摄，并上传到 Google 的相关服务，包括搜索结果和 Google Earth上。 Google 将在美国、澳大利亚、日本... http://bit.ly/ctr1oy;;
0;0;Google 街景店内拍照正式启动 http://bit.ly/ctr1oy;;
0;0;@RWW : ReadWriteHack: New API of the Week: Google Custom Search API - Plus: Google APIs Console http://rww.to/bPyY2k: RWW: ReadWriteHac...;@RWW;
