retweets;favorites;text;mentions;hashtags
0;0;Google Instant: Pros and Cons http://dlvr.it/4zzvm 【PCWORLD】;;
0;0;#Tech #TechNews Google Instant: Pros and Cons http://bit.ly/aFhsba #DhilipSiva;;#Tech #TechNews #DhilipSiva
0;0;Iwebslog.com- Google Instant Prototype Looks a Bit Like Bing (PC Magazine): PC Magazine - Google 's new Google ... http://dlvr.it/4zzxt #Tech;;#Tech
0;0;Google Launches AdWords Help Site For Small Business http://bit.ly/dbRCBI;;
0;0;Google ’s New Philosophy: We’re A Portal http://bit.ly/b42fYS;;
0;0;Google Adding Instant Search – ChinoHills.com http://dlvr.it/4zzxD;;
0;0;I have to agree for the most part RT @macTweeter : Apple Blog: Is Ping Apple’s Google Wave? http://bit.ly/9VjvsJ;@macTweeter;
2;0;Just published my first post on the Peerlo blog! Google Instant http://bit.ly/auWVvO;;
0;0;RT @carolinepro : annie nightingale. what a legend, if you dont know her - google - 40 years @R1 a pioneer of music + ... http://tmi.me/1dsih;@carolinepro @R1;
0;0;Haahha! Adoro aquele Twitter Escoteiro Gringo que responde pros brasileiros usando o Tradutor do Google !;;
0;0;RT @eWEEKNews Amazon Will Challenge Google : 10 Possible Ways - Cloud Computing from eWeek http://bit.ly/avGCX6 http://ff.im/qtekp;@eWEEKNews;
0;0;Google Chrome Speed Tests http://bit.ly/cRQN63;;
0;0;Lmaooo wrd #VINCY " @SuaveNasty : Matter a fact... RT If you never heard of Saint Vincent . .. then watchu need tuh do is google it .";@SuaveNasty;#VINCY
0;0;Google says Froyo is not for tablets, will Gingerbread be the Android tablet OS? http://chtr.it/CgtEvw #android;;#android
0;0;How Google 's new search product Google Instant will force to change SEO strategies: http://wp.me/pBETa-Vx;;
0;0;Who keeps google so #instant and reliable? goo.gl/nHAx;;#instant
0;0;RT @eWEEKNews Amazon Will Challenge Google : 10 Possible Ways - Cloud Computing from eWeek http://bit.ly/avGCX6;@eWEEKNews;
0;0;Só Bob Dylan explica o Google Instant | Black Hat Seo: Só Bob Dylan explica o Google Instant ! Recomendo que antes... http://bit.ly/ahXQ26;;
0;0;Q: Do you know the other name for the spice "shadow benny" and a good store to find it? A: google is yo http://www.society.me/q/1774873/view;;
0;0;WAIT: So Google Instant censors out 'lesbian' 'bisexual' because of it's "no porn, no hate speech" features but not 'fag';;
0;0;Censorship on Google Instant http://www.advocate.com/News/Daily_News/2010/09/09/Google_Instant_Censors_Lesbian_Bisexual/;;
0;0;@Caique_Salles eu fui no google pq fiquei curiosa também né, ai apareceu isso;@Caique_Salles;
0;0;Photog Distinguishes Himself by Looking Just Like Google - http://www.photozz.com/?x16;;
0;0;This is Your Brain on Google Instant Search http://bit.ly/b2PZm8;;
1;1;Google Instant is stupid and also dumb.;;
0;0;isso é bom // How To Setup Eclipse and Netbeans For Developing Google Android Apps http://ff.im/qtebB /via @luismessias;@luismessias;
0;0;JA QUE TODOS FAZEM PERGUNTAS QUE O GOOGLE TEM RESPOSTAS E AINDA INSISTEM EU IREI FAZER UMAS PERGUNTAS SOBR… — Sim ? http://4ms.me/duh4xb;;
0;0;@ben_hr Ben, I had to google midichlorian counts :);@ben_hr;
0;0;@renees oye, really? a singer! Now I am WAY lost! I guess it is google time;@renees;
0;0;Directory Submitter ,, Increase Your Google Ranking By Quickly Getting Hundreds Of High Quality, 1,Way Links To Yo... http://bit2.ca/ORmTP;;
0;0;Press Release Fire ,, Brand New Guide On Ranking Better Than #1 In Google In Under 24 Hours! http://bit2.ca/L24lz;;#1
0;0;Seo Mindset ,, Learn How To Get Top Google , Yahoo And Msn Rankings Over Time! http://bit2.ca/miK21;;
0;0;@monicaroman @52xmax que es eso de google instant? #miau;@monicaroman @52xmax;#miau
0;0;I love this site www. google .com who does not know it;;
9;1;¿Eyaculador precoz? Consuélate. Google Instant siempre será más rápido que tú... #googleinstantfacts @juancho21;@juancho21;#googleinstantfacts
0;0;Debunk: Bing not replacing Google on all Verizon Android devices http://bit.ly/afNxoM;;
0;0;Valeu pela ajuda com a carne de soja ... GOOGLE !;;
0;0;Google va investir en France : R&D et institut culturel - http://bit.ly/bb5A8C;;
0;0;Google is preparing to launch its Google TV service in the U.S. this fall, CEO Eric Schmidt announced at a tech fair i…http://lnkd.in/nZzkak;;
0;0;昨日から本土で開始した google インスタント、PPCは厳しくなりそう。ロングテールはすたれるのか。;;
0;0;Google Places Spurious Listing Removal | Own Page One: Search ... http://bit.ly/9JNy2y;;
0;0;Google Instant Search Demo: A First Look at Speedier Search http://bit.ly/a2zjB5;;
0;0;oh my god, go to google and type in "I am afraid of";;
0;0;@RafaelBuchegger Okay. Google nie, NIE, NIE!!! »Akne Inversa« in der Bildersuche. Niemals!;@RafaelBuchegger;
0;0;Google spotlights real-time search engine - Geeked About Internet! http://bit.ly/dBCfus;;
0;0;Verizon: Ditching Google in favour of Bing? http://bit.ly/c6KjtX;;
0;0;Video: Sergey Brin Explains Why Google Instant Matters http://bit.ly/cC2vzu;;
0;0;Google search tool seeks instant results http://bit.ly/aeLF4s;;
0;0;Google から、検索ボタンが消えちゃう!?（動画） - http://bit.ly/d4kdDS;;
0;0;[IT Media] Apple TV対 Google TV、勝つのはどちらか: DVDプレーヤーに取って代わろうとするApple TVと、CATVモデムに取って代わり、Webとテレビの融合を狙う Google TV。どちらにも課題... http://bit.ly/c8Mg19;;
0;0;Apple TV対 Google TV、勝つのはどちらか: DVDプレーヤーに取って代わろうとするApple TVと、CATVモデムに取って代わり、Webとテレビの融合を狙う Google TV。どちらにも課題はあるが、専門家はAp... http://bit.ly/b9JFbx;;
0;0;Apple TV対 Google TV、勝つのはどちらか: DVDプレーヤーに取って代わろうとするApple TVと、CATVモデムに取って代わり、Webとテレビの融合を狙う Google TV。どちらにも課題はあるが、専門家はAp... http://bit.ly/b9JFbx;;
0;0;Apple TV対 Google TV、勝つのはどちらか: DVDプレーヤーに取って代わろうとするApple TVと、CATVモデムに取って代わり、Webとテレビの融合を狙う Google TV。どちらにも課題はあるが、専門家はAp... http://bit.ly/aqHOsd;;
0;0;via HuffPost How To TURN OFF Google 's New Feature: http://huffingtonpost.com/2010/09/08/disable-google-instant_n_709235.html;;
0;0;多謝兄弟們了，貌似昨晚的飯局比較成功啊: 昨天下午洗完澡，剃須之後，為了要不要噴香水猶豫了好一陣，最後決定還是不噴。 走之前 GOOGLE 了下地圖，知道大致區域後，上車開HD2導航到達小區。 MM電話指揮我在小區裡轉來轉去，然... http://short.ie/wv6pm5;;
0;0;Google Maps for Android updated. Featuring: Walking Navigation, Street View Smart Navigation & Google Maps Search bar. http://bit.ly/bdsitn;;
0;0;@kreem_D Ha i thought u guys would be formal with the language by now lol. Google this site tho, they have all the movies in english... ...;@kreem_D;
0;0;【話題】 検索結果をリアルタイムに更新する「 Google インスタント検索」が登場 | 海外SEO情報ブログ・メルマガ: Google は、検索時の文字の入力に合わせて検索結果をリアルタイムに... http://bit.ly/ass5fi by http://seosem.net;;
0;0;RT @TheAdvocateMag : Is Google Instant censoring lesbians and bisexuals? http://bit.ly/9WM4VK;@TheAdvocateMag;
3;1;After visiting USYD this week, I wrote up a post on the various ways they're teaching & using Google Data APIs there: http://bit.ly/9VDIWr;;
0;0;CHART OF THE DAY: Facebook Passes Google In Time Spent On Site For ... http://bit.ly/a6CabD;;
0;0;Facebook inches past Google for Web users' minutes http://bit.ly/aUKsSf;;
0;0;Thoughts on Google Instant (Matt Cutts/Gadgets, Google , and SEO) http://bit.ly/a02w3e;;
0;0;おなか Google なんか食べたい 店がない;;
0;0;Censorship on Google Instant http://www.advocate.com/News/Daily_News/2010/09/09/Google_Instant_Censors_Lesbian_Bisexual/;;
0;0;google seo marketing ? - SEO Tips,search engine optimization tips ... http://bit.ly/daw1yO;;
0;0;이제 페북도... RT @chartoftheday CHART OF THE DAY: Facebook Passes Google In Time Spent On Site For First Time Ever http://read.bi/c8fNTe;@chartoftheday;
0;0;well @DarrinJWard tell 'em to get all their clients to link over. that's what google rewards for a search on SEO, crappy client links :);@DarrinJWard;
0;0;@maureenoco I had to Google "Manolo" and must say those are some effing expensive shoes. And they're not even that much shoe involved!;@maureenoco;
0;0;@I_Am_Great_ yh google him;@I_Am_Great_;
0;0;google steering the world in the wrong direction again RT @TheAdvocateMag Is Google censoring lesbians and bisexuals? http://bit.ly/9WM4VK;@TheAdvocateMag;
0;0;Photo: OMG! I LEGIT JUST SCREAMED! MY WALLPAPER SHOWS UP WHEN YOU SEARCH FOR SASHA ALEXANDER ON GOOGLE . THIS... http://tumblr.com/xbji3fyek;;
0;0;Google sees new iOS rules allowing AdMob ads http://bit.ly/bufMEY;;
0;0;Google Chrome problem seems to be fixed. Let us know if you have any problems viewing a site on the CLIC network.;;
0;0;You've got to love when the second line of an article on Google Instant is: "I haven't had the pleasure of trying Google Instant...";;
0;0;Google Chrome Portable 6.0.472.55: O Google Chrome Portable é uma versão enxuta do navegador do Google que combina... http://bit.ly/d8i1KG;;
0;0;@simplechristy Goes well w/ my Boss Google Map'n directions, use'n Digital camera to photo the screen, upload photo & print it out for me;@simplechristy;
0;0;@ReMercatelli google ! *--*;@ReMercatelli;
0;0;@msfeldstein check our my fb page, right click doesn't work on first attempt, intended? google docs flaky, embedded utube broken at times;@msfeldstein;
0;0;http://www.youtube.com/watch?v=m4Q9MJdT5Ds&feature=player_embedded#! como minha prima disse, eh coisa do capeta ! #google;;# #google
0;0;Google instant search for mobile "coming soon" http://bit.ly/c54kBB;;
0;0;Groovy Delicious: Mastering Grails: Grails services and Google Maps: http://bit.ly/d4q0Lb;;
0;0;@ulla147 Einfach bei google eingeben? xD;@ulla147;
0;0;New Google Instant search ->If ya hate it... 'Settings' -> 'Search Settings' -> then scroll down and select "Do not use Google Instant";;
0;0;Verizon: Google Search optional for Fascinate on Android 2.2 http://bit.ly/cvPxr8;;
0;0;@hirochan わたしは「検索する」ということ自体を「ググる」と言ってしまうこともありますね。 Google でも社内Wikiでも普通のテキストファイルでも;@hirochan;
0;0;Is Google Instant censoring lesbians and bisexuals? http://bit.ly/9WM4VK RT @theadvocatemag;@theadvocatemag;
0;0;@aots Can you use the ipod touch to make calls through Google voice? #AOTS;@aots;#AOTS
2;0;Google responds to around 35,000 search queries every second. More digital facts here --> http://ping.fm/T4H4w;;
0;0;Buzzup Documents - Google 's SEO Advice For Your Website - Content http://bit.ly/buOUaQ;;
0;0;@carolda o google analytics;@carolda;
0;0;Un Google Doodle generó ventas por 250 mil dólares http://goo.gl/fb/whsfg;;
0;0;How To Setup Eclipse and Netbeans For Developing Google Android Apps http://ff.im/qtebB;;
2;3;"AppleがAdMobの参入を認めたとして歓迎する声明を発表"RT @kodafumi : App Store、AdMobのような広告ネットワークがiPhone/iPadに広告を提供できるよう規制を緩和 Google は安堵のため息 http://bit.ly/9ujNNF;@kodafumi;
0;0;@FelipiGoncalves senti um leve TRADUTOR GOOGLE aí.;@FelipiGoncalves;
0;0;Is Ping Apple’s Google Wave? http:// theappleblog.com/2010/09/09/is- ping-apples-google-wave/ … via @theappleblog;@theappleblog;
1;0;Is Ping Apples Google Wave?: It’s been roughly a week since Ping’s release, and I’ve held my tongue until now. Bu... http://bit.ly/bnU8kz;;
0;0;@poppykicker I was hoping for some kind of Google Treehouse, but I'm not so disappointed that I don't want a treehouse bed.;@poppykicker;
0;0;Qual a cooisa mais ABSURDA que voce já procuroou no google ? — não me lembro http://4ms.me/aIsxQg;;
0;0;Google weird now.;;
0;1;RT @bjt_writes : When Larry Page ( Google ’s co-founder) revolutionized the whole concept of web search through its .. http://dld.bz/veMZ;@bjt_writes;
0;0;:O Yo si me quejo de mis endulzadas! ayer me dieron perro, manzana, yogurt (según Google Chrome) y muchos besos Raw Raw raw;;
0;0;a equipe do @google que não se cuide não pois logo logo o orkut perde para o twitter!;@google;
0;0;@alinemorais_ boate. joga no google ...hahahah;@alinemorais_;
0;0;@GwenMadlyn Comack (idk if that's spelt right) but I'm pretty sure that's where. Google it lol;@GwenMadlyn;
0;0;que sacoo o google não entraaa ;x;;
0;0;@HEYIMGABRIEL é que os únicos que eu sei são esses D: vai no google então q;@HEYIMGABRIEL;
0;0;Google e Adobe comemoram novos termo do iOS; o que a FTC acha disso? | MacMagazine http:// macmagazine.com.br/2010/09/09/goo gle-e-adobe-comemoram-novos-termo-do-ios-o-que-a-ftc-acha-disso/ … via @MacMagazine;@MacMagazine;
0;0;@twit_tay Acabei de ver lá. Mais folgada impossível. " Google tradutor pra vc, querida ;)";@twit_tay;
0;0;原來 Google Earth裡面也有街景的照片啊~~難怪不少~~;;
0;0;@kbarber1984 Nobody knew wtf u meant!!!! I bet u somebody tried to google it! GO READ A BOOK!;@kbarber1984;
0;0;oi, você que usa google chrome, ele atualizou hoje, não foi?;;
0;0;Google Instant... http://proxy.feedzilla.com/en_us/news_stories/top-news/internet/8807698?client_source=feed&format=rss&client_source=tns;;
0;1;【ネット】中国、グーグル( Google )に免許交付せず 地図検索サービスで http://j.mp/asW6gx;;
0;0;"Instant Elements" no Google Instant Search http://bit.ly/clfMqg /via @Cardoso;@Cardoso;
0;0;Web Graphics – Past, Present and Future http://goo.gl/fb/LIxY0 #google #blogs;;#google #blogs
0;0;Google launches Family Safety Centre for New Zealand http://goo.gl/fb/WdLRU #google #blogs;;#google #blogs
0;0;システムメンテナンスのお知らせ http://goo.gl/fb/zcp5a #google #blogs #お知らせ #システムメンテナンス;;#google #blogs # #
0;0;@s2beliebers2 sabia q eu dei um bjo no JB? ele gosto tanto q ate tiro uma fto e pos no google !!! #imaginebeliber;@s2beliebers2;#imaginebeliber
0;0;Make a great play. Get on SportsCenter. http://goo.gl/fb/7c4KU #google #blogs #sports;;#google #blogs #sports
0;0;google 推出了 Google Instant，又为每个人宝贵的生命节约了无数个2-5秒，百度表示压力不大，反正中国用户的生命长短的意义不大。;;
0;0;“ @muyinteresante : Google #Instant nos ahorrará entre 2 y 5 segundos en cada búsqueda”// Gracias a #Google podrá dedicar 5 seg más a sus hijos;@muyinteresante;#Instant #Google
0;0;@DingDongBigBen ahahaha I'm blushing, you just can't see. I'm going to have to google earth your location. Cobblestone roads & big fields?;@DingDongBigBen;
0;1;設定→アカウントとインポート→一番の下のアカウント設定を変更で Google アカウントの設定クリック、個人情報設定のマルチ ログインで編集をクリック、有効 - 同じウェブブラウザ内で複数の Google アカウントを使用します、とその他承認をチェック、保存！;;
0;0;@Locobbe Vi isso no wikipedia com a ajuda do google . Meus dois melhores professores q ja tive.;@Locobbe;
0;0;RT @bkmacdaddy : How To Grab More Rankings With Google ’s Branded Search Results http://selnd.com/diFPBd;@bkmacdaddy;
0;0;Google adds walking directions to Android: Available on the application's 4.5 update, Google 's Walking Navigation ... http://bit.ly/andzci;;
0;0;Google adds walking directions to Android: Available on the application's 4.5 update, Google 's Walking Navigation ... http://bit.ly/aBX2oq;;
0;0;Updated Google Voice offers pair of widgets: An update to the popular Google service provides home screen access t... http://bit.ly/9AKX6X;;
0;0;Updated Google Voice offers pair of widgets: An update to the popular Google service provides home screen access t... http://bit.ly/duZo2T;;
0;0;Google Instant Prototype Looks a Bit Like Bing #google #internet http://bit.ly/apk9fw;;#google #internet
0;0;Google : An Update on Apple’s Terms of Service http://tiny.ly/Cz4;;
0;0;グーグル、渋谷にてピン型のうちわを配布中　「 Google プレイス」キャンペーンの一環 | ファインドスター 広告ニュース: グーグルジャパンは9月6日より、渋谷にてピン型のうちわの提供を開始した。このうちわは、 Google マップ... http://bit.ly/cAnrEm;;
0;0;Google Instant: Pros and Cons: Google detractors say its Google Instant search technology is a both a securi... http://tinyurl.com/2uosq8o;;
0;0;"¿Y tú que miras?" Evolución del #eyetracking en #google , #facebook y #twitter ... http://bit.ly/9EBnGb;;#eyetracking #google #facebook #twitter
0;0;Seconded. It's quite jarring RT @whirringblender : Google Instant is freaking me out.;@whirringblender;
0;0;@Sw33tMocHa814 youtube. then type in youtube converter in the google search engine;@Sw33tMocHa814;
0;0;Google Instant: Pros and Cons: Google detractors say its Google Instant search technology is a both a ... http://bit.ly/axEHkv ©bjnilesh©;;
1;0;Another reason Google Instant is made of fail: http://bit.ly/cJIZa9;;
0;0;Estaría chido que los Multiple Inbox de google pudieran colapsarse. Un pequeño ícono de + -;;
0;0;Google Instant: Pros and Cons: Google detractors say its Google Instant search technology is a both a security ris... http://bit.ly/byvfkA;;
0;0;RT @droid_life Google Maps Update Brings “Walking Navigation” http://bit.ly/9kguOY;@droid_life;
0;0;Google Instant: Pros and Cons: Google detractors say its Google Instant search technology is a both a security ris... http://bit.ly/byvfkA;;
0;0;tengo una pequeña duda en ingles.. Pero prefiero tenerla a usar Google Traductor, SOBRE MI CADAVER! #Carajo;;#Carajo
0;0;Google Instant: Pros and Cons: Google detractors say its Google Instant search technology is a both a security ris... http://bit.ly/byvfkA;;
0;0;@skgsergio seguro que hay algún calendario para el Google Calendar.;@skgsergio;
0;0;Google Instant: Pros and Cons: Google detractors say its Google Instant search technology is a both a security ris... http://bit.ly/byvfkA;;
0;0;PC World: Google Instant: Pros and Cons http://bit.ly/bOV4It #tech #news;;#tech #news
0;0;google scribe is fun -- type a word, hit enter repeatedly: like Twitter if you replaced all the people w/ a computer - http://bit.ly/cB7jDd;;
0;0;pcWorld$: Google Instant: Pros and Cons http://bit.ly/bOV4It $ end;;
0;0;Google terá busca segura com padrão SSL - http://migre.me/1dUNK;;
0;0;RT @shiganet この発表があることを知っていたとしても、ヤフーJAPANは毒まんじゅうを食べたのだろうか？ RT http://eeg.jp/RmKb [計92ツ] Google Instantローンチ―タイプするにつれて次々に検索結果が表示される;@shiganet;
0;0;T-Mobile Unveils New Google Phone, G2 - http://newzfor.me/?6bhy;;
0;0;ふらっしゅ！ふらっしゅ RT @wkyhiroron : 歓迎RT @iphoneaposusume : Apple、iOS開発者向けライセンス契約の制限緩和を発表: この改訂で、開発者はAdobeのFlashアプリの移植とGoogleのAdMob広告プラットフォームの利用が可能に;@wkyhiroron @iphoneaposusume;
0;0;[PCWrld] Google Instant: Pros and Cons http://bit.ly/bOV4It;;
0;0;Google Instant: Pros and Cons: Google detractors say its Google Instant search technology is a both a security ris... http://bit.ly/bOV4It;;
0;0;Google Instant: Pros and Cons: Google detractors say its Google Instant search technology is a both a security ris... http://bit.ly/byvfkA;;
0;0;@Petaaaaah doe ff Google loeren dan ;-);@Petaaaaah;
0;0;Google ya no es tan ‘hippie’ como cuando nació.: Alrededor de 150 especialistas en seguridad informática han... http://tinyurl.com/33pldlo;;
0;0;Video: Sergey Brin Explains Why Google Instant Matters: In a conversation with DailyFinance... http://bit.ly/eFYlQ;;
0;0;#gadget Google adds walking directions to Android http://bit.ly/a0qnfx;;#gadget
0;0;@benparr Facebook one step closer to challenging Google . Possible for Google to rival FB in social realm?;@benparr;
0;0;Google ya no es tan ‘hippie’ como cuando nació. http://bit.ly/cuTDM4 ( @meneame_net );@meneame_net;
0;0;Google adds walking directions to Android http://bit.ly/alTXSO #tech #gadgets;;#tech #gadgets
0;0;#gadget Updated Google Voice offers pair of widgets http://bit.ly/acs1YQ;;#gadget
0;0;Updated Google Voice offers pair of widgets http://bit.ly/bxAJgt #tech #gadgets;;#tech #gadgets
1;1;この発表があることを知っていたとしても、ヤフーJAPANは毒まんじゅうを食べたのだろうか？ RT http://eeg.jp/RmKb [計92ツ] Google Instantローンチ―タイプするにつれて次々に検索結果が表示される;;
0;0;Legitimate Work At Home Income Opportunities Are All Around You: Google gets more Internet traffic every day that ... http://bit.ly/aHRR5G;;
0;0;Google instant, ‘tecnologia que permite leer la mente’ http://goo.gl/fb/DueKF;;
0;0;I liked a YouTube video -- Street View on Google Maps: Smart Navigation http://youtu.be/KZ2_7bKlcvI?a;;
0;0;A peek at the design & infrastructure challenges of Google Instant http://bit.ly/aQDcIh;;
0;0;@shanygnesays yes me tooo time to hop my ass on google loll.;@shanygnesays;
0;0;Google Maps for Android 越来越牛逼了，我都怀疑再下去要跑不动了;;
0;0;この記事見た後にmarket見たら「マップ」のアッブデートきてたのでwktk。でも「新機能」の説明には特段の言及なし。うーむ。 / Walk this way - Official Google Mobile Blog - http://bit.ly/ankSX1;;
2;1;Essa vale retweet - Google ajuda você a economizar na hora de abastecer seu veículo! site Meu combustível http://bit.ly/5sGsAS #ficaadica;;#ficaadica
0;0;@BlackEssence illumanti? OOK chkn it...where the heck have I been..this is all new ta me...wha so Doc giving inject was illumanti? Google;@BlackEssence;
0;0;ChromeからKindleに、見ているページを転送できる拡張機能。 / 想造ノート: Kindleユーザーはインストール必須！ Google Chromeで見ているページをKindleに即転送できる拡張機能 http://htn.to/EEirJZ;;
0;0;Google Instant: Pros and Cons - PC World: Telegraph.co.uk Google Instant: Pros and Cons PC World… http://bit.ly/TechN;;
0;0;See my new page on my Google group Mens Fashion at http://bit.ly/4DtT09;;
0;0;Google fashioning close relationships with device companies http://bit.ly/cMa5gZ;;
1;0;@Dominiquee_ UK> http://migre.me/1dUKU esse link não funciona no google chrome, acho que tem uma tres versoes, a normal e uns remix do danny;@Dominiquee_;
0;0;@felectroniko uno de Imanol Ordorika también egresado de la UNAM, mijo deja google y caele a una biblioteca y checale;@felectroniko;
0;0;I hate the new Google thing, it pisses me off.;;
0;0;@johnmartz I had to run that through google translate. Turns out you mean it's about "maths";@johnmartz;
0;0;@CuteFaceAssSwol yea u don't remember that? Google it.;@CuteFaceAssSwol;
0;0;@DesignerDepot really interesting read. What has Google done ?;@DesignerDepot;
0;0;Google カーとすれ違いますた。ストリートビューでの自分の姿を妄想中～;;
0;0;@Jonny_Brennan droids have flash players and blackberries don't. So you can do more internet on an android ( google ) phones;@Jonny_Brennan;
0;0;こりゃいいや。 Google リーダーに画面がスッキリするフルスクリーンモードと新しいショートカットが追加 : ライフハッカー［日本版］ http://www.lifehacker.jp/2010/09/100831grctcwfmns.html;;
2;1;JavaOneの Google の人のキャンセルのお知らせが来た。やっぱり、キャンセルかぁ。Puzzlersも、ChetとRomainのセッションもキャンセル。さて、その時間をどうするかだ。 #javaonejp;;#javaonejp
0;0;Google Family Safety Center http://bit.ly/d0AS4T;;
0;0;#GA -repost: I would love if Google Apps had the ability to add a link to the top navigation. Next to Mail, Calend... http://bit.ly/cgIkMx;;#GA
0;0;RT @geeksroom Google lanzá un Centro de Seguridad Familiar.[Vídeo] http://bit.ly/defvYY;@geeksroom;
0;0;日本語で来てた。全部英語にしてみたけど出てこないなぁ。誰かやってないかなぁ。 / Google Apps アップデートブログ: 新しい Google Apps プラットフォームへ: アーリーアダプターの移行開始 http://htn.to/mP7Rjz;;
0;0;holy shit my pics are on google =O how the fuck does that work: http://chatter.com/a/jsbes;;
0;0;It's Official: Google Voice access with Android Widgets http://googlevoiceblog.blogspot.com/2010/09/fast-access-to-google-voice-with.html;;
0;0;_yahoo se flipa con más de 8.880 millones de páginas frente a los 1.390 millones de google y 7 millones de bing... O.o´;;
0;0;Here Are 11 Sources Of Unstoppable Traffic: Did you know that Google has left their backdoor wide open for you? Th... http://bit.ly/8Z1Qv7;;
0;0;Here Are 11 Sources Of Unstoppable Traffic: Did you know that Google has left their backdoor wide open for you? Th... http://bit.ly/95Uyhs;;
0;0;Here Are 11 Sources Of Unstoppable Traffic: Did you know that Google has left their backdoor wide open for you? Th... http://bit.ly/95Uyhs;;
0;0;Tip of the day from @arbitainc: Using Google to find Restaurant Managers with Current Job Titles http://dlvr.it/4zzlM;@arbitainc;
0;0;歓迎RT @iphoneaposusume : Apple、iOS開発者向けライセンス契約の制限緩和を発表: この改訂で、開発者はAdobeのFlashアプリの移植と Google のAdMob広告プラットフォームの利用が可能になるようだ… http://goo.gl/fb/VBRgB;@iphoneaposusume;
0;0;AMAZING. Google infographic: http://royal.pingdom.com/2010/02/24/google-facts-and-figures-massive-infographic/ via @mrbanjo;@mrbanjo;
