retweets;favorites;text;mentions;hashtags
0;0;New API of the Week: Google Custom Search API - Plus: Google APIs Console: Today, via its Google Code Blog, Googl... http://bit.ly/as47L5;;
0;0;I´m the ultimate motherfucker. Para los que no la encontraban en google imagenes: http://bit.ly/93PcIo;;
0;0;This totally awesome SEO eBook previously sold for $37 but today you can get it totally Free. http://tinyurl.com/2af9seq Google is not God;;
0;0;[RSS収集] 【レビュー】ページのテキストを Google サーバに保存して利用するChromeエクステンション http://dlvr.it/7t6Fm;;
0;0;NYU Joins the Google Cloud (PC Magazine) http://dlvr.it/7t6Fl;;
0;0;@iSlappedYoBitch mp3 rocket << google it;@iSlappedYoBitch;
0;0;So...my cousin Daniel is doing an exam in California with the @Google company!! =) I'm so happy! If he wins the (cont) http://tl.gd/6ouq0l;@Google;
0;0;a alguien más le gustó la caricatura de scooby doo acerca de halloween que puso google ?! xDD;;
0;0;operai vou abaixar GOOGLE CHORME!;;
0;0;Lars Rasmussen, co-founder of #Google Maps and Google #Wave , will join #Facebook http://bit.ly/cXZarx;;#Google #Wave #Facebook
0;0;google translator for you;;
0;0;What would happen if a nuclear bomb goes off in your city? With Google 's Maps you can see the outcome. (carloslabs.com) http://bit.ly/bpqjNK;;
0;0;What would happen if a nuclear bomb goes off in your city? With Google 's Maps you can see the outcome. (carloslabs.com) http://bit.ly/bpqjNK;;
0;0;Google 's Android Still Beating Apple http://is.gd/gAFPc;;
0;0;pa los panas, la chica que estaba con charlie sheen cuando destrozo el la hab de hotel se llama Capri Anderson busquenla en google;;
0;0;@Opiadista Entre no Google Maps. Clique em "Como Chegar". Em A digite "Japão", em B digite "Estados Unidos". Leia o passo 27!;@Opiadista;
0;0;RT @mathewi : @myersnews @ckanal @mjenkins google keyword is how I explained it here - tho seems more expensive.;@mathewi @myersnews @ckanal @mjenkins;
0;0;Authors at Google : Matt Amsden and David Wolfe http://dld.bz/tPYD;;
0;0;"Amor não responde suas perguntas. Isso se chama Google . Amor é outra coisa...";;
0;0;@Millaneza fui no google .com procurar o que é shotacon e... eu não sabia. KKKKKKKKKKKKKKKKK;@Millaneza;
0;0;#sexfact : #factorfiction , Sex is the most frequently searched word online. Nope, #sex was overtaken by the word #Facebook on Google .;;#sexfact #factorfiction #sex #Facebook
0;0;Google Sues Interior Department Over Email Contract - WSJ.com http://safe.mn/1lHu;;
0;0;Google Sues Interior Department Over Email Contract - WSJ.com http://safe.mn/1lHu;;
0;0;@RRRJes I suppose he checked google books? I find I hardly have to go to a library anymore for 19th century imprints.;@RRRJes;
0;0;@YungRecklessTez do you have google talk.?;@YungRecklessTez;
0;0;Google Sues Interior Department Over Email Contract - WSJ.com http://safe.mn/1lHu;;
0;0;Google gana mercado por auge de teléfonos inteligentes http://bit.ly/beKoHZ;;
0;0;I hate when people google there problems!;;
0;0;@iudica buscalo en el google asi te pones al tanto de quien es.......;@iudica;
0;0;RT @schmediad : Google launches API console to help manage API usage across sites and apps. http://bit.ly/aabtb5;@schmediad;
0;0;Apple, Google Interested In Mobile Payment Startup BOKU And Its ...: TechCrunch is reporting t... http://bit.ly/aPKJTW http://bit.ly/5LYb39;;
1;0;Doodle Grub on Google campus ! http://tinyurl.com/2vwjjwu;;
0;0;@BorrachasdeAny HUASUHSAHUSAHSAHUSA eu aqui super ' google tradutor pra vida' pra nada. HUSAHUSAHU eurimuito;@BorrachasdeAny;
0;0;Ausbildung zum Google Professional mit AdWords Prüfung http://is.gd/gAFKY;;
0;0;Google Analytics - dann aber richtig! http://is.gd/gAFKx;;
0;0;Google Analytics - dann aber richtig! http://is.gd/gAFKw;;
0;0;Fundadores do Google queriam Steve Jobs como CEO da empresa http://www. gizmodo.com.br/conteudo/funda dores-do-google-queriam-steve-jobs-como-ceo-da-empresa … - ainda bem que não deu certo.;;
0;0;Sony Internet TV Blu-ray Disc Player with Google TV review http://ff.im/-t0uMa;;
1;0;Fuck Google !, ask me!;;
0;0;Google Sniper: $0 - Six Figure using this marketing blueprint (I just started yesterday!) http://cli.gs/ZVhuG;;
0;0;@google you vex me so with the termination of goog-411, its how I kept my grandma from running my cell bill up wiht 411 calls...;@google;
0;0;vExclusive: Apple, Google Are Sniffing Around Mobile Payments Startup BOKU - http://bit.ly/ct4hZ7;;
0;0;[News] 【レビュー】ページのテキストを Google サーバに保存して利用するChromeエクステンション http://dlvr.it/7t6Bp;;
0;0;@tirsales jep... bzw. nicht so intensiv. die ersten google ergebnisse sind schon ok ;-);@tirsales;
0;0;fazendo trabalho sobre a tropicália KKKKKK google pra que te quero (:;;
0;0;He marcado como favorito un video de YouTube -- John Lennon Google Doodle http://youtu.be/TYHCeUfoAnw?a;;
0;0;Google to U.S.: Who's Being Anticompetitive Now? [Digital Daily] http://ff.im/-t0uL1;;
0;0;Exclusive: Apple, Google Are Sniffing Around Mobile Payments Startup BOKU http://ff.im/-t0uLh;;
0;0;@giant_turnip DM me your email address and I'll add you to the google group.;@giant_turnip;
0;0;AAAAAAAHHHHH É DALTONICAAA! tive que perguntar pra pessoa mais inteligente: o Google , porqe aqui no twitter ngm soube responder =S;;
0;0;New API of the Week: Google Custom Search API - Plus: Google APIs Console http://sns.ly/hRT59 #twit_pro;;#twit_pro
1;1;Google sues the U.S. government in its ongoing 'cloud' battle with Microsoft http://lat.ms/a6LXMa;;
0;0;RT @OMGFacts Google Maps gives directions across bodies of water.For example, go to Google Maps an.. http://bit.ly/aFZVtx;@OMGFacts;
0;0;Google launches API console to help manage API usage across sites and apps. Includes Translate & Latitude http://bit.ly/aabtb5;;
0;0;Google Reposts Barred Turkish Videos (Marc Champion/Wall Street Journal) http://goo.gl/fb/e0icE;;
1;0;Google processa os Estados Unidos http://goo.gl/fb/q8sUH;;
0;0;@xVerity HDJSDFD LOL. 8( So yeah...I wouldn't know where St Austell was even if I looked it up on google maps tbh. 8'D;@xVerity;
0;0;Freakin' Androd phone just co-mingled my business & personal contact lists. VERY upset. #Fail #Google;;#Fail #Google
2;0;Google launches Demo Slam (I like it!). Thank you @Oniracom for the tip! http://www.demoslam.com/#/slam;@Oniracom;#
0;0;Google launches Demo Slam (I like it!). Thank you @Oniracom for the tip! http://www.demoslam.com/#/slam;@Oniracom;#
0;0;Wettkampf mit Microsoft: Google verklagt US-Innenministerium: Kampf um die US-Büros: Microsoft dominiert mit seine... http://bit.ly/aYMhXk;;
0;0;Spiegel Wettkampf mit Microsoft: Google verklagt US-Innenministerium: Kampf um die US-Büros: Microsoft dominiert m... http://bit.ly/aFZiDh;;
0;0;Wettkampf mit Microsoft: Google verklagt US-Innenministerium http://bit.ly/9RbhOO;;
0;0;"Charlie Sheen's mystery woman," ET? She's a somewhat successful porn star. Google her. Mystery solved.;;
0;0;Google is Australia and NZ's most desirable employer. According to a survey, we value brand reputation, culture, work/life balance.;;
0;0;TV do no evil = hmmmm... : http://blncs.pt/a?a=1518 Business | Google TV Gaining Steam;;
0;0;@aizkiub y habia dicho que google era un buscador (?)!;@aizkiub;
0;0;Go to Google maps. Go to directions. Put starting destination as Japan and ending des...: http://yearbook.com/a/pz7i9;;
0;0;@ronnyluke Haha iya itu kan boleh lihat dari google ron. Msh blm ngerti si maskulin dan si feminin :p;@ronnyluke;
0;0;google 'data mining' dickheads;;
0;0;Google -Blogs: Εμπρησμός από νεοναζί σε αριστερό βιβλιοπωλείο στο Βερολίνο ... http://bit.ly/dn6A0V;;
0;0;Como disse @leandropfs melhor fracasso q fiasco RT @IDGNow : 2010: As melhores e as piores inovações da Google neste ano http://bit.ly/dCwX2Q;@leandropfs @IDGNow;
0;0;@Guarisnaker Monito, entré a google y ahí sale: $ 2.000 y los libros están ca-rí-si-mos y si compra uno debe hacer flor de fila para pagar;@Guarisnaker;
0;0;('-' ) (._. ) ( ._.) ( '-') RT @apinzwh: Bgt RT @dewiKhunzzz: Serem ciiiRT @apinzwh: Search di google tentang Gn Kerakatau;@apinzwh @dewiKhunzzz @apinzwh;
0;0;Google sues US government - Straits Times http://tinyurl.com/3yxk3gq / @FLASH_NEWS #Google;@FLASH_NEWS;#Google
0;0;BieberGoogle has a sexy new BACKGROUND - Check it out :D http:// BieberGoogle.com http://www. biebersearch.com / via @bieber_ google;@bieber_;
1;0;Google ショッピングとの連携って登録業務の自動化のこと？今後このパターン増えるのか？ / asahi.com（朝日新聞社）：EC構築ASP「PRECS(プレックス)」、 Google ショッピング連携のご案内 - 企業リリース - ビジ… http://htn.to/jE7ZMT;;
0;0;Go to google maps, press "get directions," put "Japan" in the first box, put "China" in the second box, scroll and read number 43. LMBO!!!!;;
0;0;@cIcILovatoo m... esque mi BB Ya no tiene inter & no me deja entrar m... creo que mejor busco en Google !! grax!!;@cIcILovatoo;
0;0;lütfen şimdi herkez google 'a ''en keriz spor kulübü'' yazıp enter tuşuna bassın.;;
0;0;RT @Droidfeedz : Google 's Android software dominates U.S. smartphone market - San Jose Mercury News http://bit.ly/bAGV4l;@Droidfeedz;
2;0;Everyone pleeeease vote...just know the midterms affect the presidential election and you're future...if you dnt kno, bout it google da shit;;
0;0;Tuti "para de ver mendigo no google e vai ver o Chubaca!" hahahahahah;;
0;0;stop_affaire: marre d'attendre votre navigateur internet ? telecharger Google Chrome, si ce n'est pas deja fait ici : http://twlr.me/2B5;;
0;0;@Adrii_Rc uy y lo bajaste de google ? no tiene mucho virus? porque queria bajar ares pero me dijeron que no;@Adrii_Rc;
0;0;NYU Joins the Google Cloud - YAHOO!: Google has announced that New York University is moving all of its enterpris... http://yhoo.it/cTH4Df;;
0;0;Ahora se puede acceder a Flickr desde Google , pero sólo los nuevos usuarios, los antiguos ajo y agua con Yahoo http://goo.gl/jD62;;
0;0;Introducing the Google APIs Console and our latest API updates ( Google Code Blog) http://goo.gl/fb/52oDM;;
0;0;Google Reposts Barred Turkish Videos (Marc Champion/Wall Street Journal) http://goo.gl/fb/ejvU1;;
0;0;Minha mãe ta fazendo palavras cruzadas com o google do lado.. aHAHahhahahaHa deve ta divertido demais...;;
0;0;New API of the Week: Google Custom Search API - Plus: Google APIs Console http://bit.ly/btUgw4 #fb;;#fb
0;0;Apple, Google Interested In Mobile Payment Startup BOKU And Its Vast Carrier Partnerships http://bit.ly/9PL5G6;;
0;0;@This_JusTT_IN U caN Just gOOgLe me..lol;@This_JusTT_IN;
0;0;Why the Creator of Google Maps is Headed for Facebook http://is.gd/gAFAw;;
0;0;Apple, Google Looking At Buying Mobile Payment Company Boku (AAPL, GOOG) http://pulsene.ws/e6mp;;
0;0;RT @IndigoBrown : Ha!! Hell no!! I knew #ibeknowin lol RT @Diggz_dioR: @IndigoBrown CTFU ; did you go google him LmaO* haani is a fool! Lol;@IndigoBrown @Diggz_dioR @IndigoBrown;#ibeknowin
0;0;Exclusive: Apple, Google Are Sniffing Around Mobile Payments Startup BOKU http://pulsene.ws/dPHY;;
0;0;google 日本語入力で"時刻"を変換すると、お時間が出てくるのですねｗ@;@;
0;0;@OSNews Google Sues the United States of America: That is without a single shred of doubt the most awesome headlin... http://bit.ly/cHz6zd;@OSNews;
0;0;【レビュー】ページのテキストを Google サーバに保存して利用するChromeエクステンション: 10月30日(米国時間)、 Google はChrome向けのエクステンション「Web Clipboard」を公開した。これは表示して... http://bit.ly/cyJxkK;;
0;0;【レビュー】ページのテキストを Google サーバに保存して利用するChromeエクステンション: 10月30日(米国時間)、 Google はChrome向けのエクステンション「Web Clipboard」を公開した。これは表示して... http://bit.ly/cyJxkK;;
0;0;Google Sues the United States of America: That is without a single shred of doubt the most awesome headline I ever... http://bit.ly/b3A2vZ;;
10;1;Google Sues the United States of America: That is without a single shred of doubt the most awesome headline I ever... http://bit.ly/cHz6zd;;
0;0;Google Analytics no www.andreleitao.net;;
0;0;alguem aqui ja usou a versão do Google Chrome 8.0?;;
0;1;Google AdWords: YouTube Promoted Videos serves its 500,000,000th video view http://bit.ly/a1wLDm;;
0;0;How Google Book Search Works, Flying Robot Ghost Terrifies Children: Here are a few of the other noteworthy thing... http://aol.it/cmzGe3;;
0;0;wooowww,asliii..takjub abis ama google ..awesome daaahhh..;;
8;5;Google Broadens Bug Bounties To Include Web App Security http://bit.ly/bqWeoL;;
0;0;Google demanda a un ministerio que privilegió a Microsoft http:// xtranoticias.com/index.php?opti on=com_content&view=article&id=823:google-demanda-a-un-ministerio-que-privilegio-a-microsoft&catid=39:tecnologia&Itemid=57 …;;
0;0;[ Google Reader] Nielsen: Android trends younger, smartphone users are in the minority http://dlvr.it/7t63c;;
0;0;会社の適切な規模ってあるな。 RT @satomitw : グーグルに買収された会社の創業者が続々辞任： Google 's YouTube, AdMob, Google Map Founders Leaving http://goo.gl/fb/YUvF8;@satomitw;
0;0;Google sues the U.S. government in its ongoing 'cloud' battle with Microsoft | Technology | Los An.. http://lat.ms/dmUCYc;;
0;0;众包论坛（bbs.pxysm.com） Google 网站管理员工具（Webmaster Tools）功能更新：可显示反向链接总数 http://goo.gl/fb/lgVQ4 #其他google应用;;#
0;0;YES, eindelijk vindbaar in google , op happy harvest fansite;;
0;0;@Amaa_nda essa ser a tradução ok?? o google tradutor servee pra alguma coisaa;@Amaa_nda;
0;0;@jessiesosweet ok ill google and see;@jessiesosweet;
0;0;Voce costuma pegar as perguntas de comunidades do orkut , e/ou google , ou vem tudo da sua cabeça msm ?? http://4ms.me/bNL2bH;;
0;0;【電】 【レビュー】ページのテキストを Google サーバに保存して利用するChromeエクステンション （MYCOM Journal）: Google Chrome runs web pages and applications... http://dlvr.it/7t632;;
0;0;1) Go to google Maps 2) Go Get Directions 3) Japan as start location and China as End location 4) read number 43 5) Laugh And press like (=;;
0;0;Latitudie: Latitudie is the most complete Google Latitude client for iPhone and iPad! And it even runs in the... http://dlvr.it/7t621;;
0;0;Google Me...;;
0;0;Google Blog Search Results: 466,115 results for prop 19 - showing 1 through 5 http://tinyurl.com/28wrd9a;;
0;0;RT @dtg84 : What were sum of ur study habits n college? ~ highlight the things u dont understand & google it later.;@dtg84;
0;0;oi pesquisei no google sobre alface — aham e dai? http://4ms.me/cUUnvB;;
0;0;1) Go to google Maps 2) Go Get Directions 3) Japan as start location and China as End location 4) read number... http://tumblr.com/x0bo3bper;;
0;0;@DeucePolar don't kno. Guess the stuff just stop working so apple, and google pulled it.;@DeucePolar;
0;0;http://schierhuber9.co.cc/2010/11/_google_monitor_query_-or-googletestad.html _ google _monitor_query_ or googletestad;;
0;0;RT @weloveufunk Jesus et Google http://bit.ly/9qSWJ2 / jesús no lo sabe todo, saben;@weloveufunk;
0;0;@edmarmoretti o link está indo para a página do google ...;@edmarmoretti;
0;0;Google sues the US government over Microsoft favoritism http://safe.mn/1lG~;;
0;0;hahaha eu e o @RafinhaRosseto nos procramos no google;@RafinhaRosseto;
0;0;Google sues the US government over Microsoft favoritism http://safe.mn/1lG~;;
0;0;Google invites hackers into their playground: They are giving out rewards to anyone who can find vulnerabilities t... http://bit.ly/9i49FF;;
0;0;@DStrick01 @LarryAngeles @Leslie2McDonald ... google translate .. #win;@DStrick01 @LarryAngeles @Leslie2McDonald;#win
0;0;Google invites hackers into their playground: They are giving out rewards to anyone who can find vulnerabilities t... http://bit.ly/cc9Hov;;
0;0;@Fc_AshGreene coloca no google "side bar transparente" , porque é enorme;@Fc_AshGreene;
0;0;Pause for the cause.. before this convo continues.. let me google you.. !!!!;;
0;0;RT @jonrognerud : Introducing the Google APIs Console and our latest API updates ( Google Code Blog): http://bit.ly/aeOpHO;@jonrognerud;
0;0;Is The New #Google Chrome OS An Attempt To Make Your Hard Drive Obsolete? http://su.pr/1gmzcM #Googlechrome;;#Google #Googlechrome
0;0;Dios!!! Que lenta está esta cosa!!! Ni Google carga rápido -.-;;
0;0;Google - Government on 3 Fav Sources+30 others like Barrons: Tech Trader Daily- http://bit.ly/9OpfuT;;
0;0;af..aqui é irnet explorer! :@eu estava acostumada com google chorme! haha..logo menos vou pra minha irma e depois DIREITO pra casa!;@eu;
0;0;Apple, Google in secret talks with mobile payments startup BOKU http://ping.fm/jTkgL;;
0;0;I'm not even excited for VZW to get the iPhone because I love Google and Android so much! http://bit.ly/bmbV2O;;
0;0;Yeah i had to google it... LOL @Nvied;@Nvied;
0;0;RT @ZDNet : Google invites hackers into their playground http://zd.net/bzWTrW;@ZDNet;
0;0;I definitely gotta agree wit u on that one! Lol! “ @GOOGLE _ME_BiSHH : @AUsPriceless True , but it be even funnier when you see it lol !”;@GOOGLE @AUsPriceless;
0;0;Google sjellë version të ri të WebM: Google sapo ka paraqitur një version të përditësuar të vid... http://bit.ly/dw8LQJ #alkosnews #dituria;;#alkosnews #dituria
0;0;AdMob founder Omar Hamoui leaves Google http://yv2.me/wvFZ;;
0;0;Turnabout Is Fair Play: Google Sues The Feds For Not Considering Its Office Alternative: http://wp.me/p16CWP-28F;;
0;0;@SwiftieSweetie google it youll see.;@SwiftieSweetie;
0;0;"Fair Search" εναντίον Google http://goo.gl/fb/Qw0iO #travelnews;;#travelnews
0;0;@TrayGotFavour brah i swear somebody jus tweeted dat...it was a TOP TWEET wen i jus logged on... GOOGLE TIME!;@TrayGotFavour;
0;0;Google calls bug bounty hunters to YouTube, Blogger: Source: www.buzztracker.com --- Monday, November 01, 2010'133... http://bit.ly/cSl93B;;
0;0;@Dutchralex Google Sarah underwood en laat me weten wat je ervan vind.;@Dutchralex;
0;0;SEO Rank High On Google In 48 Hours: Source: www.whydowork.com --- Monday, November 01, 2010Believe it or not, it’... http://bit.ly/b7edXq;;
0;0;Google Sues Interior Department: Source: online.wsj.com --- Monday, November 01, 2010Google is suing the Departmen... http://bit.ly/9m12WU;;
0;0;Google sues U.S. over government contract exclusion: Source: www.theusdaily.com --- Monday, November 01, 2010SAN F... http://bit.ly/9xanPN;;
0;0;@mackenzielovin I didn't know that until I looked it up on google . She's had a rough time.;@mackenzielovin;
0;0;Apple, Google in secret talks with mobile payments startup BOKU http://bit.ly/asUses;;
0;0;Google has lost its startup culture … and its mojo: Source: delimiter.com.au --- Monday, November 01, 2010opinion ... http://bit.ly/92JK71;;
0;0;@tahrodrigues - Google sobre sua mãe; Voce quis dizer: A lingua da minha mãe é fofa. kkkkkkk;@tahrodrigues;
0;0;If #comcast was a person, you could find them on Google News by searching for "intoxicated" and "lion habitat.";;#comcast
0;0;Google Books to get “Rich Results” starting today http://bit.ly/bKeQvQ;;
0;0;Google sues Interior Dept over e-mail bid request: http://bit.ly/9LDytb #google #microsoft #federal #messaging #aktien #news #boerse;;#google #microsoft #federal #messaging #aktien #news #boerse
0;0;"Both Apple and Google are engaged in conversations with mobile payments start..." http://dlvr.it/7t5zV;;
0;0;Ao buscar por "panasonic discontinued technics" no Google , anúncios a respeito do fim da Technics datam não so de agora, mas também de 2009;;
0;0;Google analytics and GoStats are showing radically different traffic patterns for my blog.;;
0;0;Insisto que abrir Facebook por Google Chrome es como ver propaganda del gobierno en el cine por media hora.;;
0;0;@joksteve Para eso existe google , pero los hombres tampoco saben buscar lol;@joksteve;
0;0;New API of the Week: Google Custom Search API - Plus: Google APIs Console http://goo.gl/fb/meUpd;;
0;0;Google The Underbelly Project a GREAT piece of art in NY covered in today's NY Times today;;
1;0;Google demanda al gobierno de Estados Unidos por sólo permitir usar Microsoft http://bit.ly/c0ZOTL;;
0;0;me dicen google o que coño? :@;@;
0;0;@4lareen actually yes.. google it..it's quite lethal;@4lareen;
0;0;LOL Me lembrando dos desenhos q gostava, tinha um q não lembrava o nome, digitei "princesa órfã anel gatinho" no google e bingo! Honey Honey;;
0;0;1) Go to google Maps 2) Go Get Directions 3) Japan as start location and China as End location 4) read number 43 5) Laugh And press like (=;;
0;0;Apple, Google looking to buy Boku for mobile payments http://bit.ly/dh4Gxm;;
0;0;http://otakuland2.co.cc/2010/11/_google_monitor_query_-or-hotels.html _ google _monitor_query_ or hotels;;
0;1;Google Fusion Tables http://goo.gl/fb/JG9WV がバズってる…;;
0;0;@AislingDucks thank you Ais! honestly, thank you. i had a very mild panic attack and thought it would be a good idea to google it. don't! :L;@AislingDucks;
0;0;OSNews.com: Google Sues the United States of America: That is without a single shred of doubt the most awesome hea... http://bit.ly/dxOaJe;;
0;0;Bits: Google Extends Security Reward Program http://nyti.ms/bOftdg;;
0;0;google docs error!?!? HVA FAEN! HAR IKKE TID TIL SLIKT TULL NÅ :( :(;;
0;0;How do you work google talk !;;
0;0;[NY Times Tech] Bits: Google Extends Security Reward Program http://nyti.ms/9o6tvO;;
0;0;搜尋新秀Blekko挑戰 Google http://dlvr.it/7t5yf;;
0;0;#onlinebusiness Google in US lawsuit over online applications - Financial Times http://dlvr.it/7t5yT;;#onlinebusiness
1;1;National News- Don't Waste Your Money: Google dumps free 411 service http://bit.ly/aYDZwQ;;
0;0;Google Boots Spyware App from Android Market http://bit.ly/dnk0ZA;;
0;0;Bits: Google Extends Security Reward Program http://nyti.ms/bOftdg;;
0;0;Bits: Google Extends Security Reward Program http://dlvr.it/7t5xv;;
6;6;Tough choice - Apple TV vs. Google TV vs. Roku: 3 streaming media boxes duke it out http://ow.ly/1rmgfk;;
0;0;@MacfusionGirl haha, I didn't know the shake weight, we don't have it here. Had to google it. Thanks for the laugh :);@MacfusionGirl;
7;4;RT @courosa : http://bit.ly/9ljKat - teleports you to a random Google Streetview location. <--Very cool. Maybe a story starter...;@courosa;
0;0;When I have a question, I don't ask it, I google it.;;
0;0;» My Blog is PR4 from PR0 with Internal Pages of PR6 - Google ... http://bit.ly/LifeIsColourful-Blog-PR4;;
0;0;MacNN iPhone News: Apple, Google looking to buy Boku for mobile payments . More #Apple #iPhone #news - http://tinyurl.com/mm3pqq;;#Apple #iPhone #news
0;0;Election Day 2010: Google Maps and Where To Vote Tuesday: There is just one day until the polls open, so why not f... http://bit.ly/aQ0N7n;;
0;0;#GoogleComplexity strikes again? -> Google 's AdMob Integration Is "Just Not Going Great" http://read.bi/at1ReG;;#GoogleComplexity
0;0;@josephranseth I've got a droid. If I have something date specific, I just enter it into my Google Calendar or Outlook and it syncs.;@josephranseth;
0;0;ya se le fue la inspiracion a google ! jajajajajaja XD anda un poco deprimido hoy :D;;
0;0;Google TV Logitech Revue Review: The Best TV add-on you don't need yet - http://tinyurl.com/2b67cyu;;
0;0;Apple, Google looking to buy Boku for mobile payments - http://tinyurl.com/2dnpn69;;
0;0;@OfficialSonnYM Entra la pagina de UberTwitter por tu BB y te cuesta como $4 o $5 si queres descargarlo gratis busca en google;@OfficialSonnYM;
0;0;Google ドキュメントビューアがパッドちゃんに対応してるんだそうな。ってことはGMailに送ってもらえばいけるんじゃないかと。 RT @3tsuru3tsuru: @ribbon0328 パワーポイントは大丈夫そう？;@3tsuru3tsuru @ribbon0328;
0;0;Google is planning the demise of Jon Stewart... http://bit.ly/d8N7Pt via http://www.redditpics.com #reddit;;#reddit
0;0;Google calls bug bounty hunters to YouTube, Blogger - http://tinyurl.com/37nx7aj;;
0;0;【レビュー】ページのテキストを Google サーバに保存して利用するChromeエクステンション http://dlvr.it/7t5xK;;
0;0;Google invites hackers into their playground - http://tinyurl.com/39wpzpl;;
0;0;Google co-founders wanted Steve Jobs as their first CEO - http://tinyurl.com/329s4da;;
0;0;Apple, Google in secret talks with mobile payments startup BOKU - Apple Insider http://dlvr.it/7t5wY;;
0;0;RT @guao : 谷奥更新: 致富信息： Google 广发英雄帖，恳请黑客们出手黑了自己 http://guao.cc/P5o by @musiXboy;@guao @musiXboy;
0;0;Google Reposts Banned Turkish Videos http://dlvr.it/7t5wJ;;
0;0;NYU Joins the Google Cloud - http://tinyurl.com/35sd5sj;;
0;0;Bits: Google Extends Security Reward Program - http://tinyurl.com/2fn6t9h;;
0;0;Is Google Polluting the Internet? ... [http://is.gd/gzcEu];;
0;0;Vi esse lugar http://goo.gl/maps/J9iJ ontem no google earth. Meio sem planejar fui lá hoje, legal!;;
0;0;Google sues the US government over Microsoft favoritism - http://tinyurl.com/2egva5n;;
0;0;@Markie_DeSade A real life cowboy hat. An Akubra which is an aussie hat. Google it.;@Markie_DeSade;
0;0;After Google France et al: when is an ad "vague"?: Some of our readers may know that this particular Kat has a par... http://bit.ly/9J6JJy;;
0;0;Go to google maps.... Get directions... Then enter "JAPAN" as starting position and "CHINA" as destination.... Then read. Number 43;;
0;0;10:30 Uhr startet Google Street View in Deutschland. Oberstaufen im Allgäu wird das 1. Dorf sein dass man "bestaunen" darf. #google #yeah;;#google #yeah
0;0;Estoy regalando un e-Libro sobre Como utilizar Los Google Adsense http://www.ganardineroconadsense.org :);;
0;0;Google maps, por qué????? por que???? Creí que lo habían inventado ya todo.;;
