retweets;favorites;text;mentions;hashtags
6740;13361;When you google your symptoms of your cold and it tells you you've got four diseases and got two weeks to live pic.twitter.com/OqEFnrSHcJ;;
422;761;When you google symptoms of your cold and it tells you you've got three diseases, and got two weeks to live pic.twitter.com/PVYoL1jx7r;;
0;0;Mat Intro CTO - Google Drive http:// fb.me/5Oc7uCHjt;;
15;6;¿Será que las comadres del CNE están buscando en Google Maps los rincones en Venezuela donde poner las captahuellas y por eso se tardan?;;
2;0;Google : Former Kashechewan First Nation manager charged with fraud - CBC.ca http:// bit.ly/2cHUbI5;;
148;204;Google just acquired API.ai. Here's the updated graphic; a new bot stack has emerged! #bots http:// oreilly.com/bots pic.twitter.com/jea3eWkx3Y;;#bots
0;0;find chuck norris - Google Search Oh. My. God https://www. google.com/search?sclient =tablet-gws&client=safari&channel=ipad_bm&site=&source=hp&q=find+chuck+norris&oq=find+ch&gs_l=tablet-gws.1.0.0i20k1l2j0.1557.3725.0.4744.16.11.4.0.0.0.282.1622.0j3j5.8.0....0...1c.1.64.tablet-gws..4.11.1543.0..0i131k1j0i10k1.joZkJPBmzNY …;;
0;1;ANOTHER SHAKEDOWN by #Google as their search has STOPPED @fcc / @PreetBharara on my #MetroPCS phone??;@fcc @PreetBharara;#Google #MetroPCS
0;0;Aprende Rapido CTO - Google Drive http:// fb.me/57jmpR7JW;;
0;0;Google Pushing their PC Agenda BY ALEX FONTANA: Google is at it again pushing their PC inclusive agenda down ... http:// bit.ly/2cHUlz7;;
2;7;Google Photos can now generate themed movies from your shots http:// tnw.me/EqvC2Lv pic.twitter.com/JjkzYQOdi1;;
0;0;El coche autónomo de Google fue embestido por un conductor ebrio via @marca http://www. marca.com/motor/modelos- coches/2016/09/20/57e118a8268e3ea5558b467a.html …;@marca;
1;3;Google gives speedy AMP-enabled news stories a boost in search http:// ift.tt/2csvRXB #Apple #Digitaltrends #iPhone #iOS #iPad #iPad;;#Apple #Digitaltrends #iPhone #iOS #iPad #iPad
1;6;#TodayAtLHSK Biology students use google classroom to upload pictures of their candy mitosis models. pic.twitter.com/FBTbPs1On0;;#TodayAtLHSK
0;0;¿Cómo aprovechar el celular para promocionar tu marca/negocio vía Google ? https:// goo.gl/rfDI3b pic.twitter.com/Y5GAEsxMOn;;
0;0;We'll review your Google Ads & tell what we would change & why. No obligation. Email Us! http:// fb.me/GVPQuDlA;;
0;0;Google launches Google Trips, "a personalized tour guide for your pocket" https:// googleblog.blogspot.com.au/2016/09/see-mo re-plan-less-try-google-trips.html … #TalkAboutLosingTheSpontaneity;;#TalkAboutLosingTheSpontaneity
0;0;Martin excited for Grand Slam of Curling event in North Battleford - The Battlefords News-Optimist: Google N... http:// bit.ly/2df7V95;;
0;1;Ya está aquí Google Trips, la herramienta (casi) definitiva para planificarte los... http:// feeds.weblogssl.com/~r/diariodelvi ajero/~3/Q2XO5hTIr2w/ya-esta-aqui-google-trips-la-herramienta-casi-definitiva-para-planificarte-los-viajes … @diarioviajero;@diarioviajero;
0;0;YOU CANT JUST GOOGLE THE NAME SCORPION IM YELLING;;
0;0;Google says elderberry and lemon or some shit???;;
0;10;Might as well call you google ...cause you're all I am looking for #kendallscatchlines;;#kendallscatchlines
0;0;いよいよ服もデジタル化?! Google と「Levi's」が、洋服をウェアラブルデバイス化させる「Project Jacquard」を発表。服でスマホを操作できます◎... http:// fb.me/5kEB5s3l1;;
0;0;I liked a @YouTube video http:// youtu.be/2iWxrkGWqfA?a Comcast going cellular, Google teases possible Pixel phone (CNET Update);@YouTube;
0;0;Existen personas que te ven como GOOGLE , y te buscan cuando necesitan algo;;
0;0;Laptops In Kenya Google Trader In Ghana - Laptops http:// pimbletree.com/laptops/laptop s-in-kenya-google-trader-in-ghana-laptops/ …;;
0;0;Google Now dies in favor of more pragmatic name in search app beta http:// pocketnow.com/2016/09/20/goo gle-now-dies-feed …;;
0;0;Apple's iPhone Is Good, No Bad?; Google 's New Devices; Adobe's Earnings Beat - Eye On Tech http:// ift.tt/2d0uGhE;;
0;0;Google Play again used to host malware-laden apps; this time, http:// bit.ly/2cSsu9R;;
0;0;SAMEKKJKJDIFK;;
0;0;He añadido un vídeo a una lista de reproducción de @YouTube ( http:// youtu.be/kj9HlEXnXA4?a - Google Duo le plantará cara a WhatsApp).;@YouTube;
1;1;Google ドライブの検索がNLP（自然言語処理）を採用して、目的のファイルをより探しやすくなるように改善。 https:// plus.google.com/+GoogleDrive/p osts/acdMtRGKzeg … 日本語でも機能してんのかな？ pic.twitter.com/J41gbMuDRr;;
0;0;MPF processa Google por publicidade infantil ilegal http:// ift.tt/2dhP3c5 #notícia #marketing #empreendedorismo;;#not #marketing #empreendedorismo
0;0;Kehadiran Google Trips bisa jadi ancaman serius bagi aplikasi perjalanan terkemuka kendati sampai sekarang belum... http:// fb.me/5jlr4BEyS;;
0;0;// TRAIN TO JANNAH // Bila trending terus godek Sheikh Google Dlm reramai, pergghh 2 org je yg smpi ke Busan... http:// fb.me/4UOC73EdH;;
0;0;♖ Google Drive Search Just Got a Lot Smarter http:// 310ei.xyz/2dhNlaE #310ei;;#310ei
0;0;勉強用。「サーバー構築の手間はかかりますが、超簡単にさまざまなデータソースから、自由にダッシュボードが作れるようになります」。◆ Google Analyticsの情報をダッシュボード「Re:dash」で可視化する - Qiita http:// pyn.jp/2df7P12;;
0;0;Google Duo le plantará cara a WhatsApp: http:// youtu.be/kj9HlEXnXA4?a vía @YouTube;@YouTube;
0;0;I think Google needs a new design theme. Even this looks more boring than the iPhone 7. https:// twitter.com/reneritchie/st atus/778377772473454594 …;;
0;0;Uuh la puta que lo pario al internet de mierda este 6Mg y no carga ni Google ...;;
0;0;I love it! We need to do another google hangout!!!;;
0;0;http:// bit.ly/1iYb0n9 Search Redirect Virus Fix: A complete fix for the Google redirect virus. Remove the se... http:// tinyurl.com/hrzsvxz;;
0;0;Google は位置情報分野に相当力を入れてますね。それよりもUrban Enginesの技術が気になる！ グーグル、位置情報分析のUrban Enginesを買収--地図サービス強化へ http:// japan.cnet.com/news/business/ 35089298/ … @cnet_japan さんから;@cnet_japan;
0;2;these are ts not @google . They just help with gafe. Not employees.;@google;
1;2;google search my boyfriend is so upset about being called a furry that i think he's going to wreck our whole house;;
0;0;protip if you want to find new music: (on google play music, desktop AND mobile) pic.twitter.com/Xippq9Q4or;;
0;0;googleが10月4日になにかするみたいねー;;
0;0;if you search google all articles on Hillary are negative his are positive.. just saying! Please check!!;;
7;18;Google lanzará Allo en las próximas horas. Alló es su nueva app de mensajería instantánea.;;
0;0;#Google #Facebook - We all need 'High-Quality' sites to post our ads! http:// dld.bz/eTtqT pic.twitter.com/utrYpCoWya;;#Google #Facebook
0;0;Google Event October 4th -- Google Pixel, 4K Chromecast, & More - https:// youtu.be/PErVNykEYxY;;
0;0;Gostei de um vídeo @YouTube de @narradordevideo http:// youtu.be/9U8mpEDlDn8?a RESUMO DA ZUEIRA #38 - NARRADO PELO GOOGLE TRADUTOR;@YouTube @narradordevideo;#38
0;1;why not.... Idk... Google it?;;
0;0;【ダークサマナー】ダークファンタジーの王道ゲーム！数多のモンスターと最強を目指せ！ AppStore： http:// bit.ly/P63JqN Google Play： http:// bit.ly/Nl1XT4 #DarkSummoner_jp;;#DarkSummoner_jp
0;1;tell her to google it;;
0;0;espera foi ao Google pesquisar.;;
0;2;Vou ensinar um negócio pra vocês, Instagram é pra fotinha, pra ver imagens eu tenho o Google;;
0;0;From the 80s Wayne Watson All Day and All Night on http://www. ClassicChristianRadio.com D/L our apps from Google and Apple.;;
0;0;Come join me in an epic adventure. Invite ID: 2344439010 AppStore： http:// bit.ly/AzhyKP Google Play： http:// bit.ly/NtcNTs #DarkSummoner;;#DarkSummoner
0;1;google translate probably idk;;
0;1;Google 89.5 WFCI and the first link let's you listen to my show. Mondays with @Marissamh92 at 7 and Tuesdays at 8.;@Marissamh92;
0;1;Google Sends Out Emails Explaining RCS Ahead of Allo Launch #GoogleAllo http:// bit.ly/2cOFeBv;;#GoogleAllo
0;2;please Google the law. Thanks.;;
0;0;Me gustó un video de @YouTube de @germangarmendia http:// youtu.be/h8WEzaGAjm4?a BUSCO MI NOMBRE EN GOOGLE | I Google Myself;@YouTube @germangarmendia;
0;0;Google Event October 4th -- Google Pixel, 4K Chromecast, & More - https:// youtu.be/PErVNykEYxY;;
0;0;Google Maps Android ahora muestra un haz de luz azul para una mejor y más rápida orientación: Con la última a... http:// bit.ly/2cSmiyq;;
0;1;bien buscado en el traductor de google , pero se escribe "danke" pinche ignorante;;
0;0;Google Maps Android ahora muestra un haz de luz azul para una mejor y más rápida orientación: Con la última a... http:// bit.ly/2cSmiyq;;
0;0;Google Maps Android ahora muestra un haz de luz azul para una mejor y más rápida orientación: Con la última a... http:// bit.ly/2cSmiyq;;
0;0;RT @EdoTech : Google abre su proyecto AMP a todos sus usuarios http:// dlvr.it/MJMLZY;@EdoTech;
0;0;#5: タブレットPC CHUWI Vi7 3Gクアッドコア 7インチIPS液晶1024×600 3G/GPS/BT/SIMフリー Android5.1 中華アプリなし 日本語化済み Google プレイ対応 [並行輸入品] http:// ift.tt/2csvjBd;;#5
0;0;Google Maps Android ahora muestra un haz de luz azul para una mejor y más rápida orientación: Con la última a... http:// bit.ly/2cSmiyq;;
17;6;RT htcvive: Google brought some Vives and TiltBrush to #HackMIT to inspire VR hacking and development. pic.twitter.com/OgnCjkxwyI #VR #virtua …;;#HackMIT #VR #virtua
0;0;Google ストリートビューを始めよう！ ご質問や導入のご相談など、こちらからお気軽にお問合わせ下さい。 http:// bit.ly/2bvskEG pic.twitter.com/Lh2iz36Fec;;
0;0;Thanks, Jesse LaJeunesse, for your excellent review on Google @Birdeye_ https:// birdeye.com/nelson-macneil -rayfield-trial-attorneys-pc-146670303015497/review/16298775516377866 …;@Birdeye_;
0;8;Yo en mi día a día: Buscador de Google : cómo adelgazar 10 kilos en una semana.;;
0;0;in all fairness, I only google the really difficult friend;;
0;0;Pesquisando aqui no Google quem pediu sua opinião pic.twitter.com/hbsahBlwmA;;
0;0;Google Maps y las "novedades" de su nueva versión. #ALosBotes #YaFueTodo pic.twitter.com/Zw2HW4wapS;;#ALosBotes #YaFueTodo
0;2;. @aaron_hewison anyone :) Google EA Access :);@aaron_hewison;
0;2;3 Ways to Use Google Analytics to Evaluate Your Audience http:// buff.ly/2cHgZri pic.twitter.com/QOdymAbuqr;;
0;0;Photos actually have a decent search function (but not as good as Google Photos) is a big shift toward competence there.;;
0;1;oh my god you guys it better have cloud saving on google drive or something;;
0;0;I could google evil Christian quotes but would it represent all Christians?;;
0;0;【ダークサマナー】ダークファンタジーの王道ゲーム！数多のモンスターと最強を目指せ！ AppStore： http:// bit.ly/P63JqN Google Play： http:// bit.ly/Nl1XT4 #DarkSummoner_jp;;#DarkSummoner_jp
1;4;@lorimcewen , thanks for pushing "The Google "... @CameronBerube @GinamarieMasiel https:// twitter.com/math_alberino/ status/778333359105859584 …;@lorimcewen @CameronBerube @GinamarieMasiel;
0;0;El coche autónomo de Google , embestido por un conductor borracho http://www. expansion.com/empresas/motor /2016/09/20/57e11525468aebd5728b466f.html?cid=SMBOSO22801&s_kw=twitter … vía @expansioncom;@expansioncom;
0;0;you could sink your Asana to your Google Chrome calendar, then use any app to view...;;
0;3;I'm going by my doctor. not a Google search. thanks!;;
0;1;Ari aged 16 just showed me how to google image. I feel all sorts of techy!!;;
0;0;Google 、AMPをサポートするモバイル検索を正式公開。ゆっくりと展開し、まずは米国から導入開始か？ https://www. suzukikenichi.com/blog/google-of fically-rolls-out-amped-mobile-search-but-slowly/ … #web -official-news #feedly;;#web #feedly
0;0;why I was called a conspiracy nut for doing this 5 years ago.. Even google admitted it.. Guess I was right;;
0;0;comoachar1namarinhxlegal google pesquisa;;
0;0;Que ganas de tener Google Allo, para probarlo nomás;;
0;0;Gostei de um vídeo @YouTube de @narradordevideo http:// youtu.be/UtQzdQdtUGY?a POBRE FAZENDO POBRICE 5 - NARRADO PELO GOOGLE TRADUTOR;@YouTube @narradordevideo;
0;7;My first project when I joined Google was a new feature in Android Studio, and it finally just shipped with 2.2: https:// developer.android.com/studio/intro/i ndex.html#sample-code …;;#sample
0;0;lo buscare en google no si;;
0;0;Google Maps is finally doing something about your phone’s screwy compass - http:// techseekr.com/?id=1187543;;
1;3;MPF processa Google por publicidade infantil ilegal no Youtube http:// ift.tt/2cHUD8Y;;
1;2;自然言語によるコンピューターとの会話を実現するAPI集のAPI.AIを Google が買収 | TechCrunch Japan http:// jp.techcrunch.com/2016/09/20/201 60919google-acquires-api-ai-a-company-helping-developers-build-bots-that-arent-awful-to-talk-to/ … @jptechcrunch さんから;@jptechcrunch;
0;1;Introducing Google Trips https:// youtu.be/ign2GmVEflw via @YouTube;@YouTube;
0;0;View Design: you can steer yourself any direction you choose – vinyl phrase…: google _ad… http:// goo.gl/fb/sPuzVT;;
0;0;I've been wondering this myself tbh, maybe google for reviews;;
0;0;Google の画面が回転！？ Google で「Do a Barrel Role」と検索してみよう。そのまま画面がグルリと時計回りに回るはずだ。スマホでもできるぞ。;;
0;0;【ダークサマナー】ダークファンタジーの王道ゲーム！数多のモンスターと最強を目指せ！ AppStore： http:// bit.ly/P63JqN Google Play： http:// bit.ly/Nl1XT4 #DarkSummoner_jp;;#DarkSummoner_jp
0;0;Secara SDM saya yakin bisa kok, tinggal bagaimana menyatukan semua itu, seperti China dan Korea, dimana Google cs nggak berkutik disana;;
0;0;Gostei de um vídeo @YouTube de @narradordevideo http:// youtu.be/NbNnEYS8qJo?a RESUMO DA ZUEIRA #45 - NARRADO PELO GOOGLE TRADUTOR;@YouTube @narradordevideo;#45
0;0;Te recomiendo jugar #Apensar desde tu móvil.Disponible en App Store http:// icogr.com/18XJ4TU y en Google Play http:// icogr.com/1AdkmW1;;#Apensar
0;0;RT htcvive: Google brought some Vives and TiltBrush to #HackMIT to inspire VR hacking and development. pic.twitter.com/7cpiHz4OTo;;#HackMIT
0;0;Google Now desaparece en la última beta abriendo paso a Assistant http:// fb.me/I0Et7uMs;;
0;2;OMG! Google 4the win today I'll neva b able to look an Anna in the eye again;;
0;0;Google Now dies in favor of more pragmatic name in search app beta http:// dlvr.it/MJML42 pic.twitter.com/QXhygO1YUW;;
0;1;Google Drive now lets you find docs using natural-language queries - CNET https://www. cnet.com/news/google-dr ive-now-lets-you-find-docs-with-natural-language-queries/#ftag=CAD590a51e … #business #feedly;;#ftag #business #feedly
0;0;Google Now dies in favor of more pragmatic name in search app beta http:// ift.tt/2d9o6c0;;
0;0;09/21 08:00 の Google 検索ワード 1:市川海老蔵 2:好きな人がいること 最終回 3:アンジェリーナジョリー 4:台風 5:小林麻央;;
0;0;they should..so funny this features never be embedded into stock 7.0 @google @googlenexus https:// twitter.com/gsmarena_com/s tatus/778381231557718016 …;@google @googlenexus;
0;0;Google Pixel duo and Android 7.1 Nougat may get long-awaited stock reboot button - Phone Arena http:// bit.ly/2d6LsdI #android #news;;#android #news
0;0;Ayo kejar pajak Google . Berikan sanksi pidana. http:// jurnalindonesia.id/bertahun-tahun -google-kemplang-pajak-cuma-sri-mulyani-yang-berani-kejar/ …;;
0;1;Gracias por las felicitaciones, pero siento anunciaros que el primero en felicitarme ha sido el bot de Google :P pic.twitter.com/ERTAIcc2sG;;
0;0;Google brings natural language search to Drive - Engadget http:// dlvr.it/MJMKr0;;
0;0;Is this LIGHTNING FAST lead strategy the answer to your prayers? Stop fighting Google and get 53+ leads every day: http:// bit.ly/29rd8Hc;;
0;1;ok someone from new york signed into my google account 10 mins ago. elliott alderson, that u????;;
1;4;Attendance. Scan a QR code on the student ID at a wall mounted device(old iPhone), which connects to one of your Google things;;
0;0;まだiPhoneのマップは Google マップに追いつかないね;;
0;0;Google Fiber made a deal with one administration, and now the next admin isn't following through to make it happen the way was promised.;;
0;0;Google Trips app for Android and iOS goes official - Phone Arena http:// ift.tt/2cniUQm #android;;#android
1;4;You're not original, just Google your idea and see for yourself. Even this tweet is most likely unoriginal.;;
4;6;EI @google @Wikipedia EU NAO TENHO 33 CARA https:// twitter.com/AaronCarpenter /status/778115144295583744 …;@google @Wikipedia;
0;1;That's what I was hoping for ;-) But I may have to use Google or the movie commentary a little bit;;
0;0;Ils auraient pu faire un effort dans @CriminalMindsBB .. Et ne pas utiliser Google Trad, pour leur épisode censé se passer à Paris ... pic.twitter.com/MNXJscwU3b;@CriminalMindsBB;
2;7;I've been using Google for 10 years and I have no idea what the "I'm Feeling Lucky" button is for.;;
0;2;My friends are breaking down on Twitter. Oh no. Uhhhh. Google search: how to help friends when they are sad and you want to help them;;
0;1;【レビュー】Webブラウザーの動作を妨げる迷惑ソフトを一掃してくれる Google 製のクリーナーツール - 窓の杜 http:// forest.watch.impress.co.jp/docs/review/10 20170.html … @madonomori さんから;@madonomori;
0;0;Google launches new tour guide app for travelers http:// ift.tt/2cFQK1c;;
0;0;@RiseUp2000 @loununez57 @dcr8352 @Lawrence I expect someone like you to be up to date on facts: Google Search engine is bias.;@RiseUp2000 @loununez57 @dcr8352 @Lawrence;
0;0;Kindly Retweet #TechNews Google has ditched the Nexus brand for Pixel - http:// cuulgeek.com.ng/google-ditched -nexus-brand-pixel/ … pic.twitter.com/7OjHASIscj;;#TechNews
0;1;Google でJUMP検索したらトップニュースにいのひか出て来て幸せだった♡← pic.twitter.com/LoMEUA3lsQ;;
0;0;Thank you @Google #AndroidNougat OTA update running on my #Nexus6P very well @Android @googlenexus pic.twitter.com/DPobCL6JGo;@Google @Android @googlenexus;#AndroidNougat #Nexus6P
0;0;Google Helps Users AMPlify Their Pages with Online Guides http:// b2c.news/AW5y0H via @B2Community;@B2Community;
0;0;[Help] Is there any way to download a google trends CSV file automatically using Javascript? | http:// ift.tt/2cRNJbJ #js #webdesign;;#js #webdesign
0;0;Los nuevos #Google #Pixel incluirán un botón para reiniciar el dispositivo https:// pisapapeles.net/los-nuevos-goo gle-pixel-por-fin-incluiran-un-boton-para-reiniciar-el-dispositivo/ … vía @pisapapeles_net;@pisapapeles_net;#Google #Pixel
0;0;クルマを買う : Google アラート - 軽トラック http:// kurumawokau.doorblog.jp/archives/49597 582.html …;;
0;0;#bestbuy #Bargains #7965 7" Google Android 4.4.2 Tablet w' WiFi Dual Cameras 4GB TUV Certi… http://www. computerhotdeals.info/deals2/index.p hp?link=http%3A%2F%2Frover.ebay.com%2Frover%2F1%2F711-53200-19255-0%2F1%3Fff3%3D4%26toolid%3D100034%26campid%3D5337872096%26mpre%3Dhttp%3A%2F%2Fdeals.ebay.com%2F5003649266_7__Google_Android_4_4_2_Tablet_w__WiFi_Dual_Cameras_4GB_TUV_Certification_Chromo&image=http%3A%2F%2Fi.ebayimg.com%2F00%2Fs%2FMTAwMFgxMDAw%2Fz%2FXZ8AAOSwzOxUYkQX%2F%24_35.JPG&title=7%22+Google+Android+4.4.2+Tablet+w%27+WiFi+Dual+Cameras+4GB+TUV+Certification+Chromo … pic.twitter.com/fzKCigOBuF;;#bestbuy #Bargains #7965
0;0;No @google + @microsoft + @peterthiel the life you live you would be hard pressed to ever have myself or peers trust or respect ever at all;@google @microsoft @peterthiel;
0;2;@ScotchCrawfish @leiajennifer created Google doc. Added notes to what I've written. Excited to work in this platform! #engl312mu pic.twitter.com/DPSpNf2qfy;@ScotchCrawfish @leiajennifer;#engl312mu
0;0;Could This Mysterious Ad Be for Google 's New Pixel Phone? http:// fb.me/5eCw3g3Ja;;
0;0;Me ha gustado un vídeo de @YouTube ( http:// youtu.be/rAVdG3YO5IE?a - EL GEOMETRY DASH DE GOOGLE ? o.O).;@YouTube;
0;0;ProAndroid: Los nuevos Google Pixel podrían ser más caros que los Nexus http:// buff.ly/2cE3a9F;;
0;5;cass just typed "zak bagans x reader" into google;;
0;0;Could This Mysterious Ad Be for Google 's New Pixel Phone?: Every weekday, we bring you the Ad Age/iSpot Hot S... http:// bit.ly/2cSrfXZ;;
0;0;Te recomiendo jugar #Apensar desde tu móvil.Disponible en App Store http:// icogr.com/18XJ4TU y en Google Play http:// icogr.com/1AdkmW1;;#Apensar
0;0;[ #digitalmarketing #smm ] Small Business Tips: The Secret Formula Of A 13.11X ROI #Google AdWords Campaign … pic.twitter.com/yB40J9DpMc;;#digitalmarketing #smm #Google
0;0;#branding Could This Mysterious Ad Be for Google 's New Pixel Phone?: Every weekday, we bring you t... http:// bit.ly/2cSrfXZ #marketing;;#branding #marketing
0;2;Tidak semua hal bisa dicari dg Google , misalnya sapi saya yang hilang.;;
0;0;Could This Mysterious Ad Be for Google 's New Pixel Phone?: Every weekday, we bring you the Ad Age/iSpot Hot S... http:// bit.ly/2cSrfXZ;;
0;0;Could This Mysterious Ad Be for Google 's New Pixel Phone?: Every weekday, we bring you the Ad Age/iSpot Hot S... http:// bit.ly/2cSrfXZ;;
0;0;Di planet Uranus dan Neptunus ada hujan berlian. #Google;;#Google
0;0;#Google confirma evento para el 4 de octubre. http:// a.mynews.ly/!gD.EYAMd;;#Google
0;0;News: Could This Mysterious Ad Be for Google 's New Pixel Phone?: Every weekday, we bring you the Ad Age/iSpot... http:// bit.ly/2cSsCG9;;
0;0;Google no tiene todo.;;
0;0;Could This Mysterious Ad Be for Google 's New Pixel Phone? http:// bit.ly/2cSrfXZ;;
0;1;Haha, remember when Google Talk and Facebook were compatible with Jabber and you could shove everything into iChat? Good times.;;
0;0;Could This Mysterious Ad Be for Google 's New Pixel Phone?: Every weekday, we bring you the Ad Age/iSpot Hot S... http:// bit.ly/2cSrfXZ;;
0;0;anyone else's screen black out while on google chrome?;;
0;0;Could This Mysterious Ad Be for Google 's New Pixel Phone?: Every weekday, we bring you the Ad Age/iSpot Hot S... http:// bit.ly/2cSrfXZ;;
0;0;Could This Mysterious Ad Be for Google 's New Pixel Phone? http:// bit.ly/2cSrfXZ #eCommerce;;#eCommerce
0;3;Ultimamente paso tiempo en Google maps tratando de buscar un lugar mejor ubicado para vivir y mae cómo cuesta que desorden de país;;
0;0;Google encabeza una coalición mundial para lograr “mejores anuncios” en Internet | http:// media-tics.com http://www. media-tics.com/noticia/6808/i nternet/google-encabeza-una-coalicion-mundial-para-lograr-mejores-anuncios-en-internet.html … #in;;#in
0;0;Google ストリートビューとは、 Google 検索、 Google マップ、Google＋で、店舗・施設の中を360°のパノラマ画像で疑似体験できるサービスです。 http:// bit.ly/2bvskEG pic.twitter.com/WVGTq88s4Q;;
0;1;Fuck yeah, The Dear Hunter's new album is on Google Play :D;;
0;0;09/21 08:00 Google 検索数ランキング 1:市川海老蔵 2:好きな人がいること 最終回 3:アンジェリーナジョリー 4:台風 5:小林麻央;;
0;0;09/21 08:00 Google 検索数ランキング 1:市川海老蔵 2:好きな人がいること 最終回 3:アンジェリーナジョリー 4:台風 5:小林麻央;;
0;1;Calling Google , Microsoft, Boing or even Uber a startup is kind of silly too. @EBienkowskaEU @GibsonsSteak;@EBienkowskaEU @GibsonsSteak;
0;0;http://www. youtube.com/watch?v=zKKF_v FshMM&sns=tw … via #BonTuYauDuNet sur Google;;#BonTuYauDuNet
0;0;アイドルのニュース｜オタクニュースサイトおたぽる: 10日、女優の前田敦子が自身のTwitterで「広島カープ優勝！！！ うおーーー… http:// dlvr.it/MJMKW3 From Google By PUZjX8;;
0;0;Mierdaaa, google frases actiiiii https:// twitter.com/micchaelle/sta tus/203983338078351360 …;;
0;0;09/21 08:00 Google 検索数ランキング 1:市川海老蔵 2:好きな人がいること 最終回 3:アンジェリーナジョリー 4:台風 5:小林麻央;;
1;1;King of dark fantasy. Summon today. App Store: http:// bit.ly/AzhyKP Google Play: http:// bit.ly/NtcNTs #DarkSummoner;;#DarkSummoner
0;0;初めて生 Google カー見た!!@明石銀座通り～観光道路;@;
2;2;The #techeducator podcast is live in 8 minutes to discuss all things Google Classroom! Head over to http:// teachercast.tv right now!;;#techeducator
0;0;09/21 08:00 Google 検索数ランキング 1:市川海老蔵 2:好きな人がいること 最終回 3:アンジェリーナジョリー 4:台風 5:小林麻央;;
0;0;you're Google ...except you don't have the billions.;;
0;0;09/21 08:00 Google 検索数ランキング 1:市川海老蔵 2:好きな人がいること 最終回 3:アンジェリーナジョリー 4:台風 5:小林麻央;;
0;0;Google Duo, la nueva aplicación que pretende reemplazar a Skype #tecNovedosos http://www. tecnovedosos.com/google-duo-app/;;#tecNovedosos
0;0;Pertanyaan sederhana : Bisa kah masyarakat kita hidup tanpa Google ? Whatsapp? Twitter? FB? Path? Instagram? Bbm? Line???;;
0;0;09/21 08:00 Google 検索数ランキング 1:市川海老蔵 2:好きな人がいること 最終回 3:アンジェリーナジョリー 4:台風 5:小林麻央;;
0;0;【ダークサマナー】ダークファンタジーの王道ゲーム！数多のモンスターと最強を目指せ！ AppStore： http:// bit.ly/P63JqN Google Play： http:// bit.ly/Nl1XT4 #DarkSummoner_jp;;#DarkSummoner_jp
