retweets;favorites;text;mentions;hashtags
0;0;United Onslaught is on! Get Divine Evolvable Rank S! App Store: http:// bit.ly/AzhyKP Google Play: http:// bit.ly/NtcNTs #DarkSummoner;;#DarkSummoner
0;0;➝Very very Berry on Google play https:// play.google.com/store/music/ar tist/Very_very_Berry?id=Apw2juqqtdpufwejm5om3bhugwm … #μουσική #Ιαπωνία #πληροφορίες;;# # #
0;0;[REQ] (140) - ( #Raleigh , NC, USA), (Repaid for 185 on 6/31), ( Google Wallet / FBPay) http:// dlvr.it/PK2LzX pic.twitter.com/LQCXxh2Jp1;;#Raleigh
1;0;#USA #Google - - FREE LEADS and Quick ListBuilding - A must for the serious Internet Marketer! http:// dld.bz/fxXU2 pic.twitter.com/VjW5KwPHxW;;#USA #Google
0;0;Nova sede do Google em Londres custará 1 bilhão de libras e terá 92 mil m²; confira imagens - http:// goo.gl/alerts/CGQMR #GoogleAlerts;;#GoogleAlerts
0;0;Lol. Now the google home I've actually heard is a decent speaker. Too bad we don't have portable outlets! Lol;;
0;0;Google testa caminhões autônomos http:// dlvr.it/PK2Lg6 pic.twitter.com/ad0I5ZfYfu;;
0;2;I need it for things like the 35 where the only schedule is on Google Maps via the GTFS feed pic.twitter.com/aXFaLYYv9I;;
4;2;SEO 2017: 8 Crucial Rules For Dominating Google 's Search Results http:// bit.ly/2hu3it8 #seo #2017 #marketing;;#seo #2017 #marketing
0;0;#NowPlayingOnXIVFM D-SIX - TCHEKI NA TCHEKI #XIVFM Disponible sur App Store! & Google Play! http://www. xivfm.com;;#NowPlayingOnXIVFM #XIVFM
0;0;Google the words it'll pop up https:// twitter.com/Pocahhhhh/stat us/871388190845882372 …;;
0;0;Google Pixel XL International Giveaway @androidauth #giveaway https:// wn.nr/FKUgZ3;@androidauth;#giveaway
0;0;All I found for my google search of "milkshake duck rule" is this; please explain? pic.twitter.com/tcEuVbWVxy;;
0;1;ai eu fiz a mesma coisa no moovit e apenas um onibus então a dica é: não vá pelo caminho do google maps;;
0;0;Como manter a barriga comendo nuggets batata frita e tomando sorvete Google;;
0;0;Try Google Apps for Work for free for 30 days and message me for a discount URL: https:// goo.gl/7INB3f 06 12:46:50 pic.twitter.com/Is3J9Ydkqb;;
0;0;#Google Fonts: Una variedad de tipografías https:// is.gd/36jHiY #disenografico #disenoweb #googlefonts pic.twitter.com/5AosZcUVcJ;;#Google #disenografico #disenoweb #googlefonts
0;0;como se matar sem ser percebida e sem ferir seus familiares e aqueles que supostamente gostam de vc google search;;
0;2;Busca en google el nombre de los 23 estados, luego buscas en cada uno protestas , represión, escasez, salud. Encontrarás miles de pruebas.;;
0;0;King of dark fantasy. Summon today. App Store: http:// bit.ly/AzhyKP Google Play: http:// bit.ly/NtcNTs #DarkSummoner;;#DarkSummoner
1;2;Thanks, google . pic.twitter.com/xnZo8CSea5;;
0;0;Paragraphs and chapter books -> long stairway - Google Search https://www. google.com/search?q=stair way+landing&client=safari&hl=en-us&prmd=ivn&source=lnms&tbm=isch&sa=X&ved=0ahUKEwi5ofqc8afUAhVP92MKHXuJBBcQ_AUICSgB&biw=375&bih=559#hl=en-us&tbm=isch&q=long+stairway …;;#hl
0;0;Apple HomePod: Una bocina con Siri que llegará en diciembre para retar a Amazon y Google … http:// cnet.co/2rMPbXB;;
0;0;Apple Photos va por Google con un montón de trucos nuevos … http:// cnet.co/2sL3LfC;;
0;0;手持ちの2つのgoogleアカウントについて同時刻に同じ場所から「他のユーザーがあなたのパスワードを使用しました」らしいんだが，これって本当に不正アクセスされかけたのかな．一応通知メールは本物みたいだけど;;
0;0;No, lol. When I hit translate its all jumbled up... can't trust the google translate unfortunately.;;
0;0;Ayo Download Aplikasi DMS 102.7 FM Ambon di Google Play https:// play.google.com/store/apps/det ails?id=com.nobexinc.wls_76155036.rc … *8hE;;
0;0;If I google that I get a motion picture. Who are They ? https:// twitter.com/lkusa/status/8 71875326380359682 …;;
0;0;That's a setting you can turn off. Last update or so that setting was to as default thru a update. Google to turn it off, it's easy;;
1;0;#sales 2 Powerful Google Analytics Metrics That Can Improve Your Search Rankings http:// bit.ly/2siynpl #SEO #a … https:// twitter.com/ANDERSHJORT/st atus/871874298130173954 …;;#sales #SEO #a
0;1;lol I'm About To Google When https:// twitter.com/iamkenceited/s tatus/871875835296436224 …;;
0;0;ポータルサイトの運営ヽ(´▽｀)/ ・毎日1ページを追加する これを繰り返してサイトの情報量や更新頻度を増やし Google の検索順位を上げていきます;;
1;1;#GIS | Desarrollan el mapa de contaminación atmosférica calle a calle más detallado hecho a través de Google ... http:// fb.me/8VP9yycxy;;#GIS
0;0;The Ridiculous Bandwidth Costs of Amazon, Google and Microsoft Cloud Computing http:// ift.tt/2oXI5PZ #webdesign;;#webdesign
0;0;Apple unveils $349 HomePod smart speaker, competing with Amazon Echo and Google Home #WWDC17 #WWDC2017;;#WWDC17 #WWDC2017
1;2;Google it....bill Maher pedophile;;
0;0;Como lidar com a separação dos pais? google pesquisar;;
0;1;@Miauannyeong como não surtar sendo potterhead Google pesquisar;@Miauannyeong;
0;0;"used by some of the world’s most advanced organizations, incl Lockheed Martin, Google , NASA Ames, USRA, USC, and Los Alamos National Lab. https:// twitter.com/dwavesys/statu s/867826662796406784 …;;
0;0;@sapphicult i had to google paralipsis and pedantic pic.twitter.com/6iMKmjjz5W;@sapphicult;
0;4;Also worth noting: iOS currently has ~45% market share in the US, which leaves A LOT of phones w/out this capability. Your move Google;;
0;1;google acadêmico eu te amo;;
0;0;06/06 08:00 の Google 検索ワード 1:糸魚川 2:モニタリング 3:新幹線 4:成宮寛貴の友人A氏 5:成宮 友人 ブログ;;
0;1;I still wonder if Google got much out of starting the iOS/Android war. Seems like they’d be just as profitable in a Nokia/Apple landscape;;
0;0;Google patentiert Google Glass Apps werden 2014 zum Verkausstart verfügbar sein?;;
0;4;Google Fotos piensa que yo soy dos personas distintas.;;
0;0;Apple HomePod: Una bocina con Siri que llegará en diciembre para retar a Amazon y Google … http:// cnet.co/2rXTPCU;;
0;1;もしもの事を考えると怖いですよね、私も荷物重めになるタイプです Google 地図で見ましたが香港は島なんですね～、もうちょっと近いのかと思ってましたが台湾よりもっと先なんですね。あと島だと陸の真ん中よりは安心感ありますよね;;
0;0;Apple Photos va por Google con un montón de trucos nuevos … http:// cnet.co/2sxvWiA;;
0;1;So is my Google pixel. #teampixel #android #AMOLED;;#teampixel #android #AMOLED
0;0;getting easier to spin up stuff like that as google & co start to do cloud offerings for gpu compute, but def. still pricey;;
1;2;Free Google Play Gift Card | Hack Tool Download http:// hacktooldownload.com/free-google-pl ay-codes/ …;;
0;0;No google é foda mesmo. Principalmente homoparentais. Mas existe umas literaturas e documentários massa sobre.;;
0;0;http:// ift.tt/1DjxDiB : Google Data Studio Tutorial for Beginners & Novices http:// declic.link/google-data-st udio-tutorial … pic.twitter.com/jcksQg7jmf;;
0;0;Google warns against misusing links in syndication & large-scale article campaigns http:// selnd.com/2qwHa9I pic.twitter.com/EDEVBZmdLL;;
0;4;A day in google searches pic.twitter.com/kh1OO3KWNt;;
0;0;➔MASAKI YODA Release on Google play music -High- https:// play.google.com/store/music/al bum/MASAKI_YODA_%E4%BE%9D%E7%94%B0%E6%AD%A3%E6%A8%B9_High?id=Bcvu3yjwimoks2owjnltgdvg6ca&hl=ja … #μουσική #Ιαπωνία #πληροφορίες;;# # #
0;0;Please RT if you like!! #architecture #design #architects #interiordesign Google Doodle celebrates... http:// tinyurl.com/hjucaob;;#architecture #design #architects #interiordesign
0;0;Google Pixel XL International Giveaway @androidauth #giveaway https:// wn.nr/6qncSs;@androidauth;#giveaway
0;0;Google warns against misusing links in syndication & large-scale article campaigns http:// selnd.com/2qwHa9I;;
0;0;Read Throwing Rocks at the Google Bus | Category: Business & Economics http:// bit.ly/1YfQvZX;;
0;0;Pues api YouTube va bien solamente que la feed de Google que es la de YouTube es tan en la mierda;;
0;0;Google Pixel XL International Giveaway @androidauth #giveaway https:// wn.nr/U5Z9Km;@androidauth;#giveaway
0;0;Gostei de um vídeo @YouTube http:// youtu.be/Lyp_LYJPE2w?aEM HD - RESUMO DA ZUEIRA #55 - NARRADO PELO GOOGLE TRADUTOR;@YouTube;#55
0;0;Google 検索の仕組み&上位表示に必要な条件まとめ【SEO対策/アクセスアップ】 http:// money-pan.hatenadiary.com/entry/2016/04/ 02/084136 …;;
0;0;Apple HomePod vs. Amazon Echo vs. Google Home - CNET;;
0;1;Google Attribution: What search marketers need to know by @ginnymarvin http:// bit.ly/2sxvX68 pic.twitter.com/HaDTUQp5UM;@ginnymarvin;
0;0;Yeah I've not seen the UEBooms but I have heard them, they sound nice, so does the google home,;;
0;0;【ダークサマナー】ダークファンタジーの王道ゲーム！数多のモンスターと最強を目指せ！ AppStore： http:// bit.ly/P63JqN Google Play： http:// bit.ly/Nl1XT4 #DarkSummoner_jp;;#DarkSummoner_jp
0;1;UK Alexa Skills Jump 35 Percent in May, Google Actions Climb 31 Percent @voicebotai http:// voicebot.ai/2017/06/05/uk- alexa-skills-jump-35-percent-may-google-actions-climb-31-percent/ …;@voicebotai;
0;0;Be Careful Celebrating Google ’s New Ad Blocker. Here’s What’s Really Going On. http:// buff.ly/2sLh6o1;;
0;0;Dropbox se enche sozinho? kkk Google , se quer parar de sincronizar a parada diga, mas não venha com ficção não. Serviço de nuvem mercenário.;;
0;0;Google ’s Panda Update - Why The *Quality* Of The Backlink Is More I http://www. webmaster-success.com/google%e2%80%9 9s-panda-update-why-the-quality-of-the-backlink-is-more-important-than-ever/?utm_source=ReviveOldPost&utm_medium=social&utm_campaign=ReviveOldPost … #google #guestpost #linkbuilding #seo #traffic;;#google #guestpost #linkbuilding #seo #traffic
1;2;Google search: how to feel better about my art;;
0;0;Gostei de um vídeo @YouTube http:// youtu.be/Lyp_LYJPE2w?aEM HD - RESUMO DA ZUEIRA #55 - NARRADO PELO GOOGLE TRADUTOR;@YouTube;#55
0;0;It's funny to see an Ad company building an Ad blocker. Well done @Google #slowclap http://www. socialmediatoday.com/marketing/goog les-building-ad-blocker-chrome-big-step-towards-regulating-online-ad-content …;@Google;#slowclap
0;0;Stop Google Searching Shit Dewayne I'm Fed Up With These Windows 98 Clip Art Pics.;;
2;12;google : how to get over someone i was never with;;
0;1;CARALHO ACHEI A MÚSICA FAZENDO UMA PESQUISA RIDÍCULA NO GOOGLE COM UMA LETRA ERRADA EM PORTUGUÊS PRA MÚSICA EM INGLÊS KKKKKKKLLLLLLLLLLLKJJJ;;
0;0;@GCPAmericas News - Apple HomePod: Una bocina con Siri que llegará en diciembre para retar a Amazon y Google http:// ow.ly/o2r450bXFS6;@GCPAmericas;
0;0;Apple HomePod: Una bocina con Siri que llegará en diciembre para retar a Amazon y Google … http:// j.mp/2sxsIfe;;
0;0;And Google DO delist illegal content...most of this stuff is on the dark web now anyway, which search engines can't even access;;
0;0;Apple Photos va por Google con un montón de trucos nuevos … http:// j.mp/2rY8MoE;;
6;3;Watch Google ’s Igor Markov explain how to avoid the AI apocalypse http:// ow.ly/Ecik50bXFNa;;
0;0;rittenhouse hardware - Google Search https://www. google.com/search?q=ritte nhouse+hardware&ie=UTF-8&oe=UTF-8&hl=en-us&client=safari&dlnr=1&sei=Ae01WaerE8KFgAaLwIL4Bw …;;
0;2;Mia and I are the kind of roommates that invite each other to hang out over google calendar and its totally normal;;
0;0;Google Pixel XL International Giveaway @androidauth #giveaway https:// wn.nr/dyw5tJ;@androidauth;#giveaway
0;0;Minha pesquisa no google : "musicas gostosinhas para ouvir apaixonado";;
0;0;joguei um endereço no google maps e ele me mandou uma rota com onibus trem van carroça bote e barco e etc;;
0;0;Also, Facebook, Google and other photo cloud storage vendors are looking for anything to cut storage space/costs.;;
0;0;Could try Google;;
1;2;Como utilizar el 100% de mi cerebro google voy a tener suerte;;
0;0;Como é o nome daquela música que fala ARUOUGONUUUUUU, @Google ?;@Google;
0;0;Parabéns google , quando se trata de meio ambiente vocês não se importa;;
0;0;PPC Audience Targeting From Google To Social http:// feedproxy.google.com/~r/PPCHero/~3/ ZvTYfi_Xj8I/ … #conversionrateoptimization;;#conversionrateoptimization
0;0;Hey Phil, can't read that small print, so it must be bad news. Anyone w google knows climate change is a tax;;
0;2;EWEEK: Google Increases Top Line Pay Outs for Android Bug Discoveries #cybersecurity http://www. eweek.com/security/googl e-boosts-top-bug-bounty-for-critical-android-flaws-to-200-000 … pic.twitter.com/kVrGEYhOtK;;#cybersecurity
0;0;Please RT if you like!! #architecture #design #architects #interiordesign Google Doodle celebrates... http:// tinyurl.com/hjucaob;;#architecture #design #architects #interiordesign
0;2;hot new album by @CCurrithers called Mixtape 1 available on itunes http:// itun.es/gb/NKG6jb and google play http:// goo.gl/Uw47bk;@CCurrithers;
0;1;I WENT A FOUND IT ON GOOGLE . Hell yeah;;
0;1;@_anahikari perdi o ao vivo vou vê no google play;@_anahikari;
0;0;最近、 Google の画面がおもしろい。;;
0;1;Google search: what to do with your free time when you cut everyone in your life off;;
0;0;Help me Google;;
0;1;Google Adwords is a surprisingly confusing tool to use.;;
0;0;#HomePod , el altavoz inteligente de #Apple para competir con #Google y #Amazon #WWDC17 https:// goo.gl/VStUe2;;#HomePod #Apple #Google #Amazon #WWDC17
0;0;New post on my blog: Google Wages War Against Annoying Ads http:// ift.tt/2rN3GL2;;
0;0;There are many... just Google .;;
0;0;Google ドライブのUriというか外部アプリのproviderから取得したUri引き回してるとどこかの時点でpermissionエラーになるなあ。とりあえずキャッシュディレクトリにコピーして回避する;;
1;6;'Fuck you handsome man, fuck you' me too google , me too https:// twitter.com/googlekpopfan/ status/870318158426648576 …;;
0;0;@Helen52776413 I'm above Nuuk right now. And the weather is... google it yourself, I'm grumpy about dying in 2017.;@Helen52776413;
0;3;Just told daughter, 15, that "data" is plural. "No it's not! So then what's the singular?" "Datum." "No way." Checks Google . "Fake news!";;
0;1;i will #onpage #SEO any Website https:// goo.gl/JV8JLr #offpage #SearchEngineOptimization #seotips #Google #yousufseo #web #SERP #traffic;;#onpage #SEO #offpage #SearchEngineOptimization #seotips #Google #yousufseo #web #SERP #traffic
0;0;公式アプリ初めました（＾∇＾） app store、 Google playストアで フリーダム イオン で検索して下さい（＾∇＾） iOS用 ↓ http:// bit.ly/2m9lMEY;;
0;2;Google a real one pic.twitter.com/L6Yt7Xk822;;
0;0;United Onslaught is on! Get Divine Evolvable Rank S! App Store: http:// bit.ly/AzhyKP Google Play: http:// bit.ly/NtcNTs #DarkSummoner;;#DarkSummoner
0;0;Google is.not focused on money, they want to give users the best search results poss ble. ( Google Webmasters);;
0;0;La primera partida la gane yo, la segunda usaste Google no me jodas zynthia;;
2;3;Vai tomar no cu, Google ! De que adianta uma aba "vídeos" se a página principal das buscas é só vídeo do YouTube e nada mais?;;
0;0;Mas ya é sempre aquele mambo escrever nome dele no google e aparecer mm noticia dele shee;;
0;0;Deontae Dixon on Twitter: "deontae_dixon_interview (1).mp3 - Google Drive http:// crwd.fr/2sHSwo4 ebook available May 25th" https://twitter pic.twitter.com/FyigFoVftZ;;
0;0;How to Add Google Drive to Windows Send To menu http:// buff.ly/1zvFtIx #Google #googledrive #windows #drive #howto #cloudcomputing;;#Google #googledrive #windows #drive #howto #cloudcomputing
0;2;@andres___martin largá las redes y dame comida. Atentamente, Google the cat. @viajefm pic.twitter.com/bzwyL1hcKe;@andres___martin @viajefm;
0;0;Deontae Dixon on Twitter: "deontae_dixon_interview (1).mp3 - Google Drive http:// crwd.fr/2sHYJk7 ebook available May 25th" https://twitter pic.twitter.com/epJqRPVB7U;;
0;4;Oh man! Google maps with MS paint annotations. That guy was really going places.;;
0;1;What's the Meta? Find out all you need to know here.. #SEO #marketing #Google http:// bit.ly/metadestw pic.twitter.com/pkZWkw3hTy;;#SEO #marketing #Google
1;3;non- google -able gun stuff. double top secret gun stuff.;;
0;0;Estos son los smartphones Android más seguros según Google http:// ow.ly/LdcS30ckime;;
0;0;Estos son los smartphones Android más seguros según Google http:// ow.ly/LdcS30ckime;;
0;0;The Ridiculous Bandwidth Costs of Amazon, Google and Microsoft Cloud Computing https://www. arador.com/ridiculous-ban dwidth-costs-amazon-google-microsoft/ …;;
0;0;https:// goo.gl/6MqXYH @eBay @youtube @Facebook @cnn @BBCBreaking @google @BBCWorld @twitter @cnnbrk @nytimes @globaltimesnews @instagram pic.twitter.com/CtN51DzOo4;@eBay @youtube @Facebook @cnn @BBCBreaking @google @BBCWorld @twitter @cnnbrk @nytimes @globaltimesnews @instagram;
0;0;#BOOK -Imagínate si #Dios tuviese un celular- #Spanish Edition #amazon #barnesandnoble #google #ebay pic.twitter.com/Oksq7lSCnF;;#BOOK #Dios #Spanish #amazon #barnesandnoble #google #ebay
0;2;What is a Google My Business listing and do I need one? http:// buff.ly/2qwHz85 via @StayListed #localseo #smallbusinessmarketing pic.twitter.com/CEhTf37QvO;@StayListed;#localseo #smallbusinessmarketing
0;0;How Google is gearing up to destroy shitty ads in Chrome http:// buff.ly/2swcpzj pic.twitter.com/ursg3UOm77;;
0;0;Get a sneak peak and preview my Album, Search Me. Itunes, Google Play, Amazon!!!!! #shinepalindrome pic.twitter.com/ptNzabw6Fq;;#shinepalindrome
7;7;Google Chrome, is that an ad blocker or are you just happy to see me? http:// onvb.co/ZP4mVbP pic.twitter.com/FTnhDpPeoU;;
0;0;Google , Inc: Save the Nik Collection! - Sign the Petition! https://www. change.org/p/google-inc-s ave-the-nik-collection?recruiter=729559022&utm_source=share_petition&utm_medium=twitter&utm_campaign=share_petition … via @Change;@Change;
0;0;Apple finally unveiled its Siri-powered version of Google Home and Amazon Echo — here's everything you need to know http:// bit.ly/2qZs9cc;;
0;0;These 40 photos will convince you to ##travel to Vancouver, BC, Canada….: google _ad_client… https:// goo.gl/fb/fCpi4O;;# #travel
0;0;SEO For Dummies: How To Put Google Analytics Code In YouTube http:// rviv.ly/7jVtU;;
2;2;ICYMI - CareerOneStop has a free #app in Google Play! #JobSearch http:// ow.ly/Rmddm;;#app #JobSearch
0;17;Are you a Loli? — google ,,, how do i block ppl on curious cat? https:// curiouscat.me/PapaCone/post/ 159363489?t=1496706304 …;;
0;0;PSA: Having problems with your Google Home? You’re not alone http:// fb.me/8zci2iUcO;;
0;1;Marketing Day: Google ad-blocking news, LinkedIn’s Matched Audiences & more http:// buff.ly/2s2vj3j http:// buff.ly/2s2EVeo #marketing vi…;;#marketing
0;2;pic.twitter.com/VkIVULqrFG Multilanguages Google news full rss http:// fullrsspro.com #software #ArticleCreator | Top 6 WordPress Plugins for…;;#software #ArticleCreator
0;0;Google won't remove hate preacher rants as they don't break the rules #NoHateSpeech http:// dailym.ai/2rN8kbO;;#NoHateSpeech
0;0;stairway landing - Google Search https://www. google.com/search?q=stair way+landing&ie=UTF-8&oe=UTF-8&hl=en-us&client=safari …;;
0;0;Trending Today: Google Docs - https:// mailv2.com/en/trending/Go ogle_Docs.html … - Join the discussion.;;
0;1;Museu Imperial - Google Arts & Culture http:// fb.me/wvVwmubZ;;
6;11;DEAL: Google Home is just $109 right now. #deals http:// drd.life/2rCWkYz;;#deals
0;0;Gilded hens from an Elizabethan Royalty dinner I did at Gulf Wars….: google _ad_client = "ca… https:// goo.gl/fb/puECJm;;
0;0;Google and UN create 360-degree tour of Syria's destruction https:// lnkd.in/gM7rSCX;;
0;0;“See Inside” with Google Virtual Tour http:// pinterest.com/pin/1987917710 34314713/ …;;
0;0;Necesito ayuda con mis descargas de google crome https:// youtu.be/Shgjvtyd1Jc vía @YouTube;@YouTube;
0;0;ウチは Google ドライブに自撮りが同期されてて会社で誤爆しかけました。;;
1;0;Google Penguin actúa todo el tiempo: ya es parte del algoritmo principal https:// luciaroldan.com/google-penguin -actua-tiempo-ya-parte-del-algoritmo-principal/?utm_source=ReviveOldPost&utm_medium=social&utm_campaign=ReviveOldPost … #seo;;#seo
0;0;Cambiare le password all'una di notte perché ti arriva una segnalazione da Google di un pirla che è entrato da Bogotà: fatto! 'Notte;;
0;0;Google Assistant keeps hearing "penis" whenever I say vaguely similar words...like "pizza".;;
0;0;quando vc ja jogou tanto jogo da velha na vida que ganha do google d boas pic.twitter.com/O8ZlOliJpZ;;
0;1;Vcs dão para ser a nova voz do GOOGLE ! #ViagemNoMixTudo;;#ViagemNoMixTudo
0;0;اذا كان البعض جاهل عن تاريخ عمان السياسي ، أسأل العم google وهو بيعلمك;;
0;0;Segundo o google é tipo remover as camadas superficiais da pele com produtos químicos etc;;
222;242;Esperamos que para mañana todos ya tengan lista su cuenta de @Spotify y que compren el single en iTunes/ Google Play.;@Spotify;
1;0;Google won't remove hate preacher rants as they don't break the rules http:// dailym.ai/2rN8kbO via @MailOnline;@MailOnline;
0;1;+ ha sido el viejo truco de buscarlas en Google en plan manual. Pero no sé al 100% si de verdad están ahí;;
0;0;WWDC17は、やっぱり驚きはなかった。 後追いの製品はAppleには求めていない。 Google に数歩遅れ、Amazonにも遅れだした感。 ボクが欲しくて仕方ないものを発表してくれるのを待っています。過去に何度もあったような・・ #WWDC17;;#WWDC17
0;0;"Amazon-Apple TV deal shows tough road to cooperation for tech rivals - Reuters" via Amazon - Google News http:// ift.tt/2saMwHO;;
0;1;I think it's meant to be read in Russian with google translate;;
0;0;Learn how Google is using Street View cars to monitor pollution https:// environment.google/projects/airvi ew/ …;;
0;0;International homepage http:// ift.tt/2sxm74i Google , Apple, Microsoft, Amazon and Facebook take top five spots … https://www. ft.com /;;
0;0;Volvi gente, ah re que estoy desde google gg ORGULLO ES VERTE BRILLAR NACHO;;
0;0;Good domain possibility?: http://www. FEDEX.com ?? Its trending on google ...;;
0;0;look up 'tiny guy who screams a lot' on Google you will not be disappointed;;
0;0;I'd rather google some relationship advice before I ask anyone my age real shit. YouTube them mfs.;;
0;0;I need a “disable Google doodle” feature so when I’m making screenshots, people can see the regular Google logo #p … http:// brevardcountymarketing.blogspot.com/2017/06/i-need -disable-google-doodle-feature-so.html …;;#p
0;0;It's gone unfortunately, I was on the phone to google for an hour this morning. The link they sent me just created another account :(;;
0;0;@Android format recovery lock linking to my Google account is the biggest pain in the ass. Selling a used phone. No heads up or warning.;@Android;
0;0;Apple, Orlando shooting, Google Docs, LinkedIn, HomePod, ...;;
0;4;i want to google ARMS characters without seeing their butts!!;;
0;2;マイナーなことを調べようとすると非常に検索が難しいし、数ページ比較して正しい回答を探したりしないといけない。基礎があればもっと早くできると思う。/「知識を手に入れるための知識」がない人にとって、 Google 検索はあまりにも難しい。 http:// blog.tinect.jp/?p=40340;;
0;0;散々お世話になってきたgo-lang-pluginだけど、これでもうお役御免だな。 Google Go language IDE built using the IntelliJ Platform https:// github.com/go-lang-plugin -org/go-lang-idea-plugin …;;
0;0;Esa frase está en google hermana jajajajajajajajajaja fracasada;;
0;0;口で説明するのが難しかったので google 先生に頼りました pic.twitter.com/P4BrdfMWn1;;
0;1;Pando: Eric Schmidt publicly defends Jared Kushner. Next day, Trump shutting DoL division investigating Google https:// pando.com/2017/06/01/eri c-schmidt-publicly-defends-jared-kushner-next-day-trump-shuts-down-dol-division-investigating-google/ …;;
0;0;Apple unveils HomePod speaker to compete with Amazon Echo, Google Home https:// finance.yahoo.com/news/apple-unv eils-homepod-speaker-compete-amazon-echo-google-home-191721041.html?soc_src=social-sh&soc_trk=tw … via @YahooFinance;@YahooFinance;
0;1;New Google Ad Filter Frightens Publishers, Ad Tech PLayers http:// adage.com/article/digita l/google-ad-blocker-frightens-publishers/309252/ …;;
2;5;Google a few of the little ditties that 45 posted during 44's yrs in office. If there was a D after 45's name would ur response be the same?;;
0;0;"Android version distribution: Nougat now reaching the 10% mark" Every month Google releases updated Android dist… http:// ift.tt/2knbZa3;;
0;0;@iainlee YouTube host radical material, Youtube have been a google company for over a decade;@iainlee;
0;0;Apple Unveils HomePod Speaker, Taking on Amazon and Google https://www. bloomberg.com/news/articles/ 2017-06-05/apple-unveils-homepod-speaker-taking-on-amazon-and-google … via @technology;@technology;
0;0;Gostei de um vídeo do @YouTube http:// youtu.be/Lyp_LYJPE2w?a EM HD - RESUMO DA ZUEIRA #55 - NARRADO PELO GOOGLE TRADUTOR;@YouTube;#55
0;0;[ #content ] [ #socialmedia ] : 2 Powerful Google Analytics Metrics That Can Improve Your Search Rankings … pic.twitter.com/pEfTOKOqzu;;#content #socialmedia
0;0;“See Inside” with Google Virtual Tour https:// lnkd.in/bXg-jiB;;
