retweets;favorites;text;mentions;hashtags
1;2;乗り換えた iPhone 7 plusの空き容量は89GB。音楽をiTunes Matchにしているのと、写真を Google Photosにしたとで、音楽と写真がないとスカスカ。32GBでもいける。これくらいでないとバッックアップで死ねる。;;
0;1;I live in Japan so use Google Translate a lot. One of my faves was a menu containing the words "Nootburg Sauce" and "motherfucker".;;
0;0;Google Wages War Against Annoying Ads http:// ift.tt/2qVdG5G;;
0;0;you google ariana grande one love manchester concert..?;;
0;0;Oloko Google https:// twitter.com/gomesofcc/stat us/871876485606510593 …;;
0;0;Google Penguin 4.0 en la visibilidad online de tu negocio Es casi escalofriante pensar que Google sufr http:// rviv.ly/mZ9P8 #guias #seo;;#guias #seo
0;0;di google chrome ada plug-in yang gunanya ngeblock apapun tentang Chris Brown namanya "Chris Brownout" ppfftth. #OldNewsAnakKini;;#OldNewsAnakKini
0;0;King of dark fantasy. Summon today. App Store: http:// bit.ly/AzhyKP Google Play: http:// bit.ly/NtcNTs #DarkSummoner;;#DarkSummoner
3;12;Falar mal de mim é fácil, difícil é escrever Arnold Schwarzenegger sem pesquisar no Google .;;
0;0;THANKYOU. Google was NOT A HELP;;
0;0;Si no fuera por Google maps ya no estaría viva;;
0;0;Ternyata GOOGLE nggak mampu menemukan JODOH saya;;
0;0;Let me google this individual https:// twitter.com/theskinnybear/ status/871877440708251648 …;;
0;0;Instead of using Dr. Google just go to a GP's and get it properly tested. Many things are overmedicalised but this isn't one of them https:// twitter.com/livestrong/sta tus/871868023107399681 …;;
0;1;Not on page 1 of Google , you are not on Google . Find out how #onlinemarketing pro's do it! http:// mlsp.co/l42cv pic.twitter.com/Vy5iP73oU9;;#onlinemarketing
0;0;I want to say No, but Google Twitter is out there lol;;
0;0;Watch Google ’s Igor Markov explain how to avoid the AI apocalypse: An attack by artificial… https:// revolutionarytechnology.net/item/13310-wat ch-googles-igor-markov-explain-how-to-avoid-the-ai-apocalypse?utm_source=dlvr.it&utm_medium=twitter … #Business_Technology;;#Business_Technology
0;0;VentureBeat: Google Chrome, is that an ad blocker or are you just happy to see me? http:// onvb.co/ZP4mVbP pic.twitter.com/A4kyfBvv5e;;
0;0;#TechnologyNews : Apple has announced Homepod, a new voice-controlled speaker. The device will compete with Amazon's Alexa and Google Home.;;#TechnologyNews
0;0;過去記事：定額聴き放題ボカロアルバムまとめ【 Google Play Music編】（2016年7月更新） http:// buff.ly/2sISzjo;;
0;0;@Google consistently challenges the phrase "I can't"; My 2nd grader using voice typing(cant type yet) to write a story in @googledocs . TY! pic.twitter.com/6r3CWcIZzh;@Google @googledocs;
0;0;google;;
0;0;WWDC 2017: Apple presentó el HomePod, el rival de Amazon Echo y Google Home http:// a.mynews.ly/!gD.F75rx;;
0;0;http:// pintfy.com ⒍ Google ⒎ Qatar ⒏ FULL EP ⒐ #DutchMillUP ⒑ #NCT_체리밤_14일공개 2017/6/6 06:33 +07 #trndnl http:// bit.ly/2mE2NmV;;#DutchMillUP #NCT_ #trndnl
0;0;http:// bit.ly/view * Apple * Orlando shooting * Google Docs * LinkedIn * World Environment Day * Progressive * UPS * FEDEX * HomePod *…;;
0;0;Google Duo, la nueva aplicación que pretende reemplazar a Skype #Tecnología http://www. tecnovedosos.com/google-duo-app/;;#Tecnolog
0;3;I was trying to Google why aren't Asian Americans politically active and why aren't Asian Americans attractive came up 1st. Lmao who did dis;;
0;0;Google Maps can tell you how bad the pollution is in Oakland, block-by-block | TechCrunch - https:// techcrunch.com/2017/06/05/goo gle-maps-can-tell-you-how-bad-the-pollution-is-in-oakland-block-by-block/ …;;
0;0;[ダークサマナー]イベント「熾烈なる共同戦線」開催。GOD化可能新SモンスターをGETしよう AppStore： http:// bit.ly/P63JqN Google Play： http:// bit.ly/Nl1XT4 #DarkSummoner_jp;;#DarkSummoner_jp
0;0;Google Pixel XL International Giveaway! https:// wn.nr/qDVsmx;;
0;0;ニコニコの再生回数カウンターについて↓ http:// niconico-toolbox.blog.jp/archives/31661 16.html … らしいで だとしても、やり方次第では再生回数稼げるし信者とかTwitterに拡散とかコメントとか あとこのGoogle検索で拝啓って打つだけで1番上に出てくるしなんか凄いんじゃね？知らんけど pic.twitter.com/uNZZMVnJyA;;
0;0;The Ridiculous Bandwidth Costs of Amazon, Google and Microsoft Cloud Computing https://www. arador.com/ridiculous-ban dwidth-costs-amazon-google-microsoft/ … ( https:// news.ycombinator.com/item?id=144932 49 … );;
0;2;If you search 'askew' in Google search, the page will tilt slightly clockwise. (Try it now).;;
0;0;Click Fraud Google Adwords @SeeYourClicks : No title https:// plus.google.com/10992863776841 7499614/posts/GfnsCxZRYyT?utm_source=Sociallymap&utm_medium=Sociallymap&utm_campaign=Sociallymap …;@SeeYourClicks;
0;0;Adwords @SeeYourClicks : Facebook Ads vs. Google AdWords ============================ https:// plus.google.com/+DERMANISVASIL IS/posts/YeE22szUz9V?utm_source=Sociallymap&utm_medium=Sociallymap&utm_campaign=Sociallymap …;@SeeYourClicks;
0;0;Google Pixel XL International Giveaway @androidauth #giveaway https:// wn.nr/sMDWZs;@androidauth;#giveaway
0;7;My mom just called me from one floor up to ask how to log into Google drive;;
0;0;porque eu sinto que vou morrer google pesquisar https:// twitter.com/yg_blackpink/s tatus/871808375050338304 …;;
0;0;@adnanESPN You can be brilliant, and get a great job at Google . Not the same, nor as impressive as building your own company.;@adnanESPN;
0;0;Pages vs Google Sheets, FaceTime vs Skype:Whatsapp. iTunes vs Spotify/ Wynk/Saavn etc. https:// twitter.com/satviksehgal/s tatus/871876951148863488 …;;
0;0;【ダークサマナー】ダークファンタジーの王道ゲーム！数多のモンスターと最強を目指せ！ AppStore： http:// bit.ly/P63JqN Google Play： http:// bit.ly/Nl1XT4 #DarkSummoner_jp;;#DarkSummoner_jp
0;0;BUSCA EN GOOGLE LAS SIGUIENTES ASANAS DE YOGA Y HAZLAS TE JURO QUE AYUDAN A LOS SEGUNDOA DE HAVERLAS!! A mi siempre me sirven;;
0;0;Then you know where to start. If you know the model Google them tires. Or just Google bike pics till you figure out what you need.;;
0;3;rodrigo, no site de pesquisa no google o partido de Hitler é partido trabalhador alemao. O PT do Brasil.;;
0;0;google thank you for your support of the LGBTQ community. Happy… https://www. instagram.com/p/BU-h2RHlTwZe uqlqSqZyOobixKZJ8MRy1bz7sA0/ …;;
0;0;NP @NOAH_ID - cinta bukan dusta || Setelah Mobil, Google Ingin Buat Truk Tanpa Sopir #MorningRush #autoradio889fm;@NOAH_ID;#MorningRush #autoradio889fm
0;0;The Ridiculous Bandwidth Costs of Amazon, Google and Microsoft Cloud Computing http:// bit.ly/2qV0yxk Comments: http:// bit.ly/2qV2iqx;;
0;0;La barra de notificaciones del nougat en samsung es brutal asi es como se hace tomen nota #google #android para android stock;;#google #android
0;0;e o google ? GENTE TEM Q TER ALGUM LUGAR A VERSAO FULL;;
0;0;Is your name Google ? Cause you have everything I'm searching for;;
0;0;Gostei de um vídeo @YouTube http:// youtu.be/Lyp_LYJPE2w?aEM HD - RESUMO DA ZUEIRA #55 - NARRADO PELO GOOGLE TRADUTOR;@YouTube;#55
1;2;Why don't you just google it. I used to think peta was great till i found out they don't want us to have pets.;;
0;0;Airfarewatchdog and google flights can help find the cheapest ones;;
0;0;What to expect at Google I/O 2017 https:// goo.gl/cG2QO3;;
0;0;Like, did they even look at what Amazon and Google are charging?;;
2;1;Arizona State Retirement System Sells 800 Shares of CarMax, Inc (KMX) #Google Finance #KMX .US #All Finance #USDCAD https://www. dukascopy.com/refpro/in.php? aHR0cHM6Ly93d3cuZHVrYXNjb3B5LmNvbS9meHNwaWRlci9lbi80OTY3MDY2MjM0NDI3NDQ2Mzc4Lz91dG1fc291cmNlPXR3aXR0ZXImdXRtX21lZGl1bT1zb2NpYWwmdXRtX2NhbXBhaWduPWZ4c3BpZGVyJTIwdHdpdHRlciUyMHBvc3RpbmcKc3BwLXR3LVNwaWRFTg== …;;#Google #KMX #All #USDCAD
0;0;Google Pixel XL International Giveaway @androidauth #giveaway https:// wn.nr/zX7Vhg;@androidauth;#giveaway
0;3;Badreddine Ramtani, un Algérien chez Google : "L'e-commerce doit être le principal moteur du web algérien" http://www. huffpostmaghreb.com/2016/08/26/alg eren-google_n_11685854.html …;;
1;0;BDM - Programa 52: Culos / Google / Raw https:// ar.ivoox.com/es/19087776;;
0;1;Google testa Instant Tethering no Chrome OS http:// gdis.co/2rF1YcI pic.twitter.com/zN4OTdWfkt;;
1;3;Google analytics tells me that Chicago was my number one city today. Thank you. Followed by the Big Apple. And then Shanghai. Shanghai....;;
0;0;iosのカレンダーで登録したものを Google Calendarに表示はできないのか…;;
1;4;あと問い合わせ電話番号にたどり着くまでに Google を駆使したり、迷路のような経路をたどる必要があるのを見ると、「電話番号にたどり着けるネットリテラシーがある人」でふるいにかけてるのかなと思う;;
0;0;United Onslaught is on! Get Divine Evolvable Rank S! App Store: http:// bit.ly/AzhyKP Google Play: http:// bit.ly/NtcNTs #DarkSummoner;;#DarkSummoner
0;0;MIT Technology Review - Apple Is Countering Amazon and Google with a Siri-Enabled Speaker https://www. technologyreview.com/s/607977/apple -is-fighting-amazon-and-google-with-a-siri-enabled-speaker/ …;;
0;0;google maps corazon jajajajajaj;;
0;0;【ダークサマナー】ダークファンタジーの王道ゲーム！数多のモンスターと最強を目指せ！ AppStore： http:// bit.ly/P63JqN Google Play： http:// bit.ly/Nl1XT4 #DarkSummoner_jp;;#DarkSummoner_jp
0;0;Lmao words to big for me to even try and google it;;
0;0;Google 広告非表示の機能再開 - Y!ニュース #Yahooニュースアプリ https:// news.yahoo.co.jp/pickup/6242179;;#Yahoo
0;1;Literally Google it kassidy;;
0;2;なんか・・・ ランドの七夕グッズのページが崩れている・・・ シーのページは普通 因みにIE、 Google 、FireFoxの3つのブラウザ全てがこうだった・・・ これって私のPCだけ？ （6/6_08：51現在） pic.twitter.com/uWFkgZQPdE;;
0;0;Ecology at Google brings holistic design to our outdoor environments @google http://www. blog.google/topics/environ ment/ecology-google-brings-holistic-design-our-outdoor-environments/ …;@google;
0;0;Hoy Google me tiro este vídeo genial jajajaj https://www. instagram.com/p/BU-hx1ujnjd- rrXtDYvimA6hsYEXLvZ7TBOOa80/ …;;
1;1;Google Duo, la nueva aplicación que pretende reemplazar a Skype #Tecnología http://www. tecnovedosos.com/google-duo-app/;;#Tecnolog
0;1;@cutasterfee is geohell your term or is that used widely to mean something? My google results are all just you when I search it;@cutasterfee;
1;0;Use Google Analytics and social media to create actionable #marketing intelligence. http:// hubs.ly/H07DR1t0 #casestudy #growth pic.twitter.com/PilhFUoiXI;;#marketing #casestudy #growth
0;1;I never Google for news but as an end user if you want a paywall, you gotta expect some users and some search engines/bots to look elsewhere;;
0;0;No.. it's quite easy though.. first install and drivers .. google then follow the instructions. Let me know if you need help;;
0;1;os pregunto porque me fío más de ustedes que de google;;
1;8;Según Google tengo cáncer y/o zika;;
2;0;The Ridiculous Bandwidth Costs of Amazon, Google and Microsoft Cloud Computing https://www. arador.com/ridiculous-ban dwidth-costs-amazon-google-microsoft/ … via ycombinator;;
0;0;Google reigns supreme as world’s most valuable brand http:// dlvr.it/PK2Ny3 #marketing pic.twitter.com/L4nFqMDNDD;;#marketing
0;0;How to Delete a Google My Business Listing – A Common Question with a Complex Answer http:// hubs.ly/H07JfqM0 by @Moz pic.twitter.com/i50QCmGi22;@Moz;
0;0;Google testa Instant Tethering no Chrome OS http:// ift.tt/2sxxGIP;;
0;0;Apple HomePod vs. Amazon Echo vs. Google Home http:// dlvr.it/PK2P0J;;
0;0;Apple HomePod vs. Amazon Echo vs. Google Home http:// dlvr.it/PK2Nyy;;
0;0;Google 広告非表示の機能再開 | 2017/6/5(月) - Yahoo!ニュース https:// news.yahoo.co.jp/pickup/6242179 #Yahooニュース #Google #広告;;#Yahoo #Google #
0;0;Google Rehbere Kayıt, Google Seo Hizmeti - Vizyon 2017 http:// platinhaberler.com/ticaret/web-ta sarim/webstesi-tasarimilari/18212-google-rehbere-kayit.html …;;
0;0;【おすすめの日本語入力】 google 日本語入力をおすすめします。WindowIMEではなかなか変換できなかった単語がすぐに出てきます。無料というのも魅力的です。一度試してみる価値はあると思います。「 google 」→「日本語入力」と検索するとダウンロードのページが開きます。 pic.twitter.com/88w2o9Ag3p;;
0;0;WSJ Ends Google Users' Free Ride, Then Fades in Search Results https://www. bloomberg.com/news/articles/ 2017-06-05/wsj-ends-google-users-free-ride-then-fades-in-search-results … via @technology;@technology;
0;0;Google Rehbere Kayıt, Google Seo Hizmeti http:// platinhaberler.com/ticaret/web-ta sarim/webstesi-tasarimilari/18212-google-rehbere-kayit.html …;;
0;2;Oh Google , be more vague... (Or, perhaps this says something about Bellevue) pic.twitter.com/eMwI6uOHor;;
0;0;Tidak semua hal bisa dicari dg Google , misalnya sapi saya yang hilang.;;
0;2;Well, at least the S8 is on Nougat and has google assistant. Who by the way is going to remind me to check the potatoes in 10 mins :);;
0;0;Just did a Google search and I can confirm people have done an ice gemsona;;
0;0;Hey Mike, who's your Turkish translator? Just give us the name please and Don't tell me it's Google https:// twitter.com/mrubin1971/sta tus/871002194102931456 …;;
0;0;SEO myths: pa erank is a measure of the popularity of websites. ( Google Webmayters);;
0;0;Es un buscador de porno Es como Google pero para tocar la balalaica XDDDD;;
0;0;تذكير بالصلاة على النبي - Android Apps on Google Play http:// fb.me/1cp1dQIwa;;
0;0;I know I play hashtag games and do a lot of sarcasm (mood pending).Just thought maybe you were also. When I first found out, I had to Google;;
0;0;Google va intégrer un adblocker dans Chrome début 2018 - 100%Media by Offremedia http:// ift.tt/2rYbXgh #Google;;#Google
0;1;今月も Google Playに課金しなきゃ！ -￥980;;
0;0;you must have forgot I made it through college with google translate;;
4;1;interesting read - How the Trump-Russia Data Machine Games Google to Fool Americans https://www. pastemagazine.com/articles/2017/ 06/how-the-trump-russia-data-machine-games-google-to.html … via @pastemagazine;@pastemagazine;
0;0;Enter to #win a $20 Google Play or #iTunes Gift Card from Mama Smith's! #giveaway #mobilegaming http:// mamasmiths.com/2017/05/operat e-now-giftcard-giveaway.html …;;#win #iTunes #giveaway #mobilegaming
0;1;And yet, hard to argue with Google data...I heard a rumor that company hires smart people.;;
0;1;イライラする、その通りで、 Google はそういうモバイルページは検索順位を大幅に落とすと告知しているんですが、全然なくならない。広告付きアプリ内においては好き放題ですし。 少なくともChrome内では対策するよという話です。;;
0;0;Google pagará R$ 650 mil a quem conseguir hackear o Android - http:// goo.gl/alerts/PTc1e #GoogleAlerts;;#GoogleAlerts
0;0;（´-`）.｡oO（温泉成分分析表を領収書と勘違いしてまとめようとする Google フォト君…。 pic.twitter.com/ZMOX00bX26;;
0;0;Hi Jb what's up dude I love you so much and that is king Google;;
0;1;Siri sucks. Google Home wins this race. #HomePod https:// twitter.com/CNN/status/871 822069079580672 …;;#HomePod
10;34;Tim Cook tells me why he thinks you should buy Apple's HomePod over Amazon Echo, Google Home https:// bloom.bg/2qZhL46 pic.twitter.com/InIpSpUabp;;
1;1;We're now on Spotify, google play, itunes, and most others! #thehypotheticals #punkmusic #punkband #punk #band #music #nhmusic #spotify pic.twitter.com/6U48GQVyn3;;#thehypotheticals #punkmusic #punkband #punk #band #music #nhmusic #spotify
0;1;hoy ziro me hizo buscar algo en pornhub para traducir y la verdad que quién te conoce google traductor;;
0;0;Retweeted Poynter ( @Poynter ): #ICYMI WSJ ends Google users’ free ride, then fades in search results... http:// fb.me/72tije8mz;@Poynter;#ICYMI
0;0;Wall Street Journal’s Google traffic drops 44% after pulling out of First Click Free http:// selnd.com/2sLehDz @sengineland さんから;@sengineland;
0;3;now palin try's to make a buck from Google Adwords, Kathy is going to be ok;;
0;0;I liked a @YouTube video http:// youtu.be/Lyp_LYJPE2w?a EM HD - RESUMO DA ZUEIRA #55 - NARRADO PELO GOOGLE TRADUTOR;@YouTube;#55
0;0;United Onslaught is on! Get Divine Evolvable Rank S! App Store: http:// bit.ly/AzhyKP Google Play: http:// bit.ly/NtcNTs #DarkSummoner;;#DarkSummoner
0;0;Google to Allow ‘Brand Safety’ Monitoring by Outside Firms - WSJ https:// wayback.archive.org/web/2017060517 0926/https://www.wsj.com/articles/google-to-allow-brand-safety-monitoring-by-outside-firms-1491256676?mod=pls_whats_news_us_business_f … ➜ https:// wayback.archive.org/web/2017060523 5119/https://www.wsj.com/articles/google-to-allow-brand-safety-monitoring-by-outside-firms-1491256676?mod=pls_whats_news_us_business_f … pic.twitter.com/us8YzicQcx;;
0;0;Alguem paciente pra me explicar exatas google pesquisar;;
0;0;Absolutamente nada, Google es un chismoso;;
0;2;Discount on Google tests @MsKaleighAnne @CroninGr2 @iannazzi_rose @CarolineKepka http:// ow.ly/4p7W30clkB5;@MsKaleighAnne @CroninGr2 @iannazzi_rose @CarolineKepka;
0;0;Ningún google;;
0;0;【ダークサマナー】ダークファンタジーの王道ゲーム！数多のモンスターと最強を目指せ！ AppStore： http:// bit.ly/P63JqN Google Play： http:// bit.ly/Nl1XT4 #DarkSummoner_jp;;#DarkSummoner_jp
0;0;@inFocusDCPhoto PUNTO IMMOBILIARE | è anche su Google Plus ! | https:// plus.google.com/+Immobiliarepu nto/ … via https:// Statusbrew.com;@inFocusDCPhoto;
0;0;@bulavgqalaniz PUNTO IMMOBILIARE | è anche su Google Plus ! | https:// plus.google.com/+Immobiliarepu nto/ … via https:// Statusbrew.com;@bulavgqalaniz;
0;0;このところずっと Google ブックマークのサイトにアクセスすると、延々リダイレクトが続いていつまで経ってもブックマークが表示されないんだけど何これ。;;
0;0;King of dark fantasy. Summon today. App Store: http:// bit.ly/AzhyKP Google Play: http:// bit.ly/NtcNTs #DarkSummoner;;#DarkSummoner
0;0;Now playing SYS KING - SAVAGE dl the app google play & ios be apart of the movement;;
0;0;Just having Google Maps opened in a tab sucked all the bandwidth;;
0;0;Pq eu tenho ciúme da pessoa alheia google pesquisar;;
0;1;I'm about to Google "blooper reel, women riding sybian machine", because if it doesn't exist, it should. #trademark;;#trademark
0;0;http:// SNPX.com : Vuln Google Android Motorola Bootloader CVE201610277 Privilege Escalation Vulnerability http:// dlvr.it/PK2NLm;;
0;0;Different market segment. Lots of folks happy with "good enough" sound of Echo and Google Home.;;
0;0;これか。 / “毎朝体操 - Google Play の Android アプリ” http:// htn.to/jbAHqt;;
0;0;We're available on Google Play! https:// play.google.com/store/music/al bum/Mail_Holly_s_Junk_Divided_We_Fall?id=Bhmzdvoyca7yvltqwkvlnwvueiy …;;
0;0;Apple unveils “breakthrough home speaker” to rival Amazon and Google http:// ift.tt/2qZKHsH pic.twitter.com/3xYx4DTtyH;;
0;0;Me gustó un video de @YouTube http:// youtu.be/BtdZD4RuYTg?a Un día trabajando para GOOGLE MAPS! | Recorriendo zonas nuevas;@YouTube;
0;0;¿Cómo puedes evitar que Google Maps rastree tu ubicación? https:// goo.gl/73yRyg?btz8=23 51060805 …;;
0;0;Con estos sencillos trucos lograrás que Google Chrome vaya más rápido #tecnología http://www. tecnovedosos.com/sencillos-truc os-lograras-google-chrome/ …;;#tecnolog
0;0;You have heard of Google , right? One result of many: https://www. yelp.ca/search?cflt=im migrationlawyers&find_loc=Montr%C3%A9al%2C+QC%2C+Canada …;;
0;0;Apple announce their version of Amazon Echo/ Google Home https:// goo.gl/fb/p3gR72;;
0;0;【朗報】 あの Google が全世界の社員研修に導入した新スキルとは？ http:// prt.nu/0/Ferrari;;
0;1;OK people, this is NOT the first time #Google has been at $1k/share. It was over $1100 in 2014, before it split.;;#Google
0;0;#NowPlayingOnXIVFM Kaaris - Bambou #XIVFM Disponible sur App Store! & Google Play! http://www. xivfm.com;;#NowPlayingOnXIVFM #XIVFM
0;0;#Google ofrece hasta 200 mil dólares a quien pueda hackear Android :... http:// i.ven.bz/hag8;;#Google
0;0;Exclusive: Google launches AI investment platform via @axios https://www. axios.com/exclusive-goog le-launches-ai-investment-arm-2423046588.html?utm_source=twitter&utm_medium=twsocialshare&utm_campaign=organic …;@axios;
1;0;Go to Google Play and Download the App now https:// play.google.com/store/search?q =Plugmatch&hl=en … pic.twitter.com/iuD5zIUon3;;
0;0;Me gustó un video de @YouTube http:// youtu.be/V0jw5p8fDSg?a Google Earth DESCUBRE AREA 51 CHINA;@YouTube;
0;0;Untuk masalah hitungan pemakaian per-menit-nya, Google masih kalah dengan Facebook...;;
0;2;Good luck. You will do great!!;;
0;0;Google Pixel XL International Giveaway @androidauth #giveaway https:// wn.nr/R2hNSM;@androidauth;#giveaway
0;2;*immediately uploads screenshot to google drive so she never forgets*;;
0;0;Google Maps can tell you how bad the pollution is in Oakland, block-by-block https:// techcrunch.com/2017/06/05/goo gle-maps-can-tell-you-how-bad-the-pollution-is-in-oakland-block-by-block/ …;;
0;0;Dei 4-0 no google bem izi https:// twitter.com/MyBeyonceta/st atus/863439970786258946 …;;
0;0;アプリからじゃなくて、スマホやPCの Google からTwitterを開いてもらって、設定からアプリケーションを開いて連携先を削除すれば大丈夫だと思います!;;
0;0;【ダークサマナー】ダークファンタジーの王道ゲーム！数多のモンスターと最強を目指せ！ AppStore： http:// bit.ly/P63JqN Google Play： http:// bit.ly/Nl1XT4 #DarkSummoner_jp;;#DarkSummoner_jp
2;3;Amazon echoと、 google homeと、Homepod並べて喋ってみたいね。;;
0;1;I had to google Hillary Duff because she looks like a whole different person to me.;;
0;0;Google Pixel XL International Giveaway @androidauth #giveaway https:// wn.nr/QZ8zmz;@androidauth;#giveaway
0;0;How when you can google a word rather it being in the dictionary?;;
0;0;【無料情報】Googleページランク4以上の検索エンジン50選 http:// 5od.biz/48qCEFTU;;
0;0;How the Trump-Russia Data Machine Games Google to Fool Americans https://www. pastemagazine.com/articles/2017/ 06/how-the-trump-russia-data-machine-games-google-to.html … via @pastemagazine;@pastemagazine;
0;0;#USA #UK #Google - - What a pleasure! - FREE LEADS and ListBuilding! http:// bit.ly/2lvPjEH pic.twitter.com/H0AWJ6qXVT;;#USA #UK #Google
0;1;Compare Google Maps with Apple Maps or iCloud vs Google Drive. Apple Notes vs Evernote or Google Keep, You'll know what I am talking about. https:// twitter.com/satviksehgal/s tatus/871876637737926657 …;;
0;0;nailed it! "More diversity! Unbiased methods! Cater to MEEE!" "How?" " Google it shitlord! Not here to do unpaid emotional labor";;
0;0;From what I read/asked, echo doesn't support it, and with google home you need to buy a chrome cast audio which is about 30$;;
0;0;Apple HomePod vs. Amazon Echo vs. Google Home - CNET https:// goo.gl/fb/Q8yUjL;;
0;0;Patiently waiting for @MKBHD to drop all the videos going over the Apple and Google events;@MKBHD;
0;0;sisi gelap dari dirimu yg bikin dirimu menciptakan alter ego yg membuat itu jadi kepribadian lain. cek google , tau google kan lo;;
0;1;Mr. President ISSI have a life and grow is because the GOOGLE - FACEBOOK - TWEET have all support, finance and Follow;;
0;0;YouTube - Watch Videos, Music, and Live Streams by Google , Inc. https:// appsto.re/us/WxoBG.i;;
0;1;The Ridiculous Bandwidth Costs of Amazon, Google and Microsoft Cloud Computing #cloudcomputing https://www. arador.com/ridiculous-ban dwidth-costs-amazon-google-microsoft/ …;;#cloudcomputing
0;0;If only it wasn't 160$ more than Amazon echo and 220$ more than Google home https:// twitter.com/engadget/statu s/871875545717518337 …;;
0;0;Google Now Mapping Air Quality, Starting With Oakland http:// bit.ly/2ruVnmN pic.twitter.com/wfAEfFDRHY;;
0;0;It's more a high quality speaker w/ Siri thrown in than google home/ Alexa competitor;;
0;1;I had to Google it to figure it bouta tag you in all of our picks hahaha;;
0;2;[CTF] Save the date Google 's ctf challenge is coming. See the full description here.... http:// fb.me/Hxo1Wvb6;;
0;0;【ダークサマナー】ダークファンタジーの王道ゲーム！数多のモンスターと最強を目指せ！ AppStore： http:// bit.ly/P63JqN Google Play： http:// bit.ly/Nl1XT4 #DarkSummoner_jp;;#DarkSummoner_jp
0;0;Tech: The Ridiculous Bandwidth Costs of Amazon, Google and Microsoft Cloud Computing http:// ift.tt/2oXI5PZ;;
0;0;I liked a @YouTube video http:// youtu.be/mAbraWV5dGc?a Things You Should Never Google - Anime & Japan Edition (Warning)... http:// fb.me/66mc195al;@YouTube;
0;2;#Google updates #YouTube creator guidelines for ad-friendly #content http:// goo.gl/yx4CJm #Advertising #OnlineMarketing #contentmarketing;;#Google #YouTube #content #Advertising #OnlineMarketing #contentmarketing
0;0;thenameisaa: http:// bit.ly/OdooTrial 2 Powerful Google Analytics Metrics That Can Improve Your Search Rankings http:// bit.ly/2rJ3s8o #…;;#
0;2;don't believe everything on social media. "stories" may seem to come from a genuine news outlet. google to confirm authenticity.;;
