retweets;favorites;text;mentions;hashtags
0;0;#iPhone #Apps You can now ask Google Drive where you saved last month’s expense report: Google '... http:// 33g5v.tk #Android #App;;#iPhone #Apps #Android #App
0;0;#Facebook #Google - Learn how to work long past retirement or retrenchment http:// dld.bz/eRHUz pic.twitter.com/FcQ8Yf80d5;;#Facebook #Google
0;0;Lleno de virus google chrome, bienvenido nuevamente mozilla;;
0;0;Google провел исследование казахстанских пользователей Интернета http:// dlvr.it/MJMFB2;;
1;3;for most, it's doorway pages...that's what they are. An inefficient layer of traffic skimming. Full amp endpoint is Google .;;
0;0;Google провел исследование казахстанских пользователей Интернета http:// dlvr.it/MJMF8w;;
0;0;No need to stress, @Google Trips has organised everything for us already https:// play.google.com/store/apps/det ails?id=com.google.android.apps.travel.onthego&hl=en … pic.twitter.com/Ymlx0ZfWjE;@Google;
1;0;http:// tinyurl.com/zb4f38g Make Google forget about you #google #dataretention #datasecurity #security #datapolicy ... pic.twitter.com/BjRxxusR5w;;#google #dataretention #datasecurity #security #datapolicy
0;0;Google でメトロノームって検索したらメトロノーム出てきた（電車なのでボタン押していませんが…）;;
0;0;Adblock Plus backtracks on selling ads after Google pulls support - AdNews http:// dlvr.it/MJMF0s;;
0;0;Liked on YouTube: RESUMO DA ZUEIRA #45 - NARRADO PELO GOOGLE TRADUTOR http:// youtu.be/NbNnEYS8qJo;;#45
0;0;【ダークサマナー】ダークファンタジーの王道ゲーム！数多のモンスターと最強を目指せ！ AppStore： http:// bit.ly/P63JqN Google Play： http:// bit.ly/Nl1XT4 #DarkSummoner_jp;;#DarkSummoner_jp
0;0;Google 急上昇RK: 市川海老蔵, 好きな人がいること 最終回, アンジェリーナジョリー, 台風, 小林麻央, 台風情報, 浜崎あゆみ, ... 【PR】商品豊富ポイント増える！＠ハピタス https:// goo.gl/KsWJ6n;;
0;0;#macOSSierra made me realize how few #Apple features I use- I'm deep into @google and would jump ship to #Chromebook -but- can it run SPSS?;@google;#macOSSierra #Apple #Chromebook
0;0;With Hololens, Microsoft is learning from Google Glass's failure http://www. fastcompany.com/3063825/the-ho lolens-elevator-repair-and-the-future-of-work … by @ruthreader via @FastCompany;@ruthreader @FastCompany;
33;14;another Hospital we can afford in our Nation Building to prosperity. now @google @twitter @facebook @likedin @paypal & @amazon can pay up ! https:// twitter.com/CroweDM/status /778372471577640960 …;@google @twitter @facebook @likedin @paypal @amazon;
0;0;Rolling Sky: La tienda de aplicaciones móviles Google Play se está llenando de juegos altamente adictivos, di... http:// bit.ly/2cSrwKx;;
0;0;Just Google any interview with Lionel Shriver.;;
0;0;I added a video to a @YouTube playlist http:// youtu.be/VyoUhU_74rY?a How to Livesteram to YouTube with Google Hangouts on Air;@YouTube;
0;0;aquele momento q por curiosidade vc se pergunta por onde anda theo becker dai joga no google e a primeira noticia é um processo de agressão;;
0;0;@google speaks out about Supreme Court ruling to allow @FBI to hack any computer for no reason after their corrupt behavior to alter results;@google @FBI;
0;0;Mais se não usar o Google o que a gente usa ??!!;;
8;11;Substituímos a geografia pelo Google e a história pela. Globo;;
0;0;Ini Besaran Dana Pajak Gelap Google Sampai Facebook: Lebih Rp105 triliun dana diamankan dari pajak. http:// bit.ly/2cOA6xk;;
0;0;we need big utubers to get together and create a new site that isn't full of google shite;;
0;0;Ini Besaran Dana Pajak Gelap Google Sampai Facebook: Lebih Rp105 triliun dana diamankan dari pajak. http:// bit.ly/2cOA6xk;;
0;1;@Cincinnati_Vue Thanks for the follow! Follow us on Google Plus https:// plus.google.com/b/109704209821 443353383/+CincinnatusInsuranceLLCCincinnati …;@Cincinnati_Vue;
0;0;RT azimbrand https:// twitter.com/azimbrand/stat us/778373250397208576 … iMarketingBrand: Ad Extensions in Google AdWords http:// bit.ly/2df3jzH #m … https:// twitter.com/azimbrand/stat us/778373250397208576 …;;#m
0;0;RT SEOtipz https:// twitter.com/SEOtipz/status /778372287334449152 … Ad Extensions in Google AdWords http:// bit.ly/2df3jzH #marketingtips https:// twitter.com/SEOtipz/status /778372287334449152 …;;#marketingtips
0;0;RT EloyDix https:// twitter.com/EloyDix/status /778372283341508608 … Ad Extensions in Google AdWords http:// bit.ly/2df3jzH #marketingtips https:// twitter.com/EloyDix/status /778372283341508608 …;;#marketingtips
0;0;that is the only situation to use "OK Google " to take a picture;;
1;3;How strict are advertisers on porn? I had Google yell at me for Senran Kagura, stating: "You cannot have strategically covered nipples";;
0;0;frase do google;;
0;0;09/21 08:00 Google 検索数ランキング 1:市川海老蔵 2:好きな人がいること 最終回 3:アンジェリーナジョリー 4:台風 5:小林麻央;;
0;0;Maybe I'm late to the #gafe party but I love adding images to #googleforms questions with ease. A quick #Google search and I'm set!;;#gafe #googleforms #Google
0;0;The Intership was Google the movie;;
0;0;09/21 08:00 Google 検索数ランキング 1:市川海老蔵 2:好きな人がいること 最終回 3:アンジェリーナジョリー 4:台風 5:小林麻央;;
0;0;Can't believe Google /HTC thought those giant ass bezels would be okay in 2016.;;
0;1;Guys over at @evernote are moving to @google cloud. Seems that it's time to say Goodbye to Evernote... #productivity;@evernote @google;#productivity
0;0;King of dark fantasy. Summon today. App Store: http:// bit.ly/AzhyKP Google Play: http:// bit.ly/NtcNTs #DarkSummoner;;#DarkSummoner
0;0;mas é do google mesmo;;
0;0;Google 's new Trips app aims to be one-stop #travel shop http://www. marketingdive.com/news/googles-n ew-trips-app-aims-to-be-one-stop-travel-shop/426611/?utm_source=Sailthru&utm_medium=email&utm_campaign=Issue%3A+2016-09-20+Marketing+Dive+Newsletter+%5Bissue%3A7315%5D&utm_term=Marketing+Dive#.V-HKndT7i9I.twitter … via @marketingdive #marketing #advertising;@marketingdive;#travel # #marketing #advertising
0;0;Google 先生で「佐村河内 コラ」で検索したら出ましたよ！ pic.twitter.com/OXhgaxwRg6;;
0;0;Ini Besaran Dana Pajak Gelap Google Sampai Facebook http:// bit.ly/2cOA6xk;;
0;0;#Investment Apple's iPhone Is Good, No Bad?; Google 's New Devices; Adobe's Earnings Beat - Eye On Tech http:// bit.ly/2cOCYua;;#Investment
0;0;09/21 08:00 Google 検索数ランキング 1:市川海老蔵 2:好きな人がいること 最終回 3:アンジェリーナジョリー 4:台風 5:小林麻央;;
0;0;Google Maps Android ahora muestra un haz de luz azul para una mejor y más ... - http://www. andsoyoucode.xyz/google-maps-an droid-ahora-muestra-un-haz-de-luz-azul-para-una-mejor-y-mas-rapida-orientacion/ … pic.twitter.com/5DVBiFJDWp;;
0;0;An employee that can search through online search results and add leads to a google doc by chasericker http:// ift.tt/2df7KdI;;
0;0;You can now ask Google Drive where you saved last month’s expense report http://www. digitaltrends.com/web/google-dri ve-natural-language/ …;;
0;0;【ダークサマナー】ダークファンタジーの王道ゲーム！数多のモンスターと最強を目指せ！ AppStore： http:// bit.ly/P63JqN Google Play： http:// bit.ly/Nl1XT4 #DarkSummoner_jp;;#DarkSummoner_jp
1;0;#Google Drive search refined with natural language processing. Read more: http:// owler.us/abCdIB $ GOOG;;#Google
0;0;El neurocientífico español que enseña a meditar a los trabajadores de Google http:// fb.me/1kn0Pjxw9;;
0;0;Google Now ya no se llama así. http:// bit.ly/2cNWyGU #LoÚltimo http:// fb.me/1HW5gAbjZ;;#Lo
0;0;@ramcesII Totalmente equivocado Hoy Estamos a un #google de distancia !!;@ramcesII;#google
0;5;My mom just asked me how to get on Google ....;;
0;1;Sign in - Google Accounts p https:// accounts.google.com/SignOutOptions ?hl=en&continue=https://www.google.com/%3Fclient%3Dsafari%26channel%3Diphone_bm …;;
0;0;Terkait Pajak Google , Indonesia Harus Mencontoh Inggris http:// dlvr.it/MJMDr8;;
0;0;Google Is Grouping Keyword Volumes - What Does This Mean for SEO? - Moz https:// moz.com/blog/google-gr ouping-keyword-volumes-what-does-this-mean-for-seo?utm_content=bufferf802e&utm_medium=social&utm_source=twitter.com&utm_campaign=buffer …;;
0;0;punya bsr si google (German shepherd) bru 9 months smpai pinggang sa suda;;
0;0;Google Now ya no se llama así. http:// bit.ly/2cNWyGU #LoÚltimo;;#Lo
0;0;review app de google : http:// youtu.be/kNPcX7B54Kk?a a través de @YouTube;@YouTube;
0;0;http:// bit.ly/GoogleSupreme Ad Word Generator: How To Generate Profitable Google Adwords Ads In Less Than ... http:// bit.ly/2cSqEFS #google;;#google
0;0;http:// bit.ly/GoogleSupreme Magic Submitter: Watch how magic submitter pushes you to the top of Google sen... http:// bit.ly/2cHTT3L #google;;#google
0;0;Ad Word Generator: How To Generate Profitable Google Adwords Ads In Less Than 10 Seconds! http:// bit.ly/2cSqEFS;;
0;0;#Share Ini Besaran Dana Pajak Gelap Google Sampai Facebook: Lebih Rp105 triliun dana diamankan dari pajak. http:// bit.ly/2df51kC;;#Share
0;0;Pixel Launcher Sneak Peek Part 1: Google 's new circular launcher icons [APK Teardown] ~ visit; http:// ift.tt/XSRY8K;;
0;0;porra,não tem a resposta da prova de ética no google;;
2;7;Cuando buscas Mikha en google pic.twitter.com/HyFotS2OPk;;
0;0;Sobre a Bonnie, eu li varias reportagens no google , mas procura por site americano..;;
0;0;Google провел исследование казахстанских пользователей Интернета http:// dlvr.it/MJMDcg;;
0;0;Google провел исследование казахстанских пользователей Интернета http:// dlvr.it/MJMDb3;;
0;0;Ini Besaran Dana Pajak Gelap Google Sampai Facebook: Lebih Rp105 triliun dana diamankan dari pajak.;;
0;0;sim é uma boa, horrível precisar de icon logo ou até imagens e ir pegar no Google;;
0;0;Google abre su proyecto AMP a todos sus usuarios http:// dlvr.it/MJMDWd;;
0;1;#news Google провел исследование казахстанских пользователей Интернета #seo #сео #индекс;;#news #seo # #
0;0;INTERESADOS (AS) LLAMAR AL 990525041 Ubiquenos por GOOGLE MAPS: COMERCIAL DIMA ********PRECIO PROVEEDOR EN DIMA... http:// fb.me/437ka0zhD;;
0;0;Google abre su proyecto AMP a todos sus usuarios;;
0;0;The council is now on CM Weiner's non-binding "Right Tough" resolution that is backed by Comcast and AT&T, but opposed by Google Fiber.;;
0;0;Google abre su proyecto AMP a todos sus usuarios http:// dlvr.it/MJMDSQ;;
0;0;#EBC MPF processa Google por publicidade infantil ilegal no Youtube http:// dlvr.it/MJMDTK;;#EBC
0;0;@cnnhealth @cnnbrk A more informative, in-depth analysis of a vague article by CNN. Terrible reporting. Thank God for Google and Twitter. pic.twitter.com/pqzdc7rKJ4;@cnnhealth @cnnbrk;
0;1;O CARALHO, SO NO QUE EU VI NO GOOGLE JÁ FECHOU O BRIOCO https:// mobile.twitter.com/cabeyosoberana /status/778360630508126208?p=v …;;
0;6;WTF? Searching for Tailgate reference images from the comic on Google 's image search, and my photo shows up as a result. XD;;
0;0;Ini Besaran Dana Pajak Gelap Google Sampai Facebook http:// tinyurl.com/j6dqrxg;;
0;0;google trabaja en una mejor cámara para Android capaz de buscar lo que ve #Tecnología http://www. tecnovedosos.com/google-goggles -camara-android/ …;;#Tecnolog
1;4;Could #machinelearning help Google 's #cloud catch up to #AWS and #Azure ? | Network World http://www. networkworld.com/article/311842 0/could-machine-learning-help-googles-cloud-catch-up-to-aws-and-azure.html?utm_content=bufferee5e6&utm_medium=social&utm_source=twitter.com&utm_campaign=buffer …;;#machinelearning #cloud #AWS #Azure
0;0;Ini Besaran Dana Pajak Gelap Google Sampai Facebook http:// bit.ly/2cOB50l;;
0;0;yo busqué en google David Guetta y decía progressive techno glitch step, re ander;;
0;0;LGV32 に Google アプリ 6.5.26.21.arm64 いれたなう https:// goo.gl/w05nn #installNow;;#installNow
0;0;Oh yeah, remember Google Glass? https:// twitter.com/fastcompany/st atus/778379465558818817 …;;
0;1;Google #cute and #Aww and you will get this photo @tarongazoo https:// twitter.com/kjbar/status/7 78371758457892864 …;@tarongazoo;#cute #Aww
0;1;this is from google;;
6;6;100% Bellingcat. 'Strange' that the US government and Google would hype up/fund a guy who is sloppy, amateur & untrained in forensics;;
0;0;procurei aqui no google pra ver se eu acho pra comprar mas nadinha :(;;
0;0;20 de septiembre y aún no cambio mi linkedin, así como diablos me va contratar google ?;;
0;0;SearchCap: Google widget links, ads & SEO http:// bit.ly/2cnhAgt pic.twitter.com/Ec2Jvlaf0v;;
1;1;Inikah Duo Android Pixel, Pengganti Google Nexus?. http:// kom.ps/AFvdKx;;
0;0;Ini Besaran Dana Pajak Gelap Google Sampai Facebook http:// bit.ly/2df51kC;;
0;0;Google Drive on the web now supports natural language search and autocorrect http:// flip.it/IH9HF5;;
0;0;@Juli_M1 deja de sacar frases de google;@Juli_M1;
0;1;google why does my head pound whenever i stand up;;
0;0;こんにちは^^玉緒です。 導入したAMPが google で公開され始めたようです。 http:// goo.gl/wbz4zb #AMP導入 pic.twitter.com/a99GQu550i;;#AMP
0;0;BLOGOS話題の記事、 Google Adsense への連絡をするってのは良いね。;;
0;0;@schmittmmsmath do you know the class code for our class for google classroom??;@schmittmmsmath;
0;1;. @UJAfedNY hosts a talk on Social Media and elections with speakers from Twitter, Facebook, Google - insightful and timely #GoodTogether;@UJAfedNY;#GoodTogether
1;0;Want to cry, asks @CoryBooker ? Google " @sesamestreet and incarcerated parent." #BuzzFeedBrews #criminaljusticereform @BuzzFeed;@CoryBooker @sesamestreet @BuzzFeed;#BuzzFeedBrews #criminaljusticereform
0;0;Ini Besaran Dana Pajak Gelap Google Sampai Facebook http:// bit.ly/2df51kC;;
0;0;｢OK Google ｣の機能、今まで｢マイクに接続できません｣とか出てきて設定できなかったのに、昨日容量削減のために Google アプリの検索履歴とか全部消したら突然設定できるようになった(・・;);;
0;0;" Google Now desaparece en la última beta abriendo paso a Assistant" http://www. elandroidelibre.com/2016/09/google -now-desaparece-assistant.html/amp/ … #geek #feedly;;#geek #feedly
0;1;Small Business Tips: The Secret Formula Of A 13.11X ROI #Google AdWords Campaign http:// growthhackers.com/articles/the-s ecret-formula-of-a-13-11x-roi-google-adwords-campaign?utm_source=twitter&utm_medium=GrowthHackerSMB&utm_campaign=1271 … #GrowthI … pic.twitter.com/zk4FdBauLl;;#Google #GrowthI
0;0;Te recomiendo jugar #Apensar desde tu móvil.Disponible en App Store http:// icogr.com/18XJ4TU y en Google Play http:// icogr.com/1AdkmW1;;#Apensar
0;0;#Google le da permiso especial a #Samsung para usar ícono verde de batería en #Note7 https:// pisapapeles.net/google-le-da-p ermiso-especial-samsung-para-usar-icono-verde-de-bateria-en-note-7/ … vía @pisapapeles_net;@pisapapeles_net;#Google #Samsung #Note7
0;1;frase de google;;
0;0;Nao sou Google mais tudo que eu procuro está em você;;
0;0;Kalo google sama facebook jd diblokir, berarti youtube, blogger, WA, instagram juga ikut keblokir kah ? https:// twitter.com/Strategi_Bisni s/status/778374355239579649 …;;
0;0;É SERIO google pesquisar;;
0;0;MPF processa Google por publicidade infantil ilegal: Segundo o MPF, o canal da empresa no Youtube tem diverso... http:// abr.ai/2df6Yxc;;
0;0;#Google Trips show how Google 's suite of mobile services gets stronger by the day https://www. youtube.com/watch?v=ign2Gm VEflw …;;#Google
0;0;RT DNR_CREW: RT Frederimontanez: Buying amazon, google play or itunes gift cards. DM ME NightRTs TwitchSharer Rela… https:// twitter.com/DNR_CREW/statu s/778379713815339009 …;;
0;0;MPF processa Google por publicidade infantil ilegal: Segundo o MPF, o canal da empresa no Youtube tem diverso... http:// abr.ai/2df6Yxc;;
0;1;google playを間違えて google prayと書いてしまうのは奈々ファンの職業病;;
0;0;Google のサーバーはopteron;;
0;0;primeira e importantíssima coisa que a gente tem que aprender quando passa na universidade JAMAIS USAR ALGO DA WIKIPEDIA OU DO GOOGLE;;
0;1;当たりますように！ ★1,500円分のiTunesカード/ Google Playギフトカード★プレゼント♪応募は簡単!!こちらから⇒ http:// prtw.jp/?c=8244_68774 pic.twitter.com/HhbuwHgAyt;;
0;0;MPF processa Google por publicidade infantil ilegal: Segundo o MPF, o canal da empresa no Youtube tem diverso... http:// abr.ai/2df6Yxc;;
0;0;Ini Besaran Dana Pajak Gelap Google Sampai Facebook http:// bit.ly/2cOB50l (VIVAnews);;
0;0;MPF processa Google por publicidade infantil ilegal http:// abr.ai/2df7DyO;;
0;0;MPF processa Google por publicidade infantil ilegal http:// abr.ai/2df6iYM;;
0;0;MPF processa Google por publicidade infantil ilegal http:// abr.ai/2cODJmU #Marketing;;#Marketing
0;0;11件のコメント http:// b.hatena.ne.jp/entry/s/madeby .google.com/#tw?u=edechang … “Oct. 4 – Google ” http:// htn.to/cc3FCC;;#tw
0;0;MPF processa Google por publicidade infantil ilegal http:// fb.me/6mGQ5eHZ7;;
0;0;Gostei de um vídeo @YouTube de @narradordevideo http:// youtu.be/NbNnEYS8qJo?a RESUMO DA ZUEIRA #45 - NARRADO PELO GOOGLE TRADUTOR;@YouTube @narradordevideo;#45
0;0;#Marketing #News : MPF processa Google por publicidade infantil ilegal http:// abr.ai/2df6Yxc;;#Marketing #News
0;1;Interessante o comportamento quando existe a pressão do momento #mobile via Think with Google http:// snip.ly/f1xhe;;#mobile
2;0;http://www. youtube.com/watch?v=zKKF_v FshMM&sns=tw … via Ecrivez écrivez BonTuyau Tennis sur Google Et suivez uniquement La methode pour Gagner. #RT #LT #TL BonTuyau;;#RT #LT #TL
0;0;Just downnload the #TmobileTuesday app from the Apple App Store or the Google Play Store and receive cool gifts each and... 1/2;;#TmobileTuesday
0;0;MPF processa Google por publicidade infantil ilegal: Segundo o MPF, o canal da empresa no Youtube tem diverso... http:// abr.ai/2df7iMx;;
0;0;Come join me in an epic adventure. Invite ID: 1807038412 AppStore： http:// bit.ly/AzhyKP Google Play： http:// bit.ly/NtcNTs #DarkSummoner;;#DarkSummoner
0;0;MPF processa Google por publicidade infantil ilegal http:// abr.ai/2df6Yxc;;
0;0;MPF processa Google por publicidade infantil ilegal http:// abr.ai/2df6Yxc via @EXAME_marketing;@EXAME_marketing;
1;1;never heard of someone having a dream in a dream lol. Google it. Probably signs.;;
0;0;[ Exame Marketing ] MPF processa Google por publicidade infantil ilegal: Segundo o MPF, o canal da empresa no... http:// abr.ai/2df6Yxc;;
0;0;◈구글광고노출 ,010-2199-6409 광고전문,010-2199-6409대행,구글010-2199-6409대행,구글상위노출♬,저렴한광고비카톡id:google6409구글광고전문★;;
0;11;Realized I should probably seek help after looking at my recent google searches pic.twitter.com/kFqz1BIg3p;;
0;0;MPF processa Google por publicidade infantil ilegal http:// abr.ai/2df6Yxc;;
0;0;Google Developing Tools to Suppress Online Speech, Protect Elites' Feelings - Breitbart http://www. breitbart.com/tech/2016/09/1 9/google-wants-to-control-and-sanitize-the-internet-in-the-name-of-fighting-harassment/ … via @BreitbartNews;@BreitbartNews;
0;0;09/21 08:00 の Google 検索ワード 1:市川海老蔵 2:好きな人がいること 最終回 3:アンジェリーナジョリー 4:台風 5:小林麻央;;
0;0;SEJ Wrap-Up: Google Deindexes Billions of Websites | SEJ http:// bit.ly/2ckGd8G #Marketing pic.twitter.com/NThfDvMr3p;;#Marketing
0;0;MPF processa Google por publicidade infantil ilegal http:// abr.ai/2df6Yxc;;
0;0;MPF processa Google por publicidade infantil ilegal: Segundo o MPF, o canal da empresa no Youtube tem diverso... http:// abr.ai/2df6Yxc;;
0;0;#Notícia : MPF processa Google por publicidade infantil ilegal http:// abr.ai/2cOCPH0;;#Not
0;0;MPF processa Google por publicidade infantil ilegal: Segundo o MPF, o canal da empresa no Youtube tem diverso... http:// abr.ai/2df6iYM;;
0;0;Bubble Shooter - Android Apps on Google Play http:// fb.me/1vIEJN2Dw;;
0;1;that one is close but I did have to google doug mientkiewicz as well lol;;
0;0;MPF processa Google por publicidade infantil ilegal http:// tinyurl.com/hl9acx6;;
0;0;RT:DNR_CREW: RT Frederimontanez: Buying amazon, google play or itunes gift cards. DM ME NightRTs TwitchSharer Relay_RTs DNR_CREW twitchraid…;;
0;0;Ini Besaran Dana Pajak Gelap Google Sampai Facebook http:// bit.ly/2cOA6xk;;
0;0;Google Trips, la nouvelle application pour planifier ses voyages http:// freehealthnsurance.ml/4lY pic.twitter.com/zR02DxOEhM;;
0;1;hmmmm google it;;
0;0;Is it weird or outdated that I still want a Google Glass?;;
0;0;Microsoft, Google to Block Prenatal Gender Selection Ads in India http:// metropctechs.com/microsoft-goog le-to-block-prenatal-gender-selection-ads-in-india/ …;;
0;0;é do blog casal sem vergonha, só colocar no google;;
0;1;that is a very big person word and I had to google it. "Assemblage". Lol! So , yes and go #Royals;;#Royals
1;3;Really REALLY ?! MI AMIGA LE DIJO AL PROFE -PROFE SABE QUE ES YAOI?! EL PROFE DIJO QUD LO BUSCARÍA EN GOOGLE AHHH YYA VÁLIMOS CACA pic.twitter.com/NXVM2urKRY;;
0;0;It's awful and so is that iClone. Very disappointed with Google . Clearly they chasing margins. https:// twitter.com/DukeOfZamunda/ status/778379245965942784 …;;
0;0;hogans hero gifs - Google Search https://www. google.com/search?q=hogan s+hero+gifs&client=safari&channel=iphone_bm&prmd=ivsn&tbm=isch&tbo=u&source=univ&fir=U9H078SIJ5dFIM%253A%252CJSxQZGL7LOA6UM%252C_%253BlocjmJsmA4YsvM%253A%252CkOcmuAyOLAaX1M%252C_%253BfikV1sfubKvBuM%253A%252CAeZO6FUV8ynoMM%252C_%253B_WTUaC5jK6EtzM%253A%252CTWce0XgSRgNspM%252C_%253B0re9ef7xgGUQWM%253A%252Cm8fpAYIHzKQ9ZM%252C_%253BDh1jLDQL5nS-TM%253A%252CCPbx80X-0ZVsbM%252C_&usg=__t0T7hajK9S7NJqLfwIg1Dm6-x90%3D&sa=X&ved=0ahUKEwjY_oG_j5_PAhWGPB4KHUjnDZoQ7AkILg&biw=320&bih=529#imgrc=b2nWV7NbPQE2ZM%3A …;;#imgrc
0;0;Gostei de um vídeo @YouTube de @narradordevideo http:// youtu.be/NbNnEYS8qJo?a RESUMO DA ZUEIRA #45 - NARRADO PELO GOOGLE TRADUTOR;@YouTube @narradordevideo;#45
0;0;The Google Analytics Audit Checklist http:// madrogator.com/the-google-ana lytics-audit-checklist/ … pic.twitter.com/AnEUbg1PV9;;
0;0;#NowPlaying Point Seen Money Gone (Radio Edit) by Snoop Dogg f. Jeremih #DL Rudeboy Radio 808 App on Itunes or Google Play pic.twitter.com/G2e3cybNwz;;#NowPlaying #DL
0;1;I am on Google Drive trying to remember which Arrow Wodehouse books are still missing from my collection (only A Pelican at Blandings now!). https:// twitter.com/dylanhorrocks/ status/778371914225946625 …;;
0;1;Google präsentiert eine ziemlich komplizierte Reise-App http:// bit.ly/2d5wBQT pic.twitter.com/MLuF376r0N;;
0;0;You can watch this right now on @YouTube or Google Play for $4.99USD.;@YouTube;
0;3;I'm so indecisive that I had to google what I should eat for dinner;;
0;0;as vezes o google desativa por causa das configurações do navegador e blah;;
0;3;A Side-by-Side Comparison of AWS, Google Cloud and Azure https://www. sitepoint.com/a-side-by-side -comparison-of-aws-google-cloud-and-azure/ … via @sitepointdotcom;@sitepointdotcom;
0;1;SEO: Google Limits Keyword Data to Advertisers Only @practicalecomm @jillkocher http://www. practicalecommerce.com/articles/12738 1-SEO-Google-Limits-Keyword-Data-to-Advertisers-Only … #adwordskeywordplanner #seo;@practicalecomm @jillkocher;#adwordskeywordplanner #seo
0;0;Then don't make a claim. Google changed a lot, but not the burden of proof. https:// twitter.com/JohnRiversToo/ status/778379672245633024 …;;
0;0;検索エンジンの検索結果は、検索キーワードの出現頻度、キーワードの近接度、サイトの重要性によって導き出された適合順に準じて表示される。サイトの重要性の判断は、リンク数を重視する Google のPageRankが有名である。;;
0;0;THREE DAYS UNTIL #SEARCHING // Available on iTunes, Google Play, and Amazon / Streaming on Apple… https://www. instagram.com/p/BKmMGUnAbqd/;;#SEARCHING
0;0;I liked a @YouTube video from @jonkerlin http:// youtu.be/ki2H6CnKks4?a Do Monsters Google Autofill;@YouTube @jonkerlin;
0;0;where is #allo ?? how long should we wait for this app? #WinterIsComing;;#allo #WinterIsComing
0;0;Could This Mysterious Ad Be for Google 's New Pixel Phone? - Every weekday, we bring you the Ad Age/iSpot Hot Sp... http:// ow.ly/UlPR504GCXj;;
0;0;Ini Besaran Dana Pajak Gelap Google Sampai Facebook: Lebih Rp105 triliun dana diamankan dari pajak. http:// bit.ly/2cOB50l;;
0;1;NEVER go to Google when trying to figure out lil minor shit that may be wrong with you Google will tell yo ass u have HIV; now u gotta die.;;
0;0;Google Maps for Android now more precisely shows which direction you’re facing http:// bit.ly/2cmObD0;;
0;0;Today's google search was world of warcraft tattoos. Murlocs and alliance/horde symbols are popular.;;
0;1;procura no Google , teve ter alguma coisa;;
0;1;google it and u will know lol.;;
0;0;Google Judge, Jury & Lawmaker http:// bit.ly/2cbwkMk;;
0;0;" Google Play Books Now Analyzes Your Reading Habits and Recommends New Books" http:// buff.ly/2dfeb3h #technology #feedly;;#technology #feedly
0;0;@ErinBurnett Im sorry you had to interview @KellyannePolls , she lies so much. Its terrible. Refuses to google any vet grps that got his $;@ErinBurnett @KellyannePolls;
0;0;Google провел исследование казахстанских пользователей Интернета http:// goo.gl/fb/tH7naD #интернет #казахстан;;# #
