retweets;favorites;text;mentions;hashtags
0;0;Te regalo una idea – organiza eventos con Google Campus http:// bit.ly/2cHHtsG via @carlosbravo;@carlosbravo;
0;1;Google Trips plans your travel itinerary, utilizes Eulers bridge problem + other algorithms https:// research.googleblog.com/2016/09/the-28 0-year-old-algorithm-inside.html?m=1 …;;
0;0;#ElHumanoHablaDe Te regalo una idea – organiza eventos con Google Campus http:// bit.ly/2cHHtsG Por: @carlosbravo;@carlosbravo;#ElHumanoHablaDe
0;0;Te regalo una idea – organiza eventos con Google Campus: ¿Tienes un negocio y necesitas promocionarlo sin cos... http:// bit.ly/2cHHtsG;;
0;0;Te regalo una idea – organiza eventos con Google Campus http:// bit.ly/2cHHtsG;;
0;0;Te regalo una idea – organiza eventos con Google Campus: ¿Tienes un negocio y necesitas pr... http:// bit.ly/2cHHtsG via @Hikikomorides;@Hikikomorides;
0;2;Home just in time to join the @Seesaw webinar "Seesaw and Google Apps" #excitedtolearn;@Seesaw;#excitedtolearn
0;1;Finally up on Google Maps, but come see us in person, not just from outer space! Open House Oct 1st - check Facebook and Meetup! #Kitchener;;#Kitchener
0;0;#Branding : Te regalo una idea – organiza eventos con Google Campus http:// bit.ly/2cHHtsG;;#Branding
0;1;True Techie Tips: Columns in Google Doc!!! http:// truetechietips.blogspot.com/2016/09/column s-in-google-doc.html …;;
0;0;Te regalo una idea – organiza eventos con Google Campus http:// bit.ly/2cHHtsG vía @carlosbravo;@carlosbravo;
0;0;Two of Google ’s top self-driving engineers left to create Nuro.ai - AI Trends https:// lnkd.in/f42fyPU;;
0;0;El mercado de smartwatches hoy y en 2020: el mundo contra Apple y Google … http:// snip.ly/m1rjs pic.twitter.com/onXvKAtPdC;;
0;0;Te regalo una idea – organiza eventos con Google Campus http:// bit.ly/2cHHtsG via@carlosbravo;@carlosbravo;
0;0;esse Google está nos enganando;;
1;0;Google Has Plan to Save Thousands of Lives http:// dld.bz/eJMyw;;
0;0;RT AndroidPolice: Pixel Launcher Sneak Peek Part 1: Google 's new circular launcher icons [APK Teardown] … pic.twitter.com/Bx3K86w47g;;
0;0;Te regalo una idea – organiza eventos con Google Campus http:// bit.ly/2cHHtsG via @carlosbravo;@carlosbravo;
0;0;Lol these numbers are off @google https:// twitter.com/googlefacts/st atus/778315388866166785 …;@google;
0;0;"we can't have her on the panel, ppl will google her name and the 1st thing they see will be cat videos" LOL;;
0;3;Clients: Don't randomly email me asking what a major world tourist landmark looks like. I'm not your personal Google curator. K thx bai;;
0;0;Te regalo una idea – organiza eventos con Google Campus http:// bit.ly/2cHHtsG;;
0;0;#Google Now dies in favor of more pragmatic name in search app #beta : You may still call it… http:// goo.gl/fb/XkVGXi;;#Google #beta
0;0;Te regalo una idea – organiza eventos con Google Campus http:// bit.ly/2cHHtsG;;
0;0;@Therealkiss @Ruleyork @noreaga the king of Swaziland is called Mswati all you other dudes Google him y'all ain't balling I tell you...;@Therealkiss @Ruleyork @noreaga;
0;0;Te regalo una idea – organiza eventos con Google Campus http:// bit.ly/2cHHtsG via @carlosbravo;@carlosbravo;
0;0;Te regalo una idea – organiza eventos con Google Campus http:// bit.ly/2cHHtsG;;
0;0;Google Now dies in favor of more pragmatic name in search app beta #win #smartphone;;#win #smartphone
0;0;Google Now dies in favor of more pragmatic name in search app beta: You may still call it “ Google Now,... http:// bit.ly/2cSre6y;;
0;0;Te regalo una idea – organiza eventos con Google Campus http:// bit.ly/2cHHtsG;;
0;0;বুধবার ঢাকায় আসবে আফগানিস্তান দল - নয়া দিগন্ত, via সেরা খবর - Google News http:// ift.tt/2csvDQt http:// fb.me/2I1fci1Dr;;
0;0;【ダークサマナー】ダークファンタジーの王道ゲーム！数多のモンスターと最強を目指せ！ AppStore： http:// bit.ly/P63JqN Google Play： http:// bit.ly/Nl1XT4 #DarkSummoner_jp;;#DarkSummoner_jp
0;0;Androide Pasión: Google Duo le plantará cara a WhatsApp http://www. androidepasion.com/2016/09/google -duo-le-plantara-cara-whatsapp.html?spref=tw …;;
0;0;Google Now dies in favor of more pragmatic name in search app beta: You may still call... http:// bit.ly/2cSre6y #tech #technews;;#tech #technews
0;0;Te regalo una idea – organiza eventos con Google Campus: ¿Tienes un negocio y necesitas promo... http:// bit.ly/2cHHtsG via@carlosbravo;@carlosbravo;
0;0;Google helped me out. I baked it;;
0;0;Te regalo una idea – organiza eventos con Google Campus: ¿Tienes un negocio y necesitas promo... http:// bit.ly/2cHHtsG via@carlosbravo;@carlosbravo;
1;1;Google Now dies in favor of more pragmatic name in search app beta http:// bit.ly/2cSre6y #pocketnow;;#pocketnow
0;0;Tolak Bayar Pajak, Sikap Google Legal Tak Bermoral http:// bit.ly/2cSq3Uy #RLNews;;#RLNews
0;1;Google Duo, la nueva aplicación que pretende reemplazar a Skype #TecNovedosos http://www. tecnovedosos.com/google-duo-app/;;#TecNovedosos
0;0;Te regalo una idea – organiza eventos con Google Campus http:// bit.ly/2cHHtsG via@carlosbravo;@carlosbravo;
0;0;King of dark fantasy. Summon today. App Store: http:// bit.ly/AzhyKP Google Play: http:// bit.ly/NtcNTs #DarkSummoner;;#DarkSummoner
0;0;Te regalo una idea – organiza eventos con Google Campus http:// bit.ly/2cHHtsG;;
0;0;[En el Blog] Te regalo una idea – organiza eventos con Google Campus http:// bit.ly/2cHHtsG @marketingguerrilla;@marketingguerrilla;
0;0;私もです むしろ Google マップに頼ってもたまに道を間違える！ 子どものまま育ってしまっただけですけどね！ありがとうございます！;;
0;1;Te regalo una idea – organiza eventos con Google Campus http:// bit.ly/2cHHtsG via @carlosbravo;@carlosbravo;
0;0;Te regalo una idea – organiza eventos con Google Campus http:// bit.ly/2cHUKBu #socialmedia;;#socialmedia
0;0;Me explican por qué mi hermano se puso la foto de perfil de un perro y re que no tenemos perro tampoco de donde saco la pic de google no sé;;
0;0;Google Drive integra un par de herramientas de búsquedas y mejoras en Google docs http:// dlvr.it/MJMJ3R por @GeeksRoom;@GeeksRoom;
0;0;An employee that can search through online search results and add leads to a google doc by… http:// dlvr.it/MJMJ6N #creativejobs #jobs;;#creativejobs #jobs
0;0;Te regalo una idea – organiza eventos con Google Campus http:// bit.ly/2cHHtsG via @carlosbravo;@carlosbravo;
0;0;Google maps just took me on the most complicated route to target :( that was way more stressful than it needed to be;;
0;1;there's so much shit honestly Google be having all the answers https:// twitter.com/jenniferjay__/ status/778380503430762496 …;;
0;0;Google memang tidak bisa disalahkan. Sebab, pemerintah memang tidak akan bisa menarik pajak jika perwakilann... http:// bit.ly/2cSq3Uy;;
0;0;Te regalo una idea – organiza eventos con Google Campus http:// bit.ly/2cHHtsG Vía @carlobravo;@carlobravo;
0;0;Te regalo una idea – organiza eventos con Google Campus http:// bit.ly/2cHHtsG via @carlosbravo;@carlosbravo;
0;0;Did You check your #pageranking #today ? It should be ZERO! http:// Googlepagerank.nu #google #websupport #website #rank #page #Internet;;#pageranking #today #google #websupport #website #rank #page #Internet
0;0;Te regalo una idea – organiza eventos con Google Campus: ¿Tienes un negocio y necesitas ... http:// bit.ly/2cHHtsG marketingdeguerrilla;;
0;0;Te regalo una idea – organiza eventos con Google Campus: ¿Tienes un negocio y necesitas ... http:// bit.ly/2cHHtsG marketingdeguerrilla;;
0;0;Te regalo una idea – organiza eventos con Google Campus http:// bit.ly/2cHHtsG vía @2r0_consulting;@2r0_consulting;
0;1;Olhem ajudem. Estão a ver aqueles desenhos animados? Como é que se escreve? (não vão ao google );;
0;0;Popular on Google : * Angelina Jolie * Chris Pratt * Scream Queens * Skittles * Emma Watson * Gas Shortage Nc * macOS Sierra * Billy Gilman…;;
0;0;Te regalo una idea – organiza eventos con Google Campus: ¿Tienes un negocio y necesitas pro... http:// bit.ly/2cHHtsG vía @carlosbravo;@carlosbravo;
0;0;Te regalo una idea – organiza eventos con Google Campus http:// bit.ly/2cHHtsG via @carlosbravo;@carlosbravo;
0;0;Te regalo una idea – organiza eventos con Google Campus http:// bit.ly/2cHHtsG via @carlosbravo;@carlosbravo;
0;0;Tolak Bayar Pajak, Sikap Google Legal Tak Bermoral http:// bit.ly/2cHU7rU;;
0;0;Te regalo una idea – organiza eventos con Google Campus http:// bit.ly/2cHHtsG via @carlosbravo;@carlosbravo;
5;0;Google 's vision of a #driverless future just got a big boost from the government http://www. businessinsider.com/driverless-car -rules-help-google-2016-9 … @businessinsider #Google;@businessinsider;#driverless #Google
0;0;Te regalo una idea – organiza eventos con Google Campus http:// bit.ly/2cHHtsG;;
0;0;Google sends out invites for October 4 launch event, likely to announce 'Pixel' smartphone lineup http:// bit.ly/2cSsbfi #TechGiants;;#TechGiants
0;0;Te regalo una idea – organiza eventos con Google Campus http:// bit.ly/2cHHtsG;;
0;0;" Google : im siwan";;
0;21;Google how often we ask. You people consistently lump media together wrongly. Really annoying https:// twitter.com/riseup2000/sta tus/778379953263869952 …;;
0;0;Tolak Bayar Pajak, Sikap Google Legal Tak Bermoral: Google memang tidak bisa disalahkan. Sebab, pemerintah memang tidak akan bisa me...;;
0;0;Te regalo una idea – organiza eventos con Google Campus: ¿Tienes un negocio y necesitas promocionarlo sin cos... http:// bit.ly/2cSeY6a;;
0;0;Tolak Bayar Pajak, Sikap Google Legal Tak Bermoral: Google memang tidak bisa disalahkan. Sebab, pemerintah memang tidak akan bisa me...;;
0;0;Te regalo una idea – organiza eventos con Google Campus: ¿Tienes un negocio y necesitas promocionarlo sin cos... http:// bit.ly/2cHV9no;;
0;0;What is #Google #DataStudio and how can you use it? http:// mklnd.com/2cO9eNP pic.twitter.com/WhgiJeoRFk;;#Google #DataStudio
0;0;Is Google steering #Android towards Assistant?. Read more: http:// owler.us/abCdKc;;#Android
0;0;Adblock Plus backtracks on selling ads after #Google pulls support. Read more: http:// owler.us/abCdKk $ GOOG;;#Google
0;0;Te regalo una idea – organiza eventos con Google Campus: ¿Tienes un negocio y necesitas promocionarlo sin cos... http:// bit.ly/2cHHtsG;;
0;0;Te regalo una idea – organiza eventos con Google Campus http:// bit.ly/2cHHtsG vía @carlosbravo;@carlosbravo;
0;0;#Google downplays algorithm ranking update this week as "normal fluctuations" http:// buff.ly/2d7lIyq #SEO #search pic.twitter.com/YfLsP6cDVZ;;#Google #SEO #search
0;0;#google #カレンダー の #件名 #入力候補 が俺の中で話題沸騰中 要するに他人が入力した カレンダーの予定が 入力候補として表示される 何が言いたいのかというと 「せ」 とか入れてみろ これは酷い;;#google # # #
0;0;Tolak Bayar Pajak, Sikap Google Legal Tak Bermoral http:// bit.ly/2cSrAu0;;
0;0;How to Use Google Data Studio - http:// buff.ly/2cWNVZi;;
0;0;Gostei de um vídeo @YouTube http:// youtu.be/giM75clKXPc?aI nternet … grátis no transporte público, novidade no WhatsApp, evento do Google e;@YouTube;
0;0;this is why you copy pictures from google they look better pic.twitter.com/VYMHvfYP4R;;
0;0;my google searches are like 33% song lyrics, 33% wikipedia rabbit hole deep dives, and 33% trying to figure out what is considered normal;;
0;0;kind of hard to do that. Unless you’ve loaded to the cloud with something like google music.;;
0;0;Tolak Bayar Pajak, Sikap Google Legal Tak Bermoral http:// bit.ly/2cHU7rU;;
0;0;Conheça o Google Trips, novo app inteligente para planejar viagens http:// kedge.com.br/blog/conheca-o -google-trips-novo-app-inteligente-para-planejar-viagens/ … pic.twitter.com/a1FBpaqfwK;;
0;0;カビゴン出現 残り:503秒 午前 09:02:18まで https:// pmap.kuku.lu/#pushloc,35.18 0168570,136.913184479,143 … #ポケモンGO #名古屋 Google mapは↓ https://www. google.co.jp/maps/@35.18016 8570,136.913184479,21z …;@35;#pushloc # #
0;0;@fadiyaa27 Tolak Bayar Pajak, Sikap Google Legal Tak Bermoral http:// bit.ly/2cSq3Uy @lestari_wdynti;@fadiyaa27 @lestari_wdynti;
0;0;#scmbg Tolak Bayar Pajak, Sikap Google Legal Tak Bermoral: Google memang tidak bisa disalahkan. Sebab, pemeri... http:// bit.ly/2cSq3Uy;;#scmbg
0;0;09/21 08:00 の Google 検索ワード 1:市川海老蔵 2:好きな人がいること 最終回 3:アンジェリーナジョリー 4:台風 5:小林麻央 このツイートはマツトシ [ https:// drive.google.com/file/d/0B23ejP OdxLTNNWpnaV …;;
0;0;Google 's vision of a driverless future just got a big boost from the government: Google 's plan to get a fully... http:// bit.ly/2cSr0MN;;
0;0;7 questions we have about bombings in New York and New Jersey. http:// tiny.iavian.net/cfcd Download Drudge Report from Google Play Store.;;
0;0;Surya News: Tolak Bayar Pajak, Sikap Google Legal Tak Bermoral: Google memang tidak bisa disalahkan. Sebab, p... http:// bit.ly/2cHU7rU;;
0;0;Gostei de um vídeo @YouTube de @narradordevideo http:// youtu.be/NbNnEYS8qJo?a RESUMO DA ZUEIRA #45 - NARRADO PELO GOOGLE TRADUTOR;@YouTube @narradordevideo;#45
0;0;I liked a @YouTube video http:// youtu.be/2iWxrkGWqfA?a Comcast going cellular, Google teases possible Pixel phone (CNET Update);@YouTube;
0;0;【10/2まで】セブン-イレブンで音楽プレゼントキャンペーン実施中です。3000円以上購入＆チャージで Google Play Musicからお好きな1曲(250円以下が対象です)をプレゼント。10/2まで。 http:// gpc-check.com/sej-201609;;
0;0;Pixel Launcher Sneak Peek Part 1: Google 's new circular launcher icons [APK Teardown] http://www. androidpolice.com/2016/09/20/pix el-launcher-sneak-peek-part-1-googles-new-circular-launcher-icons-apk-teardown/ … … pic.twitter.com/kMT75c5CLg;;
0;0;Ia fazer uma montagem zoeira daí pesquisei lésbicas no Google só apareceu cenas sexuais Q horror Por isso ngm leva nosso amor a sério;;
0;0;Comcast going cellular, Google teases possible Pixel phone (CNET Update) https:// youtu.be/2iWxrkGWqfA via @YouTube;@YouTube;
0;0;Vou comprar um cartão de presente da google;;
0;0;Just posted a photo @Google NYC https://www. instagram.com/p/BKmM2mzB2M1/;@Google;
0;0;The mobile content consumption revolution is here: Google AMP and WordPress (part 2 of 3) https:// codeable.io/google-amp-wor dpress/ … vía @codeablehq #SEO;@codeablehq;#SEO
5;9;A friend wrote this sharing how to hold off google from tracking your data & inviting you to care http:// tinyurl.com/zgakakd #digped;;#digped
0;0;Introducing Google Trips: Ultimate Data Play - http://www. digitalbuzzblog.com/introducing-go ogle-trips-the-ultimate-data-play/ …;;
0;0;Google 先生まで… pic.twitter.com/mgXKuG8Ph0;;
0;0;Especialízate como Experto Google AdWords, Analytics, SEO y Community Manager. Info Aquí http:// ow.ly/ZnCH304ofkZ … http:// goo.gl/vxgGKI;;
0;0;procura no google "Memes Girls in the house" e salva lá sz;;
2;3;Google Drive Search Just Got a Lot Smarter http:// lifehacker.com/google-drive-s earch-just-got-a-lot-smarter-1786870522?utm_medium=sharefromsite&utm_source=Lifehacker_twitter … #gafe;;#gafe
0;0;Fui tentar comprar o álbum da Misbehaviour mas só aceita cartão no google play <\3;;
0;1;Hey Juan use google at least to check your facts !! At least pretend your smart https:// twitter.com/gojestr/status /778381023541399552 …;;
0;1;Ad Extensions in Google AdWords by @Jus_Wilson http:// b2c.news/eJqIFS via @B2Community pic.twitter.com/wVpZWbwDNp;@Jus_Wilson @B2Community;
0;0;Google #モンスタースーパーリーグ;;#
0;0;Google の「ページランク」の名称はラリーペイジのもじりって件、初めて知ったんだけど有名な話？;;
0;0;Google facebook twitter ESTAO ME ROUBANDO pergunta ai esse otario pq ao gostar dos negocios dele nao ligaram?;;
0;0;I liked a @YouTube video from @emsarcade http:// youtu.be/eiSschzwrEg?a HOT DATE WITH TOM HANKS | (Drunk) Google Feud;@YouTube @emsarcade;
0;1;Google ’s DeepMind Achieves Speech-Generation Breakthrough http:// bloom.bg/2cvf3i5 via @technology;@technology;
0;0;Gostei de um vídeo @YouTube de @cacursos1 http:// youtu.be/6GEcGLFB9ow?a Como remover conta Google de Qualquer Samsung Patch 1° De Agosto;@YouTube @cacursos1;
0;0;Mãe o Google não é médico;;
0;0;SearchCap: AMP live in Google , Bing partners with CBS & EU copyright http:// selnd.com/2cOEsVa;;
0;1;Yo: Son mitos, no se sabe si son verdad o mentira. Sobrina: Y buscalo en Google . JAJAJA es una sarpada.;;
0;0;Adicionei um vídeo a uma playlist @YouTube http:// youtu.be/Py5IGnL82_c?aW ordpress … SEO - How to Make Your Site Rank Higher in Google - by;@YouTube;
0;0;Adicionei um vídeo a uma playlist @YouTube http:// youtu.be/y_AAO7QfsiI?aS EO … For Beginners 2016 - How to Rank High In Google ?;@YouTube;
0;0;jajajaja son 20 episodios que se divide en dos partes y la primera sale en noviembre, google mi mejor amigo;;
0;0;Gostei de um vídeo @YouTube de @narradordevideo http:// youtu.be/NbNnEYS8qJo?a RESUMO DA ZUEIRA #45 - NARRADO PELO GOOGLE TRADUTOR;@YouTube @narradordevideo;#45
1;1;that's not what I meant google . pic.twitter.com/9VeJFAAygX;;
6;0;mbh google nya jg baru bangun kog #NginboxBersamaDedeLesti;;#NginboxBersamaDedeLesti
0;0;With Hololens, Microsoft is learning from Google Glass's failure: http:// buff.ly/2d2PUhK;;
0;0;Google ha publicado un vídeo de lo que podría ser su próximo 'smartphone' y que presentaría el 4 de http:// pinterest.com/pin/4547932623 54661076/ …;;
0;3;Me waiting for Next Ex Girlfriend to come out on Google Play @JonahMarais #PreorderNextExGf pic.twitter.com/cAoNsyAxzP;@JonahMarais;#PreorderNextExGf
0;0;Also Google also makes a folder in your drive for the assignment where all Ss assignments reside;;
0;0;had to google what that one meant... does that make me old?;;
0;0;"En icógnito Google no guarda nada de sus datos, ni historial ni cookies, así que si van a ver calatas pongan incógnito" Profe de MediosDig;;
0;0;Apple's iPhone Is Good, No Bad?; Google 's New Devices; Adobe's Earnings Beat - Eye On Tech http:// dlvr.it/MJMHpM #appleiphone;;#appleiphone
3;31;Los nuevos Google Pixel podrían ser más caros que los Nexus http:// buff.ly/2cE3a9F;;
0;0;Apple's iPhone Is Good, No Bad?; Google 's New Devices; Adobe's Earnings Beat - Eye On Tech http:// dlvr.it/MJMHkg #appleiphone;;#appleiphone
0;0;Bing #Ads vs Google #AdWords case study which offers the better value https:// goo.gl/kDj8tb;;#Ads #AdWords
0;0;RT @SEBHEUPDATE: Tolak Bayar Pajak, Sikap Google Legal Tak Bermoral http:// bit.ly/2cSq3Uy #SEBHEUPDATE;@SEBHEUPDATE;#SEBHEUPDATE
0;0;【ダークサマナー】ダークファンタジーの王道ゲーム！数多のモンスターと最強を目指せ！ AppStore： http:// bit.ly/P63JqN Google Play： http:// bit.ly/Nl1XT4 #DarkSummoner_jp;;#DarkSummoner_jp
0;0;O GOOGLE FINALMENTE VAI PADRONIZAR OS ÍCONES DO ANDROID :D mas num padrão horrível :/ https:// twitter.com/AndroidPolice/ status/778381276910751744 …;;
0;0;Blogger Announced to Remove all ability of non google accounts http:// timeandupdate.com/2015/12/blogge r-announced-to-remove-all-ability/ … #TimeandUpdate;;#TimeandUpdate
0;0;stop playing on social media your pic is plastered all over Google . Show some screenshots or shut up;;
0;0;Join me in #AppMahal ! Get it FREE on Google Play... http:// mahal.io/s?u=1m2ml1h75;;#AppMahal
0;0;nah. Paypal, Google wallet, square cash;;
0;0;"The 280-Year-Old Algorithm Inside Google Trips" http:// research.googleblog.com/2016/09/the-28 0-year-old-algorithm-inside.html …;;
0;0;Google To Update Their JavaScript Recommendations & Guidelines http:// dlvr.it/MJMHHS pic.twitter.com/uhWhY4QjFa;;
0;1;amo meu tema do google quero lamber pic.twitter.com/wPOfsAzjlx;;
0;0;And then feel a sense of superiority by always spewing out their characters frame data that they found on Youtube/ Google .;;
0;0;#Google Appears To Be Killing Off The ' Google Now' Brand. Read more: http:// owler.us/abCdJu $ GOOG;;#Google
0;0;Accesoria Ingeneria Informatica - Trabajo Freelance: Accesoriamente, Consulto ria, Sofware, Google Adsense en... http:// bit.ly/2cSs8zP;;
0;0;Music and Adventure abound in this weeks Google Play App and Game Deal of the Week http:// bit.ly/2cSrxyj;;
0;0;If you're saying sometking important but you can'z get you message across, it will be ignored. ( Google Webmasters);;
0;0;Books By Brian http://www. amazon.com/-/e/B007YN7YTQ Via @AlwaysInTao #Blog --> Google Fuchsia And Other RT http://www. alwaysintao.com/business/googl e-fuchsia-and-other-rtos/ … #business;@AlwaysInTao;#Blog #business
0;0;It is available in the App store & in Google Play http:// netNebraska.org/app . You can also watch the show at http:// netNebraska.org/bigredwrapup;;
0;0;３１話で長谷川に教えて貰ってつね子が親子丼を作ったと情報を受け、Googleさんで３１話を検索。 よし子が青柳にお菓子を貰いに行って夕飯食べれなかったのは覚えてる、星野と会ったのも覚えてる、本当は青柳が学費出しTELのにって憤ってたのも覚えてる。 でも、親子丼だったかは覚えてない;;
0;0;【ダークサマナー】ダークファンタジーの王道ゲーム！数多のモンスターと最強を目指せ！ AppStore： http:// bit.ly/P63JqN Google Play： http:// bit.ly/Nl1XT4 #DarkSummoner_jp;;#DarkSummoner_jp
0;0;Introducing Google Trips: The Ultimate Data Play http:// bit.ly/2cFIQVI;;
0;0;インストールしてみたが、やはり日本語でないと使い辛いですなぁ。。。。→グーグル、計画やチケット情報を一括で管理できる旅行アプリ「 Google Trips」をリリース http:// ascii.jp/elem/000/001/2 34/1234264/ …;;
0;0;GOOGLE NEWS FULL RSS FEED from any keyword http:// keywordtorss.fullcontentrss.com | Ángel María Villar #Google Analytics;;#Google
0;0;My 12 yr old neighbor just told me I'm like Cana from the fairytale. Had to Google it. Apparently I'm the drinker. Great;;
0;2;Excited to learn more about SEO with @billsebald presentation "how Google is reading and raking content" @Pet360 HQ. pic.twitter.com/24zrSvlN50;@billsebald @Pet360;
1;3;The 280-Year-Old Algorithm Inside Google Trips. Proud to be working with the teams that launched this https:// research.googleblog.com/2016/09/the-28 0-year-old-algorithm-inside.html …;;
0;0;#ChegaNoCrushE Fala : Você trabalha na Google ? Porque você tem tudo que eu procuro.;;#ChegaNoCrushE
0;1;check the google drive;;
0;0;Google Drive search refined with natural language processing http:// technewsdir.com/google-drive-s earch-refined-with-natural-language-processing … pic.twitter.com/T4nGsvA8jF;;
0;0;sign out of your account close down your browser ( google ,safari etc) and it should work;;
1;2;me pa que ni siquiera buscaron en google jajajajaja usaron el modelito nuestro nomas.;;
0;0;#Tegnologia Google podría develar su nuevo teléfono en octubre http:// bit.ly/2cHpiDp @elmundomovil;@elmundomovil;#Tegnologia
0;0;Could be, whereas Trump mainly lives of idiots. Oh wait! You never google ... My bad... https:// twitter.com/AtheistTeenaer /status/778026406081097728 …;;
0;0;Could This Mysterious Ad Be for Google 's New Pixel Phone? http:// twib.in/l/dbazEqdBdExb via @adage #Ads pic.twitter.com/axrefJP1jB;@adage;#Ads
0;0;#Tegnologia Google podría develar su nuevo teléfono en octubre http:// bit.ly/2cHpiDp @elmundomovil;@elmundomovil;#Tegnologia
0;1;Today I figured out that It's more efficient to Google "Tilda Swinton" instead of "~ Swinton";;
0;0;Google launches new tour guide app for travelers http:// ift.tt/2cFQK1c;;
0;0;#NewsUpdate Ini Besaran Dana Pajak Gelap Google Sampai Facebook: Lebih Rp105 triliun dana diamankan dari pajak. http:// bit.ly/2cOB50l;;#NewsUpdate
0;2;Please help me win a Google Pixel C hybrid tablet from http:// MakeUseOf.com ! https:// wn.nr/PsAgXk;;
0;3;Kinda... it appears that Mercury is moving backwards. Too much to type in 140 characters. Google . https:// twitter.com/mjmgop/status/ 778380594396954624 …;;
0;0;Could This Mysterious Ad Be for Google 's New Pixel Phone? http:// ift.tt/2csuV5p;;
0;0;Great post! For youngers please google what was a teletype!! #Fischer #Chess https:// twitter.com/olimpiuurcan/s tatus/778243750082453504 …;;#Fischer #Chess
1;3;Google Buys API.AI to Make Building Chatbots Easier https:// goo.gl/dGPe40 #machinelearning;;#machinelearning
0;0;Google 、新スマホ「Pixel」を10月4日に発表へ！特設Webサイトやティザー動画を公開――Nexusに代わり、価格は649ドルからでリーク画像も http:// smar.ws/BB1jz #スマートニュース;;#
0;0;09/21 08:00 の Google 検索ワード 1:市川海老蔵 2:好きな人がいること 最終回 3:アンジェリーナジョリー 4:台風 5:小林麻央;;
0;0;TOP BISNIS: Kejar Pajak Google hingga Tax Amnesty Diperpanjang http:// bit.ly/2cXLAPl pic.twitter.com/lkT7hHRZR2;;
0;0;Google launches new tour guide app for travelers http:// ift.tt/2cFQK1c;;
0;0;Although to be honest, I had to google it & anyone could easily do the same if they were REALLY keen on knowing what it is. :);;
0;0;Новая запись: Презентация новых смартфонов Google Pixel и Pixel XL http:// ift.tt/2cPTCYH;;
0;0;Google launches new tour guide app for travelers http:// ift.tt/2cFQK1c;;
0;0;4 presentations & resume office hours I love sharing Google with the kiddies;;
0;0;celebrity home music studios - Google Search - #tech #technews #technology http:// techandgeek.xyz/celebrity-home -music-studios-google-search-6/ … pic.twitter.com/NtjSbo2jy0;;#tech #technews #technology
0;0;Google adds natural language search to Drive http:// dlvr.it/MJMH3g pic.twitter.com/IJfkv5X48e;;
