retweets;favorites;text;mentions;hashtags
0;0;@alistairadams Checkout SpectraPod the Windows 7 palm-sized set-top Pod running a Qt GUI at ESC in Microsoft 's Booth;@alistairadams;
0;0;Apple has OS and a phone, Microsoft has an OS and a phone,Google has OS and a phone HP same, hey Linus where are you? :) Linux Brand Phone?;;
0;0;Microsoft : Kinect superará las ventas de iPad http://bit.ly/bOCTDb;;
0;0;The Associated Press: Google takes aim at Microsoft with new Web browser http://bit.ly/dlMXFz;;
0;0;Microsoft : Kinect superará las ventas de iPad http://bit.ly/bOCTDb;;
0;0;Смартфоны на базе ОС Windows Phone 7 для сетей CDMA выйдут только в 2011 году: Корпорация Microsoft , считающая, чт... http://bit.ly/acWPuh;;
0;0;odiei esse broffice u_u achei que seria menos lerdo que o microsoft office, ledo engano, é até pior ¬¬;;
0;0;Microsoft Office 2010 Home and Business $209.99 FREE SHIPPING - LogicBuy.com http://bit.ly/dvBFcu;;
0;0;@gajenx Games I guess. Maybe they intend to compete with Apple, Microsoft , Sony and Nintendo in the 'social game center space';@gajenx;
0;0;Empey set to meet Microsoft founder: A meeting with Bill Gates will be on the schedule as the Employment Minister ... http://bit.ly/bP3ef9;;
0;0;Microsoft : Kinect superará las ventas de iPad http://bit.ly/biEFFX;;
0;0;Apple, Microsoft and Nokia new Products will force RIM to sell any value or promise and take any hard decision .. To Survive !;;
0;0;Employment News Empey set to meet Microsoft founder http://bit.ly/cYfLCF;;
1;0;How Is the Microsoft Xbox 360 Slim Ready for Kinect? » Premium ... http://bit.ly/a670fx #xbox #xboxlive;;#xbox #xboxlive
0;0;Hear where #microsoft cashregister @data3limited is headed in this FY review on LTV http://bit.ly/cXnXzo;@data3limited;#microsoft
0;0;"ERES" INCLUIDA EN EL PROGRAMA "PLAYLIST 7" DE MICROSOFT APOYA DESCARGANDOLA http://www.reverbnation.com/playlist7?artist_id=gabielle;;
0;0;RT @nunofmiranda MICROSOFT : Check the new capabilities of the new Internet Explorer 9 through Murdoch from the Gorillaz. http://fb.me...;@nunofmiranda;
0;0;PUPLIC SECTOR ACCOUNT MANAGER Job at Microsoft in Ankara, TR ...: View the PUPLIC SECTOR ACCOUNT MANAGER Job job o... http://bit.ly/b8FhA7;;
0;0;I tested with 100, 250 and 1000 Lower values give echo but the audio is less clipped.  ... Read m... http://bit.ly/asRsdx #Phone #Microsoft;;#Phone #Microsoft
0;0;what the fuck is up with microsoft word!;;
0;0;Proyecto AjpdSoft- Instalar y administrar PostgreSQL en Microsoft Windows 7: Explicamos cómo descargar e instalar ... http://bit.ly/dmEjOa;;
0;0;Microsoft , Yahoo! jostle for US search share: WASHINGTON: Google is the undisputed king of search in the United St... http://bit.ly/928kgc;;
1;0;RT If when you were little you only used your computer to go on Microsoft Paint!;;
0;0;Redmond Software Development Engineer in Test II - Microsoft ...: Redmond Software Development Engineer in Test II - Microsoft Office,...;;
0;0;MICROSOFT : Check the new capabilities of the new Internet Explorer 9 through Murdoch from the Gorillaz. http://fb.me/wUMKtSBX;;
0;0;Até que fim ! Microsoft confirma chegada da rede Xbox Live no Brasil em novembro. Leia + http://is.gd/fiBWI;;
0;0;As soluções de #CRM #Microsoft , garantem uma visão clara dos clientes, do primeiro contato até a pós-venda. Fale c/a @hazdesign #DynamicsCRM;@hazdesign;#CRM #Microsoft #DynamicsCRM
0;0;Microsoft 's Tivanka Ellawala: no plans to develop more phone hardware http://bit.ly/d70iSG;;
0;0;70-642 Exam: Hello!Does The 70-642 ,70-647 And 70-649 Have an Simulation QuestionsOr It Just An Multiple... http://bit.ly/axq4eF #Microsoft;;#Microsoft
0;0;MS야 박리대박을 해도 남으니까... 흐 저런 여유가 부러워... AppleInsider - Microsoft manager claims Kinect will "blow away" iPad sales http://bit.ly/9aA8Qj;;
0;0;多変数分析など高度なA/BテストができるVisual Website Optimizer, Microsoft もユーザだ - TechCrunch http://tinyurl.com/3xt8ep7;;
0;0;多変数分析など高度なA/BテストができるVisual Website Optimizer, Microsoft もユーザだ - TechCrunch http://tinyurl.com/2wco475;;
0;0;多変数分析など高度なA/BテストができるVisual Website Optimizer, Microsoft もユーザだ - TechCrunch http://tinyurl.com/2uf29sw;;
0;0;多変数分析など高度なA/BテストができるVisual Website Optimizer, Microsoft もユーザだ - TechCrunch http://tinyurl.com/37vm4ns;;
0;0;Internet Explorer 9 Brings Apps to Microsoft Windows 7 | Fast Company: Actually interestingly useful http://bit.ly/cLfhTA #ux;;#ux
0;0;Beginning Microsoft Word 2010 http://www.readcabin.com/j/6e4a03c4;;
0;0;Check out the latest Microsoft Project, Project Server, and Project Management jobs, updated daily http://sprrr.com/r/24684;;
0;0;Microsoft is betting on Kinect http://itfanat.com/7732;;
0;0;12n3.net Microsoft to showcase new innovations at Gitex http://goo.gl/fb/k5LSO;;
0;0;12n3.net Microsoft 's smooth PC operator listens to complaints on Twitter http://goo.gl/fb/n7fIj;;
0;0;Kinect a big draw at Microsoft Stores. Wouldn't be surprised if they sell out at launch. #games #in http://yfrog.com/5caemhj;;#games #in
0;0;>:o DAMN IT. WHY IS 2007 MICROSOFT SO HARD TO USE?! I want 2003.. D:<;;
0;0;Amazon solde Microsoft Office 2008 http://goo.gl/fb/hT7mK MacGeneration.com;;
0;0;RT: Microsoft Xbox 360 HDMI 20GB Kid Bundl Extra Controller http://bit.ly/9MSkMF;;
0;0;RT: Microsoft Xbox 360 HDMI w/4 Games Xtra Controller http://bit.ly/93Off1;;
0;0;RT: NEW Wireless Networking Adapter For Microsoft XBOX 360 http://bit.ly/bAfb6b;;
0;2;#microsoft http://bit.ly/a2kuOS;;#microsoft
0;0;Microsoft 's Bing search overtakes Yahoo http://bit.ly/bFPZw1 #bing;;#bing
0;0;It's starting to look as if Microsoft could be too late to enter the modern tablet game. Pity;;
0;0;拉攏日本鬼才製作人合作 微軟將推5款Kinect專用遊戲 - AM730: 拉攏日本鬼才製作人合作 微軟將推5款Kinect專用遊戲 AM730 微軟遊戲工作室( Microsoft Game Studio)副總裁Phil… http://goo.gl/fb/xGBu7;;
0;0;Wow. The Microsoft store is going to be about the size of 8 Apple Stores.;;
0;0;@bnm_productions For once, Microsoft doesn't suck at something.;@bnm_productions;
0;0;Microsoft Rescinded a Job Offer After Background Check ...: by halflifehalflived Microsoft Resci... http://bit.ly/dB0L1j #background #check;;#background #check
0;0;Microsoft and Yahoo Deal from AlbaIM - AlbaIM Social Network,for Internet Marketers and...http://bit.ly/bP64Cc;;
0;0;#SharePoint Error–Issuer of the Token is not a Trusted Issuer http://goo.gl/fb/pXeL8 #MSDNBlog #Microsoft #wif;;#SharePoint #MSDNBlog #Microsoft #wif
0;0;New Post : Microsoft Windows 7 Ultimate 7810Final/x86 Multil28 OEMs Sep 2010 http://goo.gl/fb/l0A5b;;
0;0;Oracle trying to figure out how to sue Microsoft over besmerching name with padding vulnerability!;;
0;0;Internet Explore 9 Beta – Nuovo Browser di casa Microsoft disponibile Gratuitamente in versione Beta da scar... http://tinyurl.com/29xlqy3;;
0;0;No Porn for Microsoft 's Windows Phone 7 http://tinyurl.com/26n79js;;
0;0;RT: @mikkohypponen : Six tech companies among the Top Ten Brands: Coca-cola, IBM, Microsoft , Google, GE, McDonald's, Intel, Nokia, Disney, HP;@mikkohypponen;
0;0;Microsoft Office Home and Student 2007 http://ping.fm/bUWEl #Software ,Amazon #Amazon;;#Software #Amazon
0;0;VIDEO: Kinect Dance Masters trailer & gameplay videos http://is.gd/f2ZiE #kinect #xbox @ign #msft @microsoft;@ign @microsoft;#kinect #xbox #msft
0;0;@badlvillemojo Microsoft is only so popular because some of the programmes are already on your pc when you buy it & so many companies use it;@badlvillemojo;
0;0;Media Center + LiveID: How about Microsoft leverages Media Center to the cloud by linking one's media cent... http://bit.ly/awoeMO #Windows;;#Windows
0;0;Видео YouTube добавлено мной в избранное -- Microsoft Keyno... http://youtu.be/cH7L4RMGFuM?a;;
0;0;Microsoft : Get more from your meeting notes: Find out how to take notes quickly, organize them effectively, and tu... http://bit.ly/9ggI4W;;
0;0;Microsoft demons being cast from the server...... http://post.ly/yZFx;;
0;0;Мне понравилось видео YouTube -- Microsoft Keynote: Kinect http://youtu.be/cH7L4RMGFuM?a;;
0;0;installing microsoft office 2010 on my laptop and its taking forever BK <3;;
0;0;Microsoft Exchange System Engineer - Messaging 5 -... http://jobsurl.com/fj4x;;
0;0;Microsoft Great Plains make kissing – USA / Mexico – overview for consultant: Microsoft Business Solutions Great P... http://bit.ly/a7tuEw;;
0;0;Microsoft to embrace and extend HTML 5? • The Register: There's an internal war at Microsoft over HTML 5 and Silve... http://bit.ly/9D9ruN;;
0;0;Ahh waarom komen er altijd 's nachts interesante dingen op Discovery! Aflevering over het begin van Microsoft en Netscape. #IamaNerd;;#IamaNerd
0;0;Thanks for the RT of Microsoft 's Cyber-Security Ebook @queenz;@queenz;
0;0;Baby Pink Silicone Skin Case for Microsoft xBox 360 Controller + HDMI M/M Cable 1.3 , 3 FT: This is an archive of ... http://bit.ly/ca1JwJ;;
0;0;RT + follow @HannahSimone for chance 2 win @Samsungtweets camcorder and @Microsoft #Forza3 from #WCGUltimateGamer - watch Thurs at 11/10;@HannahSimone @Samsungtweets @Microsoft;#Forza3 #WCGUltimateGamer
0;0;Oh my gosh, you guys! I just made my first movie in Microsoft Movie Maker. And it is AWESOME! A real tear jercker.;;
0;0;#microsoft #best აქ საქმე სრულიად ახალი აკავშირებს 201 http://tinyurl.com/32laczs;;#microsoft #best
0;0;Instalar y administrar PostgreSQL en Microsoft Windows 7 - http://www.ajpdsoft.com/modules.php?name=News&file=article&sid=489;;
0;0;Era solo cuestion de tiempo para que Microsoft mejorara en serio a Internet Explorer. Probando #IE9beta http://is.gd/fiBbp;;#IE9beta
1;0;Кто свято верит в то, что Microsoft и Nokia свято верят. Угадайте как его зовут (этот твит был написан из-за обвинения автора в однообразии);;
0;0;Microsoft : TechNet Licenses Downgrade Is Just a Web Issue http://nxy.in/3x1g9;;
0;0;Microsoft 'un IE'sinin pazar payı düştü;;
0;0;Rumor: Microsoft prepping a new Zune for 2011? (Ben Patterson) - http://tinyurl.com/2en9v5a;;
0;0;곧 발매 예정인 윈도우 폰 7 은 GSM 으로 일단 한정될 것 같습니다. Microsoft 에 따르면 CDMA 버전은 2011년 상반기에 발매될 예정이고 대부분의 벤더들과 GSM 출시에 공을 들이고 있는... http://fb.me/G16ossaz;;
0;0;Gerencie de maneira otimizada o relacionamento c/seus clientes e aumente as suas vendas. Fale c/a @hazdesign http://bit.ly/aJo84k #Microsoft;@hazdesign;#Microsoft
0;0;gettin free shit is THE shit. Microsoft Office? Adobe Illustrator? Photoshop? Final Draft? #Fugetaboudetttttt;;#Fugetaboudetttttt
0;0;The fact that I have to have Windows to download a Windows ISO from MSDN says it all about Microsoft .;;
0;0;Microsoft Office 2008 for Mac Home & Student Edition http://bit.ly/9vPfgD #Software ,Amazon #Amazon;;#Software #Amazon
1;0;2019 - A Beautiful Illustration of Future Technology - From Microsoft : From Microsoft , a glimpse into our beautifu... http://bit.ly/aHWDvM;;
0;0;RT @mantol : 登録してしまた…!! Microsoft ，「Age of Empires Online」を発表。基本プレイは無料，公式サイトではβサインアップがスタート http://bit.ly/biUjDk;@mantol;
0;0;AdobeLinguistic.dll is a file used by various "Adobe" software to help control & load up a series of files and settin... #Linux #Microsoft;;#Linux #Microsoft
0;0;Sony, Microsoft consoles take aim at Wii | Portable Gadget http://bit.ly/cArhMG #technology;;#technology
0;0;Time Management - Marketplace - Microsoft Office http://bit.ly/bAcj6a;;
0;0;@Slater_94 the the the this is Microsoft sam;@Slater_94;
0;0;If Microsoft Outlook had been correctly written in the first place, it would not have encountered a problem. I could never be in marketing.;;
0;0;News on What the Death of Microsoft Kin Means: by anthony on 07/01/10 at 10:48 pm Note: This post ... http://bit.ly/9y2SPI #Mobile #Devices;;#Mobile #Devices
0;0;;) http://bit.ly/9D181j microsoft kin What the Death of Microsoft Kin Means;;
0;0;Microsoft ou Apple? — Apple http://4ms.me/d8bgId;;
0;1;Microsoft : TechNet Licenses Downgrade Is Just a Web Issue - http://bit.ly/drO3Wf;;
0;0;@TagAlongTess Better living through Microsoft .™;@TagAlongTess;
0;0;microsoft exchange services | orgstate: Intermedia is the premier provider of business communications services, in... http://bit.ly/cH9VVX;;
0;0;microsoft exchange services | orgstate: Intermedia is the premier provider of business communications services, in... http://bit.ly/cH9VVX;;
0;0;microsoft exchange services | orgstate: Intermedia is the premier provider of business communications services, in... http://bit.ly/cH9VVX;;
0;0;Microsoft y Yahoo! luchan por el segundo lugar en los servicios de búquedas en Internet: Google es el rey indiscut... http://bit.ly/cIFwM8;;
0;0;Microsoft Office 2010 Home & Student (Disc Version) http://bit.ly/cNfcyv #Software ,Amazon #Amazon;;#Software #Amazon
0;0;MacMaster's Blog: Office for Mac 2011 – Announced by Microsoft http://lnkd.in/rse6Sc;;
0;0;Why have Microsoft chose to use the most annoying actress for that latest windows 7 ad, on a side note, all those ads are rubbish.;;
0;0;Item image Microsoft Xbox 360 Console (20 GB) http://bit.ly/bnUcb5;;
0;0;Fu microsoft wordd! Go die;;
1;0;http://marketing.openoffice.org/index.html A Free alternative to Microsoft Office;;
0;0;#Amazon solde #Microsoft Office 2008. http://bit.ly/bt0lq9;;#Amazon #Microsoft
1;0;No te pierdas este martes 21 reunión del SMCMX en Microsoft : "Cloud Computing y Desarrollo en Web" http://ow.ly/2GA8W (pls RT!);;
0;0;Sugiero tambien leer sobre Microsoft Solution Framework MSF metodologia en : http://tyni.it/2n;;
0;0;اغاني fresh downloads Microsoft Visual FoxPro 9.0 Professional [file iso] key hotfiles http://goo.gl/fb/awIue;;
0;0;fresh downloads Microsoft Visual FoxPro 9.0 Professional [file iso] key hotfiles http://goo.gl/fb/rUbZQ;;
0;0;ビジネス：1位： Microsoft Office Professional 2010　アカデミック 対応OS：ソフト発売元：マイクロソフト発売日：6月17日23,244 円(税込)22…http://yaplog.jp/bed0922/archive/1710 #yaplog;;#yaplog
1;0;Microsoft Response Point (small-business VoIP phone system) declared dead: http://www.microsoft.com/responsepoint/notification.aspx;;
0;0;@samadeu CELESC indenizará a Microsoft /uso 350 cópias de softwares. Vistoria/outros 400/Multa de R$500 por programa.http://twixar.com/T5N;@samadeu;
0;0;Microsoft Tech·Ed Brasil 2010 - Home http://www. teched.com.br/2010/ via @AddThis;@AddThis;
0;0;Microsoft wants India among top 5 markets: Microsoft is betting on increasing adoption of the cloud computing mode... http://bit.ly/aPa765;;
0;0;#felgall Internet Explorer 9 http://felgall.net/?p=1942 The beta version of Microsoft '...;;#felgall
0;0;Today's groom a Microsoft programmer created superb 3-tier cake, decorating it with rosemary & lavender http://twitpic.com/2q47td;;
0;0;Computer Anzeigen: Ergonomische Tastatur Microsoft , PS II -Anschluss: wenig gebraucht, ... http://bit.ly/cHf14G Kleinanzeigen;;
1;1;Microsoft Introduces IE9 – your jQuery code is now going to roar ...: This last week I had the opportunity to atte... http://bit.ly/97idRz;;
0;0;IE "Security": Microsoft posts Internet Explorer 9 beta (updated with first-look review) - http://bit.ly/bojdCz Full http://bit.ly/aejbR6;;
0;0;Microsoft 's Tivanka Ellawala: no plans to develop more phone hardware http://bit.ly/b9VIYU;;
0;0;Microsoft fail: Adoro este vídeo, e acho que qualquer geek também gosta! http://bit.ly/brE0Bc;;
0;0;7 days to Microsoft Innovation Center Summit;;
0;0;Microsoft : Eφαρμογές για το iPad(;): Σύμφωνα με inside info που διέρρευσαν στο twitter η Microsoft ετοιμάζει εφαρμ... http://bit.ly/cZ8H1d;;
0;0;When Web sites and Web apps collide with IE 9: Questions and some answers - #IE9 #Microsoft - http://zd.net/95pUw0;;#IE9 #Microsoft
0;0;Five apps to hope for on Phone 7: By Robert Mullins on Sun, 09/19/10 - 4:49pm. With the opening of Microsoft 's Pho... http://bit.ly/b4Bx2W;;
0;0;OS Deals SEALED WINDOWS 7 ULTIMATE 32&64 BIT FULL RETAIL VERSION: £84.99 End Date: Friday Sep-24-201... http://bit.ly/ausCNc From Microsoft;;
0;0;OS Deals SEALED WINDOWS 7 ULTIMATE 32&64 BIT FULL RETAIL VERSION: £84.99 End Date: Friday Sep-24-201... http://bit.ly/as2qCK From Microsoft;;
0;0;Microsoft y Yahoo luchan por el segundo lugar en las búquedas de Internet http://bit.ly/bd1kUx via @informador ^AR;@informador;
0;0;Google TV, quelques longueurs d'avance sur Apple...: ... iphone microsoft musiques gratuites next iphone next iphone... http://goo.gl/h18s;;
0;0;Microsoft Releases Open Source Tools for the Cloud: Microsoft makes commitment to Openness in the Cloud: Releases ... http://bit.ly/afqvQl;;
0;0;Microsoft 's Aaron Greenberg Talks Kinect at TGS http://bit.ly/bVgaNe;;
0;0;I uploaded a YouTube video -- Microsoft Sam reads Errors Episode 1, Welcome to "linux" http://youtu.be/9pMI8nJC4Ik?a;;
0;0;Microsoft – Screwing the Pooch Is A Way Of Life http://bit.ly/9dhKFZ;;
0;0;How to get message from Windows to actually running application in WPF?: I spend around few hours to fin... http://bit.ly/dy90BY #Microsoft;;#Microsoft
0;0;Problem converting VB to C#linq values: I have the following VB.NET code that I cannot translate manual... http://bit.ly/ddI8D1 #Microsoft;;#linq #Microsoft
0;0;Meu Microsoft word tá todo desconfigurado;;
0;0;Discover Internet Explorer 9 Beta - Microsoft Windows http://bit.ly/cTOaeg;;
0;0;Source code will not display changes: My problem is this when I try to type code in Visual Studio 2010 I... http://bit.ly/c8NpZB #Microsoft;;#Microsoft
0;0;Kinect object scanning adds some color to Joy Ride: As you would expect, Microsoft ’s Kudo Tsunoda has expressed an... http://bit.ly/bP48DQ;;
0;0;pq eu naum consigo axar o keygen do microsoft office 2007 ????!!!!! q raiva!!!!!!!!!!!;;
0;0;Microsoft Access 2007 http://ping.fm/2OJwX #Software ,Amazon #Amazon;;#Software #Amazon
0;0;Perca de tempo esse #Microsoft Microsoft Expression Studio 2;;#Microsoft
1;0;Pirataria: CELESC indenizará a Microsoft /uso 350 cópias de softwares. Vistoria/outros 400/Multa de R$500 por programa.http://twixar.com/T5N;;
0;0;Watched a webcast on Microsoft .NET WCF development, made by http://bit.ly/cFtMmn. highly recommend her teachings.;;
0;0;Mac Generation: Amazon solde Microsoft Office 2008: Si vous devez faire l'acquisition de Microsoft Office, l'offre... http://bit.ly/9ZGJCU;;
0;0;Amazon solde Microsoft Office 2008 http://bit.ly/ar9WPd /via macgen #apple;;#apple
0;0;I still think Nintendo is more nicer than Sony and Microsoft;;
0;0;No tengo Microsoft Word asi q lo hare en WordPad... #JODASE !;;#JODASE
0;0;Alguém aí tem microsoft auto collage?;;
0;0;Microsoft Sam fails at Tech Support! - http://www.youtube.com/watch?v=obqo7k_Y6fc;;
0;0;If this is how Microsoft builds software: http://bit.ly/d5j6WT No wonder they've had so much trouble lately. #ctrlaltdel /via @hackernews;@hackernews;#ctrlaltdel
0;0;Ho impostato un video di YouTube come preferito -- How to crack any microsoft office 20... http://youtu.be/7w4OX4_tTVQ?a;;
0;0;#Microsoft Clipboard save and restore in pure VB6 + Windows API by fedo911, http://job.bs/s/1csx;;#Microsoft
0;0;Odisea en las webs de Microsoft para poder descargar el Microsoft Messenger para Mac.;;
0;0;Yarr! I just found meself a shortcut in Microsoft Office -- CTRL + Entarr breaks the page.;;
0;0;コレで安心ウィルス対策！ Microsoft Security Essentials もちろん、無料で使えます。 http://bit.ly/bN14Aj;;
0;0;Microsoft wraps up tools for mobile app developers - TMCnet http://dlvr.it/5YBSJ;;
0;0;Microsoft wants India among top 5 markets - Livemint http://bit.ly/9LcsQS;;
0;0;Microsoft ou Apple? — sl http://4ms.me/ccPNP4;;
0;0;this math project would be easy and fast if i was good at Microsoft Excel. "/;;
1;0;Many people focus on stock and overlook the fact that Microsoft lost about half its value under Ballmer;;
0;0;Re-Organize 150 images within Microsoft Word document - oDesk http://dlvr.it/5YBQw;;
0;0;Microsoft asegura que no habrá mas teléfonos por su parte. http://bit.ly/cY0R89;;
0;0;RT @Rafe : iTunes: it is to Apple as Outlook is to Microsoft .;@Rafe;
1;0;Microsoft и Nokia свято верят, что разработчики bada, Android и iOS будут сидеть сложа руки. История ничему не учит?;;
0;0;Empey set to meet Microsoft founder http://ow.ly/194F6n;;
0;0;@bsangel Microsoft needs to make Virgil plushies.;@bsangel;
0;0;#bm Microsoft SharePoint Workspace 2010 14.0.4763.1000 + rus Тихая установка http://ow.ly/194FnI;;#bm
0;0;#bm Microsoft Outlook 2010 14.0.4763.1000 + rus Тихая установка http://ow.ly/194FnJ;;#bm
0;0;IE \"Security\": Microsoft 's IE9 off limits to most Windows PCs - San Francisco Chronicle http://ow.ly/194FnP;;
0;0;IE \"Security\": Microsoft 's IE9 off limits to most Windows PCs - San Francisco Chronicle http://ht.ly/194Fon;;
0;0;#Microsoft workers celebrated Windows Phone 7 RTM with #iPhone and #blackberry hearses ... Complete with pics http://bit.ly/9rLzKm.;;#Microsoft #iPhone #blackberry
0;0;Blog Post: SharePoint Error–Issuer of the Token is not a Trusted Issuer http://goo.gl/fb/JKdfM #MSDN #microsoft;;#MSDN #microsoft
0;0;Microsoft ’s Windows Phone 7 Launch Could Crash and Burn Without Verizon http://freesmartphoneapps.us/microsofts-windows-phone-7-launch-could;;
0;0;@creative_cakery I had no idea Microsoft had gotten into blogging. Sigh!;@creative_cakery;
0;0;Amazon.com: Microsoft Office 2010 Home & Student (Disc Version): Windows: Software: amazonstuff shortened a link to... http://dlvr.it/5YB48;;
0;0;#Microsoft #Jobs Clipboard save and restore in pure VB6 + Windows API by fedo911 http://ow.ly/194FZB;;#Microsoft #Jobs
0;1;Money money money money... MONEY (no change, just a techno beat created by Microsoft Word) #BillGatesRemixes;;#BillGatesRemixes
0;0;La pagina de descargas de #Microsoft descarga a NADA! Debes ser por el boom del #IE9 Bajando #Silverlight a 16k AHHH!;;#Microsoft #IE9 #Silverlight
0;0;Mapa de funcionalidades do Visual Studio http://goo.gl/fb/ku98L #microsoft #visualstudio;;#microsoft #visualstudio
0;0;RT @marcoarreguin : Ayer vi, antitrust, jamas lá había visto :p// a poco no le tiran pedrafas a microsoft ??;@marcoarreguin;
0;0;microsoft - Internet Explorer 9 Beta available in 33 languages http://bit.ly/dmkyc4 #terminology;;#terminology
0;0;http://tinyurl.com/mvhpgw - programa Students to Business uma iniciativa da Microsoft;;
0;0;Kinect Sensor with Kinect Adventures! by Microsoft http://www. amazon.com/gp/product/B00 2BSA298/ref=cm_sw_r_tw_jdp … via @amazon;@amazon;
0;0;#Microsoft #Jobs Sharepoint consultant - Sharepoint consultant .. project omschrijving Start: in overleg duur... http://ow.ly/194GjF;;#Microsoft #Jobs
0;0;Starting Microsoft Ignite training shortly. ..;;
0;0;Time Management: Time Management - Marketplace - Microsoft Office http://bit.ly/bCR4hO;;
0;0;crmlivelab: Microsoft CRM 2011 first look video: Eric gives a first look at CRM 2011 and takes an in-depth dive in... http://bit.ly/asxznu;;
0;0;Microsoft launch Internet Explorer 9 web browser http://bit.ly/druw7y;;
0;0;Kinect launching on November 10 in Europe, Africa, Middle East http://is.gd/f3KtB #kinect #xbox @ign #msft @microsoft;@ign @microsoft;#kinect #xbox #msft
0;0;Just tried "Contact us" at download. microsoft .com - huge improvement - easy way to send feedback to MS at last (live.com did have easy way);;
0;0;Where can I recieve online training in Microsoft Office 2007 as ... http://bit.ly/d228K5;;
0;0;MICROSOFT ACCESS - Upgrades (Bay Area) #CRAIG #services #computer #SFO http://3taps.com/w/MTWUTC;;#CRAIG #services #computer #SFO
1;0;Microsoft Word Will Never Understand That My Name is NOT a Spelling Mistake.;;
0;0;Are teachers equipped to teach "digital natives" ? http://bit.ly/9f9a3g #office2010 via @Microsoft NO THEY'RE NOT!!!;@Microsoft;#office2010
0;0;@ademide don't mind sony... Nintendo & microsoft would soon surpass them by far!;@ademide;
0;0;@AmamiPerSempre lmao, we aint all got Microsoft money to import ribs and such.;@AmamiPerSempre;
0;0;Inside Sales Representative - Software - Neverfail - Austin, TX: for Microsoft systems. Our North American Headqu... http://bit.ly/a6Gidt;;
0;0;#jokes They say when you play that Microsoft CD backward you can hear satanic messages ... but that's nothing. If you play it forward ...;;#jokes
0;0;There is a new treat out there in OS land. Windows 7 (64 bit) is extremely slow with iphones really slow no fix from #apple or #microsoft;;#apple #microsoft
0;0;Microsoft shouldn't be allowed to make iPhone apps.;;
0;0;I have now resolved the problem I uninstalled the driver supplied by microsoft then I reinstalled a ... http://bit.ly/9I1ey4 #MCA #MVP #MCP;;#MCA #MVP #MCP
0;0;OpenOffice Writer - The Free Option To Microsoft Word. 100% Free! - #Vientiane - #World - http://youreader.com/u.php?i=328044;;#Vientiane #World
0;0;Re-Organize 150 images within Microsoft Word document - oDesk http://bit.ly/dz2vIX;;
0;0;RT @changeequation Samsung/ Microsoft /Adobe "Solve for Tomorrow" #STEM campaign giving $1M to teachers! Apply by 10/24: http://bit.ly/966iCw;@changeequation;#STEM
0;0;Please think about your article titles and double meanings. Could have been: Microsoft Saves Adobe Reader's Innocence. http://bit.ly/co8iEA;;
0;0;Zacks Analyst Blog Highlights: Netflix, Apple, Microsoft , Sony and Fred - PR Inside http://tinyurl.com/29o9goa;;
