retweets;favorites;text;mentions;hashtags
0;0;Microsoft Windows 7 ULTIMATE x86 / x64 Integrated September 2010 OEM DVD-BIE Download Treasure! http://www. heroturko.org/softwares/4658 69-microsoft-windows-7-ultimate-x86-x64-integrated-september-2010-oem-dvd-bie.html … vía @AddThis;@AddThis;
0;0;Ive just lost another mix cd due to fuckin microsoft and crashing problems;;
0;0;Dear Microsoft Word, thank you for destroying my 4 hours of work I just did. I hate you and the book now even more.;;
0;0;#CF Microsoft Sams Teach Yourself SQL Server 2005 Express in 24 Hours: * Microsoft Sams Teach Yourself SQL Se... http://tinyurl.com/39hps66;;#CF
0;0;True! ---> RT @Rafe : iTunes: it is to Apple as Outlook is to Microsoft . Gah!;@Rafe;
0;0;#CF Microsoft Sams Teach Yourself SQL Server 2005 Express in 24 Hours: * Microsoft Sams Teach Yourself SQL Se... http://tinyurl.com/39hps66;;#CF
0;0;Urrā, beidzot arī Microsoft Word nobruka! Diez cik tālu būs saglabājies, ja vispār būs? : );;
0;0;MICROSOFT FLIGHT SIM X DELUXE DVD-ROM: Flight Simulator X is the culmination of nearly 25 years of the landmark Fl... http://bit.ly/9VOsc3;;
1;0;IE "Security": Microsoft 's IE9 off limits to most Windows PCs - San Francisco Chronicle http://bit.ly/dzyMlC Full http://bit.ly/aF3TRU;;
2;0;Microsoft Weekly Roundup: IE 9 Beta, Windows Phone 7 Tools – USANewsWeek.com: USA Today Microsoft Weekly Roundup: ... http://bit.ly/ciMnfI;;
1;0;Android is patent-infringing and not really free, according to Microsoft http://bit.ly/bVbpIN;;
0;0;Microsoft wraps up tools for mobile app developers: (AP) — Microsoft (News - Alert) has taken another step toward ... http://bit.ly/d5GeBr;;
0;0;Microsoft wraps up tools for mobile app developers http://bit.ly/bmWPwV;;
0;0;This code does work, I tested it before sending it. What errors are you getting?... Read more on ... http://bit.ly/9IFGcB #Phone #Microsoft;;#Phone #Microsoft
0;0;Hi, I think you should use a timer for this, rather than blocking the UI thread. Try this:     va... http://bit.ly/aZrgjp #Phone #Microsoft;;#Phone #Microsoft
0;0;You could try something like this... var timer = new DispatcherTimer(); timer.Tick ... http://bit.ly/duk58M #Phone #Microsoft;;#Phone #Microsoft
0;0;Hi, I think you should use a timer for this, rather than blocking the UI thread. Try this:   var... http://bit.ly/amZUk6 #Phone #Microsoft;;#Phone #Microsoft
0;0;Microsoft wraps up tools for mobile app developers: (AP) — Microsoft (News - Alert) has taken another step toward ... http://bit.ly/a5dQq4;;
0;0;Naftis, This code appears to be doing what you have written it to do. The SoftKeyPressedEventArgs... http://bit.ly/azvhwx #Phone #Microsoft;;#Phone #Microsoft
0;0;Microsoft wraps up tools for mobile app developers: (AP) — Microsoft (News - Alert) has taken another step toward ... http://bit.ly/9f3wdZ;;
0;0;OS Deals WINDOWS XP PRO SP2 OEM NEW FREE POSTAGE AND RAM: £24.98 (0 Bid) End Date: Friday Sep-24-201... http://bit.ly/c392tR From Microsoft;;
0;0;nettiesbe [Hardware] HTC Sense met erg aantrekkelijke tools: Hopelijk zullen Microsoft en Google HTC nooit verbied... http://bit.ly/cvOasd;;
0;0;Dicas para Windows XP - Parte 2: Introdução Esta é a segunda parte das dicas para o Microsoft Windows... http://bit.ly/aES08y;;
0;0;¿Instalar el #HaloReach en la #xbox360 ? !Qué tonteria!. Atentos a esta información, muy interesante. http://exm.nr/aUSMiY #microsoft #bungie;;#HaloReach #xbox360 #microsoft #bungie
0;0;#Microsoft says no to #IE9 for #Windows XP http://bit.ly/946ebP #tech #news #browser http://bit.ly/cYFY8a;;#Microsoft #IE9 #Windows #tech #news #browser
0;0;#Microsoft says no to #IE9 for #Windows XP http://bit.ly/946ebP #tech #news #browser http://bit.ly/aHNUxG;;#Microsoft #IE9 #Windows #tech #news #browser
0;0;> @Rafe : iTunes: it is to Apple as Outlook is to Microsoft . Gah!;@Rafe;
14;1;iTunes: it is to Apple as Outlook is to Microsoft . Gah!;;
0;0;Microsoft Releases Security Advisory for ASP.NET Vulnerability (eWeek): Share With Friends: | Latest Business -... http://twurl.nl/viaj4l;;
0;0;Deploying Microsoft RemoteFX for Personal Virtual Desktops Step-by-Step Guide : http://bit.ly/dlMwFu;;
0;0;@jwhdavison see if Microsoft would be able exchange the disc for you;@jwhdavison;
0;0;How-To Blog With Microsoft Word 2010 http://goo.gl/fb/2aSMt #microsoft #howto #livewriter #microsoftoffice #word2010;;#microsoft #howto #livewriter #microsoftoffice #word2010
0;0;Typical Microsoft : RT @knight777 : I've activated Windows7 10+ times now. Every minor adjustment to my computer requires another activation.;@knight777;
0;0;RT @spyfull27 : #TGS2010 Finaliza la feria anual de videojuegos con record histórico de visitas http://bit.ly/dc8WED #Sony #Microsoft;@spyfull27;#TGS2010 #Sony #Microsoft
0;0;Microsoft 's week saw the unveiling of Internet Explorer 9, developer tools for Windows Phone 7, and the rebranding of its Office software;;
0;0;arranged brian scott - PDF eBook Searches: VIRGINIA... Microsoft Word - Scott Handwriting Policy... marching band ... http://bit.ly/b3MBjO;;
0;0;3146 ychwanegu dolen arall #2009 #microsoft #yahooo 1987 http://tinyurl.com/2gyzrvv;;#2009 #microsoft #yahooo
0;0;Deploying a Single Microsoft RemoteFX Server Step-by-Step Guide : http://bit.ly/bpZsxd;;
0;0;GV Mobile + lands on the App Store - http://www.geekword.net/download-gv-mobile/ #microsoft;;#microsoft
1;0;#Microsoft says no to #IE9 for #Windows XP http://bit.ly/946ebP #tech #news #browser;;#Microsoft #IE9 #Windows #tech #news #browser
0;0;#Microsoft says no to #IE9 for #Windows XP http://bit.ly/946ebP #tech #news #browser;;#Microsoft #IE9 #Windows #tech #news #browser
0;0;RT @GreenBiz Microsoft 's 10 Tips to Help Developers Play Nice with Sleeping PCs http://bit.ly/bjhVnr - !;@GreenBiz;
0;0;Does not look like Mircosoft is interested in getting this fixed at.hmm. I stil miss my old VSS.It looks... http://bit.ly/cCpd32 #Microsoft;;#Microsoft
0;0;Currently you need to rightclick a file -> Properties.  Or use 'tf prop' as mentioned earlier.VS2008 SP1... http://bit.ly/9chCxJ #Microsoft;;#Microsoft
0;0;Any news on 'Date Modified', I don't see it in 2008 VS Team Explorer when viewing file properties in eit... http://bit.ly/deOfPZ #Microsoft;;#Microsoft
0;0;Does not look like Mircosoft is interested in getting this fixed at.hmm. I stil miss my old VSS.It looks... http://bit.ly/cCpd32 #Microsoft;;#Microsoft
0;0;Hi Richard, We are using Team Foundation Server as a source control solution for our installation projec... http://bit.ly/bLFgK9 #Microsoft;;#Microsoft
0;0;Currently you need to rightclick a file -> Properties.  Or use 'tf prop' as mentioned earlier.VS2008 SP1... http://bit.ly/9chCxJ #Microsoft;;#Microsoft
0;0;I have created  the VS Add-in. When an user selects 'Get Latest Version,' It catches the Getting,Operati... http://bit.ly/9ZGkqz #Microsoft;;#Microsoft
0;0;Any news on 'Date Modified', I don't see it in 2008 VS Team Explorer when viewing file properties in eit... http://bit.ly/deOfPZ #Microsoft;;#Microsoft
0;0;Hi Richard, We are using Team Foundation Server as a source control solution for our installation projec... http://bit.ly/bLFgK9 #Microsoft;;#Microsoft
0;0;I have created  the VS Add-in. When an user selects 'Get Latest Version,' It catches the Getting,Operati... http://bit.ly/9ZGkqz #Microsoft;;#Microsoft
0;0;@mikejamesgreen hello Mr G, do you play Microsoft Flight Simulator? If so, is it good?;@mikejamesgreen;
0;0;Anyone ever had a problem with the Windows Live installer where is just says "Registering with Microsoft Update" and it never gets anywhere?;;
0;0;Mola el ratón que me agencié en Microsoft . Adiós cables, hola estilo.;;
0;0;Microsoft tests new Web link: Uses may include easier Internet connections, remote monitoring of industrial system... http://bit.ly/9rpTur;;
0;0;ebaa, ontem foi o dia em que deixei meu time de basquete parair ao curso de microsoft educação.;;
0;0;twitter, facebook and skype all open on the macbook... microsoft excel open on the pc...;;
0;0;ビジネス：1位： Microsoft Office Professional 2010　アカデミック 対応OS：ソフト発売元：マイクロソフト発売日：6月17日23,244 円(税込)2…http://yaplog.jp/njd0328c/archive/1587 #yaplog;;#yaplog
0;0;Review On Business Accounting Software By Sage And Microsoft http://goo.gl/fb/34r5Z;;
0;0;@mjays maybe they want to become as boring as microsoft ? ;-);@mjays;
0;0;Microsoft Wireless Explorer Mouse New Sealed in Box ( Halifax ) $40.00: Brand New & Sealed Cost $99 at FutureShop ... http://bit.ly/bq8FsD;;
0;0;The Hindu : Sci-Tech / Technology : Microsoft launches new developer tools for Windows Azure: http://bit.ly/bQLN0Z;;
0;0;Microsoft Expression Blend: Professional design tool for creating engaging Web-connected experiences for Windows Q... http://bit.ly/bOpbnK;;
0;0;Microsoft Kinect http://bit.ly/9hvogQ;;
0;0;Microsoft Kin First. Last. Always. #microsoft #internet http://bit.ly/aMe4Id;;#microsoft #internet
0;0;Microsoft Office Excel, Access Expert with Formula Experience - oDesk http://ow.ly/194DjP;;
0;0;@XboxSupport are you guys w Microsoft ?;@XboxSupport;
0;0;RT @MSFTResearch : Try Microsoft Research's Pex for Fun, an interactive coding duel. http://www.pexforfun.com/;@MSFTResearch;
0;0;weia, microsoft essentials stuft Flash Player install als bedenklich ein. #grosseVerschwörung #MS #apple unter einer Decke? ;o);;#grosseVerschw #MS #apple
0;0;TBA IE 9 Beta, Windows Phone 7 Tools Marked Microsoft Week http://bit.ly/aALi19;;
0;0;TBA IE 9 Beta, Windows Phone 7 Tools Marked Microsoft Week http://bit.ly/aALi19;;
0;0;i need to install photoshop back onto my laptop, microsoft paint isn't quite good enough... http://tumblr.com/xylj1xw9t;;
0;0;TBA IE 9 Beta, Windows Phone 7 Tools Marked Microsoft Week http://bit.ly/9gYkDu;;
1;0;Microsoft to purchase hot dog stand. Introduces "MicroDogs". story developing via @Iyaz;@Iyaz;
1;0;Microsoft , the fact that every 2nd game of reach is plagued by lag or connection issues is not going unnoticed. #Haloreach;;#Haloreach
0;0;Office2010にしたら、 Microsoft Publisher 2010の挙動が今までと変わり過ぎてWEBページの発行に苦労した．．．素直にHTMLファイルを普通に吐き出しやがれ（怒;;
1;0;It's great all of the support that MVPs, Microsoft Store folks and MS peeps are giving to make these #MSMVP events happen. Much luv to all.;;#MSMVP
0;0;Microsoft Weekly Roundup: IE 9 Beta, Windows Phone 7 Tools: Software giant Microsoft unveiled two major products- ... http://bit.ly/dCeJDq;;
0;0;If only I could find her Microsoft Office 2007...hmm where could it be??;;
0;0;Breaking Tech News Microsoft Releases Security Advisory for ASP.NET Vulnerability http://ow.ly/194EAw;;
0;0;" Microsoft Halo Reach For Xbox 360 Grosses $20,000,000 On Launch Day, Wins Our Hearts!" and related posts http://bit.ly/9CClmO;;
0;0;This page was designed with Microsoft Notepad.;;
0;0;Mark Brummel - Microsoft Dynamics - Converting 1600 Forms to Pages | The Approach http://bit.ly/cWXsok;;
0;0;Error message re input string: Today while attempting to install four items for Microsoft Fix It Center, for each ... http://bit.ly/bBhDhr;;
0;0;got some crap work this week with #microsoft active directory. doing my head in!;;#microsoft
0;0;admin support :: Microsoft Office Excel, Access Expert with Formula Experience - oDesk: I am looking for an Micros... http://bit.ly/ce3tGv;;
0;0;CRM 2011 Videos On Channel 9 - Microsoft Dynamics CRM UK Blog ...: MSCRM, Microsoft CRM, Microsoft Dynamics CRM, S... http://bit.ly/a8mCRH;;
0;0;New Post: Microsoft Office 2010 Home & Student Review http://bit.ly/9zH8YY;;
0;0;FUCK YOU MICROSOFT WORD!;;
0;0;Internet Explorer 9 (IE9) beta: 3 Cool New Features. http://t11.me/UMY-XB (PCWorld.in) #ie9 #internet #explorer #browser #feature #microsoft;;#ie9 #internet #explorer #browser #feature #microsoft
0;0;How to Crop Photos with Microsoft Office Picture Manager http://www. ehow.com/how_5861366_cr op-microsoft-office-picture-manager.html … via @ehow;@ehow;
0;0;http://bit.ly/c6Quc3 Microsoft Office 2010 Is at OfficeDepot Nothing beats FREE! Over $180 in exclusive offers;;
0;0;A #Microsoft fornece plataforma totalmente integrada e escalonável p/a implantação de soluções p/Gestão de Conhecimento. Fale c/a @hazdesign;@hazdesign;#Microsoft
0;0;How to Remove Red Eye with Microsoft Office Picture Manager http://www. ehow.com/how_5866732_re move-microsoft-office-picture-manager.html … via @ehow;@ehow;
0;0;desgraça de MSN peguei um virus num sei como !! tinha que ser da microsoft #eumereco;;#eumereco
1;0;Microsoft browser mocks antitrusters http://is.gd/fivnc;;
0;0;Who wants to show me how to use Microsoft Excel?;;
0;0;#Cloud #News Microsoft wants India among top 5 markets: Microsoft is betting on increasing adoption of the clo... http://bit.ly/8XmOWi #TCN;;#Cloud #News #TCN
0;0;Microsoft ou Apple? — Apple u_u http://4ms.me/94SkWv;;
0;0;Microsoft Windows 7 на iPad http:// japseido-blog.mirtesen.ru/blog/435092009 73 …;;
0;0;Microsoft Metro, mouse con tecnología BlueTrack http://to.ly/722o #noticias #tecnologia;;#noticias #tecnologia
0;0;@tesne Si existen, no saben que hacer con tanta plata, y trabajan para microsoft .;@tesne;
0;0;Microsoft wants India among top 5 markets http://chtr.it/5QegfK #cisco;;#cisco
0;0;Information at your fingertips: ... but add a Novell Network Certification to a Microsoft Certification, and you'v... http://bit.ly/bnSheC;;
0;0;TGS: Kinect Dance Masters Gameplay Video http://bit.ly/cGv0tp #tgs #kinect #xbox @dance_masters @microsoft @ign @majornelson;@dance_masters @microsoft @ign @majornelson;#tgs #kinect #xbox
0;0;Interessanter Artikel auf N24: Microsoft will Apple und Google jagen - http://www.n24.de/news/newsitem_6335153.html;;
3;1;Bill Gates did not drop out of Harvard to start Microsoft . First he started Traf-O-Data. That failed. Then he started Microsoft .;;
0;0;Microsoft , Yahoo! jostle for US search share (AFP) - http://newzfor.me/?7bid;;
1;0;Internet Explorer 9 : la riposte de Microsoft : Microsoft tente de reprendre la main sur le Web en lançant son nou... http://bit.ly/agY1Ij;;
0;0;Jungle (Animal Chess) : Jungle (Animal Chess) http://dlvr.it/5Y2Pl #Microsoft #Xbox;;#Microsoft #Xbox
0;0;Microsoft Nature Themes by Mike Swanson http://bit.ly/9LdfvB;;
0;0;@lottie2887 You'd think Microsoft Word would help him out at least. Maybe he thinks the red squiggles are decoration?;@lottie2887;
0;0;Microsoft tests new Web link: Uses may include easier Internet connections, remote monitoring of industrial system... http://bit.ly/cQ7Q61;;
0;0;Lmao fail! Microsoft is jumping too far ahead. Who is actually gonna do all th...(YouTube http://youtu.be/PlUdc5D5L_E?a);;
0;0;This official Microsoft theme turns your XP desktop into dark and shiny Zune inspired work space. http://www.redgage.com/c-gjaifd;;
0;0;Just one more spot left in our Beginning Microsoft Publisher class! Learn the basics of this awesome program on... http://fb.me/JHs27ZnT;;
0;0;Microsoft wants India among top 5 markets - Livemint http://bit.ly/9LcsQS;;
0;0;Kinect's software still in its infancy, says rival http://is.gd/f5Qtf #kinect #xbox @ign #msft @microsoft;@ign @microsoft;#kinect #xbox #msft
0;0;[TGS 2010] Cinco nuevos juegos anunciados para Kinect: Que Microsoft está apostando fuerte por Kinect parece más q... http://bit.ly/bkXFpi;;
0;0;Microsoft is not your friend. And so on.;;
0;0;#Ad @taletechpro artduane: Microsoft Releases Open Source Tools for the Cloud http://goo.gl/fb/RkWYd #Ad http://obrol.com;@taletechpro;#Ad #Ad
0;0;Microsoft .Net Developer Brasil group: By registering to be a member of the Microsoft .Net Developer Brasil group,... http://bit.ly/bl1Vat;;
0;0;Pareto Logic: The Microsoft support site refered me to Pareto Logics File Cure to resolve issues I have with type ... http://bit.ly/ckH0YB;;
0;0;From Blogs: Microsoft Tablet Cases & Accessories Buy Android Tablet Cheap: What is android tablet? An andr... http://bit.ly/bmOi4L #android;;#android
0;0;TBA IE 9 Beta, Windows Phone 7 Tools Marked Microsoft Week http://bit.ly/bfQFHW;;
0;0;Times are tough and any way entrepreneurs can save money is necessary. Technology is an important asset to all busine... #Linux #Microsoft;;#Linux #Microsoft
0;0;Microsoft LifeCam Studio Webcam With 1080p Full HD Sensor Overview ...: Microsoft has expanded its LifeCam portfol... http://bit.ly/a9T0Gj;;
0;0;Microsoft Nature Themes by Mike Swanson: Themes play an important part in increasing the beauty of the Windows int... http://bit.ly/ayX3S1;;
0;0;Information About Microsoft IE9 Beta | ABH News: After many months of previews the Microsoft 's IE9 beta Web browse... http://bit.ly/buuZBz;;
0;0;Extra Video to Zune Converter 6.97: Extra Video to Zune Converter - fast convert video to Microsoft Zune Player http://bit.ly/dgAmnP;;
0;0;Microsoft tests new Web link http://bit.ly/c2ZfIL;;
0;0;Microsoft tests new Web link http://bit.ly/c2ZfIL;;
0;0;Microsoft tests new Web link: Uses may include easier Internet connections, remote monitoring of industrial system... http://bit.ly/aHJ9pv;;
0;0;Microsoft tests new Web link: Uses may include easier Internet connections, remote monitoring of industrial system... http://bit.ly/cQ7Q61;;
0;0;Microsoft tests new Web link: Uses may include easier Internet connections, remote monitoring of industrial system... http://bit.ly/9XNTMs;;
0;0;Microsoft .Net Developer Brasil group: By registering to be a member of the Microsoft .Net Developer… .Net Develo... http://bit.ly/afOjpl;;
0;0;Another hot deal on Microsoft 7000 Wireless Keyboard & Mouse: Microsoft 7000 Wireless Keyboard & Mo... http://bit.ly/aD9WqW Check it out...;;
0;0;News on MS LifeCam Studio 1080p Webcam to Welcome Windows Live Messenger 2011: Microsoft has unve... http://bit.ly/9vMkJR #Mobile #Devices;;#Mobile #Devices
0;0;Microsoft ou Apple? — tentando esvaziar ç.ç http://4ms.me/aYt8J0;;
0;0;@jdadmays Facebook is the new Google is the new Microsoft;@jdadmays;
0;0;The Nintendo Wii is better than the Microsoft XBOX 360. Wii Sports is better than Halo Reach.;;
0;0;It's ELECTRIC!!!! Microsoft Publisher 2010: Microsoft Publisher 2010  $122.00 http://twurl.nl/csy0yk;;
0;0;Let's see apple makes a phone. Then google. Then Microsoft . Then Facebook. What's next the Linux phone?;;
0;0;Information About Microsoft IE9 Beta | ABH News http://bit.ly/93HimC;;
0;0;Information About Microsoft IE9 Beta | ABH News: After many months of previews the Microsoft 's IE9 beta Web browse... http://bit.ly/dhdmbu;;
0;0;Microsoft 's Live Search | Website Cluster: Live Search is the name of Microsoft 's Web search engine. Currently it ... http://bit.ly/bDsSJs;;
0;0;Microsoft LifeCam Studio Webcam With 1080p Full HD Sensor Overview ...: Microsoft has expanded its LifeCam portfol... http://bit.ly/9azpS2;;
0;0;Microsoft , Yahoo struggle for US search share : Ghana Business News: Yahoo! has long held that position but Micros... http://bit.ly/9MkgLD;;
0;0;Microsoft Nature Themes by Mike Swanson: Themes play an important part in increasing the beauty of the Windows int... http://bit.ly/aj0OOf;;
0;0;こんにゃく屋が豆腐屋に挑まない感じかなと @metal_president : なんで資本や人材に恵まれている日本の大企業は、 Microsoft やGoogleに挑もうとしないのでしょうね？？？してる？;@metal_president;
0;0;Microsoft , Yahoo! jostle for US search share (AFP) - http://newzfor.me/?7bid;;
0;0;Microsoft Releases Open Source Tools for the Cloud http://goo.gl/fb/RkWYd #Ad http://obrol.com;;#Ad
0;0;Buy: Microsoft WWE Smackdown vs Raw 2010 - Xbox360 (Suitable for ages 15+) WWE Smackdown vs Raw 2010 - Xb... http://bit.ly/aeOGyh;;
0;0;Microsoft logica: op start drukken om af te sluiten. #snapjehem;;#snapjehem
0;0;Installeer nu microsoft office 2007;;
0;0;101 Secrets of a Microsoft Excel Addict http://dlvr.it/5Y1sc;;
0;0;Microsoft espera que Kinect supere las ventas de iPad en su lanzamiento - Noticias de Videojuegos - 18/9/2010 http://safe.mn/CdJ;;
0;0;RT @ATaani : There's been a fire explosion at the Um Uthaina gas station. in Front of #Microsoft #Jordan Office , S... http://bit.ly/ckSnkD;@ATaani;#Microsoft #Jordan
0;0;Microsoft Releases Internet Explorer 9 Beta To Public: Just installed the Internet Explorer 9 and its just freakin... http://bit.ly/cqC7KD;;
0;0;Microsoft OLE DB Provider for ODBC Drivers error '80040e4d' [ODBC SQL Server Driver][SQL Server]Login failed for user 'DEWAS' -.- #blah;;#blah
0;0;Next stop sponsored by Microsoft ! http://yfrog.com/177qvuj;;
0;0;Gränssnittsutvecklare med Microsoft fokus http://lto.nu/bwZaMe #nyttjobb;;#nyttjobb
0;0;Gränssnittsutvecklare med Microsoft fokus http://lto.nu/bwZaMe #nyttjobb;;#nyttjobb
0;0;Microsoft , Yahoo! jostle for US search share (AFP) - http://newzfor.me/?7aid;;
0;0;Microsoft Office Small Business 2007 UPGRADE http://bit.ly/9ffGVt #Software ,Amazon #Amazon;;#Software #Amazon
0;0;RT @winforumsMicrosoft Touts HTML5 as IE 9 Performance Booster: Quote2010-09-16 SAN FRANCISCO – Microsoft rolled out the beta v... htt...;@winforumsMicrosoft;
0;0;Readers have spoken: No IE9 on XP is a mistake Microsoft will regret http://zd.net/bstLaf;;
0;0;Ynt: Mono Projesi hakkında ne düşünüyorsunuz?: Umarım ben haksız çıkarım ve Microsoft asla o ortamı yakalayamaz. http://bit.ly/cC3tx8;;
0;0;What took 'em so long?! RT @WindowsAzure : #Microsoft IT Starts Migration of Microsoft.com to Windows #Azure (.doc DL) http://bit.ly/a7bK8c;@WindowsAzure;#Microsoft #Azure
0;0;Microsoft Touts HTML5 as IE 9 Performance Booster: Quote2010-09-16 SAN FRANCISCO  Microsoft rolled out the beta v... http://bit.ly/9JYGRX;;
0;0;Disse que não podia confiar na estimatica da Microsoft . Falaram 2h terminou em menos de 15min o download. (Já vi esse filme antes!);;
0;0;Thanx God , No body get hurt at the fire explosion Um Uthaina gas station :) #Microsoft #Jordan;;#Microsoft #Jordan
0;0;update: Master Your Workload with Microsoft Outlook http://bit.ly/b4X6Hj;;
0;0;Laut Microsoft soll Kinect erfolgreicher als Apples iPad werden: Wie Entwickler Kudo Tsunoda in einem Interview be... http://bit.ly/cOgDA5;;
0;0;Microsoft ou Apple? — microsoft http://4ms.me/9fCpme;;
0;0;Did You Know You Can Pin Websites to Windows 7 Taskbar and Start Menu Using Microsoft Internet Explorer 9 (IE9) Be... http://bit.ly/9kkNwq;;
0;0;Microsoft Actually Decided Months Ago Not To Use Verizon As Windows Phone 7 Launch Partner http://fb.me/vfM6EG1K;;
0;0;Microsoft Actually Decided Months Ago Not To Use Verizon As Windows Phone 7 Launch Partner http://dlvr.it/5Y0KW;;
0;0;Windows Phone 7 to be on GSM Mobile Networks this Year: Microsoft felt, that it had to stop and decide what produc... http://bit.ly/d63TLR;;
0;0;Windows Phone 7 to be on GSM Mobile Networks this Year: Microsoft felt, that it had to stop and decide what produc... http://bit.ly/968drg;;
0;0;Microsoft : Eφαρμογές για το iPad(;) http://minotavrs.blogspot.com/2010/09/microsoft-e-ipad.html;;
0;0;There are already several mobile phone OSes on the market, with Microsoft 's Windows Phone 7 joining the fray i... http://zmarter.com/1113543;;
0;0;Acabo de ver una publicidad en Adwords de IE9. ¿Y Microsoft adCenter señores? ¿Se les hace chico? #fb;;#fb
0;0;Week in Microsoft : IE9 beta arrives http://bit.ly/9Zg4vV;;
0;0;Borja Prieto - Microsoft tampoco ganará la guerra de los smartphones http://bit.ly/dlw3O4;;
0;0;@JackStiefel Nevermind I see it in a previous tweet. You don't even have to zoom in. Did she(he) use Microsoft Paint for that? Horrible job.;@JackStiefel;
0;0;Today Only! Get the Microsoft Entity Framework pbook (http://bit.ly/aK6JJ5 ) for $25! Use code dotd0919tw at checkout.;;
0;0;http://yhoo.it/catnYJ - Yahoo! Organic Search Transition to Microsoft Now Complete;;
0;0;@XboxSupport So i just paid £19.99 for H3 when i already have the actual disc and Reach, thats unfair, microsoft need to sort themselves out;@XboxSupport;
0;0;I now love microsoft - they're opening a store right across from the apple store;;
0;0;@waddupDayDay Microsoft Office 2010 Standard Edition 32bit_thethingy.ISO;@waddupDayDay;
0;0;Microsoft , Yahoo! jostle for US search share (AFP) - http://newzfor.me/?7bid;;
0;0;Microsoft #fail . nothing unexpected here. Gave IE a shot after almost a year. IE8 Flawlessly imploded during installation. same old.;;#fail
0;0;Follow microsoft security in real-time. Use http://safe.mn/CcL to see the story unfold;;
0;0;Microsoft lança Internet Explorer 9: http://bit.ly/9ejWhD;;
0;0;Best I've found to crash a Mac is to run Microsoft software on it. Best way I've found to crash Windows is to run Apple software on it.;;
0;0;I seriously can't trust the legitimacy of Microsoft Word sometimes;;
0;0;A focused tutorial for Microsoft Dynamics NAV application development http://bit.ly/9AtLMs;;
0;0;E agora começa a "labuta" para atualizar o XP. Ainda bem que eu sei que a internet é rápida. Não dá p/ confiar na estimativa de Microsoft .;;
0;0;TBA IE 9 Beta, Windows Phone 7 Tools Marked Microsoft Week: Microsoft 's week saw the unveiling of Internet Explore... http://bit.ly/aYebYM;;
0;0;TBA IE 9 Beta, Windows Phone 7 Tools Marked Microsoft Week: Microsoft 's week saw the unveiling of Internet Explore... http://bit.ly/9VyfB1;;
0;0;TBA IE 9 Beta, Windows Phone 7 Tools Marked Microsoft Week: Microsoft 's week saw the unveiling of Internet Explore... http://bit.ly/9VyfB1;;
0;0;RT: New Wireless Networking Adapter For Microsoft XBOX 360 http://bit.ly/c6QZc9;;
0;0;RT: Microsoft Xbox 360 HDMI 20GB Kid Bundl Extra Controller http://bit.ly/9wTi0i;;
0;0;RT: NEW Wireless Networking Adapter For Microsoft XBOX 360 http://bit.ly/c1Tejt;;
0;0;Carmen's Raving Reviews: Microsoft Notebook Optical Mouse http:// carmensravingreviews.blogspot.com/2010/09/micros oft-notebook-optical-mouse.html?spref=tw … via @blogger;@blogger;
0;0;Microsoft , Yahoo! jostle for US search share (AFP) - http://newzfor.me/?7bid;;
