retweets;favorites;text;mentions;hashtags
0;0;Microsoft slates 7 security updates for next week, resurrects Exchange fix http:// goo.gl/mik3XL;;
0;0;The sheer lack of a question mark in Microsoft Office SmartArt disgusts me.;;
0;0;With immigration, privacy ahead, Microsoft CEO reaches out to Hill - Politico http:// goo.gl/fb/Xr53M6;;
0;1;Gostei de um vídeo @YouTube http:// youtu.be/uEP1nffkyMc?aH oje … no TecMundo (09/12) - preço do Note Edge, G Watch R2, Microsoft contra;@YouTube;
0;2;#Microsoft to start previewing #Office365 video service- a tool to share videos within the #workplace http:// channel9.msdn.com/Blogs/DevRadio /How-to-Build-a-Recommendation-Engine-using-Azure-Machine-Learning-and-Azure-Mobile-Services … via @ch9;@ch9;#Microsoft #Office365 #workplace
1;0;Microsoft broadens government cloud offerings -- GCN http:// gcn.com/articles/2014/ 12/09/microsoft-government-cloud.aspx … via @GCNtech;@GCNtech;
0;0;Microsoft cuts price of unlocked Windows Phone handset to $129 http:// cnet.co/12J8Yqp;;
3;8;Microsoft cofounder funds new institute for cell science: http:// ow.ly/FDpIp;;
0;0;Microsoft Optical Mouse 200 - Black http:// goo.gl/0dZOCm;;
0;0;The Microsoft Engine That Nailed The World Cup Is Predicting Every NFL Game — Here Are Its Picks For (Tony… http:// dlvr.it/7mpYbJ;;
1;0;Port Alberni graduates holding @Microsoft Office certificates. Way to go! http:// ow.ly/i/7SNnN;@Microsoft;
0;2;#Microsoft @Azure is partnering with @ubuntu on Snappy Ubuntu Core (the more cloud-optimized container-based #Ubuntu ) http://www. ubuntu.com/cloud/tools/sn appy …;@Azure @ubuntu;#Microsoft #Ubuntu
0;0;New post: Microsoft To US Gov&#039;t: the World&#039;s Servers Are Not Yours For the Taking http:// bit.ly/1wwj0cp;;#039 #039
0;0;ZDI-14-409: #Microsoft Internet Explorer CInputElement Type Confusion #Remote Code #Execution Vulnerability http:// feedproxy.google.com/~r/ZDI-Publish ed-Advisories/~3/LNmDoZnK4Hk/ … #ZDI;;#Microsoft #Remote #Execution #ZDI
0;1;@RamontambienRay @sigroneta 50 puntos de microsoft .;@RamontambienRay @sigroneta;
0;0;■マイクロソフトオフィス販売中■ ホームページ、店頭にてマイクロソフトオフィスの販売も行ってます(^^) 最新版はインストール方法が今までと変わっておりますが、店頭では導入サポートも行っております(^o^)v http:// bit.ly/1xSzUgu #microsoft;;#microsoft
0;0;#microsoft releases #security bulletin https://www. us-cert.gov/ncas/current-a ctivity/2014/12/09/Microsoft-Releases-December-2014-Security-Bulletin …;;#microsoft #security
0;0;[ACTUALIZADA] Nokia elimina el acceso con cuenta Microsoft a las ... - Microsoft … http:// goo.gl/fb/7clzhB #nokia;;#nokia
1;0;New post: #CrystalDynamics #Microsoft #News ‘Rise of the Tomb Raider’ to be Published by Microsoft http://www. infocrowler.com/gaming/rise-of -the-tomb-raider-to-be-published-by-microsoft.html?utm_campaign=twitter&utm_medium=twitter&utm_source=twitter …;;#CrystalDynamics #Microsoft #News
0;0;I just want to dropkick Microsoft . Brand new X box one and the damn thing keeps freezing .;;
0;0;Microsoft sues AT&T customer for activating pirated copies of Windows 7 ... - Network World http:// goo.gl/fb/qKHQ4t;;
0;0;MicroSoft Store http:// click.linksynergy.com/fs-bin/click?i d=RI0ZGM73Ukg&offerid=336830.10001114&type=3&subid=0 … ... http:// fb.me/73NA7h3LR;;
0;0;Microsoft to deliver Office 365 and Microsoft Dynamics CRM Online from Australian datacenters https:// lnkd.in/bfDEUmS;;
0;0;Microsoft : We challenge you to learn to code. Do your #HourOfCode now.: Through coding, you can make apps, gam... http:// bit.ly/1vL4POU;;#HourOfCode
0;0;Microsoft announces U.S. general availability of Microsoft Azure Government http:// on.mktw.net/1zqwBku;;
0;0;#Microsoft insistsfeds can’t take datastored in #Ireland #MicrosoftServer http:// j.mp/1waIwSD;;#Microsoft #Ireland #MicrosoftServer
0;0;これほしい → 「 Microsoft Band」は予想以上、最高水準のウエアラブル！真の狙いは健康管理データ解析 http:// techon.nikkeibp.co.jp/article/FEATUR E/20141202/391965/?n_cid=nbptec_tecrs …;;
0;0;http:// amzn.to/1raI4l9 The Microsoft Engine That Nailed The World Cup Is Predicting Every NFL Game ... - Business… http:// dlvr.it/7mpS5j;;
0;0;【 Microsoft 】 プロスポーツ界に進出するタブレット--MS製「Surface」を導入した米NFLの試み http:// dlvr.it/7mpSmd #Microsoft;;#Microsoft
0;0;#Microsoft Wants Shareholders to Know 3 Things About #Windows 10: Motley Fool: While Windows 8 was clearly a s... http:// bit.ly/1vLStpz;;#Microsoft #Windows
0;0;Technology Stock Roundup: Tech Stocks Down But #MSFT /INTC Gain: http:// Zacks.com : #Microsoft /BKS Part Way... http:// bit.ly/1vLSt9e;;#MSFT #Microsoft
0;0;Accenture, Microsoft Team Up to Take Enterprises to the Hybrid Cloud http:// bit.ly/1zphmIJ #cms #ecm;;#cms #ecm
0;0;Microsoft et Accenture présentent Accenture Hybrid Cloud Solution, une solution pour faciliter le déploiement de... http:// fb.me/7exDOqfdG;;
0;0;Gostei de um vídeo @YouTube http:// youtu.be/uEP1nffkyMc?aH oje … no TecMundo (09/12) - preço do Note Edge, G Watch R2, Microsoft contra;@YouTube;
0;0;Microsoft announces U.S. general availability of Microsoft Azure Government #ym http:// zite.to/1yxlbwA;;#ym
0;0;Microsoft Patch Tuesday addresses Exchange and Explorer flaws http:// dlvr.it/7mpYRM pic.twitter.com/Tc2WwuQrbc;;
0;0;December 2014 Patch Tuesday Releases 7 Fixes, Addresses Microsoft Exchange Bug, http://www. netsecu.org/i/2544fca19 #security;;#security
0;0;Microsoft will disable fallback to SSL 3.0 in IE11 on February 10, still has no… http:// dlvr.it/7mpT1l #microsoft pic.twitter.com/RLsDGA4Dx4;;#microsoft
0;1;Full house for Microsoft session at #GartnerAADI . Seems lots of people want to know how to start their Cloud journey @AvanadeInc;@AvanadeInc;#GartnerAADI
0;0;I liked a @YouTube video from @sean_ong http:// youtu.be/wG1b0yBJHLM?a Why I Love my Microsoft Surface 2 : Tips and Tricks;@YouTube @sean_ong;
0;0;@MSStudiosBlog can you tell the head of Microsoft to call the FBI. On #LizardSquad they are hacking Xbox please do >:(;@MSStudiosBlog;#LizardSquad
2;0;Microsoft Will Publish Rise of the Tomb Raider http:// ift.tt/1Acj4vf;;
0;0;¡Ultimas Noticias Microsoft está disponible! http:// paper.li/Jhuess/1308242 118 … Gracias a @campusMVP;@campusMVP;
0;0;I want my Microsoft;;
1;6;Microsoft TechDays 2015, soyez au cœur du plus grand événement informatique européen ! - #mstechdays https://www. microsoft.com/france/mstechd ays/default.aspx?v=2015 … #mstechdays;;#mstechdays #mstechdays
0;0;This Week's Xbox One/360 Deals for Gold Members: Microsoft has announced this week's list of Xbox One and Xbo... http:// l.gamespot.com/1zLiTqD;;
0;0;Je suis limite prêt à payer pour avoir Microsoft Word, CM Libre office;;
0;0;Microsoft 78-702 final examination: kCPGWlB;;
0;1;A jobless man applied for the position of 'office boy' at Microsoft . https://www. linkedin.com/today/post/art icle/20141124082724-134769546-a-jobless-man-applied-for-the-position-of-office-boy-at-microsoft … #entrepreneur #DreamBigger #inspiration;;#entrepreneur #DreamBigger #inspiration
0;0;Minecraft - Xbox One by Microsoft 95% Sales Rank in Video Games: 21 (was 41 yesterday… http:// goo.gl/fb/nLw8lw;;
1;0;#Minecraft #XboxOne Solo Survival Episode 2: Creeper Scouting http:// youtu.be/JL2fiLvwxqM #Microsoft #SoloSurvival #Creeper;;#Minecraft #XboxOne #Microsoft #SoloSurvival #Creeper
0;1;Gostei de um vídeo @YouTube http:// youtu.be/uEP1nffkyMc?aH oje … no TecMundo (09/12) - preço do Note Edge, G Watch R2, Microsoft contra;@YouTube;
0;1;Microsoft To US Gov't: the World's Servers Are Not Yours For the Taking http:// bit.ly/1B3EADi #TechNews;;#TechNews
0;0;Saya suka video @YouTube http:// youtu.be/--r51h9kKw0?a COMO CONSEGUIR CODIGOS XBOX LIVE GOLD GRATIS 2014 | CONSEGUIR PUNTOS MICROSOFT;@YouTube;
0;0;(12 Days of Deals 12/10/14) Xbox One Unity Bundle w/ up to 2 free select games - $349 - Microsoft Store http:// ift.tt/12pluM1;;
0;0;The Microsoft Engine That Nailed The World Cup Is Predicting Every NFL Game ... - Business… http:// goo.gl/fb/G5ygzz;;
0;0;Btw, tengo 1783 MB para descargar. MICROSOFT ATREVIDA LOCA;;
0;0;Microsoft releases Azure Government for the unique needs of government customers: Moving companies to the clou... http:// binged.it/134pBy6;;
0;0;Microsoft releases Azure Government for the unique needs of government customers: Moving companies to the clou... http:// binged.it/134pBy6;;
0;0;Microsoft é a primera a trazer o novo Core do Ubuntu par aa Cloud http:// wp.me/p5s5tH-b;;
0;0;Microsoft To US Gov't: the World's Servers Are Not Yours For the Taking http:// dlvr.it/7mpRyN #business #marketing;;#business #marketing
0;0;Game News: This Week's Xbox One/360 Deals for Gold Members: Microsoft has announced this week's list of Xbox ... http:// tinyurl.com/oq54ehc;;
0;0;Vigilance - Microsoft NET déni de service via collision de hachés, analysé le 09 09 2014- Secu Obs http:// dlvr.it/7mpTNH via@Bitin;@Bitin;
0;0;Microsoft Patch Tuesday December 2014- Secu Obs http:// dlvr.it/7mpR5v via@Bitin;@Bitin;
0;0;Microsoft To US Gov't: the World's Servers Are Not Yours For the Taking;;
0;0;Microsoft To US Gov't: the World's Servers Are Not Yours For the Taking http:// dlvr.it/7mpR4c;;
0;0;Vigilance - Microsoft Lync multiples vulnérabilités, analysé le 09 09 2014- Secu Obs http:// dlvr.it/7mpVWL via@Bitin;@Bitin;
0;0;Microsoft To US Gov't: the World's Servers Are Not Yours For the Taking http:// dlvr.it/7mpW1k;;
0;0;Finally getting some time to play with Microsoft shared mobile platform offering #UniversalApps Does what it says on the tin so far.;;#UniversalApps
0;0;Microsoft confirms Rise of the Tomb Raider publishing plans http:// aol.it/1B2txKy;;
0;0;Microsoft To US Gov't: the World's Servers Are Not Yours For the Taking http:// rss.slashdot.org/~r/Slashdot/sl ashdot/~3/K7J0z5OsQkY/story01.htm … via @feedly;@feedly;
0;0;Gratuitous microsoft bashing. Charming.;;
0;0;GIVEAWAY $15 Microsoft Card//THE DARK BELOW HYPE\\ [XB1] http://www. twitch.tv/stickyickytast ic … via @Twitch;@Twitch;
0;1;Love opening Ubuntu core 'Snappy' quote from Microsoft VP - " Microsoft loves Linux..." http://www. ubuntu.com/cloud/tools/sn appy … (well, I'm off to eat my hat!);;
0;0;Microsoft weed;;
0;0;Microsoft Xbox 360 chatpad - Authentic microsoft xbox 360 chat pad works great this is for the xbox http:// pinterest.com/pin/3435402778 00405939/ …;;
0;0;Microsoft Update が完了。PC の再起動も完了。;;
0;0;Microsoft Officeがなくても、無料でExcelやWordを利用する方法 http:// bit.ly/1lsFMGz;;
0;0;Microsoft To US Gov't: the World's Servers Are Not Yours For the Taking: Microsoft is currently fighting a leg... http:// bit.ly/1ujaEi5;;
0;0;[Slashdot] Microsoft To US Gov't: the World's Servers Are Not Yours For the Taking: http:// rss.slashdot.org/~r/Slashdot/sl ashdot/~3/K7J0z5OsQkY/story01.htm …;;
0;0;Next Lock Screen, la aplicación de Microsoft para Android se actualiza http:// wp.me/p5p8Te-5z;;
0;0;Microsoft To US Gov't: the World's Servers Are Not Yours For the Taking: Microsoft is currently fighting a leg... http:// bit.ly/1ujaDdU;;
0;0;Microsoft To US Gov't: the World's Servers Are Not Yours For the Taking: Microsoft is currently fighting a leg... http:// bit.ly/1ujaEi5;;
0;0;Microsoft Will Publish Rise of the Tomb Raider http:// gamebuzztoday.com/microsoft-will -publish-rise-of-the-tomb-raider/ … #VideoGameNews #VideoGames pic.twitter.com/QFGfzMufVQ;;#VideoGameNews #VideoGames
0;0;Microsoft To US Gov't: the World's Servers Are Not Yours For the Taking: Microsoft is currently fighting a leg... http:// bit.ly/1ujaDdU;;
0;0;Microsoft To US Gov't: the World's Servers Are Not Yours For the Taking: Microsoft is currently fighting a leg... http:// bit.ly/1ujaEi5;;
0;0;Microsoft To US Gov't: the World's Servers Are Not Yours For the Taking: Microsoft is currently fighting a leg... http:// bit.ly/1ujaEi5;;
1;0;Microsoft To US Gov't: the World's Servers Are Not Yours For the Taking: Microsoft is currently... http:// go.techn.co/LvO #Tech #Privacy;;#Tech #Privacy
0;0;Microsoft To US Gov't: the World's Servers Are Not Yours For the Taking: Microsoft is currently fighting a leg... http:// bit.ly/1ujaF5s;;
0;0;Microsoft To US Gov't: the World's Servers Are Not Yours For the Taking: Microsoft is currently fighting a leg... http:// bit.ly/1ujaCXs;;
0;0;Microsoft To US Gov't: the World's Servers Are Not Yours For the Taking http:// bit.ly/1ujaF5s;;
0;0;Microsoft To US Gov't: the World's Servers Are Not Yours For the Taking http:// bit.ly/1ujaEi5 #Tech @slashdot;@slashdot;#Tech
0;0;Slashdot News Microsoft To US Gov't: the World's Servers Are Not Yours For the Taking: Microsoft is currently ... http:// ln.is/bit.ly/OQLmS;;
0;0;Microsoft To US Gov't: the World's Servers Are Not Yours For the Taking: Microsoft is currently fighting a leg... http:// bit.ly/1ujaEi5;;
0;0;Microsoft To US Gov't: the World's Servers Are Not Yours For the Taking http:// bit.ly/1ujaEi5 ( @Slashdot );@Slashdot;
0;0;Microsoft To US Gov't: the World's Servers Are Not Yours For the Taking http:// bit.ly/1ujaEi5;;
0;0;Microsoft Officeがなくても、無料でExcelやWordを利用する方法 http:// bit.ly/1lsFMGz;;
0;0;Microsoft Officeがなくても、無料でExcelやWordを利用する方法 http:// bit.ly/1lsFMGz;;
1;0;#Microsoft Demystifying Cloud Development session pretty full. Seems to have lots of interest at #GartnerAADI;;#Microsoft #GartnerAADI
0;0;Microsoft releases Azure Government for the unique needs of government customers http:// ift.tt/1ujaBTc #windows;;#windows
0;0;New Moodle integrations with Microsoft technology are on the way http:// ift.tt/1Iwln2b #windows;;#windows
0;0;MS14-081 - Critical: Vulnerabilities in Microsoft Word and MS Office Web Apps Could Allow Remote Code Execution https:// technet.microsoft.com/en-us/library/ security/MS14-081 …;;
0;1;Microsoft Azure blog> Azure HDInsight Introduces Built-in Integration with Azure Websites to do Web Log Analytics http:// ln.is/bit.ly/1FKBs;;
0;2;Microsoft Bandを手に入れたので、いろいろと試している http://www. kako.com/blog/?p=3128;;
0;0;World’s Youngest Microsoft Employee Has Yet to Graduate … Kindergarten http:// ow.ly/FeCJz http:// fb.me/1qFG7ql45;;
0;0;World’s Youngest Microsoft Employee Has Yet to Graduate … Kindergarten http:// ow.ly/FeCJz;;
0;0;http:// ift.tt/1wdEN5k Microsoft Xbox Black (NTSC) bundle with 8 controllers and 38 games #starwars #Theforceawakens;;#starwars #Theforceawakens
0;0;http:// ift.tt/1vghLuj #Deals #0101 New 20GB 20G 20 GB HDD Hard Drive Disk for Microsoft Xbox 360 Console Slim ... pic.twitter.com/adsuTxXHOB;;#Deals #0101
0;1;［TechTargetジャパン］モバイルとクラウド、「Office」を育てる：「Windows」頼みはもう卒業、 Microsoft の“次の一手”は？ http:// bit.ly/1D5xjI5;;
0;0;Why Microsoft Dynamics NAV 2015 makes PowerShell more important than ever http:// ow.ly/FAeBQ;;
0;3;Learning Microsoft Excel is pretty hard but its all for a good cause, the test on friday #workhard#playhard#live#love#laugh#kw#dublin;;#workhard #playhard #live #love #laugh #kw #dublin
0;0;Recent Microsoft Azure Outage Makes the Case for Cloud Caution — And Finding a Trusted Partner to Lead the Way http:// fb.me/74uADvuAn;;
0;0;Accenture Aligns with Microsoft on Hybrid Cloud: What You Need to Know http:// ow.ly/FCqlz via @talkin_cloud;@talkin_cloud;
0;0;Microsoft , Accenture Team for Hybrid Cloud Platform http:// ow.ly/FD1O4 #Microsoft #Accenture;;#Microsoft #Accenture
0;0;Microsoft introduces #Bingpowered wearable #app for #Android http:// bit.ly/1qntW9E;;#Bingpowered #app #Android
0;0;Microsoft is publishing Rise of the Tomb Raider - http:// bit.ly/1uhy7iC pic.twitter.com/EdtWFjQGgA;;
0;0;@shanselman can't believe I read " Microsoft Loves Linux..." by Bob Kelly, @Microsoft 's Vice President. WTH did you guys do to @Microsoft ?;@shanselman @Microsoft @Microsoft;
0;0;Microsoft Office 2011 14.4.7 Update (アップデーター) Microsoft 社製、Office スイート。 http:// hello-mac.com/?p=20253;;
0;0;Microsoft atnaujino Office for Mac 2011 aplikacijų paketą (14.4.7) #Office #Mac #Update #MSFT http:// wp.me/p3Ceyk-3qf;;#Office #Mac #Update #MSFT
0;0;Microsoft atnaujino Office for Mac 2011 aplikacijų paketą (14.4.7) #Office #Mac #Update #MSFT http:// wp.me/p3Ceyk-3qf;;#Office #Mac #Update #MSFT
0;0;@Microsoft Mr Know it all, elite. Arrogant.;@Microsoft;
0;0;job #ITJob #Job #Ottawa - MicroSoft Dynamics Business Analyst http:// dlvr.it/7mpKBt ☜ view full details;;#ITJob #Job #Ottawa
0;0;This site is giving away Free Microsoft Points #XBOX LIVE http:// xbox.freeredeem.com /;;#XBOX
0;0;Sports (App) newly tagged " microsoft " http:// amzn.to/1B3DbwB;;
0;0;Water Resistant Women's 11 inch MacBook Air Laptop Sleeve Case Cover, Microsoft Surface, All 11"… http:// dlvr.it/7mpJDD #etsy #cases;;#etsy #cases
0;0;～ Microsoft 、来年2月にIE11のSSL3.0へのフォールバックを無効にする予定～ https://www. facebook.com/FukushimaCompu terSystem/posts/807178109341150 …;;
0;0;Windows 10 als Gratisupdate: Microsoft dementiert Gerüchte http:// bit.ly/134p3YW;;
0;0;Google geht mit Microsoft : Kostenlose Cloud für Windows-Nutzer http:// bit.ly/12pkyHm;;
0;0;Microsoft Releases Critical IE Security Update on Patch Tuesday: Microsoft released seven security b... http:// bit.ly/1zquUDC #security;;#security
0;0;I finally have a reason to love doing english reports for school... I love microsoft office 2013 pic.twitter.com/OprET1ptWc;;
0;0;Manager, SAP BI ( Microsoft Sql) - Broadcom - Irvine, CA US http:// bit.ly/12pkzLt #jobs #sapbi;;#jobs #sapbi
0;0;Developpez : La stratégie de Microsoft concernant des développements de produits et services sur d'autres... #Android http:// tr4.kr/d76789;;#Android
0;0;Microsoft 、7件のセキュリティ情報を公開　「緊急」は3件 - ITmedia エンタープライズ http://www. itmedia.co.jp/enterprise/art icles/1412/10/news053.html …;;
0;1;Gostei de um vídeo @YouTube http:// youtu.be/uEP1nffkyMc?aH oje … no TecMundo (09/12) - preço do Note Edge, G Watch R2, Microsoft contra;@YouTube;
3;0;Microsoft insistsfeds can’t take datastored in Ireland http://www. sfchronicle.com/business/artic le/Microsoft-insistsfeds-can-t-take-datastored-in-5945928.php?t=308a8bedd4&cmpid=twitter-desktop … via @sfchronicle;@sfchronicle;
0;0;Microsoft is Publishing Rise of the Tomb Raider http:// ift.tt/1Ggv2Gb Eric Frederiksen;;
0;0;Some news from WMPowerUser - Microsoft Lumia Poland shows us how to make cool steadycams using household objects http:// bit.ly/1IwkPJM;;
1;1;Microsoft License Mobility Available for Google Cloud #cloudcomputing http:// bit.ly/164hzGp;;#cloudcomputing
0;0;Skypeと Microsoft Lync間のビデオ通話が可能に - ITmedia ニュース http://www. itmedia.co.jp/news/articles/ 1412/06/news016.html …;;
0;0;Переиздание Microsoft Flight Simulator X скоро появится в Steam http:// ow.ly/2RPhPf;;
0;0;@Microsoft def Harry Potter with a mouse instead of a wand;@Microsoft;
0;0;Microsoft oltre Windows http:// ow.ly/2RPifm;;
0;0;I'm usually an advocate for open-source software (OBS is the shit) but I haven't found a more reliable office suite than Microsoft Office.;;
0;0;BizInsider: The Microsoft Engine That Nailed The World Cup Is Predicting Every NFL Game — Here Are Its Picks For W... http:// ow.ly/2RPhB4;;
0;0;Gostei de um vídeo @YouTube http:// youtu.be/uEP1nffkyMc?aH oje … no TecMundo (09/12) - preço do Note Edge, G Watch R2, Microsoft contra;@YouTube;
0;0;Btw after Microsoft buy Nokia, now you must re-log in to HERE maps. Named HERE account not Nokia account anymore. #HERE #Lumia;;#HERE #Lumia
0;0;@GABRlELPINHEIRO o da microsoft é o primo dele o controlaltdel.;@GABRlELPINHEIRO;
0;0;Every time I open Microsoft ’s Office for Mac OS X, there is a ton of updates available. That’s how often I use it…;;
0;0;#ITSecurity : December 2014 Patch Tuesday Releases 7 Fixes, Addresses Microsoft Exchange Bug http:// ow.ly/2RPi43;;#ITSecurity
0;0;The Microsoft Engine That Nailed The World Cup Is Predicting Every NFL Game — Here Are Its Picks For Week 15 http:// ow.ly/2RPhIt;;
0;0;@day9tv @Twitch @EvilGeniuses @EGJaedong @AHGLtv That would the funniest thing on the planet. xD I guess it'll stop Microsoft from winning;@day9tv @Twitch @EvilGeniuses @EGJaedong @AHGLtv;
0;0;#startups Microsoft Azure Government Comes Out Of Preview - TechCrunch http:// ow.ly/2RPgFn;;#startups
0;0;Microsoft Officeがなくても、無料でExcelやWordを利用する方法 http:// bit.ly/1lsFMGz;;
0;0;Microsoft Excel Top Tip Number 27 #Training #IT #Excel http:// goo.gl/SCtfj1 pic.twitter.com/XwPV2OPHKU;;#Training #IT #Excel
0;0;#Microsoft insistsfeds can’t take datastored in #Ireland http:// j.mp/1yxjajW #MicrosoftServer;;#Microsoft #Ireland #MicrosoftServer
0;0;No more finals! Time to actually sleep and never see Microsoft Word ever again!;;
6;1;No sé que me impresiona más, si el Microsoft <3 Linux o ver Azure en la web de Ubuntu http://www. ubuntu.com/cloud/tools/sn appy … , mola, y mucho #Dev @msdev_es;@msdev_es;#Dev
0;0;" @Azure_France : Microsoft <3 Linux - En direct de l' #azurecamp http:// bit.ly/AzureCamp-2014 pic.twitter.com/LgUSZL1FRH ";@Azure_France;#azurecamp
0;0;MS14-081 - Critical: Vulnerabilities in Microsoft Word and #MicrosoftOffice Web Apps Could Allow Remote Code Executio: http:// tinyurl.com/k7zms25;;#MicrosoftOffice
0;0;#surface NEW Microsoft Surface Pro 3 64GB w/ Black Type Cover + Headphone +Speakers +Hdmi: $849.00 (0 Bids)En... http:// tinyurl.com/k6z7dzk;;#surface
0;0;Seattle Business - Mr. Nadella goes to Washington (D.C.): Here's what Microsoft wants from politicians in 2015 http:// ow.ly/2RPgIP;;
0;0;#surface Sealed&Never Opened Microsoft Surface 2 32GB, Windows 8.1, Full MS-Office: $287.00 (0 Bids)End Date:... http:// tinyurl.com/kykhkny;;#surface
6;0;#1337day Microsoft Internet Explorer CInputElement Type Confusion Remote Code Execution Vulnerabili [ #0day #Exploit ] http:// dlvr.it/7mpKwt;;#1337day #0day #Exploit
0;0;#tech Microsoft Azure Government Comes Out Of Preview - TechCrunch http:// owl.li/2RPgFq;;#tech
4;0;#1337day Microsoft Internet Explorer RtfToForeign32 Out-Of-Bounds Indexing Remote Code Execution Vu [ #0day #Exploit ] http:// dlvr.it/7mpKnf;;#1337day #0day #Exploit
17;13;#1337day Microsoft Internet Explorer Insert Command Use-After-Free Remote Code Execution Vulnerabil [ #0day #Exploit ] http:// dlvr.it/7mpN6w;;#1337day #0day #Exploit
4;1;#1337day Microsoft Internet Explorer CTreePos Use-After-Free Remote Code Execution Vulnerability [ #0day #Exploit ] http:// dlvr.it/7mpQh0;;#1337day #0day #Exploit
5;1;#1337day Microsoft Internet Explorer CSetTimeoutInfo Use-After-Free Remote Code Execution Vulnerabi [ #0day #Exploit ] http:// dlvr.it/7mpMNG;;#1337day #0day #Exploit
0;0;I just realized today that Microsoft makes the Facebook app for Windows Phone. Neat.;;
0;0;New on Ebay Battlefield 4 for Microsoft Xbox One http:// ift.tt/1waL9DO pic.twitter.com/yM09BiPgSM;;
0;0;@LumiaSoporte @aiturralde como hago para recuperar la contraseña de Microsoft sin ella no se me actualizan las aplicaciones. Muchas gracias.;@LumiaSoporte @aiturralde;
0;0;На Xbox Rise of the Tomb Raider издаст Microsoft http:// dlvr.it/7mpQBq;;
0;1;Microsoft announces US general availability of Microsoft #Azure Government http:// news.microsoft.com/2014/12/09/mic rosoft-announces-general-availability-of-microsoft-azure-government/ …;;#Azure
1;2;Just finished roundtable with @satyanadella CEO of @Microsoft on issues facing the tech community. pic.twitter.com/KVrSceQrvB;@satyanadella @Microsoft;
0;0;Test4pass microsoft games 70-270 quiz frumps questions answers: PcCYwt;;
0;0;I have to say this is the first week where that Apple truly feels to me like Microsoft circa 1994-2002. & Facebook feels like Hotmail. Not …;;
0;0;Every time the new Microsoft advert comes on I just have a sing along to 2NE1;;
0;0;Microsoft Office Expands Document Inspector To Check Embedded Documents http:// ift.tt/1B3AXgO;;
0;0;Get Your FREE Microsoft Points Card Pins For A Limited Time: http:// freemicrosoftpoints.cc/#.VId_UbCr9mU. twitter …;;#
0;0;Microsoft revamping MSN http://www. ziddu.com/view/2788/tech nology/microsoft-revamping-msn/atbzzngg#.VIeAXfnAIeg.twitter …;;#
0;0;eBay UK: Microsoft Xbox One (Latest Model) - 500 GB Black Console (Without Kinect): £245.00 (2 ... http:// ebay.to/1zLCbfw #Consoles #UK;;#Consoles #UK
0;0;December 2014 Patch Tuesday Releases 7 Fixes, Addresses Microsoft Exchange Bug: This year’s last installment o... http:// bit.ly/1wYltvL;;
0;1;When we all wake up for Dec.25 Xbox Will Have a Nice Cool Xmas Present Just waiting on them to open #LizardSquad #Microsoft #xboxsupport;;#LizardSquad #Microsoft #xboxsupport
0;0;Microsoft Flight Simulator X llegará a Steam http:// ift.tt/12pjqUi;;
0;0;@Microsoft awww a young Bill Gates :-);@Microsoft;
0;0;A Microsoft app on Android? Try Next Lock Screen: http:// bit.ly/1Ab9mcg #Google + #Microsoft #Bing #GooglePlay pic.twitter.com/jBl56KJXuB;;#Google #Microsoft #Bing #GooglePlay
0;0;Microsoft Hints at New Pricing Model for Windows | Paul Thurrott's SuperSite for Windows http:// nzzl.me/1D5uXJa via @nuzzel;@nuzzel;
0;0;[TrendLabs] December 2014 Patch Tuesday Releases 7 Fixes, Addresses Microsoft Exchange Bug http:// ow.ly/2RPesR;;
0;0;Microsoft и Accenture совместно планируют гибридную облачную платформу для бизнеса http:// bit.ly/12pjkMh;;
0;0;“@senshudotv: Steam release date for Microsoft Flight Simulator X - http:// bit.ly/1zL5WNI ” @celtsclan CeltS boys love that game;@senshudotv @celtsclan;
