retweets;favorites;text;mentions;hashtags
0;1;"Dória ensina gestão:juntar as pontas da oferta e demanda - parceria com a Microsoft " https://www. linkedin.com/pulse/dória-en sina-gestão-como-juntar-pontas-da-oferta-e-demanda-caxito … by @fabianocaxito on @LinkedIn;@fabianocaxito @LinkedIn;
0;0;Microsoft is testing Ruuh, an English-speaking AI chatbot aimed at the Indian market (Mary Jo Foley/ZDNet) http:// bit.ly/2o9BReG;;
1;0;Microsoft launches Ruuh, yet another AI chatbot http:// twib.in/l/KzreXn5nnay7 via @maryjofoley pic.twitter.com/T7c9FDkro4;@maryjofoley;
0;0;Publicly Attacked #Microsoft IIS #ZeroDay Unlikely to be Patched https:// threatpost.com/publicly-attac ked-microsoft-iis-zero-day-unlikely-to-be-patched/124641/ … #IT #Tech #InfoSec #Security;;#Microsoft #ZeroDay #IT #Tech #InfoSec #Security
0;0;#9: Microsoft Windows 8.1 Pro - Sistemas operativos (Original Equipment... #software http:// tinyurl.com/ksvdkeh pic.twitter.com/hfXzBaiiG3;;#9 #software
0;0;New reasons to make Microsoft Bookings the go-to scheduling software for your business - Office Blogs http:// buff.ly/2nT8Vak;;
0;2;PSOD seriously !!! @Microsoft @Dell pic.twitter.com/FBBXL17qB7;@Microsoft @Dell;
0;0;@Microsoft ha creado una nube confiable, responsable e incluyente para construir nuevos empleos, oportunidades y empoderar a los mexicanos;@Microsoft;
0;0;To feliz que agora o meu email institucional é do Google e não mais da Microsoft , G Suite é outra vida;;
0;0;go home, Microsoft .;;
0;0;Microsoft MB2-717 Exam Actual Questions (Updated 29 Mar 2017) – Latest Version http:// dlvr.it/NlqMP6 pic.twitter.com/LE0hfMOgxh;;
0;0;Microsoft MB2-717 Exam Actual Questions (Updated 29 Mar 2017) – Latest Version http:// dlvr.it/NlqMHY pic.twitter.com/Q5mYG3xhQ9;;
0;0;both of you should regard C#as a historical artifact that Microsoft uses to relate to its aging customers (like me);;#as
0;0;Palestra de programas Microsoft #ventotecnologia #soubemfloripa #cdljovemflorianopolis #florianopolis #webdesigner #website #work #cofebreak pic.twitter.com/Re4vpfkIHN – bei CIA - Centro de Inovação Acate;;#ventotecnologia #soubemfloripa #cdljovemflorianopolis #florianopolis #webdesigner #website #work #cofebreak
0;0;Bad Default Settings Cause Microsoft Office 365 Vulnerability - Hashed Out by The SSL Store™ (registration) (blog) http:// dlvr.it/NlqLXR;;
0;1;Microsoft now testing Ruuh, its latest AI chatbot http:// buff.ly/2ocznMH pic.twitter.com/gUVaVn2obB;;
0;0;Este año los participantes parecen haberse enfocado bastante en el navegador de Microsoft . Varios de los equipos... http:// fb.me/6l8a288jF;;
0;2;Victory Press Release: I start my new Job at Microsoft on Monday. Nervous /excited.;;
0;0;Interested in learning more about how @Microsoft runs on #trust ? Check out the fol. story in the latest issue of our magazine #ethics https:// twitter.com/bradsmi/status /847218813091196929 …;@Microsoft;#trust #ethics
0;0;Wow. One-half of WaggEd's founding team is gone. ( Microsoft 's original PR firm) Condolences to the team and Pam's family. https:// twitter.com/melissawz/stat us/847186959646605313 …;;
0;0;Microsoft MB2-717 Exam Actual Questions (Updated 29 Mar 2017) – Latest Version http:// dlvr.it/NlqLGD pic.twitter.com/ODaLH8aAok;;
0;0;Microsoft MB2-717 Exam Actual Questions (Updated 29 Mar 2017) – Latest Version http:// dlvr.it/NlqLFY pic.twitter.com/YAgheZBYha;;
0;0;Microsoft MB2-717 Exam Actual Questions (Updated 29 Mar 2017) – Latest Version http:// dlvr.it/NlqLDf pic.twitter.com/XC21yzh95T;;
0;0;Microsoft confirma data da próxima grande atualização do Windows 10 http:// fb.me/1kfrLeCmd;;
0;0;Microsoft 's Windows 10 Creators Update rollout will start April 11 — here's what to expect http:// kng5.tv/2nAlbM4 @geekwire;@geekwire;
0;2;Microsoft 's Windows 10 Creators Update rollout will start April 11 — here's what to expect http:// kng5.tv/2nAlbM4 @geekwire;@geekwire;
0;0;5 Must-Have Mobile Business Apps #business http:// bit.ly/2lEnElp @Google @Wunderlist @dayone @Dropbox @DropboxBusiness @Microsoft pic.twitter.com/JaIMbfK1Ze;@Google @Wunderlist @dayone @Dropbox @DropboxBusiness @Microsoft;#business
0;0;5 Must-Have Mobile Business Apps #business http:// bit.ly/2lEnElp @Google @Wunderlist @dayone @Dropbox @DropboxBusiness @Microsoft pic.twitter.com/BwPCp1uOnL;@Google @Wunderlist @dayone @Dropbox @DropboxBusiness @Microsoft;#business
2;4;Microsoft to further collaborate with Toyota on #ConnectedCar tech http:// msft.social/sqAv9N #CPG @tech_record pic.twitter.com/zCzoE5eqq6;@tech_record;#ConnectedCar #CPG
2;2;Video: Microsoft Flow Best Practices and Examples for Business Analysts http:// bit.ly/2obf3eE in 34 days #MSFlow;;#MSFlow
0;6;PS I told the story of your proposal during a panel at a Microsoft marketing conference today and you both got a round of applause;;
0;1;CPUのパワーはなるべくユーザーアプリケーションのためにとっておきたいものですから、インフラ処理でCPUを使ったら負けです。 Reading: 自社開発技術満載！ Microsoft Azureの物理インフラを大解剖 http:// ascii.jp/elem/000/001/4 59/1459849/ …;;
0;0;I liked a @YouTube video from @psnewsnow http:// youtu.be/0afcDinNbW0?a Microsoft Finally Admit Xbox One Failures and Remembering E3 2013;@YouTube @psnewsnow;
0;0;Microsoft is testing Ruuh, an English-speaking AI chatbot aimed at the Indian market http://www. zdnet.com/article/micros oft-launches-ruuh-yet-another-ai-chatbot/ … http://www. techmeme.com/170329/p28#a17 0329p28 …;;#a17
0;0;Microsoft Xbox 360 White Console HDMI port + 1 control wireless, 20GB HDD, CoD http:// rover.ebay.com/rover/1/711-53 200-19255-0/1?ff3=2&toolid=10044&campid=5337506718&customid=&lgeo=1&vectorid=229466&item=112347592283 … pic.twitter.com/nooxhqRFsp;;
0;0;Microsoft Xbox 360 S 4GB Console Model 1439 Matte Black http:// rover.ebay.com/rover/1/711-53 200-19255-0/1?ff3=2&toolid=10044&campid=5337506718&customid=&lgeo=1&vectorid=229466&item=302264327101 … pic.twitter.com/yqsFLzvuLp;;
0;0;Microsoft ’s Office 365 update for March focuses on Excel, OneNote, and Visio http:// buff.ly/2o7vZCF;;
0;0;Microsoft Xbox 360 White Console HDMI port + 1 control wireless, 20GB HDD, CoD http:// rover.ebay.com/rover/1/711-53 200-19255-0/1?ff3=2&toolid=10044&campid=5337506718&customid=&lgeo=1&vectorid=229466&item=112347592283 … pic.twitter.com/6S8E7W526W;;
0;0;If I can’t figure out how to clear the #Microsoft #Skype for Business #SfB app badge #in the next 30s, I’ll just delete the fucking app.;;#Microsoft #Skype #SfB #in
0;0;Microsoft MB2-717 Exam Actual Questions (Updated 29 Mar 2017) – Latest Version http:// dlvr.it/NlqKHr pic.twitter.com/zY66YW5FHT;;
0;0;Configure MAM policies in the Intune console | Microsoft Docs https://www. dub.io/s/105030 - rewteet! #configure #mam pic.twitter.com/raPyZCzOgO;;#configure #mam
0;0;Microsoft MB2-717 Exam Actual Questions (Updated 29 Mar 2017) – Latest Version http:// dlvr.it/NlqKGy pic.twitter.com/DlmP7AcRL0;;
0;0;Microsoft in Education's cover photo http:// soc.fm/WySVdKQW #MicrosoftEDU #edtech;;#MicrosoftEDU #edtech
0;18;Microsoft Announces Free Weekend Trial for WWE 2K17 With Xbox Live Gold http:// gameranx.com/updates/id/101 701/article/xbox-gold-members-wwe-trial-2017/ …;;
0;0;Microsoft Announces Free Weekend Trial for WWE 2K17 With Xbox Live Gold http:// gameranx.com/updates/id/101 701/article/xbox-gold-members-wwe-trial-2017/ …;;
0;1;The post ZDNet: ‘How Microsoft Azure, Kinect are helping kids play TV games to recover from strokes’ appeared first on News Center.;;
0;0;Microsoft Xbox 360 White Console HDMI port + 1 control wireless, 20GB HDD, CoD http:// rover.ebay.com/rover/1/711-53 200-19255-0/1?ff3=2&toolid=10044&campid=5337506718&customid=&lgeo=1&vectorid=229466&item=112347592283 … pic.twitter.com/oSxS4A2XR5;;
0;0;#Microsoft Blogs: Change Block Tracking needs to be reset if another backup product has protected a VMWare VM prio… http:// qtc.tf/2nkAwhf;;#Microsoft
0;0;Microsoft lets you download the Windows 10 Creators Update a little early http:// buff.ly/2o5BW2R;;
0;0;Microsoft Access Version 2002 マイクロソフト プラットフォーム:   Windows (2) 新品： ￥ 16,800 7点の新品／中古品を見る: ￥ 6,980より… http:// dlvr.it/NlqJPR ... #プログラム #PC;;# #PC
0;0;Microsoft Windows XP Professional Service Pack 2 通常版 マイクロソフト プラットフォーム:   Windows XP (17) 新品： ￥… http:// dlvr.it/NlqJNV ... #プログラム #PC;;# #PC
0;0;Microsoft Remote Desktop Services Management Pack for Windows Server 2016 http:// dlvr.it/NlqJF3 pic.twitter.com/FJWHh5HR8Q;;
0;0;Microsoft Office Access 2003 アカデミック マイクロソフト プラットフォーム:   Windows (3) 1点の新品／中古品を見る: ￥ 3,980より… http:// dlvr.it/NlqJCQ ... #プログラム #PC;;# #PC
0;0;Microsoft Visual Studio Professional 2012 通常版 マイクロソフト プラットフォーム:   Windows (8)… http:// dlvr.it/NlqJBW ... #プログラム #PC;;# #PC
0;0;Microsoft Windows Server 2012 Standard 日本語版 5 CAL付 マイクロソフト プラットフォーム:   Windows 新品： ￥ 238,680 ￥… http:// dlvr.it/NlqJ7M ... #プログラム #PC;;# #PC
0;1;i accidentally had "proficienct in Microsoft Excess" on my resume for a long time :/;;
0;0;Microsoft Edge, el navegador más fácil de explotar en una competencia de hackers https://www. genbeta.com/p/209213 vía @genbeta;@genbeta;
0;0;Microsoft MB2-717 Exam Actual Questions (Updated 29 Mar 2017) – Latest Version http:// dlvr.it/NlqJ0m pic.twitter.com/WcIEWxGPu8;;
0;0;Microsoft MB2-717 Exam Actual Questions (Updated 29 Mar 2017) – Latest Version http:// dlvr.it/NlqJ06 pic.twitter.com/6fo927Sida;;
0;0;New on Ebay: FIFA 14 ( Microsoft Xbox 360, 2013) http:// ift.tt/2o7eMsP pic.twitter.com/NzILIQumRb;;
0;0;Microsoft MB2-717 Exam Actual Questions (Updated 29 Mar 2017) – Latest Version http:// dlvr.it/NlqHyF pic.twitter.com/abKGAuNozL;;
0;0;RT BillRobersonDT: #Samsung debuts #GalaxyS8 halo phones, #Microsoft Win10 update, bizarre #Ferrari crime case: http://www. digitaltrends.com/dt-daily/samsu ng-debuts-galaxy-s8-halo-phones-bixby-along-ride/ … vi…;;#Samsung #GalaxyS8 #Microsoft #Ferrari
0;0;RT BillRobersonDT: #Samsung debuts #GalaxyS8 halo phones, #Microsoft Win10 update, bizarre #Ferrari crime case: http://www. digitaltrends.com/dt-daily/samsu ng-debuts-galaxy-s8-halo-phones-bixby-along-ride/ … vi…;;#Samsung #GalaxyS8 #Microsoft #Ferrari
0;0;Microsoft Xbox 360 White Console HDMI port + 1 control wireless, 20GB HDD, CoD http:// rover.ebay.com/rover/1/711-53 200-19255-0/1?ff3=2&toolid=10044&campid=5337506718&customid=&lgeo=1&vectorid=229466&item=112347592283 … pic.twitter.com/sUUtscQJBC;;
0;0;travado demais, e além disso, qro voltar a usar o skype preview e o Microsoft Edge;;
0;0;Microsoft Xbox 360 White Console HDMI port + 1 control wireless, 20GB HDD, CoD http:// rover.ebay.com/rover/1/711-53 200-19255-0/1?ff3=2&toolid=10044&campid=5337506718&customid=&lgeo=1&vectorid=229466&item=112347592283 … pic.twitter.com/k64rBstTHh;;
0;0;@YahooAds My Yahoo homepage keeps getting hijacked by ads from your network, sending me to fake "Critical Alert from Microsoft " page.;@YahooAds;
0;0;Introduction to Microsoft Flow https:// youtu.be/vWU6xmq3T8M via @YouTube;@YouTube;
0;0;@Microsoft me cago en ustedes mil veces cabrones, ojala se les caiga la compañia;@Microsoft;
0;0;Fazeela Baksh from Greater New York City Area here http://www. Intensavida.com/detail/fazeela -baksh … #deals #English #Microsoft #opportunities #Microsoft;;#deals #English #Microsoft #opportunities #Microsoft
0;0;Vendo Microsoft Lumia 640 XL menos de un año de uso! @Cosquín https://www. instagram.com/p/BSPUziQAzBo/;@Cosqu;
0;0;Soon to retire Microsoft India chairman Pramanik wants to help companies navigate disrupti... http:// ecoti.in/1XWaLY via @economictimes;@economictimes;
0;0;Microsoft Surface Book 2 reportedly not launching this spring. -- http://www. itnewshut.com/2017/03/micros oft-surface-book-2-reportedly-not.html …;;
0;0;Microsoft study warns of difficulty organisations face in attracting cloud skills - Cloud Tech http:// ift.tt/2nkBZEn;;
8;7;Microsoft is testing Ruuh, an English-speaking AI chatbot aimed at the Indian market http://www. zdnet.com/article/micros oft-launches-ruuh-yet-another-ai-chatbot/ … http://www. techmeme.com/170329/p28#a17 0329p28 …;;#a17
0;0;Microsoft Xbox 360 White Console HDMI port + 1 control wireless, 20GB HDD, CoD http:// rover.ebay.com/rover/1/711-53 200-19255-0/1?ff3=2&toolid=10044&campid=5337506718&customid=&lgeo=1&vectorid=229466&item=112347592283 … pic.twitter.com/pp2pe0FCUu;;
0;0;Microsoft Xbox 360 S 4GB Console Model 1439 Matte Black http:// rover.ebay.com/rover/1/711-53 200-19255-0/1?ff3=2&toolid=10044&campid=5337506718&customid=&lgeo=1&vectorid=229466&item=302264327101 … pic.twitter.com/OUvKYUgCXS;;
0;0;Probando #Xamarin siempre innovando #microsoft;;#Xamarin #microsoft
0;0;Microsoft Xbox 360 White Console HDMI port + 1 control wireless, 20GB HDD, CoD http:// rover.ebay.com/rover/1/711-53 200-19255-0/1?ff3=2&toolid=10044&campid=5337506718&customid=&lgeo=1&vectorid=229466&item=112347592283 … pic.twitter.com/WyRCqAwU93;;
0;0;Microsoft Xbox 360 White Console HDMI port + 1 control wireless, 20GB HDD, CoD http:// rover.ebay.com/rover/1/711-53 200-19255-0/1?ff3=2&toolid=10044&campid=5337506718&customid=&lgeo=1&vectorid=229466&item=112347592283 … pic.twitter.com/vmmN11R1e4;;
0;0;GTA V New en ebay: Grand Theft Auto V 5 USED SEALED ( Microsoft Xbox One, 2014) http:// ift.tt/2obdCtK pic.twitter.com/wJWO0ZO1IT;;
0;0;#Parcerias #Youtube O Xbox mudou graças a comunidade de fãs! Declarações fortes de executivos da Microsoft ... http:// fb.me/8sFlanCJZ;;#Parcerias #Youtube
1;2;#Cajuneuity !!;;#Cajuneuity
0;0;#PowerObjects The CRM Minute: In Case You Missed it - Join Genya to Learn about Microsoft Power... Read Blog: http:// owler.us/acs4A1;;#PowerObjects
0;0;“A great leader once told me, ‘persistence beats resistance.’ And after working at Facebook, Intel and Microsoft ... http:// fb.me/3gf4yxKfy;;
0;0;Microsoft Office Home and Business 2016 (最新)|カード版|Win対応 マイクロソフト プラットフォーム: Windows 7 / 8 / 8.1 / 10… http:// dlvr.it/NlqGcC ... #Windows #OS;;#Windows #OS
0;0;Microsoft Windows 10 Home Anniversary Update適用版 32bit/64bit 日本語版 (最新)|USBフラッシュドライブ マイクロソフト… http:// dlvr.it/NlqGYn ... #Windows #OS;;#Windows #OS
0;0;Microsoft Windows10 Home Premium 64bit 日本語 DSP版|DVD LCP(紙パッケージ)+USB増設PCIカードUSB2.0 マイクロソフト(DSP)… http:// dlvr.it/NlqGWr ... #Windows #OS;;#Windows #OS
0;0;Microsoft Office Personal 2016 (最新)|カード版|Win対応 マイクロソフト プラットフォーム: Windows 7 / 8 / 8.1 / 10 (13) 新品：… http:// dlvr.it/NlqGTq ... #Windows #OS;;#Windows #OS
1;1;The Future of Learning Technology in UK Higher Education. @Microsoft @surface http:// klou.tt/1b55ksfph2pzi #higherED #edtech #elearning #edreform;@Microsoft @surface;#higherED #edtech #elearning #edreform
0;0;Microsoft Windows 10 Home Anniversary Update適用 32bit/64bit 日本語版 (最新) |オンラインコード版 マイクロソフト プラットフォーム:… http:// dlvr.it/NlqGRx ... #Windows #OS;;#Windows #OS
0;0;Microsoft Windows 10 Pro Anniversary Update適用版 32bit/64bit 日本語版 (最新)|USBフラッシュドライブ マイクロソフト… http:// dlvr.it/NlqGNr ... #Windows #OS;;#Windows #OS
0;0;Microsoft PowerPoint2016 (最新)|カード版|Win対応 マイクロソフト プラットフォーム: Windows 7 / 8 / 8.1 / 10 (6) 新品： ￥… http:// dlvr.it/NlqGHS ... #Windows #OS;;#Windows #OS
0;0;Microsoft Access 2016 (最新)|カード版|Win対応 マイクロソフト プラットフォーム: Windows 7 / 8 / 8.1 / 10 (1) 新品： ￥ 15,984… http:// dlvr.it/NlqGFX ... #Windows #OS;;#Windows #OS
0;0;Microsoft Windows 10 Pro Anniversary Update適用版 32bit/64bit 日本語版 (最新)|オンラインコード版 マイクロソフト プラットフォーム:… http:// dlvr.it/NlqGDD ... #Windows #OS;;#Windows #OS
0;0;Microsoft Excel 2016 (最新)|カード版|Win対応 マイクロソフト プラットフォーム: Windows 7 / 8 / 8.1 / 10 (2) 新品： ￥ 15,984 ￥… http:// dlvr.it/NlqG7q ... #Windows #OS;;#Windows #OS
0;0;LIVESTREAM - Battlefield 1 https://www. youtube.com/channel/UCG25H CIwDM-E_uhbbx0YFNA/live … @windowsclubbr @xboxbr @microsoftbr #xboxone #microsoft @ignbroficial @tecmundo_games;@windowsclubbr @xboxbr @microsoftbr @ignbroficial @tecmundo_games;#xboxone #microsoft
0;0;Microsoft has announced the availability of its Azure Analysis Services preview in the UK South and Japan East... http:// fb.me/1j1mK2rA6;;
0;2;It's awesome, new streaming program owned by Microsoft - the delay is almost non-existent!;;
0;0;To which scientists does this apply? There are so many. Don't use the term to act smart. It's rude.;;
0;0;Microsoft MB2-717 Exam Actual Questions (Updated 29 Mar 2017) – Latest Version http:// dlvr.it/NlqG26 pic.twitter.com/vmh50FdxwF;;
2;0;How Microsoft plans to address #AI and machine learning challenges http://www. cio.com/article/318623 0/application-development/how-microsoft-plans-to-address-ai-and-machine-learning-challenges.amp.html …;;#AI
0;0;Reboot Reacts To Microsoft In Part 2 4K http:// share-the-buzz.com/video/82?S3FW;;
0;0;Isso é Microsoft , vai no site deles mesmo, perae.;;
0;0;How #Microsoft #Access #Training Can Help Your #Employees http:// bit.ly/2nhSPmq;;#Microsoft #Access #Training #Employees
1;0;We have @kimnels15 from @Microsoft_Gov talking about the role of IT in innovation. pic.twitter.com/X2xGH8iwmg;@kimnels15 @Microsoft_Gov;
0;0;"Хотел сфотографироваться в офисе Microsoft , но кто-то испортил весь снимок" @doc_videoo ... pic.twitter.com/Pwk0RPsmaK;@doc_videoo;
0;0;"Хотел сфотографироваться в офисе Microsoft , но кто-то испортил весь снимок" @doc_videoo ... pic.twitter.com/LzXEViqugL;@doc_videoo;
0;0;"Хотел сфотографироваться в офисе Microsoft , но кто-то испортил весь снимок" @doc_videoo ... pic.twitter.com/kbZDxoWd9c;@doc_videoo;
0;0;"Хотел сфотографироваться в офисе Microsoft , но кто-то испортил весь снимок" @doc_videoo ... pic.twitter.com/0Go43JaeW2;@doc_videoo;
0;0;"Хотел сфотографироваться в офисе Microsoft , но кто-то испортил весь снимок" @doc_videoo ... pic.twitter.com/DVmpsiwje7;@doc_videoo;
0;0;"Хотел сфотографироваться в офисе Microsoft , но кто-то испортил весь снимок" @doc_videoo ... pic.twitter.com/RXokDEOhc3;@doc_videoo;
0;0;"Хотел сфотографироваться в офисе Microsoft , но кто-то испортил весь снимок" @doc_videoo ... pic.twitter.com/UqPmcewaUz;@doc_videoo;
0;0;Microsoft Paint.;;
0;0;Microsoft Arrow Launcher http:// v3.2.zero .31695 APK [Latest] http://www. fapp.online/microsoft-arro w-launcher-v3-2-zero-31695-apk-latest-5/ … pic.twitter.com/gWjFrzRr55;;
0;0;Análisis de la vulnerabilidad 0-Day de Microsoft (ya corregida MS17-013) http:// buff.ly/2o9vLuN;;
0;0;Grand Theft Auto V -- Special Edition ( Microsoft Xbox 360, 2013) - European Ver… http:// ift.tt/2nhCeiQ pic.twitter.com/j6cS5HGPkT;;
0;0;The Internet of Intelligent Things: Google, Samsung, Microsoft , and the new battle http:// ln.is/robotwatch.co/ lGqCi … #ai #google #microsoft #samsung;;#ai #google #microsoft #samsung
0;0;#Review #Microsoft Surface Pro 4 Intel Core i7 512 GB, 16 GB RAM . All-in-one pc. http:// goo.gl/NG1ZA3 #BuyCheap pic.twitter.com/1iBybWcTnK;;#Review #Microsoft #BuyCheap
0;2;I get real steamed up when I see people use the default microsoft sans font for their sIKkk chIneSe kAnJi so I wanna improve my handwriting;;
0;0;Exposed files on Microsoft 's document-sharing site http://www. bbc.co.uk/news/technolog y-39417479 …;;
0;0;@stoclip : 2016年ナスダック 営業キャッシュフローランキング。トップ5はApple658億ドル、Alphabet 360億ドル、Microsoft333億ドル、 http:// buff.ly/2nSjBqu pic.twitter.com/mPKQYw9URX;@stoclip;
1;1;I liked a @YouTube video from @psnewsnow http:// youtu.be/0afcDinNbW0?a Microsoft Finally Admit Xbox One Failures and Remembering E3 2013;@YouTube @psnewsnow;
37;43;Trust informs every decision we make. A good read from @ethisphere on how @Microsoft runs on trust. http:// bit.ly/2obUC1u pic.twitter.com/PA4izUPAFw;@ethisphere @Microsoft;
0;0;Citrix NetScaler deployments in Microsoft Azure - http://www. 247tech.co.uk/citrix-netscal er-deployments-in-microsoft-azure/ …;;
0;0;Microsoft releases Windows 10 Mobile Insider Preview Build 15063.2 to Slow Ring http:// ow.ly/i9Gr50avXVL;;
0;0;Microsoft updates the Xbox app on iOS with Beam notifications, achievement improvements and more http:// ow.ly/oJW150avXVM;;
0;0;Doria fecha parceria de R$ 15 milhões com a Microsoft para ensino público http:// fb.me/3pMRzeF7b;;
0;0;Microsoft MB2-717 Exam Actual Questions (Updated 29 Mar 2017) – Latest Version http:// dlvr.it/NlqF3f pic.twitter.com/29pcRNW9Gl;;
0;0;Oye hoy fui a las oficinas de microsoft y tienen salas de wellness, con xbox, pinpon y sillones que hacen masajes. Google style! Muy pro;;
9;4;"Solve the hardest problems. The rest will take care of itself." - @johnshew of @DecodedShow & @Microsoft http:// youtube.com/decodedshow pic.twitter.com/MxJRwrxnod;@johnshew @DecodedShow @Microsoft;
1;5;Microsoft Finally Admit Xbox One Failures and Remembering E3 2013: http:// youtu.be/0afcDinNbW0?a via @YouTube;@YouTube;
0;1;TechCrunch: Microsoft ’s Creators update wants to bring Windows 10 artists and gamers back into the fold … pic.twitter.com/wY3DSA2g6o;;
0;0;nigga I play games on a Microsoft Surface @Misadventures;@Misadventures;
0;0;#schoolsupplies Microsoft Surface Pro 1601 10.5" Tablet PC Core i5-3317U 1.7GHz 8GB 256GB SSD http:// dlvr.it/NlqCqz #onsale #greatdeals pic.twitter.com/oy5wsEeDE9;;#schoolsupplies #onsale #greatdeals
0;0;Microsoft Exchange Sensitive Data Search: MailSniper https:// n0where.net/microsoft-exch ange-sensitive-data-search-mailsniper/ … #InfoSec #CyberSecurity;;#InfoSec #CyberSecurity
0;0;Microsoft HoloLens helps medical equipment maker hone sales pitch http:// bit.ly/2nwSz4F #Strategy #CIO;;#Strategy #CIO
0;0;Microsoft HoloLens helps medical equipment maker hone sales pitch http:// bit.ly/2nwSz4F #Strategy #CIO;;#Strategy #CIO
0;0;端末紛失後の恒例行事のパスワード変更。今回変えたのはDropBox、 Microsoft 、Google(Gmail)だけにした。ソーシャル系は乗っ取られたら考える(ぉ;;
0;0;#MSPowerBI - Turn insight into deep, meaningful action using Microsoft Flow and Power BI http:// ow.ly/Rl0X50avXMr;;#MSPowerBI
0;0;Microsoft HoloLens helps medical equipment maker hone sales pitch http:// dlvr.it/NlqChs pic.twitter.com/vjHw8HSLS6;;
0;0;Me ha gustado un vídeo de @YouTube de @pmiscojones ( http:// youtu.be/-FuRU0J_fO4?a - Opinión ¡¡¡ MICROSOFT OBSESIONADO CON VENDERNOS;@YouTube @pmiscojones;
1;3;When your name is Tayyiabah but Microsoft word changes it to tablecloth https:// twitter.com/mouna_alhakeem /status/847170879234719747 …;;
0;1;Here's what @LinkedIn could mean for @Microsoft cloud @Azure via @gigabarb http:// fortune.com/2017/03/29/mic rosoft-linkedin-cloud-data-center/ … @reidhoffman @scottgu @markrussinovich;@LinkedIn @Microsoft @Azure @gigabarb @reidhoffman @scottgu @markrussinovich;
10;19;中華のくだりは若干反省している / 自社開発技術満載！ Microsoft Azureの物理インフラを大解剖 http:// ascii.jp/elem/000/001/4 59/1459849/ …;;
0;1;Been on the phone to Microsoft for the last 80-90 mins. Kms.;;
0;0;Class action contro Microsoft : Windows 10 ha danneggiato i Pc - Reggio Prima Pagina http:// ow.ly/w38T50avXqi;;
0;0;ASCII.jp 自社開発技術満載！ Microsoft Azureの物理インフラを大解剖 ASCII.jp Azureのアーキテクトですが、前職はヒューレット・パッカード エンタープライズ… http:// 2bit.tk/LbzH0;;
0;0;New on Ebay Microsoft Xbox One Holiday Bundle 1 TB Black Console http:// ift.tt/2odnaEe pic.twitter.com/AAN5RdAi9T;;
0;0;"E o Continuum? Microsoft adapta suíte Office completa para o DeX" http://www. tudocelular.com/android/notici as/n90574/dex-continuum-office.html … #tecnologia #feedly;;#tecnologia #feedly
0;1;these are just running around the Microsoft campus up here. @tanya has a bunch of them in NZ I think!;@tanya;
0;2;SSMS itself, no. Definitely will have new xplat SQL tools. VS Code extension is first one. Stay tuned!;;
2;3;Building success with #Microsoft teams with @kkhipple and the @tspbug group pic.twitter.com/mkc8x0VIM3 – bei MNP LTD;@kkhipple @tspbug;#Microsoft
0;1;Definitely one to read! #Cortana now has access to the Android lock screen http:// read.bi/2mMpoO6 via @sai @Microsoft @BingAds;@sai @Microsoft @BingAds;#Cortana
0;1;Hey Ross, thanks for reaching out. All billing for EA Access goes through Microsoft /Xbox. -Harvey;;
0;0;Microsoft offers analysis of the #0day eploited by the Zirconium group https:// kas.pr/Y7wn pic.twitter.com/jTfY3XHKjn;;#0day
5;7;Microsoft Exchange Sensitive Data Search: MailSniper https:// n0where.net/microsoft-exch ange-sensitive-data-search-mailsniper/ … #InfoSec #CyberSecurity;;#InfoSec #CyberSecurity
1;0;10 million people now help Microsoft test Windows 10 - http:// klou.tt/eed2e7wp7hof;;
0;0;Engadget: Microsoft 's best Surface Book finally comes to the UK http:// dlvr.it/NlqC8c pic.twitter.com/uHVg3ZmhF9;;
0;0;Microsoft Samuel;;
