retweets;favorites;text;mentions;hashtags
0;0;amazon UK #8: Forza Motorsport 4 (Xbox 360): Forza Motorsport 4 (Xbox 360) by Microsoft Platform:   Xbox 360... http:// dlvr.it/nwBl6 check !;;#8
0;0;Antivírus da Microsoft diz que Google Chrome é maligno http:// goo.gl/fb/qVdCV #internet #antivírus #chrome #google;;#internet #antiv #chrome #google
0;0;#ukpc4sale LONDON Good Condition Macbook 2.4ghz, 2gb Ram, 160GB Hd, Ilife11, Microsoft 2011, Adobe Master Suite ... http:// bit.ly/5ZSJh0;;#ukpc4sale
0;0;RT @TaimurAsad : iPhone, iPod touch And iPad Make More Money Than All Of Microsoft ’s Products Put Together [REPORT] http://www. redmondpie.com/iphone-ipod-to uch-and-ipad-make-more-money-than-all-of-microsofts-products-put-together-report/ …;@TaimurAsad;
0;0;Part One: Intel, Haswell and Microsoft 's "Think Different" Moment http:// zite.to/qunuAa via @zite;@zite;
0;0;http:// copy090611ne.jugem.jp/?eid=162 Gynaecology The Real World Fashion Role-Playing Games Microsoft Asset Sink Crime List of Universities;;
0;0;IBM Eclipses Microsoft In Value For the First Time in 15 years! http://ow.ly/6Kgv1;;
1;0;#Microsoft Advances in #AugmentedReality http:// amplify.com/u/a1dzhi RT @AniseSmith @WilliamPiket *Wow! Cloud + Augmented Reality;@AniseSmith @WilliamPiket;#Microsoft #AugmentedReality
0;0;Microsoft Security Tool Falsely Detect Chrome As Trojan ...;;
0;0;What Is Google Docs, Microsoft Office365 and Zoho Docs? How to Use Cloud Based Office Apps? http:// bit.ly/prEtq4;;
0;0;#simodernwarfarefueramexicano podrías pagar microsoft points para sobornar el score.;;#simodernwarfarefueramexicano
0;0;iPhone, iPod touch And iPad Make More Money Than All Of Microsoft ’s Products Put Together [REPORT] http://www. redmondpie.com/iphone-ipod-to uch-and-ipad-make-more-money-than-all-of-microsofts-products-put-together-report/ …;;
0;0;Lastest Microsoft Flight Simulator auctions http:// nblo.gs/nRnBH;;
0;0;FNN VIDEO: IBM passes Microsoft to become the world's second-most valuable company in technology. http:// bit.ly/bkp2EU;;
0;0;IBM beats Microsoft in tech giants ranking http:// bbc.in/n9kaAC #BBC;;#BBC
0;0;IBM passa Microsoft e é segunda entre gigantes da tecnologia http:// bit.ly/pwNtjS #terramobile;;#terramobile
0;0;não é a toa que a apple recusou o Flash e agora a microsoft tb, essa merda ja travou meu navegador umas 4 vezes só hoje;;
0;0;Обновление Microsoft удаляет Google Chrome: Последнее обновление баз антивируса Microsoft Security Essentials, вышедшее 30 сентября 2...;;
0;0;Обновление Microsoft удаляет Google Chrome: Последнее обновление баз антивируса Microsoft Security Essentials, вышедшее 3... #followback;;#followback
0;0;Get Microsoft Office 2010 Free! Here: http:// bit.ly/mfgEYD http:// bit.ly/mfgEYD;;
0;0;Microsoft launches web-based Windows Phone Marketplace http:// tinyurl.com/688nusx;;
0;0;Microsoft cutting Zune Pass cost by 33% with no more free songs to keep http:// tinyurl.com/688nf56;;
0;0;That moment when Microsoft Word tells you that your name is a spelling mistake. Thanks guys. -_-;;
0;0;Microsoft muốn “bóp nghẹt” giới phát triển ứng dụng?: (Dân trí) - Gã khổng lồ phần mềm Mỹ Microsoft vừa đặt ra ... http:// bit.ly/otj2Eh;;
0;0;[dt] Microsoft muốn “bóp nghẹt” giới phát triển ứng dụng? http:// bit.ly/otj2Eh;;
0;0;Open Question: How do you make a timeline on microsoft ?: Word, Powerpoint or exel? and how do you find it on ei... http:// yhoo.it/nVBr84;;
0;0;#Microsoft Online Services #Licensing Options http:// bit.ly/nDly0m #Cloud #ITPro;;#Microsoft #Licensing #Cloud #ITPro
0;0;http:// pubertypublic2109.blogspot.com/2011/10/royal- weddinglooking-back.html … Baseball Golf URL Friends FreeBSD Microsoft Law Topics Porsche;;
0;0;http:// artistry0906.jugem.jp/?eid=170 CD Microsoft Computing Technology Shoes Fruit Seinfeld Poker Administrative Law Civil Law;;
0;0;MS Microsoft extends IT training grant for migrant workers http:// bit.ly/n3rfx7;;
2;0;IBM rebasa a Microsoft y se convierte en la segunda compañía de tecnología más valiosa http://j.mp/qe9qbS;;
0;0;Microsoft Excel 2010 Introduction Quick Reference Guide (Cheat Sheet of Instructions, Tips & Shortcuts – Laminat... http:// bit.ly/oqt5UV;;
0;0;Microsoft Excel 2010 Introduction Quick Reference Guide (Cheat Sheet of Instructions, Tips & Shortcuts – Laminat... http:// bit.ly/oqt5UV;;
0;0;@BridieBoo_TW yeh microsoft word came in handy and 1D will last for a while and then all their fans will finally grow up :) and;@BridieBoo_TW;
0;0;Microsoft was started out of the basement Google in a garage. YOU HAVE BOTH entrepreneurs wanted. http://dld.bz/GWrg;;
0;0;RT @DJMalvo : Got my microsoft word for MAC now!!!! Yes!!! Grad School, here I come!;@DJMalvo;
0;0;For a good bargain on Microsoft Guitar Hero Games check out eBay. Check it. http:// bit.ly/aaFGSu;;
0;0;Funny. When a website doesn't work in IE, I blame Microsoft ... when a website doesn't work in Chrome, I blame the site's developer.;;
0;0;RT @VentureBeat : Microsoft accidentally deleted Chrome from a few thousand users' computers. Uh... oops? http://ow.ly/6KtCm;@VentureBeat;
0;0;news: Microsoft donates software worth Rs 1.5 billion to Sri Lanka http:// bit.ly/qtJQqJ;;
0;0;Download Microsoft Autoroute v2011 + crack + serial - fullDOWNLOAD SOFTWARE FOR FREE http:// bit.ly/pPsyvU;;
0;0;“ @GearsBlog If you want to unlock the Microsoft Liquid Green Metal Skins We will find out later this month! via @GearsViking ”;@GearsBlog @GearsViking;
0;0;http:// breakdown092911.cocolog-nifty.com/blog/2011/10/o wen-jensen-tat.html … XBOX Family Apparel Chess Hummer Polygamy Microsoft Fruit;;
0;0;@RobJohnson1234 thats one to brag about to Microsoft fanatics (;;@RobJohnson1234;
0;0;Download Microsoft Expression Studio 4 Ultimate + crack + serial - fullDOWNLOAD SOFTWARE FOR FREE http:// bit.ly/pYRv2G;;
0;0;Watch my feed, peeps. Was tweeting re: the Microsoft /FB/Google-plex matrix forming months ago...;;
0;0;Windows Phone 7 Mango update now one step closer to consumers - Microsoft announced today that the first major... http:// is.gd/o6ZLmW;;
0;0;man i love microsoft , but fuck bing dude;;
0;0;IBM Unseats Microsoft As Second Most Valued Tech Company - Slashdot http:// fb.me/XxIOJIzb;;
0;0;Google Chrome 14.0.835.187 (Stable channel/安定版) Microsoft Security Essentials問題アップデート: GoogleのWebブラウザー「Google Ch... http:// bit.ly/r0nypy;;
0;0;IBM Unseats Microsoft As Second Most Valued Tech Company - Slashdot http:// news.slashdot.org/story/11/10/01 /0048250/ibm-unseats-microsoft-as-second-most-valued-tech-company …;;
0;0;Microsoft Security Essential confunde Chrome con malware eliminándolo del sistema http:// pulse.me/s/1WYsc;;
0;0;@domelhor Microsoft deixa vazar nome de smartphone Nokia com Windows Phone 7.5: Parece que a Micro... http:// bit.ly/plGbE4 @alunovirtual;@domelhor @alunovirtual;
0;0;Microsoft deixa vazar nome de smartphone Nokia com Windows Phone 7.5: Parece que a Microsoft no Ca... http:// bit.ly/quuibm @alunovirtual;@alunovirtual;
0;0;@ki_sekiya I can't beleive that Microsoft could get it wrong! and yes if it was during the week it could be chaotic !;@ki_sekiya;
0;0;Comparing top lines: Apple vs. Microsoft http:// zite.to/nzINYb via @zite The saga continue;@zite;
0;0;Microsoft Shows Off Kinect and Windows Phone 7.5 Integration [VIDEO]: http:// bit.ly/nwk0yK WP7 windows 8 download ios 5 jailbreak _42;;
0;0;http:// continuecontinuous2608.blogspot.com/2011/10/hellaf lush-mk3-rx-7-hellaflush.html … Silver Snowboarding Internet Microsoft Apartment;;
0;0;Обновление Microsoft удаляет Google Chrome #novosti;;#novosti
0;0;Microsoft a perdu 9 milliards de dollars à cause de Bing. http://www. numerama.com/magazine/19877 -microsoft-a-perdu-9-milliards-de-dollars-a-cause-de-bing.html …;;
0;0;Apple iDevices Make More Money Than All of Microsoft ’s Products Put Together http:// zite.to/n23ywn via @zite;@zite;
0;0;Microsoft launches web-based Windows Phone Marketplace http:// tinyurl.com/688nusx;;
0;0;Microsoft cutting Zune Pass cost by 33% with no more free songs to keep http:// tinyurl.com/688nf56;;
1;0;Can we get like a sega-infinity ward-rockstar- microsoft -Sony contract together?;;
0;0;“ @TaimurAsad : iPhone, iPod touch And iPad Make More Money Than All Of Microsoft ’s Products Put Together [REPORT] http://www. redmondpie.com/iphone-ipod-to uch-and-ipad-make-more-money-than-all-of-microsofts-products-put-together-report/ … ”;@TaimurAsad;
0;0;Billionaire Blazers owner sued by own bodyguards: Over the last 18 months or so, Allen, who co-founded Microsoft , has: beaten cancer;...;;
0;0;IBM streeft Microsoft voorbij http://www. nu.nl/internet/26302 35/ibm-streeft-microsoft-voorbij.html … via @nunl;@nunl;
0;0;Microsoft Dynamics GP  Cloud or on Premise | Not For Profit Tech ...: You can make implementing your Microsoft ... http:// bit.ly/qgdP9c;;
0;0;Ich baue zur Zeit einen #Microsoft #Windows #Wordpress #Blog auf und suche noch Helfer http:// windows-neun.de /;;#Microsoft #Windows #Wordpress #Blog
0;0;I'd be outraged. RT @VentureBeat : Microsoft accidentally deleted Chrome from a few thousand users' computers. http://ow.ly/6KtCm;@VentureBeat;
0;0;Microsoft look to the community for the key features in the next version of Windows Phone: Apollo: http:// blog.gsmarena.com/microsoft-look -to-the-community-for-the-key-features-in-the-next-version-of-windows-phone-apollo/#.ToeOjpVUejY.twitter … via @AddThis;@AddThis;#
0;0;iPhone, iPod touch And iPad Make More Money Than All Of Microsoft ’s Products Put Together (REPORT): According to... http:// bit.ly/ndqpNc;;
0;0;iPhone, iPod touch And iPad Make More Money Than All Of Microsoft ’s Products Put Together (REPORT): According to... http:// bit.ly/nHRH0R;;
0;0;iPhone, iPod touch And iPad Make More Money Than All Of Microsoft ’s Products Put Together (REPORT): Accordin... http:// bit.ly/ndqpNc #in;;#in
0;0;Windows 7 Home Premium SP1 64bit (Full) System Builder DVD 1 Pack - by Microsoft Software http:// adf.ly/2a1HL;;
1;0;iPhone, iPod touch And iPad Make More Money Than All Of Microsoft ’s Products Put Together (REPORT): According to... http:// bit.ly/o67qZR;;
0;0;Blogged: [News] 7″ Amazon Fire, Microsoft /Samsung deal, Cyanogenmod adds Xperia, Google Voice, Hipmunk, Wallet http:// goo.gl/hC0Om #android;;#android
0;0;iPhone, iPod touch And iPad Make More Money Than All Of Microsoft ’s Products Put Together (REPORT): ... http:// bit.ly/ndqpNc #Redmondpie;;#Redmondpie
0;0;#cydia #Tweaks #Post iPhone, iPod touch And iPad Make More Money Than All Of Microsoft ’s Products Put Together (... http:// bit.ly/ndqpNc;;#cydia #Tweaks #Post
0;0;iPhone, iPod touch And iPad Make More Money Than All Of Microsoft ’s Products Put Together (REPORT) http:// bit.ly/rrDZ8J #RobJohn1234;;#RobJohn1234
0;0;iPhone, iPod touch And iPad Make More Money Than All Of Microsoft ’s Products Put Together (REPORT): According to... http:// bit.ly/ndqpNc;;
0;0;#Tech iPhone, iPod touch And iPad Make More Money Than All Of Microsoft ’s Products Put Together ... http:// bit.ly/ndqpNc via @redmondpie;@redmondpie;#Tech
0;0;iPhone, iPod touch And iPad Make More Money Than All Of Microsoft ’s Products Put Together [REPORT] http://www. redmondpie.com/iphone-ipod-to uch-and-ipad-make-more-money-than-all-of-microsofts-products-put-together-report/ … via @TaimurAsad;@TaimurAsad;
0;0;iPhone, iPod touch And iPad Make More Money Than All Of Microsoft ’s Products Put Together [REPORT]: According to... http:// bit.ly/ndqpNc;;
0;0;Android-таблетки будут основаны на процессорах Intel Atom: Некоторое время назад компания Microsoft заявила, что... http:// bit.ly/qSFoZB;;
0;0;Microsoft verdient eine halbe Milliarde mit - Android http:// bit.ly/rjeMUF;;
0;0;Microsoft : для работы Windows 8 достаточно процессора Atom и 1 ГБ RAM: Microsoft : для работы Windows 8 достаточн... http:// bit.ly/nKuu8i;;
0;0;Xbox 360 Wireless Network Adapter A/B/G Networks Only by Microsoft Software http://www. amazon.com/gp/product/B00 0B6MLV4?ie=UTF8&tag=gmlvr30-20&linkCode=shr&camp=213733&creative=393185&creativeASIN=B000B6MLV4&ref_=zg_bs_14112941_17 … via @amazon #xbox360 #games;@amazon;#xbox360 #games
0;0;Part One: Intel, Haswell and Microsoft 's "Think Different" Moment http:// zite.to/qunuAa via @zite;@zite;
0;0;Mashable! - Twitter Buzz: How Do You Like Windows 8 So Far? [CHART] #windows #microsoft #devices http:// bit.ly/pwAILc;;#windows #microsoft #devices
0;0;Do you STILL trust Microsoft to build antivirus support into Windows 8? - ZDNet http:// go.evri.com/4Oqp #microsoft;;#microsoft
0;0;@BW pls join us for #Office365 Twitter Chat, with latest updates/trends from #Microsoft #CalNetTech View invite:http://ht.ly/6IRvT;@BW;#Office365 #Microsoft #CalNetTech
0;0;Microsoft etiquetó accidentalmente a Google Chrome como malware http:// conecti.ca/2011/09/30/mic rosoft-etiqueto-accidentalmente-a-google-chrome-como-malware/ … vía @conectica;@conectica;
0;0;Definitely, two of the most popular web web hosting service systems that you can get are Microsoft windows... http:// tinyurl.com/3qz55ex;;
0;0;IBM Tops Microsoft in Market Value for First Time Since 1996: Bloomberg.by Sarah Frier - Sep 30, 2011Sam Palmisa... http:// bit.ly/qkhuFJ;;
0;0;hells yeah! RT @chaosmaster129 : @santiagoblue7 No, buy microsoft !;@chaosmaster129 @santiagoblue7;
0;0;Sr. Dev Technology Specialist Job – Microsoft – Atlanta, GA http:// dlvr.it/nw7zt;;
0;0;【東京ベイエリア】 9位： Microsoft Office Home and Business 2010 - http:// is.gd/RFoLZj;;
0;0;Microsoft tool may be removing Chrome | ZDNet UK http://www. zdnet.co.uk/blogs/security -bullet-in-10000166/microsoft-tool-may-be-removing-chrome-10024469/ …;;
0;0;IBM overtakes Microsoft to become second-most valuable tech company : http:// goo.gl/Rs95R #v #fb #li;;#v #fb #li
0;0;@santiagoblue7 No, buy microsoft !;@santiagoblue7;
0;0;Microsoft Â Windows Live Custom Domains www.WDKY56.com: Some cool Who is Who Domain Name images: Microsoft Â... http:// twurl.nl/ulq5qx;;
0;0;OH: Many #jdedward users debating not whether to make the bet to #oracle or go to #ibm but #microsoft or opensource. #oow11;;#jdedward #oracle #ibm #microsoft #oow11
0;0;#Developer Microsoft .NET #CSharp Entity Framework SQL Server ASP.NET #MVC Looking for projects #freelance #contract http:// goo.gl/l6tjA;;#Developer #CSharp #MVC #freelance #contract
0;0;IBM supera Microsoft em valor de mercado http:// info.abril.com.br/noticias/merca do/ibm-supera-microsoft-em-valor-de-mercado-01102011-9.shl … via @_INFO;@_INFO;
0;0;iPhone, iPod touch And iPad Make More Money Than All Of Microsoft ’s Products Put Together [REPORT] http:// bit.ly/r7wn8N .....LMaO;;
0;0;PCWorld: Microsoft Downs Domain that Bred Botnet that Targeted Macs http:// bit.ly/oA6ZDi Full http:// bit.ly/oPlQZU;;
0;0;My pops gettin old man. Dude gets mad at the computer when he can't figure shit out and starts talkin bout "fuck you Microsoft word" lol;;
0;0;MICROSOFT OFFICE (2010) ONENOTE (X64 / X86): http:// bit.ly/qFNg08;;
0;0;Microsoft Downs Domain that Bred Botnet that Targeted Macs http:// bit.ly/mRwA2k;;
0;0;iPhone, iPod touch And iPad Make More Money Than All Of Microsoft ’s Products Put Together [REPORT] http://www. redmondpie.com/iphone-ipod-to uch-and-ipad-make-more-money-than-all-of-microsofts-products-put-together-report/ …;;
0;0;Microsoft takes the Android profit, the Wonkas take the pain http:// reg.cx/1R4b via @regvulture;@regvulture;
0;0;I was seriously considering buying a Windows Phone 7 phone, but with all the BS that Microsoft is pulling with Android, they can go to hell.;;
0;0;Gawain Huber: Factors in pricing Microsoft CRM 2011 - Pricing and cost MSDYNCRM - http:// tinyurl.com/3k3fruk : http:// bit.ly/owaJDo;;
0;0;Nintendo e minha vida, mas Microsoft tem suas virtudes.;;
0;0;Microsoft launches web-based Windows Phone Marketplace http:// tinyurl.com/688nusx;;
0;0;#Msft - Weekly News Roundup: Microsoft Corporation (NASDAQ:MSFT) http:// bit.ly/nBktkq;;#Msft
0;0;Microsoft cutting Zune Pass cost by 33% with no more free songs to keep http:// tinyurl.com/688nf56;;
0;0;iPhone, iPod touch And iPad Make More Money Than All Of Microsoft 's Products Put Together [REPORT] (via Redmond Pie) http://www. redmondpie.com/iphone-ipod-to uch-and-ipad-make-more-money-than-all-of-microsofts-products-put-together-report/ …;;
0;0;"Your most unhappy customers are your greatest source of learning." Bill Gates, Chairman and former CEO, Microsoft;;
1;0;Raising money for #G3 @xbox , and giving away PSN codes, microsoft points, and live codes, at http:// twitch.tv/ep1cd1m3;@xbox;#G3
0;0;For .NET|Anything Goes| Microsoft |Windows Server freelancers: Add a Novell DOS 7.0 Network to a Windows XP Pro Network http:// omani.ac/1zlb;;
0;0;For Microsoft Access freelancers: MS Access 2007 Database customisation http:// omani.ac/1zoi;;
0;0;http:// dayspas09091.jugem.jp/?eid=128 Microsoft Madonna Game Video Cards Snowboarding Jimmy Kimmel Live Genetic Engineering List of Sports;;
0;0;Soul Calibur V: video gameplay via YouTube http:// goo.gl/fb/mJDIH #games #news #playstation3 #xbox360 #fightinggames #microsoft #mohairborne;;#games #news #playstation3 #xbox360 #fightinggames #microsoft #mohairborne
0;0;http:// bullion09071.jugem.jp/?eid=152 Entertainment Microsoft FreeBSD Pediatrician Computer Printer Matt Damon LLC XBOX Tennis Senator;;
0;0;Thanks for the quick response Microsoft ... Twitter contact integration issue in Mango resolved http:// bit.ly/rcVOcu (via @wpcentral ) #wp7;@wpcentral;#wp7
0;0;câmera de 196 megapixels, não, não http:// bit.ly/p7zUGM e é da microsoft;;
0;0;@FolkertWolfs Antivirus Microsoft verwijderde Chrome http://www. nu.nl/internet/26299 20/antivirus-microsoft-verwijderde-chrome.html … via @nunl;@FolkertWolfs @nunl;
29;3;iPhone, iPod touch And iPad Make More Money Than All Of Microsoft ’s Products Put Together [REPORT] http://www. redmondpie.com/iphone-ipod-to uch-and-ipad-make-more-money-than-all-of-microsofts-products-put-together-report/ …;;
0;0;http:// fee090411news.cocolog-nifty.com/blog/2011/10/m azda-rx7-veils.html … Hyperlink Microsoft Counterstrike Britney Spears Politician Song;;
0;0;Amado Microsoft Word o nome Frejat, não é um erro gramatical ele é um Deus Musical;;
0;0;http:// mommy090111news.cocolog-nifty.com/blog/2011/10/2 010-toyota-cor.html … Kitchen Politician Photography Tom Cruise Microsoft Civil Union;;
0;0;http:// fatherlyfathom2009.blogspot.com/2011/10/aston- martin-dbs-volante-images.html … Microsoft The Real World Common Law Hyperlink;;
0;0;Samsung betaalt Microsoft voor elk Androidtoestel - NU.nl #News > http:// bit.ly/oBKJDv;;#News
0;0;Microsoft Arc Bundle Giveaway: Here is your chance to win a Microsoft Arc Bundle. Ends on October 2nd. http:// bit.ly/pxPN6b;;
0;0;Is Microsoft the “Black Hand” of the Android Kingdom? http:// technobizz.net/?p=1715;;
0;0;:) Zendio Empowers Microsoft Outlook Users to Know When Email is Read; Links Are Clicked microsoft professional http:// bitly.com/r55tbU;;
0;0;microsoft professional Zendio Empowers Microsoft Outlook Users to Know When Email is Read; Links Are Clicked :P http:// bitly.com/r55tbU;;
0;0;http:// bitly.com/r55tbU Zendio Empowers Microsoft Outlook Users to Know When Email is Read; Links Are Clicked microsoft professional;;
0;0;Mango : Microsoft Windows Phone 7.5 http:// goo.gl/fb/78UjD;;
0;0;Microsoft LifeCam VX-3000 Webcam   $22.70 $ USD - Offered By: Buy.com Last Updated: 2011-09-26... http:// tinyurl.com/3gholac #cameras;;#cameras
0;0;Hoy a jugar #xbox360 Live gratis todo el weekend #wtf buena de microsoft a jugar @GearsofWar3 toda la noche ahy q aprovechar el regalo;@GearsofWar3;#xbox360 #wtf
0;0;Microsoft Office 2011 for Mac is ridiculously cool. There are so many new features, and the new logos are awesome.;;
0;0;New Microsoft Corporation Microsoft Pocket Streets 2005 Media Only Detailed Full-Color Maps: Pocket Streets 200... http:// amzn.to/nfABG3;;
0;0;Microsoft RVF-00001 Arc Touch Mouse - $49.99 - Offered By: TigerDirect.com Category: Computers accessories... http:// tinyurl.com/3qe6r5m;;
0;0;www.JobFairUSA.net Help Desk Representative - IT - Microsoft - Software - Hardware http:// goo.gl/q7eiU;;
0;0;Всё-таки хорошо что я не использую платформу андроид RT @opennetru Доход Microsoft от сделок, связанных с платформой Android, оценен в 444;@opennetru;
0;0;anybody got a microsoft word product key that i could have?? please..;;
0;0;Windows Phone Marketplace fo Apps revealed by Microsoft : Source: www.mobileattack.com --- Saturday, October 01, ... http:// bit.ly/r3ztCA;;
0;0;http:// gloss091411news.cocolog-nifty.com/blog/2011/10/b elieve-tattoo.html … Corporatism Apple Computer Adultery Microsoft Julia Roberts Humor;;
0;0;http:// insigna-opc-tunig-news.blogspot.com/2011/10/geezer 1-1968-chevrolet-impala.html … Space Technology Microsoft Song Mitsubishi DVD Truck;;
0;0;http:// breakdown092911.cocolog-nifty.com/blog/2011/10/o wen-jensen-tat.html … Microsoft Kobe Bryant FreeBSD Marketing Dell Computer Love;;
0;0;Kit Teclado Mouse Bluetrack Microsoft Wireless Comfort 5000 - R$ 199,00 http:// produto.mercadolivre.com.br/MLB-199789372- kit-teclado-mouse-bluetrack-microsoft-wireless-comfort-5000-_JM …;;
0;0;Amazon USA #33737 Microsoft Powerpoint: The How-To Guide $2.99: Vook Wish you could put together high quality p... http:// amzn.to/p7CABc;;#33737
0;0;Amazon USA #18447 Microsoft Excel: The How-To Guide $2.99: Vook Mastering Excel will make your more hirable and... http:// amzn.to/oA2jI7;;#18447
0;0;Microsoft Downs Domain that Bred Botnet that Targeted Macs #tech http:// goo.gl/liLpI;;#tech
0;0;Microsoft to Samsung: Where's my money b!tch http:// bit.ly/nUxumk #HackTheNews;;#HackTheNews
0;0;#playstation3 #xbox360 #callofduty #games #porn #fietsroutes #appeltaart #iphone5 #microsoft #bf3 #duitsers #divasdraaiendoor #lelijk #chips;;#playstation3 #xbox360 #callofduty #games #porn #fietsroutes #appeltaart #iphone5 #microsoft #bf3 #duitsers #divasdraaiendoor #lelijk #chips
0;0;RT @WiredFeed : Microsoft Anti-Malware Tool Mistakenly Snuffs Google Chrome: http:// blog-admin.wired.com/wiredenterpris e/wp-admi … http:// bit.ly/p6sYC2 >> lie lie ms on fire;@WiredFeed;
0;0;Home Improvement Modern Style - Photo HD #Gallery http:// the1stchoicetile.com / #Tile #Stone #WA #Seattle , #Kirkland , #Bellevue , #Microsoft , #Boeing;;#Gallery #Tile #Stone #WA #Seattle #Kirkland #Bellevue #Microsoft #Boeing
0;0;Microsoft launches web-based Windows Phone Marketplace http:// tinyurl.com/688nusx;;
0;0;Microsoft cutting Zune Pass cost by 33% with no more free songs to keep http:// tinyurl.com/688nf56;;
0;0;Microsoft Patents Modular Smart Phone Design: Recently, Microsoft has gone and patented a new design for smart p... http:// bit.ly/nQnUGw;;
1;0;Waffle House > iHop RT @_fastlanesavage: RT @mTRILLionare: RT @_fastlanesavage Microsoft Store >>> Apple Store ......... Target >>> WalMart;@_fastlanesavage @mTRILLionare @_fastlanesavage;
0;0;Google Chrome 14.0.835.187 (Stable channel/安定版) Microsoft ...: GoogleのWebブラウザー「Google Chrome」 14.0.835.187（Stabl... http:// bit.ly/n4BO8t;;
0;0;New Guernica: Microsoft guadagna su ogni smartphone Android venduto http:// newguernica.blogspot.com/2011/10/micros oft-guadagna-su-ogni-smartphone.html?spref=tw …;;
0;0;@sanbok Skype for iOS - epic fail of Microsoft !!!Fucking Microsoft !!!)))));@sanbok;
0;0;#DevHourMx pues sony se aprovecha en meter todo el logo de playstation hasta las tables, tvs, etc. o tambien microsoft con su movil;;#DevHourMx
0;0;RT @VentureBeat : Microsoft accidentally deleted Chrome from a few thousand users' computers. Uh... oops? http://ow.ly/6KtCm;@VentureBeat;
0;0;[DE] Bericht: Android bringt Microsoft 444 Millionen Dollar Lizenzgebühren – ZDNet.de http:// bit.ly/nnTj3z;;
0;0;pior do q esperar sua banda favorita voltar em menos de 10 anos, eh acreditar q o pessoal da microsoft vai ler o seu relatorio de erros;;
0;0;http:// claire-van-der-boom-news.blogspot.com/2011/10/disney -channel-stars-help-open.html … Hewlett-Packard Microsoft Mathematician Equity;;
0;0;Quien deberia regalarme una tarjetas de microsoft puntos para mi cumple es @Shundalicious hahahha :$ se te extra;a sabes? u_u;@Shundalicious;
0;0;Rosewill Windows 7 Certified Media Center Infrared Remote Control RRC-127: Important notice: Microsoft Media Cen... http:// bit.ly/qSjkCj;;
0;0;Rosewill Windows 7 Certified Media Center Infrared Remote Control RRC-127: Important notice: Microsoft Media Cen... http:// bit.ly/qSjkCj;;
0;0;Rosewill Windows 7 Certified Media Center Infrared Remote Control RRC-127: Important notice: Microsoft Media Cen... http:// bit.ly/qSjkCj;;
0;0;Rosewill Windows 7 Certified Media Center Infrared Remote Control RRC-127: Important notice: Microsoft Media Cen... http:// bit.ly/qSjkCj;;
0;0;IBM supera Microsoft em valor de mercado http:// bloginfosergio.blogspot.com/2011/10/ibm-su pera-microsoft-em-valor-de.html#more … @TechTudo @GizmodoBR @_Ciencia_Tecno @UOLTecnologia;@TechTudo @GizmodoBR @_Ciencia_Tecno @UOLTecnologia;#more
0;0;Microsoft And Nokia Announce Suite Of ÿFDMicrosoft AppsÿFD For NokiaÿFDs Symbian Belle Platform http:// bit.ly/pzIwzd SkyDrive ios 5 os x _85;;
0;0;Oh Microsoft , off by 1 errors FTW? :P http:// yfrog.com/nzcecp;;
0;0;Aww.. Microsoft Virus detection killed my Chrome.. http://www. microsoft.com/security/porta l/Threat/Encyclopedia/Entry.aspx?name=PWS%3aWin32%2fZbot&threatid=2147598479 …;;
