retweets;favorites;text;mentions;hashtags
0;0;Reading: The Microsoft Engine That Nailed The World Cup Is Predicting Every NFL Game ... - Business... http:// bit.ly/1GgCoJJ @TweetMeMe;@TweetMeMe;
0;0;Microsoft extends fed-only cloud http:// ift.tt/1D5GQyN;;
0;1;. @JustinaBlakeney uses technology to create art, run her business & tuck her daughter in at night http:// tinyurl.com/k22hozj >Thanks @Microsoft;@JustinaBlakeney @Microsoft;
0;0;Microsoft 's Government Cloud Comes Online - Data Center Knowledge http:// bit.ly/134udUV;;
0;0;New #cybersecurity story from http:// CIO.com : " Microsoft Patch Tuesday addresses Exchange and Explorer flaws" http:// ift.tt/1GbdBZp;;#cybersecurity
0;0;Microsoft tells US: The world's servers are not yours for the taking - Ars Technica http:// tinyurl.com/lwjv6be;;
0;0;Microsoft Files Appeal in Ireland Email Case - http:// sshelf.com/4y0;;
0;0;Microsoft Flight Simulator X llegará a Steam (El vuelo 587) Dovetail Games anunció que lanzará una versión... http:// fb.me/1Cs1c3nn5;;
0;0;microsoft buying out doritos -- would that violate some kind of antitrust law?;;
1;0;Microsoft Stores & YouthSpark For The Holidays! http:// goo.gl/Bwhb9Y via @queenofswag4u;@queenofswag4u;
0;0;Microsoft Files Appeal in Ireland Email Case - https:// securityshelf.com/2014/12/09/mic rosoft-files-appeal-in-ireland-email-case/ …;;
0;0;(eWeek) http:// ift.tt/1BxiuMu Microsoft Files Appeal in Ireland Email Case #ITSecurity;;#ITSecurity
0;0;The Microsoft Engine That Nailed The World Cup Is Predicting Every NFL Game - Here Are Its Picks For Week 15 http:// ift.tt/1zqEmHb;;
0;0;Microsoft Files Appeal in Ireland Email Case http:// ift.tt/1BxiuMu #cloud;;#cloud
0;0;Microsoft Files Appeal in Ireland Email Case http:// ift.tt/1BxiuMu #twimbos #techzim;;#twimbos #techzim
0;0;@Microsoft none of your products ever work correctly #notpleased;@Microsoft;#notpleased
0;0;Microsoft 's "Hour of Code" speaks to modern, future job requirements http:// dlvr.it/7mpz0W;;
0;0;La stratégie de Microsoft concernant des développements de produits et services sur d'autres plateformes lui e... http:// bit.ly/1B3LWGS;;
0;0;La stratégie de Microsoft concernant des développements de produits et services sur d'autres plateformes lui e... http:// bit.ly/1B3LWqr;;
0;0;La stratégie de Microsoft concernant des développements de produits et services sur d'autres platefor... http:// bit.ly/1B3LYi5 #Android;;#Android
0;0;Microsoft Officeがなくても、無料でExcelやWordを利用する方法 http:// bit.ly/1lsFMGz;;
0;0;Microsoft tells Windows 10 users to uninstall Office https:// lnkd.in/bhytyZe;;
0;0;Microsoft CEO Nadella visits D.C. to promote cloud products for federal use http:// wapo.st/1wYyXI2;;
0;0;Microsoft 's "Hour of Code" speaks to modern, future job requirements http:// dlvr.it/7mpqkP;;
0;0;Xbox One Twitch TV App Updated, Filters and VOD Added: The team at Microsoft in charge of the Xbox One announc... http:// bit.ly/1B3LM2r;;
0;0;Sway, el nuevo acercamiento de Microsoft para crear presentaciones http:// hipertextual.feedsportal.com/c/33160/f/5389 87/s/4118294d/sc/28/l/0Lbitelia0N0C20A140C120Csway/story01.htm … via @feedly;@feedly;
0;0;The team at Microsoft in charge of the Xbox One announces that the dedicated Twitch streaming application for ... http:// bit.ly/1B3LM2r;;
0;0;Estudiante boricua gana competencia de Microsoft - El Nuevo Día http:// ln.is/www.elnuevodia .com/neg4y … vía @elnuevodia #EducaPR #MIEExpert15 my student won!;@elnuevodia;#EducaPR #MIEExpert15
0;0;'Rise of the Tomb Raider' será distribuido por Microsoft . Square Enix se ha vendido vilmente. Me pensaré muy mucho el darles más dinero.;;
0;0;Microsoft 's "Hour of Code" speaks to modern, future job requirements http:// dlvr.it/7mpp0P;;
0;0;Microsoft Dezember 2014-Patchday-Nachlese http://www. borncity.com/blog/?p=158733;;
0;0;Huddle House, Inc. Goes Live with Microsoft Dynamics® GP and IBIS, Inc. to be ... - Virtual-Strategy... http:// bit.ly/1ujemIh #Dynamics;;#Dynamics
0;1;Estudiante boricua gana competencia de Microsoft - El Nuevo Día http://www. elnuevodia.com/estudiantebori cuaganacompetenciademicrosoft-1907493.html … vía @elnuevodia;@elnuevodia;
0;0;How would you feel when #Nexiuscarriee , #microsoft , #icloud and other big company starting following you in... http:// fb.me/3KJl8zMi0;;#Nexiuscarriee #microsoft #icloud
0;0;Microsoft Officeがなくても、無料でExcelやWordを利用する方法 http:// bit.ly/1lsFMGz;;
0;0;anyone got the product key for microsoft office??;;
0;0;@AngryJoeShow that quote was from the initial annoucement when it was timed. Now that they are publishing the game its all microsoft .;@AngryJoeShow;
0;0;-Natalia, ¿supiste que Microsoft compró Skype por 8.5 billones de dólares? -Qué bobos, si lo podían descargar gratis de Internet!;;
0;2;Our #cloud makes it easy to integrate 3rd party apps. See how we integrate Microsoft Sharepoint: http:// ow.ly/FD731 #saas #apps;;#cloud #saas #apps
0;0;#Microsoft planea vender #Windows10 bajo suscripción http:// pinterest.com/pin/4376232887 66206316/ …;;#Microsoft #Windows10
0;0;New Post: James Henderson Announcing General Availability of Microsoft Azure Government http:// jameshenderson.info/content/announ cing-general-availability-microsoft-azure-government …;;
0;0;I'll probably turn it down but I really don't know yet. Microsoft looks good on any resume;;
0;1;Free 1hr webcast tomorrow at 2:30 on #SharePoint , #BI and reporting. Get the most out of your #Microsoft solution. http:// bit.ly/1yhyIDh;;#SharePoint #BI #Microsoft
0;0;Rise of the Tomb Raider será publicado pela Microsoft , e não pela Square Enix http:// fb.me/41PjTgl8b;;
0;0;Microsoft Sues ‘Does’ For Activating Pirated Software Despite being one of the most pirated software vendors in... http://www. rssmix.com /;;
0;0;Microsoft To US Gov't: the World's Servers Are Not Yours For the Taking http:// ift.tt/1waPEyk;;
0;0;NEW eBook: Microsoft Licensing for Virtual Environments: A fantastic new tool has been published by Altaro. It... http:// bit.ly/1ujeasE;;
0;0;Microsoft garante distribuição de Rise of the Tomb Raider http:// ift.tt/1D4Ni9l #ifttt;;#ifttt
0;0;Internal Memo: #HBO CTO #OttoBerkes explains his abrupt resignation: Otto Berkes, the Microsoft veteran who has… http:// bit.ly/1B3LnwY;;#HBO #OttoBerkes
0;0;Microsoft biedt Office 365 ProPlus gratis aan alle leerkrachten en studenten aan ~ http:// nl.afterdawn.com/nieuws/artikel .cfm/2014/12/09/microsoft-biedt-office-365-proplus-gratis-aan-alle-leerkrachten-en-studenten-aan …;;
0;0;Might work for Microsoft , I have until tomorrow to decide if I wana take the offer or not;;
0;0;http:// ift.tt/1xoZQVq #Deals #0118 Microsoft Surface Pro/Pro 2 10.6 Windows 8 Leather Case Cover w/ Keyboard H... pic.twitter.com/uXPhYcpDiP;;#Deals #0118
0;0;Finding the companion content for your Microsoft Press books https:// lnkd.in/byZN6Eh;;
0;0;Microsoft opens Azure cloud just for US government surveillance: http:// bit.ly/12prKTU;;
0;0;@m_Terry91 @Sty808 Microsoft is now the publisher for Rise of the Tomb Raider (was SquareEnix). Looks like it's back to being an exclusive.;@m_Terry91 @Sty808;
0;0;S/O to my Church Member For Taking Care Of a Brother With Microsoft Offce Stuff;;
0;0;8位： Microsoft Office Personal 2007 日本語版オフィス2007(OEM/DSP)Office2007 http:// dlvr.it/7mplbp;;
0;0;9位： Microsoft Office Professional 2007 日本語版オフィス2007(OEM/DSP)Office2007 http:// dlvr.it/7mpmvk;;
0;0;Buy Computer NOW > http:// ift.tt/1zMOzPI #420 Microsoft Surface Pro/Pro 2 10.6 Windows 8 Leather Case Cover w/... pic.twitter.com/vB0rpnTcLj;;#420
0;0;@wadewoodislove they're not even looking into the lizard squad, if anyone can get them it's Microsoft .;@wadewoodislove;
0;0;Microsoft , Twitter o Yahoo se vuelcan en la plataforma de ciberactivismo Change:  La plataforma recibe 25 mill... http:// bit.ly/134trqK;;
0;0;" Microsoft ’s real job is to be able to help others realize the benefits of this digital transformation” - http:// fedscoop.com/microsoft-unve ils-full-suite-cloud-offerings-aimed-government/#.VIeEKGVZpmw.twitter …;;#
0;0;I think Microsoft named .NET so it wouldn't show up in a Unix directory listing. ― Oktal;;
0;0;Patch Tuesday: Microsoft Finishes 2014 with 7 Security Bulletins http:// ow.ly/FDxFZ;;
0;0;Startup idea: Microsoft Word, but good. You can have that one for free, Silicon Valley.;;
0;0;Microsoft Translator Team Blog - Site Home - MSDN Blogs http:// dlvr.it/7mpqzV;;
0;1;Microsoft SharePoint Designer Team Blog - MSDN Blogs ... http:// dlvr.it/7mpnMy;;
0;0;Microsoft will disable fallback to SSL 3.0 in IE11 on February 10, still has no date for complete SSL 3.0 removal... http:// fb.me/6V1TyTnnR;;
0;0;Microsoft will disable fallback to SSL 3.0 in IE11 on February 10, still has no date for c... http:// afroprofile.com/?p=37396 pic.twitter.com/FZ18Wevi6M;;
0;0;[SEA TechFlash] Mr. Nadella goes to Washington (D.C.): Here's what Microsoft wants from politicians in 2015 http:// dlvr.it/7mpjvk;;
0;0;Microsoft Excel Top Tip Number 11 #Training #IT #Excel http:// goo.gl/SCtfj1 pic.twitter.com/XrW6RkEGSu;;#Training #IT #Excel
0;0;Microsoft Flight Simulator X coming to Steam next week thanks to Dovetail http:// dlvr.it/7mpkpC;;
0;0;Microsoft distribuira Rise of the Tomb Raider http:// tmblr.co/ZnyXsl1XcIXOj;;
0;0;Microsoft Files Appeal in Ireland Email Case: As expected, Microsoft is fighting a New York judge's order to t... http:// bit.ly/1GgBgFY;;
0;0;Microsoft Files Appeal in Ireland Email Case: As expected, Microsoft is fighting a New York judge's order to t... http:// bit.ly/1GgBixJ;;
0;0;Microsoft Files Appeal in Ireland Email Case: As expected, Microsoft is fighting a New York judge's order to t... http:// bit.ly/1GgBixJ;;
0;0;Microsoft opnieuw in beroep tegen dataverzoek Ierse e-mail via @NUnl #data #ms #privacy http://www. nu.nl/internet/39487 08/microsoft-opnieuw-in-beroep-dataverzoek-ierse-e-mail.html …;@NUnl;#data #ms #privacy
0;0;Microsoft Files Appeal in Ireland Email Case: As expected, Microsoft is fighting a New York judge's order to t... http:// bit.ly/1GgBixJ;;
0;0;Microsoft Files Appeal in Ireland Email Case: As expected, Microsoft is fighting a New York judge's order to t... http:// bit.ly/1GgBixJ;;
0;0;" @Microsoft Enables #Lync - #Skype Video Calls http:// bit.ly/1D5ETSQ #cctr RT @manielse;@Microsoft @manielse;#Lync #Skype #cctr
0;0;Microsoft Files Appeal in Ireland Email Case: As expected, Microsoft is fighting a New York ju... http:// bit.ly/1GgBixJ #teamfollowback;;#teamfollowback
0;0;I liked a @YouTube video from @kendrlcks http:// youtu.be/taKmZ0acR8s?a Microsoft and Sony Could Stop the Lizard Squad?;@YouTube @kendrlcks;
0;0;snappy microsoft : submitted by Chris78323 [link] [comment] http:// tinyurl.com/m9ge7mc;;
0;0;Quite a lot of people are angry at Microsoft over the whole Tomb Raider business. That's nothing new.;;
0;0;Microsoft 、7件のセキュリティ情報を公開　「緊急」は3件 ⇒このニュースのTwitterの反応 http:// ift.tt/1B3KKU2;;
0;0;@yaponishi 正確にはSkypeを Microsoft が買ったので統合したって感じだが。;@yaponishi;
0;0;I've been trying to download apps to my Nokia Lumia 530 for 4 hours @Microsoft I'm about to take it back to the store;@Microsoft;
0;0;【新しい話題へのTwitterの反応】 Microsoft 、7件のセキュリティ情報を公開　「緊急」は3件 http:// ift.tt/1B3KKU2;;
0;0;Microsoft tells US: The world's servers are not yours for the taking - Ars Technica http:// goo.gl/fb/hDsQqS;;
0;0;Microsoft Zune HD ahora en dos nuevos colores - #fb http:// tinyurl.com/mflrj5r;;#fb
0;0;" Microsoft loves Linux" Bob Kelly, Corporate Vice President at Microsoft http://www. ubuntu.com/cloud/tools/sn appy …;;
0;1;名刺の自動認識できるAPI、無料公開か。 …… 米 Microsoft 、名刺を自動認識できる「OneNote Beta API」無料公開 http:// internet.watch.impress.co.jp/docs/news/2014 1209_679391.html …;;
0;0;Microsoft Work and Play Bundle pricing approaches Crazy Eddie levels of cheap - PCWorld http:// goo.gl/fb/jP8DyR;;
0;0;The Microsoft Engine That Nailed The World Cup Is Predicting Every NFL Game ... - Business… http:// goo.gl/fb/Yveof5;;
0;0;The Microsoft Engine That Nailed The World Cup Is Predicting Every NFL Game — Here Are Its… http:// goo.gl/fb/qFnSoT;;
0;0;Microsoft Azure Government Comes Out Of Preview @TechCrunch http:// techcrunch.com/2014/12/09/mic rosoft-azure-government-comes-out-of-preview/ …;@TechCrunch;
0;0;#XBOXSUCKS #PLAYSTATIONNATION @Microsoft @Xbox @PlayStation pic.twitter.com/9iBRUJm514;@Microsoft @Xbox @PlayStation;#XBOXSUCKS #PLAYSTATIONNATION
0;0;Переиздание Microsoft Flight Simulator X скоро появится в Steam;;
0;0;In battle over Irish emails, Microsoft warns U.S. 'what if' shoe were on other foot http:// clkon.us/1GfHCFE;;
0;0;Free Microsoft Points http:// xboxguide.tumblr.com /;;
0;0;Deal: Microsoft Store Will Offer $50 Off Xbox One Plus A Free Game Tomorrow http:// dlvr.it/7mpk5g;;
0;0;Deal: Microsoft Store Will Offer $50 Off Xbox One Plus A Free Game Tomorrow http:// dlvr.it/7mpnJl;;
0;0;Deal: Microsoft Store Will Offer $50 Off Xbox One Plus A Free Game Tomorrow http:// dlvr.it/7mpqhJ;;
1;0;So 2015 may see Office 365 from Microsoft store data in Australia which is a step in the right direction. Of... http:// fb.me/3mhJrSyT9;;
0;0;@digiphile @Microsoft @Azure @Amazon @Google So does that mean iCloud is compliant by default?;@digiphile @Microsoft @Azure @Amazon @Google;
0;0;@Microsoft WHY!!! DOES!!! WINDOWS!!!! RESTART!!!! TO!!! UPDATE!!!! WITHOUT!! MY!!! PERMISSION!!!!!!!!!!!!!!!!!!!!!!!!!!!?;@Microsoft;
0;0;Microsoft s Tomb Raider Publishing Deal Similar To Dead Rising 3: *Sorry, Sony fanboys you… http:// dlvr.it/7mpqC3 #xbox #x360 #xboxone;;#xbox #x360 #xboxone
0;0;TNG-9753 MICROSOFT CER... - #KingOfPrussia , PA ( http:// tinyurl.com/m8rqtbn ) Get Sales Engineer Jobs #SalesEngineer #jobs #job #GetAllJobs;;#KingOfPrussia #SalesEngineer #jobs #job #GetAllJobs
0;0;Gears of War 3 (Xbox 360, 2011) #XBox360 #Microsoft #Games #ForSale via @eBay http:// ow.ly/Ff4hX;@eBay;#XBox360 #Microsoft #Games #ForSale
0;0;Microsoft officially unveils its Azure government cloud. Hmm... http:// blogs.seattletimes.com/microsoftpri0/ 2014/12/09/microsoft-officially-unveils-its-government-ready-cloud/#.VIeGEo141wc.twitter … via @seattletimes;@seattletimes;#
0;0;Microsoft Xbox One (Latest Model) FIFA 15 Bundle 50... https:// twib.in/l/MpqggAE7rkM #Deals_UK | https:// twibble.io pic.twitter.com/zuDqiOAZ1x;;#Deals_UK
0;1;Microsoft Corporation is sponsoring SQLSaturday #346 - El Salvador 2015 #sqlsatElSalvador;;#346 #sqlsatElSalvador
0;0;Negli ultimi mesi Microsoft si è segnalata per un grande dinamismo: ha lanciato, annunciato o presentato nuovi... http:// fb.me/6WxGX3n0A;;
0;0;Rise of the Tomb Raider is being developed by Microsoft , but we are still getting a PC version, right? RIGHT?!;;
0;0;UXC Eclipse exploits Microsoft Dynamics CRM Online from Australian datacentres - PC Advisor http:// bit.ly/1zLHX0G;;
0;0;Contrato HIDROSANITARIA.doc - Microsoft Word Onlinv bh https:// onedrive.live.com/view.aspx?Bsrc =Share&Bpub=SDX.SkyDrive&resid=22A6FD3FEACCA850!186&cid=22a6fd3feacca850&app=Word&authkey=!AgAwjk4AxTkGOjA …;;
0;0;A year after Snowden revelations, Microsoft demands NSA reform - #TechTongue #Tech #Mobile http:// tinyurl.com/kjd4dqb;;#TechTongue #Tech #Mobile
0;0;I liked a @YouTube video from @sniparssweg http:// youtu.be/6kxyy1xQaM4?a How 2 get rich using microsoft office ft. big man tyrone ( ͡°;@YouTube @sniparssweg;
0;0;Para cerrar el evento a las 6pm Narancia, Infomovil, Microsoft , Oracle, Seres, y Praxis dando pláticas y talleres #ContabilidadElectronica;;#ContabilidadElectronica
0;0;#JadwalBCBDG 09.00 Presentation Processing with Microsoft Powerpoint(P); 15.00 Financial Reporting with Excel (P),3D Character Training(P);;;#JadwalBCBDG
0;0;Swarm for Windows Phone gains Emoji keyboard support and more in new update http:// dlvr.it/7mpnN2 #microsoft pic.twitter.com/bY2TlLh027;;#microsoft
0;0;. @Microsoft CEO Satya Nadella showcases how even #business giants can pivot for success http:// bit.ly/1mT54Qm @EntMagazine;@Microsoft @EntMagazine;#business
0;0;Microsoft 、7件のセキュリティ情報を公開　「緊急」は3件 http:// dlvr.it/7mppgB;;
0;0;Microsoft Work and Play Bundle pricing approaches Crazy Eddie levels of cheap - PCWorld http:// dlvr.it/7mpmZf;;
0;0;Microsoft の月例パッチの適用が完了しました。 普段私が使っているマシンでは、Win7で18件、Win8.1でオプション含めて12件ありました。 今月の件数はやや多めです。... http:// fb.me/4nIzs2Gd6;;
1;2;［ http://www. itmedia.co.jp ］「Windows」頼みはもう卒業、 Microsoft の“次の一手”は？ http:// bit.ly/1D5xjI5;;
0;0;Microsoft To US Gov't: the World's Servers Are Not Yours For the Taking http:// ift.tt/1wwiYRX;;
0;0;Microsoft Surface Pro 3 4GB/128GB - MQ2-00001 - $999.00 - http:// goo.gl/W8Fo8G;;
0;0;Microsoft 、12月のWindows Update（月例セキュリティ情報）計7件（緊急3件、重要4件）公開 http:// twiutil.com/s/?s=s0055 via @LifeGpper pic.twitter.com/abynrZmaOS;@LifeGpper;
0;0;Microsoft Surface Pro 3 i7 8GB/512GB - $1949.99 - http:// goo.gl/aAcCtt;;
0;0;Microsoft Windows 10 to go subscription-based à la Office 365? Aw hell no!;;
0;1;Gostei de um vídeo @YouTube http:// youtu.be/uEP1nffkyMc?aH oje … no TecMundo (09/12) - preço do Note Edge, G Watch R2, Microsoft contra;@YouTube;
6;0;Microsoft opens Azure cloud just for US government surveillance http:// reg.cx/2dv3;;
0;0;Microsoft opens Azure cloud just for US government surveillance http:// reg.cx/2dv3;;
0;0;[ITmedia News 速報 最新記事一覧] Microsoft 、7件のセキュリティ情報を公開　「緊急」は3件 http:// rss.rssad.jp/rss/artclk/Jhg hW3hNszbI/4c59e7724a3f2ada1dc4928a7297862b?ul=XqtFBh4X2lullovj5p_PgwHGZDdiSY7UoGlRELN0xs1pUcTaLmmm8u_dGGuvdN6R4deh9TJQ9ekRlJ59vAqqQTMJOXT2yJDXwr.iAwPpLikTPsXgui3CbLLLKpxlpGCMa3EAGwd …;;
0;0;. @Microsoft 's @Azure is live & compliant with FedRAMP: http:// techcrunch.com/2014/12/09/mic rosoft-azure-government-comes-out-of-preview … Uncle Sam has an alternative to @Amazon . @Google now lags?;@Microsoft @Azure @Amazon @Google;
0;0;PlayStation Experience, Microsoft X15, jRPGs... http:// bit.ly/134sLlp;;
0;0;PlayStation Experience, Microsoft X15, jRPGs... http:// bit.ly/1Gg0JiL vía @GamerHispano;@GamerHispano;
0;0;The Microsoft Engine That Nailed The World Cup Is Predicting Every NFL Game ... - Business Insider http:// bit.ly/1zqBSIT;;
0;0;@MSFTnews Where can I buy the Microsoft Band?;@MSFTnews;
0;0;Microsoft 、7件のセキュリティ情報を公開　「緊急」は3件 http:// ift.tt/1wdIrMI;;
0;0;Microsoft confirms Rise of the Tomb Raider publishing plans http:// newinly.com/31yjh5x94;;
0;0;Microsoft CEO Vows To Hire More People Who Are Not White Or Male http:// j.mp/1IcVDrA #microsoft #satyanadella;;#microsoft #satyanadella
0;0;Microsoft 、iPhone版OneNoteにノート作成機能を、Mac版には印刷機能を追加(「iPhoneアプリ」最新記事一覧‐ITmedia キーワード) / http:// bit.ly/R61c4G;;
0;0;vtnc microsoft tbm com esses emails de merda tdo bugado;;
0;0;Microsoft To US Gov't: the World's Servers Are Not Yours For the Taking http:// flip.it/og9Hf;;
0;0;【12ヶ月保証】DELL OPTIPLEX 790 [+ Microsoft Office 2007 Personal][+3584MB増設済]特選 中古パソコンデスクトップ 省スペース Windows http:// hb.afl.rakuten.co.jp/hgc/g00reed5.2 ncy34dd.g00reed5.2ncy4821/?pc=http%3A%2F%2Fitem.rakuten.co.jp%2Fpasokore%2F4bt214067-470%2F&m=http%3A%2F%2Fm.rakuten.co.jp%2Fpasokore%2Fi%2F10400152%2F …;;
0;1;6 – Microsoft billionaire takes on cell biology - http:// runwhere.com/?p=49090 #startups #business;;#startups #business
0;0;On route home after 9 hours worth of uni work. I have a sore head and sore eyes from 9 hours of Microsoft Word bashing. Need kebab!;;
0;0;No puede ser ¿enserio? Osea me compro la Xbox One hace un mes, y se me jode el lector. WTF! @Xbox_Spain @Microsoft;@Xbox_Spain @Microsoft;
0;0;Nuovo eBook: Microsoft licensing per ambienti virtuali: Altaro software ha pubblicato un nuovo tool di grande ... http:// bit.ly/1vLVHJQ;;
0;0;Has Microsoft Introduced a Hole in your Patching Program? | DDI Frontline Blog http:// digitaldefen.se/1ymwPJl;;
0;0;@Lumia Microsoft MUST introduces a new and great Lumia flagship to market at the earliest possible;@Lumia;
0;0;Microsoft Azure Government Comes Out Of Preview http:// fb.me/3K8fd1xhy;;
0;0;#Microsoft Will Let Customers Run Its Software On #Google 's Cloud http:// uk.businessinsider.com/microsoft-will -let-customers-run-its-software-on-googles-cloud-2014-12 …;;#Microsoft #Google
0;1;Microsoft users not happy over quiet SharePoint Online feature cuts http://www. zdnet.com/article/micros oft-users-not-happy-over-quiet-sharepoint-online-feature-cuts/ …;;
0;0;Love our new Microsoft Openness site http:// bit.ly/1qrzD6v;;
0;0;Microsoft 、7件のセキュリティ情報を公開　「緊急」は3件 http:// dlvr.it/7mpfjZ 【ITmedia】;;
0;0;@NBA2K @LD2K @Ronnie2K Microsoft needs to hurry up with the update!;@NBA2K @LD2K @Ronnie2K;
1;2;20% of Microsoft Azure is running Linux... Imagine a similar statement 10 years ago #GartnerAADI;;#GartnerAADI
0;0;Microsoft Will Publish Rise of the Tomb Raider http:// ift.tt/1Acj4vf #videogames;;#videogames
0;0;Microsoft Azure Government Comes Out Of Preview http:// dlvr.it/7mpj9g #themesh #technology;;#themesh #technology
0;0;Microsoft 、7件のセキュリティ情報を公開　「緊急」は3件 http:// dlvr.it/7mpfM5 【ITmedia】;;
0;0;Join The Microsoft store #MSFTHoliday Twitter Party http:// goo.gl/PXzaOS via @makobiscribe;@makobiscribe;#MSFTHoliday
0;0;Showtime Anytime is now streaming on Xbox One #microsoft http:// bit.ly/1wdJ2hu;;#microsoft
0;0;7 tips for your performance review #microsoft http:// bit.ly/1wdJ210;;#microsoft
0;0;Saad (': microsoft sam http:// fb.me/1NIUKpeOE;;
0;0;Russisch Roulette beim Update: Ein Microsoft -Patch crasht Windows & Office http:// fb.me/2CebU7X0a;;
0;0;Feeling like a Beta VCR owner @carolduncan . Good platform, but Microsoft was late to market & are playing catch-up. @TheOpalUser @OpalappAU;@carolduncan @TheOpalUser @OpalappAU;
0;0;Quem tem XBOX 360 e pode me auxiliar? Sou nova nesse mundo microsoft , sou sonysta ;-;;;
0;0;@mrgan yeah, I understood. And good point. Microsoft would be failing their customers if they weren't where the users were;@mrgan;
0;0;Microsoft releases Azure Government for the unique needs of government customers http:// bit.ly/1waOnHu;;
0;0;The Microsoft Engine That Nailed The World Cup Is Predicting Every NFL Game ... - Business Insider: Business I... http:// bit.ly/1ujd4NA;;
45;28;Awesome entrance to @Microsoft DC offices! Do you think we can reach 100 million students with the #HourOfCode ? pic.twitter.com/c3zbFYGnt9;@Microsoft;#HourOfCode
0;0;Microsoft Store - $70.99 off Acer V3-112P-P7LP-US 11.6&quot; (4GB) (500GB) Now: $329 http:// goo.gl/fb/5t2ZPT;;
0;0;Microsoft Store - $100.99 off Acer Storm 2 Touch 13.3&quot; 2560x1440 i7-4510U/8GB/256GB Now… http:// goo.gl/fb/L6Zvsd;;
0;0;Microsoft Store - $80.99 off Acer Switch Black 10.1&quot; 1366x768 BayTrail-T Z3735F/2GB… http:// goo.gl/fb/HtBiHx;;
0;0;Microsoft Security Bulletin Summary for November 2014 / Admin Rights Related Vulnerabilities http:// odai.co/p/wb;;
0;0;Microsoft Is Launching Showtime Anytime On Xbox One http:// weeder.org/rLH3p7V #tech #gadgets;;#tech #gadgets
0;0;Microsoft #Xbox 360 4GB Slim Console w/ Accessories! http:// ebay.to/1tLjfgY pic.twitter.com/gcghmCTxv8;;#Xbox
0;0;Microsoft Lumia Poland shows us how to make cool steadycams using household objects http:// bit.ly/1waOkLP;;
0;0;Microsoft Officeがなくても、無料でExcelやWordを利用する方法 http:// bit.ly/1lsFMGz;;
0;0;Enter for a chance to win a $500 Walmart Gift and a Microsoft Windows device, plus other great prizes! http:// ln.is/gleam.io/2hgTM;;
0;0;Microsoft calls out U.S. government for double standard in email warrant case (Todd Bishop/GeekWire) http:// buff.ly/1BwoxRD;;
0;0;#GameUP Microsoft anuncia redução nos preços do Xbox 360 no Japão tag: http:// blogger.com ,1999:http://t.co/IhY4FKXpv1-3432516088724771948;;#GameUP
0;0;#GameUP Rise of the Tomb Raider será publicado pela Microsoft tag: http:// blogger.com ,1999:http://t.co/IhY4FKXpv1-2207584232098334790;;#GameUP
0;0;Microsoft enables Skype and Lync video integration | ZDNet http:// buff.ly/1ytRpJ6 #skype #video #lync;;#skype #video #lync
0;0;#GameUP “Rise of the Tomb Raider” será publicado pela Microsoft http:// popgames.pop.com.br/?p=64412;;#GameUP
0;0;@null Microsoft 、7件のセキュリティ情報を公開　「緊急」は3件 http:// ift.tt/1wdIrMI ITmedia RSS更新☆2 ##rogerco9pel;@null;# #rogerco9pel
0;0;#GameUP Microsoft comenta a exclusividade de Street Fighter V no PlayStation 4 http://www. supergameplay.com.br/?p=33692;;#GameUP
1;0;Microsoft Flight Simulator X coming to Steam next week thanks to Dovetail http:// dtoid.it/134s77m;;
0;2;@slobonmyrobb @CGBreezy13 single space Microsoft Himalaya font size ten and just sit there and type like two pages and your basically done;@slobonmyrobb @CGBreezy13;
0;0;Microsoft 、7件のセキュリティ情報を公開　「緊急」は3件 http:// dlvr.it/7mpdbM;;
0;0;The most serious and complete Microsoft Band review I've seen: "A few weeks with the Microsoft Band http:// feeds.encosia.com/~r/Encosia/~3/ f7XCLUsDTMo/ … ";;
0;0;If Microsoft did porn, they might be called Microshaft;;
0;0;Одно из новых обновлений для Windows 10 TP Build 9879 не устанавливается из-за наличия Microsoft Office на ПК http:// bit.ly/1IwpgUI;;
