retweets;favorites;text;mentions;hashtags
0;0;@DetectRight RT Microsoft Windows Media Player just overtook UserAgent NSPlayer/11.00.6001.7006 WMFSDK/11.00.6001.700 .. http://8ti.de/b4mN;@DetectRight;
0;0;Office Ultimate 2007: Microsoft Office Ultimate 2007 provides people at home or work with a comprehensive set of t... http://bit.ly/9mRdsN;;
0;0;@DetectRight RT Microsoft Windows Media Player just overtook UserAgent NSPlayer/11.0.6002.18005, who lost their digni .. http://8ti.de/b4mM;@DetectRight;
0;0;@DetectRight RT Microsoft Windows Media Player just took over UserAgent NSPlayer/12.00.7600.16385 WMFSDK/12.00.7600.1 .. http://8ti.de/b4mL;@DetectRight;
0;0;Microsoft Announces New Mobile OS http://bit.ly/9ievKI;;
0;0;Print Manager Plus 2010 Now Supports Microsoft XPS http://ow.ly/182cE Control office printing costs;;
0;0;@DetectRight RT Microsoft Windows Media Player CE just got married to UserAgent NSPlayer/9.0.0.3270 WMFSDK/9.0, who l .. http://8ti.de/b4mK;@DetectRight;
0;0;Microsoft Announces New Mobile OS http://bit.ly/aJ67v9;;
0;0;Microsoft Announces New Mobile OS http://bit.ly/dCgW7t;;
0;0;Microsoft Announces New Mobile OS http://bit.ly/dbXjzN;;
0;0;@microsoft _cares i'll take the pin, do we get to keep the keyboard and if we do we decided daniel gets to keep it.;@microsoft;
0;0;Microsoft Announces New Mobile OS http://bit.ly/abCZFm;;
0;0;Chart: US smartphone platform share (... Microsoft needs a win with Windows Phone 7 Series) http://bit.ly/aQDI51 #mobile;;#mobile
0;0;Microsoft Announces New Mobile OS http://bit.ly/djooTV;;
0;0;別物になっちゃいけないと思うんだけどなぁ。 RT @itmedia : [News]Windows 8は「まったく違うものになる」―― Microsoft 関係者が語る http://bit.ly/bd7t9E;@itmedia;
0;0;Microsoft Announces New Mobile OS http://bit.ly/9BCOnd;;
0;0;Microsoft Announces New Mobile OS http://bit.ly/cGha3G;;
0;0;@Iam_Talib nothin much....i think i mighht b workin @a temp job 4 microsoft soon nd im bout 2 start berklee online.....;@Iam_Talib @a;
0;0;Microsoft Anoints AT&T as Preferred Windows Phone 7 Carrier - PC World http://bit.ly/d7d9wx;;
0;0;Windows Phone 7 Interface: Microsoft Has Out-Appled Apple http://post.ly/ODZj;;
0;0;Windows Phone 7 Interface: Microsoft Has Out-Appled Apple: http://digg.com/d31It9V?t;;
0;0;Not like Microsoft to keep us developers waiting! Windows Phone 7 Series dev. platform announcement not until 15 March at MIX conference :o(;;
0;0;How exactly is Microsoft going to comeback into play in the mobile market? While the windows 7… http://goo.gl/fb/Enby;;
0;0;Malware [Itnews]Gumblar malware detected on ninemsn - Overclock.net ...: Microsoft 's ad server dishes up malware l... http://bit.ly/cd2FTw;;
0;0;Re: 5000 Seriales Genuinas Actualizadas Para Productos de Microsoft : Gracias http://bit.ly/a0AAHV;;
0;0;Microsoft has a " microsoft store" now? Fucking biters!;;
0;0;Documents To Go® ( Microsoft Word &... included in HUGE promo code contest for #BestAppEver Awards from @148Apps :: http://bit.ly/cQmUZd;@148Apps;#BestAppEver
0;0;Microsoft honoured for Inuit language software: http://www.cbc.ca/consumer/story/2010/02/16/nunavut-microsoft.html;;
0;0;Google Maps vs. Bing Maps: Microsoft aumenta su cuota de mercado http://bit.ly/cjmxA5;;
0;0;#9: Microsoft Visual Basic 4.0 Standard Edition http://ff.im/-g3b4U;;#9
0;0;@Hi_Dann Microsoft will always be 4 years behind. I think I watched Steve bullmer is it? Say they're 4 years behind not so long ago on utube;@Hi_Dann;
0;0;@Microsoft I Can't use that tool... Do you have that in .deb??;@Microsoft;
0;0;[News]Windows 8は「まったく違うものになる」―― Microsoft 関係者が語る http://bit.ly/bd7t9E;;
0;0;Softwzone.com - Translating Microsoft Dynamics Gp To Foreign Language: If your organization depl.. http://bit.ly/bWUlG9;;
0;0;Windows 7 RC coming to an end -- This is an email I received from Microsoft tod http://mlmanley.com/02162010/windows-7-rc-coming-to-an-end/;;
0;0;Microsoft launches Windows Phone 7 - http://bit.ly/bN7NOj;;
0;0;@innovatebig Microsoft unveils new mobile operating system http://bit.ly/bv4M8Q;@innovatebig;
0;0;Das Entscheidende beim neuen Windows Mobile ist, das Microsoft es von der Desktop-Software trennt. Eigenständiger Ansatz für Mobiltelefonie;;
0;0;Microsoft debuts Windows Phone 7 Series: http://bit.ly/bhz8gg;;
0;0;Microsoft Office 2010: al descubierto sus versiones y novedades http://ow.ly/18296 Tiene buena pinta.;;
0;0;Anyone try Microsoft Mouse Mischief? http://tinyurl.com/yb7fq6k;;
0;0;Hiring a Director, Communications - 711748 at Microsoft (Redmond, WA) http://bit.ly/cQunXc #jobs #shjobs;;#jobs #shjobs
0;0;Microsoft Communication Services: As someone intimately familiar with Microsoft Communication Services – I thought... http://bit.ly/c3ZjKw;;
0;0;Анонсирован выход Microsoft BizTalk Server Management Pack для Operations Manager 2007: Мы рады представить Micros... http://bit.ly/aI7vWZ;;
0;0;Цитата #12327: dli: SP2 для Microsoft Office SharePoint Portal Server 2003 Известные проблемы после установки пак... http://bit.ly/bbRx2n;;#12327
0;0;RT @windowsphone : RT @WMPoweruser : Bloomberg Analyst – Microsoft `Revolutionized’ Windows Phone http://bit.ly/ahyDe0 #WP7;@windowsphone @WMPoweruser;#WP7
0;0;"Only version 1.0 of Microsoft Silverlight supports the Macintosh PowerPC." Weet iemand waar ik die versie nog kan krijgen? #durftevragen;;#durftevragen
0;0;Still having trouble with the "Blue Screen" on your computers? Call Microsoft ,(800-642-7676) Using SecureIT call 877-373-3320.;;
0;0;Name:ROB-PC,OSVer: Microsoft Windows NT 6.1.7600.0,Procs:4,User:Rob;;
0;1;UK government is upgrading to Microsoft Vista instead of Windows 7 http://bit.ly/aiNKIl;;
0;0;Get Microsoft Office 2007 for FREE (YouTube) http://bit.ly/95mqLw;;
0;0;Microsoft Windows Media Player CE just subsumed UserAgent NSPlayer/8.91 WMPCE/8.91.01.8547, who drank a final beer. True story.;;
0;0;Microsoft Windows Media Player CE just accepted UserAgent NSPlayer/9.0.0.3250 WMFSDK/9.0, who voted for Barack Obama. True story.;;
0;0;Microsoft Windows Media Player CE just got married to UserAgent NSPlayer/9.0.0.3270 WMFSDK/9.0, who lost their dignity. True story.;;
0;0;Microsoft Windows Media Player CE just overtook UserAgent NSPlayer/9.0.0.3268, who lost their temper. True story.;;
0;0;Microsoft Windows Media Player CE just subsumed UserAgent NSPlayer/8.9_WMPCE/8.9.01.3100, who forgot who they were. True story.;;
0;0;Microsoft Windows Media Player CE just got married to UserAgent NSPlayer/9.0.0.3250, who forgot who they were. True story.;;
0;0;Microsoft Windows Media Player CE just accepted UserAgent NSPlayer/9.0.0.2980, who drank a final beer. True story.;;
0;0;Microsoft Windows Media Player CE just took over UserAgent PC2M/0.9.22.9 (Mobilla1.0; Website Transcoder for Mobile Clients; http://m.env.ne;;
0;0;DetectRight just created a new Application: Microsoft Windows Media Player CE;;
0;0;Microsoft Windows Media Player just took over UserAgent NSPlayer/12.00.7600.16385 WMFSDK/12.00.7600.16385, who lost their dignity. True stor;;
0;0;Microsoft Windows Media Player just subsumed UserAgent NSPlayer/10.0.0.3705 WMFSDK/10.0, who drank a final beer. True story.;;
0;0;Microsoft Windows Media Player just took over UserAgent NSPlayer/11.0.6000.6351 WMFSDK/11.0, who lost their identity. True story.;;
0;0;Microsoft Windows Media Player just got married to UserAgent NSPlayer/11.0.6000.6346, who drank a final beer. True story.;;
0;0;Microsoft Windows Media Player just subsumed UserAgent NSPlayer/11.0.6002.18049 WMFSDK/11.0, who voted for Barack Obama. True story.;;
0;0;Microsoft Windows Media Player just overtook UserAgent NSPlayer/11.0.6002.18005, who lost their dignity. True story.;;
0;0;Microsoft Windows Media Player just subsumed UserAgent NSPlayer/10.0.0.3802, who drank a final beer. True story.;;
0;0;Microsoft Windows Media Player just subsumed UserAgent NSPlayer/7.1.0.3055 - Via_Cisco_Content_Engine, who lost their temper. True story.;;
0;0;Microsoft Windows Media Player just subsumed UserAgent NSPlayer/11.0.5721.5265 WMFSDK/11.0, who drank a final beer. True story.;;
0;0;Microsoft Windows Media Player just took over UserAgent NSPlayer/11.00.6001.7113 WMFSDK/11.00.6001.7113, who voted for Barack Obama. True st;;
0;0;Microsoft Windows Media Player just got married to UserAgent NSPlayer/4.1.0.3858, who merged bountifully. True story.;;
0;0;Microsoft Windows Media Player just subsumed UserAgent NSPlayer/10.0.0.4072 WMFSDK/10.0, who merged bountifully. True story.;;
0;0;Microsoft Windows Media Player just accepted UserAgent NSPlayer/11.00.6002.18049 WMFSDK/11.00.6002.18049, who merged bountifully. True story;;
0;0;Microsoft Windows Media Player just got married to UserAgent NSPlayer/11.00.6000.6351 WMFSDK/11.00.6000.6351, who lost their temper. True st;;
0;0;Microsoft Windows Media Player just accepted UserAgent NSPlayer/10.0.0.3650, who lost their identity. True story.;;
0;0;Microsoft Windows Media Player just accepted UserAgent NSPlayer/10.0.0.4066, who merged bountifully. True story.;;
0;0;Microsoft Windows Media Player just overtook UserAgent NSPlayer/11.00.6001.7006 WMFSDK/11.00.6001.7006, who lost their dignity. True story.;;
0;0;DetectRight just created a new Application: Microsoft Windows Media Player;;
0;0;MWC 2010: Orange becomes a partner of Microsoft in Europe http://goo.gl/fb/nhDl;;
0;0;Hiring a Product Marketing Manager - External - 710653 at Microsoft (Bellevue, WA) http://bit.ly/dk6nF6 #jobs #shjobs;;#jobs #shjobs
0;0;Hiring a Sr Marketing Manager at Microsoft (Redmond, WA) http://bit.ly/dchle3 #jobs #shjobs;;#jobs #shjobs
0;0;Hiring a Senior Marketing Manager - External - 710342 at Microsoft (Bellevue, WA) http://bit.ly/9UiP3M #jobs #shjobs;;#jobs #shjobs
0;0;Hiring a Public Relations Manager - Trustworthy Computing - 709604 at Microsoft (Redmond, WA) http://bit.ly/9UF2Ox #jobs #shjobs;;#jobs #shjobs
0;0;Microsoft Tag - http://www.handy-faq.de/forum/showthread.php?t=111040;;
0;0;Microsoft Windows Phone 7 series unveiled[I Heart Tech] http://tinyurl.com/yle5v7m;;
0;0;Hiring a System Administrator Microsoft - Ts / Sci Fs Pg - 43712 at CACI (Aurora, CO) http://bit.ly/ablnE6 #jobs #shjobs;;#jobs #shjobs
1;0;Malicious Web Site / Malicious Code: Microsoft ’s Ninemsn Australia Web Site Compromised http://is.gd/8xj63;;
0;0;Update Windows 7 WAT, Disable Activation Crack: Microsoft rupanya sudah lama mengetahui bahwa sistem Windows 7 yan... http://bit.ly/9MPfGa;;
0;0;Getting Laid off from Microsoft . | Funniest Video of the Day: http://bit.ly/bIpqrw via @addthis;@addthis;
0;0;HardMicro.fr [Macworld 2010] Microsoft présente Office pour Mac 2011: À l'occasion du Macworld 2010 qui s'est tenu... http://bit.ly/cZgg4w;;
0;0;Documents To Go® ( Microsoft Word &... included in HUGE promo code contest for #BestAppEver Awards from @148Apps :: http://bit.ly/cQmUZd;@148Apps;#BestAppEver
0;0;Windows Phone 7: Microsoft ’s Mobile Do or Die: Yesterday, Microsoft wowed Barcelona with its brand new mobile phon... http://bit.ly/aU8T36;;
0;0;iPhone tip Microsoft unveils new smartphone software - Seattle Times http://ow.ly/16APgs;;
0;0;iPhone tip Microsoft unveils new smartphone software - Seattle Times http://ow.ly/16APgr;;
0;0;Just checked Windows Phone Series 7 interface, it's awesome! Looks like a Zune on steroïds. #Microsoft seems to take the right direction!;;#Microsoft
0;0;I hate Microsoft Windows.;;
0;0;[bnet] Windows Phone: May the Most Gorgeous OS Win - Microsoft (MSFT) unveiled a fresh-faced revision of their mobi... http://ow.ly/16APjl;;
0;0;Microsoft has Out-Appled Apple. While the phone looks promising, let's see the final product. what are your thoughts? http://tr.im/OuyA;;
0;0;700 Millionen zu wenig? Yelp lehnt Angebot von Microsoft ab. http://bit.ly/aTw6D3;;
0;0;Hiring a Director, Communications - 711748 at Microsoft (Redmond, WA) http://bit.ly/cQunXc #jobs #shjobs;;#jobs #shjobs
0;1;Dando uma olhada nas start ups do festival SXSW, patrocinadas pelo Microsoft BizSpark http://is.gd/8xiLa;;
0;0;#Enterprise #Microsoft _Windows on 2 Fav Sources+1 other like Mashable!-7 Things to Consider for Social Media in th... http://bit.ly/cS5Q9K;;#Enterprise #Microsoft
0;0;Microsoft challenges Google's Android with upgraded mobile platform http://bit.ly/dkhqZk #tech;;#tech
0;0;Microsoft Builds Zune, Xbox Into New Windows Phone Platform http://www.technewsworld.com/story/69352.html kind of cool...;;
0;0;Just finished updating Ch. 10, "Understanding Access Operators and Expressions" for " Microsoft Access 2010 in Depth" #Access2010 #Office2010;;#Access2010 #Office2010
0;0;Office Ultimate 2007: Microsoft Office Ultimate 2007 provides people at home or work with a comprehensive set of t... http://bit.ly/d1lyV1;;
0;0;Windows Phone: May the Most Gorgeous OS Win: Microsoft (MSFT) unveiled a fresh-faced revision of th.. http://tinyurl.com/ybquevk #tech #news;;#tech #news
0;0;Forwarding Outlook emails to other account in an intelligent way: A VBS macro for Microsoft Outlook that forwards ... http://bit.ly/aq1kWI;;
0;0;#MVP10 #MVPbuzz Free IS Decisions software NFR licenses for Microsoft MVPs: http://ow.ly/180JJ | MVP? Please enjoy and RT!;;#MVP10 #MVPbuzz
0;0;rt @gannotti Microsoft 's new Windows Phones add Xbox, Zune, 'live tile' design http://bit.ly/b6Q6Iy;@gannotti;
0;0;Google and Microsoft Vie for iPhone Search Presence. > http://rfly.me/70a / (via @MacRumors );@MacRumors;
0;0;90576:Sev4:Windows: Microsoft Windows Kernel Elevation Privilege Vulnerability (MS10-015 and KB977165);;
0;0;116887:Sev5:Local: Microsoft Windows TCP/IP Remote Code Execution Vulnerability (MS10-009);;
0;0;Microsoft Introduces New Zune-inspired Smartphone Software - Digital Media Wire #zune http://bit.ly/dvhNew;;#zune
0;0;116886:Sev4:Local: Microsoft Windows Client/Server Run-time Subsystem Elevation of Privilege Vulnerability (MS10-011);;
0;0;Why Microsoft ? Word vs. Writer: http://bit.ly/ce6whA | Excel vs. Calc: http://bit.ly/cYYQxw | PowerPoint vs. Impress: http://bit.ly/amTwp3;;
1;0;40 cosas de Microsoft que probablemente no sabes http://bit.ly/b6LKgJ #tecnologia #internet #windows;;#tecnologia #internet #windows
0;0;Microsoft unveils Windows Phone 7 series - eChannelLine http://url4.eu/1QCEi;;
0;0;Windows Phone 7 a good start, but questions persist: Microsoft 's brought out a new mobile operating system like it... http://bit.ly/92U7YQ;;
0;0;90578:Sev5:Windows: Microsoft Windows Shell Handler Remote Code Execution Vulnerability (MS10-007);;
0;0;90577:Sev5:Windows: Microsoft SMB Client Remote Code Execution Vulnerability (MS10-006);;
0;0;90581:Sev4:Windows: Microsoft Windows Paint Remote Code Execution Vulnerability (MS10-005);;
0;0;Microsoft Windows 7 Ultimate $263.50 http://amazot.com?tweet=9519;;
0;0;Microsoft Windows 7 Professional $268.99 http://amazot.com?tweet=9518;;
0;0;90580:Sev4:Windows: Microsoft Windows Server 2008 Hyper-V Denial of Service Vulnerability (MS10-010);;
0;0;90579:Sev5:Windows: Microsoft SMB Server Remote Code Execution Vulnerability (MS10-012);;
0;0;110113:Sev4:Office Application: Microsoft Office Remote Code Execution Vulnerability (MS10-003);;
0;0;Daft UK government will upgrade to Microsoft Vista, snub Windows 7 - Digital Lifestyle - Macworld UK http://shar.es/m1xmI via @sharethis;@sharethis;
0;0;90584:Sev5:Windows: Microsoft DirectShow Remote Code Execution Vulnerability (MS10-013);;
0;0;Microsoft Windows 7 Ultimate Upgrade $185.00 http://amazot.com?tweet=9517;;
0;0;Succinct article with everything known so far: " Microsoft unveils Windows Phone 7 Series hotness" http://arst.ch/edl via @arstechnica;@arstechnica;
0;0;90583:Sev4:Windows: Microsoft Windows Cumulative Security Update of ActiveX Kill Bits (MS10-008);;
0;0;90582:Sev4:Windows: Microsoft Windows Kerberos Denial of Service Vulnerability (MS10-014);;
0;0;@cairnsdave pfft :P I'm on the phone to my manufacturer atm cause microsoft sucks. *sigh* sys restore for the lose.;@cairnsdave;
0;0;So microsoft I'm havin a lil problem .... Fuck xbox!!! http://tweetphoto.com/11618366;;
0;0;110108:Sev4:Office Application: Microsoft PowerPoint OEPlaceholderAtom Use-After-Free Vulnerability (MS10-004);;
0;0;110107:Sev4:Office Application: Microsoft PowerPoint LinkedSlideAtom Heap Overflow Vulnerability (MS10-004);;
0;0;110109:Sev4:Office Application: Microsoft PowerPoint Remote Code Execution Vulnerability (MS10-004);;
0;0;Gumblar malware detected on ninemsn: Microsoft 's ad server dishes up malware links. http://bit.ly/cvE06o;;
0;0;Need Microsoft Office? Check out http://tiny.cc/1psqa for a real steal on MS products!;;
0;0;Google Buzz slammed by Yahoo and Microsoft http://money.cnn.com/2010/02/09/technology/google_buzz_yahoo_microsoft/;;
0;0;@janepyle @A_Silvers @nickgould @nickf Wasn't that what the #ixd10 talk about working at Microsoft about? (Didn't see it so not sure).;@janepyle @A_Silvers @nickgould @nickf;#ixd10
0;0;Now at the MVP technical sessions in a Microsoft office I haven't visited before in the center of Bellevue. Gary just finished DevXprss demo;;
9;1;RT @WMPoweruser : Bloomberg Analyst – Microsoft `Revolutionized’ Windows Phone http://bit.ly/ahyDe0 #WP7;@WMPoweruser;#WP7
0;0;eCOST - $30 off Microsoft Xbox 360 Elite 120GB Console: Microsoft Xbox 360 Elite 120GB Console - $217.00 (Save $30) http://bit.ly/aLCLy9;;
0;0;I totally didn't know it was Shrove Tuesday, thanks a lot Microsoft Outlook (if it doesn't ding at me, I don't know what's going on);;
0;0;MWC 2010: Microsoft rules out entering mobile handset market: Microsoft chief executive Steve Ballmer has confirme... http://bit.ly/dsTjOK;;
0;0;[TechNet Blogs] Microsoft ’s Windows Azure Platform Gains Traction Among Hosting Providers: This week at PDC 2009,... http://bit.ly/9hA3mH;;
0;0;[TechNet Blogs] New SCE 2010 Training for Microsoft Partners: As we move from the Release Candidate to the final S... http://bit.ly/dnvnfs;;
0;0;[TechNet Blogs] Announcing! Microsoft Virtualization Summit 2010 – From the Desktop to the Datacenter: From the Dy... http://bit.ly/9X6YhQ;;
0;0;Candace Washington's Online Resume | Candace, WA | http://ResumeBucket.com/canjohnson | #CUSTOMER #SERVICE #MICROSOFT #TEXAS #CALLS RT!;;#CUSTOMER #SERVICE #MICROSOFT #TEXAS #CALLS
0;0;APPCRAFT Software Announcing! Microsoft Virtualization Summit 2010 – From the Desktop to the Datacenter: From the ... http://bit.ly/bmflez;;
0;0;Microsoft caught stealing, http://tinyurl.com/yc5nzse;;
0;0;Microsoft presenta el Windows Phone 7 http://viigo.im/2rVb;;
0;0;Quiero el nuevo telefono de microsoft >.<;;
0;0;There have been Viruses going around and as usual, mostly on Facebook. Here is a simple solution. Microsoft is... http://bit.ly/9h5VmM;;
0;0;#jobs #career Licensing Executive - 709111 at Microsoft (Chicago, IL): Licensing Executive, WW Licensing & Pricing... http://bit.ly/8YHMdX;;#jobs #career
0;0;Microsoft Anoints AT&T as Preferred Windows Phone 7 Carrier- Microsoft announced AT&T as a "premier partn... http://bit.ly/acP6FB;;
1;0;At NAB Digital Rapids debuts StreamZHD Live ABR adaptive bitrate streaming system for Flash, Microsoft IIS, and iPhone. http://ow.ly/181Zh;;
0;0;Microsoft , en línea con su nuevo móvil. Check out this site: http://erickennuestromundo.blogspot.com/;;
0;0;Open a cupboard in your kitchen. Arrange dishes the way you want them. Close, re-open. Are dishes still arranged? Not in Microsoft Windows.;;
0;0;Apps mexicanas en Windows Phone : Afirma Microsoft que quiere apostar por el desarrollo de aplicaciones hechas en Mex.. http://bit.ly/bDR7Qe;;
8;3;SharePoint 2010 helps to power the Winter Olympics (from our sponsor Microsoft ): http://bit.ly/9vqZ1t;;
0;0;Microsoft out Google's Google: http://bit.ly/aepZZQ (via @john_m_neff );@john_m_neff;
0;0;RT @mackie1227 : #Chupamelasbolas Microsoft <-- a ellos no que me regalan todo su catalogo de software xD;@mackie1227;#Chupamelasbolas
0;0;Damn, aren't Microsoft leaéders enough rich to open windows source code ? No they prefer ephemere glory instead of humanity thanks.;;
0;0;Microsoft offers up lengthy Windows Phone 7 Series video walkthrough http://goo.gl/jLvv;;
0;0;This pc guy may need to become a Mac guy after my computer made me go ballistic today #microsoft;;#microsoft
0;0;Стив Баллмер представил Windows Mobile 7: В Барселоне на конференции MWC 2010 глава Microsoft … http://goo.gl/fb/jdkI http://ff.im/-g39c2;;
0;0;downloading my free trial of microsoft word on my new computer;;
0;0;Beyond Windows Phone 7: More on other pieces of Microsoft \'s mobile portfolio microsoft office;;
0;0;RT @TratoHecho_tech: Donará Microsoft cuatro mil licencias de Office a Colombia http://bit.ly/avUFOO;@TratoHecho_tech;
0;0;GDReviews.com: Microsoft 's Windows Phone 7 Series Could Be A Success, Analysts Say - eWeek http://bit.ly/9zYAcQ;;
0;0;"combine with behavioral simulations to produce real-time animations for Google Earth or Microsoft Virtual Earth." http://icio.us/4dyjje;;
0;0;Стив Баллмер представил Windows Mobile 7: В Барселоне на конференции MWC 2010 глава Microsoft … http://goo.gl/fb/jdkI;;
0;0;Just wowed a crowd of people at work by smoothly navigating thru Microsoft Office...smh;;
0;0;@Skitzzo Well, at least they update their security flaws #WordPress v. #Microsoft;@Skitzzo;#WordPress #Microsoft
0;0;?!? RT @jonfildes : RT @tim_harper : Bizarrely the UK government will upgrade to Microsoft Vista, snub Windows 7 http://bit.ly/aECi6J;@jonfildes @tim_harper;
0;0;Microsoft : “Someday we will bring back Killer Instinct”: Killer Instinct 3 rumors may have been floating abo... http://tinyurl.com/y8gxfgd;;
0;0;Microsoft : “Someday we will bring back Killer Instinct” http://bit.ly/cFsUeC;;
0;0;Apesar que agora o PC daqui é: Win 7 Original, Office 2010 e mouse Microsoft sr. @alexmalavasi hahaha XD;@alexmalavasi;
0;0;Clarification to Microsoft : Trying to force innovation for the sake of innovation is pointless. Meet a need. Solve a problem. Please.;;
0;0;Microsoft XBOX 360 Game System (CONSOLE Only) -Working! http://twurl.nl/qhiaoq;;
0;0;Microsoft XBOX 360 Game System (CONSOLE Only) -Working! http://twurl.nl/432gjy;;
0;0;Microsoft XBOX 360 Game System (CONSOLE Only) -Working! http://twurl.nl/nin8o5;;
0;0;Discount Microsoft Zune FlexiSkin and miniSync Bundle (Aluminum Grey (with clip)) http://bit.ly/deS5oo;;
0;0;says Intel и Nokia объединились против Apple, Google и Microsoft http://ow.ly/16APX4 http://plurk.com/p/3swbsv;;
0;0;Intel и Nokia объединились против Apple, Google и Microsoft http://ow.ly/16APX4;;
0;0;Dear Microsoft Silverlight...Update your own browser. Okay? I'd rather continue getting crushed in Scramble. Which... http://fb.me/67BWVjE;;
0;0;Open a desk drawer. Arrange items in drawer the way you want them. Close, re-open. Are things still arranged? Not in Microsoft Windows.;;
0;0;Get Turbo Tax Basic Federal + efile 2009 for $24.95 from the Microsoft Store! Much, much more at Microsoft . http://cli.gs/bq18N;;
0;0;Microsoft Office 2010: al descubierto sus versiones y novedades http://bit.ly/attqXs;;
0;0;Intel и Nokia объединились против Apple, Google и Microsoft http://ow.ly/16APX3;;
0;0;Intel и Nokia объединились против Apple, Google и Microsoft http://ow.ly/16APX2;;
0;0;Intel и Nokia объединились против Apple, Google и Microsoft http://ow.ly/16APX1;;
0;0;WORD 2007 PDF converter DPI resolution: No one at Microsoft seems to know what DPI (dots per inch) resolution their http://bit.ly/b7mkH7;;
0;0;RT @tweetmeme Will Microsoft 's LookingGlass Shed New Light On Social Media? | InventorSpot http://bit.ly/t7HPh;@tweetmeme;
0;0;My friend suggessted to his other friend to use the "Doyin Microsoft Word" Study Method - where u type out ur notes cuz ur notes be sloppy;;
0;0;Microsoft office professional 2007 help?? Why is there 2 disks?: I just got a copy of the office 2007 Acedemic ver... http://bit.ly/c7Mm98;;
0;0;New Blog Post: Microsoft Announced Windows Phone 7 Series: It’s been a long time coming but.. http://bit.ly/9hJB3i;;
0;0;RT @csfsb : How Microsoft and Google could put a kink in phishing scams http://bit.ly/cgMPu1 // New blog post at CSFSB #in;@csfsb;#in
0;0;Review of Microsoft OneNote Home and Student 2007 http://bit.ly/cuy3Tk;;
0;0;Just opened my first Microsoft case! =D;;
0;0;！ RT @alleyinsider : CHART OF THE DAY: The Collapse Of Microsoft 's Mobile Business $ MSFT $ RIMM $ AAPL by @fromedome http://bit.ly/aIYOT1;@alleyinsider @fromedome;
0;0;Windows Phone 7 Interface: Microsoft Has http://gizmodo.com/5472010/ #uidesign #microsoftwindowsphone7;;#uidesign #microsoftwindowsphone7
0;0;Microsoft Gets Its Groove Back (PC World) http://nxy.in/jd95s;;
0;0;RT @MarlenTrevino : Bill Gates: “No hay nada del iPad que quisiera q hubiera hecho Microsoft ” http://bit.ly/9sfX59 <- de q murió el quemado?;@MarlenTrevino;
0;0;Windows Phone 7: Smartphone from Microsoft (http://cli.gs/bQJAg) http://cli.gs/bQJAg;;
0;0;Exchange Server 2010 VHD: This download comes as a pre-configured VHD. This download enables you evaluate Microsoft … http://goo.gl/fb/tNkr;;
0;0;Donará Microsoft cuatro mil licencias de Office a Colombia http://bit.ly/avUFOO;;
0;0;@RafiRahman not if your activision same with microsoft they both know that they will make money even if they release shit games;@RafiRahman;
0;0;Все-таки приятно, когда о тебе пишут в ленте новостей про google и microsoft :) http://bit.ly/czKuXO;;
0;0;Introduction To Microsoft Word 2007 at Thayer Public Library, Braintree - tomorrow (2/17) at 9:15am - http://b.globe.com/bZBVdr.;;
0;0;Translating Microsoft Dynamics Gp To Foreign Language: http://bit.ly/d3bT4r via @addthis;@addthis;
0;0;Excel Expert User-Your One Stop Solution In Mastering Microsoft Excel. http://ow.ly/16AQ9Q;;
