retweets;favorites;text;mentions;hashtags
0;1;"Gigya has been working w/ Microsoft on its social strategy & expects 2 C Microsoft 's take on a feed interface" http://bit.ly/9UitnS [ @RWW ];@RWW;
1;0;I for one welcome our Apple overlords. The iPad is clearly a communist plot to make us ignore the best corporation in the world, microsoft;;
0;0;Microsoft Live Writer "Blog This" for Firefox addon: https://addons.mozilla.org/en-US/firefox/addon/9968 -- works great with Firefox 3.X;;
0;0;[エンタープライズ]レイ・オジーは Microsoft をどこに導くのか http://bit.ly/asRFU3;;
0;0;" Microsoft Co-Founder Steve Jobs..." http://is.gd/8xqFT;;
0;0;Until today I had never heard of this: Microsoft Tax Dodge - http://microsofttaxdodge.com/ http://plurk.com/p/3swhce;;
0;0;Microsoft 's New Mobile OS Shows Promise, Is Overdue: Analysis - Popular Mechanics - http://redir.is/lLF #Smartphone;;#Smartphone
0;0;Microsoft anuncia la fecha de salida de Game Room http://cli.gs/ATBqd;;
0;0;[エンタープライズ]ホワイトペーパー：CA ARCserve Backupによる「 Microsoft Hyper-V仮想環境」の事業継続と惨事復旧 http://bit.ly/9BhGR4;;
0;0;Seriously @HTC , where is the update for the Droid Eris? The delay is starting feel like I'm waiting on a Microsoft security update.;@HTC;
0;0;RT @Cynergy_Systems : Microsoft Silverlight 4 beta client for Facebook Review | http://ow.ly/17mKB | #silverlight #Facebook (via @videoetech);@Cynergy_Systems @videoetech;#silverlight #Facebook
0;0;Monster Mashup : Une nouveau type d'intéraction avec la Microsoft Surface. - http://tinyurl.com/ygaz7po #semageek;;#semageek
0;0;RT @TecnologiaBlog : Google Maps vs. Bing Maps: Microsoft aumenta su cuota de mercado http://bit.ly/cjmxA5;@TecnologiaBlog;
0;0;Name:GEBRUIK-GQNJC6D,OSVer: Microsoft Windows NT 6.1.7600.0,Procs:1,User:Gebruiker;;
0;0;RT @DaronBabin : Google and Microsoft Vie for iPhone Search Presence http://bit.ly/biz6wY;@DaronBabin;
0;0;" Microsoft technology" -- isn't that an oxymoron? -- Gareth Barnard #fortune;;#fortune
0;0;RT @Androidheadline It’s (sort of) official - Google overtakes Microsoft in mobile http://goo.gl/fb/xJ3N;@Androidheadline;
0;0;Just Viewed: New Perspectives on Microsoft Office 2007, First C http://www.5r.com.au/0324788843/rd;;
0;0;Neues Video zu #BPOS : Microsoft Online Services: Gemeinsame Kontakte mit #Sharepoint Online http://ow.ly/182tl #Outlook2010;;#BPOS #Sharepoint #Outlook2010
0;0;Microsoft presenta Windows Phone 7 Series http://www.pcworld.com.mx/Articulos/7587.htm;;
0;0;Microsoft Excel Tips - Adding a Table to Excel (Excel Tables): http://EzineArticles.com/3759177;;
0;0;Microsoft 's Windows Phone 7 Series Could Be A Success, Analysts Say: Microsoft launched the Windows Phone 7 Series... http://bit.ly/bTxYWT;;
0;0;Microsoft 's Windows Phone 7 Series Could Be A Success, Analysts Say: Microsoft launched the Windows Phone 7 Series... http://bit.ly/aPDMQB;;
0;0;New Born2learn post: Quality Matters – Tell Us What You Think: Microsoft Learning’s localization... http://bit.ly/aONsyK;;
1;1;In all honesty, who cares about IE9 when Microsoft can't even get people off of IE6. #internetexplorer #ie #mix;;#internetexplorer #ie #mix
0;0;Microsoft launches Windows Phone 7 Series for mobiles > http://news.bbc.co.uk/1/hi/technology/8515915.stm;;
0;0;Windows Gadgets: Καλησπέρα παιδιά! Μια ερώτηση θέλω να κάνω. Όπως έψαχνα τα windows 7 είδα στο site της microsoft τα... http://bit.ly/9Aoknh;;
0;0;[BLOG] SQL Server 2008 vs. Oracle .. and so it begins….: Microsoft has the gloves off and is ready to rumble. I... http://bit.ly/cKvklK;;
0;0;MOBILE WORLD: Microsoft Launches New Version Of Mobile Software http://goo.gl/fb/SlKB;;
0;0;I must have a prostate-sized brain - the older I get, the smarter I get. Writing at Microsoft is going good. The novel is also coming along.;;
0;0;Save $30.00 now $29.95: Microsoft Natural Ergo Keyboard 4000 http://ergonomictimes.com/p/B000A6PPOK;;
0;0;"YouTube - Why Microsoft : Microsoft compared to Google - Total Value Overview" http://j.mp/aM8TSA;;
0;0;WTF are you thinking Microsoft ? http://bit.ly/arnp60 Didn't you get the memo? http://bit.ly/abL5VF *sigh*;;
0;0;Visited the Las Colinas Microsoft Tech Center today, pretty cool place.;;
0;0;I see a big difference between Apple, Google, and Microsoft . No one is *ever* excited about Microsoft products except the fanboys;;
0;0;Microsoft Anoints AT&T as Preferred Windows Phone 7 Carrier - PC World http://is.gd/8xpSe;;
0;0;RT @phonnz : jaja, es chistoso ver como #Microsoft obliga a mis amigos a tuitear con su #rmspMX <- Esa no es la idea;@phonnz;#Microsoft #rmspMX
0;0;[ITmedia News] Windows 8は「まったく違うものになる」―― Microsoft 関係者が語る: 次期版Windowsは、これまでとは大幅に違ったものになるようだ。 Microsoft のあるマネジャーは「Windo... http://bit.ly/ckNyn2;;
0;0;Microsoft Anoints AT&T as Preferred Windows Phone 7 Carrier http://bit.ly/aQeJQv;;
0;0;Microsoft Anoints AT&T as Preferred Windows Phone 7 Carrier http://bit.ly/aQeJQv;;
0;0;Microsoft Anoints AT&T as Preferred Windows Phone 7 Carrier - PC World - #iphone #droid http://bit.ly/d7d9wx;;#iphone #droid
0;0;RT @bittarman : http://bit.ly/aK4g7w The perfect definition of how the #microsoft #windows codebase must be derived /via @marsbomber;@bittarman @marsbomber;#microsoft #windows
0;0;I wish Microsoft would just STOP developing new versions of IE. Each time they introduce a new version, it adds more time to my dev cycle.;;
0;0;Microsoft Starts Over in Phone Software http://daily-sport-news.blogspot.com;;
0;0;a decent day at #sflive2010 , tomorrow will be awesome, also #microsoft -free, which is a win, so I don't have to skip talks :);;#sflive2010 #microsoft
0;0;http://bit.ly/a2IwJ3 O WINDOWS PHONE 7: E não é que o telefone da MICROSOFT surpreendeu o mundo? #gadgets;;#gadgets
0;0;Microsoft escribe controladores para su propio modelo de virtualización deberían echar #LinusTorvalds;;#LinusTorvalds
0;0;Para que pagar mais para aprender SEO? Aprenda em 1 dia no Centro de Treinamento Microsoft http://cursodeformacaoseo.griff.art.br/ #cursoseo;;#cursoseo
0;5;RT @nathanziarek Be still my beating heart! Lukew talks information density in an epic battle between Apple & Microsoft http://bit.ly/bM8TGM;@nathanziarek;
0;0;@InteractSeattle logo was shown was listed by Microsoft DPE as something important in our region at #mvp10;@InteractSeattle;#mvp10
0;0;Goals for Tonight: 1.) Watch Lost 2.) Walk/Run with Chloe 3.) Read a chapter out of my Microsoft Office book 4.) Drink a Beer! =D;;
0;0;Axxess reveals new ADSL reseller pricing: Related posts:Axxess reveals new ADSL reseller pricing ... Microsoft r... http://bit.ly/aruUQ6;;
0;0;Microsoft announce they have jQuery 1.4.2 before jQuery announce it exists...odd. http://is.gd/8xpnO.;;
0;0;RT @jlugo227 is interviewing Enterprise Software Sales Professionals in Philadelphia for opportunities w/ Microsoft .;@jlugo227;
0;0;Microsoft Anoints AT&T as Preferred Windows Phone 7 Carrier – PC World: Sydney Morning Herald Microsoft Anoints ... http://bit.ly/bsIIY9;;
0;0;War of the Worlds? - Mobile OSs in Google v Apple (Android:iPhone)…oh wait Microsoft enters stage left with... http://tumblr.com/x7b6ia3i2;;
0;0;Sometimes Microsoft 's effort to use the lowest common denominator sucks. What is supposed to be "convenience" actually turns sour.;;
0;0;クラスにみえた。Windows.prevもありえそう RT @topitmedia 「Windows.next」と呼ばれているらしい。^宮本 ：Windows 8は「まったく違うものになる」―― Microsoft 関係者が語る http://bit.ly/cBPrdl;@topitmedia;
0;0;#microsoft did not convince me with the answer to my question on the importance of open standards, especially in IT development;;#microsoft
0;0;Job Listing Suggest “Core” Natal Game In Development: A job listing on Microsoft 's website indicates the com... http://tinyurl.com/yffkcqc;;
0;0;War of the Worlds? - Mobile OSs in Google v Apple (Android:iPhone)…oh wait Microsoft enters stage left with... http://tumblr.com/x7b6ia2jn;;
0;0;Google and Microsoft Vie for iPhone Search Presence http://bit.ly/biz6wY;;
0;0;@tom_watson I guess that "UK Govt will encourage more Open Source" nonsense succeeding in lowering Microsoft 's license price, then?;@tom_watson;
0;0;To find out more about Microsoft Dynamics RMS EPOS till systems visit Syncro-it http://bit.ly/1vEPQ3 #EPOS #RMS #Till #Microsoft;;#EPOS #RMS #Till #Microsoft
0;0;Finished meeting with Microsoft Office team; presented Virtualization Solutions Overview; Application- and Desktop Delivery concepts #mvp10;;#mvp10
0;0;@oscarelmexicano En esa parte tienes toda la razón, dejemoslo en que es la mejor aplicación de Microsoft si la sabes usar bien.;@oscarelmexicano;
0;0;Microsoft Outlook causes me so many problems. Such a shame as it's a great biz tool but neither my tasks nor contacts work properly.;;
0;0;Microsoft : “Algum dia iremos trazer Killer Instinct de volta.” http://bit.ly/9npPTE;;
0;0;LIVE MONDAY 9 A.M.: Microsoft Reboots Its Mobile Business (MSFT, AAPL) http://bit.ly/c9Cmnk;;
0;0;Updated my blog with Microsoft Access Database Features http://tinyurl.com/ykua5hz;;
0;0;Updated my blog with Microsoft Access Database Errors And Basic Problems http://tinyurl.com/yjpgqex;;
0;0;Updated my blog with Microsoft Access Database Functions And Objects http://tinyurl.com/ykek8dp;;
0;0;Hiring a Principal Design Engineer, Global Foundation Services - 705529 at Microsoft (Redmond, WA) http://bit.ly/bB9q3b #jobs #shjobs;;#jobs #shjobs
0;0;Too little too late for #Microsoft #Mobile Business? See the trend lines from #SAI "Chart of the Day" http://dougdesimone.blogspot.com/ #in;;#Microsoft #Mobile #SAI #in
0;0;http://bit.ly/cJi8Qm $ MSFT Microsoft gets smart on phone;;
0;0;GDReviews.com: Microsoft Anoints AT&T as Preferred Windows Phone 7 Carrier - PC World http://bit.ly/bLckQM;;
0;0;NOVEDADES | Microsoft da a conocer Windows Phone 7 Series. http://www.estrategiaynegocios.net/tecnologia/Default.aspx?option=8018;;
0;0;NOVEDADES | Microsoft da a conocer Windows Phone 7 Series. http://www.estrategiaynegocios.net/tecnologia/Default.aspx?option=8018;;
0;0;RT @Microsoft Windows Phone - Mobile World Congress Day 2 (New blog: http://bit.ly/93KuLN Newsroom: http://bit.ly/9RRQtK) #MWC10 #WP7;@Microsoft;#MWC10 #WP7
0;0;Documents To Go® ( Microsoft Word &... included in HUGE promo code contest for #BestAppEver Awards from @148Apps :: http://bit.ly/cQmUZd;@148Apps;#BestAppEver
0;0;Microsoft Xbox 360 Arcade Console £99.95 @John Lewis Free delivery: Found by warehousestock, John Lewis Deals Yo... http://bit.ly/aJMWmz;@John;
0;0;Deal: Microsoft Xbox 360 Arcade Console £99.95 @John Lewis Free delivery: Found by warehousestock, John Lewis Dea... http://bit.ly/aJMWmz;@John;
0;0;$ MSFT Microsoft 's hotmail suffers an outage, although service is now back to normal: http://bit.ly/djIhCw;;
0;0;Was lucky enough to attend the C.H.A.T. Festival keynote given by Robbie Bach from Microsoft . Nice guy, and a good orator. :);;
0;0;While Google Android inherits the modifiability of Windows Mobile for better or worse, Windows Phone 7 becomes a Microsoft branded iPhone.;;
0;0;@dnzm Jij haat Microsoft echt met een vurige passie he, LOL! ;-);@dnzm;
0;0;RT @chartoftheday : CHART OF THE DAY: The Collapse Of Microsoft 's Mobile Business http://bit.ly/b2Drjj;@chartoftheday;
0;0;@kierankelly On the brightside, if iPhones bring in Mac sales, Microsoft makes it harder for Mac users to see the "new" Microsoft .;@kierankelly;
0;0;Wonder what the hostess gift is? | RT @retailwire : Tupperware parties for brands like Microsoft ,Kraft,Ford and Verizon. http://bit.ly/cSrpzJ;@retailwire;
0;0;RT @MelCarson RT @CandaceKuss RT @HK_London : B2B White Paper on Social Media” charts Microsoft 's experiences http://bit.ly/dt6Eaz;@MelCarson @CandaceKuss @HK_London;
0;0;Report: Microsoft X10 Conference http://bit.ly/diR6Y6;;
0;0;Just added Microsoft Windows Phone 7 Series to my want list on @gdgt ! http://gdg.to/c2WzcC;@gdgt;
0;0;Progressive BI zoekt microsoft BI/ETL/DWH specialist -... http://jobsurl.com/18ac49;;
0;0;wow microsoft , when did you stop wearing the geeky glasses and start hangin' with the cool kids? http://bit.ly/bGgrLJ;;
0;0;Windowsにゅーてくのろじー！(違う RT @topitmedia : 「Windows.next」と呼ばれているらしい。^宮本 ：Windows 8は「まったく違うものになる」―― Microsoft 関係者が語る http://bit.ly/cBPrdl;@topitmedia;
0;0;'Large' Microsoft Franchise Coming to Project Natal http://gamef.ly/a62388 (via @GFGameCenter );@GFGameCenter;
0;0;Hiring a Director, Communications - 711748 at Microsoft (Redmond, WA) http://bit.ly/cQunXc #jobs #shjobs;;#jobs #shjobs
0;0;Looks like Steve Jobs also co-founded Microsoft , or so NY Times says http://bit.ly/abSYGY;;
0;0;Hiring a Attorney - Oem / Commercial Licensing (worldwide Sales Group) - 711293 at Microsoft (Redmond... http://bit.ly/9AemlU #jobs #shjobs;;#jobs #shjobs
0;0;Going to pick up my brother then going to get some superstar then microsoft points.;;
0;0;J2EE Microsoft Commerce Server Architect at Major Business Technology Consulting Firm (Boston, MA) http://bit.ly/9IEIU7;;
0;0;Was Microsoft Hit By Google China Aurora Hack? Here's why we need IT NETWORK TRANSPARENCY. http://bit.ly/biwPPt;;
0;0;QT @davidsbundler : Microsoft Word で Manet って打ったら赤い波線が出たので、「スペル間違ってる？」と思って右クリックしたら変換候補に Monet が出たでござる の巻;@davidsbundler;
0;0;@Windows Windows Phone 7 a good start, but questions persist: Microsoft 's brought out a new mobile operating syste... http://bit.ly/9YMZHg;@Windows;
0;0;"Windows-y" just refers to Microsoft 's general style guide for its products. See: Windows 7, WinMo 7, Zune HD's user interfaces.;;
0;0;Don't you love HTC sucking up to Microsoft as always. Problem is I don't see how -& why- you can or want to "Sense" the Windows Phone 7 UI.;;
1;0;RT @nathanziarek : Be still my beating heart! @lukewdesign talks density in an epic battle bw Apple & Microsoft http://bit.ly/bM8TGM #ux #ixd;@nathanziarek @lukewdesign;#ux #ixd
0;0;Microsoft - Intuit Integrate Monopoly http://ow.ly/11TlK;;
0;0;#edchat #edtech #education - Please follow me as I'm doing research for Microsoft . Thanks!;;#edchat #edtech #education
0;0;Microsoft Anoints AT&T as Preferred Windows Phone 7 Carrier - PC World http://socinow.com/02b03f;;
0;0;Rave Reviews for Microsoft ’s Phone 7 Series http://bit.ly/cbFr0b;;
0;0;Correct. It is not spyware. RT @IPThinkTank : Microsoft wins Windows XP Windows Genuine Advantage lawsuit http://is.gd/8siw3;@IPThinkTank;
0;0;spent a great day at a school in VA where they are working to move from Microsoft to Linux and Google Apps.;;
0;0;#Enterprise #Microsoft _Windows on 1 Fav Source+2 others like Mashable!-7 Things to Consider for Social Media in th... http://bit.ly/99WP8T;;#Enterprise #Microsoft
0;1;la neta la neta ,excel es la mejor aplicación hecha por Microsoft . Obvio si la sabes usar a full;;
0;0;BnfCh> http://j.mp/dzCvuv Microsoft Releases Antipiracy Update for Windows 7...;;
0;0;Microsoft getting customer service very right over twitter. I'm impressed. @MicrosoftHelps @XboxSupport;@MicrosoftHelps @XboxSupport;
0;0;Its so funny to see asian tourist take photos of being on microsoft campus/ bldg;;
0;0;iPad: Cisco Does It Again: A Sign ... Apple, Microsoft Go Big With Latest Offerings Putting aside all... http://bit.ly/aX17Pr #news;;#news
0;0;The Collapse Of Microsoft 's Mobile Business http://bit.ly/b5zCRk;;
0;0;#windowsphone7 is truly amazing ui work. #Microsoft just upped their game. Will #apple step up?;;#windowsphone7 #Microsoft #apple
0;0;Microsoft finally unveiled the new Windows Phone 7. I'm am gone from AT&T when this bad boy comes out! http://www.windowsphone7series.com/;;
1;1;Microsoft compared to Google (by Microsoft , video#2) http://j.mp/9ic6aC;;#2
0;0;http://blog-free-software.web-popular.com - Microsoft Introduces New Zune-inspired Smartphone Software ...:;;
0;0;RIM just doesn't get it. They need to pull a Microsoft and innovate with something like WinMo 7 (I just put Microsoft and Innovate together);;
0;0;Otázka by Microsoft : "Not using Windows 7 yet?" Ne a už nikdy. Díky. Konec hlášení!;;
0;0;Teléfono móvil Sony Ericsson X2 | Microsoft Office Mobile&trade y Turbo 3G: http://bit.ly/dDA1WX via @addthis;@addthis;
0;1;http://www.a7la-iq.com/vb/showthread.php?t=7411 Microsoft rtm-escrow office 2010 14.0.4734.1000 تم تسريب النسخة النهائية للاوفيس 2010;;
0;0;A Microsoft Word 2008 az egyetlen alkalmazás, amely rendszeresen fagy a gépemen. Elvesztek bár beágyazott mezőt, de inkább átállok Pagesre.;;
0;0;Grrr. ' Microsoft Office Infopath' is not listed in my MS Office 2007 Professional installation options. What the...!;;
0;0;Microsoft Xbox360 120gb HardCore Bundle http://www.pricebargin.co.uk/product/Microsoft-Xbox360-120gb-HardCore-Bundle.html;;
0;0;Forwarding Outlook emails to other account in an intelligent way: A VBS macro for Microsoft Outlook that forwards ... http://bit.ly/bUUGlf;;
0;0;Microsoft 's burden is to prove that its visual distinction and smooth integration outweigh the advantages of market leaders. #windowsphone;;#windowsphone
0;3;「Windows.next」と呼ばれているらしい。^宮本 ：Windows 8は「まったく違うものになる」―― Microsoft 関係者が語る http://bit.ly/cBPrdl;;
0;0;WP7 will be whole new start from 0 RT CHART OF THE DAY The Collapse Of Microsoft 's Mobile Business http://bit.ly/b2Drjj @chartoftheday;@chartoftheday;
0;0;Microsoft Wireless Notebook Laser Mouse 6000 ( Halifax ) $35.00: Perfect condition Microsoft Wireless Notebook Las... http://bit.ly/asPixo;;
0;0;Legal Marketers _ Microsoft announcing a new social media aggregator and monitoring tool http://is.gd/3PE5Z;;
0;0;New Article: Hits and Misses in Microsoft ’s New Mobile Software http://bit.ly/9zGMU8;;
0;0;The Noteput: If Beethoven Designed the Microsoft Surface - noteput - Gizmodo http://tumblr.com/xdh6i9qp5;;
0;0;RT @IsCool : WOW WOW WOW > CHART OF THE DAY: The Collapse Of Microsoft 's Mobile Business http://ow.ly/182jL;@IsCool;
0;0;Google Android May Run Asus Netbook, Rival Microsoft (Update1) - Bloomberg.com: http://bit.ly/cfQ6hc;;
1;0;New idea for Microsoft new adverts "I'm a PC and i had a shit on a mac";;
0;0;RT @begeek_fr MWC 2010 : Orange devient un partenaire clé de Microsoft en Europe http://goo.gl/fb/nhDl;@begeek_fr;
0;0;Microsoft Starts Over in Phone Software http://nyti.ms/dB9NJa;;
0;0;a intergénération, Word me propose... interpénétration. C'est le WTF de minuit. Bisous Microsoft;;
0;0;New Blog Post: Microsoft Anoints AT&T as Preferred Windows Phone 7 Carrier http://bit.ly/dkQSpV;;
0;0;Microsoft Xbox 360 Arcade Console £99.95 @John Lewis Free delivery http://bit.ly/c9OsV4;@John;
0;0;Windows Mobile's Incredible Death Spiral [Data] - Gizmodo, the Gadget Guide http://go.evri.com/1H3O #microsoft;;#microsoft
0;0;Microsoft Announces New Mobile OS http://bit.ly/asdxRv;;
0;0;@emenel Arial only exists b/c Microsoft didn't want to pay for a Helvetica license, so they created a cheap look-alike instead;@emenel;
0;0;If I'm running Microsoft Office and Microsoft Access on Microsoft Windows, why do the programs keep crashing? Stupid Microsoft .;;
0;0;RT @atomix Nuevo Post en Atomix: X10: Microsoft quiere revivir la serie de Killer Instinct http://bit.ly/aUGQEb dios te escuche.;@atomix;
0;0;Documents To Go® ( Microsoft Word &... included in HUGE promo code contest for #BestAppEver Awards from @148Apps :: http://bit.ly/cQmUZd;@148Apps;#BestAppEver
0;0;[SCE Team Blog] New SCE 2010 Training for Microsoft Partners: As we move from the Release Candidate to the final S... http://bit.ly/dnvnfs;;
0;0;Microsoft Office Enterprise 2007 Full Retail Version Key and Download - 99.95 USD: Microsoft Office Enterpri... http://tinyurl.com/yg45cfg;;
0;0;I have to hand it to Microsoft ... the interface of Windows Phone 7 is pretty snazzy;;
0;0;... alguién sabe de alguna aplicación similar al Visio de Microsoft , que sea libre??;;
0;0;RT @atomix : Nuevo Post en Atomix: X10: Microsoft quiere revivir la serie de Killer Instinct http://bit.ly/aUGQEb;@atomix;
1;0;RT Absulit: RT @dotnetcr : 40 cosas de Microsoft que probablemente no sabes http://bit.ly/b6LKgJ Viva el software libre #tecnologia #internet;@dotnetcr;#tecnologia #internet
0;0;バージョンと混同するからこのネーミングは勘弁してほしいｗ RT @itmedia : [News]Windows 8は「まったく違うものになる」―― Microsoft 関係者が語る http://bit.ly/bd7t9E [SB-911T];@itmedia;
0;0;Nuevo Post en Atomix: X10: Microsoft quiere revivir la serie de Killer Instinct http://bit.ly/aUGQEb;;
0;0;{an uphill battle} Windows Mobile's Incredible Death Spiral - windows phone 7 series - Gizmodo http://bit.ly/bKYxs0 | #mobile #microsoft;;#mobile #microsoft
0;0;Windows Phone 7 a good start, but questions persist: Microsoft 's brought out a new mobile operating system like it... http://bit.ly/deq3WM;;
0;0;WOW WOW WOW > CHART OF THE DAY: The Collapse Of Microsoft 's Mobile Business http://ow.ly/182jM;;
0;0;WOW WOW WOW > CHART OF THE DAY: The Collapse Of Microsoft 's Mobile Business http://ow.ly/182jL;;
0;0;WOW WOW WOW > CHART OF THE DAY: The Collapse Of Microsoft 's Mobile Business http://ow.ly/182iQ;;
0;0;160 free microsoft points just for watching a movie!!;;
0;0;#Enterprise #Microsoft _Windows on 1 Fav Source+2 others like ReadWriteWeb-The New Windows Phone: How Does The Ente... http://bit.ly/9dpfwa;;#Enterprise #Microsoft
0;0;Microsoft ® Forefront™ Client Security Best Practices Analyzer: Best Practices Analyzer for FCS v1.0 http://goo.gl/fb/QydC;;
0;0;Microsoft Anoints AT&T as Preferred Windows Phone 7 Carrier - PC World-Sydney Morning HeraldMicrosoft...- http://cli.gs/48VG2;;
0;0;@AtomiClint Thanks! Works ok, was hoping for a more automatic way. Some break themselves, some won't break unless I do it. Microsoft fun;@AtomiClint;
0;0;Guii.com.uy: Microsoft quiere frenar al iPhone http://bit.ly/9oJ6XH;;
0;0;RT @iPhoneAddictfr Microsoft dévoile Windows Phone 7 - iPhoneAddict.fr http://tinyurl.com/yaf5lzv;@iPhoneAddictfr;
0;0;Microsoft 's New Mobile OS Shows Promise, Is Overdue: Windows Phone 7 Series http://bit.ly/bdynDi;;
0;0;Does Apple even have any more friends? Think Microsoft , Google, Adobe, all mobile manufacturers.....;;
1;0;RT @rusdpe : "New blog post: Получите ПО Microsoft для веб-студий через UMI.CMS! - http://cut.ms/Ma3";@rusdpe;
0;0;http://gizmodo.com/5471805/windows-phone-7-series-everything-is-different-now Microsoft 's new phone. Very different approach. Cluttered.;;
0;0;Like victims in the thriller, “10 Little Indians,” the directors of Yahoo involved in its Microsoft takeover debac... http://bit.ly/apAmzP;;
0;0;my ongoing breakup with Microsoft Word took a nasty turn today: lost 8 hours of work at the office #fb;;#fb
0;0;Windows Phone 7: Hey, Microsoft ist wieder zurück am Mobilfunkmarkt! [WMC] http://bit.ly/a1jSop;;
0;0;Microsoft launches Windows Phone 7 Series for mobiles http://news.bbc.co.uk/2/hi/technology/8515915.stm;;
0;0;" Microsoft Anoints AT'T as Preferred Windows Phone 7 Carrier" http://tinyurl.com/y9kf6vj #iPad #fb;;#iPad #fb
0;0;Documents To Go® ( Microsoft Word &... included in HUGE promo code contest for #BestAppEver Awards from @148Apps :: http://bit.ly/cQmUZd;@148Apps;#BestAppEver
0;0;#3: Microsoft Windows 7 Anytime Upgrade, Home Premium to Ultimate (PC DVD) [Import UK] http://bit.ly/cwgmtu;;#3
0;0;#3: Microsoft Windows 7 Anytime Upgrade, Home Premium to Ultimate (PC DVD) [Import UK] http://bit.ly/cwgmtu;;#3
0;0;Microsoft word question http://goo.gl/fb/BP1c;;
0;0;Microsoft office 2007 bites!!!!!;;
0;0;Microsoft University Scholarships 2010 http://goo.gl/fb/VB7C;;
0;0;RT @PaulvanTamTam : RT @Pauluz : Als zelfs Gizmodo dit zegt: "Windows Phone 7 interface: Microsoft has Out-Appled Apple": http://bit.ly/bqvqUL;@PaulvanTamTam @Pauluz;
0;0;Steve Jobs a co-fondé Microsoft …: …c’est le Times Digest qui le dit : Pour la petite histoire, le Times Digest est... http://bit.ly/cmcp1F;;
0;0;Got the Xbox 360 all packed up ready to be sent to Microsoft 's repair centre tomorrow.;;
0;0;RT @tweetmeme Microsoft Unveils Windows Phone 7 Series http://bit.ly/dszGAD;@tweetmeme;
0;0;http://bit.ly/b2apTf $ MSFT Microsoft 's Windows Phone 7 Series Could Be A Success, Analysts Say;;
0;0;Livre blanc sur le Social Media Marketing (B2B) par Microsoft : http://bit.ly/dsF3aT;;
0;0;Microsoft catches up in the smartphone race http://bit.ly/dh8IQu <Love the Brit sense of humour!;;
0;0;@kenny_789 och, dafür wird Microsoft bestimmt bald was dazu sagen. Hoffe ich mal.;@kenny_789;
0;0;Microsoft referring to its intern candidates as "Geniuses" make me feel rather uncomfortable…;;
0;0;Getting Laid off from Microsoft . | Funniest Video of the Day http://goo.gl/1VXz;;
0;0;Google vs Microsoft http://moscowlondon.livejournal.com/242717.html;;
0;0;RT @00mb : I hate Microsoft Windows.;@00mb;
0;0;@reifman thanks - Microsoft dodging taxes http://blog.reifman.org/2009/10/microsofts-washington-tax-dodge-nears-1-billion.html;@reifman;
0;0;Microsoft gana posiciones frente a Google http://bit.ly/dzDaHL;;
0;0;RT @dotnetcr : 40 cosas de Microsoft que probablemente no sabes http://bit.ly/b6LKgJ #tecnologia #internet #windows;@dotnetcr;#tecnologia #internet #windows
0;0;@Andre_Sugai olha eu tenho a lifecam da microsoft e é boa...essa lifecam cinema deve ser A WEBCAM!!!;@Andre_Sugai;
0;0;pondering why I have overseen the good will of microsoft to make the world a better place until now...;;
0;0;Enojadaa..!!! Estupiiidoo tipooo! pagar $1000 para qee no le pusieraa el microsoft a mi lap..!!!!!;;
