retweets;favorites;text;mentions;hashtags
0;0;@brielarson @PBS You ask what this has to do with @Schwarzenegger ? My family legacy involves #TheTerminator #news @Cyrus;@brielarson @PBS @Schwarzenegger @Cyrus;#TheTerminator #news
0;0;Microsoft MB2-717 Exam Actual Questions (Updated 29 Mar 2017) – Latest Version http:// dlvr.it/Nlqc0H pic.twitter.com/SyxqjNfEjE;;
0;0;Microsoft MB2-717 Exam Actual Questions (Updated 29 Mar 2017) – Latest Version http:// dlvr.it/Nlqbt5 pic.twitter.com/XOr0yJfIjt;;
4;1;How #Microsoft builds its fast and reliable global network. #Cloud #Azure #Data >> http:// redpix.ie/2nralZu pic.twitter.com/5XRg2LSCFC;;#Microsoft #Cloud #Azure #Data
0;0;na moral, a Microsoft é muito mercenária tem que ativar o Windows por 500 dilmas pra conseguir mudar a cor da barra de tarefas CTVYGBKHajdnk;;
0;0;Microsoft Dynamics MB6-890 Exam – Get Latest Exam Questions http:// dlvr.it/NlqbRb pic.twitter.com/os7ogaJNlO;;
1;1;TT @QwantCom Según Microsoft , tenemos que poner «empatía» en Ias IA, a fin de proteger lo... https:// speakbridge.io/medias/embed/r ightscon-en-espanol/RightsCon/3896 … pic.twitter.com/twp3YX1InM;@QwantCom;
0;0;Microsoft is testing Ruuh, an English-speaking AI chatbot aimed at the Indian market (Mary Jo Foley/ZDNet) http:// dlvr.it/NlqbJ6;;
0;1;Microsoft is testing Ruuh, an English-speaking AI chatbot aimed at the Indian market (Mary Jo Foley/ZDNet) http:// dlvr.it/NlqbK4 pic.twitter.com/tHuuRWH4eW;;
0;0;Ja eigenlijk wel ja, Microsoft moet zich gewoon meer gaan inzetten om ontwikkelaars te helpen ontwikkelen voor UWP.;;
0;0;Microsoft Get's New Updates Fore Xbox app On iOS: In step with the Creators update launching on the Xbox One these… http:// dlvr.it/Nlqb6g pic.twitter.com/LZMYjAdWfn;;
0;0;#Microsoft anuncia la fecha de lanzamiento para Windows 10 ... :... http:// i.ven.bz/gGBb;;#Microsoft
0;1;Great question! #MSIgnite takes place at the Orange County Convention Center & Microsoft Envision takes place at Hilton Orlando.;;#MSIgnite
0;0;「オープン Windows！」『... Microsoft ね。』 pic.twitter.com/fYVKsckvhD;;
0;0;4月半ばにWindows10でCreators Updateきますね！ ペイント3Dになり、3D空間でモデリングやペイントができる予定とか！ また、 Microsoft がMixed Realityと呼ぶ仮想現実にPCから接続出来る3万円位のMR用ヘッドマウントディスプレイ発売とか！;;
0;0;ASCII.jp：自社開発技術満載！ Microsoft Azureの物理インフラを大解剖 (1/3) http:// ascii.jp/elem/000/001/4 59/1459849/ …;;
0;0;How do you think Apple, Microsoft , Adobe etc stay in business regardless of how bad the rip people off.;;
0;0;Trust informs every decision we make. A good read from @ethisphere on how @Microsoft runs on trust. http:// soc.fm/GWy3p6gh;@ethisphere @Microsoft;
1;1;#Stem day with @markherringnz #OneNote #Microsoft #MicrosoftEDU pic.twitter.com/roNp3yhnvh;@markherringnz;#Stem #OneNote #Microsoft #MicrosoftEDU
0;0;@Microsoft reveals that my DNA is 0% "black", leading you to the notion that you seem to be lying about who I am. #Cyrus @PBS #news;@Microsoft @PBS;#Cyrus #news
0;0;#p360rd MESCyT, UASD y Microsoft realizan Seminario Integración Racional de Tecnologías http:// ow.ly/zOgq30anHfL http:// fb.me/1PcHbvRvO;;#p360rd
0;1;Who else can't wait for this performance? Get tix 2 see MOVE - Beyond - Live On Tour @Microsoft Theater on 6/11 now: http:// bit.ly/2hxiOoa https:// twitter.com/juliannehough/ status/844655995410296832 …;@Microsoft;
1;0;Looking to keep your computer clean? Try Microsoft Security Essential. It’s free. http:// ow.ly/YnJQ301IM8I #CyberSecurity;;#CyberSecurity
0;1;Microsoft releases Windows 10 Mobile Insider Preview Build 15063.2 to Slow Ring http:// everythingms.com http:// bit.ly/2nkrAZg;;
0;0;Microsoft 's Surface Book and Surface Studio will ship in more markets http:// ift.tt/2nx2Ttn;;
0;0;#p360rd MESCyT, UASD y Microsoft realizan Seminario Integración Racional de Tecnologías http:// ow.ly/zOgq30anHfL;;#p360rd
0;0;#MVPBuzz aquí casual en #Microsoft Community Connection 2017 pic.twitter.com/5wSRpcO3o5;;#MVPBuzz #Microsoft
0;0;Microsoft apuesta por Android con Picturesque, aplicación de bloqueo de pantalla http:// ow.ly/9K7s30amsA1 pic.twitter.com/xdc6BdrucA 7;;
0;1;At ESRI CIO Summit. Who would have thought - a Microsoft - ŘED Hat partnership! Very cool! pic.twitter.com/E59Jusj8rC;;
0;0;Microsoft confirma el 11 de abril como la fecha de llegada de Windows 10 Creators Update - https://www. tecnocienciapy.com/microsoft-conf irma-el-11-de-abril-como-la-fecha-de-llegada-de-windows-10-creators-update … pic.twitter.com/k0dnp7I1uk;;
0;0;Microsoft Dynamics MB6-890 Exam – Get Latest Exam Questions http:// dlvr.it/NlqYyp pic.twitter.com/C3ji7TttBQ;;
0;0;The problem here in Niger is thé connexion. How Microsoft can help tout improve thé connectivity in Niger?;;
0;0;MB2-718 Exam updated (29 Mar 2017) Questions for Microsoft Dynamics Certification http:// dlvr.it/NlqYy3 pic.twitter.com/gUte5topCK;;
0;0;Microsoft MB2-717 Exam Actual Questions (Updated 29 Mar 2017) – Latest Version http:// dlvr.it/NlqYpv pic.twitter.com/J6p8oqh3DF;;
0;1;"IIS 6.0 Vulnerability Leads to Code Execution" http:// blog.trendmicro.com/trendlabs-secu rity-intelligence/iis-6-0-vulnerability-leads-code-execution/ … #cybersecurity #Microsoft #tech;;#cybersecurity #Microsoft #tech
0;0;@Microsoft you literally went backwards 10 years with that @Xbox one guide button update. Did that shiz on the 360 back in 07 lolz;@Microsoft @Xbox;
0;0;無料で使えるウイルス対策ソフトまとめ!!! - FC2まとめ http:// summary.fc2.com/summary.php?su mmary_cd=448232 … #Windows #Microsoft #FC2 #ウイルス対策ソフト #アンチウイルス #21595;;#Windows #Microsoft #FC2 # # #21595
0;0;Pam Edstrom, 1946-2017: Microsoft ’s first PR director was a technology communications… https:// goo.gl/fb/k4QHVt;;
0;3;I'd rather use LibreOffice Base any day of the week than try to figure out Microsoft 's byzantine licensing nonsense.;;
0;0;Microsoft Dynamics MB6-890 Exam – Get Latest Exam Questions http:// dlvr.it/NlqYNp pic.twitter.com/ZbVJvPwIgV;;
0;0;Microsoft Bookings Scheduling Tool Goes Global With New Capabilities. http:// buff.ly/2o8ascQ pic.twitter.com/c6USvSVpQA;;
0;0;Parceria com Microsoft amplia utilização de tecnologia na Rede Municipal de Ensino http:// fb.me/1TBUilXLS;;
0;0;New on eBay! FIFA 16 for Microsoft Xbox 360 http:// ift.tt/2nkKEGK pic.twitter.com/8EBTDxBBkt;;
0;1;Cloud Computing for Beginners with Microsoft Azure http:// click.linksynergy.com/link?id=tYVgjD atze4&offerid=323058.446940&type=2&murl=https%3A%2F%2Fwww.udemy.com%2Fazure-cloud-computing%2F … #machinelearning;;#machinelearning
0;0;New on eBay! FIFA 16 -- Deluxe Edition ( Microsoft Xbox One, 2015) http:// ift.tt/2nkqWuF pic.twitter.com/iRRF1DBude;;
0;0;" Microsoft OneDrive überholt Dropbox und Google Drive" https:// windowsarea.de/2017/03/micros oft-onedrive-ueberholt-dropbox-und-google-drive/ …;;
0;1;Top Brand News: ZDNet: ‘How Microsoft Azure, Kinect are helping kids play TV games to recover from strokes’ - http:// topbrandnews.com/zdnet-how-micr osoft-azure-kinect-are-helping-kids-play-tv-games-to-recover-from-strokes/ …;;
0;0;Dum dim dum Xamarin.iOS 10.6 #ios #ios103 #macios #fresh #softwaredevelopment #sexy #Microsoft #newapis https:// twitter.com/xamarinhq/stat us/847188846362218497 …;;#ios #ios103 #macios #fresh #softwaredevelopment #sexy #Microsoft #newapis
0;0;#SeeUnity Announces Support for Microsoft OneDrive. Read Blog: http:// owler.us/acs50T;;#SeeUnity
0;1;ZDNet: ‘How Microsoft Azure, Kinect are helping kids play TV games to recover from strokes’ http:// dlvr.it/NlqWxS #Microsoft pic.twitter.com/INhAabdy99;;#Microsoft
0;1;Fetch Data From Azure SQL Database Using Nintex Workflow NWC (Nintex Workflow Cloud) http:// dlvr.it/NlqX0S #News #Microsoft pic.twitter.com/0NOeYXAyGR;;#News #Microsoft
1;0;Microsoft is testing Ruuh, an English-speaking AI chatbot aimed at the Indian market (Mary Jo Foley/ZDNet) https:// corpgovnewsblog.wordpress.com/2017/03/30/mic rosoft-is-testing-ruuh-an-english-speaking-ai-chatbot-aimed-at-the-indian-market-mary-jo-foleyzdnet …;;
0;0;#OtherTopic @Microsoft project has mapped the Human Genome. Has found that what you call "black" DNA is officially inhuman. #PardonMe #Cyrus;@Microsoft;#OtherTopic #PardonMe #Cyrus
0;3;windows10がどんなＯＳがいまだわかってない？！ 楽しいアイドルソングで一緒にお勉強しましょ♡ ぴよひな楽曲がたくさん聴ける★無料★ページ https:// soundcloud.com/piyohina/ 新曲ドンドン追加中！ #windows #microsoft;;#windows #microsoft
0;0;#1: Excel 2010 Training Videos - 14 Hours of Excel 2010 training by Microsoft Office… https:// goo.gl/fb/1tVgw1 FREE-> http:// goo.gl/umf8Nn;;#1
0;0;Project Scorpio: Microsoft games ready for launch, says Spencer. Feature... https:// youtu.be/MquRm_JbLGA vía @YouTube #ProjectScorpio #AbanTech;@YouTube;#ProjectScorpio #AbanTech
0;1;ZDNet: ‘How Microsoft Azure, Kinect are helping kids play TV games to recover from strokes’ http:// zd.net/2oA8df2 #Microsoft;;#Microsoft
0;0;Pam Edstrom, 1946-2017: Microsoft ’s first PR director was a technology communications pioneer http:// ift.tt/2o9CNPS pic.twitter.com/aiLIGr7SWO;;
0;0;Microsoft Get's New Updates Fore Xbox app On iOS pic.twitter.com/LYaQ05H7O3;;
1;0;Bold new ad campaign from Microsoft pic.twitter.com/6mf4MXihjI;;
3;3;More on #cognitiveservices from @microsoft ! #azuregovmeetup https://www. pscp.tv/w/a6rj8zFkclFl Wmd2ZFhSS2J8MWRqeFh2UWVPTHpHWiwkxDLqV-APFzeTMNCWM2DgH8QYQVdB_WLYmoEJdpsD …;@microsoft;#cognitiveservices #azuregovmeetup
0;0;Pam Edstrom, 1946-2017: Microsoft ’s first PR director was a technology communications pioneer http:// ift.tt/2o9CNPS;;
0;0;I liked a @YouTube video from @psnewsnow http:// youtu.be/0afcDinNbW0?a Microsoft Finally Admit Xbox One Failures and Remembering E3 2013;@YouTube @psnewsnow;
0;0;@achiquini lo de laptop es viejo 2011, Motorola lo intentó con sus Droid, luego microsoft con sus windows phone https:// m.youtube.com/watch?v=PvfseZ LtN50 …;@achiquini;
0;0;Microsoft Dynamics MB6-890 Exam – Get Latest Exam Questions http:// dlvr.it/NlqVqc pic.twitter.com/zU41kVHVBt;;
0;0;MB2-718 Exam updated (29 Mar 2017) Questions for Microsoft Dynamics Certification http:// dlvr.it/NlqVpq pic.twitter.com/KZvQgN1QJL;;
0;0;Microsoft Confirms Windows 10 Creators Update Launch Date https://www. windowsmode.com/microsoft-conf irms-windows-10-creators-update-launch-date/ … pic.twitter.com/6DRqELKax1;;
0;0;MICROSOFT Lumia 650 Bianco 16 GB 4G / LTE Display 5” HD Slot Micro SD Fotocamera 8 Mpx Windows Europa a soli 148,99€ http:// dlvr.it/NlqVnT pic.twitter.com/tFv2jdDWnf;;
0;0;Microsoft MB2-717 Exam Actual Questions (Updated 29 Mar 2017) – Latest Version http:// dlvr.it/NlqVmw pic.twitter.com/lIGT9ONc6F;;
0;0;New post: Microsoft : milioni di dati sensibili resi pubblici attraverso http:// Docs.com http://www. modacellulare.com/2017/03/30/mic rosoft-milioni-di-dati-sensibili-resi-pubblici-attraverso-docs-com/ …;;
2;1;AI... To Be or Not to Be?? @kashyapn asks the question at 4:45! @Microsoft #ids17 pic.twitter.com/5SFM28fWc5;@kashyapn @Microsoft;#ids17
0;1;Thanks for the support. It'll take a major update from Microsoft before we're able to do anything with Office 2016 for Mac.;;
0;0;New on Ebay Microsoft Xbox One with Kinect 500GB Black Console Bundle (9 games + Dimensions) http:// ift.tt/2n8fQsI pic.twitter.com/SUH08G6y8C;;
0;0;New on Ebay Microsoft Xbox One Holiday Bundle 1 TB Black Console http:// ift.tt/2odnaEe pic.twitter.com/nttnotasRR;;
0;0;@sony @PlayStation @yosp it's crap like this #psplus April that turned me off of buying PlayStation games and pushed me to #xbox @Microsoft;@sony @PlayStation @yosp @Microsoft;#psplus #xbox
0;0;New on Ebay Microsoft XBOX ONE 500 GB Black System- CONSOLE ONLY Untested http:// ift.tt/2nhppX7 pic.twitter.com/lBM4hZ1gOP;;
1;0;http:// ift.tt/2nBIpBr - Microsoft is testing Ruuh, an English-speaking AI chatbot aimed at the Indian market (Mary Jo Foley/ZDNet) #tech …;;#tech
0;0;Top Ten Interesting Things About Microsoft http:// dld.bz/f4qw8 #AboutMicrosoft #ThingsAboutMicrosoft pic.twitter.com/l3P7PSZzts;;#AboutMicrosoft #ThingsAboutMicrosoft
0;0;Fans? LOL, they ignored all of us: #Microsoft claims 10 million 'fans' help it test #Windows10 https://www. extremetech.com/computing/2466 85-microsoft-claims-10-million-fans-help-test-windows-10-but-its-sure-got-a-funny-definition-of-that-word …;;#Microsoft #Windows10
0;0;Are you tuned in? We're learning about .NET Core with #Microsoft in Philly LIVE HERE: http:// bit.ly/2o7Gq9q pic.twitter.com/tgKleubbFN;;#Microsoft
0;0;Microsoft in Health - IRIS Increases Patient Engagement with help of Microsoft Azure - https:// youtu.be/ENT3FuAzjJo;;
0;4;#MTEI students enjoy global business moments. Chatting with Yves from the third MTEI cohort at Microsoft in Seattle. https:// goo.gl/photos/BmPz5b1 pxUt7MpDK9 …;;#MTEI
0;1;You can talk directly to the Microsoft PXT team here, please send your feedback: https:// github.com/Microsoft/pxt/ issues …;;
0;1;microsoft back at it with the unnecessary bs i love it;;
0;0;AIS จับมือ Microsoft เปิดโปรฯ พิเศษแถม Office 365 ผลักดันธุรกิจ SME เต็มรูปแบบ http:// dlvr.it/NlqTl3 pic.twitter.com/JsrOlWGMTy;;
0;0;@RepEdRoyce (Pt9)PS3,BB&T,USB, @facebook , @Citi , @eBay , @AmericanExpress , @amazon , @twitter & @Microsoft accts,Wifi,printer,Office, @BarclaycardUS;@RepEdRoyce @facebook @Citi @eBay @AmericanExpress @amazon @twitter @Microsoft @BarclaycardUS;
0;0;I just earned the Microsoft in the Classroom certification on the Microsoft Educator Community. https:// education.microsoft.com/Status/Public? token=RKvfLNoo … via @MicrosoftEDU;@MicrosoftEDU;
0;0;Oletools: Análisis forense de archivos Microsoft Office http:// blog.segu-info.com.ar/2017/03/oletoo ls-analisis-forense-de-archivos.html … #seguridadinformática;;#seguridadinform
0;0;Bad Default Settings Cause Microsoft Office 365 Vulnerability - Hashed Out by The SSL Store™ (registration) (blog) http:// dlvr.it/NlqTBn;;
1;0;Quieres aprender acerca de Integrando #Bot #Framework y #Microsoft #Teams #SharePoint #Office365 ? @CompartiMOSScom http:// buff.ly/2mBtXFV;@CompartiMOSScom;#Bot #Framework #Microsoft #Teams #SharePoint #Office365
2;1;Brand new playlist Bring The Noise now live on XBox and Microsoft Groove. The 50 Hardest Hip Hop Songs of All... http:// fb.me/xQQVrqMx;;
0;0;Microsoft Windows 8.1 Pro (旧バージョン) マイクロソフト プラットフォーム:   Windows (34) 新品： ￥ 44,100 5点の新品／中古品を見る:… http:// dlvr.it/NlqSwP #Linux #OS #LinuxOS;;#Linux #OS #LinuxOS
0;0;Microsoft Access 2016 (最新)|カード版|Win対応 マイクロソフト プラットフォーム: Windows 7 / 8 / 8.1 / 10 (1) 新品： ￥ 15,984… http:// dlvr.it/NlqSvQ ... #会計ソフト #業務ソフト;;# #
0;0;Microsoft Access 2016 (最新)|オンラインコード版 マイクロソフト プラットフォーム: Windows 7 / 8 / 8.1 / 10 (22) 新品： ￥ 14,800… http:// dlvr.it/NlqSv0 ... #会計ソフト #業務ソフト;;# #
0;1;Microsoft Edge <3;;
0;1;toda la razon, cuando apple haga con sus tabletas lo mismo que microsoft , comrprare el ipad;;
1;1;Microsoft 's Surface Book and Surface Studio will ship in more markets http://www. infoworld.com/article/318638 6/computers/microsofts-surface-book-and-surface-studio-will-ship-in-more-markets.html#tk.rss_all … #cloud pic.twitter.com/9vNLe8a3d7;;#tk #cloud
0;0;[$289.99 save 43%] Microsoft Surface 3 Touch Tablet 64GB HD, Wi-Fi - Silver (7G5-00015) Windows 10 http://www. lavahotdeals.com/us/cheap/micro soft-surface-3-touch-tablet-64gb-hd-wi/183655?utm_source=twitter&utm_medium=rss&utm_campaign=at_lavahotdealsus … pic.twitter.com/kzm66VsZEM;;
0;0;RT TechCrunch : Microsoft ’s Creators update wants to bring Windows 10 artists and gamers back into the fold … pic.twitter.com/bnpL2zGOKQ;;
0;0;[$20.99 save 31%] Minecraft Favorites Pack for Microsoft Xbox One Brand NEW http://www. lavahotdeals.com/us/cheap/minec raft-favorites-pack-microsoft-xbox-brand/183651?utm_source=twitter&utm_medium=rss&utm_campaign=at_lavahotdealsus … pic.twitter.com/1P6ktFS8FT;;
0;0;lb19_burnett tweeted about Microsoft Tech Summit. This is a #LogicApp #Demo .;;#LogicApp #Demo
0;0;It might have to do with Apple/ Microsoft systems. On Linux, fresh start, GIMP opens as fast as Blender :);;
0;0;Iniciativa bem-vinda . Idêntico ao programa Insider da Microsoft;;
0;0;why the fuck is Microsoft not realizinh every update they add to this is making it worse?? where's the fuckin GAMES tab https:// twitter.com/gamespot/statu s/847216809472331776 …;;
0;0;MB2-718 Exam updated (29 Mar 2017) Questions for Microsoft Dynamics Certification http:// dlvr.it/NlqS9F pic.twitter.com/IbvxoZxdBu;;
0;0;MB2-718 Exam updated (29 Mar 2017) Questions for Microsoft Dynamics Certification http:// dlvr.it/NlqS69 pic.twitter.com/7oHOCRYL2c;;
0;0;Microsoft MB2-717 Exam Actual Questions (Updated 29 Mar 2017) – Latest Version http:// dlvr.it/NlqS1N pic.twitter.com/L7GSI3K7KQ;;
0;0;Microsoft MB2-717 Exam Actual Questions (Updated 29 Mar 2017) – Latest Version http:// dlvr.it/NlqRqr pic.twitter.com/O3vFPjbYTn;;
0;5;On note of #hololens , I think it's time for @microsoftedu @microsoft _edu to create #hololens expert program :) @bbtnb #edtechbridge;@microsoftedu @microsoft @bbtnb;#hololens #hololens #edtechbridge
0;0;via Geekwire Pam Edstrom, 1946-2017: Microsoft ’s first PR director was a technology communications pioneer http:// ift.tt/2o9CNPS;;
0;0;''Windows 10 destruyó mi pc": juicio múltiple a Microsoft . http://www. zeusnews.it/n.php?c=25134;;
0;0;MB2-718 Exam updated (29 Mar 2017) Questions for Microsoft Dynamics Certification http:// dlvr.it/NlqRKJ pic.twitter.com/5vaHLMLg61;;
0;0;Get utmost freedom from the ailments in Microsoft product http://www. freetoclassifieds.com/us/-get-utmost -freedom-from-the-ailments-in-microsoft-product-ad28042.html …;;
12;11;ão colaborativa de planilhas chega ao Microsoft Excel no Windows https:// glo.bo/2o98Yzb pic.twitter.com/7hRjluQ;;
0;0;Here’s how #Microsoft has rethought its approach to #email . #workspace #Enterprise >> http:// redpix.ie/2mD4kIg pic.twitter.com/sBl9UMSIuW;;#Microsoft #email #workspace #Enterprise
0;0;Microsoft 's Windows 10 Creators Update is an OS done right http:// fb.me/1eW3zv0MW;;
0;0;Microsoft Security Essentials supera en protección a varias firmas antivirus https://www. softzone.es/2017/03/29/mic rosoft-security-essentials-supera-antivirus/ … via @softzone;@softzone;
0;4;Hi, Clippy! So much memories! ;) #Windows #Microsoft #Word pic.twitter.com/PUiuvTv4ME;;#Windows #Microsoft #Word
0;0;The latest デイリー chimcity! http:// paper.li/chimcity?editi on_id=a3b0fdf0-14d3-11e7-b97c-0cc47a0d1605 … Thanks to @fairy_9 @sshzk @Yokoox #security #microsoft;@fairy_9 @sshzk @Yokoox;#security #microsoft
0;0;Microsoft and Ubuntu did this a long time ago lmao;;
0;0;Pam Edstrom, 1946-2017: Microsoft ’s first PR director was a technology communications pioneer http:// ift.tt/2o9CNPS;;
0;0;I liked a @YouTube video http:// youtu.be/OeHjN4oWVfk?a Microsoft Sucks;@YouTube;
0;0;Now we know ... Why #Microsoft thought #LinkedIn was worth $26 Million ... http:// ow.ly/FtAS30a5yOY pic.twitter.com/AB2O4bkpgv;;#Microsoft #LinkedIn
0;0;Microsoft SQL Server on Twitter: "Learn how to create a #SQLServer Failover Clu… https:// twitter.com/i/web/status/8 47165214340628480 … , see more http:// tweetedtimes.com/v/15415?s=tnp;;#SQLServer
0;0;Entérate de lo más reciente sobre el acuerdo que firmó Microsoft en conjuntos con gigantes de las redes sociales: http:// goo.gl/vPCtLY;;
5;1;" Microsoft is testing Ruuh, an English-speaking AI chatbot aimed at the Indian market (Mary Jo Foley/ZDNet)" http:// bit.ly/2nNb72T;;
0;0;Work with your Microsoft Reps as we'll keep you out of the news unlike Oracle did to Denver. http:// denver.cbslocal.com/2017/03/22/den ver-admits-software-licensing-violations-taxpayers-will-pay-millions/ …;;
0;0;Microsoft Announces Updates for Xbox One, Windows 10 and Surface Studio http:// ift.tt/2nieJWB;;
0;0;Microsoft is testing Ruuh, an English-speaking AI chatbot aimed at the Indian market (Mary Jo Foley/ZDNet) http:// ift.tt/2nBIpBr;;
0;0;"Humans attack surface to reach 4 billion people by 2020... - Microsoft #Cybercriminals #cybersecurity pic.twitter.com/TzKOOO2kNT;;#Cybercriminals #cybersecurity
1;1;Xbox One update adds a bunch of long-awaited features http:// bit.ly/2nM5SR9 : #Microsoft;;#Microsoft
0;1;IBM in the cloud: Inside the tech giant’s quest to stand out against Amazon, Microsoft and Google http:// buff.ly/2nPvJbB pic.twitter.com/irqgi58IQm;;
0;1;How to use Formulas In Microsoft Excel http:// share-the-buzz.com/video/100?D0Qdi;;
0;0;Microsoft is testing Ruuh, an English-speaking AI chatbot aimed at the Indian market (Mary Jo Foley/ZDNet) http:// ift.tt/2nBIpBr;;
1;0;XML: The Microsoft Office Open Xml Formats #xml #FreeDownload #Free #Giveaway http:// buff.ly/2nSCWqW pic.twitter.com/5H6I9Q0y6F;;#xml #FreeDownload #Free #Giveaway
0;0;El antivirus de Microsoft (MSE) es tan bueno como Avast o AVG http://www. muycomputer.com/2017/03/29/ant ivirus-de-microsoft/ …;;
1;1;Find out how you can use and create a bot http:// bit.ly/2ndholh #bot #Microsoft #Azure pic.twitter.com/1ZN7bet0FN;;#bot #Microsoft #Azure
0;0;#Microsoft te damos la calificación perfecta en tu compra de hardware con un maletín de regalo! pic.twitter.com/W2mhSByEBn;;#Microsoft
6;5;En #Microsoft invertimos más de $9M USD en aumentar habilidades Digitales en LATAM, lee más de nuestra iniciativa en http:// msft.social/hJnmyB;;#Microsoft
0;0;Microsoft 's Windows 10 Creators Update lives up to its name https://www. engadget.com/2017/03/29/win dows-10-creators-update-review/ … via @engadget;@engadget;
0;0;MB2-718 Exam updated (29 Mar 2017) Questions for Microsoft Dynamics Certification http:// dlvr.it/NlqQ0h pic.twitter.com/j0gpDYrwYU;;
0;0;MB2-718 Exam updated (29 Mar 2017) Questions for Microsoft Dynamics Certification http:// dlvr.it/NlqQ0R pic.twitter.com/IRXmBoK8lx;;
0;1;Microsoft MB2-717 Exam Actual Questions (Updated 29 Mar 2017) – Latest Version http:// dlvr.it/NlqPxX pic.twitter.com/MFeqx2zLW6;;
0;1;Microsoft MB2-717 Exam Actual Questions (Updated 29 Mar 2017) – Latest Version http:// dlvr.it/NlqPxP pic.twitter.com/tXG0y6xG4y;;
0;1;Tablet-a-day Giveaway by Win an iPad, iPad mini, Microsoft Surface, Kindle Fire HD, or a Nexus 10;;
1;3;Learning about the "growth mindset" and not the "fixed mindset" from #Microsoft 's Mary-Ellen Anderson. pic.twitter.com/qemBhzFoU1 – bei Ryerson Digital Media Zone (DMZ);;#Microsoft
0;0;ASCII.jp：自社開発技術満載！ Microsoft Azureの物理インフラを大解剖 (1/3) http:// ascii.jp/elem/000/001/4 59/1459849/ …;;
0;1;Microsoft 's 'Application Verifier' bug-finder is easily pwnable | http:// bit.ly/2nzjQGn;;
0;1;(2/?) intellectual property and gets away with it. Samsung, Google, and Microsoft all have either made or seriously increased their revenues;;
0;0;We have just added Fazeela Anwar. You can look at it on http://www. Intensavida.com/detail/fazeela -anwar … #Management #Microsoft #Real #career #Estate #touch;;#Management #Microsoft #Real #career #Estate #touch
0;2;New post: "ZDNet: ‘How Microsoft Azure, Kinect are helping kids play TV games to recover from strokes’" http:// ift.tt/2nwWVsy;;
0;1;Microsoft is testing Ruuh, an English-speaking AI chatbot aimed at the Indian market (Mary Jo Foley/ZDNet) http:// dlvr.it/NlqPSz pic.twitter.com/otR3vS8DMx;;
0;2;GW: Pam Edstrom, 1946-2017: Microsoft ’s first PR director was a technology communications pioneer http:// dlvr.it/NlqPHG pic.twitter.com/I60CH1wLPX;;
0;1;Pam Edstrom, 1946-2017: Microsoft ’s first PR director was a technology communications pioneer http:// dlvr.it/NlqPN8;;
0;0;Microsoft Selfie para Android, retoca tus fotos con Inteligencia Artificial : Reviews - http:// ow.ly/MBJ930ai9PK pic.twitter.com/50P0Q5WDAE;;
0;0;Administrative Assistant Microsoft Office in Jacksonville, FL: contractor, massage, various https:// postjobfree.com/resume/aczj1y;;
0;0;Microsoft による理系女子支援プログラム「 #MakeWhatsNext : Change the Odds」 http:// ift.tt/2nNgejo #広告;;#MakeWhatsNext #
1;2;Pam Edstrom, 1946-2017: Microsoft ’s first PR director was a technology communications pioneer http:// bit.ly/2o9qOC1 #Geekwire;;#Geekwire
0;0;I liked a @YouTube video from @barnacules http:// youtu.be/TXTWCqTRIag?a Why MICROSOFT Force Installs Software Without Permission;@YouTube @barnacules;
0;0;Microsoft による理系女子支援プログラム「 #MakeWhatsNext : Change the Odds」 http:// dlvr.it/NlqNN7 pic.twitter.com/ChNajIP5MC;;#MakeWhatsNext
0;0;How Microsoft Access Training Can Help Your Employees http:// ift.tt/2o9whZL;;
0;0;Microsoft is testing Ruuh, an English-speaking AI chatbot aimed at the Indian market (Mary Jo Foley/ZDNet) http:// ift.tt/2nBIpBr Mary…;;
0;0;I added a video to a @YouTube playlist http:// youtu.be/0afcDinNbW0?a Microsoft Finally Admit Xbox One Failures and Remembering E3 2013;@YouTube;
0;1;azure-cli-shell 0.1.1a24: Microsoft Azure Command-Line Interactive Shell http:// pypi.python.org/pypi/azure-cli -shell/0.1.1a24 …;;
0;0;Microsoft , Tinder Edition.;;
0;1;@Jeff_A_Friedman finally met @microsoft Kim in person! pic.twitter.com/RtGGMvlc7M;@Jeff_A_Friedman @microsoft;
0;0;Microsoft HoloLens helps medical equipment maker hone sales pitch http:// ift.tt/2ocjgPg;;
