retweets;favorites;text;mentions;hashtags
0;0;I was using DOS at the United Way in San Diego in '88 when windows came out. That day I celebrated with with great wine.;;
0;0;Real Time Apnoea Monitoring of Children Using the Microsoft Kinect Sensor: A Pilot Study. - PubMed - NCBI https://www. ncbi.nlm.nih.gov/pubmed/?term=% 22ali+al-naji%22 …;;
0;0;【第8回】OneDrive に保存した Office ドキュメントを手軽にスマホで参照/編集 - PC Watch http:// ift.tt/2nNisiZ #microsoft #マイクロソフト;;#microsoft #
0;0;Microsoft Patch Tuesday of March 2017: 18 Security Bulletins; 9 Rated Critical, 9 Important;;
0;0;#Microsoft Windows 10 Creators Update To Start Worldwide Rollout On April 11. Read more: http:// owler.us/acs9vn $ MSFT;;#Microsoft
0;0;@Microsoft sends desolate images of US national parks one after another on Windows 10's background. So I noticed Japan is rich in green.;@Microsoft;
0;0;Microsoft Office 2016 Product Key Serial Keys | InternetKhazana https://www. internet-khazana.com/blog/2015/10/3 0/microsoft-office-2016-product-key-serial-keys/ …;;
0;0;About to get hit offline by some racist kids with the gt zPolos and Twixy420 on xbox 360 @XboxSupport @Xbox @Microsoft;@XboxSupport @Xbox @Microsoft;
0;0;Microsoft 、｢Windows 10 Mobile｣のプレビュー版（build 15063.2）をSlowリングのユーザーにも提供開始 http:// taisy0.com/2017/03/30/811 88.html …;;
1;2;Crayon Joins Microsoft AI in Health Partners Alliance https:// blog.crayon.com/crayon-joins-m icrosoft-ai-health-partners-alliance/ … via @crayonit #SAM #Cloud #MSPartners;@crayonit;#SAM #Cloud #MSPartners
0;0;How Secure is Sending Emails to Microsoft Teams Channels? http:// bit.ly/2mv5GS0 via @PaulCunningham;@PaulCunningham;
0;0;Programación de Obra en Microsoft Project® Clase 1 de 6, mañana jueves 30 de marzo en aula K519.;;
0;0;(gives Microsoft the finger and edits registries to disable cortana every chance she gets.);;
0;0;. @WSJ highlights our collaboration with @Microsoft and @PublicisGroupe on the new data pilot initiative. http:// on.wsj.com/2oAkaBc;@WSJ @Microsoft @PublicisGroupe;
0;10;Did my part for my group project then what do you know Microsoft Word doesn't respond so I have to write it all again:) how's your day going;;
0;0;Hey @Microsoft The "integrated" Flash player in Win 10 IE 11 is not cutting it. I can't even play a GIF??!!;@Microsoft;
0;0;Nice view to end the workday ... and a reminder why the Microsoft Commute team does what it does. pic.twitter.com/EtGVza2Sat;;
1;3;Voici un article intéressant sur la stratégie "jeu vidéo" de Microsoft ;) http://www. gamekyo.com/groupnews_arti cle45903.html …;;
0;0;Microsoft Azure Analysis Services now available in Japan East and UK South https:// mspoweruser.com/microsoft-azur e-analysis-services-now-available-in-japan-east-and-uk-south/ …;;
0;1;Windows Management Framework (WMF) 5.1 now in Microsoft Update Catalog http:// bit.ly/2ng2A5o;;
0;0;JavaScript, HTML and CSS Web Development | Microsoft on edX | Course About Video http:// youtu.be/pWRrsqyA574 #coding;;#coding
0;0;Buy Microsoft Corporation (MSFT) Stock Without All the Risk - http:// investorplace.com/2017/03/micros oft-corporation-how-to-buy-microsoft-stock-now/ …;;
0;0;#ProductReview : Take the Apple pen (stylus?) and combine it with the Microsoft features and you're golden.;;#ProductReview
0;0;Microsoft Studio H Offices - Redmond - Office Snapshots https:// officesnapshots.com/2017/03/29/mic rosoft-studio-h-offices-redmond/ …;;
0;0;Microsoft Windows 10 Home USB Flash Drive | Affiliate Shop Online http:// fb.me/3tBMzthwb;;
0;0;Microsoft to Release Windows 10 Creators Update Starting April 11 http:// ift.tt/2oiShyq;;
0;0;yeah, that is true. The desktop stuff sounds a bit like the continuum idea from Microsoft that never really happened.;;
0;1;Microsoft just tried to get $199 out of me;;
0;1;Whaaaaaaaaaaaaaaaaaaaaaaaaaaaaaaaaaaaaaaat :O :O :O So jelly!;;
0;1;then come to the Microsoft store events! Shit yesterday there was only a 12 man bracket;;
0;0;#7: Microsoft Xbox 360 Game System HDMI Console 60GB http:// dlvr.it/Nlr9Ld;;#7
0;0;and Microsoft gets income from the Fed. Do we boycott MS too?;;
0;0;Microsoft expande venda do Surface para novos mercados https:// canalte.ch/S1YIS-1RLX;;
0;0;Gostei de um vídeo @YouTube de @ronaldo_nestor http:// youtu.be/O4uM2Yle8Jk?a Microsoft confirma data de chegada da nova versão do Windows;@YouTube @ronaldo_nestor;
0;0;Microsoft to Release Windows 10 Creators Update Starting April 11 http:// fb.me/4p3urRPIm;;
2;2;Pam Edstrom, 1946-2017: Microsoft ’s first PR director was a technology communications pioneer http://www. geekwire.com/2017/pam-edstr om-1946-2017-microsofts-first-pr-director-technology-communications-pioneer/ … via @GeekWire;@GeekWire;
0;0;Microsoft to Release Windows 10 Creators Update Starting April 11 http:// fb.me/18aqIZCk9;;
1;0;Le Surface Studio de Microsoft arrive chez Best Buy http:// blogue.bestbuy.ca/ordinateurs-po rtables-et-tablettes/microsoft-surface-studio-arrive-best-buy … via @BestBuyQuebec;@BestBuyQuebec;
0;0;How millions of ‘insiders’ shaped Microsoft ’s new Windows 10 Creators Update http://www. geekwire.com/2017/millions- insiders-shaped-microsofts-new-windows-10-creators-update/ … via @GeekWire;@GeekWire;
0;0;Microsoft to Release Windows 10 Creators Update Starting April 11 http:// dlvr.it/Nlr96D;;
0;0;Microsoft to Release Windows 10 Creators Update Starting April 11 http:// dlvr.it/Nlr8lT;;
0;0;#EXPconsulting Microsoft to Release Windows 10 Creators Update Starting April 11 http:// dlvr.it/Nlr8h3 @julio_verissimo;@julio_verissimo;#EXPconsulting
2;2;Hey, @Microsoft fix your freaking Xbox servers. Thanks.;@Microsoft;
0;0;#EXPconsulting Microsoft to Release Windows 10 Creators Update Starting April 11 http://www. eweek.com/enterprise-app s/microsoft-to-release-windows-10-creators-update-starting-april-11?utm_source=dlvr.it&utm_medium=twitter … @expconsultinges;@expconsultinges;#EXPconsulting
0;0;Microsoft to Release Windows 10 Creators Update Starting April 11 http:// dlvr.it/Nlr8gz;;
11;19;Pam Edstrom, 1946-2017: Microsoft ’s first PR director was a technology communications pioneer http://www. geekwire.com/2017/pam-edstr om-1946-2017-microsofts-first-pr-director-technology-communications-pioneer/ … via @GeekWire;@GeekWire;
0;0;Microsoft to Release Windows 10 Creators Update Starting April 11 http:// ift.tt/2oiShyq #devnews;;#devnews
0;0;I wonder what @Microsoft & @Google think about #SamsungDeX . Could possibly take market share away from #Windows10 & #ChromeOS .;@Microsoft @Google;#SamsungDeX #Windows10 #ChromeOS
0;0;@Samsung DeX..... what Microsoft 's Continuum should've been.;@Samsung;
0;0;#Microsoft The Windows 10 Creators Update's best new features: Privacy tweaks, Paint 3D, an... Read more: http:// owler.us/acs9dJ $ MSFT;;#Microsoft
0;0;#Microsoft nos habla un poco de la nueva actualización de Xbox One :... http:// i.ven.bz/gGBA;;#Microsoft
0;0;#Microsoft Poll: What's your favorite Windows 10 Creators Update feature?. Read more: http:// owler.us/acs9dL $ MSFT;;#Microsoft
0;0;tell her u both ugly. y'all yo daddy's son ayy ayy furran. Microsoft paint head ass;;
0;0;Consequently did Dr Mars exceeding Microsoft expected to enhance "general interest" in its low start on retailers' appeals-court next year.;;
0;0;Microsoft Teams collaboration service starts rolling out to education http:// soc.fm/UPCPTDYd #MicrosoftEDU #edtech pic.twitter.com/eTsmVTboUT;;#MicrosoftEDU #edtech
0;0;A Microsoft Engineer Discusses Why Diversity In Tech Will Make Better Products https://www. fastcompany.com/3069122/a-micr osoft-engineer-discusses-why-diversity-in-tech-will-make-better-products …;;
0;0;Top story: Turn insight into deep, meaningful action using Microsoft Flow and P… https:// powerbi.microsoft.com/en-us/blog/tur n-insight-into-deep-meaningful-action-using-microsoft-flow-and-power-bi-2/ … , see more http:// tweetedtimes.com/AWSOMEDEVSIGNE R?s=tnp …;;
0;0;GTA V New en ebay: Grand Theft Auto V 5 USED SEALED ( Microsoft Xbox One, 2014) http:// ift.tt/2obdCtK pic.twitter.com/yUm5qiQ935;;
0;0;I liked a @YouTube video from @psnewsnow http:// youtu.be/0afcDinNbW0?a Microsoft Finally Admit Xbox One Failures and Remembering E3 2013;@YouTube @psnewsnow;
0;0;you literally TRIED to fix something that wasn't broken...AND FUCKING FAILED!;;
0;0;Что нового в Windows 10 Creators Update (версия 1703) - Microsoft Community https:// vk.cc/6rqHob;;
0;1;true wireless charging or phones similar to that of a hologram. Microsoft is developing the technology -;;
1;2;I liked a @YouTube video from @the_crapgamer http:// ln.is/www.youtube.co m/prgqb … OMG! Did Microsoft Just Get Marketing Rights For The New Call Of;@YouTube @the_crapgamer;
0;0;Microsoft Planner: Now you can recover deleted Plans and Groups https:// blogs.msdn.microsoft.com/brismith/2017/ 03/29/microsoft-planner-now-you-can-recover-deleted-plans-and-groups/ …;;
0;0;Microsoft 社がMacをコピーすることに長けていたわけではない。Macが10年もの間コピーしやすい製品だっただけだ。それはApple社の問題だ。独自性が消えていたのだ;;
0;0;1Doc for Microsoft Office 365 Online (wu changjiang) が、Macアプリセールスランキング24時間で、圏外⇒42位に急浮上しました。 https:// itunes.apple.com/jp/app/1doc-fo r-microsoft-office-365-online/id1126606236?mt=12&uo=2&at=11l55P&ct=AppStoreHit …;;
0;0;New on Ebay Used Tom Clancy's The Division ( Microsoft Xbox One, 2016) http:// ift.tt/2nktMkx pic.twitter.com/OPgyesJdAj;;
0;0;@HP @Microsoft it's ok to land me here with no way to get out...Nice job QA it's a tablet not a computer pic.twitter.com/PoO9iJXF4k;@HP @Microsoft;
3;5;. @toddbishop on how Microsoft 's first PR person, who died Wednesday, got the attention of biz news media: http:// talkingbiznews.com/1/how-microsof ts-first-pr-person-got-the-interest-of-the-biz-news-media/ … pic.twitter.com/qqfkffGA2w;@toddbishop;
0;0;Microsoft 's Windows 10 Creators Update lives up to its name http:// fb.me/1oqbyKYEs;;
0;0;This new system update kicks ass! Really like the design and simplicity of it. Congrats Microsoft @Xbox;@Xbox;
0;0;#Microsoft Windows 10 Mobile Build 15063.2 comes to Insiders in the Slow Ring. Read more: http:// owler.us/acs9an $ MSFT;;#Microsoft
1;0;Microsoft is testing Ruuh, an English-speaking AI chatbot aimed at the Indian market (Mary Jo… http:// dlvr.it/Nlr6Fm (via @_SEM ) pic.twitter.com/JcAdjwqUjM;@_SEM;
0;0;Microsoft study warns of difficulty organisations face in attracting cloud skills - Cloud Tech http:// dlvr.it/Nlr68M pic.twitter.com/WIrTHsKjDT;;
0;0;MySite: http:// j.gs/8u9s Atualização… http:// dlvr.it/Nlr64z #Games #Notícias #Interface_do_Xbox_One #Microsoft follow @3dsounada pic.twitter.com/dk06Lzjs8p;@3dsounada;#Games #Not #Interface_do_Xbox_One #Microsoft
0;0;なぜ、世界的に有名な Microsoft やIBMやサムスンが、 暗号通貨の一つ、イーサリアムと 提携していると思いますか？ http://www. excite.co.jp/News/economy_g /20160108/zuuonline_93807.html … …;;
1;1;Windows update just killed my desktop. To much cannabis at The Microsoft HQ again.;;
0;0;#Microsoft Windows 10 Mobile Creators Update build 15063.2 is now available in the Slow ring. Read more: http:// owler.us/acs9am $ MSFT;;#Microsoft
0;1;CodeLynx adapts Microsoft HoloLens headset for security systems on the go - http:// SourceSecurity.com http://www. arkas.co.uk/news;;
0;0;The latest Microsoft Education&Onenote Daily! http:// paper.li/MrDSci/1480434 420?edition_id=72a0faa0-14b8-11e7-bc3c-0cc47a0d164b … #mieexpert;;#mieexpert
0;2;Mi tarde con jóvenes promesas. #youthsparklivemx @Microsoft https://www. instagram.com/p/BSPbGVIjXUx/;@Microsoft;#youthsparklivemx
0;0;Windows 10 Creators Update: Microsoft bestätigt Start am 11. April http:// winfuture.mobi/news/96852;;
0;0;Recon Tech, ¡nuevo mando de Microsoft para PC y Xbox! http://www. konzentrix.com/recon-tech-nue vo-mando-de-microsoft-para-pc-y-xbox/ …;;
0;0;with our government waging a war on science?;;
0;0;#Microsoft Windows 10 Mobile build 15063.2 rolls out to Insiders in the Slow ring. Read more: http:// owler.us/acs9ao $ MSFT;;#Microsoft
0;1;Microsoft Dynamics 365 CRM provides #healthcare providers with a 360 degree view of their patients. http:// bit.ly/2nhzi5q #MSDYN365;;#healthcare #MSDYN365
1;0;Microsoft Intelligenza Artificiale, arrivano i chip prog... http://www. lifetrends.it/microsoft-inte lligenza-artificiale-chip-programmabili/ … #tech #lifetrends #tecnologia pic.twitter.com/0cUhYcZ5om;;#tech #lifetrends #tecnologia
0;0;Doria fecha parceria de R$ 15 milhões com a Microsoft para ensino público http:// fb.me/8sO32mHbG;;
0;0;Microsoft ’s http:// docs.com leaks sensitive files to everyone http:// borncity.com/win/2017/03/30 /microsofts-docs-com-leaks-sensitive-files-to-everyone/ …;;
0;0;New on Ebay Microsoft Xbox One with Kinect 500GB Black Console Bundle (9 games + Dimensions) http:// ift.tt/2n8fQsI pic.twitter.com/8tYkdV0lOk;;
2;2;#technews #tech Microsoft is testing Ruuh, an English-speaking AI chatbot aimed at the Indian market (Mary Jo F... http:// ow.ly/yTVS50avZGW;;#technews #tech
0;0;Retail Sales Associate (part-time) - Microsoft - West Des Moines, IA http:// ift.tt/2ococDN;;
0;0;Google Chrome, Microsoft Edge, and Win32k APIs Different actions are taken here! pic.twitter.com/cuf1A0k3tv;;
0;0;Microsoft Surface Book Leather Sleeve | RAW | http:// etsy.me/1QkhtM8 | #SurfaceBook #SurfaceBookSleeve #SurfaceBookCover;;#SurfaceBook #SurfaceBookSleeve #SurfaceBookCover
2;1;I liked a @YouTube video from @psnewsnow http:// youtu.be/0afcDinNbW0?a Microsoft Finally Admit Xbox One Failures and Remembering E3 2013;@YouTube @psnewsnow;
0;0;Tá me tirando em Microsoft o YouTube não roda mais em segundo plano https:// twitter.com/xboxbr/status/ 847228606010990596 …;;
2;3;“ #IngramMicroCloud #OdinAutomation : Cloud Services Surprises beyond #Microsoft Azure.”- @joepanettieri @ChannelE2E . http:// bit.ly/2ohLUeP pic.twitter.com/3eoau1YcI1;@joepanettieri @ChannelE2E;#IngramMicroCloud #OdinAutomation #Microsoft
0;0;another fact that you do not even use Mac at all u are using windows and adobe premiere maybe Microsoft pays you this time;;
0;0;O word do meu computador não tava querendo funcionar e eu liguei na assistência da Microsoft e era muito fácil de se resolver o problema;;
0;0;Recently, the government had a meeting with executives from ''Apple'' Inc, Microsoft , Samsung Electronics Co and... http:// fb.me/6Ca1TaLFf;;
0;0;Microsoft word「おっ？！この改行、この数字…見出しにしたいんやな！わかるで！あらよっとぉっ！段落下げて、ついでにフォントも変えといたったわ！」 俺「頼む～死んでくれ～」;;
0;0;I don't have gold. Could You get me a Microsoft card for me to change my gamertag?;;
0;0;「Surface Book」のハイエンドモデルを日本で発売へ　30万8664円から: Microsoft のハイブリッドノート「Surface Book」のハイエンドモデル「Surface Book with Performance… http:// dlvr.it/Nlr3y3;;
0;0;Comparison – Samsung Galaxy TabPro S Vs Microsoft Surface Pro 4 http:// inethonduras.com/index.php/2017 /03/21/comparison-samsung-galaxy-tabpro-s-vs-microsoft-surface-pro-4 …;;
0;0;Will Splunk become an Output Provider for Microsoft EventFlow? http:// dlvr.it/Nlr3gQ #splunk;;#splunk
0;0;Microsoft Flowからメールが飛ばなくて困っている… flowの実行履歴をみるとメール飛ばしてるのに、メール受信先にはこない。 Gmailにも届かない…なんでや。Azureの障害が検知できへんやん;;
0;0;I HATE the Xbox one update. It's extremely frustrating. Change it back @Microsoft This change made it worse.;@Microsoft;
0;0;#10: Microsoft D86-05555 Visio Standard 2016 Windows English 1 License Medialess: Microsoft … https:// goo.gl/fb/cKEwzI #Education #Software;;#10 #Education #Software
0;0;#Microsoft IT Pro Support: Managing Windows 10 GPO Issues Running on Windows Server 2012 R2. Read more: http:// owler.us/acs84u $ MSFT;;#Microsoft
0;2;no. get shotcut. it's free, not like the bs microsoft is doing. plus, way more features. https://www. shotcut.org/download/;;
0;0;パートナー様の成長戦略をサポートする「パートナー ネクスト (Partner NEXT)」 - Microsoft Partners https:// lnkd.in/g9jBusM;;
0;0;"An Absolute Beginners guide to Storage Spaces Direct | MVPDays2017RoadShow" #microsoft #S2D #StorageDirect #HCI https:// channel9.msdn.com/Events/MVPDays /MVPDays2017RoadShow/An-Absolute-Beginners-guide-to-Storage-Spaces-Direct …;;#microsoft #S2D #StorageDirect #HCI
1;3;Microsoft releases Auto Attendant and Call Queues in Office 365. See https:// blogs.office.com/2017/03/27/sky pe-business-drives-digital-transformation/ …;;
0;0;The Xbox One gets Microsoft ’s Beam streaming and a faster interface today http://www. theverge.com/2017/3/29/1510 5796/xbox-one-march-update-microsoft-beam-streaming-dashboard-faster …;;
0;0;Every time I have to open up Microsoft word I think of school;;
0;0;米 Microsoft 、Excelにリアルタイムでの共同編集機能を追加 | マイナビニュース http:// news.mynavi.jp/news/2017/03/2 9/153/ … #マイナビニュース;;#
0;0;Waiting for #xamarin #workshop @Microsoft HQs. pic.twitter.com/PghYGzOtQF;@Microsoft;#xamarin #workshop
0;0;Microsoft Targets Office Phones with Skype for Business Upgrades http:// ift.tt/2nBzwb7 #devnews;;#devnews
0;14;Isso porque ela saem quando a Google, Apple e Microsoft liberam msm, não cabe a Kiloo escolher a hora, só a data. https:// twitter.com/joseaschulz/st atus/847230527056695296 …;;
0;0;Microsoft Flight Simulator X Симулятор гражданской авиации: http:// youtu.be/W5HlkC3xErY?a на @YouTube;@YouTube;
0;0;#Amazing #1: Excel 2010 Training Videos - 14 Hours of Excel 2010 training by Microsoft Office: Specialist,… https://www. amazon.com/Excel-2010-Tra ining-Videos-Specialist/dp/B00505VMXY/ref=pd_zg_rss_ms_sw_software_1?ie=UTF8&tag=freehozzt-20&utm_source=dlvr.it&utm_medium=twitter … #GetNow;;#Amazing #1 #GetNow
0;0;You may find a way to do it, but Microsoft does not support installation of Windows to USB or SD. Thanks ^DM;;
0;0;Microsoft Azure Feature Checks for Defects in VM Backups http:// ift.tt/2nBzvUB #devnews;;#devnews
0;0;Microsoft Bookings Scheduling Tool Goes Global With New Capabilities http:// ift.tt/2nBHPE5 #devnews;;#devnews
0;0;Microsoft ha sido demandado por varios millones de dolares debido a las actualizaciones de Windows 10 [eng] https://www. meneame.net/story/microsof t-ha-sido-demandado-varios-millones-dolares-debido-10 …;;
0;0;Microsoft Dynamics MB6-890 Exam – Get Latest Exam Questions http:// dlvr.it/Nlr26f pic.twitter.com/YWtmg1qC6z;;
0;0;Hey @Microsoft I'd really like to use Groove if only it'd load a song to stream in less than the time it takes type this or you know...ever.;@Microsoft;
1;0;Microsoft is testing Ruuh, an English-speaking AI chatbot aimed at the Indian market (Mary Jo Foley/ZDNet) http:// ift.tt/2ozV59O pic.twitter.com/OZcYjhDBux;;
0;0;Technology Associate: Microsoft Technology Associate (Mta) #technologyassociate #FreeDownload #Free #Giveaway http:// buff.ly/2nfx4pa pic.twitter.com/jPmRy05OBJ;;#technologyassociate #FreeDownload #Free #Giveaway
0;0;Fix for Microsoft ’s faulty ‘WPD – 2/22/2016’ MTP driver update http:// borncity.com/win/2017/03/30 /fix-for-microsofts-faulty-wpd-2222016-mtp-driver-update/ …;;
0;0;The Microsoft Surface Book Giveaway | MakeUseOf Deals https:// deals.makeuseof.com/giveaways/the- microsoft-surface-book-giveaway?gid=1251298 … via @makeuseof;@makeuseof;
0;0;HEY COLLIN SONY > MICROSOFT YOU MAD?;;
0;14;おはようございまーす！ムラさんに教えてもらったwin10版シェーダーを入れようとしたら入れるフォルダが分からなくて最後にはなぜか間違えて作ったMicrosoftアカウントを消すのに悪戦苦闘してました(｡・・`｡) んなわけで現在の1.10.2自ワールドです(* ॑꒳ ॑* ) pic.twitter.com/v18dQFGTes;;
0;0;Cloud Computing löst traditionelles Geschäft mit Software-Lizenzen ab - Newsroom Microsoft Deutschland - http:// xing.com/r/zB4t1;;
0;0;$20.99 Minecraft Favorites Pack for Microsoft Xbox One Brand NEW on Ebay http:// rover.ebay.com/rover/1/711-53 200-19255-0/1?icep_id=114&ipn=icep&toolid=11300&campid=5338015517&customid=&mpre=http%3A%2F%2Fwww.ebay.com%2Fitm%2FMinecraft-Favorites-Pack-for-Microsoft-Xbox-One-Brand-NEW-%2F122260634832 …;;
0;0;MB2-718 Exam updated (29 Mar 2017) Questions for Microsoft Dynamics Certification http:// dlvr.it/Nlr1dt pic.twitter.com/rR2j18TSc3;;
0;0;Does Microsoft Edge Really Has An Edge In #Microsoft #Edgereallyhas #Edgein http://www. techyv.com/article/does-m icrosoft-edge-really-has-edge-power-consumption … pic.twitter.com/ZiIwgnVwr3;;#Microsoft #Edgereallyhas #Edgein
0;1;founf this. we are shifting Microsoft Envision, our event for business leaders to become part of Microsoft Ignite;;
0;0;ASOS Streamlines Fashion With Microsoft Azure via @forbes http://www. forbes.com/sites/tonybrad ley/2017/02/24/asos-streamlines-fashion-with-microsoft-azure/#132d5cab358f …;@forbes;#132d5cab358f
0;0;1Doc for Microsoft Office 365 Online (wu changjiang) が、有料Macアプリランキング24時間で、圏外⇒47位に急浮上しました。 https:// itunes.apple.com/jp/app/1doc-fo r-microsoft-office-365-online/id1126606236?mt=12&uo=2&at=11l55P&ct=AppStoreHit …;;
0;0;Microsoft MB2-717 Exam Actual Questions (Updated 29 Mar 2017) – Latest Version http:// dlvr.it/Nlr1cc pic.twitter.com/55GNaevElg;;
0;0;高価買取キャンペーン！！ おまとめ5点以上で5000円UP！！ http:// okaitori-pc-tok.shop / #PC買取 #office #ビジネス #タブレット買取 #Microsoft #Windows10;;#PC #office # # #Microsoft #Windows10
0;0;米 Microsoft 、Excelにリアルタイムでの共同編集機能を追加 http:// news.mynavi.jp/news/2017/03/2 9/153/ … #マイナビニュース 共有ブックでひどい目にあったことあるので気にはなるが、中身ははてさて;;#
0;2;Many lessons can be learned from this cautionary tale... #ERP #binarystream #MSDYNGP #Microsoft http:// ow.ly/9dJI30ajnzk;;#ERP #binarystream #MSDYNGP #Microsoft
0;0;OMG! Did Microsoft Just Get Marketing Rights For The New Call Of Duty In... https:// youtu.be/EjRARWHiA8A via @YouTube;@YouTube;
1;0;#HowTo disable #OneDrive in #Windows10 #technology #techtips #vc #startup #tech #Microsoft http:// arzillion.com/S/wencl7 pic.twitter.com/dyEbB8QE3h;;#HowTo #OneDrive #Windows10 #technology #techtips #vc #startup #tech #Microsoft
0;1;Google Launches http:// opensource.google.com http:// dlvr.it/Nlr14v #News #Microsoft pic.twitter.com/3ifkl7VjYU;;#News #Microsoft
0;0;見てる: "Allow inheritance from intersections · Issue #‌14075 · Microsoft /TypeScript" https:// github.com/Microsoft/Type Script/issues/14075 …;;#
0;0;I liked a @YouTube video http:// youtu.be/P2uL3qDkl7E?a Full Review Windows 10 Creators update Part 2 or 9 Microsoft Edge Browser features;@YouTube;
0;0;Skype Microsoft;;
0;0;Microsoft Targets Office Phones with Skype for Business Upgrades http:// ift.tt/2nBzwb7;;
0;0;Microsoft Azure Feature Checks for Defects in VM Backups http:// ift.tt/2nBzvUB;;
0;0;Microsoft Bookings Scheduling Tool Goes Global With New Capabilities http:// ift.tt/2nBHPE5;;
0;0;vCloud_Storage : How to Counter Big Players Bully for SMBs? - http:// hwswworld.com/index.php?rout e=product/category&path=137 … Microsoft Project 2013 Step : http://www. amazon.com/gp/product/073 5669112/ref=as_li_tf_tl?ie=UTF8&camp=1789&creative=9325&creativeASIN=0735669112&linkCode=as2&tag=hardwaresoftw-20 …;;
0;0;Windows 10 Creators Update lands on 11 April: But Microsoft admits the rollout of new... http://www. pcauthority.com.au/News/456509,wi ndows-10-creators-update-lands-on-11-april.aspx?utm_source=twitter&utm_medium=social&utm_campaign=pcauthority_autopost … pic.twitter.com/SchGlrc3Tx;;
0;0;他社見積もりご提示で査定金額UP！！ http:// okaitori-pc-tok.shop / #PC買取 #office #ビジネス #タブレット買取 #Microsoft #Windows10;;#PC #office # # #Microsoft #Windows10
0;0;Explore Researcher in Microsoft Word http:// buff.ly/2obViUm;;
0;0;Pam Edstrom, 1946-2017: Microsoft ’s first PR director was a technology communications pioneer http:// inethonduras.com/index.php/2017 /03/29/pam-edstrom-1946-2017-microsofts-first-pr-director-was-a-technology-communications-pioneer/ …;;
0;0;Windows Weekly 511: Yammer Yam Jam https:// youtu.be/InKxwCLhKjg via @YouTube #Windows #Microsoft;@YouTube;#Windows #Microsoft
0;1;hj teve uma palestra da microsoft na universidade e foi mto top tinha uma recrutadora pegando currrículo pra vagas nos estados unidos;;
0;0;無料で使えるウイルス対策ソフトまとめ!!! - FC2まとめ http:// summary.fc2.com/summary.php?su mmary_cd=448232 … #Windows #Microsoft #FC2 #ウイルス対策ソフト #アンチウイルス #61776;;#Windows #Microsoft #FC2 # # #61776
0;0;Payment Methods: UK Microsoft Points, Xbox Live Codes, License Transfer & PayPal! Skype:VolkyLobbies;;
0;0;Microsoft 's New Cloud Server to Use ARM Chips - http://www. investopedia.com/news/microsoft s-new-cloud-server-use-arm-chips/ … #IaaS;;#IaaS
0;0;Exclusive, leaked definitely NOT a Microsoft paint FAKE NEWS @CarltonFC banner for clash with @melbournefc on Sunday! #AFL #AFLDeesBlues pic.twitter.com/mAd3pOTcGt;@CarltonFC @melbournefc;#AFL #AFLDeesBlues
0;0;Unless 'legally compelled to', Microsoft will not hand over data http:// dlvr.it/Nlr073 #games pic.twitter.com/9ihdPhsaU6;;#games
0;0;How to Download Microsoft Office Picture Manager http:// dlvr.it/Nlr01w #FF #LIST #RT #LIKE pic.twitter.com/hzUIL2E2s9;;#FF #LIST #RT #LIKE
