retweets;favorites;text;mentions;hashtags
0;0;RT @GeeksRoom Microsoft Security Essentials elimina Chrome al confundirlo con un virus http:// bit.ly/rnVb4L;@GeeksRoom;
0;0;Microsoft Security Essentials elimina Chrome al confundirlo con un virus: Microsoft Security Essenti... http:// bit.ly/qXrA4K #eMarketing;;#eMarketing
6;0;#GR Microsoft Security Essentials elimina Chrome al confundirlo con un virus http:// bit.ly/nHq2G4;;#GR
0;0;Microsoft Security Essentials elimina Chrome al confundirlo con un virus http:// tinyurl.com/3pejyy8 #geek #Spanish;;#geek #Spanish
0;0;En el blog: Microsoft Security Essentials elimina Chrome al confundirlo con un virus http:// bit.ly/nHq2G4;;
0;0;Microsoft Security Essentials elimina Chrome al confundirlo con un virus http:// bit.ly/nHq2G4 #Geek;;#Geek
0;0;Microsoft Security Essentials elimina Chrome al confundirlo con un virus http:// bit.ly/py5ZmJ;;
0;0;[Geeksroom] Microsoft Security Essentials elimina Chrome al confundirlo con un virus http:// bit.ly/nbx5oY;;
1;0;Microsoft Security Essentials elimina Chrome al confundirlo con un virus http:// tinyurl.com/3pejyy8;;
0;0;http:// bit.ly/oQAr0u Microsoft Xbox 360 4gb Arcade;;
0;0;X Box Consoles · Microsoft Xbox 360 | redcoon.nl: Bij redcoon.nl vind je alles uit de productcategorie Consoles ... http:// bit.ly/eKWmMt;;
0;0;x-box Consoles · Microsoft Xbox 360 | redcoon.nl: Bij redcoon.nl vind je alles uit de productcategorie Consoles ... http:// bit.ly/hItICZ;;
0;0;X Box Consoles · Microsoft Xbox 360 | redcoon.nl: Bij redcoon.nl vind je alles uit de productcategorie Consoles ... http:// bit.ly/eKWmMt;;
0;0;Microsoft Visual Studio 2008 Unleashed By Lars Powers http:// p.ost.im/p/ejhnVD;;
0;0;Get Microsoft Office 2010 Free! Here: http:// bit.ly/mfgEYD http:// bit.ly/mfgEYD;;
1;0;No Bloom Community 8s! Once I reach 200 viewers ( Im already at 150 ) I'm gonna give away 1600 Microsoft Point card! http:// twitch.tv/Goofy RT;;
0;0;MICROSOFT SIDEWINDER GAMEPAD w/SOFTWARE CD-ROM & MANUAL - $14.99: MICROSOFT SIDEWINDER GAMEPAD WITH SOFTWARE CD-... http:// bit.ly/n5AkFQ;;
0;0;Which is the best software updater? @FireFox Which is the worst IMHO? @Microsoft Office (Mac): numerous clicks and app quits.;@FireFox @Microsoft;
0;0;Microsoft Training: IT training enhances job skills http:// bit.ly/nFQhUc;;
0;0;XBox 360 Check out 'Kinect Sensor with Kinect Adventures!' by Microsoft Software http:// amzn.to/biJtEK;;
0;0;Microsoft Wireless Entertainment Desktop 7000 (Silver): Microsoft is committed long term to the mission of help... http:// amzn.to/ocWVjB;;
1;0;Microsoft Needs A New Business Model For Windows 8 Tablets http:// bit.ly/mSYjcw PC Tablets;;
0;0;Jobs or Cook, Apple battle vs. Google differs from old Microsoft ... http:// bit.ly/mW6icZ http:// bit.ly/pXjVCG h... http:// bit.ly/pwUIAd;;
1;0;No Microsoft Word, I'm pretty sure I spelled my own name correctly..... Oh crap, no, 2 l's Danielle not 3.... #smh #storyofmylife;;#smh #storyofmylife
0;0;[Add7] ★ Microsoft オフィス （日本語版） 売りたし！★ http:// bit.ly/o4IKya プロダクトキー 認証 マイクロソフト・オフィス アウトルック マイクロソフト;;
6;0;Antivírus da Microsoft acusa navegador Chrome de carregar malware;;
0;0;Cant find google?RT @VentureBeat : Microsoft accidentally deleted Chrome from a few thousand users' computers. Uh... oops? http://ow.ly/6KtCm;@VentureBeat;
0;0;Microsoft desapareción Google Chrome porque lo consideraba un virus http:// bit.ly/nloUmA @CHW_NET;@CHW_NET;
0;0;Latest Microsoft Dynamics GP Top Add-Ons Nominations include Config AD; Zetafax; Easy e-Bank Rec; http:// dld.bz/asnA9 #msdyn;;#msdyn
0;0;Microsoft Work on Promoting Window Phone 7 http:// shar.es/bmHz1;;
0;0;Microsoft ?s Security Essentials anti-malware tool has mistakenly identified Google Chrome as a password-pilfering... http:// dlvr.it/nwRhC;;
0;0;Microsoft ?s Security Essentials anti-malware tool has mistakenly identified Google Chrome as a password-pilfering... http:// dlvr.it/nwRh5;;
0;0;History Of Microsoft ’s Cakes To Mozilla For Shipping Firefox - http:// bit.ly/nI2SfD;;
0;0;Microsoft Crm Dynamics http://www. enire.com/software/micro soft-crm-dynamics-t26886.html …;;
0;0;Microsoft Word nunca vai entender que o meu nome não é um erro de ortografia!;;
0;0;Microsoft Work on Promoting Window Phone 7 http://www. planetinsane.com/microsoft-work -on-promoting-window-phone-7/2623390/ … via @planetinsane;@planetinsane;
1;1;Microsoft Most Valuable Professional: http://www. mcsesolution.com/Grupo-Mcsesolu tion/microsoft-most-valuable-professional.html … via @danieldonda;@danieldonda;
0;0;" @twiterillo : Microsoft Security Essential confunde Chrome con malware eliminándolo del sistema http:// bit.ly/qfTWkU /Maaal;@twiterillo;
0;0;Microsoft Lebanon Boards the Social Media Ship (Iloubnan.info) http:// bit.ly/ruQBPb;;
0;0;… http://mercury-auto mobile-magazine-ads-news.blogspot.com/2011/10/miley- cyrus-manip-selena-gomez.html … Shower Travel Microsoft;;
0;0;Masya allah -___- RT @ochaindahh: Galak ak SE yg microsoft windows :o;@ochaindahh;
0;0;I liked a @YouTube video http:// youtu.be/G7LwUlaOKX4?a Microsoft Kinect Motion Sports Launch Trailer;@YouTube;
0;0;“ @coolcatteacher : How to google cloud connect Microsoft Office. Cool. http:// goo.gl/feLqK a must read when using google docs #pbl #edchat;@coolcatteacher;#pbl #edchat
0;0;http://cmdesign.ca - Joy Ride MIA, but Microsoft insists 'BigPark's vision' will come to l... * http:// bit.ly/pYVqLk - http://cmdesign.ca;;
0;0;http://cmdesign.ca - Joy Ride MIA, but Microsoft insists 'BigPark's vision' will come to l... * http:// bit.ly/pYVqLk - http://cmdesign.ca;;
0;0;http://cmdesign.ca - Joy Ride MIA, but Microsoft insists 'BigPark's vision' will come to l... * http:// bit.ly/pYVqLk - http://cmdesign.ca;;
0;0;Microsoft Points, PBG Credits, PBG Gear, gaming gear, energy drinks & MORE http:// bit.ly/nmNwXl We take PayPal - AND we have it ALL!!!;;
0;0;Visual Basic Online - Microsoft Visual Studio Express | Microsoft SQL Server Express: Visual Studio 2010 Express... http:// bit.ly/pw8AUP;;
0;0;#Google acusa a #Microsoft de extorsión. http:// tecnewsperu.blogspot.com/2011/09/google -acusa-microsoft-de-extorsion.html …;;#Google #Microsoft
0;0;8 ways Windows 8 improves on Windows 7: http:// bit.ly/n2lsys Download Windows 8 Microsoft show off Wins 8 WP7 ios 5 final Android _8;;
0;0;Also have a boxed copy of Microsoft Publisher 97 with CD Key. $10+postage. http:// yfrog.com/hwelhzj;;
0;0;@josepez83 josheshito do u have Microsoft office??;@josepez83;
0;0;Very intriguing story on the death of Microsoft 's UI technologies http://www. riagenic.com/archives/722 #UX;;#UX
0;0;Italian Software Maker Contests Microsoft 's Purchase of Skype: http:// nyti.ms/rhQNjT;;
0;0;Microsoft Pushes FixIt Tool to Enable Support for Newer TLS Version http:// threatpost.com/en_us/blogs/mi crosoft-pushes-fixit-tool-enable-sup …;;
0;0;http:// butterfliest.jugem.jp/?eid=142 Home Improvement Pathology Tool List of Songs Asia Opera Microsoft Aston Martin Weapon Renault;;
0;0;AS IS MICROSOFT XBOX 360 ELITE SEALED GAME CONSOLE http:// bit.ly/nwOYsk;;
0;0;XBox 360 Check out 'Kinect Sensor with Kinect Adventures!' by Microsoft Software http:// amzn.to/biJtEK;;
0;0;Got an error from the Microsoft Teredo Tunneling Adapter driver in Windows 7? If u use ZoneAlarm, upgrade to the latest version #ipv6 #help;;#ipv6 #help
0;0;FOOTBALL WORLD • Microsoft Office 2010 Visio Premium x32: Compatible HP CC364X High Yield Black Toner CartridgeH... http:// bit.ly/rbOIGC;;
0;0;FOOTBALL WORLD • Microsoft Office 2010 Visio Premium x32: Compatible HP CC364X High Yield Black Toner CartridgeH... http:// bit.ly/qxc3ca;;
0;0;Microsoft “Accidentally” Tags Chrome As Malware http:// nblo.gs/nRugP;;
0;0;Microsoft удаляет Google Chrome с компьютеров пользователей http:// feedproxy.google.com/~r/my-chrome/~ 3/uz-ZIhNn87w/ …;;
2;0;RT #dmpg_ Microsoft #SharePoint #Telligent team up to enable powerful #social community experiences. Learn how #SPC11 Tues 3:15 SPC206: (CXM);;#dmpg_ #SharePoint #Telligent #social #SPC11
0;0;Microsoft Downs Domain that Bred Botnet that Targeted Macs: Mac users uncharacteristically faced Kelihos, a smal... http:// bit.ly/qnO0L1;;
0;0;8 ways Windows 8 improves on Windows 7: http:// bit.ly/n2lsys Download Windows 8 Microsoft show off Wins 8 WP7 ios 5 final Android _63;;
0;0;http:// jesuschrists.jugem.jp/?eid=171 Gardening Husband George Clooney Italy Microsoft Rolling Stones Mathematician Mac OS X Home Engineer;;
0;0;amazon UK #8: Forza Motorsport 4 (Xbox 360): Forza Motorsport 4 (Xbox 360) by Microsoft Platform:   Xbox 360... http:// dlvr.it/nwBl6 check !;;#8
0;0;Bing, una ruina para Microsoft http:// tinyurl.com/6b539pc;;
0;0;Microsoft which offered to buy Yahoo for more than $47 billion in 2008 and was turned down, has also been named as a likely bidder for Yahoo;;
0;0;Varios cursos de microsoft gratis http://ow.ly/6KDdM;;
0;0;XPがこんなに生き残ったのって Microsoft が定義したNetbook要件が微妙だったのと、XPを提供するという大失策をやっちまったせいだよなあ。あそこで突っぱねてVista必須にしてれば、Netbookあれだけ売れなかったかもしれないけど、XPサポート伸ばさなくても済んだ。;;
0;0;Xbox 360 Wireless Network Adapter A/B/G Networks Only by Microsoft Software http://www. amazon.com/gp/product/B00 0B6MLV4?ie=UTF8&tag=gmlvr30-20&linkCode=shr&camp=213733&creative=393185&creativeASIN=B000B6MLV4&ref_=zg_bs_14112941_17 … via @amazon #xbox360 #games;@amazon;#xbox360 #games
0;0;@dreeespriggg I would put the lil accent but I only know how to do it in Microsoft word lol;@dreeespriggg;
1;0;#google perd du crédit ? RT @tunisieup : Samsung : les raisons de son accord avec Microsoft http://ice.tn/2611 #tunisie #it #outsourcing;@tunisieup;#google #tunisie #it #outsourcing
0;0;#G3 aka #ExtraLife with Microsoft backing it. = Fail...;;#G3 #ExtraLife
0;0;http:// lnkd.in/Yue3qN Microsoft will cry...;;
0;0;Tips For Obtaining The Top 401k Advisors: You may have a 401k advisor? Read through guidelines for c... http:// bit.ly/raYqeo #microsoft;;#microsoft
1;0;Battlefield 3 PS3, Xbox 360 Multiplayer Beta flanks solid action: s Playstation 3 and Microsoft Corp.'s Xbox 360... http:// bit.ly/oWVVNz;;
0;0;Battlefield 3 PS3, Xbox 360 Multiplayer Beta flanks solid action: s Playstation 3 and Microsoft Corp.'s Xbox 360... http:// bit.ly/qswi1C;;
0;0;Microsoftが得るAndroidのライセンス料は4億4400万ドル――Goldman Sachs予測 - ITmedia プロフェッショナル モバイル http://www. itmedia.co.jp/promobile/arti cles/1109/30/news022.html …;;
0;0;Microsoft Wireless Laser Desktop 7000: Includes the popular Comfort Curve keyboard design, a rechargeable High D... http:// bit.ly/oPLAAI;;
0;0;Microsoft Wireless Laser Desktop 7000: Includes the popular Comfort Curve keyboard design, a rechargeable High D... http:// bit.ly/oPLAAI;;
0;0;Microsoft Wireless Laser Desktop 7000: Includes the popular Comfort Curve keyboard design, a rechargeable High D... http:// bit.ly/oPLAAI;;
0;0;Microsoft Shows Off Kinect and Windows Phone 7.5 Integration [VIDEO]: http:// bit.ly/nwk0yK WP7 windows 8 download ios 5 jailbreak _67;;
0;0;Карта ключа продукта Microsoft Office для дома и бизнеса 2010: Карта ключа продукта Microsoft Office для дома и ... http:// bit.ly/qY71XR;;
0;0;There is no software in the world that kerns as poorly as Microsoft Word. How can they get it so poorly, when everyone else does fine??;;
0;0;#OpenSource #News Box.net Boosts Sync, Security In Battle With Microsoft http:// bit.ly/qLNit4 #Linux;;#OpenSource #News #Linux
0;0;Microsoft to make Royalty Fees for the Kindle Fire also - The Gadget Gurus http:// go.evri.com/4OqI #microsoft;;#microsoft
2;0;Microsoft Security Essential confunde Chrome con malware eliminándolo del sistema http:// bit.ly/qfTWkU #fb;;#fb
0;0;RT @Microsoft : ... @GearsofWar3 sells 3 million copies in a week + more: http:// bit.ly/oq9npR;@Microsoft @GearsofWar3;
0;0;… http://ferrari- 360-with-430-wheels-news.blogspot.com/2011/10/citroe n-bx-gti-bx-16-soupapes.html … Automobile Microsoft France Matt Damon;;
0;0;RT @Microsoft : Weekend Reading: @WindowsPhone 7.5 starts rolling out, ...;@Microsoft @WindowsPhone;
0;0;Microsoft es superada por IBM http:// fb.me/1gIn9O7u9;;
0;0;IBM beats Microsoft in tech giants ranking http:// fb.me/V4rTMm19;;
0;0;【 Microsoft Security EssentialがGoogle Chromeを潜在的な脅威として認識？】 http:// detail.chiebukuro.yahoo.co.jp/qa/question_de tail/q1372413083 … 発症中。がっかりです。。。;;
0;0;Remote Desktop Manager 6.5.1.0 download - FreewareLinker.com: ... SSH, RAW and rLogin; X Window; Microsoft Hyper... http:// bit.ly/rmbiwO;;
0;0;Remote Desktop Manager 6.5.1.0 download - FreewareLinker.com: ... SSH, RAW and rLogin; X Window; Microsoft Hyper... http:// bit.ly/mTcXls;;
0;0;... SSH, RAW and rLogin; X Window; Microsoft Hyper-V; Microsoft Virtual PC; Microsoft Virtual Server; Microsoft ... http:// bit.ly/mTcXls;;
0;0;Remote Desktop Manager 6.5.1.0 download - FreewareLinker.com: ... SSH, RAW and rLogin; X Window; Microsoft Hyper... http:// bit.ly/mTcXls;;
0;0;Remote Desktop Manager 6.5.1.0 download - FreewareLinker.com: ... SSH, RAW and rLogin; X Window; Microsoft Hyper... http:// bit.ly/mTcXls;;
0;0;@mugi_wara ああ、そうなんですか。それが Microsoft 製ですよ;@mugi_wara;
0;0;ART-COPY 6.1 ADDS MICROSOFT XP/WIA SCANNER DRIVER SUPPORT.: An article from: Imaging Update: This digital docum... http:// amzn.to/n34FUr;;
0;0;Microsoft , Samsung Enter Into Android Licensing Agreement - Latest News http:// soc.li/afT9Omg;;
1;0;Microsoft idea: Kinect body scans could estimate age, automate parental controls: http://www. geekwire.com/2011/microsoft -idea-kinect-body-scans-estimate-age-automate-parental-controls … No more Kinect for little people!;;
7;0;Feliz día del periodista que le deja el trabajo de corrección ortográfica a Microsoft Office Word 2010.;;
0;0;Skype dando trabalho, parabens Microsoft por estragar um bom software.;;
0;0;what is wrong with my microsoft word it keeps stopping;;
0;0;Microsoft Windows Developer Preview x86 6.2.8102 en-RUS Lite DVD: Microsoft Windows Developer Preview x86 6.2.81... http:// bit.ly/pFp9rN;;
0;0;@marknca Ha! Silly Microsoft ...;@marknca;
0;0;wow! microsoft Expression Encoder (Screen Capture) is the tool to record your #wp videos. Nice highlighter & lot of other options! #wpdev;;#wp #wpdev
0;0;#Microsoft #Bluetooth #Notebook #Mouse 5000 - неубиваемая мышь! Падает и падает.;;#Microsoft #Bluetooth #Notebook #Mouse
0;0;Microsoft reportedly adding video from Comcast, Verizon, HBO Go and others to Xbox Live http:// aol.it/rd3WRv via @engadgethd;@engadgethd;
0;0;http:// lounge090611.jugem.jp/?eid=157 Exercise Hospital Intimacy Microsoft Monsters Audi Clock International Law Softball Civil Law XBOX;;
0;0;Error? umm eso es dudoso, miedo? - Microsoft Security Essentials elimina Chrome de Windows y cómo solucionarlo http:// bit.ly/n9Fiy5;;
0;0;IBM Ahora Más Valiosa Que Microsoft : Wow, por primera vez desde el año 1996, la compañía IBM ... http:// bit.ly/nTxhar #avantwebsolutions;;#avantwebsolutions
0;0;Hiring a Front Desk Administrative Assistant With Strong Microsoft Suite Skills at Kelly Services ... http:// bit.ly/qtYtHF #jobs #shjobs;;#jobs #shjobs
0;0;おめでとうございます。MVPの検索サイトでnittaで検索しても出ませんが、まだ公開前かな。 http:// goo.gl/6kfIS RT @nittajunya 新田順也 Microsoft のMVP（Word部門）をいただきました。;@nittajunya;
0;0;Microsoft identifica por error Google Chrome como malware http:// bit.ly/n8PO65;;
0;0;IPAD doubles as a piece of paper now I can print from it..and It have a keyboard...ii just Microsoft to work on here and its a wrap;;
1;0;Whoops! Did @Microsoft accidentally delete your install of @GoogleChrome ? Here's how to get it back: http://j.mp/nXOsyB;@Microsoft @GoogleChrome;
0;0;thanks for not having a rating system microsoft ... would like to not worry about 13-17 year olds using my app..;;
0;0;Ho appena comprato questo articolo: Halo Anniversary Xbox 360 Italian EMEA PAL DVD' di Microsoft tramite @amazon http://www. amazon.it/dp/B005FJEO12/ ref=cm_sw_r_tw_asp_KwtVC.1H7B5DY …;@amazon;
0;0;IBM Tops Microsoft in Market Value http:// on.wsj.com/mQ4Xep via @WSJ @ibm @microsoft;@WSJ @ibm @microsoft;
0;0;Microsoft Security Essentials elimina Chrome de Windows y cómo solucionarlo http:// dlvr.it/nwPJ2;;
0;0;Aaaaaaaaaaaa blm ada microsoft office ԅ(´̩ε `̩ԅ );;
0;0;IBM Tops Microsoft To Become Second Most Valuable Tech Company--But Only Briefly http:// huff.to/phhwB8 via @huffingtonpost;@huffingtonpost;
0;0;Google, Yahoo y Microsoft se unen por la libertad de expresión http:// mexico.cnn.com/tecnologia/201 1/03/08/google-yahoo-y-microsoft-se-unen-por-la-libertad-de-expresion?utm_source=feedburner&utm_medium=feed&utm_campaign=Feed%253A+cnnmexico%252Ftecnologia+(Tecnolog%25C3%25ADa+-+CNNM%25C3%25A9xico.com … );;
0;0;Microsoft Shows Off Kinect and Windows Phone 7.5 Integration [VIDEO]: http:// bit.ly/nwk0yK WP7 windows 8 download ios 5 jailbreak _7;;
0;0;Choose Between Microsoft windows Website hosting and Unix like ... http:// bit.ly/n5kzRI;;
0;0;¡Me limpio el culo con Microsoft !;;
0;0;Convert Microsoft Excel to a Web Database http:// bit.ly/ocwifu #MS_Excel #online_database;;#MS_Excel #online_database
0;0;IBM supera Microsoft em valor de mercado http:// info.abril.com.br/noticias/merca do/ibm-supera-microsoft-em-valor-de-mercado-01102011-9.shl … via @_INFO;@_INFO;
0;0;昨年に引き続き、 Microsoft Most Valuable Professional (MVP) 受賞しました！ありがたい事です。日頃お世話になっている皆さんに感謝。;;
0;0;@FeaRHaleyBaby I can give microsoft points for u to buy the map;@FeaRHaleyBaby;
1;0;Refazendo os cálculos de sua empresa? A Microsoft Office Standard 2010 está com 30% off. Aproveite! http:// bit.ly/qiapcG;;
0;0;GREAT guest blog post by JJ Food Service CIO Rif Kiamil on his experience w/ Microsoft Dynamics AX 2012. Check it out! http:// stuf.in/b17t5;;
0;0;Should you upgrade to #Microsoft Office 2010. http:// bit.ly/9gJ0Yb #tech #Office2010;;#Microsoft #tech #Office2010
0;0;LOL, this was kind of a flop -_- " Microsoft Zune got an Official Upgrade!!!!" http:// bit.ly/aO9dZB;;
0;0;Que Microsoft que piningui, i'm sorry, Tomatelaaass! @argiralt;@argiralt;
0;0;http:// juncturejunior2109.blogspot.com/2011/10/renewa l-of-vows-wording-samples.html … Investment Skiing Microsoft George Clooney Children;;
0;0;Wow, the web really looks like it's growing into just being Chrome vs. Firefox. No wonder Microsoft rushed to make IE a contender again.;;
0;0;http:// lpgas090511news.cocolog-nifty.com/blog/2011/10/m ark-feehily-an.html … Water Hewlett-Packard Corvette Education Health Science Microsoft;;
0;0;Microsoft amplía su gama de ratones con Explorer Touch y Touch Mouse http:// tecnologia.es.msn.com/fotos.aspx?cp- documentid=159065523&ocid=tweet … vía @msn_ellos;@msn_ellos;
0;0;Depois do mau entendido da Microsoft com o Chrome, estou devolta a usar. Graças a Deus! kkkk;;
0;0;Do you STILL trust Microsoft to build antivirus support into Windows 8? http:// zd.net/oQX0hZ RT @ZDNet;@ZDNet;
0;0;Idiots... RT @VentureBeat : Microsoft accidentally deleted Chrome from a few thousand users' computers. Uh... oops? http://ow.ly/6KtCm;@VentureBeat;
0;0;RT @DanielPink : RT @davidmwessel : IBM Tops Microsoft in Market Value for first time since 1996 http:// on.wsj.com/okqTPB;@DanielPink @davidmwessel;
0;0;which software should I use, a small businessman, to keep track of inventory? Excel? Access or Microsoft Office?;;
0;0;Woven Gemstone Chip Stretch Bracelet PATTERN and INSTRUCTIONS on CD: You must have Microsoft Word on your PC to run... http:// dlvr.it/nwNrZ;;
0;0;Se Microsoft fosse boa, não começaria com "M" de merda.;;
0;0;Google Chrome - Microsoft Security Essentials on 1 Fav Source+10 others like VentureBeat-Whoopsie: Microsoft acc... http:// bit.ly/romeCB;;
0;0;Microsoft deberia replantearse que carajo quizo inventar con la version 2011 de msn.;;
0;0;Without a doubt, two of the most prevalent world-wide-web website hosting systems that you can get are Microsoft ... http:// bit.ly/oTnNNU;;
0;0;Definitely, two of the most popular web web hosting service systems that you can get are Microsoft windows and A... http:// bit.ly/ogeFtG;;
0;0;Microsoft Natural Ergonomic Desktop 7000 Reviews: High Definition Laser Technology gives the Mouse more precisio... http:// bit.ly/qlUwHf;;
0;0;Microsoft Natural Ergonomic Desktop 7000 Reviews: High Definition Laser Technology gives the Mouse more precisio... http:// bit.ly/qlUwHf;;
0;0;Microsoft Natural Ergonomic Desktop 7000 Reviews: High Definition Laser Technology gives the Mouse more precisio... http:// bit.ly/qlUwHf;;
0;0;Microsoft Natural Ergonomic Desktop 7000 Reviews: High Definition Laser Technology gives the Mouse more precisio... http:// bit.ly/qlUwHf;;
0;0;… http://si lly-wedding-dresses-news.blogspot.com/2011/10/modern -winter-wedding-invitations-from.html … GPS Microsoft Monitor Adultery Pathology;;
0;0;October priority is to ship new WinPatrol build that handles Microsoft 's new random cookie filenames. Get notified: http://www. winpatrol.com/signup.html;;
0;0;Microsoft Apps coming to Nokia Symbian Belle smartphones http:// tinyurl.com/5s8f528;;
0;0;Que tal um bolo de aniversário comemorando uma vulnerabilidade da Microsoft ? http:// bit.ly/okkqFc via @corujadeti;@corujadeti;
0;0;Que tal um bolo de aniversário comemorando uma vulnerabilidade da Microsoft ? http:// bit.ly/oIKhTX via @corujadeti;@corujadeti;
0;0;by @gustcol .. Que tal um bolo de aniversário comemorando uma vulnerabilidade da Microsoft ? http:// bit.ly/noBe9R;@gustcol;
1;0;Que tal um bolo de aniversário comemorando uma vulnerabilidade da Microsoft ? http:// bit.ly/oIKhTX (via @gustcol );@gustcol;
0;0;Microsoft Windows Developer Preview x86 6.2.8102 en-RUS Lite DVD: Microsoft Windows Developer Preview x86 6.2.81... http:// bit.ly/qjtL1C;;
0;0;Microsoft Security Essentials Identifikasi Google Chrome Sebagai Malware Trojan ~ Mekhels [Digg] http:// nblo.gs/nRsUR;;
0;0;Microsoft AV Mistakes Google Chrome For a Virus - PC Magazine http:// bit.ly/qzEkCk;;
0;0;MS 백신프로그램이 크롬을 바이러스로 오인하고 삭제 시켰군요. Microsoft accidentally deleted Chrome from a few thousand users' computers.http://ow.ly/6KtCm;;
0;0;@ThaKite : Sending out a KITE, Gaming: Microsoft Xbox 360 Gears of War 3 Special Edition - http:// tinyurl.com/42jh7bb;@ThaKite;
0;0;;) I work hard because I love my work. Bill Gates (1955 - ) founder and chairman of Microsoft;;
0;0;Windows 8 Tablets And Desktops Shown Off By Microsoft At BUILD Conference http:// bit.ly/nXTTVe tablet S Hp TOuchPad WP7 ipad 3 ios _60;;
0;0;#dmpg_ Microsoft #SharePoint #Telligent team up to enable powerful #social community experiences. Learn how #SPC11 Tuesday 3:15 SPC206: (CXM);;#dmpg_ #SharePoint #Telligent #social #SPC11
0;0;Sending out a KITE, Gaming: Microsoft Xbox 360 Gears of War 3 Special Edition - http:// tinyurl.com/42jh7bb;;
0;0;Additional Tags: call of duty 5 gameplay multiplayer 4 COD5 COD 5 infinity ward xbox 360 microsoft sony playstation... http:// dlvr.it/nwNFb;;
0;0;Analice el comportamiento y el uso online de su público objetivo. - Microsoft Advertising - España http:// advertising.microsoft.com/espana/uso-onl ine … vía @MSAdvertising;@MSAdvertising;
0;0;http:// bit.ly/4Km9Y8 RT @busquedaempleo Conviertete en un experto en diseno web con la herramienta Microsoft #dr ... http:// bit.ly/ok6fGa;@busquedaempleo;#dr
0;0;RT @ernesmil14 Soporte de Microsoft Windows Vista http:// support.microsoft.com/ph/11732/es-es #tab1 … : Soporte de Microsoft Windows Vista http:// support.microsoft.com/ph/11732/es-es #tab1 …;@ernesmil14;#tab1 #tab1
0;0;#Waiting for @seesmic to come out with a great g+ client for Android! The one from Google sucks big time! Feels as though Microsoft made it!;@seesmic;#Waiting
0;0;Managing a business is tough. Microsoft Dynamics GP 2010 R2 enables more insight and greater efficiency. Watch a demo @http://stuf.in/b17;@http;
0;0;NovaMind Mind Mapping Software Adds Microsoft Project Import and Export; Mind Manager Import http:// post.ly/3Rhi6;;
0;0;La canción del nuevo videojuego de #Batman es para las consolas Playstation 3, Xbox 360, Wii U y Microsoft Windows y saldrá en noviembre.;;#Batman
0;0;Microsoft Downs Domain that Bred Botnet that Targeted Macs http:// dld.bz/asAeu;;
0;0;hey look it's comic chat time:(ﾟヮﾟ) chat.comic-sun.net, room #hurfcity ☜(ﾟヮﾟ☜) be sure to use microsoft comic chat for maximum laughs;;#hurfcity
0;0;http:// creditor0908.jugem.jp/?eid=156 Microsoft Larry King Live Julia Roberts Camera Hawaii Home Appliance Jaguar Credit Card;;
0;0;Definitely, two of the most popular web web hosting service systems that you can get are Microsoft windows and A lin... http://q6o99.tk;;
0;0;Definitely, two of the most popular web web hosting service systems that you can get are Microsoft windows and A... http:// bit.ly/mX29mr;;
0;0;Microsoft windows world wide web web hosting provides extensive to offer. It Provides ASP, ASP.World wide web an... http:// bit.ly/puRgZP;;
0;0;Microsoft “Accidentally” Tags Chrome As Malware #Techupdate http:// bit.ly/qNBXyW;;#Techupdate
0;0;Is Microsoft the “Black Hand” of the Android Kingdom? http:// onlineinternetjob.net/?p=1459;;
0;0;Suena a trampa. Por que iban a darnos los de Microsoft regalos y pizza en Teleco solo por asistir a su evento? #itsatrap !;;#itsatrap
0;0;@zedshaw A programmer goes to Microsoft to work on Open Source.;@zedshaw;
