retweets;favorites;text;mentions;hashtags
2;3;@Microsoft @Xbox @XboxSupport you won't get away with this I won't forgive you I will never forgive I'm now a ps4 player jk, but fix this pic.twitter.com/5sTEHSmMJj;@Microsoft @Xbox @XboxSupport;
0;0;Microsoft Releases LinkedIn App for Windows 10 PCs http:// ift.tt/2vvTHZm;;
0;0;Microsoft appoints new General Manager for Nigeria http:// ift.tt/2u3hh1C;;
0;0;#Microsoft .erichorvitz is speaking about #AI in the open world—tune into the #livestream to watch #FacSumm #Edgeo … https:// twitter.com/i/web/status/8 87093274103525376 …;;#Microsoft #AI #livestream #FacSumm #Edgeo
0;0;#Microsoft Catch the final season of ‘The Strain’ in the Windows Store http:// msft.social/0YQRD5 pic.twitter.com/p8B3cx4whM;;#Microsoft
0;1;No lo podían haber hecho peor los de microsoft;;
0;0;Laser Checks, Payroll, Compatible with Microsoft Dynamics http://www. blogs.winncomm.net/laser-checks-p ayroll-compatible-with-microsoft-dynamics … pic.twitter.com/5ypXMjQWi0;;
0;0;Microsoft 翻訳 pic.twitter.com/gPPAL1y6JW;;
0;0;I have contributed to you through the years in commentary and strategy solution bearing banter. IGNORED! Whatever its your class war bighead;;
0;0;#Microsoft recognized in Leader Quadrant of Gartner’s Magic Quadrant for Access Management, Worldwide. https:// info.microsoft.com/EMS-AM-MQ-2017 .html?ls=social&utm_source=Direct …;;#Microsoft
0;0;Tech Moves: Microsoft bringing in GE tech executive to be corporate VP of U.S. division http:// ift.tt/2vbGqWw pic.twitter.com/ep8vMvKCSL;;
0;0;Now Hiring: Director - Cybersecurity Policy at Microsoft (Washington D.C.) http:// dlvr.it/PWJzGy #privacy #infosec;;#privacy #infosec
0;1;Microsoft Surface Pro 5 To Come With A Refreshed Design, Find Out Specs, Features & Release Date http:// tinyurl.com/y8eefnlx;;
0;0;#Microsoft Research AI Division Hopes To Solve AI Challenges. Read more: http:// owler.us/ac2NNm $ MSFT;;#Microsoft
0;0;#Review Microsoft Surface Pro 4 Intel Core i5 256 GB, 8 GB RAM. Tablet or laptop? http:// goo.gl/mgjUBt #BuyCheap pic.twitter.com/vJcdGNm67i;;#Review #BuyCheap
1;3;Corporations including @Microsoft & @BECU find a place in Highline classrooms: http:// bit.ly/2uAO7IJ @M_Thomassian @HPSCareerAccess pic.twitter.com/h917U275uh;@Microsoft @BECU @M_Thomassian @HPSCareerAccess;
0;0;@Xbox @XboxAustralia @Microsoft please tell us you have plans to release #xboxonsie;@Xbox @XboxAustralia @Microsoft;#xboxonsie
0;1;Tag ur self im Microsoft https:// twitter.com/jenniferdaniel /status/887033694451412992 …;;
0;1;aquele momento em que vc vai xingar muito no tuiter sobre o word e a microsoft pergunta se tá tudo bem com vc eu amo o @twitter;@twitter;
0;1;Looks a lovely day!;;
0;0;Love and truth not me or you. knowledge and good works get you nowhere. Hoping you have the relationship I enjoy.;;
0;1;Adobe & Microsoft Partner in the Cloud https:// adobe.ly/2sFddla;;
2;6;I agree. Dennis always has cogent concise comments that resonate. @Microsoft has a gem.... @MoBarPresident https:// twitter.com/OlgaVMack/stat us/886976888605954048 …;@Microsoft @MoBarPresident;
0;1;The smartphone is eventually going to die, and Apple, Google, Microsoft , and Facebook are racing to kill it http:// fb.me/3dAuceC62;;
1;0;. @SteveStrauss on Microsoft 365 Business and moving to the cloud. Via @USATODAY : http:// msft.social/aoeC01 by #OfficeSmallBiz;@SteveStrauss @USATODAY;#OfficeSmallBiz
0;0;#Microsoft Hi Hello Windows Phone 8.1: Will you miss us (?). Read more: http:// owler.us/ac2LD5 $ MSFT;;#Microsoft
0;0;แหล่งรวมเลยนะ Nvidia , Microsoft Google ,Apple, Cisco ฯลฯ 555;;
0;0;Video: Introducing Microsoft StaffHub, a new app to help frontline staff workers manage their work day https:// goo.gl/FIslIu pic.twitter.com/a8l4urzdGq;;
0;1;Microsoft #Xbox One S Bundle 500GB White Console #eBay https:// xbox.bestpricedealz.com/redirect/ebay/ 112482161179?source=twitter … pic.twitter.com/UJ5T0VIhrg;;#Xbox #eBay
0;0;Accenture and Microsoft partner on blockchain identity prototype https:// lnkd.in/eApQf-r;;
0;0;#Career #Opportunity for #" Microsoft stack Consultant (17-02375) - NJ" http:// ift.tt/2t9taAf #ApTask . More here: http:// ift.tt/1xAY53N;;#Career #Opportunity # #ApTask
0;0;Google, #Microsoft 's new mission: How to kill disease-carrying mosquitoes. Read more: http:// owler.us/ac2LF6 $ MSFT;;#Microsoft
0;0;always thought it was cute that @harryshumjr the Apple boy shares a name with Microsoft man @harryshum and now they've met! and danced! https:// twitter.com/HarryShumJr/st atus/886978549311090688 …;@harryshumjr @harryshum;
0;0;#Microsoft #Workplace #Analytics helps managers understand worker #Productivity http:// buff.ly/2uu3Yp4 #MSInspire http:// bit.ly/2uwWHan pic.twitter.com/bF6EpoqFCt;;#Microsoft #Workplace #Analytics #Productivity #MSInspire
0;0;@ATVIAssist Having trouble with beta! spoke to Microsoft and they told me to contact activision;@ATVIAssist;
0;1;The latest The Microsoft Azure Daily! http:// paper.li/f-1492299036?e dition_id=f07c56a0-6b47-11e7-b16d-0cc47a0d164b … #azure #cloud;;#azure #cloud
0;0;I'm at Microsoft Colombia - @msftcolombia in Bogota, DC https://www. swarmapp.com/c/hnq1IpvaTXt;@msftcolombia;
0;1;The latest Best Stories On Twitter This Week! http:// paper.li/oldpama1?editi on_id=ee10add0-6b47-11e7-970d-002590a5ba2d … #microsoft #azure;;#microsoft #azure
0;0;Microsoft прекращает поддержку Windows 10 на некоторых компьютерах http://www. oszone.net/31404/Microsof t_cuts_off_Windows_10_support_early_for_some_PCs?utm_referrer=https%3A%2F%2Fzen.yandex.com …;;
0;0;New in the #SFB world - Users Move To Dump #Microsoft #Skype http:// ow.ly/X4xu50cRQ8Q;;#SFB #Microsoft #Skype
0;1;KPMG and Microsoft announce new smart #audit platform, KPMG Clara, moving onto Microsoft Azure http:// bit.ly/2uwS7Ju pic.twitter.com/99VzAPC4NF;;#audit
0;0;ネクストセット、 Microsoft Office 365導入企業向けアドオン機能にSkype for Business チャット連携機能を搭載 プレスリリース： @nifty ビジネス http:// ow.ly/AxWu30dAWtX;@nifty;
1;0;Microsoft adiciona nuevas y mejores funciones a Skype http:// ow.ly/JU9W30dHQW9 pic.twitter.com/IfE7r5DW18;;
0;0;RT @KathleenGlass : What's next on Microsoft 's LinkedIn and Dynamics integration list - http:// klou.tt/1jvfdw9y5ixe0;@KathleenGlass;
0;0;Kate Johnson, GE Digital chief commercial officer, to join Microsoft as president, CVP of… http:// techoverlook.com/kate-johnson-g e-digital-chief-commercial-officer-to-join-microsoft-as-president-cvp-of-microsoft-us/ … pic.twitter.com/04c692Yw3I;;
0;0;Managing Compliance in the Cloud with Microsoft Azure - lack of expertise, staffing headaches, and m... http:// crypt0.net/post/managing- compliance-in-the-cloud-with-microsoft-azure/ …;;
0;0;Alliance envisions the new energy future - Microsoft 's Azure Cloud Platform provides secure and flex... http:// crypt0.net/post/alliance- envisions-the-new-energy-future/ …;;
0;0;Microsoft признала, что погорячилась с модернизацией Skype #news #сегодня #followback;;#news # #followback
2;0;Kate Johnson, GE Digital chief commercial officer, to join Microsoft as president, CVP of Microsoft US http:// bit.ly/2t9qvGN;;
0;0;ネクストセット、 Microsoft Office 365導入企業向けアドオン機能にSkype for Business チャット連携機能を搭載 プレスリリース： @nifty ビジネス http:// ow.ly/AxWu30dAWtX;@nifty;
0;0;Power BI On-premises data gateway – July Update is now available! | Microsoft Power BI Blog | Microsoft Power BI http:// bit.ly/2thEONx;;
0;0;Microsoft Just Released an App that Destroys Barriers for the Blind https://www. inc.com/wanda-thibodea ux/what-does-it-take-for-the-blind-to-see-just-this-i.html … #Tech #TechNews;;#Tech #TechNews
0;0;¿Triunfará la nueva Nintendo Switch? La competencia de la nueva consola de Nintendo, es bastante, Sony y Microsoft https:// nintendoswitch.com.es/triunfara-la-n ueva-nintendo-switch/?utm_source=ReviveOldPost&utm_medium=social&utm_campaign=ReviveOldPost …;;
0;0;NartwoGames now streaming Microsoft Flight Simulator X http:// ift.tt/2s7nRki 1 pic.twitter.com/NZVWjlvTDM;;
2;1;「iOS 11」は「iPhone」の“中年の危機”？--ユーザーインターフェースの混乱 - CNET https:// japan.cnet.com/article/351042 52/ … ”もしあなたがAppleファンで、 Microsoft の長年の失敗の数々を笑ってきたのであれば、大きな屈辱に耐える時が来た”;;
1;0;Microsoft planea implementar una nueva red llamada "Súper Wifi" - El Impulso http:// ift.tt/2vw8yD8;;
0;0;#NintendoSwitch 32GB (with Gray Joy-Con) NEW Sony #XBOX MICROSOFT #Playstation #eBay https:// playstation.bestpricedealz.com/redirect/ebay/ 263077496113?source=twitter … pic.twitter.com/fAK1ps3UFV;;#NintendoSwitch #XBOX #Playstation #eBay
0;0;تحميل وتثبيت برنامج microsoft office 2010 مفعل مدى الحياة وبرابط تورنت http:// dlvr.it/PWJwdW pic.twitter.com/DcpWIHRlaG;;
0;0;I liked a @YouTube video http:// youtu.be/zgqs42Lm0bA?a Twenty One Pilots in a Microsoft Outlook Ad;@YouTube;
0;0;Microsoft phone scammers are back. Please warn as many people as possible, particularly family users http:// my.sociabble.com/3rFefXwZ;;
0;0;#Microsoft is proud to announce support for the newest generation of #Intel Xeon Scalable Processors! http:// my.sociabble.com/mH56x3sL;;#Microsoft #Intel
0;1;Yep - #Microsoft closed at all time high today. We're doomed I tell ya'!;;#Microsoft
0;0;Microsoft 、「LinkedIn」のWindows 10（UWP）アプリをリリース http:// dlvr.it/PWJvzm;;
0;1;That's Seattle summers for you;;
0;1;#GPS is great for finding your way around, except for when you’re indoors. Has #Microsoft come up with a solution? http:// bit.ly/2u3dnWz pic.twitter.com/4MZfi40Slc;;#GPS #Microsoft
0;0;#Microsoft Forms AI Research Group 07/14/2017. Read more: http:// owler.us/ac2LNu $ MSFT;;#Microsoft
10;18;Finding out you can make emojis on Microsoft Word changes everything I've ever thought possible and believed in.;;
0;0;Ontdek hier de grote plannen van #Microsoft voor artificiële intelligentie. http:// my.sociabble.com/DPhe4ViK;;#Microsoft
0;0;Takda apa la fy saja je main tulis tulis belajar buat microsoft word hehe :p;;
0;1;Update: it's been less than an hour and she is no longer responding to us. @Microsoft help.;@Microsoft;
0;1;@BANDA_MS Que nochee jaja @Microsoft Theater https://www. instagram.com/p/BWqoS3AFAbr/;@BANDA_MS @Microsoft;
0;0;Microsoft 、「LinkedIn」のWindows 10（UWP）アプリをリリース http:// ift.tt/2uwsjgs;;
0;0;Physical activity reduces heart disease de https:// goo.gl/vmy1k2 #TuesdayMotivation #google #motivation #microsoft #crowdfunding #travel;;#TuesdayMotivation #google #motivation #microsoft #crowdfunding #travel
0;1;For sure. If you can get access, Microsoft Dreamspark generally has Windows Server versions. You can download Windows 7 VMs for free from MS;;
0;0;Can they do King George County next? Talk about limited service!;;
0;0;Microsoft to correct Skype missteps, Star Wars AR is coming http:// flip.it/qmDs19;;
0;3;Sometimes Microsoft word/PowerPoint/excel is utterly user-UNfriendly and it ends up really pissin me off;;
0;0;Maybe Microsoft should stick to 1 update a year;;
0;0;Impacting Business Outcomes with Microsoft Teams - Getting Started https:// lnkd.in/enspQ66;;
0;0;Microsoft translator is _way_ better than Google at translating from English to Korean (and vice versa).;;
0;0;The latest Initech Daily! http:// paper.li/JuanMRhodes/13 72173991?edition_id=56f50e00-6b47-11e7-b326-0cc47a0d15fd … Thanks to @ndambrosio #microsoft #microsoftteams;@ndambrosio;#microsoft #microsoftteams
0;0;Microsoft Lowers Friction Between Skype Experiences on Windows 10 http:// dld.bz/fVy4a;;
0;0;Participating in Microsoft 's transformation was and still is a source of motivation and growth. https:// lnkd.in/emDCEBk;;
0;0;List of Free eBooks from Microsoft Press http:// bit.ly/2u2PfS9;;
0;0;Εφαρμογή της Microsoft για ανθρώπους με προβλήματα όρασης: Μία νέα εφαρμογή αποκάλυψε η Microsoft , η οποία μπορεί… http:// dlvr.it/PWJvG4 pic.twitter.com/CWHaZvHO82;;
0;0;Bringing Omnichannel to Microsoft Dynamics 365 http:// dlvr.it/PWJv93;;
0;0;تحميل وتثبيت برنامج microsoft office 2010 مفعل مدى الحياة وبرابط تورنت:;;
0;0;Can't wait for November to come around when the new Xbox comes out so I can sell my Microsoft stock;;
0;1;The latest The PartnerSideUp Daily! http:// paper.li/partnersideup/ daily?edition_id=494c0ba0-6b47-11e7-970d-002590a5ba2d … Thanks to @RedmondPartner #azure #microsoft;@RedmondPartner;#azure #microsoft
0;1;Microsoft wants AI to fill your blind spots, not take over your job https://www. technologyreview.com/s/608272/micro soft-thinks-ai-will-fill-your-blind-spots-not-take-over-your-job/ … #Microsoft #ArtificialIntelligence;;#Microsoft #ArtificialIntelligence
0;0;Credit Suisse raised its target for Microsoft $ MSFT . This 10yr DCF shows nice Upside http:// ow.ly/yzX830dHkGj pic.twitter.com/XHdUItjKJi;;
0;0;Regulators approve #Microsoft 's renewable energy deal with Puget Sound Energy. Read more: http:// owler.us/ac2LY7 $ MSFT;;#Microsoft
0;2;That's awesome! I hope Osage will be in apple and microsoft systems soon, too. It's really motivating to see tribes already there though.;;
1;6;Very cool: Shawn Hunt uses 3D printing & Microsoft tech to bring Raven into 21st century #indigenous #aboriginal http:// bit.ly/2uwVJef;;#indigenous #aboriginal
1;4;Microsoft Azureを“大人買い”、「Azure Stack」ってなに？（ @IT ） http:// dlvr.it/PWJtYP pic.twitter.com/nKu4EVuF7X;@IT;
0;0;Microsoft Office 365: Is new knowledge gained imbedded in the response plan? #MicrosoftOffice365 http:// buff.ly/2tVZz03;;#MicrosoftOffice365
0;0;To reign in the cloud: Nadella's #Microsoft reorganization needed to compete with Amazon. Read more: http:// owler.us/ac2LY8 $ MSFT;;#Microsoft
0;0;Your labeling me wrong Alex. I judge your judgement. I am humble no foolish pride or ego... can be what you think is normal. Respect beadick;;
0;0;Microsoft Japanのオフィシャル動画サイト http:// bit.ly/KXhe6t;;
0;0;OMG the feels...! T^T #Microsoft #clip https:// twitter.com/joeheenan/stat us/886872363312218112 …;;#Microsoft #clip
0;0;Our artists KJMC(kj the mc) and Mc Willa Scrilla Music is OFFICIALLY on Microsoft Groove for… https://www. instagram.com/p/BWqn5FJlIaG/;;
0;0;Microsoft cuts off Windows 10 support early for some PCs http:// zd.net/2v6Q8sS via @ZDNet & @edbott;@ZDNet @edbott;
0;0;Microsoft deja de actualizar Windows 10 en PCs antiguos: reporte - CNET en Español http:// ift.tt/2vbOUfZ;;
0;0;Sinto saudade do celular da Microsoft que eu tinha, apesar de ser muito bosta, não ter quase nada, o wpp era personalizado, muito;;
0;0;Publicis and Microsoft Link Up Products for Data Push - WSJ https:// wayback.archive.org/web/2017071717 5217/https://www.wsj.com/articles/publicis-and-microsoft-link-up-products-for-data-push-1490198400?mod=rss_Technology … ➜ https:// wayback.archive.org/web/2017071723 2320/https://www.wsj.com/articles/publicis-and-microsoft-link-up-products-for-data-push-1490198400?mod=rss_Technology … pic.twitter.com/z2EOKjiGK1;;
0;0;#Ad : Microsoft Xbox 360 S (1439) 250 GB, Black, Video Gaming Console / System http:// dlvr.it/PWJtBc pic.twitter.com/BzSGRnLQEs;;#Ad
0;0;Microsoft is a software not product;;
0;0;#Ad : Microsoft (1540) Xbox One - 500GB - Black - Video Gaming Console http:// dlvr.it/PWJtBZ pic.twitter.com/3hnQOHtpGW;;#Ad
0;0;#Ad : Microsoft Xbox 360 S (1439) 250 GB, Black, Video Gaming Console / System http:// dlvr.it/PWJtBb pic.twitter.com/IGsUf8sw1j;;#Ad
0;0;#Ad : Microsoft (1540) Xbox One - 500GB - Black - Video Gaming Console http:// dlvr.it/PWJtBW pic.twitter.com/dkjTpQgG6j;;#Ad
0;0;#Ad : Microsoft Xbox 360 S (1439) 250 GB, Black, Video Gaming Console / System http:// dlvr.it/PWJtBV pic.twitter.com/uVH8n4Syy1;;#Ad
0;0;#Ad : Microsoft (1540) Xbox One - 500GB - Black - Video Gaming Console http:// dlvr.it/PWJtBS pic.twitter.com/ghTbQCrKJl;;#Ad
0;0;#Ad : Microsoft (1540) Xbox One - 500GB - Black - Video Gaming Console http:// dlvr.it/PWJtBR pic.twitter.com/SeWmqBWgiH;;#Ad
0;0;#Ad : Microsoft (1540) Xbox One - 500GB - Black - Video Gaming Console http:// dlvr.it/PWJtBM pic.twitter.com/Jyb0XeaaWb;;#Ad
0;0;Private corporate event for Microsoft . @LVA_Tweet;@LVA_Tweet;
0;1;Cash Receipt and Payment Account Format in Microsoft Excel https:// is.gd/kcCaEO Retweet Please;;
0;1;Microsoft Open Source Roadshow – Free training on Open Source and Azure: http:// ift.tt/2vbCqoO;;
0;0;Call US/Canada toll free 1-888-787-9274 #Xbox #technical support number. #Microsoft certified technicians. #XboxOne http:// sanaahacheminfo.com / pic.twitter.com/TDYJk8nLdA;;#Xbox #technical #Microsoft #XboxOne
3;5;List of Free eBooks from Microsoft Press https:// goo.gl/fb/L1uTwu;;
0;0;Big tech firms urge @FCC to retain #netneutrality @Reuters http://www. reuters.com/article/us-usa -internet-idUSKBN1A20W0 … @Google @facebook @Snap @amazon @Twitter @Microsoft #FCC;@FCC @Reuters @Google @facebook @Snap @amazon @Twitter @Microsoft;#netneutrality #FCC
1;3;Microsoft ’s Path Guide app doesn’t need your GPS to navigate indoors https://www. techsourceint.com/news/microsoft s-path-guide-app-doesnt-need-your-gps-to-navigate-indoors …;;
0;0;Mable design on #microsoft surface pro 4 #clenmentcanopylocation , #clementcanopycondo , #Clementcanopyshowflat pic.twitter.com/sHi5cHly5v;;#microsoft #clenmentcanopylocation #clementcanopycondo #Clementcanopyshowflat
0;0;Big tech firms urge @FCC to retain #netneutrality @Reuters http://www. reuters.com/article/us-usa -internet-idUSKBN1A20W0 … @Google @facebook @Snap @amazon @Twitter @Microsoft #FCC;@FCC @Reuters @Google @facebook @Snap @amazon @Twitter @Microsoft;#netneutrality #FCC
0;0;MICROSOFT SURFACE D9P-00001 13.5", 2256x1504, below $1300, Core i5-7200U, Corning Gorilla Glass, Microsoft , Windows 10, Windows 10 S July … pic.twitter.com/7tFC2khs0T;;
0;0;【学生アナリティクスシステム】 Microsoft Dynamics 365を使用し、学生に関するあらゆる活動情報を継続的に集約・分析。学生情報の管理に係わる業務活動を全面的に支援いたします。 http://www. pageone.ne.jp/products/stude ntanalytics/ …;;
0;1;Awesome!;;
0;0;Hey font fans... did you see that the @Microsoft font, Calibri, made the legal news? http://www. cnn.com/2017/07/13/asi a/maryam-nawaz-sharif-calibri-font-trnd … #fontgate;@Microsoft;#fontgate
0;0;#Microsoft : Energy plan enables Microsoft to buy more green power . Read more: http:// owler.us/ac2L5n $ MSFT;;#Microsoft
0;0;@Microsoft your latest update has ruined my evening. Accidentally clicked accept, and it's taken over two hours. No Game of Thrones for me.;@Microsoft;
0;2;Wow what a beautiful sunny day!;;
0;0;Microsoft показала управление смартфоном жестами с помощью солнцезащитных очков: Пользователю не понадобится никакое дополнительное…;;
0;0;Microsoft Dynamics CRM: What to do with the results or outcomes of measurements? #MicrosoftDynamicsCRM http:// buff.ly/2tXcGxP;;#MicrosoftDynamicsCRM
0;1;Top de rasones por la que messenger de Microsoft fracasó: -La gente (inserte insulto) enviaba demasiados zumbidos desquiciantes.;;
0;1;Here at Microsoft Sydney for Azure Discovery Days pic.twitter.com/uLJkZcmac3;;
2;0;8 surprisingly great things about Microsoft Teams https:// lnkd.in/eY9evja;;
0;1;I don t know..;;
0;0;New on Ebay: Microsoft Xbox 360 games buy 1 get 1 10% off! http:// ift.tt/2vb3Udf pic.twitter.com/wSe10ciOCO;;
0;1;#Microsoft #HoloLens for augmented reality with @IFSworld solutions! #innovation #AR #digital @IFSFrance https:// lnkd.in/dKurHtJ;@IFSworld @IFSFrance;#Microsoft #HoloLens #innovation #AR #digital
0;0;Microsoft Rural Broadband Announcement https:// goo.gl/fb/8UE7ok;;
0;0;#Attunix Microsoft West Regional Partner of the Year. Read Blog: http:// owler.us/ac2MSL;;#Attunix
0;1;I am surprised you haven't bought 365 of those shirts! One for every day of the year;;
0;0;#word2016 , #word , #certification , #microsoft , #office , #wordprocessing , #MicrosoftWord2016 , #TEST4U http:// fb.me/xfJlfMx4;;#word2016 #word #certification #microsoft #office #wordprocessing #MicrosoftWord2016 #TEST4U
1;0;Microsoft Brings LinkedIn to Your Desktop in a New Windows 10 App http:// for.tn/2uBDqFx #LinkedIn pic.twitter.com/YUU6k8wHoV;;#LinkedIn
0;0;" Microsoft 、「LinkedIn」のWindows 10（UWP）アプリをリリース" http://www. itmedia.co.jp/news/articles/ 1707/18/news047.html …;;
0;0;#Microsoft has improved the shell, task manager and other elements in the new test build Wi... Read more: http:// owler.us/ac2L0F $ MSFT;;#Microsoft
0;0;#Attunix Named Microsoft 2017 Partner of the Year. Read Blog: http:// owler.us/ac2MST;;#Attunix
0;4;Exactly. Ill take 3 good AAAs from Microsoft over a dozen cheap Japanese games from Sony.;;
0;1;#NAWRBNEXUS2017 girlfriends. #GameOfThones7 Microsoft JUST blessed our socks off w debut @msftprincess productivity tools! #arbrookrealty pic.twitter.com/0OgD5YQhr1;@msftprincess;#NAWRBNEXUS2017 #GameOfThones7 #arbrookrealty
0;1;Finding your way though a large office building could get a lot simpler. https:// goo.gl/fHMXyR #Maps #Microsoft #tech;;#Maps #Microsoft #tech
1;10;We will discuss it in a week at Microsoft .;;
0;4;harry is a man wanted by both apple AND microsoft when will your faves;;
0;0;Jogo Xbox One State Of Decay - Microsoft por R$60 http:// gafanhotoapp.com.br/oferta/jogo-xb ox-one-state-of-decay-microsoft …;;
0;1;Head to the company store immediately!;;
0;0;Microsoft 's new app guides you through indoor spaces without GPS http:// tnw.me/vWHw6gI pic.twitter.com/Zb5rPyz6AT;;
0;0;iOS 11, Wunderlist sempre a crashar. Lá tive que me render ao to-do da Microsoft . Algum dia lá teria de ser;;
0;0;Retweeted Curiosidades ( @curiosidadesn24 ): Microsoft contrató a un chico de 14 años después de que éste hackeara... http:// fb.me/8TwoiuvCg;@curiosidadesn24;
0;0;Microsoft se despide de Windows Phone El sistema operativo para móviles de Microsoft para competir con Android e... http:// fb.me/6DbaSVcBu;;
12;5;Microsoft Office Professional 2016 https://www. amazon.co.jp/dp/B01MS0KOY9? m=A1YNZ03XEG4RNY&ref_=v_sp_widget_detail_page … #Amazon #ヤフオク #パソコン;;#Amazon # #
0;2;Wow. So many people joining MS recently. Best wishes! :);;
0;0;My heart is just so happy;;
2;11;Me and my 2 oldest sons @Lumia @pickit @Microsoft @Windows @nokia @NokiamobBlog @nothinbutanokia @TheLumians #lumia950XL #hunter #portrait pic.twitter.com/62DylHHEua;@Lumia @pickit @Microsoft @Windows @nokia @NokiamobBlog @nothinbutanokia @TheLumians;#lumia950XL #hunter #portrait
0;0;Microsoft 's new app guides you through indoor spaces without GPS http:// tnw.me/vWHw6gI pic.twitter.com/BM7GZpubiu;;
0;0;Microsoft Rural Broadband Announcement https:// goo.gl/fb/yEkG8G;;
0;0;New on Ebay Microsoft Xbox One 1TB 1540 Matte Black w/ box http:// ift.tt/2vbdu0x pic.twitter.com/zMeHExRAw9;;
0;0;.NET【ドットネット】は、Microsoftが2000年に提唱した、 インターネット中心のコンピューティング環境を指すっす。 また、パッケージソフトを基盤としたビジネスから、Webサービスなどネットワークを基盤としたビジネスに転換する事業戦略を指す言葉でもあるっすよ♪;;
0;0;まあどんなものが作れるのかを示して引っ張っていって欲しいな。 / " Microsoft Is Making First-Party Content For Its Windows 10 VR Headsets" https:// uploadvr.com/microsoft-maki ng-first-party-content-windows-10-vr-headsets/ …;;
0;0;Two new Microsoft tools can help your company know whether it’s ready for EU General Data Protection Regulation https:// blogs.microsoft.com/firehose/2017/ 07/17/two-new-microsoft-tools-can-help-your-company-know-whether-its-ready-for-eu-general-data-protection-regulation/ …;;
0;0;Working Through Obstacles - Microsoft Store https://www. microsoft.com/en-us/store/mu sic/album/mc-willa-scrilla/working-through-obstacles/8d6kgwxdktjn … #MicrosoftStore;;#MicrosoftStore
0;0;#Microsoft wants to bring internet to rural areas of the USA. Read more: http:// owler.us/ac2NLg $ MSFT;;#Microsoft
12;6;Microsoft еерийн бvтээгдэхvvний баахан номоо vнэгvй тарааж бга бололтой: Largest FREE Microsoft eBook Giveaway! https:// blogs.msdn.microsoft.com/mssmallbiz/201 7/07/11/largest-free-microsoft-ebook-giveaway-im-giving-away-millions-of-free-microsoft-ebooks-again-including-windows-10-office-365-office-2016-power-bi-azure-windows-8-1-office-2013-sharepo/ …;;
0;0;vizer ta de boas pelo microsoft edge amanda eh uma genia mesmo;;
0;0;Microsoft Rural Broadband Announcement https:// goo.gl/fb/rJSUFs;;
0;0;[B!] 世界最大級のYARNクラスタを構築する Microsoft 、自動運転技術に乗り出すNVIDIA─データビジネスのメインプレーヤが挑む次のゴール | IT Leaders http:// it.impressbm.co.jp/articles/-/146 50 …;;
0;1;“世界最大級のYARNクラスタを構築する Microsoft 、自動運転技術に乗り出すNVIDIA─データビジネスのメインプレーヤが挑む次のゴール | IT Leaders” http:// htn.to/HhMMEA;;
0;2;wait binch we got microsoft word, its really lit outchea;;
0;0;Microsoft exprime el espectro de TV para ofrecer un internet rápido y barato http:// ift.tt/2tkqAv8;;
0;0;Microsoft 、モバイル版「Skype」のステータス表示他をユーザーの批判を受けて復活 - ITmedia http://www. itmedia.co.jp/news/articles/ 1707/17/news023.html …;;
