retweets;favorites;text;mentions;hashtags
0;0;【12ヶ月保証】DELL LATITUDE E6510 [+ Microsoft Office 2003 Personal][+3584MB増設済]特選 中古パソコンノート A4 Windows 7 P http:// hb.afl.rakuten.co.jp/hgc/g00reed5.2 ncy34dd.g00reed5.2ncy4821/?pc=http%3A%2F%2Fitem.rakuten.co.jp%2Fpasokore%2F4at214094-370%2F&m=http%3A%2F%2Fm.rakuten.co.jp%2Fpasokore%2Fi%2F10400862%2F …;;
0;0;La stratégie de Microsoft concernant des développements de produits et services sur d'autres plateformes lui e... http:// bit.ly/1B3LWqr;;
0;0;@Microsoft get your heads out ur asses and go and stop lizard squad from shutting down xbox live forever on Xmas day for Christ sake;@Microsoft;
0;0;@KiddFuture @BrittanyAgneta Microsoft paint actually. I'm like bob Ross with the brush;@KiddFuture @BrittanyAgneta;
0;0;Newly added: Microsoft Lumia Poland shows us how to make cool steadycams using household objects http:// techcrawler.us/microsoft/wm-p ower-user/microsoft-lumia-poland-shows-us-how-to-make-cool-steadycams-using-household-objects?utm_campaign=twitter&utm_medium=twitter&utm_source=twitter …;;
0;1;Gostei de um vídeo @YouTube http:// youtu.be/uEP1nffkyMc?aH oje … no TecMundo (09/12) - preço do Note Edge, G Watch R2, Microsoft contra;@YouTube;
0;0;Newly added: Deal: Microsoft Store Will Offer $50 Off Xbox One Plus A Free Game Tomorrow http:// techcrawler.us/microsoft/wm-p ower-user/deal-microsoft-store-will-offer-50-off-xbox-one-plus-a-free-game-tomorrow-2?utm_campaign=twitter&utm_medium=twitter&utm_source=twitter …;;
0;2;my mom made the password to my Microsoft account ilovemymom#1 #why;;#1 #why
1;3;Microsoft is the publisher of Rise of the Tomb Raider. so that happened.;;
0;0;[ITmedia] Microsoft 、7件のセキュリティ情報を公開　「緊急」は3件 http:// dlvr.it/7mq1dP;;
0;0;Microsoft 、2014年12月の月例パッチをリリース ｰ 今月は計7件 - 気になる、記になる… http:// taisy0.com/2014/12/10/422 33.html …;;
0;0;Microsoft 、7件のセキュリティ情報を公開　「緊急」は3件 http:// dlvr.it/7mq2PY;;
0;0;At @Microsoft 's ThingMakers presentation with @Kickstarter . The mantra for the next few months: pic.twitter.com/zj33sqgLuN;@Microsoft @Kickstarter;
0;0;Dear Microsoft word, I'm pretty sure I spelled my name correctly...;;
0;0;source: Me, Microsoft Paint,;;
0;0;Microsoft Files Appeal in Ireland Email Case: As expected, Microsoft is fighting a New York judge's order to turn… http:// j.mp/1D5KCYV;;
0;0;Microsoft 、7件のセキュリティ情報を公開　「緊急」は3件 http:// dlvr.it/7mq3LD;;
0;0;Microsoft is currently fighting a legal battle with the U.S. government, who wants to search the company's... http:// fb.me/1oHsGwxrx;;
0;0;Top story: Microsoft announces US general availability of Microsoft Azure Gover… http:// news.microsoft.com/2014/12/09/mic rosoft-announces-general-availability-of-microsoft-azure-government … , see more http:// tweetedtimes.com/AWSOMEDEVSIGNE R?s=tnp …;;
0;1;"Oh it'll be professional. I have Microsoft Publisher." -LW #burnbulletin;;#burnbulletin
0;0;Microsoft tells US: The world’s servers are not yours for the taking http:// bit.ly/1zpEQ0l #reddit;;#reddit
0;0;Microsoft tells US: The world’s servers are not yours for the taking http:// bit.ly/1vLZir9 #Reddit #Tech;;#Reddit #Tech
0;1;JCole rapped in front of a Microsoft screen saver for 5 mins in the Apparently video and I thought it was dope as hell. Salute.;;
0;0;Devoir réinitialiser son téléphone juste parce que l'application #XboxMusic refuse de se synchroniser au cloud... Merci #Microsoft !;;#XboxMusic #Microsoft
0;0;Is Microsoft really planning to offer subscriptions for Windows 10? http:// fb.me/1LpXIl1R5;;
0;0;#jobs4u #jobs Microsoft Dynamics AX / Axapta Business Analyst -Salt Lake City, [Salt Lake City, #UT ] http:// bit.ly/1IwuM9Q #business;;#jobs4u #jobs #UT #business
0;0;【 Microsoft 】 2014 年 12 月のセキュリティ情報 (月例) - MS14-075、MS14-080 ～ MS14-085 http:// dlvr.it/7mq1GL #Microsoft;;#Microsoft
0;0;La stratégie de Microsoft concernant des développements de produits et services sur d'autres plateformes ... http:// bit.ly/1B3LYi5 #iOS;;#iOS
0;0;Va... Esta para @tic616 #SoyTanIngeniero que le he pedido a Microsoft que las barras de progreso vengan milimetradas en Windows 10;@tic616;#SoyTanIngeniero
0;0;December 2014 Updates For Microsoft Office 2013 And 2010 Brings New Document Inspector… http:// dlvr.it/7mq7dh pic.twitter.com/ZmQ42rP4bm;;
0;0;#office La stratégie de Microsoft concernant des développements de produits et services sur d'autres plateformes… http:// dlvr.it/7mq2GX;;#office
0;0;「 Microsoft Band」は予想以上、最高水準のウエアラブル！真の狙いは健康管理データ解析 http:// dlvr.it/7mq1gw;;
0;1;Check out "EXPRESSWAY 10th December 2014" on Eventbrite! Wed, 10 Dec @MSAU Microsoft Innovation Centre #Brisbane https://www. eventbrite.com.au/e/expressway-1 0th-december-2014-tickets-14467176715?aff=eandprexshre&ref=eandprexshre …;@MSAU;#Brisbane
0;0;Microsoft announces new Visual Basic 14 features http:// ow.ly/FDtjO;;
0;0;12 days of deals at Microsoft -Different deal every day. Save big for your holiday shopping Up to 8% Cash Back! http:// dlvr.it/7mq2TW;;
0;0;Barnes&Noble compra a parte da Microsoft na fabricação do e-reader Nook. E mais http:// ht.ly/FzaHX;;
0;0;Estudiante boricua gana competencia internacional de Microsoft http:// bit.ly/1D5Kf0k #LoQuePasaPR;;#LoQuePasaPR
0;1;Microsoft Office for Mac 2011 14.4.7 update: still upgradeable direct from 14.1.0. https://www. microsoft.com/en-us/download /details.aspx?id=45122 … #macadmin;;#macadmin
0;0;Microsoft Will Publish Rise of the Tomb Raider http://www. giantbomb.com/articles/micro soft-will-publish-rise-of-the-tomb-raider/1100-5115/ …;;
1;1;Estudiante boricua gana competencia internacional de Microsoft http:// bit.ly/1B3Px7V -vía PH.;;
0;0;Internet of Things Supply Chains By @Microsoft - http:// klou.tt/f20xon3to1e9;@Microsoft;
0;0;Rise of the Tomb Raider será publicado por Microsoft y no por Square Enix. http:// bit.ly/1Gft3BR | pic.twitter.com/9FSKHECQn1;;
1;0;Developpez : La stratégie de Microsoft concernant des développements de produits et services sur d'autres... #iOS http:// tr4.kr/i112695;;#iOS
0;0;using microsoft excel for personal uses makes you feel like such a #numberguy #analyst #futuregm;;#numberguy #analyst #futuregm
0;0;#Microsoft is now publishing the new #TombRaider . Yeah..."Timed Exclusive" my ass!;;#Microsoft #TombRaider
0;0;Sparkline pro microsoft procuration 2010: znUvPLo;;
0;0;Damn. I just spit out half of my cocktail in laughter remembering that Microsoft bought Yammer.;;
0;0;Ah shit I'm about to get hired by Microsoft , aren't I;;
0;0;What's the appeal of Microsoft 's machine learning programs? - http://www. traincanada.com/blogs/whats-ap peal-microsofts-machine-learning-programs/ … pic.twitter.com/f1KWYDUMo0;;
0;0;Microsoft 、7件のセキュリティ情報を公開　「緊急」は3件 http:// coraly.tv/jp_news/ キーワードは #3件 #7件 #Microsoft ↓詳しくは↓ http:// goo.gl/fNJjEf;;#3 #7 #Microsoft
0;0;#Microsoft goes public with more on its future plans for NET http:// wp.me/p5qmDR-gk;;#Microsoft
0;0;Microsoft Office Excel 2013 [オンラインコード] [ダウンロード][Windows版] (PC2台/1ライセンス) マイクロソフト プラットフォーム:… http:// dlvr.it/7mq7gF ... #PCソフト #ダウンロード;;#PC #
0;0;Call of Duty: Advanced Warfare Digital ( Microsoft Xbox One, 2014) via eBay http:// ift.tt/1uhG9YL;;
0;0;New/Sealed Destiny ( Microsoft Xbox One, 2014) via eBay http:// ift.tt/1vA36qr;;
0;0;Microsoft Office Personal 2013 [オンラインコード] [ダウンロード][Windows版] (PC2台/1ライセンス) マイクロソフト プラットフォーム:… http:// dlvr.it/7mq7M2 ... #PCソフト #ダウンロード;;#PC #
0;0;Microsoft Office Home and Business 2013 [オンラインコード] [ダウンロード][Windows版] (PC2台/1ライセンス) マイクロソフト… http:// dlvr.it/7mq3HJ ... #PCソフト #ダウンロード;;#PC #
0;0;Microsoft Office for Mac Home and Student 2011 ファミリーパック [ダウンロード] (PC3台/1ライセンス) マイクロソフト プラットフォーム:… http:// dlvr.it/7mq7jt ... #PCソフト #ダウンロード;;#PC #
0;0;Microsoft Office 365 Solo(1年版) [オンラインコード] [ダウンロード] マイクロソフト プラットフォーム:    Windows, Macintosh (97)… http:// dlvr.it/7mq7Lz ... #PCソフト #ダウンロード;;#PC #
0;0;Microsoft opens Azure cloud just for US government surveillance http:// ift.tt/1zqBTN2;;
0;1;@msftcitizenship Thanks for the follow! BIG Microsoft fan :);@msftcitizenship;
0;0;Microsoft Office for Mac Home and Student 2011 ファミリーパック [パッケージ] (PC3台/1ライセンス) マイクロソフト プラットフォーム:… http:// dlvr.it/7mq2HF ... #ビジネスソフト #オフィス;;# #
0;0;Microsoft Office Personal 2013 [オンラインコード] [ダウンロード][Windows版] (PC2台/1ライセンス) マイクロソフト プラットフォーム:… http:// dlvr.it/7mq4LV ... #ビジネスソフト #オフィス;;# #
0;0;Microsoft Office Excel 2013 [オンラインコード] [ダウンロード][Windows版] (PC2台/1ライセンス) マイクロソフト プラットフォーム:… http:// dlvr.it/7mq486 ... #ビジネスソフト #オフィス;;# #
0;0;Microsoft Office Professional 2013 アカデミック [プロダクトキーのみ] [パッケージ] [Windows版](PC2台/1ライセンス) マイクロソフト… http:// dlvr.it/7mq6rv ... #ビジネスソフト #オフィス;;# #
0;0;Microsoft To US Gov't: the World's Servers Are Not Yours For the Taking http:// slashdot.feedsportal.com/c/35028/f/6474 10/s/41479564/sc/1/l/0Lnews0Bslashdot0Borg0Cstory0C140C120C0A90C2262580Cmicrosoft0Eto0Eus0Egovt0Ethe0Eworlds0Eservers0Eare0Enot0Eyours0Efor0Ethe0Etaking0Dutm0Isource0Frss10B0Amainlinkanon0Gutm0Imedium0Ffeed/story01.htm …;;
0;0;Microsoft Office 365 Solo(1年版) [オンラインコード] [ダウンロード] マイクロソフト プラットフォーム:    Windows, Macintosh (97)… http:// dlvr.it/7mq1j4 ... #ビジネスソフト #オフィス;;# #
0;0;Microsoft Office Access 2013 アカデミック [プロダクトキーのみ] [パッケージ] [Windows版](PC2台/1ライセンス) マイクロソフト プラットフォーム:… http:// dlvr.it/7mq1qg ... #会計ソフト #業務ソフト;;# #
0;0;Microsoft Office Access 2013 通常版 [プロダクトキーのみ] [パッケージ] [Windows版](PC2台/1ライセンス) マイクロソフト プラットフォーム:… http:// dlvr.it/7mq6TY ... #会計ソフト #業務ソフト;;# #
0;0;Microsoft Office Home and Business 2013 [プロダクトキーのみ] [パッケージ] [Windows版](PC2台/1ライセンス) マイクロソフト… http:// dlvr.it/7mq7yR ... #ビジネスソフト #オフィス;;# #
0;0;Microsoft Office Home and Business 2013 [オンラインコード] [ダウンロード][Windows版] (PC2台/1ライセンス) マイクロソフト… http:// dlvr.it/7mq7wM ... #ビジネスソフト #オフィス;;# #
0;0;Al parecer Microsoft va a cerrar #Clipart :'( http:// bit.ly/1BrGIrJ pic.twitter.com/1VaF6aTIv4;;#Clipart
0;0;Microsoft Office Personal 2013 [プロダクトキーのみ] [パッケージ] [Windows版](PC2台/1ライセンス) マイクロソフト プラットフォーム:… http:// dlvr.it/7mpxKM ... #ビジネスソフト #オフィス;;# #
0;0;Microsoft Office for Mac Home and Student 2011 ファミリーパック [ダウンロード] (PC3台/1ライセンス) マイクロソフト プラットフォーム:… http:// dlvr.it/7mptVm ... #ビジネスソフト #オフィス;;# #
0;0;Next Lock Screen, la aplicación de Microsoft para Android se actualiza - http:// bit.ly/162A8uA;;
0;0;Microsoft CEO Nadella visits D.C. to promote cloud products for federal use (WaPo) http:// ift.tt/12pvmp8;;
0;1;Microsoft releases a... http://www. simmyideas.com/microsoft-rele ases-preview-windows-10/ … #Microsoft #TechTips #Windows10 #WindowsTips;;#Microsoft #TechTips #Windows10 #WindowsTips
0;0;Pardon the offensivness but got dam when I call Microsoft support and gotta talk to Apu that shit does not make me happy;;
0;0;@Microsoft New St Gardens is a non-profit community garden in Waterford. Follow our journey which has been a fantastic success so far!;@Microsoft;
0;0;Microsoft Excel Top Tip Number 29 #Training #IT #Excel http:// goo.gl/SCtfj1 pic.twitter.com/e3TBZpeKeM;;#Training #IT #Excel
0;0;Microsoft says U.Ss can't take data stored in Ireland http:// bit.ly/1ujfyLL;;
0;0;Deals : http:// ift.tt/1vLSBaa New 20GB 20G 20 GB HDD Hard Drive Disk for Microsoft Xbox 360 Console Slim $22.... pic.twitter.com/qXuLEy8lqb;;
0;0;Heroix Introduces Performance Monitoring for Microsoft Hyper-V http:// ift.tt/1uhE8vI;;
0;0;The Microsoft Engine That Nailed The World Cup Is Predicting Every NFL Game ... - Business Insider http:// dlvr.it/7mpsXH;;
0;0;Call of Duty: Advanced Warfare ( Microsoft Xbox One, 2014) NEW SEALED via eBay http:// ift.tt/1z41CK6;;
0;0;Check out Microsoft Cortana's picks for Week 15 of the NFL season! #Microsoft #NFL http://www. businessinsider.com/microsoft-cort ana-nfl-picks-week-15-2014-12 …;;#Microsoft #NFL
0;0;Haha what a joke Microsoft can smd with all the money they got you think they would hire some 1 who speaks english..;;
0;0;Microsoft Will Publish Rise of the Tomb Raider http:// ift.tt/1z427Up;;
0;0;Microsoft opens Azure cloud just for US government surveillance http:// bit.ly/1zqGC0Y;;
0;0;Microsoft 、7件のセキュリティ情報を公開　「緊急」は3件 http:// dlvr.it/7mpxYj 【ITmedia】 #followme;;#followme
0;0;RT @shane_a_lynn : So, the @fitbit "Charge HR" looks class. - Deciding between Microsoft band..which ever stocks 1st gets my $$;@shane_a_lynn @fitbit;
0;0;I guess being a #lifelong #fan of the #tombraider #videogames doesn't matter since #RiseOfTheTombRaider is #exclusive 2 #Microsoft #XboxOne;;#lifelong #fan #tombraider #videogames #RiseOfTheTombRaider #exclusive #Microsoft #XboxOne
0;0;@Mattghost3 Merry Christmas Happy Holidays From Xbox One Microsoft;@Mattghost3;
0;0;Photo: Full Protective Xbox One Skin with 2PCS Protective Vinyl Skin Decals Cover for Microsoft Xbox One... http:// tmblr.co/ZPODdr1XcL8gS;;
0;0;Microsoft updates Bing with quick answers for local phone numbers, hours of operation, directions http:// venturebeat.com/2014/12/08/mic rosoft-updates-bing-with-quick-answers-for-local-phone-numbers-hours-of-operation-and-directions/?n_play=548788d1e4b005530a252a61 … via @VentureBeat;@VentureBeat;
0;0;This site is giving away Free Microsoft Points #XBOX LIVE http:// xbox.free-downloadfiles.com /;;#XBOX
0;0;Xbox Live ameaçada de ser fechada para sempre no Natal....pelo jeito a Microsoft foi uma menina má esse ano huehueheueheu;;
0;0;How Microsoft Will Respond to the PlayStation Experience: Brand new gameplay footage from Uncharted 4 and the ... http:// bit.ly/1vLYsuJ;;
0;1;You know society places too much emphasis on size when even Microsoft Word is trying to slim from a Times New Roman 12 to a Calibri 11;;
0;0;Feds bid to seize emails stored in Ireland threatens US citizens privacy, Microsoft says;;
0;0;Reddit Microsoft ( @MicrosoftReddit ) favorited one of your Tweets! > Thank you!;@MicrosoftReddit;
0;0;Does anyone know how to use Microsoft Access?;;
0;0;[ITmedia エンタープライズ] Microsoft 、7件のセキュリティ情報を公開　「緊急」は3件 http:// ift.tt/1z40TZl;;
0;0;Microsoft To US Gov't: the World's Servers Are Not Yours For the Taking http:// goo.gl/fb/pcC18V #tki;;#tki
0;0;La neta, si hacen el nuevo de Tomb Raider exclusivo de Microsoft , mato a alguien;;
0;0;MICROSOFT CSD-00016 KMS MS WIRELESS COMFORT DESKTOP 5000 SİYAH 135.15 TL+KDV -Tuccar.com.tr http:// fb.me/3sFv09Eoe;;
0;0;New on Ebay Microsoft Xbox One - PERFECT CONDITION http:// ift.tt/1vAEtKo pic.twitter.com/SxFtDoEDGj;;
0;0;New on Ebay Microsoft Xbox One (Latest Model)- Call of Duty: Advanced Warfare LimitedFREESHP http:// ift.tt/1yxnPlU pic.twitter.com/Uy6wjb9j3m;;
0;0;Minere suas Bitcoins na nuvem: http:// trizteza.com/11-todas-categ orias/8-minere-dogecoins-e-outras-crypto-moedas-na-nuvem … #sony #microsoft;;#sony #microsoft
0;0;New on Ebay Microsoft Xbox One (Latest Model)- 500 GB Black Console (Without Kinect) http:// ift.tt/1zLKIzb pic.twitter.com/YfuNxhyW8H;;
0;0;New on Ebay Microsoft Xbox One - Day One Edition 500 GB Black Console NO KINECT http:// ift.tt/1yxnMXj pic.twitter.com/ShIg9BWOZz;;
0;0;Microsoft to host Office 365, Dynamics CRM in Australia | ZDNet http:// zd.net/1A7q2l6 via @ZDNet & https:// twitter.com/achanthadavong;@ZDNet;
0;0;Microsoft Azure Government Comes Out Of Preview http:// kwai.ch/1GfWF1X;;
0;0;Ramon’s Day At Microsoft Headquarters. 8 Things To... via @ramonray http:// zoot.li/3at3o #mobile #mobilesecurity pic.twitter.com/ugHkdBGa3J;@ramonray;#mobile #mobilesecurity
0;0;Für Private super. für Managed Systems wo nur kontrollierte Software zum Winsatz kommt schlecht: http:// bit.ly/1zLKxnu #Microsoft #Update;;#Microsoft #Update
0;0;Microsoft s Tomb Raider Publishing Deal Similar To Dead Rising 3: *Sorry, Sony fanboys you… http:// dlvr.it/7mpv71 #xbox #x360 #xboxone;;#xbox #x360 #xboxone
0;0;“ @IGN : Microsoft is publishing Rise of the @TombRaider . http:// go.ign.com/C9Rd89L pic.twitter.com/9zN8Zx6W3S ” WTF! so it will never come to ps4;@IGN @TombRaider;
0;0;Microsoft says private data 'at risk' in court case http:// a.msn.com/01/en-us/BBgvP 23 …;;
0;0;محاضرة ألقاها بيل جيتس من أغنى رجال العالم ومؤسس شركة Microsoft " تحت عنوان: 10 قواعد لا تدرسها في المدرسة ::... http:// fb.me/3q1opOGHX;;
0;0;Snappy、 Microsoft Azureで使えるの? / Announcing Snappy Ubuntu Core http://www. ubuntu.com/cloud/tools/sn appy …;;
0;0;Microsoft Gets Left Out and Does What it Knows Best http:// chzb.gr/1Is2rl4;;
0;0;#FreeKindleBook [Computers & Technology][Free] How To Use Microsoft Excel 2013: Get Started With Microsoft ... - http://www. free-kindle-books-4u.com/computers-tech nologyfree-how-to-use-microsoft-excel-2013-get-started-with-microsoft-excel-2013-today-the-microsoft-office-series/ …;;#FreeKindleBook
0;0;http:// XML.net なんて 知らない間にみんな使っていますね。 Microsoft 製品の脆弱性対策 について(2014年2月)】 セキュリティ対策情報 [緊急対策]の 警報がでています。;;
0;0;Microsoft 's Bing introduces 'Fact Answers' for steamlined access to phone numbers, directions and more http:// tnw.me/XTwIFxP;;
0;0;Microsoft planea vender Windows 10 bajo suscripción - http:// ComputerHoy.com http:// fb.me/79M8Wpcux;;
0;0;TechnoBuffalo - Microsoft is Publishing Rise of the Tomb Raider http:// bit.ly/1vLY53a;;
0;0;>> I am having to go back to Excel 2003 to do something that was a simple task - now made impossible by you. Hardly progress, @Microsoft ?;@Microsoft;
0;0;Rise of the Tomb Raider será distribuído pela Microsoft e pode chegar ao PC http:// canalte.ch/SOY2-SFC;;
0;0;@wadewoodislove so if anyone could find them it'd be Microsoft - since Microsoft was who they breached and DDoS'd. Very unlikely it'll happen;@wadewoodislove;
0;1;Woo! #Microsoft #Band #10K I think the GPS was a bit off, because I ran a bit further via the mile markings @BSP. pic.twitter.com/yG9KikSlNb;@BSP;#Microsoft #Band #10K
0;0;Microsoft Is Launching Showtime Anytime On Xbox One http:// goo.gl/OU3Sfu;;
0;0;#FreeKindleBook [Computers & Technology][Free] How To Use Microsoft Excel 2010: Get Started With Microsoft ... - http://www. free-kindle-books-4u.com/computers-tech nologyfree-how-to-use-microsoft-excel-2010-get-started-with-microsoft-excel-2010-today-the-microsoft-office-series/ …;;#FreeKindleBook
0;0;Deal: Microsoft Store Will Offer $50 Off Xbox One Plus A Free Game Tomorrow: As part of their ’12 Days of Deal... http:// bit.ly/12ptWL4;;
0;0;Microsoft Lumia Poland shows us how to make cool steadycams using household objects: Often video and photos sh... http:// bit.ly/12ptTiC;;
0;0;Deal: Microsoft Store Will Offer $50 Off Xbox One Plus A Free Game Tomorrow http:// goo.gl/yKeIzi;;
0;0;Microsoft To US Gov't: the World's Servers Are Not Yours For the Taking;;
0;0;Microsoft : Giving data stored in Ireland to US a privacy risk http:// ift.tt/1wuCyxL;;
0;0;Microsoft tells Windows 10 users to uninstall Office: Microsoft today took the unusual step of telling users r... http:// bit.ly/1GgCP6N;;
0;0;@iamelliot @alexcwilliams but but wat about windows10? surely that will save microsoft , lumia, surface, mankind and outlook;@iamelliot @alexcwilliams;
0;0;#FreeKindleBook [Computers & Technology][Free] How To Use Microsoft Word 2010: Get Started With Microsoft Word ... - http://www. free-kindle-books-4u.com/computers-tech nologyfree-how-to-use-microsoft-word-2010-get-started-with-microsoft-word-2010-today-the-microsoft-office-series/ …;;#FreeKindleBook
0;0;Microsoft 、7件のセキュリティ情報を公開　「緊急」は3件（ITmedia エンタープライズ） http:// dlvr.it/7mpvgK #ニュースJP;;#
0;0;【ITメディアニュース】 [ITmedia エンタープライズ] Microsoft 、7件のセキュリティ情報を公開　「緊急」は3件 http:// dlvr.it/7mq085;;
0;0;via @regvulture Microsoft opens Azure cloud just for US government surveillance http:// dlvr.it/7mpzwd #latest #technews;@regvulture;#latest #technews
0;1;Review of Microsoft Office 365 Video - http:// panop.to/1yzaTa4 #Office365 #Office365Video;;#Office365 #Office365Video
0;0;Microsoft opens Azure cloud just for US government surveillance http:// dlvr.it/7mpt4Z;;
1;0;Video summary of #Microsoft and #Adobe #PatchTuesday December 2014 https:// community.qualys.com/blogs/laws-of- vulnerabilities/2014/12/09/microsoft-adobe-poodle-on-patch-tuesday-december-2014 …;;#Microsoft #Adobe #PatchTuesday
0;0;Got all my poems. Went to type them and it says Microsoft had expired. #excuseme;;#excuseme
0;0;Microsoft 、7件のセキュリティ情報を公開　「緊急」は3件（ITmedia エンタープライズ） http:// ift.tt/1saMuv3;;
0;0;Some news from WMPowerUser - Deal: Microsoft Store Will Offer $50 Off Xbox One Plus A Free Game Tomorrow http:// bit.ly/1z41t9p;;
0;0;Tremendo! Estudiante boricua gana competencia de Microsoft http://www. elnuevodia.com/estudiantebori cuaganacompetenciademicrosoft-1907493.html#.VIeHgoO_e1k.twitter … #HourofCode;;# #HourofCode
0;0;@Gamer_RTweets hay man you are a winner of The xbox $10.00 Microsoft Card to bye movies in more how do you wont me to give it to you ?;@Gamer_RTweets;
0;0;[ITmedia エンタープライズ] Microsoft 、7件のセキュリティ情報を公開　「緊急」は3件 http:// dlvr.it/7mps8c;;
0;0;In a battle over Irish emails, Microsoft warns the U.S. "what if" the shoe were on other foot? http:// bizj.us/182v4z;;
0;0;Tubby looks absolutely chuffed with himself that he's figured out how to actually&competently use this Microsoft Surface Pro... #ausvind;;#ausvind
0;0;How big is it when Microsoft Starts supporting the Challenge! You better think twice about this little shake thing! pic.twitter.com/fFRAsQZbup;;
0;0;The Microsoft Engine That Naild The World Cup Is Predictin Every #NFL Game � Here R Its Picks For Week 15 http:// j.mp/1z41oCG #Cortana;;#NFL #Cortana
0;0;[ITmedia エンタープライズ] Microsoft 、7件のセキュリティ情報を公開　「緊急」は3件 http:// dlvr.it/7mpw0Y;;
0;0;Microsoft Partners To Offer Hybrid Cloud Bundle - InformationWeek http://www. informationweek.com/cloud/infrastr ucture-as-a-service/microsoft-partners-to-offer-hybrid-cloud-bundle/d/d-id/1317973 … via @InformationWeek;@InformationWeek;
0;0;Microsoft opens Azure cloud just for US government surveillance http:// ift.tt/1zqBTN2;;
0;0;Microsoft Files Appeal in Ireland Email Case http:// ift.tt/1BxiuMu;;
0;0;Microsoft tells US: The world’s servers are not yours for the taking http:// bit.ly/1GgCzEW;;
0;0;@googleindia Microsoft #72HoursOfCrazy;@googleindia;#72HoursOfCrazy
0;0;Microsoft to Publish Rise of the Tomb Raider? Here's hoping a PC version coincides with it for those without an XBone.;;
0;0;Microsoft será a publisher de Rise of The Tomb Raider: E assim, a exclusividade mesmo que provisória do espera... http:// bit.ly/1GgCAsv;;
0;0;This site is giving away Free Microsoft Points #XBOX LIVE http:// freexboxlivegold.cleanfile.org /;;#XBOX
0;0;Heroix Introduces Performance Monitoring for Microsoft Hyper-V: Heroix , developer of application performance ... http:// bit.ly/1vLXJti;;
1;1;[Newegg] Microsoft Xbox 360 Wired Controller ($14.99 w/ free shipping) Shellshocker deal http:// goo.gl/fb/w4eeYP;;
0;0;" Microsoft confirms Rise of the Tomb Raider publishing plans" http://www. joystiq.com/2014/12/09/mic rosoft-confirms-rise-of-the-tomb-raider-publishing-plans/?ncid=rss_truncated …;;
0;0;Microsoft のScalptErgonomicKeyboard、テンキーだけ反応が悪くてイライラしてたら、ボタン電池抜き差しで驚くほど改善した。困ってる方はやってみて。;;
0;0;さーて。今日は Microsoft の月例パッチの公開日ですね;;
1;1;The new Azure web interface looks gorgeous. Terrific job @Azure @Microsoft #GartnerAADI;@Azure @Microsoft;#GartnerAADI
0;0;Microsoft Flight Simulator X coming to Steam next week thanks to Dovetail http:// dlvr.it/7mpsPB;;
0;0;Dear @Microsoft why disable Edit Shape function for straight lines in Excel 2010 and 2013? >>;@Microsoft;
0;0;ITmedia エンタープライズ： Microsoft 、7件のセキュリティ情報を公開　「緊急」は3件 http:// dlvr.it/7mpykN;;
