retweets;favorites;text;mentions;hashtags
1;1;#WARNING @Microsoft @Windows #Scam Is Calling From #Below Said License Expired,Call Back! Machine Picked Up Mine,Others Called Up To 4Xs! https:// twitter.com/Cat_Care_Cente r/status/847225314514227200 …;@Microsoft @Windows;#WARNING #Scam #Below
0;0;gracias!! Debe ser por eso, tengo #Microsoft;;#Microsoft
0;0;Margin Debt Hits Record $530 Billion Or, 1 Whole Microsoft http:// heisenbergreport.com/2017/03/29/mar gin-debt-hits-record-530-billion-or-1-whole-microsoft … pic.twitter.com/t0RZsNbdkd;;
0;0;Microsoft would of proudly announced that halo wars 2 has sold over 1 million units like nioh developers did .;;
0;0;Halo 5: Guardians -- Limited Edition ( Microsoft Xbox One, 2015) Brand New Sealed #LimitedEdition pic.twitter.com/mfLktut4s3;;#LimitedEdition
0;3;"Oh loco, mesma sensação de quando o Xbox Mil Grau ganhou presente dá Microsoft " #xboxmilgrau … https://www. instagram.com/p/BSPYlO8AkyB/;;#xboxmilgrau
0;0;Beware phone calls, emails and online pop ups from fraudsters pretending to represent Microsoft , Apple or other Tech Support companies #scam pic.twitter.com/lf975TGqUm;;#scam
0;0;Microsoft podría comprar @Citrix | Computerworld Venezuela http:// ow.ly/UFdW30amGnk pic.twitter.com/oOQpN65l7s;@Citrix;
2;0;Microsoft podría comprar @Citrix | Computerworld Venezuela http:// ow.ly/UFdW30amGnk pic.twitter.com/lJX9OwftWg;@Citrix;
0;0;Microsoft podría comprar @Citrix | Computerworld Venezuela http:// ow.ly/UFdW30amGnk pic.twitter.com/RTXfJXpJl0;@Citrix;
0;0;Doxed by Microsoft ’s http:// Docs.com : Users unwittingly shared sensitive docs publicly http:// buff.ly/2nsS9fP pic.twitter.com/Wsf5u1eKZy;;
0;0;Doxed by Microsoft ’s http:// Docs.com : Users unwittingly shared sensitive docs publicly http:// buff.ly/2nsZ7RR pic.twitter.com/hXOUv1yucF;;
0;0;Oh God, I can't bear to go to Microsoft !;;
0;0;Club Microsoft isims vous informe qu'on va reporter les certifications de C#deux semaines à cause de vacances... http:// fb.me/1VgqNqhV0;;#deux
0;0;AIS จับมือ Microsoft เปิดโปรฯ พิเศษแถม Office 365 ผลักดันธุรกิจ SME เต็มรูปแบบ pic.twitter.com/ms57yim9oy;;
1;1;Microsoft Partner Network Japan のオフィシャル動画サイト http:// bit.ly/1NMefCn;;
3;2;Microsoft 's 3D capture app for mobile devices is not coming anytime soon - MSPoweruser https:// mspoweruser.com/microsofts-3d- capture-app-for-mobile-devices-is-not-coming-anytime-soon/ … この雰囲気、このままフェードアウトする気かな？;;
0;0;GREAT NEWS! Microsoft is adding a browser function @Opera has had for a decade.... http:// fb.me/2GLS6aULp;@Opera;
0;0;#WindowsGames Windows 10 update will bring 3-D, game tools and doodling - CBC.ca http:// dlvr.it/NlqmSK #Windows #Microsoft;;#WindowsGames #Windows #Microsoft
0;0;Microsoft confirma el 11 de abril como la fecha de llegada de Windows 10 Creators Update - http:// ln.is/www.genbeta.co m/wind/v268t …;;
0;0;https:// twitter.com/ya570202/statu s/847225433288450051 … webbrowser1は、EXCELのコントロールボックス→「 Microsoft web browser 」を選択してフォーム作成した時に自動命名されるオブジェクト名(このエリアに指定されたURLのwebページが表示される);;
0;0;試験会場数全国一位の「 Microsoft Office Specialist 公認パートナー」です。;;
0;0;Publicly Attacked Microsoft IIS Zero Day Unlikely to be Patched http:// twib.in/l/RnkroLMRjb9n pic.twitter.com/0w0HDGKxpy;;
1;1;Estonian Guitar - Microsoft Store https://www. microsoft.com/en-us/store/mu sic/album/gunnar-k-a-njalsson/estonian-guitar/8d6kgwxd18zq … #MicrosoftStore #MTVNews #MAGA #Eestilaul2017 #svpol #NRK #SVT #melodifestivalen pic.twitter.com/vnC9qRluDt;;#MicrosoftStore #MTVNews #MAGA #Eestilaul2017 #svpol #NRK #SVT #melodifestivalen
0;0;「Surface Book」のハイエンドモデルを日本で発売へ　30万8664円から Microsoft のハイブリッドノート「Surface Book」のハイエンドモデル「Surface Book with Performanc… http:// ift.tt/2nx4zDb;;
0;0;Grand Theft Auto V -- Special Edition ( Microsoft Xbox 360, 2013) - European Ver… http:// ift.tt/2nhCeiQ pic.twitter.com/bAhAcLmUop;;
0;0;How To Create A Resume In Microsoft Word Free http:// share-the-buzz.com/video/102?Hoyg;;
0;0;Castle Siege? Now? After the entire world stopped playing it?? Time for Microsoft to start selling Groceries!!;;
1;0;@Microsoft Can #BigData and data privacy co-exist? What do YOU think? Check out my article! ---> https:// goo.gl/QEBWgY;@Microsoft;#BigData
0;0;@Microsoft I regret buying a Mac;@Microsoft;
0;0;Microsoft Dynamics MB6-890 Exam – Get Latest Exam Questions http:// dlvr.it/NlqlzS pic.twitter.com/BmgVjMXeeb;;
0;0;MB2-718 Exam updated (29 Mar 2017) Questions for Microsoft Dynamics Certification http:// dlvr.it/Nlqlxz pic.twitter.com/HoUDJgNArF;;
0;0;@Microsoft @Xbox @XboxP3 I hate the new xbox home screen and that extra step to go to the home screen. Is there any way I can revert to old?;@Microsoft @Xbox @XboxP3;
0;0;Parabéns Microsoft e Prefeitura de SP. O sucesso de uma corporação não se mede em vender e visar lucro, mas em doar… https:// lnkd.in/eFJQ9ae;;
0;0;So if a male finds the cure you don't want it used on you ? Works for me. Go for it guys !;;
0;0;Microsoft ’s Spring fling: Is another new Surface device category coming? https://www. gadget-rumours.com/microsofts-spr ing-fling-is-another-new-surface-device-category-coming/ …;;
0;0;Microsoft Announces Updates for Xbox One, Windows 10 and Surface Studio http:// dlvr.it/NlqkzH;;
0;1;Not a good day for #Microsoft - Exposed files on Microsoft 's #Office365 https:// lnkd.in/d7qhcUu;;#Microsoft #Office365
0;0;MOSは、科目ごとに独立した試験であり、1科目ごとに認定されます。 Microsoft Office Masterを目指す方は、同一バージョンで所定の4科目に合格する必要があります。 http:// mos.odyssey-com.co.jp/about/master.h tml …;;
0;1;I'm On Microsoft Word In The Car https:// twitter.com/__queenofitall /status/847226954138869760 …;;
0;1;@trayonwhite I was at the Minority Day event at Microsoft recently and saw you on the news a minute ago and instantly remembered you!;@trayonwhite;
0;0;" Microsoft Office 365 documents leaked onto Google and Bing over users misunderstanding..." #doc2cloud https:// goo.gl/h4xmi0;;#doc2cloud
0;1;kkkkk esse modelo já é o da Microsoft , mas eu amo Nokia mesmo kk pegaria esse novo Android dela sem pensar;;
0;1;Seriously @Microsoft ? pic.twitter.com/dQ9hYo5Sk6;@Microsoft;
0;0;Só queria instalar o visual Studio sem dar erro! Me ajuda aí microsoft;;
0;0;Microsoft confirma data da próxima grande atualização do Windows 10 via @Olhar %20Digital;@Olhar;
0;0;Microsoft should make an effort to make Xbox THE place for Western RPGs http:// bit.ly/2oiUvOv;;
0;0;New on Ebay Microsoft Xbox One with Kinect 500GB Black Console Bundle (9 games + Dimensions) http:// ift.tt/2n8fQsI pic.twitter.com/vVjASm0tHb;;
0;0;Microsoft Lumia 550 https:// nl.hardware.info/product/325707 /microsoft-lumia-550-black/specificaties … https://www. microsoft.com/en-us/mobile/p hone/lumia550/ …;;
0;0;Microsoft Office 365 Solo (1年版)|オンラインコード版|Win/Mac対応 マイクロソフト プラットフォーム:   Windows 7 / 8 / 8.1 /… http:// dlvr.it/Nlqjwq ... #PCソフト #ダウンロード;;#PC #
0;0;Microsoft Office Home and Business 2016 (最新) |オンラインコード版|Win対応 マイクロソフト プラットフォーム: Windows 7 / 8 /… http:// dlvr.it/NlqjsL ... #PCソフト #ダウンロード;;#PC #
0;0;Microsoft Windows 10 Home Anniversary Update適用 32bit/64bit 日本語版 (最新) |オンラインコード版 マイクロソフト… http:// dlvr.it/Nlqjgw ... #PCソフト #ダウンロード;;#PC #
0;0;Microsoft Word 2016 (最新)|オンラインコード|Win対応 マイクロソフト プラットフォーム: Windows 7 / 8 / 8.1 / 10 (17) 新品： ￥… http:// dlvr.it/NlqjcV ... #PCソフト #ダウンロード;;#PC #
0;0;Microsoft Office Personal 2016 (最新)|オンラインコード版|Win対応 マイクロソフト プラットフォーム: Windows 7 / 8 / 8.1 / 10… http:// dlvr.it/NlqjYh ... #PCソフト #ダウンロード;;#PC #
0;0;Microsoft Excel 2016 (最新)|オンラインコード版|Windows版 マイクロソフト プラットフォーム: Windows 7 / 8 / 8.1 / 10 (43) 新品：… http:// dlvr.it/NlqjNR ... #PCソフト #ダウンロード;;#PC #
0;0;#ConsejoTI : Formas de adaptarse a los cambios en los #parches de #Microsoft : http:// searchdatacenter.techtarget.com/es/consejo/For mas-de-adaptarse-a-los-cambios-en-los-parches-de-Microsoft …;;#ConsejoTI #parches #Microsoft
0;1;@imcatnoone Any chance you have some connections at Microsoft ? Hoping to get a speaker for an event.;@imcatnoone;
0;2;En #Microsoft con la #XamarinLeague @YOHIS iniciando Geolocalizacion con #Xamarin;@YOHIS;#Microsoft #XamarinLeague #Xamarin
0;0;#O365 Jobs, Bristol 'I listen to what you want' Neil Mills, Agent Book a chat here >>> https:// calendly.com/millshill/30min #Microsoft pic.twitter.com/glIGZoqMh2;;#O365 #Microsoft
0;0;Cómo los fans de Xbox hemos cambiado la cultura de Microsoft http://www. xboxers.es/2017/03/26/los -fans-xbox-cambiado-la-cultura-microsoft/?utm_source=ReviveOldPost&utm_medium=social&utm_campaign=ReviveOldPost …;;
0;0;Microsoft Dynamics MB6-890 Exam – Get Latest Exam Questions http:// dlvr.it/NlqjG1 pic.twitter.com/y0BMhn5KDx;;
0;0;MB2-718 Exam updated (29 Mar 2017) Questions for Microsoft Dynamics Certification http:// dlvr.it/NlqjCM pic.twitter.com/uIEyZH85ig;;
0;0;自社開発技術満載！ Microsoft Azureの物理インフラを大解剖 http:// dlvr.it/Nlqj88;;
0;0;Tell Microsoft to disappear! The way they treat customers and the way they charge is unacceptable! Products are Pathetic!;;
0;0;Microsoft Dynamics MB6-890 Exam – Get Latest Exam Questions http:// dlvr.it/Nlqhvy pic.twitter.com/xkZWszCKjJ;;
0;6;Fascinating questions from the great minds at Microsoft here in Seattle. https:// twitter.com/BookEventsSea/ status/847217488869773313 …;;
0;0;[ASCII] 自社開発技術満載！ Microsoft Azureの物理インフラを大解剖 http:// dlvr.it/Nlqj15 #IT #haken #shigoto;;#IT #haken #shigoto
0;6;Good effort Microsoft but twitch is un-contestable by any company at this point pic.twitter.com/Ip4UxDFUF1;;
0;0;MB2-718 Exam updated (29 Mar 2017) Questions for Microsoft Dynamics Certification http:// dlvr.it/NlqhmS pic.twitter.com/I53leZECTV;;
0;0;Microsoft Corporation (NASDAQ:MSFT) president and chief legal officer Brad Smith on warpath … http:// opensources.info/microsoft-corp oration-nasdaqmsft-president-and-chief-legal-officer-brad-smith-on-warpath/ …;;
0;0;Windows10/office2016/Corei7-3770/8GB 1TB TV/B-CAS付② http:// page12.auctions.yahoo.co.jp/jp/auction/p54 5901827 … #デスクトップ #Microsoft #Windows10;;# #Microsoft #Windows10
0;1;Yeah i think i made the mistake picking the ps4 over the xbox one. Microsoft sounds way better;;
0;0;sorry to hear that! We're human afterall, it happens, you never know until it's too late! Like @Microsoft with @OpenSourceOrg;@Microsoft @OpenSourceOrg;
7;7;Hoe serieus nemen we #cybersecurity ? Vandaag met @CarloKuip langs bij het @Microsoft Cybercrime Center. #EBC #betrouwbaarheidvoorop pic.twitter.com/OIBwk60mlA;@CarloKuip @Microsoft;#cybersecurity #EBC #betrouwbaarheidvoorop
0;2;E aquela sensação legal de vc saber que semana que vem tem evento de recrutamento da Microsoft na sua deliciosa faculdade?;;
0;0;Microsoft Xbox One S - 500GB White Console - No box https:// goo.gl/5JmP4n #deals;;#deals
0;0;" Microsoft recently introduced a new feature that aims to inspire confidence among its customers." http://www. eweek.com/storage/micros oft-azure-feature-checks-for-defects-in-vm-backups …;;
3;2;Publicly Attacked Microsoft IIS Zero Day Unlikely to be Patched | Threatpost | … https:// threatpost.com/publicly-attac ked-microsoft-iis-zero-day-unlikely-to-be-patched/124641/ … , see more http:// tweetedtimes.com/opexxx?s=tnp;;
0;0;Microsoft Dynamics MB6-890 Exam – Get Latest Exam Questions http:// dlvr.it/NlqgJk pic.twitter.com/JWHWJwvR9P;;
0;0;Publicly Attacked Microsoft IIS Zero Day Unlikely to be Patched http:// twib.in/l/RnkroLMRjb9n pic.twitter.com/LmGsKezDcv;;
0;0;Microsoft Get's New Updates Fore Xbox app On iOS: In step with the Creators update launching on the Xbox One these… http:// dlvr.it/NlqgHK pic.twitter.com/dehEMBQ5HQ;;
0;0;MB2-718 Exam updated (29 Mar 2017) Questions for Microsoft Dynamics Certification http:// dlvr.it/NlqgHP pic.twitter.com/FZ16dpYVWu;;
0;0;Microsoft Get's New Updates Fore Xbox app On iOS: In step with the Creators update launching on the Xbox One these… http:// dlvr.it/NlqgCH pic.twitter.com/trMZ79vCVJ;;
0;0;Microsoft Get's New Updates Fore Xbox app On iOS: In step with the Creators update launching on the Xbox One these… http:// dlvr.it/NlqgBs pic.twitter.com/G5Xh9cC37f;;
0;1;Samsung is so much more viable than Microsoft & Canonical's approach (although a linux or Windows would be more useful) I'm exite;;
0;0;Microsoft Get's New Updates Fore Xbox app On iOS: In step with the Creators update launching on the Xbox One these… http:// dlvr.it/Nlqg1X pic.twitter.com/D2mygKIbxD;;
0;0;Microsoft Dynamics MB6-890 Exam – Get Latest Exam Questions http:// dlvr.it/NlqfxH pic.twitter.com/DQANoG3g41;;
0;0;I liked a @YouTube video http:// youtu.be/P2uL3qDkl7E?a Full Review Windows 10 Creators update Part 2 or 9 Microsoft Edge Browser features;@YouTube;
0;0;MB2-718 Exam updated (29 Mar 2017) Questions for Microsoft Dynamics Certification http:// dlvr.it/Nlqfjz pic.twitter.com/T6XHpbDRjv;;
0;0;igualito que #Continuum de Microsoft con Lumia950 . Eso es viejo. La diferencia es entorno de usuario más friendly.;;#Continuum
0;0;Intro to Google Chrome and Microsoft Edge Loadable fonts, Parentage pic.twitter.com/cnHaGEjDUZ;;
0;0;マイクロソフトのセキュリティ対策の動画が、YouTube の Microsoft Cloud Platform チャネルに増えてる #Security https://www. youtube.com/user/MSCloudOS /videos … pic.twitter.com/F0k5fCVdUf;;#Security
0;0;How Microsoft Access Training Can Help Your Employees - Advertise here with BSA Microsoft Access is a very popu... http:// ow.ly/s54950avZ5R;;
0;0;FBモバイル版にあるコラージュ機能やインスタのストーリーは確かにスナップチャットによく似てる。戦略がさすが Microsoft グループ、褒めて、けなして、安く買う。ダメならコピる。 https:// twitter.com/WSJJapan/statu s/847051976420548609 …;;
0;0;Microsoft の出してるやつの方がよくね？;;
0;1;True! I love @Grammarly . It is so great. Cannot wait to have it working with Microsoft Outlook :);@Grammarly;
0;0;How Microsoft Access Training Can Help Your Employees - Advertise here with BSA Microsoft Access is a very popu... http:// ow.ly/DOF650avYKe;;
0;0;Microsoft Xbox 360 w/Kinect 4GB Black Console With 17 Games & 2 Wireless Remotes http:// rover.ebay.com/rover/1/711-53 200-19255-0/1?ff3=2&toolid=10044&campid=5337506718&customid=&lgeo=1&vectorid=229466&item=262911096017 … pic.twitter.com/VfcLvNcXEU;;
0;0;Microsoft Xbox, Xbox 360, and Xbox One Game Lot 180+ Games http:// rover.ebay.com/rover/1/711-53 200-19255-0/1?ff3=2&toolid=10044&campid=5337506718&customid=&lgeo=1&vectorid=229466&item=262907540086 … pic.twitter.com/vi8mUrrfx8;;
0;0;I hope Microsoft will anounce new Windows Mobile devices! http:// build.microsoft.com / #Build2017;;#Build2017
0;0;New on Ebay Battlefield 4 ( Microsoft Xbox One, 2013) http:// ift.tt/2o9xEYc pic.twitter.com/DIIUrN6VZl;;
0;0;#Samsung debuts #GalaxyS8 halo phones, #Microsoft Win10 update, bizarre #Ferrari crime case: … https:// twitter.com/BillRobersonDT /status/847216236228366336 …;;#Samsung #GalaxyS8 #Microsoft #Ferrari
0;0;More on #cognitiveservices from microsoft ! #azuregovmeetup https://www. pscp.tv/w/a6rj8zFkclFl Wmd2ZFhSS2J8MWRqeFh2UWVPTHpHWiwkxDLqV-APFzeTMNCWM2DgH8QYQVdB_WLYmoEJdpsD …;;#cognitiveservices #azuregovmeetup
0;0;Kicked out Rothchilds, Microsoft . Put Bill Gates on Cyber terror watch list. Now is backing up $ with gold. POINT: guy is not joke. stayaway https:// twitter.com/ItIzBiz/status /847135918494404608 …;;
0;0;Thanks to One Identity for the follow. https:// twitter.com/OneIdentity #Staffordshire #Microsoft #Partner #Office365;;#Staffordshire #Microsoft #Partner #Office365
0;0;Microsoft is testing Ruuh, an English-speaking AI chatbot aimed at the Indian market (Mary Jo Foley/ZDNet) http:// ow.ly/ASjF50avYGN;;
0;0;#ArrowLauncher me encantó, contador de no leídos incluído, gestos, etc. Wooow #Microsoft se lució!!! Por que no supe antes de esa app :'(;;#ArrowLauncher #Microsoft
0;1;If I'm not mistaken, the licensing deal, that EA made with microsoft a couple of years back, i set to expire this year.;;
0;0;Microsoft Xbox 360 w/Kinect 4GB Black Console With 17 Games & 2 Wireless Remotes http:// rover.ebay.com/rover/1/711-53 200-19255-0/1?ff3=2&toolid=10044&campid=5337506718&customid=&lgeo=1&vectorid=229466&item=262911096017 … pic.twitter.com/QshONR86sU;;
0;0;@MicrosoftVC Thanks for the opportunity!;@MicrosoftVC;
0;0;Microsoft Xbox, Xbox 360, and Xbox One Game Lot 180+ Games http:// rover.ebay.com/rover/1/711-53 200-19255-0/1?ff3=2&toolid=10044&campid=5337506718&customid=&lgeo=1&vectorid=229466&item=262907540086 … pic.twitter.com/sOkr3V0xOS;;
0;0;Engineer II Customer Operations @Syniverse India Bangalore http:// bit.ly/2ney8I1 #Analyst #Microsoft #Windows;@Syniverse;#Analyst #Microsoft #Windows
0;0;#BONPLAN Microsoft Office 2016 de A à Z à 10€ avec ce coupon DEC1202 RT+Follow https:// goo.gl/b82ROO #TPMP pic.twitter.com/VHG7IDsL6y;;#BONPLAN #TPMP
0;0;#6: Xbox 360 - Console 4 GB: Xbox 360 - Console 4 GB di Microsoft 945% Classifica vendite in Videogiochi: 369 (ieri… http:// dlvr.it/Nlqdvw;;#6
2;4;Unique hiring approach leads to "awesome" HoloLens job - JobsBlog: Life at Microsoft http:// buff.ly/2ePvZlU #autism #inclusionworks;;#autism #inclusionworks
0;0;Read why Microsoft named Centrica as the most engaged Yammer network in the world in our how to guide #measurement http:// hubs.ly/H06VpwN0 pic.twitter.com/y2CU7glNoB;;#measurement
0;0;#O365 Jobs, Liverpool 'I listen to what you want' Neil Mills, Agent Book a chat here >>> https:// calendly.com/millshill/30min #Microsoft pic.twitter.com/Ul22BDBTei;;#O365 #Microsoft
0;0;me segue no microsoft excel e ve meu stories de lá;;
16;26;Pam Edstrom, 1946-2017: Microsoft ’s first PR director was a technology communications pioneer http://www. geekwire.com/2017/pam-edstr om-1946-2017-microsofts-first-pr-director-technology-communications-pioneer/ …;;
0;0;So, you want to work at Microsoft ? https:// lnkd.in/egVv6rz;;
0;0;Microsoft iPad (Teach Yourself VISUALLY) https:// goo.gl/VBHGsN #computersinternet pic.twitter.com/nPCZQOYZU8;;#computersinternet
0;0;Microsoft iPad (Teach Yourself VISUALLY) https:// goo.gl/VBHGsN #computersinternet pic.twitter.com/GY9itOe1S2;;#computersinternet
0;0;Microsoft Xbox 360 w/Kinect 4GB Black Console With 17 Games & 2 Wireless Remotes http:// rover.ebay.com/rover/1/711-53 200-19255-0/1?ff3=2&toolid=10044&campid=5337506718&customid=&lgeo=1&vectorid=229466&item=262911096017 … pic.twitter.com/vaMIedGp0H;;
0;0;Yikes! I'm an #Xbox guy & I have to say, across the board, Microsoft 's​ product support has been amazing when I needed it.;;#Xbox
0;0;Microsoft Xbox, Xbox 360, and Xbox One Game Lot 180+ Games http:// rover.ebay.com/rover/1/711-53 200-19255-0/1?ff3=2&toolid=10044&campid=5337506718&customid=&lgeo=1&vectorid=229466&item=262907540086 … pic.twitter.com/ucFG4WrWER;;
0;0;I think you'll like my novel, I understand The Riddler @JimCarrey has an interest. #BatmanBeyond;@JimCarrey;#BatmanBeyond
0;0;Windows 10 Creators Update: Microsoft announces rollout will begin on April 11: https://www. neowin.net/news/windows-1 0-creators-update-microsoft-announces-rollout-will-begin-on-april-11 … via @NeowinFeed;@NeowinFeed;
0;1;Major Beam partner here. I'm hooked. Zero delay, responsive staff, supportive community, owned by Microsoft .;;
0;0;Microsoft Sessions: Desarrolle aplicaciones innovadoras http:// fb.me/4fJZGtZ6P;;
0;2;#PamEdstrom , 1946-2017: #Microsoft ’s first #PRdirector was a technology communications pioneer http://www. geekwire.com/2017/pam-edstr om-1946-2017-microsofts-first-pr-director-technology-communications-pioneer/ … via @GeekWire;@GeekWire;#PamEdstrom #Microsoft #PRdirector
0;0;Microsoft Get's New Updates Fore Xbox app On iOS: In step with the Creators update launching on the Xbox One these… http:// dlvr.it/NlqXxF pic.twitter.com/8Om2rcphvG;;
1;1;#Microsoft #SCAM Caller Wants Callback DONT! 800-608-4702 Caller ID has 25 Results - https:// checkwhocalled.com/phone-number/1 -800-608-4702?utm_campaign=shareaholic&utm_medium=twitter&utm_source=socialnetwork … - @CheckWhoCalled;@CheckWhoCalled;#Microsoft #SCAM
0;0;Microsoft Xbox 360 w/Kinect 4GB Black Console With 17 Games & 2 Wireless Remotes http:// rover.ebay.com/rover/1/711-53 200-19255-0/1?ff3=2&toolid=10044&campid=5337506718&customid=&lgeo=1&vectorid=229466&item=262911096017 … pic.twitter.com/UUgdikq1MR;;
0;0;Microsoft Xbox, Xbox 360, and Xbox One Game Lot 180+ Games http:// rover.ebay.com/rover/1/711-53 200-19255-0/1?ff3=2&toolid=10044&campid=5337506718&customid=&lgeo=1&vectorid=229466&item=262907540086 … pic.twitter.com/O2LXviYwBw;;
0;0;Grand Theft Auto V GTA 5 for Microsoft Xbox 360 http:// ift.tt/2nhT29j pic.twitter.com/BHBAbqBJew;;
0;0;Microsoft Xbox 360 w/Kinect 4GB Black Console With 17 Games & 2 Wireless Remotes http:// rover.ebay.com/rover/1/711-53 200-19255-0/1?ff3=2&toolid=10044&campid=5337506718&customid=&lgeo=1&vectorid=229466&item=262911096017 … pic.twitter.com/l89H5Y5cg7;;
0;0;Microsoft Xbox, Xbox 360, and Xbox One Game Lot 180+ Games http:// rover.ebay.com/rover/1/711-53 200-19255-0/1?ff3=2&toolid=10044&campid=5337506718&customid=&lgeo=1&vectorid=229466&item=262907540086 … pic.twitter.com/pGfVsD2KHs;;
0;0;Proof: a black cloth with yellow flowers.;;
0;0;La Creators Update de Microsoft va considérablement améliorer Windows Defender http://www. erenumerique.fr/creators-updat e-de-microsoft-va-considerablement-ameliorer-windows-defender-article-30103-14.html?utm_source=ReviveOldPost&utm_medium=social&utm_campaign=ReviveOldPost … #news;;#news
0;0;#MultisoftVirtualAcademy The Features of Microsoft ® Training Programs for All. Read Blog: http:// owler.us/acs6iN;;#MultisoftVirtualAcademy
0;0;Stan Winston admits that I appear to be the basis of his company's vampire. I admit proof:;;
4;1;#ReTweet & #ENTER to #WIN the @Microsoft @Surface Book #Giveaway #Competition #Sweepstakes #Contest https:// store.digg.com/giveaways/the- microsoft-surface-book-giveaway?gid=2473842 … #RT;@Microsoft @Surface;#ReTweet #ENTER #WIN #Giveaway #Competition #Sweepstakes #Contest #RT
0;0;То чувство, когда друг утверждает: "У Apple нет инноваций", сам восхваляет Samsung, а потом мы видим нечто похожее на Microsoft Display Dock https:// twitter.com/SamsungRu/stat us/847115506540777472 …;;
0;0;The story experienced a cordon spoof and the head of homosexual Celebrity Report that had gap with individuals on a tribute to Microsoft .;;
0;0;Microsoft Surface Book 2 Release Date News: Company to Hold a Spring Event Without New Laptop Announcement? http://www. thebestweightlosssolution.com/microsoft-surf ace-book-2-release-date-news-company-to-hold-a-spring-event-without-new-laptop-announcement.html …;;
0;0;Great. Then all the boys will go to work at your competitors. Glad you showed your anti-male bias.;;
0;0;God damn it Adobe and Microsoft , Sony and Nintendo to NOT release any new consoles for another few years?;;
20;15;Microsoft Planner: Now you can recover deleted Plans and Groups https:// blogs.msdn.microsoft.com/brismith/2017/ 03/29/microsoft-planner-now-you-can-recover-deleted-plans-and-groups/ … #AzureAD #Office365Groups;;#AzureAD #Office365Groups
0;0;Microsoft Xbox 360 w/Kinect 4GB Black Console With 17 Games & 2 Wireless Remotes http:// rover.ebay.com/rover/1/711-53 200-19255-0/1?ff3=2&toolid=10044&campid=5337506718&customid=&lgeo=1&vectorid=229466&item=262911096017 … pic.twitter.com/r7fBizbX5E;;
0;0;Microsoft Xbox, Xbox 360, and Xbox One Game Lot 180+ Games http:// rover.ebay.com/rover/1/711-53 200-19255-0/1?ff3=2&toolid=10044&campid=5337506718&customid=&lgeo=1&vectorid=229466&item=262907540086 … pic.twitter.com/xP0C3WQRzV;;
1;2;Microsoft spends $1B/year on #security . Tune in now to hear how to keep your enterprise secure: #CXOSummit17 http:// soc.fm/6Qo3Xhy1;;#security #CXOSummit17
0;0;Microsoft Dynamics MB6-890 Exam – Get Latest Exam Questions http:// dlvr.it/NlqcCh pic.twitter.com/qwu4HnqfVj;;
0;0;Microsoft Dynamics MB6-890 Exam – Get Latest Exam Questions http:// dlvr.it/NlqcCk pic.twitter.com/PX8RkF7jA8;;
0;0;MB2-718 Exam updated (29 Mar 2017) Questions for Microsoft Dynamics Certification http:// dlvr.it/NlqcBn pic.twitter.com/A6YdvVc4h8;;
0;0;MB2-718 Exam updated (29 Mar 2017) Questions for Microsoft Dynamics Certification http:// dlvr.it/NlqcBr pic.twitter.com/c4gfwq4lhk;;
0;0;Microsoft Dynamics MB6-890 Exam – Get Latest Exam Questions http:// dlvr.it/Nlqc8W pic.twitter.com/dxYrHyfssn;;
0;0;a microsoft;;
0;0;MB2-718 Exam updated (29 Mar 2017) Questions for Microsoft Dynamics Certification http:// dlvr.it/Nlqc4Q pic.twitter.com/VzR6vUkOnl;;
0;0;Microsoft MB2-717 Exam Actual Questions (Updated 29 Mar 2017) – Latest Version http:// dlvr.it/Nlqc2N pic.twitter.com/29LaF2Q1Gs;;
