retweets;favorites;text;mentions;hashtags
0;0;Satya Nadella CEO, Microsoft : Accenture Hybrid Cloud Solution for Microsoft Azure https:// lnkd.in/dCCnP2u;;
0;0;Microsoft Lumia Poland shows us how to make cool steadycams using household objects http:// goo.gl/GjE8q2;;
0;0;Deal: Microsoft Store Will Offer $50 Off Xbox One Plus A Free Game Tomorrow http:// goo.gl/yKeIzi;;
0;1;@JWUProvidence @Microsoft I just found this out and have been paying $10 a month!!! SO happy I can use this now and save that $ instead;@JWUProvidence @Microsoft;
0;0;あいつらタコですよ( microsoft に対して;;
0;0;Microsoft takes Publishing role for Rise of the Tomb Raider »Inside Gamer http:// ow.ly/FDB11;;
0;0;@XboxSupport Hello, today I already called the microsoft support for the recovery of my business. I sent a form to reset my password,;@XboxSupport;
0;0;ニュース:「 Microsoft Band」は予想以上、最高水準のウエアラブル！真の狙いは健康管理データ解析 #News http:// nkbp.jp/12pzG7O;;#News
0;0;Microsoft Malicious Software Removal Tool 5.19 Free http:// wp.me/p31Onm-yP http:// fb.me/7fYSinzeE;;
0;0;Microsoft Flight Simulator X coming to Steam next week thanks to Dovetail http:// ift.tt/1Iwy1OL;;
0;0;[電脳] 「Windows」頼みはもう卒業、 Microsoft の“次の一手”は？ （ITmedia） http:// dlvr.it/7mqCVh #newsjp;;#newsjp
5;1;Headed to Microsoft Ignite? — US$300 off the standard fee when you register on or before Dec. 11th! http:// ow.ly/Fyf3d;;
0;0;This Week's Xbox One/360 Deals for Gold Members: Microsoft has announced this week's list of Xbox One and Xbo... http:// tinyurl.com/oq54ehc;;
0;0;@Sony @PlayStation and your bullshit chat help sucked and didn't help. I'll be changing over to Microsoft and xbox. Never again;@Sony @PlayStation;
0;1;@Microsoft @nfl Are you sure you want someone like #benedelman representing you? #isthatwhattheshieldstandsfor ?;@Microsoft @nfl;#benedelman #isthatwhattheshieldstandsfor
0;1;Microsoft announces US general availability of Microsoft Azure Government http:// news.microsoft.com/2014/12/09/mic rosoft-announces-general-availability-of-microsoft-azure-government/ …;;
0;1;@lablady @bpmilne @Microsoft thanks, Lisa! We appreciate your continued support #awesomecustomer #dwollalove #govt #msft #GovCloud;@lablady @bpmilne @Microsoft;#awesomecustomer #dwollalove #govt #msft #GovCloud
0;0;[TechTargetジャパン] 「Windows」頼みはもう卒業、 Microsoft の“次の一手”は？ http:// j.mp/1B3Tn0P #followmejp;;#followmejp
0;0;Windows 8.1 Now Supports MKV Files Via Xbox Video App: Microsoft released an update for its built in Mod... http:// bit.ly/1ujhC6L #xbox;;#xbox
0;1;Microsoft Said To Be Dropping SharePoint Online ‘Public Sites’ Feature http:// dlvr.it/7mqBc0;;
0;0;محاضرة ألقاها بيل جيتس من أغنى رجال العالم ومؤسس شركة Microsoft " تحت عنوان: 10 قواعد لا تدرسها في المدرسة :: 000... http:// ift.tt/12pwBEP;;
0;0;Microsoft Visual Studio Professional 2013 with MSDN 更新版 マイクロソフト プラットフォーム:   Windows (1) 新品： ￥… http:// dlvr.it/7mqGx0 ... #プログラム #PC;;# #PC
0;0;Microsoft Visual Studio Professional 2013 with MSDN 通常版 マイクロソフト プラットフォーム:   Windows (1) 新品： ￥… http:// dlvr.it/7mq9PX ... #プログラム #PC;;# #PC
0;0;Microsoft Visual Basic .NET Standard Version 2002 マイクロソフト プラットフォーム:   Windows (3) 新品： ￥ 2,980… http:// dlvr.it/7mqCWg ... #プログラム #PC;;# #PC
0;0;Microsoft MSDN Operating Systems 2013 通常版 マイクロソフト プラットフォーム:   Windows (1) 新品： ￥ 80,989 5点の新品／中古品を見る:… http:// dlvr.it/7mqGYZ ... #プログラム #PC;;# #PC
0;0;Microsoft Visual Studio Professional 2013 通常版 マイクロソフト プラットフォーム:   Windows (7) 新品： ￥ 55,302… http:// dlvr.it/7mqCx4 ... #プログラム #PC;;# #PC
0;0;2Xbox One plus Assassin's Creed Bundle for only $329. #cybermonday at Microsoft ! http:// bit.ly/1tEKO6M;;#cybermonday
0;0;Microsoft Windows XP Professional Service Pack 2 通常版 マイクロソフト プラットフォーム:   Windows (16) 新品： ￥ 59,000… http:// dlvr.it/7mq9jJ ... #プログラム #PC;;# #PC
0;0;Microsoft Visual Studio Professional 2013 アップグレード版 マイクロソフト プラットフォーム:   Windows 新品： ￥ 35,469… http:// dlvr.it/7mq8t0 ... #プログラム #PC;;# #PC
1;1;Esta semana en #portada : Accenture y Microsoft lanzan plataforma de nube híbrida http:// shrd.by/1njwEV vía... http:// shrd.by/jdYbNd;;#portada
0;2;I like square enix more than Microsoft as a publisher. Why didnt you stay with square enix tomb raider?? Why????;;
0;0;【12ヶ月保証】HP 6000 PRO+19TFT [+ Microsoft Office 2007 Personal][+1024MB増設済]特選 中古パソコンデスクトップ 液晶セット Windows http:// hb.afl.rakuten.co.jp/hgc/g00reed5.2 ncy34dd.g00reed5.2ncy4821/?pc=http%3A%2F%2Fitem.rakuten.co.jp%2Fpasokore%2F4bt214012-420%2F&m=http%3A%2F%2Fm.rakuten.co.jp%2Fpasokore%2Fi%2F10398903%2F …;;
25;17;Microsoft Xbox 360 Wired Controller $14.99 (free shipping) Shellshocker deal via Newegg. http:// ow.ly/FDAOF;;
0;0;@4JStudios ya just as everyone said Microsoft owns minecratf so no more dlc for psn #Microsoftsucks;@4JStudios;#Microsoftsucks
0;0;@flinty1972 No Problem. Microsoft have a site if you're ever in doubt to check on an app. It's not very comprehensive though.;@flinty1972;
0;0;Hahaha... Microsoft pic.twitter.com/rtL9LwSpOr;;
0;0;Work location #work #trainer #kualalumpur #malaysia #microsoft #excel #training @Menara SapuraKencana… http:// instagram.com/p/wZ7ygRB__e/;@Menara;#work #trainer #kualalumpur #malaysia #microsoft #excel #training
0;0;[ITmedia エンタープライズ] Microsoft 、7件のセキュリティ情報を公開　「緊急」は3件 http:// ift.tt/1z40TZl #今日のFeedly;;#
0;0;Microsoft Windows 8.1 Pro (旧バージョン) マイクロソフト プラットフォーム:   Windows (26) 4点の新品／中古品を見る: ￥ 22,200より… http:// dlvr.it/7mq9gj #Linux #OS #LinuxOS;;#Linux #OS #LinuxOS
0;0;Skinny Ubuntu Linux 'Snapped' up by fat Microsoft cloud: A smartphone-inspired version of Ubuntu Serve... http:// bit.ly/1B3SJAz #Ubuntu;;#Ubuntu
0;0;Gostei de um vídeo @YouTube http:// youtu.be/uEP1nffkyMc?aH oje … no TecMundo (09/12) - preço do Note Edge, G Watch R2, Microsoft contra;@YouTube;
0;0;Couldnt transfer my Microsoft from Mac to PC :( @venkysrinivasan - just got a new one;@venkysrinivasan;
1;2;Shameless plug: Visit Rosey Pinterest board http:// bit.ly/1yxp0lrand and <3 our work for Microsoft , Expedia, ASUS, Western Star, etc.Thanks!;;
0;0;Microsoft #Xbox 360 4GB Slim Console w/ Accessories! http:// ebay.to/1tLjfgY pic.twitter.com/DLawi8lwh1;;#Xbox
0;1;Hoje no TecMundo (09/12) - preço do Note Edge, G Watch R2, Microsoft con...: http:// youtu.be/uEP1nffkyMc via @YouTube;@YouTube;
0;0;@LizardSquad go on Microsoft and give back the og gamertags they are big dicks about gamertags;@LizardSquad;
0;0;New on Ebay Microsoft - Xbox One 500GB Console Kinect Assassin's Creed: Unity Bundle http:// ift.tt/15VRnOp pic.twitter.com/HrALKs6Kof;;
0;0;New on Ebay Microsoft Xbox One (Latest Model)- 500 GB Black Console (Without Kinect) http:// ift.tt/1ujhjsA pic.twitter.com/UhTOOXqx6j;;
0;0;@FranXGameer yea man a game funded by Microsoft will come to playstation;@FranXGameer;
1;1;Scheduling/calendaring is always a challenge at Microsoft in the month of December...;;
0;0;Sports (App) newly tagged " microsoft ": Sports (App)By Microsoft Corporation Buy new: $0.0... http:// amzn.to/1B3SzJj;;
0;0;Sports (App) newly tagged " microsoft ": Sports (App)By Microsoft Corporation Buy new: $0.0... http:// amzn.to/1B3SzJj;;
0;0;Hackearam te minha conta da Microsoft;;
0;0;Barnes & Noble to buy Microsoft 's stake in Nook business http:// klou.tt/ddc2z0w7vka7;;
0;0;Microsoft Excel Top Tip Number 19 #Training #IT #Excel http:// goo.gl/SCtfj1 pic.twitter.com/QLWn7ya7BB;;#Training #IT #Excel
6;1;Imagine, create and share everything in your life, all on one sleek device with the Microsoft @Surface tablet. pic.twitter.com/XIwTtPmSEb;@Surface;
0;2;i like when microsoft word tells me when something doesn't sound right in my paper...haha just kidding DON'T TELL ME WHAT TO DO;;
0;0;Portal de ciber causas http:// chn.ge/87WIJZ recibe inversión de Twitter, Yahoo! y Microsoft http:// bit.ly/1wvU3hs;;
0;0;The Microsoft Engine That Nailed The World Cup Is Predicting Every NFL Game ... - Business Insider http:// dlvr.it/7mq9sc;;
0;0;#XNews , #Grabit , #Microsoft outlook express will work with our newsgroup service. http://www. uncensorednewsfeed.com /;;#XNews #Grabit #Microsoft
0;0;Square is shooting themselfs in the foot by making rise of the tomb raider a microsoft exclusive. Dont have a sook when you dont sell enough;;
0;0;デジマメNo.3 『言語バーがなくなった！』( Microsoft IME) http:// laclog.lac-key.bz/?eid=91;;
0;0;Gostei de um vídeo @YouTube http:// youtu.be/uEP1nffkyMc?aH oje … no TecMundo (09/12) - preço do Note Edge, G Watch R2, Microsoft contra;@YouTube;
0;0;I liked a @YouTube video from @keemstarx http:// youtu.be/wZlYJfSYHpU?a Lizard Squad vs Anonymous - Xbox Live Microsoft #DramaAlert Xbox One;@YouTube @keemstarx;#DramaAlert
0;0;The Death Of The Password Starts Today: FIDO—a non-profit alliance backed by Microsoft , Google, and other... http:// goo.gl/ScI17Y;;
0;0;Microsoft 、7件のセキュリティ情報を公開　「緊急」は3件 http:// dlvr.it/7mq9TT #News;;#News
0;0;@BenGames_ @4JStudios thats cause microsoft owns minecraft so nobody sucks your just emotionaly distressed;@BenGames_ @4JStudios;
0;0;Shoutout to Microsoft Word for deleting my saved assignment. :)))))))));;
0;0;SAVE $7 - Batman Decal Skin Sticker Decal for Microsoft Xbox 360E Console+Controllers $9.64 http:// c69.co/110140513 #discount #xbox;;#discount #xbox
0;0;Microsoft Windows 7 Home Premium 32 Bit Download Iso http:// prahman.com/?p=8476;;
0;0;Mentor Media Microsoft Windows 7 Professional W/sp1 - License And Media (qlf-00195) - http://www. amazon.com/Mentor-Media-M icrosoft-Windows-Professional/dp/B008C4HXPQ?SubscriptionId=AKIAJDBSXXZ72O2YWJDQ&tag=secrheal01-20&linkCode=xm2&camp=2025&creative=165953&creativeASIN=B008C4HXPQ …;;
0;0;Microsoft Files Appeal in Ireland Email Case http:// fb.me/7fvqwJncy;;
0;0;@Ashaman3000 Right. Instead they come out with this " Microsoft will be publishing on Xbox" crap, which is obviously a shameless PR ploy.;@Ashaman3000;
0;0;#EXPconsulting Microsoft Files Appeal in Ireland Email Case http:// dlvr.it/7mqGPY @julio_verissimo;@julio_verissimo;#EXPconsulting
0;0;So with Microsoft publishing the new Tomb Raider game does that mean PS4 gamers are fucked, as in never seeing the game on our console?;;
0;0;¡ MICROSOFT LUMIA TE CUMPLE TU PROPÓSITO! -Checa de qué se trata aquí--> http:// blog.urbancheck.com.mx/?p=1688;;
0;0;Microsoft Windows 8.1 (DSP版) 64bit 日本語 Windows8.1アップデート適用済み マイクロソフト(DSP) プラットフォーム:   Windows (127)… http:// dlvr.it/7mqB95 ... #Windows #OS;;#Windows #OS
0;0;Microsoft Windows 8 Pro 発売記念優待版 (2013年1月31日まで:型番情報:3UR-00026) マイクロソフト プラットフォーム:   Windows (1278)… http:// dlvr.it/7mq9fd ... #Windows #OS;;#Windows #OS
0;0;Microsoft Windows 8.1 Pro Pack with Windows Media Center (Windows 8.1からWindows 8.1 Pro) マイクロソフト… http:// dlvr.it/7mqFv3 ... #Windows #OS;;#Windows #OS
0;0;Microsoft Windows 8.1 Pro Pack (Windows 8.1からWindows 8.1 Pro) プロダクトキーカード 日本語対応 【並行輸入品】 Microsoft … http:// dlvr.it/7mqHNG ... #Windows #OS;;#Windows #OS
0;0;Microsoft Windows 8.1 Pro (DSP版) 64bit 日本語 Windows8.1アップデート適用済み マイクロソフト(DSP) プラットフォーム:   Windows… http:// dlvr.it/7mq5ZV ... #Windows #OS;;#Windows #OS
0;0;Microsoft Windows7 Professional 32bit Service Pack 1 日本語 DSP版 DVD LCP 【紙パッケージ版】 マイクロソフト(DSP)… http:// dlvr.it/7mq29y ... #Windows #OS;;#Windows #OS
0;0;Microsoft Windows 8.1 最新版 [Windows 8.1 Update 適用済みパッケージ] マイクロソフト プラットフォーム:   Windows (37) 新品： ￥… http:// dlvr.it/7mq53Y ... #Windows #OS;;#Windows #OS
0;0;Microsoft Windows7 Professional 64bit Service Pack 1 日本語 DSP版 DVD LCP 【紙パッケージ版】 マイクロソフト(DSP)… http:// dlvr.it/7mq46T ... #Windows #OS;;#Windows #OS
0;0;Microsoft Windows7 Home Premium 32bit Service Pack 1 日本語 DSP版 DVD LCP 【紙パッケージ版】 マイクロソフト(DSP)… http:// dlvr.it/7mq6m9 ... #Windows #OS;;#Windows #OS
0;0;Microsoft Windows7 Home Premium 64bit Service Pack 1 日本語 DSP版 DVD LCP 【紙パッケージ版】 マイクロソフト(DSP)… http:// dlvr.it/7mq5nn ... #Windows #OS;;#Windows #OS
0;0;#Tecnologia Microsoft presenta Sway, una app para crear páginas web de forma sencilla http:// dlvr.it/7mq1hB;;#Tecnologia
1;0;BMW Germany investing heavily in #Microsoft #Windows devices. Currently at #2 in Business sales heading quickly to #1 http:// investcorrectly.com/20141207/micro soft-msft-scores-windows-phone-win-bmw/#%2EVIUVfHQgNOg%2Elinkedin …;;#Microsoft #Windows #2 #1 #
0;0;Microsoft Dynamics CRM 2015 Search New Features https:// lnkd.in/bT4_A6k;;
0;0;The Microsoft Engine That Nailed The World Cup Is Predicting Every NFL Game ... - Business Insider http:// dlvr.it/7mq4Xp;;
0;0;" Microsoft loves Linux, and we’re excited to be the first cloud provider to offer"... Ubuntu snappy. http://www. ubuntu.com/cloud/tools/sn appy …;;
0;0;@FranXGameer yea and then it comes to pc microsoft will not let tomb raider go to ps4;@FranXGameer;
0;0;в операционных системах Microsoft Windows.;;
0;0;محاضرة ألقاها بيل جيتس من أغنى رجال العالم ومؤسس شركة Microsoft " تحت عنوان: 10 قواعد لا تدرسها في المدرسة :: http:// ift.tt/12pwBEP;;
0;0;It all makes sense now peeps... @Microsoft is Publishing #RiseOfTheTombRaider http://www. technobuffalo.com/2014/12/09/mic rosoft-is-publishing-rise-of-the-tomb-raider/ … via @TechnoBuffalo;@Microsoft @TechnoBuffalo;#RiseOfTheTombRaider
0;0;This site is giving away Free Microsoft Points #XBOX LIVE http:// xbox.free-downloadfiles.com /;;#XBOX
0;0;Sony stopping support on ps3: 2015 Microsoft stopping support on 360: 2016 I don't want these consoles to die;;
0;0;Microsoft Floats Dynamics GP 2015 ERP for SMBs Looking to the Cloud http:// shar.es/13vJME via @eWEEKNews;@eWEEKNews;
0;0;Microsoft se apunta a la personalización de Android con Next Lock Screen http:// wp.me/p2RdIX-2Ii;;
0;0;Microsoft se apunta a la personalización de Android con Next Lock Screen http:// wp.me/p2RdIX-2Ii;;
0;0;Microsoft se apunta a la personalización de Android con Next Lock Screen http:// wp.me/p2RdIX-2Ii;;
0;0;Microsoft se apunta a la personalización de Android con Next Lock Screen http:// wp.me/p2RdIX-2Ii;;
0;0;Microsoft se apunta a la personalización de Android con Next Lock Screen http:// wp.me/p2RdIX-2Ii;;
0;0;Microsoft se apunta a la personalización de Android con Next Lock Screen http:// wp.me/p2RdIX-2Ii;;
0;0;Microsoft se apunta a la personalización de Android con Next Lock Screen http:// wp.me/p2RdIX-2Ii;;
0;0;Microsoft se apunta a la personalización de Android con Next Lock Screen http:// wp.me/p2RdIX-2Ii;;
0;0;Microsoft se apunta a la personalización de Android con Next Lock Screen http:// wp.me/p2RdIX-2Ii;;
0;0;Microsoft se apunta a la personalización de Android con Next Lock Screen http:// wp.me/p2RdIX-2Ii;;
0;0;Microsoft loves Linux, and we’re excited to be the first cloud provider to offer a Ubuntu Core image on Azure! http://www. ubuntu.com/cloud/tools/sn appy … #newMS;;#newMS
0;0;Making the Move to Microsoft Office 365 http:// bubblews.com/news/9631378-m aking-the-move-to-microsoft-office-365 … عبر @GoBubblews;@GoBubblews;
0;0;atomsoffice: iPrivate404: Microsoft opnieuw in beroep tegen dataverzoek Ierse e-mail via NUnl #data #ms #privacy ...;;#data #ms #privacy
0;0;CFU President, Helen Hand, here--Today I took Sue Price's Microsoft Excel 2013 level 1 class in our... http:// fb.me/2QU6DhyMj;;
0;0;Microsoft reveals plans to deliver cloud services from datacenters | Dynamic Business – Small... http:// fb.me/3UzDXIKde;;
0;0;the @Surface & NFL ! @Microsoft Video Hands-on with the NFL's Surface Pro 2 tablets http://www. theverge.com/#ooid=42cG01cj rC7QBtXzcFIz37gwyVshnBUo …;@Surface @Microsoft;#ooid
1;0;Microsoft Band: One month later http:// bdsams.com/1B3Rv8s pic.twitter.com/02fiookmtX;;
0;0;Bloody kid has hacked the family timer again. Come on Microsoft keep up update it to block this youtube hack please;;
0;0;Estudiante boricua gana competencia de Microsoft http:// fb.me/34WVOBFtV;;
0;0;El nuevo Lumia 530. Este smartphone de Microsoft viene con las siguientes características: • La versión más... http:// fb.me/1tKqPygbT;;
0;0;@Gladwell Blink is one of my fav books, I would really like to connect about a Microsoft HCI I am running in the UK next march please?;@Gladwell;
0;0;Microsoft and their subtle changes :| From <Reference Include="Windows, Version=8.1"/> To <TargetPlatform Include="Windows, Version=8.1"/>;;
5;5;Microsoft Band: One month later http:// neow.in/1ujgMXA pic.twitter.com/BZUCXrcw7o;;
0;0;Microsoft Identity Management Consultant FIM: Microsoft Identity Management Consultant FIM… http:// goo.gl/fb/xjpfyk;;
0;0;Microsoft Officeがなくても、無料でExcelやWordを利用する方法 http:// bit.ly/1lsFMGz;;
0;0;Esta semana en #portada : Con el Developer Day 2014, Microsoft promueve innovación http:// shrd.by/tP3Shs vía... http:// shrd.by/rMGD1n;;#portada
0;0;Gostei de um vídeo @YouTube de @vovoloko75 http:// youtu.be/ETiO3Frv8Jw?a Gerador de Live Gold e Microsoft Points;@YouTube @vovoloko75;
0;0;Microsoft giving free consoles for upgraded server protection HOLY!;;
1;2;#MachineLearning – Hype or Reality? Microsoft ML Experts Weigh In http:// bit.ly/1vBvcBR;;#MachineLearning
0;0;На Xbox Rise of the Tomb Raider издаст Microsoft;;
0;0;Microsoft releases Azure Government for the unique needs of government customers http:// go.rcvets.com/3pX #Windows #Nokia #PC;;#Windows #Nokia #PC
0;0;It hasn't even been a week after the SFV announcement and already people are on the anti- Microsoft hate train. FFS;;
0;0;Rise of the Tomb Raider will be Published by Microsoft http:// pulse.me/s/364B9z;;
0;0;This site is giving away Free Microsoft Points #XBOX LIVE http:// xboxlivegold.easygifthouse.com /;;#XBOX
0;3;Microsoft gets App Annie analytics for Windows Store apps - CNET - http:// klou.tt/1wfjzx7jzijh1;;
0;0;@jofish was wondering if you would be in the UK next year, would love to discuss a Microsoft HCI event I am running. Thanks;@jofish;
1;0;Rise of the Tomb Raider Is Being Published By Microsoft | @IGN #TombRaider #Xbox http://www. ign.com/videos/2014/12 /09/rise-of-the-tomb-raider-is-being-published-by-microsoft-ign-news …;@IGN;#TombRaider #Xbox
0;0;Destiny ( Microsoft Xbox One, 2014) $37.00 via eBay http:// ift.tt/12pxflF;;
0;1;Great feedback to the news that Office365 will be available from Microsoft 's new Sydney data centres, that will have a real speed lift;;
0;0;It just looks like Microsoft is trying to be cute and word things in a way to trick people into believing RotTR will be Xbone exclusive.;;
0;0;@FranXGameer NO RISE OF THE TOMB RAIDER IS PUBLISHED BY MICROSOFT IT WAS ANNOUNCED TODAY HAHAHAHHA;@FranXGameer;
0;0;I predict that Microsoft will get out of the business of trying sell Surface machines. They are really great tablets but just cost too much;;
0;0;Microsoft 70-635 honors weigh anchor display: nXAJjnQIo;;
0;0;iPrivate404: Microsoft opnieuw in beroep tegen dataverzoek Ierse e-mail via NUnl #data #ms #privacy http://www. nu.nl/internet/39487 08/microsoft-opnieuw-in-beroep-dataverzoek-ierse-e-mail.html … Protect Ame...;;#data #ms #privacy
1;0;Microsoft gibt Visual Studio 2013 Community - Cross-Plattform-Entwicklung für Web, Android und iOS #Programmierung http://www. linux-community.de/Internal/Nachr ichten/Kooperationen/Microsoft/Cross-Plattform-Entwicklung-fuer-Web-Android-und-IOS …;;#Programmierung
0;0;With Windows 10, Microsoft could move to a subscription-based model - http:// revealedtech.com/computer-syste m/with-windows-10-microsoft-could-move-to-a-subscription-based-model/ … pic.twitter.com/4HYwz2HNWR;;
0;0;Microsoft CEO Nadella visits DC to promote cloud products for federal use - The company announced that... http:// tmblr.co/ZXg2pn1XcNR85;;
0;0;It’s official: Microsoft buys email app maker Acompli for reported $200M http:// ow.ly/FBwgz;;
0;0;[newegg] 내일 아침 7시 Microsoft Xbox 360 Common Controller Winxp (52A-00004) ($15/무료) http:// goo.gl/R4sG9X #ppomppu #뽐뿌;;#ppomppu #
0;0;Microsoft opens Azure cloud just for US government surveillance - At its Cloud for Government Summit in... http:// tmblr.co/ZXg2pn1XcNQZm;;
0;0;RISE OF THE TOMB RAIDER será publicado por Microsoft . ¿Exclusividad a la vista? http://www. alfabetajuega.com/noticia/micros oft-sera-la-encargada-de-publicar-rise-of-the-tomb-raider-y-no-square-enix-n-46366?utm_campaign=videojuegos&utm_source=twitter&utm_medium=social … pic.twitter.com/TiNHrzuWOa;;
0;0;microsoft flight simulator x coming to steam next week thanks to dovetail http:// bit.ly/1yNp6UR;;
0;0;Bill Gates admits Control-Alt-Delete was a mistake, blames IBM: http:// bit.ly/1D53OpL #microsoft;;#microsoft
0;0;Od @mediaofpoland Nocny hackaton Microsoft Night of Living Devs w Katowicach i Poznaniu:   Następ... http:// bit.ly/1GgEWrd #radio #news;@mediaofpoland;#radio #news
0;0;Od @mediaofpoland Nocny hackaton Microsoft Night of Living Devs w Katowicach i Poznaniu:   Następ... http:// bit.ly/1GgEWrd #radio #news;@mediaofpoland;#radio #news
0;0;#Empleo #Baleares Programador Senior Microsoft Dynamics Nav: DYNASOFT SPAIN SL. - Islas Baleares - Se... http:// empleo.besturl.es/8cH6 #Trabajo;;#Empleo #Baleares #Trabajo
0;0;Microsoft 70-693 braindumps mass meeting: pvPbA;;
0;0;Anytime Microsoft does something apparently it's born of evil, but when Sony does it, it's just another win for the home team ¬_¬;;
0;0;Microsoft ’s Strange Quest for the Topological Qubit http://www. technologyreview.com/featuredstory/ 531606/microsofts-quantum-mechanics/ … > @TechReview;@TechReview;
0;0;Microsoft drops AT&T Lumia 520 to $29; available on Amazon and Microsoft Store - Inferse http:// goo.gl/ty3gxP;;
0;0;Microsoft extends fed-only cloud: New offerings build on FedRAMP-certified service, firm says. http:// bit.ly/1vLZI0J #news;;#news
0;0;محاضرة ألقاها بيل جيتس من أغنى رجال العالم ومؤسس شركة Microsoft " تحت عنوان: 10 قواعد لا تدرسها في المدرسة :: 000... http:// fb.me/3ynsnmFbn;;
0;0;WordPress on Azure: The “Awesome” Choice Saves Microsoft 75 Percent of Hosting Costs https:// customers.microsoft.com/Pages/Customer Story.aspx?recid=11000&mkt_tok=3RkMMJWWfF9wsRohu6rKZKXonjHpfsX%2F7u0lUK6g38431UFwdcjKPmjr1YIBTcNjI%2BSLDwEYGJlv6SgFS7XCMadx37gOUxM%3D …;;
0;0;محاضرة ألقاها بيل جيتس من أغنى رجال العالم ومؤسس شركة Microsoft http:// shar.es/13vJuW via @sharethis;@sharethis;
0;1;Look at the hypocrisy...people find out Rise of the Tomb Raider is being published by Microsoft and it's a crime. Oh but SFV is fine though;;
0;0;Microsoft insists feds can’t take data stored in Ireland: If U.S. prosecutors can reach into a Microsoft server in… http:// dlvr.it/7mq0Sz;;
0;0;shouldnt: Ariana Grande sounds like a font on Microsoft Word http:// tmblr.co/ZdNKTv1XcN3BE;;
0;0;New on Ebay: FIFA 14 ( Microsoft Xbox One, 2013) http:// ift.tt/1qrFbOr pic.twitter.com/2FqT0ESVc4;;
0;0;محاضرة ألقاها بيل جيتس من أغنى رجال العالم ومؤسس شركة Microsoft " تحت عنوان: 10 قواعد لا تدرسها في المدرسة :: http:// ift.tt/12pwBEP;;
0;0;[ITmedia] Microsoft 、7件のセキュリティ情報を公開 「緊急」は3件 http:// goo.gl/fb/hijeGL;;
0;0;Ubuntu Core first on Microsoft @azure lolwut;@azure;
0;0;Microsoft Dynamics CRM Online Meeting the Needs of Government Customers - Microsoft Dynamics Blog #MSDynCRM @RLSTUTZ https:// community.dynamics.com/b/msftdynamics blog/archive/2014/12/09/microsoft-dynamics-crm-online-meeting-the-needs-of-government-customers.aspx …;@RLSTUTZ;#MSDynCRM
0;1;También es #DobleMoral redactar un panfleto en #Word instalado en #Windows (pirata por cierto) describiendo lo Diabólico que es #Microsoft;;#DobleMoral #Word #Windows #Microsoft
0;2;If you were in the middle of something, the information you were working on may be lost. Microsoft Word will attempt to recover your work.;;
0;0;[ITmedia エンタープライズ] Microsoft 、7件のセキュリティ情報を公開　「緊急」は3件 http:// bit.ly/1B3Qjli;;
0;0;#Windows NEW Microsoft Surface Pro 3 64GB w/ Black Type Cover + Headphone +Speakers +Hdmi: $849.00 (0 Bids)En... http:// ebay.to/1vLZs1K;;#Windows
0;0;Uhm... in Microsoft stanno seriamente meditando di farmi restare con Windows 7 ancora per qualche anno? http:// fb.me/1M9TBlOGj;;
0;0;Microsoft is losing it Win8 is crap and they have no new ideas boring windows;;
