retweets;favorites;text;mentions;hashtags
0;2;Free Xbox Live Gold 12mo - Free 4200 Microsoft Points! http:// shar.es/u4p6d vía @sharethis;@sharethis;
0;0;Microsoft 、9万人超える社員にSurface、WP8スマホ、Win8 PCを配布 | ガジェット速報 - http:// ggsoku.com/2012/09/micros oft-early-winter-holiday/ … タダなら欲しい( ・ω・);;
0;0;Microsoft ‘office’ 2013: Do You Know The Additional Features?: Customer preview of Microsoft ‘office’ 2013 can b... http:// bit.ly/OpusLu;;
0;0;How you can Set Microsoft Security Necessities to Personalize a Restore Point Before Using Adware and spyware Ac... http:// bit.ly/Opusvg;;
0;0;Quick Takes: RIM's Marketing, Microsoft Takes Even More Risks, and A Lesson from Digg http:// is.gd/hpqHa7;;
0;0;#Tech Microsoft SkyDrive vs. Google Drive on Android - CNET: V3.co.ukMicrosoft SkyDrive vs. Google Drive o... http:// bit.ly/R6rQD4 #News;;#Tech #News
0;0;Microsoft SkyDrive vs. Google Drive on Android - CNET: V3.co.ukMicrosoft SkyDrive vs. Google Drive o... http:// bit.ly/R6rQD4 #Tech #News;;#Tech #News
0;0;Microsoft Kinect for Xbox 360, You Are the Controller!! http:// amzn.to/nbF47h #Game #Console #Xbox360 #Kinect;;#Game #Console #Xbox360 #Kinect
0;0;Microsoft announces London studio for tablet-based entertainment http:// adf.ly/Cq80Y Read on here;;
0;0;Me ha gustado un vídeo de @YouTube .de @djprieto_y_neta http:// youtu.be/Mc-ZBD3DHI4?a Microsoft registra los dominios Halo;@YouTube @djprieto_y_neta;
1;4;Microsoft SkyDrive vs. Google Drive on Android http:// cnet.co/R6xu8g;;
0;0;Microsoft SkyDrive vs. Google Drive on Android - CNET http:// bit.ly/SmivHM;;
0;0;The keynote session was delivered by Ward Ralston, Director in the Windows Server and Management Group from Microsoft … http:// lnkd.in/bTEXB6;;
0;0;Tech Business Report: Microsoft 's GIFTS To Employees, Google Glass PRAISED http:// goo.gl/tbhNi;;
0;0;no we received a DMCA from Microsoft ( @YouTube http:// youtu.be/HRr0b84eS5Y?a );@YouTube;
0;0;RT @bizjournals : How would your rate this perk? -- Microsoft to give employees free tablets, PCs, phones http:// flpbd.it/2PFAj via @PSBJ;@bizjournals @PSBJ;
0;0;Microsoft Office 2007 http:// wp.me/pUrgQ-gM;;
0;0;$ MSFT Microsoft Corporation News: Microsoft Corporation (MSFT) Surface Knockoff Already Surfacing? http:// bit.ly/Qq0Wr7;;
0;0;#Tech Microsoft announces London studio for tablet-based entertainment http:// goo.gl/qRKaL #Onlireeks;;#Tech #Onlireeks
0;0;News UK : Microsoft announces London studio for tablet-based entertainment - TechRadar UK: DevelopMicrosoft anno... http:// bit.ly/R6uuss;;
0;0;Travis I guess Microsoft is banking on the death of the desktop/laptop. Powell;;
0;1;windows xpのwindows updateでskype5.10の更新きた。えーと、skypeって microsoft に買収されたんだっけか。;;
0;0;Willie I guess Microsoft is banking on the death of the desktop/laptop. Tiano;;
0;0;An Awesome Graphic Showing The Collapse Of The Microsoft -Intel Monopoly http://www. businessinsider.com/wintel-monopol y-2012-9?utm_source=twbutton&utm_medium=social&utm_campaign=sai … via @sai;@sai;
7;0;http://www. youtube.com/watch?v=Mc-ZBD 3DHI4&feature=youtube_gdata_player … MICROSOFT REGISTRA HALO 7.8.9;;
0;0;http:// Outak.com Microsoft SkyDrive vs. Google Drive on Android - CNET: GeekWireMicrosoft SkyDrive vs. Google... http:// bit.ly/R6rQD4;;
0;1;How you like them apples microsoft;;
0;0;Introducing Microsoft ｮ SQL Serverｮ 2012: Ross Mistry, Stacia Misner #BOOK #Kindle http:// amzn.to/Kfh0xA #Amazon #USA;;#BOOK #Kindle #Amazon #USA
0;0;Microsoft SkyDrive vs. Google Drive on Android - CNET http:// bit.ly/U4hZlS;;
0;0;GeekWireMicrosoft SkyDrive vs. Google Drive on AndroidCNETWith Microsoft SkyDrive recently touching down on Goog... http:// bit.ly/R6rQD4;;
2;0;Microsoft gifts full-time employees with Surface tablets, Windows 8 phones and PCs http:// zite.to/R2k8d9 @bnharris2011 did you get one?;@bnharris2011;
0;0;“ @IGN : Halo 7, 8, and 9 web domains secured by Microsoft http:// go.ign.com/SmdHSs ” oh no...;@IGN;
0;0;' Dennaziaa makes me sick! Aha that's why Microsoft cant spell Your name!;;
0;0;Zune Bundle 30 GB Digital Media Player (White) w/ Microsoft Docking Station & BlueProton 1GB USB 2.0 Flash Drive http:// bit.ly/R6xdSW;;
0;0;iPhone/iPad 値下げアプリ情報！ ♪2000円⇒700円♪ 『Master in 24h™ for Microsoft ® Office® 2010』(電子書籍) | http:// tinyurl.com/3bz8hdj #appinfojp_pd;;#appinfojp_pd
0;0;How can i get Microsoft Works for free?;;
0;0;Microsoft didn't take our server down they requested intimidate take down or ( @YouTube http:// youtu.be/FcDtGYU8h3Q?a );@YouTube;
0;0;Microsoft SkyDrive vs. Google Drive on Android - CNET http:// bit.ly/RQMUCT #android;;#android
0;0;Tech Business Report: Microsoft 's GIFTS To Employees, Google Glass PRAISED http:// goo.gl/tbhNi;;
5;1;¿Eres Estudiante y quieres Trabajar en Microsoft ? - Nota: Valido solo para Mexico via Rubén Mugártegui Paulín - @Mugartegui;@Mugartegui;
0;0;Microsoft Visual Studio Ultimate 2012 French - MSDN Untouched: Microsoft Visual Studio Ultimate 2012 French - MS... http:// bit.ly/TUzBSM;;
0;0;Microsoft snaps up Halo 7, 8, and 9 domains. Also Halo 4 UNSC Weapon Video http:// fb.me/WLisVF5b;;
1;0;Microsoft SkyDrive vs. Google Drive on Android: http:// cnet.co/R1BEUw #Technology;;#Technology
0;0;Empregos - Ceará Analista de Suporte Sênior Microsoft  Exchange (3N) http:// dlvr.it/28tPNJ;;
0;0;Microsoft PowerPoint 2003 http:// wp.me/pUrgQ-gK;;
0;0;NIIT inks pact with Microsoft ... http:// is.gd/vxm0qh #News #Technology;;#News #Technology
0;0;An Awesome Graphic Showing The Collapse Of The Microsoft -Intel Monopoly by @hblodget http:// bit.ly/PjpP89;@hblodget;
0;0;Wie man eine 2007 Microsoft Document Mit Windows 2003 öffnen http:// dlvr.it/28tP7M;;
0;0;Look at this New post: Microsoft Expected To Set Surface Tablet Cost $299 Or Less http://www. s1m.us/pigetter/archi ves/2105 …;;
0;0;Microsoft Visual Studio 2012 Reviewed http:// bit.ly/Q09OTT;;
1;0;ayanna's dumbass didn't know how to work microsoft word;;
0;0;Microsoft SkyDrive vs. Google Drive on Android: Android users looking for a cloud storage and file-syncing solut... http:// bit.ly/R1ulMF;;
0;0;Microsoft finds malware hidden in new computers in China http:// cnet.co/Nr4E67 via @CNET;@CNET;
0;0;Microsoft files patent to bring Star Trek's 'Holodeck' to future Xbox consoles http:// bit.ly/OfMy2B via @MailOnline;@MailOnline;
0;0;RT @workinthecloud : #SaaS How Microsoft Redesigned HQ For Productivity - Gizmodo Australia: How Microsoft Redesi... http:// bit.ly/U4hIiN;@workinthecloud;#SaaS
0;0;RT @workinthecloud : #SaaS How Microsoft Redesigned HQ For Productivity - Gizmodo Australia: How Microsoft Redesi... http:// bit.ly/U4hIiN;@workinthecloud;#SaaS
0;0;http:// Jobs4USA.info : Database organization and internet searching - Admin Assistant Data Entry Microsoft E... http:// bit.ly/OpppuP #jobs;;#jobs
0;0;RT Microsoft SkyDrive vs. Google Drive on Android - CNET http:// bit.ly/PrxM9W -> gotta love online drives.;;
0;0;http:// Jobs4USA.info : Database organization and internet searching - Admin Assistant Data Entry Microsoft E... http:// bit.ly/R6wTUc #jobs;;#jobs
0;0;http:// Jobs4USA.info : Database organization and internet searching - Admin Assistant Data Entry Microsoft E... http:// bit.ly/R6wTUc #jobs;;#jobs
0;0;Google Doesn’t Require Google Search On Android, Despite What FairSearch & Microsoft Want You To Believe (Danny Sull... http:// bit.ly/PCkYB1;;
0;0;Microsoft SkyDrive - Online document storage and file sharing http:// fb.me/1Yr2VJ9oB;;
0;0;Microsoft Word 2003 & PowerPoint http:// wp.me/pUrgQ-gI;;
0;0;Microsoft SkyDrive vs. Google Drive on Android - CNET http:// bit.ly/R6rQD4 @inkfield;@inkfield;
1;0;Lee Schuneman director de producción de Rare se encargará de dirigir el nuevo estudio de Microsoft en Londres que se dedicará a Windos 8.;;
0;0;Whack off to silence your pesky smartphone: Microsoft 's awesome mobile patent application http:// goo.gl/71Mvu;;
0;0;#Microsoft descobre que PCs já saem de fábrica com vírus - http:// goo.gl/zqaUb;;#Microsoft
0;0;Microsoft 、｢Windows 8｣ではパッケージ版を発売しない意向か?! http:// taisy0.com/2012/09/15/936 5.html …;;
0;0;#party News Bits: Weezer Rocking Microsoft Retail Store Opening + More: – Not to be outdone by App... http:// bit.ly/R1B6y0 #radio #music;;#party #radio #music
0;0;Microsoft Access 2010 (X64 X86) http:// goo.gl/fb/KEslK;;
0;0;Shoes for Florida Microsoft came in today!!! 6 days until the trip begins!!! http:// instagr.am/p/Pky0vztKKI/;;
0;0;Microsoft announces London studio for tablet-based entertainment: Microsoft will open a new London studio, which... http:// bit.ly/R6wHnT;;
0;0;RT @IGN : Halo 7, 8, and 9 web domains secured by Microsoft http:// go.ign.com/SmdHSs;@IGN;
0;0;ソフトウェアのヒット商品→ ９位： Microsoft Office 2007 Standard http:// amzn.to/U2B33W #ソフトウェア;;#
3;0;"Same ol shit just a differant day, We ain't no Microsoft entrepreneurs still their stacking are bills higher than gates" #TargetTheIndustry;;#TargetTheIndustry
0;0;Microsoft adquiere los dominios Halo 7, Halo 8 y Halo 9. http:// goo.gl/fb/d5Ehd #Videojuegos #PC;;#Videojuegos #PC
0;0;Microsoft Unveils Surface Tablet http:// tf.to/ayt2d;;
0;1;Microsoft SkyDrive vs. Google Drive on Android - CNET http:// bit.ly/PrxM9W;;
0;0;Microsoft to Give New Tablets, Windows Phones and PCs to Employees http:// ow.ly/dI3dX;;
0;0;Join @HPStorageGuy in TechCast series. Insights from #VMworld & recent Microsoft Windows annc. http:// bit.ly/Qp3ypf #HPStorage;@HPStorageGuy;#VMworld #HPStorage
0;0;Brand New Unopened Microsoft Arc Wireless keyboard ( Delta/Surrey/Langley ) $40.00 http:// bit.ly/UUuCzi ►Vancouver, BC;;
0;0;Microsoft SkyDrive vs. Google Drive on Android - CNET http:// bit.ly/PrxM9W;;
0;1;Microsoft のメールサービスは何故「Hotmail」というのだろう。メールを運ぶときに懐に忍ばせて暖めていたりするのだろうか。パソコン界の木下藤吉郎なのだろうか。;;
0;0;Tech Business Report: Microsoft 's GIFTS To Employees, Google Glass PRAISED http:// goo.gl/tbhNi;;
0;0;Microsoft a attigim mail bence takdir edilesi :) yarin kapimda hediye paketinde bir windows 3.1 disketi bulursam sasirmam :);;
0;0;Microsoft announces London studio for tablet-based entertainment - TechRadar UK: DevelopMicrosoft announces Lond... http:// bit.ly/R6uuss;;
0;0;#happyhour #tgif #bellevue #stresslessinseattle @Microsoft City Center Plaza http:// instagr.am/p/PkyvQ5NfzL/;@Microsoft;#happyhour #tgif #bellevue #stresslessinseattle
0;0;Microsoft Tries To Patent the Holodeck! (Well, Almost) http:// bit.ly/UUuz6J;;
4;1;RT @EYEONIPP: RT @PCMag Microsoft , the International Police Force http:// goo.gl/Q7vDh via @therealdvorak;@EYEONIPP @PCMag @therealdvorak;
0;0;Microsoft entregará un computador, una Surface y un smartphone a todos sus empleados http://www. emol.com/noticias/tecno logia/2012/09/14/560537/microsoft-entregara-un-computador-una-surface-y-un-smartphone-a-todos-sus-empleados.html … vía @Emol;@Emol;
0;0;#linux #netfilter Problem to shape Microsoft Remote Desktop traffic http:// dlvr.it/28tN0K;;#linux #netfilter
0;0;Microsoft to give all employees free Surface tablets and Windows Phone 8 devices http:// dlvr.it/28tMxy;;
0;0;Microsoft to give all employees free Surface tablets and Windows Phone 8 devices http:// dlvr.it/28tMxT;;
0;0;Whack off to silence your pesky smartphone: Microsoft ’s awesome mobile patent application http:// tnw.to/n4Mz via @TNWmicrosoft;@TNWmicrosoft;
0;0;@abeshkov из Microsoft На выпущенных в Китае новых компьютерах обнаружили вирусы http:// lenta.ru/news/2012/09/1 4/nitol/ …;@abeshkov;
0;0;Microsoft SkyDrive vs. Google Drive on Android http:// dlvr.it/28tMw9;;
0;0;Microsoft registra los dominios Halo 7, 8 y 9 http:// feedproxy.google.com/~r/niubie/~3/e JiOY1CMb6U/story01.htm …;;
0;0;Microsoft applies 'surgical sinkhole' to strangle botnet installed on new PCs http:// shar.es/u4g9H via @computerworld;@computerworld;
0;0;Microsoft Word 2003, Excel & PowerPoint http:// wp.me/pUrgQ-gG;;
0;0;Microsoft découvre des PC infectés dès l'usine - http:// goo.gl/news/QFFH via http:// news.google.com;;
0;0;Valencia y Maracaibo presente en Foro Latinoamericano de Docentes Innovadores de Microsoft http:// goo.gl/fb/Kv6WW;;
0;0;Car Bean Bag Dash & Windshield Holder for the Microsoft Zune 4GB / 8GB - Gomadic Brand: Our New Gomadic Bean Bag... http:// amzn.to/UUum3w;;
0;0;Microsoft SkyDrive vs. Google Drive on Android - CNET: News TribeMicrosoft SkyDrive vs. Google Drive on AndroidC... http:// bit.ly/TUyTEU;;
0;0;Google Apps dropping support for IE8 #google #googleapps http:// bit.ly/OptD5z #microsoft;;#google #googleapps #microsoft
0;0;Software Development Engineer-IEB- Microsoft Studios (809265) #job http:// jobsurl.com/R9pl;;#job
0;0;Microsoft SkyDrive vs. Google Drive on Android - CNET: News TribeMicrosoft SkyDrive vs. Google Drive on AndroidC... http:// adf.ly/Cq7bm;;
0;0;Microsoft admits millions of computers could be infected with malware before they’re out of the box http:// fb.me/1Ba8g5v6D;;
0;0;Microsoft to give all employees free Surface tablets and Windows Phone 8 devices - http:// tinyurl.com/9qb9uhj;;
0;0;"IGN Article - Halo 7, 8, 9 Websites Purchased by Microsoft via @addthis " NO, WHY. DON'T DO THIS. DON'T YOU DARE. http:// m.ie.ign.com/articles/2012/ 09/14/halo-7-8-9-websites-purchased-by-microsoft …;@addthis;
0;0;Microsoft SkyDrive vs. Google Drive on Android - CNET: News TribeMicrosoft SkyDrive vs. Google Drive on AndroidC... http:// bit.ly/R6rQD4;;
0;0;Webinar Oct 9th – Microsoft CRM for Wholesale Distributors http:// bit.ly/RQMoos #crmipad;;#crmipad
0;0;#Microsoft admits millions of computers could be infected with #malware before they're even out of the box;;#Microsoft #malware
0;0;Microsoft SkyDrive vs. Google Drive on Android: Android users looking for a cloud storage and file-s... http:// bit.ly/OpqimR #Tech #News;;#Tech #News
0;0;Microsoft に電話してライセンス認証し直す簡単なお仕事 なのに10分かかる;;
0;0;Whack off to silence your pesky smartphone: #Microsoft ’s awesome mobile patent application http:// dlvr.it/28tMNN;;#Microsoft
0;0;Microsoft Flight Simulator X: Gold Edition is $25.99 for PC on Amazon! In stock on September 17, 2012. http://www. amazon.com/Microsoft-Flig ht-Simulator-X-Edition-Pc/dp/B001DPZE84/ref=zg_bs_4924894011_13/190-2940642-6495104&tag=d082ha9ud-20&bdnd=120914165205 …;;
0;0;Tech Business Report: Microsoft 's GIFTS To Employees, Google Glass PRAISED http:// goo.gl/tbhNi;;
1;1;http:// cnet.com : Microsoft SkyDrive vs. Google Drive on Android: Android users looking for a cloud storage a... http:// cnet.co/R1Abh0;;
0;0;#IFollowBack Microsoft SkyDrive vs. Google Drive on Android - CNET http:// goo.gl/fb/QbKLJ;;#IFollowBack
0;0;Microsoft SkyDrive vs. Google Drive on Android: With Microsoft SkyDrive recently touching down on Google Drive's... http:// adf.ly/Cq7Z7;;
0;0;http:// hu.lk/lsxymagfwh6x Microsoft SkyDrive vs. Google Drive on Android: With Microsoft SkyDrive... http:// bit.ly/UUue3U @tscinho 4 news updt;@tscinho;
0;0;[Redmond Report] Microsoft 's User Experience Virtualization Tool Available as Release Candidate: Microsoft last ... http:// bit.ly/R1c9ml;;
0;0;#geordi3B0y Microsoft SkyDrive vs. Google Drive on Android - CNET http:// goo.gl/fb/Oh01Q;;#geordi3B0y
0;0;Microsoft SkyDrive vs. Google Drive on Android - CNET http:// bit.ly/TUyFxR;;
0;0;Microsoft SkyDrive vs. Google Drive on Android - CNET http:// bit.ly/PrxiAt;;
0;0;#TechNews Microsoft SkyDrive vs. Google Drive on Android via CNET http:// tinyurl.com/9bhpwgb;;#TechNews
0;0;Microsoft SkyDrive vs. Google Drive on Android - CNET http:// goo.gl/fb/3VJeR #technology;;#technology
0;0;Microsoft SkyDrive vs. Google Drive on Android - CNET: V3.co.ukMicrosoft SkyDrive vs. Google Drive on AndroidCNE... http:// adf.ly/Cq7XS;;
0;0;Whack off to silence your pesky smartphone: Microsoft ’s awesome mobile patent application http:// goo.gl/fb/YVkow;;
0;0;Neowin has spent the better part of this week up in Microsoft 's neighborhood and among the… http:// goo.gl/fb/do62J;;
0;0;Di microsoft word aja nanti taro di fd nanti kasih ke aul biar di print RT @andiniamalina : @Windagista mih nih dirangkumnya dibuku;@andiniamalina @Windagista;
0;0;Going to return this gay ass game stop controller & get my Microsoft controller then game :);;
0;0;創業17年か、早いもんだ。eBAYが、ロゴを変えた。色はそのままで文字の重なりをやめ字体をいま風に。（そういゃ Microsoft もロゴ変えたな…）会社もいろいろなタイミングでの、気分転換。 必要だな。コストはかかるが。;;
0;0;Microsoft adquiere los dominios Halo 7, Halo 8 y Halo 9. http:// feedproxy.google.com/~r/portalmbpc/ ~3/EiY8rAYRwrU/ …;;
0;0;Wtf microsoft secured the domains for halos 7,8,9;;
0;0;Gary Rothfeld MD Microsoft SkyDrive vs. Google Drive on Android - CNET: GeekWireMicrosoft SkyDrive vs. Google Dr... http:// bit.ly/R6sY9Z;;
0;0;Microsoft SkyDrive vs. Google Drive on Android - CNET http:// bit.ly/R6sY9Z;;
0;0;ACAVO DE RACIVIR Free Xbox Live Gold 12mo - Free 4200 Microsoft Points! http:// shar.es/u4ghU vía @sharethis;@sharethis;
0;0;Whack off to silence your pesky smartphone: Microsoft 's awesome mobile patent application http:// dld.bz/bMAvr;;
0;0;Microsoft and The xx collaboration @visualization ... sweet http:// buff.ly/Na2Luc;@visualization;
0;0;Microsoft finds malware hidden in new computers in China - CNET (blog): Daily Mail Microsoft … http:// bit.ly/TechN;;
0;0;damn now i have to hunt someone down with a microsoft office cd. i refuse to buy that shit son.;;
0;0;Tech Business Report: Microsoft 's GIFTS To Employees, Google Glass PRAISED http:// goo.gl/tbhNi;;
0;0;http:// cnet.co/Q9TiR6 Microsoft SkyDrive vs. Google Drive on Android With Microsoft SkyDrive recently touching down on Google Drive's te...;;
0;0;Me compre una app para mi ipad que segun esto era microsoft word, me meto y no sirve. Aaaaaaaahhhh!!!;;
0;0;@OmarDirie_ Thanks Microsoft :);@OmarDirie_;
0;0;Microsoft 3.5mm Earphone / Handsfree Splitter (White) mp3: Microsoft 3.5mm Earphone / Handsfree Splitter (White)... http:// amzn.to/x53Oof;;
0;0;http:// hypered.mx : Microsoft abre nuevo estudio para juegos Surface - LEVELUP http:// bit.ly/Slno3C;;
0;0;ATTENTION!Whack off to silence your pesky smartphone: #Microsoft ’s awesome mobile patent application http:// goo.gl/TQEGM;;#Microsoft
6;0;"An Awesome Graphic Showing The Collapse Of The Microsoft -Intel Monopoly" http:// read.bi/ONwwi6;;
0;0;#android Microsoft SkyDrive vs. Google Drive on Android - CNET: News TribeMicrosoft SkyDrive vs. Google ... http:// bit.ly/R6rQD4 #market;;#android #market
0;0;How is it that I have a Microsoft point value that ends in 10? Someone explain that to me.;;
0;0;“ @socialmedia_nws : Whack off to silence your pesky smartphone: Microsoft ’s awesome mobile patent application http:// dlvr.it/28tJ7W ”;@socialmedia_nws;
0;0;@Microsoft - BUY #ACER ALREADY;@Microsoft;#ACER
57;42;Malware present on PCs before they even reach stores, says Microsoft http:// bit.ly/QMIPxu;;
0;0;一瞬SunOSのパッケージに見えた / “ Microsoft 、｢Windows 8｣ではパッケージ版を発売しない意向か?!” http:// htn.to/j1iVQ8;;
0;0;Halo 7, 8, 9 Websites Purchased by Microsoft http:// dlvr.it/28tLHK;;
0;0;Microsoft expected to offer Office 2013 upgrades in October ( #Microsoft )... http:// bit.ly/PjLtt6;;#Microsoft
0;0;Graduation speech: "I'd like to thank the Internet, Google, Wikipedia, Microsoft , and Copy-Paste...";;
0;0;http:// Iwebslog.com - Microsoft SkyDrive vs. Google Drive on Android: Android users looking for a cloud st... http:// l.mytr.in/PrwNGG #Excel;;#Excel
0;0;Free Xbox Live Gold 12mo - Free 4200 Microsoft Points! http:// shar.es/u4grt vía @sharethis;@sharethis;
0;0;Microsoft offers $30 of coupons for pre-ordering Resident Evil 6 http:// bit.ly/OvxhAl #geek;;#geek
0;0;Tech Business Report: Microsoft 's GIFTS To Employees, Google Glass PRAISED http:// goo.gl/tbhNi;;
0;0;Enter to #Win a copy of #Microsoft @Office for PC or Mac! #Rafflecopter #Giveaway at @amomstake Ends 9/14 http://www. amomstake.com/2012/08/micros oft-office-2010-back-to-school-routine-idea-review-giveaway/ …;@Office @amomstake;#Win #Microsoft #Rafflecopter #Giveaway
0;0;Eventos da Nintendo são necessariamente melhores do que os da Sony e da Microsoft só por ter o Reggie;;
0;0;browsing:" Microsoft Windows - Wikipedia" http:// ja.wikipedia.org/wiki/Windows;;
0;1;waw, free windows 8 installer from microsoft;;
0;0;Microsoft to give all employees free Surface tablets and Windows Phone 8 devices - http:// tinyurl.com/9vycyzh;;
0;0;Microsoft SkyDrive vs. Google Drive on Android - http:// tinyurl.com/8egp8rn;;
0;0;Microsoft SkyDrive vs. Google Drive on Android: http:// cnet.co/RQLU1A http:// bit.ly/4zfDyS;;
0;0;Nova versão do Skype ganha integração com Windows Live ID: Adquirido ano passado pela Microsoft , o Skype tornou-... http:// glo.bo/R1n6UT;;
0;0;Nova versão do Skype ganha integração com Windows Live ID: Adquirido ano passado pela Microsoft , o Skype tornou-... http:// glo.bo/Opt2AV;;
0;0;Nova versão do Skype ganha integração com Windows Live ID: Adquirido ano passado pela Microsoft , o Skype tornou-... http:// glo.bo/R1n6UT;;
0;0;LMAOO RT @IGN : Halo 7, 8, and 9 web domains secured by Microsoft http:// go.ign.com/SmdHSs;@IGN;
0;0;Google, Facebook, Microsoft join non-profit to promote internet’s awesomeness [VIDEO] http:// nakedsecurity.sophos.com/2012/09/14/goo gle-facebook-microsoft-join-non-profit-to-promote-internets-awesomeness/ …;;
0;0;Microsoft Wireless Desktop Comfort 5000 Keyboard and Mouse ( Calgary ) $15.00 http:// tinyurl.com/9gdjp7w ►Calgary, AB;;
0;0;Slightly too far. RT @IGN Halo 7, 8, and 9 web domains secured by Microsoft http:// go.ign.com/SmdHSs;@IGN;
0;0;New Event Listing - Microsoft Office 365 Workshop... http://www. events-near.com/microsoft_offi ce_365_workshop-town-events-manchester-great_britain.htm … #Manchester;;#Manchester
0;0;Microsoft Smartglass Review On http://www. forthevideogamer.tumblr.com /;;
0;0;@Microsoft SkyDrive vs. @Google Drive on #Android - @CNET : http:// tinyurl.com/9f9mjxf;@Microsoft @Google @CNET;#Android
0;0;RT @forbes : The Microsoft -Samsung Partnership Lifts Windows Phone's Prospects http:// bit.ly/Sl7HcK;@forbes;
0;0;#navteam Replacing Field Values in Microsoft Dynamics NAV 2013 http:// dlvr.it/28tKMB;;#navteam
0;0;Microsoft SkyDrive vs. Google Drive on Android http:// goo.gl/fb/YXyFC;;
0;0;@andrewburnett Waverley Gate, Microsoft office :);@andrewburnett;
0;0;Microsoft researchers have discovered computer systems infected with botnet malware before they're even taken out... http:// fb.me/1WT1emRnS;;
0;0;Your PC may come with malware pre-installed: Microsoft researchers have discovered computer systems infected wit... http:// bit.ly/PiY7sl;;
0;0;Microsoft is going all in with Windows 8 and Windows Phone 8: Microsoft is reportedly giving all employees new W... http:// bit.ly/UTTh78;;
0;0;Microsoft is reportedly giving all employees new Windows 8 PCs, Windows Phone 8 smartphones, and Microsoft ... http:// fb.me/24U9dZ3M9;;
0;0;Microsoft battles botnet pre-installed on systems: A batch of factory-fresh PCs from China are bearing malware, ... http:// bit.ly/R1yikj;;
0;0;Google Doesn't Require Google Search On Android, Despite What FairSearch & Microsoft Want You To Believe (Danny ... http:// bit.ly/UUhfiB;;
0;0;Microsoft is going all in with Windows 8 and Windows Phone 8: Microsoft is reportedly giving all employees new W... http:// bit.ly/R0jnae;;
0;0;Your PC may come with malware pre-installed: Microsoft researchers have discovered computer systems infected wit... http:// bit.ly/QZLtCo;;
0;0;Microsoft is going all in with Windows 8 and Windows Phone 8 http:// bit.ly/R1ySi9 #tech #news;;#tech #news
0;0;Your PC may come with malware pre-installed: Microsoft researchers have discovered computer systems infected... http:// adf.ly/Cq7F9 #PC;;#PC
0;0;Microsoft researchers have discovered computer systems infected with botnet malware before they're even taken ou... http:// bit.ly/QZLtCo;;
0;0;Microsoft is reportedly giving all employees new Windows 8 PCs, Windows Phone 8 smartphones, and Microsoft Surfa... http:// bit.ly/R0jnae;;
0;0;Microsoft battles botnet pre-installed on systems: A batch of factory-fresh PCs from China are bearing malware, ... http:// Sniip.us/42786;;
0;0;Your PC may come with malware pre-installed: Microsoft researchers have discovered computer systems infected wit... http:// Sniip.us/39552;;
0;0;Microsoft is going all in with Windows 8 and Windows Phone 8: Microsoft is reportedly giving all employees new W... http:// Sniip.us/68674;;
0;0;PCWorld: Your PC may come with malware pre-installed: Microsoft researchers have discovered computer ... http:// bit.ly/OpsWZW #IfbadNews;;#IfbadNews
0;0;PCWorld: Microsoft is going all in with Windows 8 and Windows Phone 8: Microsoft is reportedly giving... http:// bit.ly/PjLeOG #IfbadNews;;#IfbadNews
0;0;PCWorld: Microsoft battles botnet pre-installed on systems: A batch of factory-fresh PCs from China a... http:// bit.ly/U4gfZV #IfbadNews;;#IfbadNews
0;0;Microsoft is going all in with Windows 8 and Windows Phone 8: Microsoft is reportedly giving all employees new W... http:// bit.ly/R0jnae;;
0;0;Your PC may come with malware pre-installed: Microsoft researchers have discovered computer systems infected wit... http:// bit.ly/QZLtCo;;
0;0;Your PC may come with malware pre-installed: Microsoft researchers have discovered computer systems infected wit... http:// bit.ly/QZLtCo;;
