retweets;favorites;text;mentions;hashtags
0;0;I won 3 achievements in Microsoft Solitaire Collection (UWP) for 132 #TrueAchieveme ... https://www. trueachievements.com/gamer/RotorBla deUSMC …;;#TrueAchieveme
8;10;#SAP on #Microsoft Azure - Technical Overview; Are you new to SAP on Azure? Start here! https:// blogs.msdn.microsoft.com/azurecat/2017/ 07/14/sap-on-azure-technical-overview-are-you-new-to-sap-on-azure-start-here/ … #Azure #Cloud via @UserEd_ pic.twitter.com/nx36JEenvr;@UserEd_;#SAP #Microsoft #Azure #Cloud
0;6;OH YEAH I'M ALSO GIVING AWAY 100 PS5s THAT SONY PERSONALLY SENT TO ME TO GIVEAWAY AND 100 XBOX Xs PERSONALLY SENT BY MICROSOFT;;
0;0;WebApp? Is an insult being a company here by microsoft is a simple web app. that nasty;;
0;0;I actually don't know. You can look in the microsoft app store though, The specs are mean. Lol! You will need windows 10 etc.;;
0;0;How Microsoft brought SQL Server to Linux | TechCrunch - TechCrunch http:// ift.tt/2u3kzSF;;
0;1;Thanks for this. Yes, I make stuff like this the old fashioned way sometimes: Microsoft Word! #sschat;;#sschat
0;0;#MSFT Training News: Microsoft Professional Program data science capstone: students helping students http:// bit.ly/2tzinP2;;#MSFT
0;0;KPMG and Microsoft Boost Their Global Alliance https:// lnkd.in/dPrhpjf;;
0;0;New on Ebay Microsoft Xbox One 1TB 1540 Matte Black w/ box http:// ift.tt/2vbdu0x pic.twitter.com/dWqkhoYXOd;;
0;0;NOTICIAS | W10 Fall Creators Update permitirá elegir la cantidad de Internet que usas en actualizaciones #noticias #windows #microsoft #tech pic.twitter.com/rjWfanFAfR;;#noticias #windows #microsoft #tech
0;0;Fate of Pakistan's Prime Minister Sharif hangs by the thread of a Microsoft font http:// nbcnews.to/2v5YK3c;;
0;0;http:// ift.tt/2tzdZzM Microsoft が傘下のビジネスSNS「LinkedIn」のWindows 10アプリをリリースした（7月末までにローリングアウト完了予定）。アクションセンターやライブタイルにプッシュ通知が表示されるようになる。;;
0;0;How to enable and disable SMBv1, SMBv2, and SMBv3 in Windows and Windows Server via @Microsoft https:// support.microsoft.com/en-us/help/269 6547/how-to-enable-and-disable-smbv1-smbv2-and-smbv3-in-windows-and-windows …;@Microsoft;
0;0;How Microsoft brought SQL Server to Linux | TechCrunch https:// techcrunch.com/2017/07/17/how -microsoft-brought-sql-server-to-linux/ …;;
1;1;LEIVIA RATE SON 5EME JOUR SANS CRACHER JE LE RETROUVE CHER MICROSOFT POUR PLACEMENT DE PRODUIT;;
0;0;Microsoft brengt Windows 10-app van LinkedIn uit - http://www. nieuws-suriname.nl/microsoft-bren gt-windows-10-app-van-linkedin-uit/ … Gratis App - http:// bit.ly/1Hb6P9J;;
0;0;El lanzador de Microsoft para Android, Arrow Launcher, se actualiza, conoce las novedades http://www. iosmovil.com/el-lanzador-de -microsoft-para-android-arrow-launcher-se-actualiza-conoce-las-novedades/ … pic.twitter.com/UphnMklahz;;
0;0;Yeah i did. Just trying to wonder what direction they are going to go. Don't think they can compete with sony and microsoft but nintendo yes;;
0;0;Wow, Alex just pops off his negative spew on people he has no clue??? LOL Crazy Fucker. Just have to overlook him. pic.twitter.com/ZJ7FUDwzh9;;
0;0;Microsoft Surface Laptop Review: Very Stylish And Secure – UNILAD https:// dailymarkhor.com/microsoft-surf ace-laptop-review-very-stylish-and-secure-unilad/ … pic.twitter.com/6npjpjIOQB;;
0;0;#Ad : Microsoft Xbox 360 E (1538) 500 GB, Black, Video Gaming Console / System http:// dlvr.it/PWK7Jw pic.twitter.com/S0akoCIcDu;;#Ad
0;0;cc: @Microsoft pic.twitter.com/D3xkmB71yn;@Microsoft;
0;0;Adobe Photoshop Elements 15 at Microsoft Store - https:// goo.gl/XNXndv Get A 30% Off Adobe Photoshop Elements 15 #Coupons #Shopping;;#Coupons #Shopping
0;0;#AlgerianStartup Dalil vs. #Microsoft | SOCIAL INNOVATION| Empowering people who are blind | Microsoft 's Seeing AI a… https:// goo.gl/kEwjXF;;#AlgerianStartup #Microsoft
0;0;wow ladies, fix all the issues we got now in 16241;;
0;0;Madden NFL 17 - Microsoft Xbox One Game - Complete http:// dlvr.it/PWK6sZ;;
0;0;My blog: Microsoft Feature Wishlist: Editable Grid for Adxstudio #CRM http:// blogs.infostrat.com/2016/09/micros oft-feature-wish-list-editable.html …;;#CRM
0;1;Cookies or chips? Your child’s choices may https:// goo.gl/Siqu2c #TuesdayMotivation #google #motivation #microsoft #crowdfunding #travel;;#TuesdayMotivation #google #motivation #microsoft #crowdfunding #travel
0;0;Conheça os 10 projetos para HoloLens que concorrem a US$ 100.000 em prêmio no concurso da Microsoft http:// dlvr.it/PWK6jZ pic.twitter.com/GpCPoIpx8Y;;
0;0;Enjoyed speaking with @ryotnews and trying out the microsoft HoloLens. . . . #computers … https://www. instagram.com/p/BWqrmMOgzg2/;@ryotnews;#computers
0;1;Widerwärtig sowas. Das Arbeitsleben wirklich erleichtern und nicht einfach nur damit werben... sind wir hier bei Microsoft oder was?!;;
0;6;This is what Microsoft 's Mac news page is nowadays https:// news.microsoft.com/mac/ pic.twitter.com/TuT6ootsvB;;
0;0;Our data says people are spending 134 minutes a day using Microsoft Outlook @outlook http:// bit.ly/1S9JRG7 #BigData #StopGuessing pic.twitter.com/yJEo70zPKt;@outlook;#BigData #StopGuessing
0;0;Microsoft Surface Pro 4 (M3,i5,i7 | 4,8,16GB RAM | 128,256,512,1TB) Windows 10 Price: ... #WindowsTablet https:// digitaldealer.co/microsoft-surf ace-pro-4-m3i5i7-4816gb-ram-1282565121tb-windows-10-578-49/ … pic.twitter.com/bb0FlycdpP;;#WindowsTablet
0;0;Our data says people are spending 134 minutes a day using Microsoft Outlook @outlook http:// bit.ly/1S9JRG7 #BigData #StopGuessing pic.twitter.com/9b0YzNAZVi;@outlook;#BigData #StopGuessing
0;0;Our data says people are spending 134 minutes a day using Microsoft Outlook @outlook http:// bit.ly/1S9JRG7 #BigData #StopGuessing pic.twitter.com/EF9Q8KL7Wa;@outlook;#BigData #StopGuessing
1;0;Conheça os 10 projetos para HoloLens que concorrem a US$ 100.000 em prêmio no concurso da Microsoft http:// ift.tt/2t9sXwO;;
0;0;Microsoft begins rolling out LinkedIn app for Windows 10 following $26.2B acquisition http:// bit.ly/2tzzdNE;;
0;3;Conheça os 10 projetos para HoloLens que concorrem a US$ 100.000 em prêmio no concurso da Microsoft http:// ift.tt/2t9sXwO;;
0;1;That I have already tried.;;
2;5;The worst career advice I ever received was "if you go to Microsoft you'll be a small fish in a big pond.";;
0;0;#AI for Earth: Microsoft ’s new program to put AI to work for the future of our planet: http:// hubs.ly/H0851Fl0 by @MSFTissues pic.twitter.com/aDzV12SbOS;@MSFTissues;#AI
0;0;8 Great Paul Allen Business Quotes http://www. myfrugalbusiness.com/2015/10/paul-a llen-business-quotes-microsoft-mike-schiemer.html … <---- Read #Microsoft #Quote #Windows #Tech #Quote #IT pic.twitter.com/0liObgMnaf;;#Microsoft #Quote #Windows #Tech #Quote #IT
0;0;The smartphone is eventually going to die, and Apple, Google, Microsoft , and Facebook are racing to kill it https:// lnkd.in/euDqt3x;;
0;0;Microsoft Translator for iOS receives a large update, brings new speech translation animation and more http:// ift.tt/2ut6uPd;;
2;1;RT @infoworld How will the cloud change IT? Look at Microsoft : https:// tinyurl.com/y95mlal7 by @DavidLinthicum #CloudComputing #IT pic.twitter.com/uPs37sKtgu;@infoworld @DavidLinthicum;#CloudComputing #IT
0;0;#Ad : Microsoft Xbox 360 E (1538) 500 GB, Black, Video Gaming Console / System http:// dlvr.it/PWK5xs pic.twitter.com/qpRjvBzTk3;;#Ad
0;0;#Ad : Microsoft Xbox 360 E (1538) 500 GB, Black, Video Gaming Console / System http:// dlvr.it/PWK5xl pic.twitter.com/voCJpKuIxv;;#Ad
0;0;#Ad : Microsoft Xbox 360 E (1538) 500 GB, Black, Video Gaming Console / System http:// dlvr.it/PWK5xW pic.twitter.com/gTK0aZwP9r;;#Ad
0;0;#Ad : Microsoft Xbox 360 E (1538) 500 GB, Black, Video Gaming Console / System http:// dlvr.it/PWK5wy pic.twitter.com/A1SLIaoSFR;;#Ad
0;0;Retweeted Microsoft Education ( @MicrosoftEDU ): Joining the #MSFTEduChat on 7/18? Here’s a look at the questions... http:// fb.me/1oxh11Cyr;@MicrosoftEDU;#MSFTEduChat
0;0;MSって聞くと、モビルスーツの略だと一瞬思う。 Microsoft Focus：Skypeとの使い分けは？　LINEとの置き換えは？ Microsoft Teamsの効果的な活用法 (1/2) - ITmedia エンタープライズ http://www. itmedia.co.jp/enterprise/art icles/1707/01/news007.html …;;
0;2;Also sticky notes!;;
0;0;Umm is that brownies?;;
1;0;In battle for enterprise, Goldman Sachs projects Microsoft will come out on top http://www. ciodive.com/news/in-battle -for-enterprise-goldman-sachs-projects-microsoft-will-come-out-on/447200/ … #Strategy #CIO #Technology pic.twitter.com/xAmVmtJBxP;;#Strategy #CIO #Technology
0;0;@Microsoft Press is offering discounts certification prep books. Windows Server 2016 is happening now @PCATT https://www. microsoftpressstore.com/promotions/sav e-up-to-55-on-exam-prep-books-ebooks-141071 … pic.twitter.com/IOlRJT9Wsq;@Microsoft @PCATT;
0;1;Microsoft #マイクラ #マイクラpe #Mirrativ で配信中！ https:// mirrativ.com/live/BixN5wO6N z0 …;;# # #Mirrativ
0;0;Anyone know anything about Microsoft Excel? I need a tutor.;;
0;0;Microsoft Core i5 Surface Pro 4 $849 http:// ift.tt/2uwQnQn;;
0;0;VisualStudio https:// twitter.com/VisualStudio/s tatus/887096817871200257Paritoshmmmec … (1/2) Navigate to 'C:\Program Files (x86)\ Microsoft Visual Studio\2013\version name\Common7\IDE'.;;
0;0;Microsoft CD encyclopedia circa 1993;;
0;1;It looks like a kid with Microsoft Word made that, Jesus.;;
0;2;Tell them your dad works at Microsoft;;
1;2;LinkedIn and Microsoft Announce New Windows 10 App http:// bit.ly/2uBpbR5 #SocialMedia pic.twitter.com/Kc3IdOgKOf;;#SocialMedia
0;1;Microsoft Windows has never been great after Windows 8. https:// betanews.com/2017/07/15/win dows-10-fail-microsoft/ …;;
0;0;技術要素の開発の速さは、実感でいうとこんな感じ。金を稼ぐ上では、速けりゃいいってもんでもない点には注意(速いほどコストがかかる)。 学術 >= Google, Microsoft , etc >>> 評論家 >= 一般ベンダ >>>>> ユーザ/応用領域;;
0;0;#Microsoft You can now carry on your laptop as United States Middle-Eastern Laptop Ban ends - … pic.twitter.com/FawI6Ey55Y;;#Microsoft
0;0;「成長は一時的に安定を失うことだ。それは、慣れ親しんでいるが型にはまったやり方や、 安定しているが退屈な仕事、時代遅れの価値観、意味のないつき合いを排除することでもある。」 ビル・ゲイツ（ microsoft 創業者）;;
3;2;Kerberos bypass, login theft bug slain by Microsoft , Linux slingers http:// j.mp/2ta4U0O pic.twitter.com/Pitt809Niu;;
0;1;Let your PowerPoint slides come to life with Morph! #Microsoft #Office365 http:// fb.me/GWLNbgWP;;#Microsoft #Office365
0;0;It doesn't take long to figure out.;;
0;0;How one Microsoft font could bring down a government!!!! http:// fb.me/5eWnHFpdO;;
0;1;Microsoft releases first public release candidate of SQL Server 2017 https:// lnkd.in/een_WCj;;
0;0;Grand Theft Auto V ( Microsoft Xbox One, 2014) http:// ift.tt/2tyKRsc pic.twitter.com/kTUL5CkCSs;;
1;0;Microsoft 's SQL Server 2017 for Linux and Windows moves ahead with first Release Candidate http:// zd.net/2uARr6z via @ZDNet & @maryjofoley;@ZDNet @maryjofoley;
0;0;YahooFinance: Today's charts: Netflix earnings on tap; Blue Apron sinks; Microsoft shares rise SeanaNSmith… … https:// twitter.com/YahooFinance/s tatus/887095875713077248 …;;
0;1;You make a compelling case.;;
0;0;Windows 10 quand Microsoft te fait croire que sa fonctionne sur tout les PC https://www. instagram.com/p/BWqrFGlndbf/;;
0;0;Ballmer is an idiot who nearly ruined Microsoft . Why listen to this court clown about anything?? https:// twitter.com/axios/status/8 87094818706341889 …;;
0;0;#RevitalizationPartners Regulators approve Microsoft 's renewable energy deal with Puget Sou... Read Blog: http:// owler.us/ac2MDR;;#RevitalizationPartners
0;0;It's a trap! XD;;
0;1;Unsure. Best to stay inside! pic.twitter.com/sAOHi8vVgl;;
0;0;Mightyskins Protective Vinyl Skin Decal Cover for Microsoft Xbox One C... #steampunk http:// geekbeeps.com/details?asin=B 06XC97F7W … pic.twitter.com/S0ao73eMRF;;#steampunk
0;0;HORI Fighting Commander for Xbox One Officially Licensed by Microsoft - Xbox One https:// gamebeatz.com/product/hori-f ighting-commander-for-xbox-one-officially-licensed-by-microsoft-xbox-one/ … #xbox360 pic.twitter.com/k6QMipSV9f;;#xbox360
0;0;VisualStudio: Paritoshmmmec (1/2) Navigate to 'C:\Program Files (x86)\ Microsoft Visual Studio\2013\version name\Common7\IDE'.;;
0;4;(Have I mentioned I OneNote? );;
0;0;Microsoft Dynamics 365 Extensions: What defines Best in Class? #MicrosoftDynamics365Extensions http:// buff.ly/2tX9i64;;#MicrosoftDynamics365Extensions
0;1;I had a 3dfx card, I had a microsoft force feedback wheel before they were USB. I'm waiting for 2nd gen before I even consider VR.;;
0;0;HBCU Technology Summit: Nous somme reçus dans les locaux de Microsoft . Ici, il est question des initiatives... http:// fb.me/6lcq0CjzO;;
0;1;LRT long live microsoft paperclip guy;;
0;1;@msonenote !! Glitter pen;@msonenote;
0;0;Inside Microsoft 's #blockchain as a Service -- http:// Redmondmag.com http:// fwd.ovh/ln6Y9w;;#blockchain
0;0;. @SikichLLP Named to @Microsoft Dynamics’ 2017/2018 Inner Circle http://www. techfunnel.com/sikich-llp-nam ed-microsoft-dynamics-20172018-inner-circle/ … pic.twitter.com/JmKL7AVQGt;@SikichLLP @Microsoft;
0;0;Microsoft paint skill on point;;
0;1;Actually I am a happy and content person about myself and life, but my dis-likes that you feel & see & dont like is my passion your problem. pic.twitter.com/c3Y1ty6K81;;
0;2;Did y'all know the school gives you free Microsoft word and the whole shabang;;
0;0;Stop this crazy crusade! Google, Facebook, Microsoft , Amazon tell FCC over net neutrality… http:// dlvr.it/PWK3yn;;
0;0;(1/2) Navigate to 'C:\Program Files (x86)\ Microsoft Visual Studio\2013\version name\Common7\IDE'.;;
2;3;@Xbox @XboxSupport @Microsoft you see my gamertag is vulgar safari but someone change it plz help fix my gamertag just give it back plz pic.twitter.com/FEHqumpLNF;@Xbox @XboxSupport @Microsoft;
0;2;July in Seattle is fantastic!;;
0;0;What's new in SQL Server 2017 | Microsoft Docs http:// bit.ly/2u3jVnT;;
0;1;Just completed the Introduction to Microsoft Teams - the digital hub for teaching and learning in Office 365 for Education;;
0;1;Our pleasure! Thank YOU for the really insightful presentation!;;
0;1;On my @ASUS #Zenbook running @Microsoft @Windows #Windows10 16MB RAM, @MicrosoftEdge w/ 4 tabs using excessive memory. Is this normal? pic.twitter.com/ak4A8oB9cq;@ASUS @Microsoft @Windows @MicrosoftEdge;#Zenbook #Windows10
0;0;Baixando aquele joguinho antes do Masterchef #Xbox #XboxOne #microsoft #projeccars #vivofibra … https://www. instagram.com/p/BWqqpkcFefo/;;#Xbox #XboxOne #microsoft #projeccars #vivofibra
0;0;i fucking love spreadsheets just fucking buy me microsoft excel addons for my birthday please;;
0;0;GFC Nieuws - Microsoft brengt Windows 10-app van LinkedIn uit -... http:// fb.me/1ULLRCNzL;;
0;0;YahooFinance: Today's charts: Netflix earnings on tap; Blue Apron sinks; Microsoft shares rise SeanaNSmith… https:// twitter.com/i/web/status/8 87095875713077248 …;;
0;1;What is that brightness coming in the windows?;;
1;1;I wish Microsoft wasn't so terribly incompetent in the Japanese console gaming market. I hate missing out on so many great games~ ((´д｀));;
0;0;Microsoft unveils its new LinkedIn app for Windows 10 http:// bit.ly/2vaAPQ3;;
0;0;#xbox One Scorpio will have a 'premium' ? but.... #playstation #microsoft #newestgadgets http:// bit.ly/2dahFCO pic.twitter.com/9u4ZZFLsTN;;#xbox #playstation #microsoft #newestgadgets
0;0;Sommergewinnspiel 2017 &#8211; Tag 18 https://www. beyondpixels.at/sommergewinnsp iel-2017-tag-18/ … #microsoft via @BeyondPixelsAT;@BeyondPixelsAT;#8211 #microsoft
0;0;Awesome @Microsoft ! Way to go! Everyone should do this! https:// m.slashdot.org/story/328779;@Microsoft;
0;0;@satyanadella This is great! The IDC awards Windows Phone 0.1% market share, notes lack of commitment from Microsoft https:// mspoweruser.com/idc-awards-win dows-phone-0-1-market-share-notes-lack-commitment-microsoft/ …;@satyanadella;
0;0;View my verified achievement from Microsoft on Acclaim. https://www. youracclaim.com/badges/9005d06 1-3ce0-41b8-beac-eb0897e821ed/twitter …;;
0;0;Microsoft のPath Guideは、ユニークな屋内ナビゲーション – TechCrunch Japan http:// jp.techcrunch.com/2017/07/15/201 70714microsofts-path-guide-is-an-unconventional-approach-to-indoor-navigation/ …;;
0;9;I also love how Microsoft imported my BGs so I boot up my comp for the first time and it already knows I'm neck deep in dragon age;;
0;1;#Belgium #jobs #emploi Senior .NET Developer - Dutch, Microsoft , RESTful, Architect, Belgium http:// ift.tt/2utstWm .Post your jobs 4 fre…;;#Belgium #jobs #emploi
0;0;Janela da Microsoft ?;;
0;0;#TemptationIsland 101 Secrets Of A Microsoft Excel Addict http:// casualient.com/Mcd;;#TemptationIsland
0;1;remember Microsoft Points? remember buying map packs for 800 Microsoft Points?;;
0;0;Stop this crazy crusade! Google, Facebook, Microsoft , Amazon tell FCC over net... http://www. theregister.co.uk.convey.pro/l/gVrJm78 by #DMBisson via @c0nvey;@c0nvey;#DMBisson
4;54;Have to give a special thank you to @digitaldad for the special edition #qualcomm NinjaCat stickers #WindowsInsider #microsoft pic.twitter.com/uiUf7iDIqw;@digitaldad;#qualcomm #WindowsInsider #microsoft
0;0;Azure Stack は Microsoft が目指した Azure の完成形ではないか: 先週、なかなかに刺激的なタイトルの記事が流れておりました。 ついに秘密兵器をリリ... http:// dlvr.it/PWK3FW;;
0;0;¿Qué sistema operativo domina en el mercado? - Según el Brand Finance’s Global 500, este año Microsoft es la qu... http:// ow.ly/5z8X50cRQZs;;
0;0;View my verified achievement from Microsoft on Acclaim. https://www. youracclaim.com/badges/21a527e e-d14f-41c3-ab31-a124e1b48412/twitter …;;
0;0;Today's charts: Netflix earnings on tap; Blue Apron sinks; Microsoft shares rise @SeanaNSmith https:// yhoo.it/2u29Fuz pic.twitter.com/YopQ92U5B5;@SeanaNSmith;
0;0;Microsoft Translator for iOS receives a large update, brings new speech translation animation and more - http:// klutchgaming.com/microsoft-tran slator-for-ios-receives-a-large-update-brings-new-speech-translation-animation-and-more/ … pic.twitter.com/bdBkxtGsqP;;
0;0;Microsoft Data Scientist Uses Skills to Combat SIDS After Loss of Newborn Son http:// ift.tt/2t9TmL9;;
0;0;Amazon is the new 1990s Microsoft , trying to extinguish all competitors, large and small, no matter the consequences or harm.;;
0;0;New on eBay! Minecraft: Xbox One Edition ( Microsoft Xbox One, 2014) Brand New Sealed http:// ift.tt/2vc1dt4 pic.twitter.com/5xcdTcbiNo;;
0;3;Ponto alto do dia: a microsoft dá o Office de graça pra todos os alunos de qualquer faculdade. uhul.;;
0;0;Free advanced Microsoft Word course, Thursdays, 8/10-24, 6-8pm, 35 Main Street, Blairstown. Call @PssNewJersey at 973-940-3500 to register. pic.twitter.com/xykMLeREVa;@PssNewJersey;
0;0;I don't do "self injurious behavior" lmao;;
0;1;343 Industry confirmed Halo will stay Microsoft exclusive. PONY TWATS ON SUICIDE WATCH! I can do it too. lol;;
0;0;No es exactamente de Windows... Pero si de Microsoft ​ http://www. novainc.company/2017/07/arrow- launcher-el-lanzador-de-microsoft.html …;;
6;1;Push hilarious photos to #hololens users with this #vulnerability that #microsoft doesn't want you to know about! https://www. theinquirer.net/inquirer/news/ 3013670/microsoft-patches-a-remote-code-execution-flaw-affecting-hololens …;;#hololens #vulnerability #microsoft
0;1;Probably not as bad as having the robot voice from Microsoft Word read it. I feel weird when I do this. Lol.;;
0;0;Arrow Launcher, el lanzador de Microsoft para Android se actualiza con estas novedades http:// fb.me/17xvgWgUq;;
0;0;Arrow Launcher, el lanzador de Microsoft para Android se actualiza con estas novedades http:// dlvr.it/PWK2FW pic.twitter.com/CpWpbUI3YJ;;
0;0;Tech Etc. Podcast Podcast | entertainment, phones, games, microsoft , technology, windows, google http:// shoutengine.com/TechEtcPodcast/;;
0;2;This time cn u have some non Microsoft paint graphics?;;
0;0;Stop this crazy crusade! Google, Facebook, Microsoft , Amazon tell FCC over net neutrality… http:// dlvr.it/PWK20K;;
0;0;BRIEF-Kate Johnson to join as president, CVP of Microsoft US (Reuters: Company News) http:// dlvr.it/PWK1sL;;
0;0;Whenever you find a bug;;
0;2;Hey I have thought about it lol I have a thing for @Microsoft swag;@Microsoft;
1;1;おっ microsoft samか！？;;
0;0;Don't see anything on . @Google or . @microsoft either. No marine, army, military, nothing.;@Google @microsoft;
0;0;He actually was part of a Microsoft conference? I'm?;;
1;0;La 4ème révolution industrielle a démarré ! Appropriez-vous les avancées de l' #IA avec Microsoft #experiences17 ! http:// my.sociabble.com/VZKHgTkW;;#IA #experiences17
0;0;Microsoft Rural Broadband Announcement https:// goo.gl/fb/kDtBN7;;
0;0;U N I T Y - What? pic.twitter.com/srNzwJxu91;;
0;0;Soweit ich unterrichtet bin, sind Microsoft und ZeniMax nicht die gleiche Firma;;
0;0;[INFOGRAPHIE] Etude IDC & Microsoft - La transformation numérique du retail http:// my.sociabble.com/VmAxdWDT;;
0;0;Microsoft Windows 7 Ultimate SP1 actualización julio de 2017 multilenguaje full activado 32 y 64 bits http:// dlvr.it/PWK16Z pic.twitter.com/iy7479kFxg;;
0;0;#Windows #Microsoft We play the tech-merger matchmaker game (The 3:59, Ep. 253) - CNET http:// dlvr.it/PWK14f #WindowsPhone;;#Windows #Microsoft #WindowsPhone
0;0;脱 Microsoft プロジェクトを阻む政治的圧力 - ITmedia http:// techtarget.itmedia.co.jp/tt/news/1707/1 4/news01.html …;;
0;2;Tech Moves: Microsoft bringing in GE tech executive to be corporate VP of U.S. division https://www. geekwire.com/2017/tech-move s-microsoft-bringing-ge-tech-executive-corporate-vp-u-s-division/ …;;
0;1;Microsoft Edge is so desperate for us not to use chrome that they show misleading graphs... pic.twitter.com/2YF6KF4JMb;;
0;0;"Potenciar la experiencia en plataformas de Microsoft y priorizar las consolas" via @generacionxbox http:// generacionxbox.com/microsoft-algo -importante-xbox/#piopialo-Pote …;@generacionxbox;#piopialo
0;0;pc and laptop format windows 7 windows 10 microsoft office 2016 pm me limay and orion area;;
0;0;Tech Moves: Microsoft bringing in GE tech executive to be corporate VP of U.S. division http://www. geekwire.com/2017/tech-move s-microsoft-bringing-ge-tech-executive-corporate-vp-u-s-division/ … pic.twitter.com/J5ioZeaeAN;;
0;0;BRIEF-Kate Johnson to join as president, CVP of Microsoft US http:// feeds.reuters.com/~r/reuters/com panyNews/~3/7yoduo6hD-o/brief-kate-johnson-to-join-as-president-idUSFWN1K80T1 …;;
0;0;@Microsoft My xbox one drive makes Strange noises and is very loud since a couple of moments i dont knoe why. Is there a way to fix this ?;@Microsoft;
1;1;HoloLens, Microsoft Ready #microsoft #mgmgrand #microsoftready2017 #mobiledevops #xamarin #dev … https://www. instagram.com/p/BWqpvv-h7H1/;;#microsoft #mgmgrand #microsoftready2017 #mobiledevops #xamarin #dev
1;1;Microsoft Releases LinkedIn App for Windows 10 http://www. technews24h.com/2017/07/micros oft-releases-linkedin-app-for.html …;;
0;1;So whoever finishes first guys that gong?;;
0;0;Microsoft , Google back strong Net neutrality on broadband firms - The Boston Globe http:// dlvr.it/PWK0pK;;
0;0;Saying, unity in impunity.not a dissenter or divider, I take specialty in chat room psychological warfare..lol;;
0;0;Dell EMC Cloud for Microsoft Azure Stack Whiteboard video – #EMC https:// goo.gl/fb/FLW8Np;;#EMC
0;0;Dell EMC Cloud for Microsoft Azure Stack Whiteboard video – #EMC https:// goo.gl/fb/AXk9ef;;#EMC
0;0;I wouldn't want to run servers if I had to use #Microsoft either https:// twitter.com/ServerlessConf /status/886991643529838592 …;;#Microsoft
0;0;alors @MSVousAide #microsoft ? c normal ce probleme de synchro mail? onedrive fonctionne pourtant! android, W10, Edge, Chrome= echecs! pic.twitter.com/4sMfrgpOm2;@MSVousAide;#microsoft
0;1;Microsoft はなぜ、大幅人員削減に踏み切るのか - ITmedia http://www. itmedia.co.jp/enterprise/art icles/1707/15/news009.html …;;
0;1;Microsoft powerpoint 2010;;
0;0;Microsoft Rural Broadband Announcement https:// goo.gl/fb/JJvyy4;;
0;1;I went to go see em last night at the Microsoft theatre;;
0;0;無料で使えるウイルス対策ソフトまとめ!!! - FC2まとめ http:// summary.fc2.com/summary.php?su mmary_cd=448232 … #Windows #Microsoft #FC2 #ウイルス対策ソフト #アンチウイルス #61116;;#Windows #Microsoft #FC2 # # #61116
0;0;Payment Methods: UK Microsoft Points, Xbox Live Codes, License Transfer & PayPal! Skype:VolkyLobbies;;
1;9;Na chvíli zpět na #iOS10 Jeden poznatek Problémy s #Outlook pro #iOS nebyly způsobeny #iOS11 , ale tím, že je debilní jako Microsoft;;#iOS10 #Outlook #iOS #iOS11
0;0;#analytics #website How Microsoft brought SQL Server to Linux http:// tw.eet.link/PWK0L1 #clickcounter;;#analytics #website #clickcounter
0;0;#analytics #website How Microsoft brought SQL Server to Linux http:// tw.eet.link/PWK0MG #clickcounter;;#analytics #website #clickcounter
0;0;New in Microsoft Azure: MariaDB TX 2.0 | MariaDB https:// lnkd.in/d6gvvHa;;
0;0;What is Mixed Reality & why is it important to Microsoft http:// dlvr.it/PWK0Fx;;
4;2;Resolving Microsoft Identity Manager “sync-rule-validation-parsing-error” error http:// buff.ly/2u2MSAF;;
0;1;Malo no hay ninguno. Cada uno destaca en algo. Pero el apelero le tiene fobia a Microsoft . . http://www. businessinsider.com/siri-vs-google -assistant-cortana-alexa-2016-11 …;;
