retweets;favorites;text;mentions;hashtags
0;0;[ Microsoft ] RIM、無料の「BlackBerry Enterprise Server Express」提供を発表: RIMは、スペインのバルセロナで開催されたMobile World Congressにおいて、新たに... http://bit.ly/aUZVhv;;
0;0;eMazzanti Technologies Wins Microsoft Windows 7 Deployment Award ( http://ping.fm/OLa1C;;
0;0;@captj did you see that mIcrosoft out-microsofted theirselves?;@captj;
0;0;eMazzanti Technologies Wins Microsoft Windows 7 Deployment Award ( http://ping.fm/hpiv3;;
0;0;Windows 7 Finally in Motion: Why else would Microsoft be talking about a mobile platform at MIX, a Web design a.. http://bit.ly/aA7f2W;;
0;0;http://j.mp/bsN8vo viele neue Freund für Microsoft dank Mobility;;
0;0;Microsoft Fixes Access to Hotmail, Restores Service... http://ff.im/-g3oj8;;
0;0;" Microsoft Completely Rebooted Its Mobile Business Yesterday; Here's What You Missed" ( http://bit.ly/cJYi11 );;
3;0;Nuevo Post en Atomix: Microsoft : Algún día reviviremos Killer Instinct http://bit.ly/dzhRIF;;
0;0;@majornelson HELLOOO MICROSOFT ? WE WANT TO PLAY ON YOUR ABSOLUTELY BRILLIANT ONLINE GAMING SERVICE.;@majornelson;
0;0;@HuntHenning Yep, with iPhone 4.0 coming, Microsoft is missing a HUGE opportunity Window waiting a year to release Win 7 Phone.;@HuntHenning;
0;0;Liked "[Fixed Link] People have begun to notice: Microsoft Get's It's Groove Back - http://bit.ly/9npuDe" http://ff.im/-g3nW7;;
0;0;Microsoft Anoints AT&T as Preferred Windows Phone 7 Carrier http://bit.ly/bBaKGI WTH? I don't plan on leaving Verizon;;
0;0;iPhone Hacks - Microsoft Attacks iPhone In New Windows Phone 7 Teaser Ad http://bit.ly/ayGq04;;
0;0;IT Update: Windows Phone 7 a good start, but questions persist: Microsoft 's brought out a new mobile operating sys... http://bit.ly/9ReP3s;;
5;6;[Fixed Link] People have begun to notice: Microsoft Get's It's Groove Back - http://bit.ly/9npuDe;;
0;0;@joestump Google, Yahoo, Microsoft , and all OpenSocial 0.8 implementers support Portable Contacts. Pretty wide support;@joestump;
0;0;mmi installing windows 7 with dvelopers account: through my school i have a Microsoft developers account which allows me to get window...;;
0;0;また別物にする気かよ…使い方を教える方、愚痴を聞く方の身にもなれよ…つか変えるならWindowsの名前も変えろ QT @itmedia : [News]Windows 8は「まったく違うものになる」―― Microsoft 関係者が語る http://bit.ly/bd7t9E;@itmedia;
0;0;IT Audit: Microsoft Small Business Server 2003 Best Practice Analyzer: http://snurl.com/u4mvi;;
0;0;Que saco Microsoft ! Eu te odeiooooooooooooooo;;
0;0;Microsoft Describes its Windows Phone 7 http://bit.ly/dDt6xH #xbox #xboxlive;;#xbox #xboxlive
0;0;Why former employees say Microsoft can't innovate : http://ow.ly/1832X (Betanews);;
0;0;if microsoft made a car, all of your warning lights would be replaced with, "This car has performed an illegal operation".;;
0;0;@hemang27shah wait you wrote that site about free microsoft points? write up a sample piece of some gaming news;@hemang27shah;
0;0;Google argumenta su digitalización de millones de libros - http://bit.ly/aKDICt #google #internet #leyes #libros #Microsoft;;#google #internet #leyes #libros #Microsoft
0;0;Attending Silverlight 4 presentation by Jeff Barnes http://bit.ly/9nsGiN @Microsoft office in Ft. Lauderdale, FL;@Microsoft;
0;0;Desde el blog: Microsoft y AB regalamos 10 Audi R8 LMS... y 190 coches más http://tinyurl.com/ycbnw8e;;
0;0;if Microsoft made a car, your airbag system would ask, "Are You Sure?" before deploying.;;
0;0;Microsoft Ofice 2010 em versão trial até outubro: http://tinyurl.com/yh2ozcr;;
0;0;3CX VOIP Phone for Microsoft Windows http://easylivecd.com/wifi-news;;
0;0;3CX VOIP Phone for Microsoft Windows http://easylivecd.com/voip-news;;
2;0;Windows Marketplace for Mobile update coming soon http://bit.ly/dgDhbC #windowsmobile #microsoft #mwc #mwc10;;#windowsmobile #microsoft #mwc #mwc10
0;0;3CX VOIP Phone for Microsoft Windows http://easylivecd.com/router-news;;
0;0;3CX VOIP Phone for Microsoft Windows http://easylivecd.com/mplayer-news;;
0;0;3CX VOIP Phone for Microsoft Windows http://easylivecd.com/firewall-news;;
1;1;RT @MicrosoftPress : Free ebook: Understanding Microsoft Virtualization R2 Solutions: http://ow.ly/17VJ2 466 pages by Mitch Tulloch!;@MicrosoftPress;
0;0;RT @SJBeresford : @aljemison The deli downstairs ringing you up on a Windows register don't count as a Microsoft connect. @Shadeo5 * damn;@SJBeresford @aljemison @Shadeo5;
0;0;Microsoft Excel Tips - Adding a Table to Excel (Excel Tables),Excel tables are dynamic and can expand as your d...http://t77.us/u5kmcfc4n6;;
0;0;if Microsoft made a car, your car would crash twice a day for no reason at all.;;
0;0;At the beginning of the month, I created rules to auto-file OOF & S+ replies. Now 100+ emails I didn't have to file! #fb #Office #Microsoft;;#fb #Office #Microsoft
0;0;Microsoft Office Professional Plus (2010): Info:The Microsoft Office 2010 is a limited, invitation only program.. http://bit.ly/adkhIw;;
0;0;Microsoft Windows Phone http://www.microsoft.com/windowsmobile/en-us/default.mspx Enjoy downloads and resources;;
0;0;Ex-Microsoft Employee Likens Windows Phone 7 To Vista: A former Microsoft product manager says there are some para... http://bit.ly/b4emM2;;
0;0;Wow microsoft my phone, opera mobile beta, and google maps. left my windows phone for a bit and all these updates!;;
0;0;Gizmodo - Windows Phone 7 Interface: Microsoft Has Out-Appled Apple [UI Design] http://bit.ly/ahurSb;;
0;0;Microsoft Office Professional Plus 2010 | HOTFILE | http://filelinkfind.com/hotfile/fd-74bl;;
0;0;@microsoft _cares doesn't it just make you feel awesome when you do that haha;@microsoft;
0;0;Apple vs Microsoft según Soth Park http://www.youtube.com/watch?v=6-CSrcS2tNU;;
0;1;RT @DesignerDepot : Windows Phone 7 Interface: Microsoft Has Out-Appled Apple: http://bit.ly/a7mJtF;@DesignerDepot;
0;0;Microsoft and Yahoo! Partnership Expected to Get EU Approval http://bit.ly/9NQHJs;;
0;0;@Tainhaalvinegra não é pirata, tiiio! :( é do site oficial da Microsoft , poxa HAIUOEHIUOE;@Tainhaalvinegra;
0;0;Free Microsoft Learning Plan tool for Partners http://su.pr/2dynf6 a FREE service containing the courses from MS training teams and systems.;;
0;0;Microsoft 's Embedded OSes Get Windows 7 Branding: Microsoft changed its product naming scheme for its embedded ope... http://bit.ly/bBBXtD;;
0;0;Why Google Has Become Microsoft 's Evil Twin - PCWorld - http://bit.ly/a9uElt;;
0;0;eMazzanti Technologies Wins Microsoft Windows 7 Deployment Award ( http://ping.fm/7EB2O;;
0;0;#Cloud #Careers Principal Se Storage Architect - External - 711817 at Microsoft (Redmond, WA): team seeks a Pr... http://bit.ly/ayC827 #TCN;;#Cloud #Careers #TCN
0;0;@likeaboss right now the microsoft party van is pulling up to your house hahaha;@likeaboss;
0;0;Blog: RIM Offers Free Microsoft Synchronization Software http://krz.ch/RSU;;
0;0;Microsoft Gets Its Groove Back http://shar.es/m1AYZ via @sharethis;@sharethis;
0;0;Blog: RIM Offers Free Microsoft Synchronization Software http://krz.ch/RSU;;
0;0;@technolass Was having Solona problems, and let's just say the Microsoft store could take lessons from just about anyone on how to do it...;@technolass;
0;0;eMazzanti Technologies Wins Microsoft Windows 7 Deployment Award ( http://ping.fm/6tm9J;;
0;0;Pega pirata! RT @lanayzs : baixando o Microsoft Office 2010...;@lanayzs;
0;0;#HITECH10 Report from Microsoft Global High Tech Summit: http://bit.ly/c7bn24;;#HITECH10
0;0;Getting Excel to Display Currency: You can change the way Microsoft Excel formats numbers so it is displayed as.. http://bit.ly/aVFBBg;;
0;0;I'm done with Microsoft and The Xbox promo show. Then Friday, I rip it all down. I'lll upload the pics I have of the show sometime tomorrow.;;
0;0;Microsoft Rejoins the Smart Phone Revolution With the Windows 7 Phone – Discover… http://goo.gl/fb/IPic #news;;#news
0;0;@hemang27shah I checked the link and all I saw was a post for free microsoft points? just copy and paste your sample and send the email agin;@hemang27shah;
0;0;Isaiah's Tech: Microsoft 's Turtle and Pure To Get CDMA Variants; Sporting Nvidia's Tegra? http://bit.ly/brwF2o;;
0;0;eMazzanti Technologies Wins Microsoft Windows 7 Deployment Award ( http://ping.fm/FfKxW;;
0;0;Awesome Maps Microsoft , very impressive. MUST WATCH http://bit.ly/dnMnNl (via @zholmquist );@zholmquist;
0;0;Microsoft chegando junto com o windows 7 mobile http://bit.ly/aZ3xS7 previsão de liberar até final desse ano.;;
0;0;Have you checked Microsoft Demo Showcase at Microsoft Partner network ? http://su.pr/2UNEyv;;
0;0;Windows Phone 7: Creative destruction pays off for Microsoft http://bit.ly/9ES5Wm;;
0;0;@KazoSG 2k and ea are the only two companeis that don't (fully) have their servers with Microsoft .;@KazoSG;
0;0;eMazzanti Technologies Wins Microsoft Windows 7 Deployment Award ( http://ping.fm/2XYEU;;
0;0;#Boxee #Microsoft _Windows on 2 Fav Sources+1 other like Gizmodo-Boxee Integration App Lets Boxee and Windows 7 Med... http://bit.ly/ai7YGz;;#Boxee #Microsoft
0;0;People who paste from Microsoft Word into web forms should have to sit through a 3 hour lecture on why that's a bad idea.;;
0;0;#Boxee #Microsoft _Windows on 2 Fav Sources+1 other like Gizmodo-Boxee Integration App Lets Boxee and Windows 7 Med... http://bit.ly/9g8VNJ;;#Boxee #Microsoft
0;0;Microsoft Azure, on paye à l'heure ok, pour quelle puissance ? http://bit.ly/bO9Kzk;;
0;0;Microsoft getting the big mo? Todd Bishop says it is. http://bit.ly/bVJaxj;;
0;0;Dagreport staat live: LG, HTC, een interview met Microsoft en natuurlijk de tip van @ronnosmeets http://tinyurl.com/ykwyjhv;@ronnosmeets;
0;0;Google Buys an Aardvark to Improve Social Networking: Google has moved quickly to match moves by Microsoft and Yah... http://bit.ly/9VLBHw;;
0;0;Microsoft XBOX 360 Game System (CONSOLE Only) -Working!: US $24.50 (16 Bids) End Date: Tuesday Feb-16-2010 20:46:2... http://bit.ly/a7JjAF;;
0;0;http://tinyurl.com/ydevr96 Microsoft Describes its Windows Phone 7;;
0;0;@Waterbaron I used to work for Microsoft (1997-1999), and after switching to Mac, I became a much happier computer user. iPad is neat, but--;@Waterbaron;
0;0;Blog Post: Learning Microsoft Access Database Tips. http://bit.ly/djb7ki;;
0;0;[big debate] Microsoft Windows Phone 7 Series: Finally, a Microsoft mobile OS worth getting excited about: I got a... http://bit.ly/bwZxg3;;
0;0;[big debate] Microsoft Windows Phone 7 Series: Finally, a Microsoft mobile OS worth getting excited abo... http://bit.ly/cqjetO (via @gdgt );@gdgt;
0;0;eMazzanti Technologies Wins Microsoft Windows 7 Deployment Award ( http://ping.fm/tyB1C;;
1;0;Microsoft renueva su software móvil con Phone 7. http://bit.ly/bUP1jL;;
0;0;@luccasalm Sim, ao mesmo tempo anunciaram a compra da Microsoft pela TecToy;@luccasalm;
0;0;Microsoft Office Professional Plus (2010): http://i37.tinypic.com/70hvlv.jpg http://i45.tinypic.com/2nw2uxe.png http://bit.ly/d8NWqR;;
0;0;@List_Erine まだまだ使わざるをえないのですが、win自体からの脱却を少しずつ… microsoft は、windows phone7はWMとは違う、をアピールしてますが違いがあまり実感できず　エンドユーザー向けクラウドはあまり考えてなさそうですね;@List_Erine;
0;0;TechiPod New Track – Microsoft …: TechiPod New Track – Microsoft Anoints AT&T as Preferred.. http://bit.ly/c4rni6;;
0;0;amazing Microsoft maps http://on.ted.com/88y5;;
0;0;I am a bit of a mobile geek - Read up on the Windows phone 7 Series OS from Microsoft . An interesting aspect... http://tumblr.com/xko6ibgp5;;
0;0;if any of you live in Georgia and want to get certified in Microsoft office pls DM and i can get you the information.. oh did i say its FREE;;
0;0;Microsoft Global High Tech Summit 2010: Social Engineering to Win Hearts and Minds: On Thursday February 10, Gary ... http://bit.ly/atR1LW;;
0;0;Is 2010 the year that Microsoft fights back Google & Apple? Windows7, Bing, Maps, and now the Windows Phone 7 | http://bit.ly/amKh2H;;
0;0;★★★ITmedia: Windows 8は「まったく違うものになる」―― Microsoft 関係者が語る http://bit.ly/a0E1BA;;
0;0;@jpgodinho nice, eu também comecei como inglês. Meti-me a seguir uns grupos (.NET e Microsoft -related). Qual é o teu ID lá?;@jpgodinho;
0;0;@sfernandezc y que bueno que no regreses a microsoft , en México son sinónimo de falta de creatividad;@sfernandezc;
0;0;Microsoft Developer http://bit.ly/c9fkVe #Developer #Jobs;;#Developer #Jobs
0;0;Liked "People have begun to notice: Microsoft Get's It's Groove Back - http://bit.ly/9ryqwb" http://ff.im/-g3m3Z;;
0;0;Does AT&T suck all the Exec Board dicks @Apple and Microsoft ..shit..they bout to get dibs on the Windows 7 Mobile;@Apple;
0;0;@microsoft _cares LOL;@microsoft;
0;0;is Playing Microsoft Train Simulator.;;
0;0;This Is What Windows Phone 7 Series Marketplace Will Look Like [ Microsoft ] http://bit.ly/bQITLF;;
0;0;This Is What Windows Phone 7 Series Marketplace Will Look Like [ Microsoft ] http://bit.ly/cSsLdJ;;
0;1;Dear Microsoft : You need more than just a beautiful font for a great GUI design. #Windows #Phone #7 #fail;;#Windows #Phone #7 #fail
0;0;@Carnage4Life Yeah, Microsoft got its photocopier started again..haha;@Carnage4Life;
0;0;RT @Seccom_Global : Microsoft 's ad server dishes up malware links http://bit.ly/aZfWb9;@Seccom_Global;
0;0;@TheNewsChick and this one: ' Microsoft Gets Its Groove Back', PC World's take on phone, cloud, OS, search: http://bit.ly/ac1Ms9;@TheNewsChick;
0;0;Mid-Level Microsoft Network Engineer http://bit.ly/asOAZi #Architect #Jobs;;#Architect #Jobs
0;0;Microsoft SharePoint Architect http://bit.ly/cc85Cf #Architect #Jobs;;#Architect #Jobs
1;0;Microsoft също могат да правят потресаващо добри неща, когато пожелаят. 3D карти с augmented reality: http://is.gd/8xx9g;;
0;0;RT @Carnage4Life People have begun to notice: Microsoft Get's It's Groove Back - http://bit.ly/9ryqwb;@Carnage4Life;
0;0;RT @Carnage4Life People have begun to notice: Microsoft Get's It's Groove Back - http://bit.ly/9ryqwb;@Carnage4Life;
0;0;zajimava analyza #MWC : #Apple , #Microsoft , #Nokia i #Google se chystají do bitvy o nejlepší mobilní platformu: http://tinyurl.com/yeoa9vc;;#MWC #Apple #Microsoft #Nokia #Google
0;0;Microsoft Word, why do you want to hyphenate everything?;;
0;0;@EdStruijlaart via silverlight ( Microsoft , hè bah) op een 13 inch MacBook pro mocht je dat bedoelen.;@EdStruijlaart;
0;0;Microsoft Starts Over in Phone Software http://cot.ag/cyytu3;;
0;0;Lo vi hace tiempo, aún así sigue siendo bueno RT @paquesepas : El futuro según Microsoft [VIDEO] http://bit.ly/9hU787;@paquesepas;
0;0;"Congrats" Windows Phone 7 Series RELEASED: PICTURES Of Microsoft 's New Phone HuffPost - http://bit.ly/askijH;;
0;0;dli: SP2 для Microsoft Office SharePoint Portal Server 2003 Известные проблемы после установки пакета обновления ... http://bit.ly/b6A2QO;;
0;0;Windows Phone 7 Series: Serious Enough for Work?: Microsoft 's new Windows Phone 7 Series software is already getti... http://bit.ly/cFRVHD;;
0;0;RT: HDTV HD Component Cable Cord For MICROSOFT XBOX 360 NEW http://bit.ly/9XDt3W;;
0;0;@nathanieletc Because Silverlight is Microsoft , FLASH SUUUUUUUUUUUCKS, and websites are trying to move away from Flash.;@nathanieletc;
0;0;Once again, Microsoft is unoriginal: Xobni already does what MSFT's Outlook Social Connector will do.;;
0;0;Is Microsoft 's mojo back? Maybe: http://bit.ly/9seRet via @techflash;@techflash;
0;0;1 and 1 #Deal : Web Hosting Plans Starting From Only $6.99/mo. (Linux and Microsoft ). . Get 6 Free Months! http://bit.ly/cz2sVY;;#Deal
0;0;bisa upgrade yg ver. 6,5 ke ver.7 gak? RT @MIdotcom : Microsoft Luncurkan Windows Phone 7 http://bit.ly/bQiB8C;@MIdotcom;
0;0;Irony is watching Microsoft Halo Legends Blu Ray on your PS3. Take that Alanis Morissette! (This message is Z and Richard approved);;
0;0;うーん、やはりここに買収されちゃうのかな RT @topitmedia : レイ・オジーは Microsoft をどこに導くのか http://bit.ly/dBr0Kl;@topitmedia;
0;0;Looks like Microsoft have listened to the feedback the new Phone 7 looks OK http://bit.ly/aU5TRr;;
0;0;Hackers \fix\XP BSoD rootkit|An update released by Microsoft this month (MS10-015) broke XP machines that were .. http://oohja.com/x78cW;;
0;0;Windows Phone 7 Interface: Microsoft Has Out-Appled Apple Minimalist Home Design :P http://bit.ly/bz19uF;;
0;0;#Boxee #Microsoft _Windows on 1 Fav Source+2 others like CrunchGear-This Windows Media Center Boxee plug-in is a mu... http://bit.ly/9SW5HR;;#Boxee #Microsoft
0;0;Microsoft 's New Mobile OS Shows Promise, Is Overdue: Analysis http://bit.ly/d9xAfU;;
0;0;2020 Vision: The Future of Gaming, Microsoft X10 Conference, Street Fighter IV on iPhone, plus… http://goo.gl/fb/MRlD;;
0;0;【ITmedia 企業動 Windows 8は「まったく違うものになる」―― Microsoft 関係者が語る http://bit.ly/cjRgmG #itmedia;;#itmedia
0;0;@DesignerDepot {Windows phone 7 - Microsoft has out_Appled Apple} Thankyou, best laugh I have had all day!;@DesignerDepot;
0;0;CSS3 and HTML5 rocks! Er, hello Microsoft ??? Heeelllooooo? When is IE going to catch up?!?!;;
0;0;Microsoft 、「Windows Phone 7 Series」を発表 http://ow.ly/183eU;;
0;0;[Redmond Report] Microsoft 's Embedded OSes Get Windows 7 Branding: Microsoft changed its product naming scheme for... http://bit.ly/aImMKU;;
0;0;RIM, Microsoft Aim for Apple: http://bit.ly/cfl0LK;;
0;0;Review: Microsoft Outlook 2007 Calendar, Contacts, Tasks Quick Reference Guide (Cheat Sh http://www.33b.org/1934433683/33;;
0;0;@FlyBoii718 My flow is like rubbin logs. .i leave the pussy microsoft like windows vista.;@FlyBoii718;
0;0;Review: Microsoft Word 2007 Advanced Quick Reference Guide (Cheat Sheets of Instructions http://www.33b.org/1934433578/33;;
0;0;RT @cultofmac Microsoft ’s New Windows 7 Phone Also Doesn’t Have Flash | Cult of Mac http://bit.ly/cUtgcX;@cultofmac;
0;0;Review: Microsoft Excel 2007 Introduction Quick Reference Guide (Cheat Sheet of Instruct http://www.33b.org/1934433616/33;;
0;0;Review: Microsoft PowerPoint 2007 Introduction Quick Reference Guide (Cheat Sheet of Ins http://www.33b.org/1934433659/33;;
1;0;Microsoft Starts Over, Announces Credible iPhone Competitor http://bit.ly/a7ZVsK;;
1;0;Microsoft says it's looking into `limited number' of reports that Windows Live customers were able to get into other users' accounts.;;
0;0;[MCPMag News] Microsoft 's Embedded OSes Get Windows 7 Branding: Microsoft changed its product naming scheme for it... http://bit.ly/ajuFRO;;
0;0;[MCPMag News] Microsoft 's Embedded OSes Get Windows 7 Branding: Microsoft changed its product naming scheme for it... http://bit.ly/ajuFRO;;
0;0;Microsoft Office Professional Plus (2010)... http://bit.ly/a5FP8P;;
0;0;Microsoft ® Award Team/Claims Office Your email has won you £700,000.00 To claim your prize, contact;;
0;0;Getting ready to hear a talk on silverlight. — at Microsoft http://gowal.la/s/3Vwa;;
0;0;Damn not. They stripped it out ! RT @DesignerDepot Windows Phone 7 Interface: Microsoft Has Out-Appled Apple;@DesignerDepot;
0;0;Microsoft 's Windows Phone 7 Series Could Be A Success, Analysts Say - Windows from eWeek: Microsoft launched the W... http://bit.ly/9OySm7;;
0;0;RT @WeLuvMusic - RT @alleyinsider : CHART OF THE DAY: The Collapse Of Microsoft 's Mobile Business $ MSFT $ RIMM $ AAPL by @fromedome http:...;@WeLuvMusic @alleyinsider @fromedome;
0;0;We practised our Imagine Cup presentation this morning. Still have a lot of work to do! Also Microsoft have some flash conferencing gear.;;
0;0;How do I delete unwanted pages out of a Microsoft Acess report http://bit.ly/9yKbts;;
0;0;[myITforum Blogs] MS10-015 BSOD Issues - Are they Malware related?:   During the most recent Microsoft security up... http://bit.ly/bS6GAn;;
0;0;RT: Blaise Aguera y Arcas demos Photosynth augmented-reality mapping technology from Microsoft TED2010 video htt... http://bit.ly/aaUonD;;
0;0;Microsoft Rejoins the Smart Phone Revolution With the Windows 7 Phone: After being bypassed and outclassed by othe... http://bit.ly/cwBP65;;
0;0;Film With Fame: Watch a movie with Rob Zombie on XBL: The details Microsoft is hosting a special Game with Fame ev... http://bit.ly/ajqYxl;;
0;0;Microsoft Anoints AT&T as Preferred Windows Phone 7 Carrier http://bit.ly/aQeJQv;;
0;0;RT @terahedun Only an academic would describe Microsoft Word as being 'imperialistic' when it's doing the grammar corrections 4 other lang.;@terahedun;
0;0;Je comprends rien au modèle de facturation de Microsoft Azure, c'est brumeux;;
0;0;Microsoft : "Windows 8 will be something completely different from what folks usually expect of Windows." Let's hope so. http://ow.ly/17Fnm;;
0;0;Microsoft : "Windows 8 will be something completely different from what folks usually expect of Windows." Let's hope so. http://ow.ly/17FmO;;
0;0;UK government will upgrade to Microsoft Vista, snub Windows 7 - Digital Lifestyle - Macworld UK http://shar.es/m1Afi via @sharethis;@sharethis;
0;0;Microsoft もタブレット型の端末を開発するなら、先日発表していたhpのあれではなく、Windows Phone 7の様な斬新なUIベースで開発していた方が注目されたのではないかなと思ったりも。;;
0;0;“Why Microsoft ” website is now live. http://bit.ly/90kdtP;;
0;0;RT @topitmedia : 「Windows.next」と呼ばれているらしい。^宮本 ：Windows 8は「まったく違うものになる」―― Microsoft 関係者が語る http://bit.ly/cBPrdl;@topitmedia;
0;0;Microsoft 's Windows Phone 7 Series Could Be A Success, Analysts Say -... http://ff.im/-g3kqx;;
0;0;90576:Sev4:Windows: Microsoft Windows Kernel Elevation Privilege Vulnerability (MS10-015 and KB977165);;
0;0;BBC News - Microsoft launches Windows Phone 7 Series for mobiles http://is.gd/8xvo2;;
0;0;116887:Sev5:Local: Microsoft Windows TCP/IP Remote Code Execution Vulnerability (MS10-009);;
0;0;Achievement Hunter checks out Microsoft 's X10 Event.. http://bit.ly/bololG ...and this was just funny. http://is.gd/8xvfj (PG);;
0;0;116886:Sev4:Local: Microsoft Windows Client/Server Run-time Subsystem Elevation of Privilege Vulnerability (MS10-011);;
0;0;90578:Sev5:Windows: Microsoft Windows Shell Handler Remote Code Execution Vulnerability (MS10-007);;
0;0;Blaise Aguera y Arcas demos Photosynth augmented-reality mapping technology from Microsoft TED2010 video http://bit.ly/9dJAyl;;
0;0;90577:Sev5:Windows: Microsoft SMB Client Remote Code Execution Vulnerability (MS10-006);;
0;0;90581:Sev4:Windows: Microsoft Windows Paint Remote Code Execution Vulnerability (MS10-005);;
0;0;Microsoft Office 2008 for Mac Home & Student Edition by Microsoft Software Platform: Mac, Mac OS X (529)Buy new: $... http://bit.ly/aGOpZ0;;
0;0;90580:Sev4:Windows: Microsoft Windows Server 2008 Hyper-V Denial of Service Vulnerability (MS10-010);;
0;0;Microsoft doesn't copy Apple at all.. nooo. http://tr.im/OuUS;;
0;0;90579:Sev5:Windows: Microsoft SMB Server Remote Code Execution Vulnerability (MS10-012);;
0;0;110113:Sev4:Office Application: Microsoft Office Remote Code Execution Vulnerability (MS10-003);;
0;0;SqlClient.SqlException:Import of Microsoft Distributed Transaction Coordinator (MS DTC) transaction failed: 0x8004d00e(XACT_E_NOTRANSACTION);;
0;0;Windows Phone 7 Interface: Microsoft Has Out-Appled Apple: http://bit.ly/bxbT4g;;
0;0;90584:Sev5:Windows: Microsoft DirectShow Remote Code Execution Vulnerability (MS10-013);;
0;0;Front Page:: Microsoft Pulls Security Updates http://jcxp.info/?p=165;;
0;0;@Microsoft any good deals out there upgrading desktop and netbook? In the uk;@Microsoft;
0;0;Alleged Windows Mobile 7 Images Leaked http://www.newstop.org/?p=255731 Alleged images of Microsoft 's...;;
0;0;Hackers "fix" XP BSoD rootkit: An update released by Microsoft this month (MS10-015) broke XP machines that were i... http://bit.ly/cQ1DDE;;
0;0;90583:Sev4:Windows: Microsoft Windows Cumulative Security Update of ActiveX Kill Bits (MS10-008);;
0;0;News: Microsoft 's Embedded OSes Get Windows 7 Branding http://krz.ch/RS8;;
0;0;News: Microsoft 's Embedded OSes Get Windows 7 Branding http://krz.ch/RS8;;
0;0;News: Microsoft 's Embedded OSes Get Windows 7 Branding http://krz.ch/RS8;;
0;0;Hackers "fix" XP BSoD rootkit: An update released by Microsoft this month (MS10-015) broke XP machines ... http://bit.ly/av9Nwk #technology;;#technology
0;0;Hackers "fix" XP BSoD rootkit: An update released by Microsoft this month (MS10-015) broke XP machines that were i... http://bit.ly/cZl0gF;;
0;0;90582:Sev4:Windows: Microsoft Windows Kerberos Denial of Service Vulnerability (MS10-014);;
0;0;Microsoft Starts Over in Phone Software http://s.nyt.com/u/B7K (via @jeanprytyskacz );@jeanprytyskacz;
0;0;Hackers "fix" XP BSoD rootkit: An update released by Microsoft this month (MS10-015) broke XP machines that were i... http://bit.ly/cZl0gF;;
0;0;@my Hackers "fix" XP BSoD rootkit: An update released by Microsoft this month (MS10-015) broke XP machines that we... http://bit.ly/cZl0gF;@my;
0;0;Hackers "fix" XP BSoD rootkit: An update released by Microsoft this month (MS10-015) broke XP machines that ... http://tinyurl.com/y8jakrg;;
0;0;Microsoft Suffers Hotmail Outage http://www.newstop.org/?p=255729 Microsoft 's hotmail service su...;;
0;0;Beyond Windows Phone 7: More on other pieces of Microsoft 's mobile ... http://bit.ly/9VA4ea;;
0;0;110108:Sev4:Office Application: Microsoft PowerPoint OEPlaceholderAtom Use-After-Free Vulnerability (MS10-004);;
0;0;Microsoft co-founder Gates tackling #climatechange #globalwarming http://is.gd/8sg45;;#climatechange #globalwarming
0;0;110107:Sev4:Office Application: Microsoft PowerPoint LinkedSlideAtom Heap Overflow Vulnerability (MS10-004);;
