retweets;favorites;text;mentions;hashtags
0;0;Interesting: The future of cloud computing and competition between #Apple , #Google , #Amazon and #Microsoft http://www. zdnet.com/blog/perlow/dr agons-in-the-cloud-apple-google-amazon-and-microsoft/17460 …;;#Apple #Google #Amazon #Microsoft
0;0;Google Just Opened Its First Retail Outlet In London http://www. businessinsider.com/google-just-op ened-its-first-retail-outlet-in-london-2011-9?utm_source=twbutton&utm_medium=social&utm_campaign=sai … via @sai #li #google #retail #apple #microsoft;@sai;#li #google #retail #apple #microsoft
0;0;http:// researchmana.jugem.jp/?eid=106 Fruit Microsoft Dating BMW Judge Trade Debt Celebrities Garden Iron Chef Paris Hilton Los Angeles DVD;;
0;0;Get This: iOS Devices Generate More Revenue Than Microsoft ’s Entire Product Line | RazorianFly http://www. razorianfly.com/2011/10/01/get -this-ios-devices-are-generating-more-revenue-than-microsofts-entire-product-line/ … via @razorianfly;@razorianfly;
0;0;Definition change log - Get the latest definitions - Microsoft Malware Protection Center http:// bit.ly/qvwkpv;;
0;0;RT @GeeksRoom : #GR Microsoft Security Essentials elimina Chrome al confundirlo con un virus http:// bit.ly/nHq2G4;@GeeksRoom;#GR
1;0;So it looks like IBM is now bigger than Microsoft . http:// goo.gl/3Mk9I;;
0;0;Definitely, two of the most popular web web hosting service systems that you can get are Microsoft windows and A... http:// bit.ly/oO7WQD;;
0;0;@tehriccio i think Microsoft has hrddrive transferring cables... They might be free I can't remember;@tehriccio;
0;0;Microsoft Word Gue KENAPA ? ¬_¬;;
0;0;Casio Paying Microsoft To Use Linux http:// ur1.ca/59qww;;
0;0;Microsoft 's Android patent ransom to ... http:// hottopicsource.com/microsofts-and roid-patent-ransom-to-total-444m-next-year-channel-register/ …;;
0;0;Used Microsoft Xbox 360 60GB HDD http:// bit.ly/osfCBb;;
0;0;Microsoft Xbox 360 Slim 4GB Video Game System http:// bit.ly/qcT68l;;
0;0;AS IS MICROSOFT XBOX 360 ELITE SEALED GAME CONSOLE http:// bit.ly/qKa17q;;
0;0;MCTS Guide to Configuring Microsoft ® Windows Server® 2008 Active Directory (Exam #70-640), 1st Edition: MCTS Guide... http:// dlvr.it/nwXgv;;#70
0;0;iPhone, iPod touch And iPad Make More Money Than All Of Microsoft 's Products Put Together http:// zite.to/rnRBaP;;
0;0;IBM تتخطى Microsoft لتصبح ثاني اغلى شركة تقنية في العالم http:// fb.me/1dn7ndggs;;
0;0;How To Become Expert in Visual Studio 2008 (.Net Framework 3.5) and Pass 70-505 Exam: Microsoft Visual 200... http:// tinyurl.com/3mqamg4;;
0;0;Conflict in the Web servers: Microsoft windows Hosting or Red hat ... http:// tinyurl.com/4ygnhuc;;
0;0;Conflict in the Web servers: Microsoft windows Hosting or Red hat ...: For many who are reasonably proficient ... http:// twurl.nl/8p5t8s;;
0;0;Microsoft ties to Android device makers: patently complicated. http:// bit.ly/q2uU4k An easy to understand article. #patents;;#patents
0;0;http:// stst.tw/a1027804 - Microsoft Dynamics CRM Consultant ...: Herentals - GMI group N.V. #job #IT;;#job #IT
0;0;Free P&P see T&C's Xbox 360 Hard Drive (20GB) by Microsoft 103% Sales Rank in PC & Video Games: 386 (was 787 ye... http:// amzn.to/npdOBw;;
0;0;Chrome: Google repariert Fehler von Microsoft - GoogleWatchBlog (Blog): Chrome: Google repariert Fehle... http:// bit.ly/qOpACg #win7blog;;#win7blog
0;0;IBM تتخطى Microsoft لتصبح ثاني اغلى شركة تقنية في العالم http:// fb.me/1iT06ZXjC;;
0;0;[Nilai Pasar] Pertama Kalinya, IBM Lampaui Microsoft http:// kom.ps/3RkH via @kompasdotcom;@kompasdotcom;
1;0;そうなんです・・・ Microsoft の企業CM に出ております・・・。（書店でも電車内でも恥ずかしい・・・） RT @nbaden : うぉー！メトロの車内CM見てたら、 @waki さんが出てた。;@nbaden @waki;
0;0;Se nada dar certo viro faxineiro da #microsoft KKKKKKKKKKKKKKKKKKKKKKKK;;#microsoft
0;0;@DoubleJoJensen that's what happens when you bring a plucky little #Mac into #Microsoft 's backyard!;@DoubleJoJensen;#Mac #Microsoft
0;0;akhirnya mikocok kandas kalah.sesuatu bangetz-> [Nilai Pasar] Pertama Kalinya, IBM Lampaui Microsoft http:// kom.ps/3RkH via @kompasdotcom;@kompasdotcom;
0;0;Microsoft kills Google Chrome with bad malware signature http:// shar.es/bmb3Y;;
0;0;@cursoside ... ¿ Microsoft ? Dreanweaver;@cursoside;
0;0;Ei @VEJA de acordo com o @g1tecnologia a #IBM passou a #Microsoft atualiza seus números,Pfv né!;@VEJA @g1tecnologia;#IBM #Microsoft
0;0;#IBM beats #Microsoft in tech giants ranking http:// bbc.in/n9kaAC #li;;#IBM #Microsoft #li
0;0;@Microsoft you should bring the 2008 dashboard back to xbox!;@Microsoft;
0;0;JUBORAX.com found article on Heise.de Trojaner Verdacht: Microsoft Patch löscht Google Chrome;;
0;0;IBM passa Microsoft e é segunda entre gigantes da tecnologia >> http://ow.ly/6K2dS #IBM #Tecnologia;;#IBM #Tecnologia
0;0;CacoteoV.2.0 100% Mobile & Smart Device Ready Hiphop for MicroSoft direct link > http:// goo.gl/2udp9 #Cacoteo;;#Cacoteo
0;0;http:// curve092811news.cocolog-nifty.com/blog/2011/10/t he-mercedes-be.html … Clothing Types Corporatism Microsoft Porsche Apparel Electronics;;
0;0;Fichas, microsoft , cromos?? En mis tiempos eran choros y punto!!;;
0;0;Oh my gosh!!!! Microsoft recover crashed on me..... My draft... Oh nose;;
0;0;Are they really being wellmrun?? // IBM Is Now More Valuable Than Microsoft - http://j.mp/pa4AfU;;
0;0;Microsoft Corp. Launches “PC versus Mac” Website: “ Microsoft Corp. (NASDAQ:MSFT) has launched a new web site ref... http:// bit.ly/qw8plV;;
0;0;@ismiseadam I'm a PC and I can run Photoshop, Zune, Chrome, Skype and Microsoft Flight Simulator X without a single stutter/delay! :P;@ismiseadam;
0;0;According to @klout , I'm influential about: microsoft windows, and microsoft kinect http:// klout.com/user/jmservera ?n=tw&v=influential_about …;@klout;
0;0;Make A Choice Between Microsoft windows Website hosting and Unix like Web hosting After Evaluating The Needs You... http:// bit.ly/qSH0Sk;;
0;0;Make A Choice Between Microsoft windows Website hosting and ... http:// chilp.it/08c55e;;
0;0;Make A Choice Between Microsoft windows Website hosting and Unix like Web hosting After Evaluating The Needs You... http:// bit.ly/pyHPtV;;
0;0;Make A Choice Between Microsoft windows Website hosting and ... http:// chilp.it/39ed94;;
0;0;@tcha_tcho sempre pode pedir para secretaria de imprensa da Microsoft . Minha agenda esta bem cheia.;@tcha_tcho;
0;0;waiting patiently for microsoft word to cooperate;;
0;0;BBC: IBM now second biggest tech firm: Microsoft has slipped to third place among top tech firms as veteran IB... http:// tinyurl.com/43mcc4e;;
0;0;Microsoft Security Essentials hates Google Chrome | www.friendzconnect.com http:// bit.ly/rusfXG;;
0;0;IBM Tops Microsoft to Be Second-Most Valuable in Technology http:// bloom.bg/pLLNzP;;
0;0;@_LimaoComSal kkk, nunca se sabe! Vai que vc no futuro tu trampa é na #microsoft ?;@_LimaoComSal;#microsoft
0;0;Microsoft Shows Off Kinect and Windows Phone 7.5 Integration [VIDEO]: http:// bit.ly/nwk0yK WP7 windows 8 download ios 5 jailbreak _50;;
0;0;Kerala Microsoft Security Essentials hates Google Chrome http:// dlvr.it/nwWTX;;
0;0;iOS owns huge lead in Web browsing, but what about Internet market share?: Microsoft 's Windows Phone has less ma... http:// bit.ly/mXic2Q;;
0;0;Pro comp = professional courtesy ID = MVP ID. No personal data required. @WinPatrol PLUS code free to all Microsoft MVP's to help.;@WinPatrol;
0;0;naresh Thot Of This: "Maybe MSE could sense what some Microsoft die-hards think of Google?" for http:// bit.ly/obgHtp;;
0;0;Army of Two New Microsoft XBOX 360 Game http:// bit.ly/pOxzli;;
0;0;IBM Eclipses Microsoft in Value for the First Time in 15 Years: http:// bit.ly/oc3aEq;;
0;0;IBM Tops Microsoft to Be Second-Most Valuable in Technology - Bloomberg http:// bloom.bg/peQ9eS via @BloombergNews;@BloombergNews;
0;0;The best place to find Microsoft Guitar Hero Games is at eBay. Check it. http:// bit.ly/aaFGSu;;
0;0;Microsoft 's Bing now offers airport maps. http:// bit.ly/pcJ116;;
0;0;iPhone e i suoi cugini fatturano più di tutta Microsoft messa insieme http:// bit.ly/pqYzR4 #apple #microsoft;;#apple #microsoft
0;0;Twitter / A lot of fun things: computer software……..#4: M ...: HAPPENINGS1NOW: computer software..#4: Microsoft ... http:// bit.ly/os2BjD;;#4 #4
1;0;Apple iDevices Make More Money Than All of Microsoft 's Products Put Together http:// bit.ly/mUZK2e;;
0;0;“ @DarkOperator : Microsoft admits Windows Phone 7 user location privacy problems http:// bit.ly/oDMfH2 ”;@DarkOperator;
0;0;#Conface Maintain code consistency with Microsoft StyleCop http:// dlvr.it/nwWNb;;#Conface
0;0;Intunes Partner Account Manager-Incubation Sales Team Job at Microsoft (Dallas, TX): Job Category: Sales Location:... http:// dlvr.it/nwWKS;;
0;0;Anti-virus da Microsoft detecta Chrome como vírus e o remove http:// glo.bo/qrYNMy #Techtudo;;#Techtudo
0;0;Dynamic Health – Goji Juice 32 fl oz liquid Microsoft Dynamics ... http:// dlvr.it/nwWHQ;;
0;0;iPhone, iPod touch And iPad Make More Money Than All Of Microsoft ’s Products Put Together http:// flpbd.it/y62M;;
0;0;New Tech Jobs: SENIOR MECHANICAL ENGINEER - MICROSOFT HARDWARE TEAM Job at Microsoft (Redmond, WA) http:// bit.ly/o0qZwU;;
0;0;Definitely, two of the most popular web web hosting service systems that you can get are Microsoft windows and A... http:// bit.ly/nVuIAc;;
0;0;… http://tattoos -on-heads-and-faces-news.blogspot.com/2011/10/cute-s mall-star-tattoo-on-foot.html … Microsoft Paris Television Mexico;;
0;0;http:// climbclinch2508.blogspot.com/2011/10/cops-r odders-classic-car-and.html … Italy BMW Microsoft Gold Broadway Musicals Exercise Common Law;;
0;0;XBox 360 Check out 'Kinect Sensor with Kinect Adventures!' by Microsoft Software http:// amzn.to/biJtEK;;
0;0;Microsoft Security Essentials confunde a Chrome por un troyano! http://j.mp/oSLX3O;;
0;0;Microsoft Office Professional 2010 ( Mississauga / Peel Region ) $250.00 http:// bit.ly/piCbeU ►Toronto, ON;;
0;0;How Microsoft and Kaspersky Labs Neutralized a Spam Botnet [Security] (Gizmodo) http:// bit.ly/or7paa;;
0;0;Creo que para MS Google lo es RT @a1arte : Microsoft Security Essentials elimina Chrome al confundirlo con un virus http:// bit.ly/qvTSwO;@a1arte;
0;0;RT @theworldwinner Microsoft Security Essentials hates Google Chrome | www.friendzconnect.com http:// bit.ly/rusfXG;@theworldwinner;
0;0;Microsoft Downs Domain that Bred Botnet that Targeted Macs: Mac users uncharacteristically faced Kelihos, a smal... http:// bit.ly/ndbEHW;;
0;0;*That* is funny -> Microsoft “Accidentally” Tags Chrome As Malware - http:// tcrn.ch/mQdoAJ;;
0;0;Microsoft admits Windows Phone 7 user location privacy problems http:// bit.ly/oDMfH2;;
1;0;iPhone, iPod touch And iPad Make More Money Than All Of Microsoft ’s Products Put Together [REPORT] http://www. redmondpie.com/iphone-ipod-to uch-and-ipad-make-more-money-than-all-of-microsofts-products-put-together-report/ … via @TaimurAsad;@TaimurAsad;
0;0;Microsoft Security Essentials hates Google Chrome http:// p.ost.im/p/ejCMXt;;
0;0;#phoneapps #apps Microsoft begins updating phones with Windows Phone 7.5 Mango: Over the air upgrade program... http:// bit.ly/pjCKfH #ab;;#phoneapps #apps #ab
0;0;Microsoft Security Essentials elimina Chrome de Windows y cómo solucionarlo http:// alt1040.com/2011/10/micros oft-security-essentials-elimina-chrome-de-windows-y-como-solucionarlo-2 … vía @alt1040 por si alguien tiene problemas;@alt1040;
0;0;Microsoft Security Essentials flagger Google Chrome som malware http:// newz.dk/n49545;;
0;0;Microsoft Work on Promoting Window Phone 7 - Planet Insane: Planet InsaneMicrosoft Work on P... http:// bit.ly/q8R9Ea ... #nasdaq #stocks;;#nasdaq #stocks
2;0;CONGRATS Microsoft MVP's! Email Name & ID to support@WinPatrol.com for FREE ($29.95) pro comp @WinPatrol PLUS upgrade. #MVPAward;@WinPatrol @WinPatrol;#MVPAward
0;0;"Encyclopedia entry: PWS:Win32/Zbot - Learn more about malware - Microsoft Malware Protection Center" ( http:// bit.ly/reYtWJ )＜家にもあった！注意！;;
0;0;So apparently, the new OWA/Live@edu thing works better in Firefox than IE. Well done @Microsoft !;@edu @Microsoft;
0;0;@officeformac I am wondering why Microsoft Word 2011 for Mac does not have the double-click full text citation feature similar to 2008;@officeformac;
0;0;IBM Tops Microsoft to Become Second-Most Valuable in Technology http:// bit.ly/odWBkU;;
0;0;@SharonHayes Microsoft and Apple. ;-);@SharonHayes;
0;0;TechCrunch: Microsoft "Accidentally" Tags Chrome As Malware http:// tcrn.ch/qK0vlE http:// goo.gl/bfjjW;;
0;0;The Halo license has made Mega Bloks more than just another Lego knock-off. Wonder what behind-closed-doors deals were done with Microsoft .;;
0;0;Microsoft reveals Windows 8 Start Menu http:// bit.ly/qE0Ul1 Jailbreak iOS 5 ipad WP7 windows 8 Android download cydia Sony tablet _21;;
0;0;Apple iDevices Make More Money Than All of Microsoft ’s Products Put Together http:// feedproxy.google.com/~r/iphonedlb/~ 3/BDiqwm6ZdZ4/ …;;
0;0;http:// heartattacks.jugem.jp/?eid=158 Relationship Types Marriage Mercedes Benz Credit Law Topics Microsoft Income Tax GPS Art Television;;
0;0;@thatDIVA microsoft what ?;@thatDIVA;
0;0;I liked a @YouTube video http:// youtu.be/jPG30L9dZs0?a RIP Jamey Rodemeyer - Artwork using Microsoft Word;@YouTube;
0;0;Gears of War 3 - #Xbox -360-Shooter beschert Microsoft den erfolgreichsten UK-Verkaufsstart 2011 http://www. ichspiele.cc/news/gears-of- war-3-verkauft-sich-in-uk-sehr-gut-6630.html … #gow3;;#Xbox #gow3
0;0;Hahaha !!! RT @VentureBeat : Microsoft accidentally deleted Chrome from a few thousand users' computers. Uh... oops? http://ow.ly/6KtCm;@VentureBeat;
0;0;Accidentally my ass: Whoopsie: Microsoft accidentally deletes Chrome from several thousand users’ PCs http:// 6sen.se/qZ3MRc;;
0;0;Microsoft Security Tool IDs Chrome Browser as Malware http:// tinyurl.com/6btnnvc;;
0;0;Microsoft Security Essential elimina Chrome al confundirlo con un virus, jajaja que chafa tenia que ser Window.;;
0;0;IBM Tops Microsoft in Market Value, does this mean a decline of the PC or lack of vision at MS http://j.mp/rdOzTC;;
0;0;Anti-virus da Microsoft detecta Chrome como vírus e o remove http:// glo.bo/qrYNMy #Techtudo;;#Techtudo
0;0;@CheLeapofFaith TO MICROSOFT WORD;@CheLeapofFaith;
0;0;http:// insolvency09051.cocolog-nifty.com/blog/2011/10/i magenes-de-ang.html … Air Travel Star Trek Microsoft GPS RAM Rolling Stones Hummer;;
0;0;Veja abaixo a lista dos dez mais ricos dos EUA*: - 1 – Bill Gates, fundador da Microsoft Idade: 55 Fortuna:... http:// tumblr.com/xre50ffrok;;
0;0;Microsoft to help sell Hyper-V infused Linux distro in China http:// bit.ly/qJFrBy;;
0;0;Acho que a Microsoft só pensa que inova, mas o Windows 8 só um visual diferente. Melhorias mesmo só nos sonhos da M$. kkkkkkk;;
0;0;Microsoft Windows 8 Build 7989 AMD(x64) | Rapidshare, Filesonic ... - http:// bit.ly/r4VyBh ... make Wi... http:// hellotxt.com/andy_4/fiACtg;;
0;0;Caramba @furiagames360 a microsoft tá ferrando com tudo, com as novas dashs..;@furiagames360;
0;0;#Jobs Intunes Partner Account Manager-Incubation Sales Team Job at Microsoft (Dallas, TX) http:// dlvr.it/nwTXK #Dallas #TX;;#Jobs #Dallas #TX
0;0;ビル・ゲイツと Microsoft は、イルミナティなんだって。つーことは、Windowsからも洗脳を受けてるかもしれない。だったら、もしかして、OSをWindowsからLinux系に変えるだけでも相当な意識革命になるのかもしれないって思った。;;
0;0;Microsoft Windows 7 Blood Bath & WPI 2011 X86 (2011 & English): http:// bit.ly/qFWk9K;;
0;0;Cadê, a Microsoft vai copiar o que o #Gnome3 faz com os programas que rode navegador em HTML5? cc @gnomebrasil;@gnomebrasil;#Gnome3
0;0;Windows 7 forgot bill, just want a Microsoft;;
0;0;Que graciosos los de Microsoft al marcar a Chrome como malware. Al parecer no quieren competencia :/;;
0;0;Microsoft Windows 8 Build 7989 AMD(x64) | Rapidshare, Filesonic ... - http:// bit.ly/qxwoHP ... make Wi... http:// hellotxt.com/andy_4/fiACtQ;;
0;0;Microsoft Windows 8 Build 7989 AMD(x64) | Rapidshare, Filesonic ... - http:// bit.ly/pEUDFz ... make Wi... http:// hellotxt.com/andy_4/fiACsw;;
0;0;IBM Unseats Microsoft As Second Most Valued Tech Company http:// goo.gl/x736f;;
0;0;U.S. Internet Explorer 9 usage now at 31% on Windows 7 | WinRumors - http:// bit.ly/qjhSIZ Microsoft continues to .. http:// htxt.it/l/GyACEA;;
0;0;Programming Windows Phone 7, Microsoft XNA Framework Edition ... - http:// bit.ly/qojxF6 Programming Windows Phone .. http:// htxt.it/l/GyACHA;;
0;0;http:// iamcpgermany.wordpress.com Cloud Kid bis zum 30.06.2011 verlängert @microsoft @iamcporg #azure;@microsoft @iamcporg;#azure
0;0;Box Is #Taunting #Microsoft : Box Is Taunting Microsoft Levie is the 26-year-old who co… http:// goo.gl/fb/c4CpA;;#Taunting #Microsoft
0;0;RT @GeeksRoom : #GR Microsoft Security Essentials elimina Chrome al confundirlo con un virus http:// bit.ly/nHq2G4;@GeeksRoom;#GR
0;0;Microsoft SE detecta Chrome como malware y lo borra (0 puntos): Esta mañana, el programa Microsoft Security Esse... http:// bit.ly/nWmrvP;;
0;0;Jobs or Cook, Apple battle vs. Google differs from old Microsoft ... http:// bit.ly/mW6icZ http:// bit.ly/pXjVCG h... http:// bit.ly/pwUIAd;;
0;0;:P http:// gsm-blog.nl/telecom-nieuws /microsoft-zet-webversie-marketplace-voor-windows-phone-online/ … 27 Microsoft zet webversie Marketplac...;;
0;0;27 http:// gsm-blog.nl/telecom-nieuws /microsoft-zet-webversie-marketplace-voor-windows-phone-online/ … Microsoft zet webversie Marketplac... .;;
0;0;Northern Oakland County fun things to do Introduction to Microsoft Excel 2007 http:// buz.tw/YfhME;;
0;0;JUBORAX.com found article on Heise.de Bericht: Microsoft verdient knapp eine halbe Milliarde #an #Android;;#an #Android
0;0;Microsoft Security Essentials elimina Chrome al confundirlo con un virus http:// tinyurl.com/5w3dghh #DaleClick;;#DaleClick
0;0;[UPDATED]Unlock microsoft office 2007 free without _ no download YouTubeflv.webm http:// bit.ly/mOvy8X;;
2;1;Microsoft Security Essentials elimina Chrome al confundirlo con un virus | GeeksRoom http:// geeksroom.com/2011/10/micros oft-security-essentials-elimina-chrome-al-confundirlo-con-un-virus/54207/ … via @GeeksRoom;@GeeksRoom;
0;0;Teacher’s Pet Pre Kindergarten: System Requirements: Microsoft Windows 95 98 Me XP (including... http:// dlvr.it/nwKzZ http:// bit.ly/mQ3zzA;;
0;0;Teacher’s Pet Pre Kindergarten: System Requirements: Microsoft Windows... http:// dlvr.it/nwKxQ #Learning_Software_Children #Kindergarten_;;#Learning_Software_Children #Kindergarten_
0;0;Microsoft Security Essentials elimina Chrome al confundirlo con un virus http:// bit.ly/nHq2G4;;
0;0;Microsoft Files Patent for Automatic Child Lock Security System [Want to Make ... - TFTS (blog) http:// bit.ly/nghbbP;;
0;0;D'oh! RT @TechCrunch : Microsoft "Accidentally" Tags Chrome As Malware http:// tcrn.ch/qK0vlE;@TechCrunch;
0;0;Que coincidencia que el antivirus de Microsoft confunda a Chrome como un Malware...;;
0;0;VTC Microsoft Visual CSharp dotNET-Tutorials: Image: http:// img828.imageshack.us/img828/1386/vt cmicrosoftvisualc … ... http:// bit.ly/njTDZ7;;
0;0;VTC Microsoft Visual CSharp dotNET-Tutorials: Image: http:// img828.imageshack.us/img828/1386/vt cmicrosoftvisualc … ... http:// bit.ly/njTDZ7;;
0;0;IAMCP Germany Blog http:// iamcpgermany.wordpress.com @microsoft @iamcporg #azure;@microsoft @iamcporg;#azure
0;0;@GamersZoo Please RT We will give away 1600 Microsoft points or a Playstation Membership when we reach 250 followers! bit.ly/p0ouaq;@GamersZoo;
0;0;¿Chrome es un virus?: Microsoft cree que sí - http://www. efectosocial.net/2011/10/01/%c2 %bfchrome-es-un-virus-microsoft-cree-que-si/ … vía @FitoElizond0;@FitoElizond0;
0;0;Microsoft kills Google Chrome with bad malware signature http:// bit.ly/o0i5I2;;
0;0;@amy_hearts_asw yeah. Sure anytime you need me!over here Microsoft office publisher or Microsoft office word work fine, mine are from there!;@amy_hearts_asw;
0;0;Dance Central with 240 Microsoft Points by Microsoft Platform:   Xbox 360(91)Buy new: $49.99 $45.96 43 used & ... http:// amzn.to/r3uo4a;;
0;0;Microsoft reveals Windows 8 Start Menu http:// bit.ly/qE0Ul1 Jailbreak iOS 5 ipad WP7 windows 8 Android download cydia Sony tablet _56;;
0;0;Microsoft Lebanon Boards the Social Media Ship http:// bit.ly/piZ1yj;;
0;0;LOOK: Microsoft Xbox 360 Arcade http://www. gamescentral.info/consoles/xbox3 60-consoles/microsoft-xbox-360-arcade/ …;;
0;0;How Microsoft and Kaspersky Labs Neutralized a Spam Botnet [Security] http:// bit.ly/ojuR0b;;
0;0;@RavieSexiCool lol you say installed like its microsoft word you so silly;@RavieSexiCool;
0;0;Microsoft Security Essentials (Anti-virus Gratuito) elimina Chrome al confundirlo con un virus;;
0;0;Forza 4 - by Microsoft http:// adf.ly/2ZtU4;;
0;0;http:// coke090211news.cocolog-nifty.com/blog/2011/10/p revious-episod.html … Toyota Guild Beijing Game Fruit Capitalism Scholarship Microsoft;;
0;0;Microsoft 70-576 Exam #certification http:// bit.ly/qEM8IS;;#certification
0;0;If this boy can't compete with the #iPhone , Microsoft is going further down - http:// arstechnica.com/microsoft/revi ews/2011/10/real-competition-from-redmond-windows-phone-7-mango-reviewed.ars … #fb;;#iPhone #fb
0;0;#IPv6 repost Got an error from the Microsoft Teredo Tunneling Adapter driver in Windows 7? If u use ZoneAlarm, u... http:// bit.ly/nYzyBT;;#IPv6
0;0;Me entero que Microsoft Security Essentials AntiVirus confundió a Chrome con un Virus. JA!;;
0;0;Anyone want 400 microsoft points?;;
0;0;Microsoft Crm Dynamics http://www. enire.com/software/micro soft-crm-dynamics-t26886.html … : Microsoft Crm Dynamics http://www. enire.com/software/micro soft-crm-dynamics-t26886.html … http:// bit.ly/oNnxpV;;
1;0;Social CRM, Office 365 Coming to Microsoft Dynamics CRM http:// bit.ly/n8UhFW #CRM : Social CRM, Office 365 Coming... http:// bit.ly/qiymPo;;#CRM
0;0;Check this video out -- RIP Jamey Rodemeyer - Artwork using Microsoft Word http://www. youtube.com/watch?v=jPG30L 9dZs0&feature=share … via @youtube;@youtube;
0;0;IBM supera Microsoft em valor de mercado, diz jornal http:// bit.ly/qX184S -;;
0;0;Tips for Putting the 'Use' in Microsoft Dynamics CRM User Adoption ... http:// goo.gl/sUJF3 : Tips for Putting th... http:// bit.ly/pP07Rt;;
0;0;sony son los papas biologicos de microsoft !!;;
0;0;Microsoft Security Essentials elimina Chrome al confundirlo con un virus http:// dlvr.it/nwS2y;;
0;0;Microsoft Security Essentials elimina Chrome al confundirlo con un virus http:// bit.ly/pES2QI;;
0;0;Microsoft Security Essentials elimina Chrome al confundirlo con un virus http:// dlvr.it/nwS5t;;
0;0;Microsoft Security Essentials elimina Chrome al confundirlo con un virus http:// dlvr.it/nwS4f;;
0;0;Microsoft Security Essentials elimina Chrome al confundirlo con un virus http:// dlvr.it/nwS49 #Geeks_Rooms;;#Geeks_Rooms
0;0;Microsoft Security Essentials elimina Chrome al confundirlo con un virus http:// dlvr.it/nwS0h;;
2;0;Microsoft Security Essentials elimina Chrome al confundirlo con un virus http:// dlvr.it/nwRzD;;
0;0;@CeRealHeartless Sister just translate it on Microsoft word.;@CeRealHeartless;
0;0;pqp a microsoft ta me fudendo msm;;
0;0;Microsoft Office 2010 Professional Plus with SP1 VL Edition x64-ZWTiSO http:// is.gd/qQXkNM;;
0;0;Black Silicone Skin Cover Case + Sport Exercise Armband For Microsoft ZUNE 30GB 30G MP3 Digital Media Player: http:// amzn.to/mWPc0F;;
0;0;Microsoft может получать $444 млн в год за Android: В течение года на лицензионных отчислениях за Android-устрой... http:// bit.ly/oHSIs1;;
0;0;iPhone, iPod touch And iPad Make More Money Than All Of Microsoft ’s Products Put Together [REPORT] http:// bit.ly/qlVsMi;;
0;0;Microsoft AV Mistakes Google Chrome For a Virus http://www. pcmag.com/article2/0,281 7,2393985,00.asp … via @pcmag;@pcmag;
0;0;Microsoft security tools deleting Google Chrome from Windows PCs http:// latimesblogs.latimes.com/technology/201 1/09/microsoft-security-tools-deleting-google-chrome-from-windows-pcs.html … via @latimestech;@latimestech;
0;0;Microsoft Lebanonopened its doors to the social media for the first time on the afternoon of Mo... http:// bit.ly/pBRMke #uk #socialmedia;;#uk #socialmedia
0;0;http:// saw090511news.cocolog-nifty.com/blog/2011/10/j ewish-wedding.html … Debt Brad Pitt Wall Street Microsoft Fax Shower Finance Garden;;
0;0;Microsoft Shows Off Kinect and Windows Phone 7.5 Integration [VIDEO]: http:// bit.ly/nwk0yK WP7 windows 8 download ios 5 jailbreak _53;;
0;0;http:// tinyurl.com/65ana5c #IBM dépasse #Microsoft en capitalisation boursière - Clubic.com;;#IBM #Microsoft
0;0;How to Uninstall Microsoft Internet Explorer 9 (IE 9) in Windows 7 or Windows Vista - As we already told you... http:// tinyurl.com/3b7ngyx;;
0;0;Microsoft accidentally deletes Chrome from several thousand users’ PCs http:// venturebeat.com/2011/09/30/bal eted/ … vía @venturebeat;@venturebeat;
0;0;Microsoft Security Essentials elimina Chrome al confundirlo con un virus http:// dlvr.it/nwRsd;;
0;0;Anyone know how to make a brochure on the microsoft please tell me;;
0;0;@WarrenRiddell and I mean BARE, Microsoft developer tools, kinect developer tools, windows 7 and everything;@WarrenRiddell;
0;0;Microsoft Security Essentials elimina Chrome al confundirlo con un virus http:// bit.ly/nHq2G4;;
1;0;Microsoft Security Essentials elimina Chrome al confundirlo con un virus http:// bit.ly/rnVb4L [ @geeksroom ];@geeksroom;
0;0;Microsoft Security Essentials elimina Chrome al confundirlo con un virus http:// bit.ly/rnVb4L;;
1;0;Microsoft Security Essentials elimina Chrome al confundirlo con un virus http:// bit.ly/py5ZmJ;;
