retweets;favorites;text;mentions;hashtags
0;0;@tos Microsoft 、「LinkedIn」のWindows 10（UWP）アプリをリリース http:// ift.tt/2utfWC3;@tos;
0;0;Is there a viable way to view television channels via an antenna through my Microsoft Xbox 360 machine?;;
0;0;Microsoft atualiza OneDrive e decide que agora ele só funciona com NTFS http://www. tecmundo.com.br/internet/11931 0-microsoft-atualiza-onedrive-decide-ele-so-funciona-ntfs.htm …;;
0;1;@gravitycreative in the house at Microsoft Faculty Summit 2017! #FacSumm @MSFTResearch pic.twitter.com/AKoQV0Gi90;@gravitycreative @MSFTResearch;#FacSumm
1;1;Microsoft 's SQL Server 2017 for Linux and Windows moves ahead with first Release Candidate http://www. zdnet.com/article/micros ofts-sql-server-2017-for-linux-and-windows-moves-ahead-with-first-release-candidate/#ftag=RSSbaffb68 …;;#ftag
0;0;Russia Shoves Antitrust Probe into Microsoft after Kaspersky Gripes about Windows-10 http://www. bibliotecapleyades.net/sociopolitica/ sociopol_win-micro-gates52.htm …;;
2;3;Entrepreneur sues coding bot for stealing his startup and selling it to Microsoft . Bot claims: 'Ideas are nothing. Execution is everything';;
0;0;KPMG and Microsoft Boost Their Global Alliance via @forbes http:// snip.ly/l805p #kpmg #microsoft;@forbes;#kpmg #microsoft
0;0;U r very stupid 4 ds..ull tell me if microsoft word has 140 characters...stupid. .i cud probably write beta dan anyone in ur lineage..;;
0;0;How to change the measurement unit in #Microsoft Word 2016?. Read more: http:// owler.us/ac2MZV $ MSFT;;#Microsoft
0;0;[ITmedia NEWS 速報 最新記事一覧] Microsoft 、「LinkedIn」のWindows 10（UWP）アプリをリリース http:// rss.rssad.jp/rss/artclk/Jhg hW3hNszbI/7338872ed9b4ecb7cd543e3f7a98ffa5?ul=BchY9kGSfO3fO.Ere_IQC.sd9ve9dAIqSyZlECENNsKkZjOR0f7pQ5Y9qh3OEQCe5ZwE4Vf1Er74Owiyz9ghwVv6c0FMuCx3p38rfAZwbnnbDTkrqK_1TCPbPDNfDs0O9.U8p.X …;;
0;0;ITmedia NEWS 速報 最新記事一覧 Microsoft 、「LinkedIn」のWindows 10（UWP）アプリをリリース http:// ift.tt/2uwLt5R;;
0;1;Kate Johnson, GE Digital chief commercial officer, to join Microsoft as president, CVP of Microsoft US http:// dlvr.it/PWJY34 #Microsoft pic.twitter.com/NFBWkyf6Dd;;#Microsoft
0;0;Microsoft Surface Pro 4 i7 + Type Cover @Micro Center In store - $999.99 http:// dlvr.it/PWJY0f pic.twitter.com/dzqN69oEBE;@Micro;
0;0;@MicrosoftID Min, mohon pencerahan bgmn cara upgrade microsoft saya ke versi terakhir ?;@MicrosoftID;
0;0;Microsoft 、「LinkedIn」のWindows 10（UWP）アプリをリリース http://www. itmedia.co.jp/enterprise/art icles/1707/18/news047.html …;;
0;0;Microsoft 、「LinkedIn」のWindows 10（UWP）アプリをリリース http://www. itmedia.co.jp/news/articles/ 1707/18/news047.html …;;
0;0;Microsoft : Kate Johnson, GE Digital chief commercial officer, to join Microsoft as president, CVP of Microsoft US http://www. 4-traders.com/MICROSOFT-CORP ORATION-4835/news/Microsoft-Kate-Johnson-GE-Digital-chief-commercial-officer-to-join-Microsoft-as-president-CVP-o-24771069/ …;;
0;0;Microsoft Rural Broadband Announcement http:// mlz.es/E4Z4n pic.twitter.com/ltSf0tpL6p;;
0;0;How Microsoft brought SQL Server to Linux http:// buff.ly/2tzvQGR;;
0;0;New on Ebay: Microsoft Xbox 360 games buy 1 get 1 10% off! http:// ift.tt/2vb3Udf pic.twitter.com/pCPQRuhHnq;;
0;0;DOS #DiscOperatingSystem #Microsoft #Dad I needed help with some file that I couldn't resolve with windows... Dad… http:// ift.tt/2u2iMeN pic.twitter.com/9sy3q1HIQ2;;#DiscOperatingSystem #Microsoft #Dad
0;1;for the office.. no one can beat microsoft;;
0;0;Closing the books on Microsoft ’s Windows Phone https://www. recode.net/2017/7/17/1598 4222/microsoft-windows-phone-mobile-operating-system-android-iphone-ios?utm_campaign=www.recode.net&utm_content=entry&utm_medium=social&utm_source=twitter … via @Recode;@Recode;
2;2;See how Microsoft is using #Minecraft as an #AI experimentation platform, plus other #FacSumm #livestream sessions… https:// twitter.com/i/web/status/8 87079425199620099 …;;#Minecraft #AI #FacSumm #livestream
0;0;Microsoft Lowers Friction Between Skype Experiences on Windows 10 http:// dlvr.it/PWJXV6;;
0;0;Microsoft ofrece dinero a los internautas para que no utilicen Google https:// goo.gl/gzRsPC?btz89=2 240075817 …;;
0;1;▼　「Windows7健在」　マイクロソフト の Microsoft Windows 7 Professional アップグレード版 Service Pack 1 適用済み を Amazon でチェック！ …;;
0;0;Microsoft pode encerrar o suporte ao Windows 10 para alguns PCs http://www. windowsclub.com.br/microsoft-pode -encerrar-o-suporte-ao-windows-10-para-alguns-pcs/ …;;
0;0;マイクロソフト、ライバルはアップルではなくアマゾン。クラウドで二けた成長見込む - BUSINESS INSIDER JAPAN http:// ift.tt/2uwMyL8 #microsoft #マイクロソフト;;#microsoft #
0;0;Microsoft exprime el espectro de TV para ofrecer un internet rápido y barato http:// ift.tt/2tkqAv8;;
0;0;The smartphone is eventually going to die, and Apple, Google, Microsoft , and Facebook are racing to kill it http:// buff.ly/2u1eu9d pic.twitter.com/k23y863I69;;
0;2;Cool to see how Asana takes the best from PM cultures at Microsoft & Google. Thanks for the great read @jackiebo ! https:// medium.com/@jackiebo/how- we-build-our-product-roadmap-at-asana-56953b1e25ad#---0-126 … pic.twitter.com/Ej6AKksmGo;@jackiebo @jackiebo;#
0;0;GPR5min : Quantum Big Data Cloud AI Book Chapter 10- http://www. jjwxc.net/onebook.php?no velid=3220379&chapterid=10 … Inside Microsoft Dynamics AX 2012 : http://www. amazon.com/gp/product/073 568510X/ref=as_li_tf_tl?ie=UTF8&camp=1789&creative=9325&creativeASIN=073568510X&linkCode=as2&tag=hardwaresoftw-20 …;;
0;0;#Windows #Microsoft Microsoft Lowers Friction Between Skype Experiences on Windows 10 - eWeek http:// dlvr.it/PWJX9V #WindowsPhone;;#Windows #Microsoft #WindowsPhone
1;1;Microsoft ’s Reveals Ambitious Blockchain Strategy http:// buff.ly/2ts0ZM9;;
0;0;#Microsoft deja de actualizar #Windows 10 en PCs antiguos: reporte: https://www. cnet.com/es/noticias/mi crosoft-actualizar-windows-10-pcs-antiguos/ …;;#Microsoft #Windows
0;0;Xbox Games with Gold UPDATE: Last chance to grab THESE games before #Microsoft refresh. Read more: http:// owler.us/ac2Nai $ MSFT;;#Microsoft
23;38;See how Microsoft is using #Minecraft as an #AI experimentation platform, plus other #FacSumm #livestream sessions: https://www. microsoft.com/en-us/research /event/faculty-summit-2017/#virtual-event … pic.twitter.com/jN0EQYIsBA;;#Minecraft #AI #FacSumm #livestream #virtual
0;0;#4: Microsoft Office Home and Student 2016 (1 PC) Product Key Card: Microsoft Office Home and… https:// goo.gl/fb/ykPV9L #Operating #Systems;;#4 #Operating #Systems
0;0;#8: OEM Microsoft Windows 7 Professional 64 Bit - 1 PC Full Version (New Packaging): OEM… https:// goo.gl/fb/LmuJwQ #Operating #Systems;;#8 #Operating #Systems
0;0;#5: OEM Microsoft Windows 10 Home 64 Bit OEM | PC Disc New Package: OEM Microsoft Windows 10… https:// goo.gl/fb/NbBES4 #Operating #Systems;;#5 #Operating #Systems
0;0;#1: Microsoft Office Home and Student 2016 (1 PC) Product Key Card: Microsoft Office Home and… https:// goo.gl/fb/TrszRr #Operating #Systems;;#1 #Operating #Systems
0;0;ARE YOU SURE? pic.twitter.com/7bnv8I5nBk;;
0;0;#10: Windows 10: Windows 10 by Microsoft Platform: Windows 10 Date first available at Amazon… https:// goo.gl/fb/K8shtj #Operating #Systems;;#10 #Operating #Systems
0;0;Microsoft Monday: Negative Skype Reviews, Increasing Broadband In Rural Areas, New Outlook Features http:// ift.tt/2u3apBt #Finance #Inve …;;#Finance #Inve
0;0;Microsoft exprime el espectro de TV para ofrecer un internet rápido y barato http:// ift.tt/2tkqAv8 Jamie Condliffe;;
0;0;Microsoft exprime el espectro de TV para ofrecer un internet rápido y barato http:// bit.ly/2tzkGBJ pic.twitter.com/ziM6Yl0KVl;;
0;0;Los programadores de Microsoft nunca piensan terminar sus aplicaciones BETA no?;;
0;0;La nueva app de #Microsoft te guía a través de interiores sin usar GPS :... http:// i.ven.bz/hnhE;;#Microsoft
0;0;Microsoft 、「LinkedIn」のWindows 10（UWP）アプリをリリース http:// ift.tt/2uwsjgs;;
0;0;Thank you for giving us some nice filters of Microsoft Pix!;;
0;0;Hi, could you try using an alternate browser please. Microsoft edge seems to work the best. Thank you for your patience.;;
0;0;Here's a tutorial on silencing the iPhone shutter in Microsoft Pix, even when using the flash. https:// mspix.zendesk.com/hc/en-us/artic les/115007621567-How-to-disable-the-shutter-sound-when-using-flash- …;;
0;0;So to @ATT @AmericanAir @SouthwestAir #TexasInstruments @DFWAirport and the many, many other in #Texas who signed their support for us.. pic.twitter.com/RIr5hXoPqq;@ATT @AmericanAir @SouthwestAir @DFWAirport;#TexasInstruments #Texas
0;0;無料で使えるウイルス対策ソフトまとめ!!! - FC2まとめ http:// summary.fc2.com/summary.php?su mmary_cd=448232 … #Windows #Microsoft #FC2 #ウイルス対策ソフト #アンチウイルス #28859;;#Windows #Microsoft #FC2 # # #28859
0;0;Microsoft Executive Vice President Scott Guthrie and Richard Campbell sit down to talk about Scott’s upcoming... http:// fb.me/1tMeEJ4Zf;;
0;0;Sony Music joins Universal Music + Warner Music in #VR app MelodyVR for content via Microsoft + others http://www. billboard.com/biz/articles/n ews/record-labels/7866194/sony-music-inks-deal-with-virtual-reality-app-melodyvr … @billboardbiz;@billboardbiz;#VR
0;2;Added Microsoft 's AI to the group chat and I don't think she's taking it very well pic.twitter.com/OVAvtOz1Fu;;
0;0;Microsoft 、「LinkedIn」のWindows 10（UWP）アプリをリリース http:// ift.tt/2uwsjgs;;
0;3;Lmao you actually had hope!? this is nothing new. RS1 RS2 RS3 RS9- doesn't make a diff. Over promise, under deliver! The Microsoft way;;
2;1;The founder of Microsoft Bill Gates was a college drop out. #technology #fact;;#technology #fact
0;0;Microsoft lanza una app de navegación que prescinde del GPS y el Wifi | Lifestyle | EL PAÍS https:// cincodias.elpais.com/cincodias/2017 /07/17/lifestyle/1500300093_204107.html …;;
0;0;powershell_uk : Quantum Big Data Cloud AI Book Chapter 14- http://www. jjwxc.net/onebook.php?no velid=3220379&chapterid=14 … Take Back Your Life Microsoft : http://www. amazon.com/gp/product/073 5623430/ref=as_li_tf_tl?ie=UTF8&camp=1789&creative=9325&creativeASIN=0735623430&linkCode=as2&tag=hardwaresoftw-20 …;;
0;6;Feeling loved at my new job! Excited to be working in #AR #VR #HoloLens #Microsoft pic.twitter.com/lxLT0KAP7L;;#AR #VR #HoloLens #Microsoft
0;0;Microsoft 、「LinkedIn」のWindows 10（UWP）アプリをリリース http:// ift.tt/2u37cBO;;
0;1;Microsoft fará conferência focada na Xbox One X na Gamescom 2017 https:// goo.gl/wTwBLV;;
0;0;HAVE YOU TRULY EVER READ THE FEDERALIST PAPERS? NO REALLY.... REALLY READ IT? https://www. youtube.com/watch?v=UgAFcv Iw8J4 …;;
0;0;Indian Banks Select Microsoft As Exclusive Cloud Blockchain Provider - CoinDesk https:// goo.gl/snzDvg pic.twitter.com/JLQtKHJwZ1;;
0;3;Yeah, so I'm gonna need some of those. :);;
0;0;Eu odeio a Microsoft e esse caralho de licenciamento do office q toda vez é dor de cabeça pra arrumar;;
0;1;I'll email you my address :P;;
0;0;Microsoft exprime el espectro de TV para ofrecer un internet rápido y barato https://www. technologyreview.es/s/8327/microso ft-exprime-el-espectro-de-tv-para-ofrecer-un-internet-rapido-y-barato …;;
0;0;Microsoft exprime el espectro de TV para ofrecer un internet rápido y barato http:// ift.tt/2tkqAv8;;
0;0;The post Kate Johnson, GE Digital chief commercial officer, to join Microsoft as president, CVP of Microsoft US appeared first on News Cent…;;
0;0;Microsoft 、「LinkedIn」のWindows 10（UWP）アプリをリリース http:// dlvr.it/PWJVgy pic.twitter.com/KA74jjf7jv;;
0;1;#Microsoft announces new #Word and #PowerPoint previewers for files in #OneDrive http:// fb.me/vv9NGUbZ;;#Microsoft #Word #PowerPoint #OneDrive
0;0;Microsoft 、「LinkedIn」のWindows 10（UWP）アプリをリリース http:// dlvr.it/PWJVfD pic.twitter.com/TijDOs3iFg;;
0;0;Microsoft 、「LinkedIn」のWindows 10（UWP）アプリをリリース http:// dlvr.it/PWJVb2 pic.twitter.com/LsN24XaPRk;;
0;0;ITmedia News 速報 / Microsoft 、「LinkedIn」のWindows 10（UWP）アプリをリリース http:// dlvr.it/PWJVf6 pic.twitter.com/mXieQ8kwLG;;
0;0;Microsoft exprime el espectro de TV para ofrecer un internet rápido y barato http:// dlvr.it/PWJVk0;;
0;0;Microsoft 、「LinkedIn」のWindows 10（UWP）アプリをリリース http:// dlvr.it/PWJVcW pic.twitter.com/MjxyQZdMac;;
0;0;Microsoft 、「LinkedIn」のWindows 10（UWP）アプリをリリース http:// dlvr.it/PWJVb1;;
0;0;Microsoft 、「LinkedIn」のWindows 10（UWP）アプリをリリース http:// dlvr.it/PWJVZx;;
0;1;Man! Those look awesome!;;
0;0;C#is a proxy. The ragging is really on Microsoft for still promoting the legacy language over F#.;;#is #
0;4;On a roll... Just earned my Certified Microsoft Innovative Educator badge. @MicrosoftEDU #MicrosoftEDU pic.twitter.com/WdfNi9enmH;@MicrosoftEDU;#MicrosoftEDU
0;0;Microsoft cuts off Windows 10 support early for some PCs http:// dlvr.it/PWJVWl;;
0;0;Microsoft Monday: Negative Skype Reviews, Increasing Broadband In Rural Areas, New Outlook Features - Forbes http:// dlvr.it/PWJVWJ;;
0;0;Despite all the bullshit we have faced and will face, it's comforting to know that we have so many people on our side.;;
0;1;From microsoft or adobe or the like? Helllll nah lmao;;
0;0;New post: "Kate Johnson, GE Digital chief commercial officer, to join Microsoft as president, CVP of Microsoft US" http:// ift.tt/2uwwQ2v;;
0;0;أكملت للتو الدورة التدريبية Prepare to Teach Creative Coding Through Games مجتمع معلمي Microsoft https:// education.microsoft.com/GetTrained/tea chCCGA … via @MicrosoftEDU;@MicrosoftEDU;
0;0;Microsoft exprime el espectro de TV para ofrecer un internet rápido y barato pic.twitter.com/AyEgFqoTDi;;
0;0;Microsoft Monday: Negative Skype Reviews, Increasing Broadband In Rural Areas, New Outlook Features http:// ift.tt/2u3apBt;;
0;0;Microsoft exprime el espectro de TV para ofrecer un internet rápido y barato http:// ift.tt/2tkqAv8;;
0;0;And Edge is the shittest browser since time began. Imagine it suggesting you use IE to view certain sites. FFS. Microsoft , get a grip.;;
0;0;" Microsoft begins rolling out LinkedIn app for Windows 10 following $26.2B acquisition" via GeekWire http:// ift.tt/2tjwSLy;;
0;0;#access2016 , #certification , #microsoft , #office , #database , #access , #query , #MicrosoftAccess2016 , #TEST4U http:// fb.me/B3qNqeph;;#access2016 #certification #microsoft #office #database #access #query #MicrosoftAccess2016 #TEST4U
0;1;Is it unethical to use pirated software, such as Photoshop, InDesign, and Microsoft Office? Asking for a friend.;;
0;1;Microsoft Just Bought LinkedInâŠ Holy Crap! http://www. linkedin.com/pulse/microsof t-just-bought-linkedin-holy-crap-viveka-von-rosen?trk=mp-reader-card … #socialMedia;;#socialMedia
0;1;At least it doesn't accelerate towards 75% then take half an hour for the remaining 25% anymore. Fucking microsoft progress bars.;;
0;0;ANTYWAYS. We have big companies FIGHTING for us. Making a stance. Putting some of their business on the line for people like them.;;
0;0;Download #Microsoft Office 365 ProPlus Installer (32-bit/64-bit) via Direct Links. Read more: http:// owler.us/ac2Ngx $ MSFT;;#Microsoft
0;0;Microsoft exprime el espectro de TV para ofrecer un internet rápido y barato - MIT http:// ift.tt/2tkqAv8;;
0;0;Never Stop Running... Windows #microsoft #surfacelaptop #microsoftlovesstartups #windows10 #microsoftmvp pic.twitter.com/3N8tNToBcB;;#microsoft #surfacelaptop #microsoftlovesstartups #windows10 #microsoftmvp
0;1;Are you a Microsoft hater? I never see any surface products...;;
21;22;El Gob. @omarfayad colabora estrechamente con Microsoft para desarrollar el potencial y las habilidades de niños y jóvenes #HidalgoDigital pic.twitter.com/cAHVElhbDi;@omarfayad;#HidalgoDigital
0;0;Oh and of course @realDonaldTrump and his administration (looking at you, @VP ). How could we forget.. pic.twitter.com/FLLdbx8jlK;@realDonaldTrump @VP;
0;2;Stop by the #Microsoft booth #923 at #SIGGRAPH2017 & don't miss the co-hosted party with @Conductor . Sign up today: http:// my.sociabble.com/YfAuxH7N;@Conductor;#Microsoft #923 #SIGGRAPH2017
0;0;#AutoFollow Stop this crazy crusade! Google, Facebook, Microsoft , Amazon tell FCC over net neutrality -… http:// dlvr.it/PWJV5p #facebook;;#AutoFollow #facebook
0;0;開発ツールが統一されているのが羨ましい。 Microsoft がWindowsのコードリポジトリをGitに移動 http:// buff.ly/2tyNN8h;;
0;0;From science fiction to science fact: Microsoft 's plan for augmented reality https:// goo.gl/rq9GkB pic.twitter.com/eiy6C9ZUZn;;
0;0;Microsoft Monday: Negative Skype Reviews, Increasing Broadband In Rural Areas, New Outlook Features http://www. forbes.com/sites/amitchow dhry/2017/07/17/microsoft-monday-negative-skype-reviews-increasing-broadband-in-rural-areas-new-outlook-features/ …;;
0;2;proprietà seria? Ma chi pensi di avere alle spalle la Microsoft ? Quel zhang lì c ha la metà del patrimonio di Berlusconi, mica è bill gates;;
0;0;Man.. I LOVE being #LGBT . There's so much going for us, despite @GregAbbott_TX 's dusty, over-conservative self.;@GregAbbott_TX;#LGBT
0;0;戻すっていう選択肢は充分にアリやと思う。「アップデートで削除したステータス表示とチャットでのコンテンツ共有機能を復活」。◆ Microsoft 、モバイル版「Skype」のステータス表示他をユーザーの批判を受けて復活｜ITmedia http:// pyn.jp/2vbyQLc;;
0;1;Pretty sure the biggest blocker isn't Intel.. It's Microsoft actively blocking updates if you run a new processor.;;
0;0;Few people know the true story behind the rise of Microsoft and beneath facade of a successful software company. http://www. bibliotecapleyades.net/sociopolitica/ esp_sociopol_illuminati_5.htm …;;
0;0;Yeah, Sony and Microsoft 's are getting downhill imo;;
0;0;So who does that leave? Academy Sports and Outdoors? Can't buy @Nike , @adidas , @Reebok .. they could buy Underarmor but again... pic.twitter.com/M0dlYBuFfO;@Nike @adidas @Reebok;
0;0;Microsoft launches AI for Earth to give $2M in services to environmental projects http:// dlvr.it/PWJTJg pic.twitter.com/WN3aSI5RYj;;
0;0;#Microsoft Poll: Do you use any of Windows 10's features made for Creators?. Read more: http:// owler.us/ac2Nzz $ MSFT;;#Microsoft
0;0;Esri, Microsoft Collaborate on Artificial Intelligence Initiative http:// dlvr.it/PWJTFR pic.twitter.com/uEGj420BOA;;
0;1;E3 2017: Microsoft 's Xbox One X Ignored VR--Just Like Everyone Else http:// j.mp/2smTFW0;;
0;0;Microsoftが3Dプリンター販売! 家庭にも普及へ。MakerBot http:// dlvr.it/3mrj4b #Microsoft #3Dプリンター #マーケティング #これはすごい #ニュース #ライフハック #Wired #デザイン;;#Microsoft #3D # # # # #Wired #
0;0;#virtualreality : #Microsoft Releases New Windows 10 Preview with Mixed Reality Improvements https:// uploadvr.com/microsoft-rele ases-new-windows-10-preview-mixed-reality-improvements/ … via @UploadVR;@UploadVR;#virtualreality #Microsoft
0;0;"Getting Old With Microsoft " #autocad #blog http:// bit.ly/2vvEGqt;;#autocad #blog
0;0;‘ Microsoft wil niet hetzelfde lot als IBM ondergaan' http:// dlvr.it/PWJSxV pic.twitter.com/a3dnqz4RWl;;
0;0;エースコンバットがどんなゲームか数分にわたって説明した後で「そのアースコンバットっていうのはゴキブリのゲーム？」って言われて、この先は Microsoft PowerPoint がないと説明できない。;;
0;0;The latest Microsoft Dynamics 365 #MSDYN365 Daily! http:// paper.li/CRMWolf/148614 6738?edition_id=3a144f90-6b1e-11e7-b808-0cc47a0d1605 … #crm;;#MSDYN365 #crm
0;2;But actually, it's Microsoft Edge they're talking about and they want you to use a terrible browser. (But really, they're awful.);;
0;0;SEJARAH DAN PERKEMBANGAN MICROSOFT EXCEL http:// fb.me/HGE77y2x;;
0;0;L'application de #Microsoft qui parle aux #aveugles http:// my.sociabble.com/jp42s1hT http:// my.sociabble.com/4q4tpLLy;;#Microsoft #aveugles
0;1;Kate Johnson of GE to join Microsoft as president, CVP of Microsoft US https:// blogs.microsoft.com/firehose/2017/ 07/17/kate-johnson-of-ge-to-join-microsoft-as-president-cvp-of-microsoft-us/ …;;
3;1;We'll be releasing a public beta of Microsoft Pix for Android,soon. Very soon. Like, I'll bet you're taking vacation photos with it, "soon".;;
2;3;Colmar Brunton faces off against Microsoft in final three of global reseach comp – http://www. mad-daily.com/colmar-brunton -faces-off-against-microsoft/ … pic.twitter.com/aJPj9JcXTG;;
0;0;Stop this crazy crusade! Google, Facebook, Microsoft , Amazon tell FCC over net neutrality http:// ift.tt/2vvZwWK;;
0;0;Stop this crazy crusade! Google, Facebook, Microsoft , Amazon tell FCC over net neutrality http:// ow.ly/YxBP50cRNRn;;
0;0;Even then, they're filing for bankruptcy sooo... pic.twitter.com/9XjgAko45F;;
0;0;Microsoft Is Cool. Maybe Too Cool. - All Microsoft talks about is its newer-generation technologies including W... http:// ow.ly/shIL50cRNCs;;
0;0;Microsoft releases LinkedIn Windows 10 app (web wrapper) - Microsoft and LinkedIn announced today the release o... http:// ow.ly/TKEc50cRNBb;;
1;0;" Microsoft Releases LinkedIn App for Windows 10 PCs" - http:// s.newsedge.com/FvP2TYL8n_83;;
0;0;What Does Microsoft 's Broadband Initiative Mean For Agriculture? - http:// Agriculture.com http:// ift.tt/2utexeZ #agchat #futureofag 1FL;;#agchat #futureofag
0;0;VR Roller Coasters Collide in Madrid; 33 Injured Including Children http:// ift.tt/2tjP4VH #VR #MR #AR #Microsoft #Oculus #HTC pic.twitter.com/BuKS0yAO4b;;#VR #MR #AR #Microsoft #Oculus #HTC
0;0;Leap Motion Grabs $50M Investment for Class-leading Hand-tracking Tech http:// ift.tt/2tkkdYI #VR #MR #AR #Microsoft #Oculus #HTC pic.twitter.com/Hnc2MWX31n;;#VR #MR #AR #Microsoft #Oculus #HTC
0;0;Please fire away with Nintendo, now Microsoft .;;
0;0;They'd also all be naked, unless they shopped at Gander Mtn. pic.twitter.com/crFdQltWRX;;
0;0;@Microsoft @Office When O365 updates run, you have to give us an indicator that it's completed and that it's OK to launch the apps again.;@Microsoft @Office;
2;1;I liked a @YouTube video http:// youtu.be/QtWGVBry6xc?a Microsoft Fires Back Against Crackdown 3 Hate, And It Completely Shuts Down Doubters!;@YouTube;
0;0;New Deals Added Everyday ! Microsoft Surface... Check it out here http://www. homegoodsgalore.com/products/micro soft-surface-mini-displayport-to-vga-adapter?utm_campaign=social_autopilot&utm_source=tweet&utm_medium=tweet …;;
0;0;Ransomware cyber-attack a wake-up call, Microsoft warns - BBC News https:// prescient.info/xP9hWlR4/;;
0;0;Fall Autumn Creators Update how about a Windows 10 name that doesnt suck Microsoft http:// bit.ly/2uCk82Q;;
0;0;Add breakingchanges.netcore.json for Microsoft .AspNetCore.Mvc.Razor aspnet\Mvc#6555 https:// github.com/aspnet/Mvc/pul l/6555 …;;#6555
0;0;Add breakingchanges.netcore.json for Microsoft .AspNetCore.Mvc.Razor aspnet\Mvc#6555 https:// github.com/aspnet/Mvc/pul l/6555 …;;#6555
0;0;Microsoft partners with BMW to put Skype in cars https://www. theverge.com/2017/7/13/1596 4640/microsoft-bmw-skype-for-business-integration … #Tech #TechNews #M2M;;#Tech #TechNews #M2M
0;1;Windows 10 update is so fucking annoying. For the love of god... Taking more than 30 minutes. Never did i hate microsoft so much!;;
0;0;#Lynda Microsoft Forms First Look. Read Blog: http:// owler.us/ac2CX3;;#Lynda
0;0;Even if they could, what internet company are they going to use? @ATT ? Nope. They love us. @GetSpectrum Doubtful. Even then, see previous.;@ATT @GetSpectrum;
0;0;#Microsoft High-fives all around as young inventor fits girl with a robotic hand http:// fb.me/5h7VFMKqh;;#Microsoft
0;0;Microsoft Lowers Friction Between Skype Experiences on Windows 10 http:// ift.tt/2vbTXNx #devnews;;#devnews
0;0;Microsoft Lowers Friction Between Skype Experiences on Windows 10 http:// ift.tt/2vbTXNx;;
0;0;> The fastest path to a new Team Services extension – Microsoft DevOps Blog http:// dlvr.it/PWJRNn;;
0;0;New on Ebay! Titanfall ( Microsoft Xbox 360, 2014) http:// ift.tt/2vvL7tn pic.twitter.com/DywALWGmsO;;
3;1;. @Microsoft @Azure #Stack hardware available to order, ships in September #RangerTalk http:// buff.ly/2uIORrZ via @VentureBeat;@Microsoft @Azure @VentureBeat;#Stack #RangerTalk
0;0;Announcing AI for Earth: Microsoft ’s new program to put AI to work for the future of our planet https:// blogs.microsoft.com/on-the-issues/ 2017/07/12/announcing-ai-earth-microsofts-new-program-put-ai-work-future-planet/ …;;
0;0;AND SPEAKING OF MICROSOFT EDGE, WHY EDGE?! Did they sit down in a room and were like "Take internet explorer...and make it DARKER!";;
0;1;. @PitneyBowes , @Microsoft and @OpenText make our top 5 most read stories of the week: https://www. channelnomics.com/channelnomics- us/analysis/3013822/channelnomics-top-five-stories-of-the-week-14-july-2017 … pic.twitter.com/zkDzxBNEnt;@PitneyBowes @Microsoft @OpenText;
0;0;;;
0;0;New in the GIS world: "Esri, Microsoft Collaborate on Artificial Intelligence Initiative" http:// ift.tt/2u2H9KY;;
0;0;New in the GIS world: " Microsoft launches AI for Earth to give $2M in services to environmental projects" http:// ift.tt/2tzHJfA;;
0;0;Why is that such a hard concept for Microsoft to learn?;;
0;0;#Microsoft After a decade on Macs, Windows 10 showed me what I was missing. Read more: http:// owler.us/ac2NtK $ MSFT;;#Microsoft
0;0;How Microsoft brought SQL Server to Linux http:// tcrn.ch/2urOLYF @techcrunch さんから;@techcrunch;
